index,title,desc,author,language,stars,forks,today_forks,url,type,datetime
13,ezbookkeeping,"A lightweight, self-hosted personal finance app with a user-friendly interface and powerful bookkeeping features.",mayswind,Go,"1,566",163,461 stars this week,https://github.com//mayswind/ezbookkeeping,GitHub_Go_weekly,2025-09-05 02:38:29
14,trivy,"Find vulnerabilities, misconfigurations, secrets, SBOM in containers, Kubernetes, code repositories, clouds and more",knqyf263,Go,"28,329","2,710",221 stars this week,https://github.com//aquasecurity/trivy,GitHub_Go_weekly,2025-09-05 02:38:29
15,terraform,"Terraform enables you to safely and predictably create, change, and improve infrastructure. It is a source-available tool that codifies APIs into declarative configuration files that can be shared amongst team members, treated as code, edited, reviewed, and versioned.",jbardin,Go,"46,504","10,013",285 stars this week,https://github.com//hashicorp/terraform,GitHub_Go_weekly,2025-09-05 02:38:29
16,kubo,An IPFS implementation in Go,whyrusleeping,Go,"16,688","3,100",36 stars this week,https://github.com//ipfs/kubo,GitHub_Go_weekly,2025-09-05 02:38:29
17,cel-go,"Fast, portable, non-Turing complete expression evaluation with gradual typing (Go)",TristonianJones,Go,"2,684",250,29 stars this week,https://github.com//google/cel-go,GitHub_Go_weekly,2025-09-05 02:38:29
18,evilginx2,"Standalone man-in-the-middle attack framework used for phishing login credentials along with session cookies, allowing for the bypass of 2-factor authentication",kgretzky,Go,"13,722","2,388",64 stars this week,https://github.com//kgretzky/evilginx2,GitHub_Go_weekly,2025-09-05 02:38:29
19,containerd,An open and reliable container runtime,dmcgowan,Go,"19,219","3,651",47 stars this week,https://github.com//containerd/containerd,GitHub_Go_weekly,2025-09-05 02:38:29
20,dpanel,轻量化 docker 可视化管理面板。lightweight panel for docker,donknap,Go,"3,246",216,40 stars this week,https://github.com//donknap/dpanel,GitHub_Go_weekly,2025-09-05 02:38:29
21,velociraptor,Digging Deeper....,scudette,Go,"3,441",552,34 stars this week,https://github.com//Velocidex/velociraptor,GitHub_Go_weekly,2025-09-05 02:38:29
22,gf,"A powerful framework for faster, easier, and more efficient project development.",gqcn,Go,"12,683","1,708",23 stars this week,https://github.com//gogf/gf,GitHub_Go_weekly,2025-09-05 02:38:29
23,nightingale,"Nightingale for monitoring and alerting, just as Grafana for visualization.",710leo,Go,"11,372","1,568",39 stars this week,https://github.com//ccfos/nightingale,GitHub_Go_weekly,2025-09-05 02:38:29
1,fluentui-system-icons,"Fluent System Icons are a collection of familiar, friendly and modern icons from Microsoft.",fluentCI,HTML,"10,042",724,179 stars this week,https://github.com//microsoft/fluentui-system-icons,GitHub_HTML_weekly,2025-09-05 02:38:29
2,OpenClash,A Clash Client For OpenWrt,vernesong,HTML,"21,678","3,546",120 stars this week,https://github.com//vernesong/OpenClash,GitHub_HTML_weekly,2025-09-05 02:38:29
3,awesome-compose,Awesome Docker Compose samples,glours,HTML,"41,150","7,663",143 stars this week,https://github.com//docker/awesome-compose,GitHub_HTML_weekly,2025-09-05 02:38:29
4,CamPhish,Grab cam shots & GPS location from target's phone front camera or PC webcam just sending a link.,techchipnet,HTML,"3,953","1,081",27 stars this week,https://github.com//techchipnet/CamPhish,GitHub_HTML_weekly,2025-09-05 02:38:29
5,ml-interviews-book,https://huyenchip.com/ml-interviews-book/,R-Mahmoudi,HTML,"4,011",627,83 stars this week,https://github.com//chiphuyen/ml-interviews-book,GitHub_HTML_weekly,2025-09-05 02:38:29
6,epg,Utilities for downloading the EPG (Electronic Program Guide) for thousands of TV channels from hundreds of sources.,freearhey,HTML,"2,350",320,20 stars this week,https://github.com//iptv-org/epg,GitHub_HTML_weekly,2025-09-05 02:38:29
7,ecma262,"Status, process, and documents for ECMA-262",jmdyck,HTML,"15,447","1,358",16 stars this week,https://github.com//tc39/ecma262,GitHub_HTML_weekly,2025-09-05 02:38:29
8,zphisher,An automated phishing tool with 30+ templates. This Tool is made for educational purpose only ! Author will not be responsible for any misuse of this toolkit !,htr-tech,HTML,"14,000","5,172",64 stars this week,https://github.com//htr-tech/zphisher,GitHub_HTML_weekly,2025-09-05 02:38:29
9,blazor-samples,,guardrex,HTML,972,790,5 stars this week,https://github.com//dotnet/blazor-samples,GitHub_HTML_weekly,2025-09-05 02:38:29
10,website,Kubernetes website and documentation repo:,k8s-ci-robot,HTML,"4,986","14,997",14 stars this week,https://github.com//kubernetes/website,GitHub_HTML_weekly,2025-09-05 02:38:29
11,n8n-docs,"Documentation for n8n, a fair-code licensed automation tool with a free community edition and powerful enterprise options. Build AI functionality into your workflows.",tanay1337,HTML,990,"2,334",34 stars this week,https://github.com//n8n-io/n8n-docs,GitHub_HTML_weekly,2025-09-05 02:38:29
12,home-assistant.io,📘 Home Assistant User documentation,frenck,HTML,"7,213","7,868",29 stars this week,https://github.com//home-assistant/home-assistant.io,GitHub_HTML_weekly,2025-09-05 02:38:29
13,html-css,Curso de HTML5 e CSS3,gustavoguanabara,HTML,"15,415","3,689",53 stars this week,https://github.com//gustavoguanabara/html-css,GitHub_HTML_weekly,2025-09-05 02:38:29
14,al-folio,"A beautiful, simple, clean, and responsive Jekyll theme for academics",george-gca,HTML,"13,846","12,203",71 stars this week,https://github.com//alshedivat/al-folio,GitHub_HTML_weekly,2025-09-05 02:38:29
15,language-server-protocol,Defines a common protocol for language servers.,dbaeumer,HTML,"12,137",881,36 stars this week,https://github.com//microsoft/language-server-protocol,GitHub_HTML_weekly,2025-09-05 02:38:29
1,system_prompts_leaks,"Collection of extracted System Prompts from popular chatbots like ChatGPT, Claude & Gemini",asgeirtj,JavaScript,"18,800","3,000","5,585 stars this week",https://github.com//asgeirtj/system_prompts_leaks,GitHub_JavaScript_weekly,2025-09-05 02:38:29
2,whatsapp-web.js,A WhatsApp client library for NodeJS that connects through the WhatsApp Web browser app,pedroslopez,JavaScript,"19,121","4,451",746 stars this week,https://github.com//pedroslopez/whatsapp-web.js,GitHub_JavaScript_weekly,2025-09-05 02:38:29
3,filestash,"📁 A file manager / web client for SFTP, S3, FTP, WebDAV, Git, Minio, LDAP, CalDAV, CardDAV, Mysql, Backblaze, ...",mickael-kerjean,JavaScript,"12,529",888,431 stars this week,https://github.com//mickael-kerjean/filestash,GitHub_JavaScript_weekly,2025-09-05 02:38:29
4,screenity,The free and privacy-friendly screen recorder with no limits 🎥,alyssaxuu,JavaScript,"17,058","1,350",340 stars this week,https://github.com//alyssaxuu/screenity,GitHub_JavaScript_weekly,2025-09-05 02:38:29
5,nuclei-templates,Community curated list of templates for the nuclei engine to find security vulnerabilities.,actions-user,JavaScript,"10,856","3,011",157 stars this week,https://github.com//projectdiscovery/nuclei-templates,GitHub_JavaScript_weekly,2025-09-05 02:38:29
6,drawio-desktop,Official electron build of draw.io,davidjgraph,JavaScript,"56,619","5,407",128 stars this week,https://github.com//jgraph/drawio-desktop,GitHub_JavaScript_weekly,2025-09-05 02:38:29
7,live,✯ 可直连访问的电视/广播图标库与相关工具项目 ✯ 🔕 永久免费 直连访问 完整开源 不断完善的台标 支持IPv4/IPv6双栈访问 🔕,github-actions,JavaScript,"26,458","3,971",92 stars this week,https://github.com//fanmingming/live,GitHub_JavaScript_weekly,2025-09-05 02:38:29
8,responsively-app,A modified web browser that helps in responsive web development. A web developer's must have dev-tool.,manojVivek,JavaScript,"24,185","1,284",125 stars this week,https://github.com//responsively-org/responsively-app,GitHub_JavaScript_weekly,2025-09-05 02:38:29
9,lighthouse,"Automated auditing, performance metrics, and best practices for the web.",paulirish,JavaScript,"29,348","9,560",55 stars this week,https://github.com//GoogleChrome/lighthouse,GitHub_JavaScript_weekly,2025-09-05 02:38:29
10,eslint,Find and fix problems in your JavaScript code.,nzakas,JavaScript,"26,235","4,786",29 stars this week,https://github.com//eslint/eslint,GitHub_JavaScript_weekly,2025-09-05 02:38:29
11,pot-desktop,🌈一个跨平台的划词翻译和OCR软件 | A cross-platform software for text translation and recognition.,Pylogmon,JavaScript,"15,144",694,138 stars this week,https://github.com//pot-app/pot-desktop,GitHub_JavaScript_weekly,2025-09-05 02:38:29
12,Baileys,Socket-based TS/JavaScript API for WhatsApp Web,adiwajshing,JavaScript,"6,523","2,215",100 stars this week,https://github.com//WhiskeySockets/Baileys,GitHub_JavaScript_weekly,2025-09-05 02:38:29
13,Interstellar,One of the most popular modern web proxies with blazing fast speeds and a variety of games.,xbubbo,JavaScript,"1,626","19,495",25 stars this week,https://github.com//UseInterstellar/Interstellar,GitHub_JavaScript_weekly,2025-09-05 02:38:29
14,edgetunnel,Running V2ray inside edge/serverless runtime,zizifn,JavaScript,"7,979","38,010",37 stars this week,https://github.com//zizifn/edgetunnel,GitHub_JavaScript_weekly,2025-09-05 02:38:29
