index,title,desc,author,language,stars,forks,today_forks,url,type,datetime
1,bytebot,"Bytebot is a self-hosted AI desktop agent that automates computer tasks through natural language commands, operating within a containerized Linux desktop environment.",atupem,TypeScript,"4,517",455,433 stars today,https://github.com//bytebot-ai/bytebot,GitHub_TypeScript_daily,2025-09-05 02:38:29
2,Termix,"Termix is a web-based server management platform with SSH terminal, tunneling, and file editing capabilities.",LukeGus,TypeScript,"2,825",102,425 stars today,https://github.com//LukeGus/Termix,GitHub_TypeScript_daily,2025-09-05 02:38:29
3,rustdesk,"An open-source remote desktop application designed for self-hosting, as an alternative to TeamViewer.",rustdesk,Rust,"97,494","14,288",133 stars today,https://github.com//rustdesk/rustdesk,GitHub_Rust_daily,2025-09-05 02:38:29
4,crewAI,"Framework for orchestrating role-playing, autonomous AI agents. By fostering collaborative intelligence, CrewAI empowers agents to work together seamlessly, tackling complex tasks.",joaomdmoura,Python,"37,528","4,950",100 stars today,https://github.com//crewAIInc/crewAI,GitHub_Python_daily,2025-09-05 02:38:29
5,trivy,"Find vulnerabilities, misconfigurations, secrets, SBOM in containers, Kubernetes, code repositories, clouds and more",knqyf263,Go,"28,329","2,710",173 stars today,https://github.com//aquasecurity/trivy,GitHub_Go_daily,2025-09-05 02:38:29
6,PowerToys,Windows system utilities to maximize productivity,crutkas,C#,"123,149","7,335",253 stars today,https://github.com//microsoft/PowerToys,GitHub_C#_daily,2025-09-05 02:38:29
7,whatsapp-web.js,A WhatsApp client library for NodeJS that connects through the WhatsApp Web browser app,pedroslopez,JavaScript,"19,121","4,451",622 stars today,https://github.com//pedroslopez/whatsapp-web.js,GitHub_JavaScript_daily,2025-09-05 02:38:29
8,trufflehog,"Find, verify, and analyze leaked credentials",renovate,Go,"20,512","1,974",83 stars today,https://github.com//trufflesecurity/trufflehog,GitHub_Go_daily,2025-09-05 02:38:29
9,ML-From-Scratch,Machine Learning From Scratch. Bare bones NumPy implementations of machine learning models and algorithms with a focus on accessibility. Aims to cover everything from linear regression to deep learning.,eriklindernoren,Python,"27,883","4,856",188 stars today,https://github.com//eriklindernoren/ML-From-Scratch,GitHub_Python_daily,2025-09-05 02:38:29
10,pocketbase,Open Source realtime backend in 1 file,ganigeorgiev,Go,"50,373","2,609",50 stars today,https://github.com//pocketbase/pocketbase,GitHub_Go_daily,2025-09-05 02:38:29
11,elysia,Python package and backend for the Elysia platform app.,dannyjameswilliams,Python,"1,293",164,110 stars today,https://github.com//weaviate/elysia,GitHub_Python_daily,2025-09-05 02:38:29
12,Wazuh-Rules,"Advanced Wazuh Rules for more accurate threat detection. Feel free to implement within your own Wazuh environment, contribute, or fork!",taylorwalton,Python,957,243,10 stars today,https://github.com//socfortress/Wazuh-Rules,GitHub_Python_daily,2025-09-05 02:38:29
13,ansible,"Ansible is a radically simple IT automation platform that makes your applications and systems easier to deploy and maintain. Automate everything from code deployment to network configuration to cloud management, in a language that approaches plain English, using SSH, with no agents to install on remote systems. https://docs.ansible.com.",bcoca,Python,"66,222","24,072",24 stars today,https://github.com//ansible/ansible,GitHub_Python_daily,2025-09-05 02:38:29
14,tensorzero,"TensorZero is an open-source stack for industrial-grade LLM applications. It unifies an LLM gateway, observability, optimization, evaluation, and experimentation.",virajmehta,Rust,"9,992",668,14 stars today,https://github.com//tensorzero/tensorzero,GitHub_Rust_daily,2025-09-05 02:38:29
1,windows,Windows inside a Docker container.,kroese,Shell,"44,272","3,214","6,797 stars this week",https://github.com//dockur/windows,GitHub_Shell_weekly,2025-09-05 02:38:29
2,WhisperLiveKit,"Real-time & local speech-to-text, translation, and speaker diarization. With server & web UI.",QuentinFuxa,Python,"6,238",533,"4,965 stars this week",https://github.com//QuentinFuxa/WhisperLiveKit,GitHub_Python_weekly,2025-09-05 02:38:29
3,bytebot,"Bytebot is a self-hosted AI desktop agent that automates computer tasks through natural language commands, operating within a containerized Linux desktop environment.",atupem,TypeScript,"4,517",455,"1,394 stars this week",https://github.com//bytebot-ai/bytebot,GitHub_TypeScript_weekly,2025-09-05 02:38:29
4,theHarvester,"E-mails, subdomains and names Harvester - OSINT",L1ghtn1ng,Python,"14,193","2,287",861 stars this week,https://github.com//laramies/theHarvester,GitHub_Python_weekly,2025-09-05 02:38:29
5,MiniCPM-V,"MiniCPM-V 4.5: A GPT-4o Level MLLM for Single Image, Multi Image and High-FPS Video Understanding on Your Phone",yiranyyu,Python,"21,216","1,562",934 stars this week,https://github.com//OpenBMB/MiniCPM-V,GitHub_Python_weekly,2025-09-05 02:38:29
6,system_prompts_leaks,"Collection of extracted System Prompts from popular chatbots like ChatGPT, Claude & Gemini",asgeirtj,JavaScript,"18,800","3,000","5,585 stars this week",https://github.com//asgeirtj/system_prompts_leaks,GitHub_JavaScript_weekly,2025-09-05 02:38:29
7,WrenAI,"⚡️ GenBI (Generative BI) queries any database in natural language, generates accurate SQL (Text-to-SQL), charts (Text-to-Chart), and AI-powered insights in seconds.",cyyeh,TypeScript,"11,599","1,158","1,521 stars this week",https://github.com//Canner/WrenAI,GitHub_TypeScript_weekly,2025-09-05 02:38:29
8,hyperswitch,"An open source payments switch written in Rust to make payments fast, reliable and affordable",hyperswitch-bot,Rust,"26,524","4,001","2,051 stars this week",https://github.com//juspay/hyperswitch,GitHub_Rust_weekly,2025-09-05 02:38:29
9,whatsapp-web.js,A WhatsApp client library for NodeJS that connects through the WhatsApp Web browser app,pedroslopez,JavaScript,"19,121","4,451",746 stars this week,https://github.com//pedroslopez/whatsapp-web.js,GitHub_JavaScript_weekly,2025-09-05 02:38:29
10,koog,"Koog is the official Kotlin framework for building and running robust, scalable and production-ready AI agents across all platforms – from backend services to Android and iOS, JVM, and even in-browser environments. Koog is based on our AI products expertise and provides proven solutions for complex LLM and AI problems",sdubov,Kotlin,"2,875",189,"1,142 stars this week",https://github.com//JetBrains/koog,GitHub_Kotlin_weekly,2025-09-05 02:38:29
11,chatterbox,SoTA open-source TTS,fatchord,Python,"11,716","1,455","1,269 stars this week",https://github.com//resemble-ai/chatterbox,GitHub_Python_weekly,2025-09-05 02:38:29
12,grist-core,Grist is the evolution of spreadsheets.,paulfitz,TypeScript,"9,266",446,261 stars this week,https://github.com//gristlabs/grist-core,GitHub_TypeScript_weekly,2025-09-05 02:38:29
13,1brc,1️⃣🐝🏎️ The One Billion Row Challenge -- A fun exploration of how quickly 1B rows from a text file can be aggregated with Java,gunnarmorling,Java,"7,324","2,075",186 stars this week,https://github.com//gunnarmorling/1brc,GitHub_Java_weekly,2025-09-05 02:38:29
14,MobileAgent,Mobile-Agent: The Powerful GUI Agent Family,junyangwang0410,Python,"5,411",529,315 stars this week,https://github.com//X-PLUG/MobileAgent,GitHub_Python_weekly,2025-09-05 02:38:29
1,Archon,Beta release of Archon OS - the knowledge and task management backbone for AI coding assistants.,Wirasm,Python,"11,551","1,996","6,327 stars this month",https://github.com//coleam00/Archon,GitHub_Python_monthly,2025-09-05 02:38:29
2,airi,"💖🧸 Self hosted, you owned Grok Companion, a container of souls of waifu, cyber livings to bring them into our worlds, wishing to achieve Neuro-sama's altitude. Capable of realtime voice chat, Minecraft, Factorio playing. Web / macOS / Windows supported.",nekomeowww,Vue,"12,649","1,043","10,770 stars this month",https://github.com//moeru-ai/airi,GitHub_Vue_monthly,2025-09-05 02:38:29
3,system_prompts_leaks,"Collection of extracted System Prompts from popular chatbots like ChatGPT, Claude & Gemini",asgeirtj,JavaScript,"18,800","3,000","10,484 stars this month",https://github.com//asgeirtj/system_prompts_leaks,GitHub_JavaScript_monthly,2025-09-05 02:38:29
4,drawnix,"开源白板工具（SaaS），一体化白板，包含思维导图、流程图、自由画等。All in one open-source whiteboard tool with mind, flowchart, freehand and etc.",pubuzhixing8,TypeScript,"10,668",797,"7,457 stars this month",https://github.com//plait-board/drawnix,GitHub_TypeScript_monthly,2025-09-05 02:38:29
5,winapps,"Run Windows apps such as Microsoft Office/Adobe in Linux (Ubuntu/Fedora) and GNOME/KDE as if they were a part of the native OS, including Nautilus integration. Hard fork of https://github.com/Fmstrat/winapps/",oskardotglobal,Shell,"8,594",258,"5,234 stars this month",https://github.com//winapps-org/winapps,GitHub_Shell_monthly,2025-09-05 02:38:29
6,sim,Open-source platform to build and deploy AI agent workflows.,waleedlatif1,TypeScript,"14,028","1,685","7,682 stars this month",https://github.com//simstudioai/sim,GitHub_TypeScript_monthly,2025-09-05 02:38:29
7,codex,Lightweight coding agent that runs in your terminal,bolinfest,Rust,"38,539","4,453","6,735 stars this month",https://github.com//openai/codex,GitHub_Rust_monthly,2025-09-05 02:38:29
8,omarchy,Opinionated Arch/Hyprland Setup,dhh,Shell,"6,801",825,"3,942 stars this month",https://github.com//basecamp/omarchy,GitHub_Shell_monthly,2025-09-05 02:38:29
9,windows,Windows inside a Docker container.,kroese,Shell,"44,272","3,214","7,269 stars this month",https://github.com//dockur/windows,GitHub_Shell_monthly,2025-09-05 02:38:29
10,magic,Super Magic. The first open-source all-in-one AI productivity platform (Generalist AI Agent + Workflow Engine + IM + Online collaborative office system),Rock-520,PHP,"3,889",395,"2,584 stars this month",https://github.com//dtyq/magic,GitHub_PHP_monthly,2025-09-05 02:38:29
11,nautilus_trader,A high-performance algorithmic trading platform and event-driven backtester,cjdsellers,Rust,"14,988","1,624","4,955 stars this month",https://github.com//nautechsystems/nautilus_trader,GitHub_Rust_monthly,2025-09-05 02:38:29
12,WrenAI,"⚡️ GenBI (Generative BI) queries any database in natural language, generates accurate SQL (Text-to-SQL), charts (Text-to-Chart), and AI-powered insights in seconds.",cyyeh,TypeScript,"11,599","1,158","2,052 stars this month",https://github.com//Canner/WrenAI,GitHub_TypeScript_monthly,2025-09-05 02:38:29
13,serena,A powerful coding agent toolkit providing semantic retrieval and editing capabilities (MCP server & other integrations),MischaPanch,Python,"11,396",799,"4,297 stars this month",https://github.com//oraios/serena,GitHub_Python_monthly,2025-09-05 02:38:29
14,crush,The glamourous AI coding agent for your favourite terminal 💘,kujtimiihoxha,Go,"11,893",582,"5,392 stars this month",https://github.com//charmbracelet/crush,GitHub_Go_monthly,2025-09-05 02:38:29
1,windows,Windows inside a Docker container.,kroese,Shell,"44,272","3,214","6,797 stars this week",https://github.com//dockur/windows,GitHub_Shell_weekly,2025-09-05 02:38:29
2,WhisperLiveKit,"Real-time & local speech-to-text, translation, and speaker diarization. With server & web UI.",QuentinFuxa,Python,"6,238",533,"4,965 stars this week",https://github.com//QuentinFuxa/WhisperLiveKit,GitHub_Python_weekly,2025-09-05 02:38:29
3,bytebot,"Bytebot is a self-hosted AI desktop agent that automates computer tasks through natural language commands, operating within a containerized Linux desktop environment.",atupem,TypeScript,"4,517",455,"1,394 stars this week",https://github.com//bytebot-ai/bytebot,GitHub_TypeScript_weekly,2025-09-05 02:38:29
4,theHarvester,"E-mails, subdomains and names Harvester - OSINT",L1ghtn1ng,Python,"14,193","2,287",861 stars this week,https://github.com//laramies/theHarvester,GitHub_Python_weekly,2025-09-05 02:38:29
5,MiniCPM-V,"MiniCPM-V 4.5: A GPT-4o Level MLLM for Single Image, Multi Image and High-FPS Video Understanding on Your Phone",yiranyyu,Python,"21,216","1,562",934 stars this week,https://github.com//OpenBMB/MiniCPM-V,GitHub_Python_weekly,2025-09-05 02:38:29
6,system_prompts_leaks,"Collection of extracted System Prompts from popular chatbots like ChatGPT, Claude & Gemini",asgeirtj,JavaScript,"18,800","3,000","5,585 stars this week",https://github.com//asgeirtj/system_prompts_leaks,GitHub_JavaScript_weekly,2025-09-05 02:38:29
7,WrenAI,"⚡️ GenBI (Generative BI) queries any database in natural language, generates accurate SQL (Text-to-SQL), charts (Text-to-Chart), and AI-powered insights in seconds.",cyyeh,TypeScript,"11,599","1,158","1,521 stars this week",https://github.com//Canner/WrenAI,GitHub_TypeScript_weekly,2025-09-05 02:38:29
8,hyperswitch,"An open source payments switch written in Rust to make payments fast, reliable and affordable",hyperswitch-bot,Rust,"26,524","4,001","2,051 stars this week",https://github.com//juspay/hyperswitch,GitHub_Rust_weekly,2025-09-05 02:38:29
9,whatsapp-web.js,A WhatsApp client library for NodeJS that connects through the WhatsApp Web browser app,pedroslopez,JavaScript,"19,121","4,451",746 stars this week,https://github.com//pedroslopez/whatsapp-web.js,GitHub_JavaScript_weekly,2025-09-05 02:38:29
10,koog,"Koog is the official Kotlin framework for building and running robust, scalable and production-ready AI agents across all platforms – from backend services to Android and iOS, JVM, and even in-browser environments. Koog is based on our AI products expertise and provides proven solutions for complex LLM and AI problems",sdubov,Kotlin,"2,875",189,"1,142 stars this week",https://github.com//JetBrains/koog,GitHub_Kotlin_weekly,2025-09-05 02:38:29
11,chatterbox,SoTA open-source TTS,fatchord,Python,"11,716","1,455","1,269 stars this week",https://github.com//resemble-ai/chatterbox,GitHub_Python_weekly,2025-09-05 02:38:29
12,grist-core,Grist is the evolution of spreadsheets.,paulfitz,TypeScript,"9,266",446,261 stars this week,https://github.com//gristlabs/grist-core,GitHub_TypeScript_weekly,2025-09-05 02:38:29
13,1brc,1️⃣🐝🏎️ The One Billion Row Challenge -- A fun exploration of how quickly 1B rows from a text file can be aggregated with Java,gunnarmorling,Java,"7,324","2,075",186 stars this week,https://github.com//gunnarmorling/1brc,GitHub_Java_weekly,2025-09-05 02:38:29
14,MobileAgent,Mobile-Agent: The Powerful GUI Agent Family,junyangwang0410,Python,"5,411",529,315 stars this week,https://github.com//X-PLUG/MobileAgent,GitHub_Python_weekly,2025-09-05 02:38:29
1,1brc,1️⃣🐝🏎️ The One Billion Row Challenge -- A fun exploration of how quickly 1B rows from a text file can be aggregated with Java,gunnarmorling,Java,"7,324","2,075",186 stars this week,https://github.com//gunnarmorling/1brc,GitHub_Java_weekly,2025-09-05 02:38:29
2,Mindustry,The automation tower defense RTS,Anuken,Java,"24,735","3,176",109 stars this week,https://github.com//Anuken/Mindustry,GitHub_Java_weekly,2025-09-05 02:38:29
3,CompreFace,Leading free and open-source face recognition system,Elijas,Java,"6,831",936,209 stars this week,https://github.com//exadel-inc/CompreFace,GitHub_Java_weekly,2025-09-05 02:38:29
4,DependencyCheck,OWASP dependency-check is a software composition analysis utility that detects publicly disclosed vulnerabilities in application dependencies.,jeremylong,Java,"7,164","1,374",20 stars this week,https://github.com//dependency-check/DependencyCheck,GitHub_Java_weekly,2025-09-05 02:38:29
5,revanced-patches,🧩 Patches for ReVanced,oSumAtrIX,Java,"4,145",517,56 stars this week,https://github.com//ReVanced/revanced-patches,GitHub_Java_weekly,2025-09-05 02:38:29
6,Telegram,Telegram for Android source,xaxtix,Java,"27,479","8,907",98 stars this week,https://github.com//DrKLO/Telegram,GitHub_Java_weekly,2025-09-05 02:38:29
7,ghidra,Ghidra is a software reverse engineering (SRE) framework,ryanmkurtz,Java,"59,923","6,676",224 stars this week,https://github.com//NationalSecurityAgency/ghidra,GitHub_Java_weekly,2025-09-05 02:38:29
8,awesome-low-level-design,Learn Low Level Design (LLD) and prepare for interviews using free resources.,ashishps1,Java,"17,681","4,376",185 stars this week,https://github.com//ashishps1/awesome-low-level-design,GitHub_Java_weekly,2025-09-05 02:38:29
9,automq,AutoMQ is a diskless Kafka® on S3. 10x Cost-Effective. No Cross-AZ Traffic Cost. Autoscale in seconds. Single-digit ms latency. Multi-AZ Availability.,ijuma,Java,"6,998",485,82 stars this week,https://github.com//AutoMQ/automq,GitHub_Java_weekly,2025-09-05 02:38:29
10,jdk,JDK main-line development https://openjdk.org/projects/jdk,jonathan-gibbons,Java,"21,640","6,216",56 stars this week,https://github.com//openjdk/jdk,GitHub_Java_weekly,2025-09-05 02:38:29
11,termux-app,Termux - a terminal emulator application for Android OS extendible by variety of packages.,agnostic-apollo,Java,"44,748","5,025",248 stars this week,https://github.com//termux/termux-app,GitHub_Java_weekly,2025-09-05 02:38:29
12,HyperCeiler,HyperOS enhancement module - Make HyperOS Great Again!,lingqiqi5211,Java,"3,871",277,35 stars this week,https://github.com//ReChronoRain/HyperCeiler,GitHub_Java_weekly,2025-09-05 02:38:29
13,glide,An image loading and caching library for Android focused on smooth scrolling,sjudd,Java,"34,943","6,168",15 stars this week,https://github.com//bumptech/glide,GitHub_Java_weekly,2025-09-05 02:38:29
14,kestra,"⚡ Universal Workflow Orchestration Platform — Code in any language, run anywhere. 800+ plugins for data, infrastructure, and AI automation.",tchiotludo,Java,"20,732","1,764",312 stars this week,https://github.com//kestra-io/kestra,GitHub_Java_weekly,2025-09-05 02:38:29
15,mlkit,A collection of sample apps to demonstrate how to use Google's ML Kit APIs on Android and iOS,zhouyiself,Java,"3,938","3,039",15 stars this week,https://github.com//googlesamples/mlkit,GitHub_Java_weekly,2025-09-05 02:38:29
16,GmsCore,Free implementation of Play Services,mar-v-in,Java,"10,815","2,142",77 stars this week,https://github.com//microg/GmsCore,GitHub_Java_weekly,2025-09-05 02:38:29
17,AndroidPdfViewer,Android view for displaying PDFs rendered with PdfiumAndroid,barteksc,Java,"8,351","2,018",8 stars this week,https://github.com//DImuthuUpe/AndroidPdfViewer,GitHub_Java_weekly,2025-09-05 02:38:29
18,netty,Netty project - an event-driven asynchronous network application framework,normanmaurer,Java,"34,406","16,146",31 stars this week,https://github.com//netty/netty,GitHub_Java_weekly,2025-09-05 02:38:29
19,Infinity-For-Reddit,A Reddit client for Android,Docile-Alligator,Java,"4,889",446,31 stars this week,https://github.com//Docile-Alligator/Infinity-For-Reddit,GitHub_Java_weekly,2025-09-05 02:38:29
1,WhisperLiveKit,"Real-time & local speech-to-text, translation, and speaker diarization. With server & web UI.",QuentinFuxa,Python,"6,238",533,"4,965 stars this week",https://github.com//QuentinFuxa/WhisperLiveKit,GitHub_Python_weekly,2025-09-05 02:38:29
2,theHarvester,"E-mails, subdomains and names Harvester - OSINT",L1ghtn1ng,Python,"14,193","2,287",861 stars this week,https://github.com//laramies/theHarvester,GitHub_Python_weekly,2025-09-05 02:38:29
3,MiniCPM-V,"MiniCPM-V 4.5: A GPT-4o Level MLLM for Single Image, Multi Image and High-FPS Video Understanding on Your Phone",yiranyyu,Python,"21,216","1,562",934 stars this week,https://github.com//OpenBMB/MiniCPM-V,GitHub_Python_weekly,2025-09-05 02:38:29
4,chatterbox,SoTA open-source TTS,fatchord,Python,"11,716","1,455","1,269 stars this week",https://github.com//resemble-ai/chatterbox,GitHub_Python_weekly,2025-09-05 02:38:29
5,MobileAgent,Mobile-Agent: The Powerful GUI Agent Family,junyangwang0410,Python,"5,411",529,315 stars this week,https://github.com//X-PLUG/MobileAgent,GitHub_Python_weekly,2025-09-05 02:38:29
6,qlib,"Qlib is an AI-oriented Quant investment platform that aims to use AI tech to empower Quant Research, from exploring ideas to implementing productions. Qlib supports diverse ML modeling paradigms, including supervised learning, market dynamics modeling, and RL, and is now equipped with https://github.com/microsoft/RD-Agent to automate R&D process.",you-n-g,Python,"29,898","4,618",848 stars this week,https://github.com//microsoft/qlib,GitHub_Python_weekly,2025-09-05 02:38:29
7,elysia,Python package and backend for the Elysia platform app.,dannyjameswilliams,Python,"1,293",164,462 stars this week,https://github.com//weaviate/elysia,GitHub_Python_weekly,2025-09-05 02:38:29
8,free-programming-books,📚 Freely available programming books,vhf,Python,"367,284","64,050",805 stars this week,https://github.com//EbookFoundation/free-programming-books,GitHub_Python_weekly,2025-09-05 02:38:29
9,SurfSense,"Open Source Alternative to NotebookLM / Perplexity, connected to external sources such as Search Engines, Slack, Linear, Jira, ClickUp, Confluence, Notion, YouTube, GitHub, Discord and more. Join our discord: https://discord.gg/ejRNvftDp9",MODSetter,Python,"7,551",565,563 stars this week,https://github.com//MODSetter/SurfSense,GitHub_Python_weekly,2025-09-05 02:38:29
10,RD-Agent,"Research and development (R&D) is crucial for the enhancement of industrial productivity, especially in the AI era, where the core aspects of R&D are mainly focused on data and models. We are committed to automating these high-value generic R&D processes through R&D-Agent, which lets AI drive data-driven AI. 🔗https://aka.ms/RD-Agent-Tech-Report",you-n-g,Python,"7,402",769,171 stars this week,https://github.com//microsoft/RD-Agent,GitHub_Python_weekly,2025-09-05 02:38:29
11,mihomo,A simple Python Pydantic model for Honkai: Star Rail parsed data from the Mihomo API.,KT-Yeh,Python,"22,804","3,271",258 stars this week,https://github.com//MetaCubeX/mihomo,GitHub_Python_weekly,2025-09-05 02:38:29
12,DeepCode,"""DeepCode: Open Agentic Coding (Paper2Code & Text2Web & Text2Backend)""",Zongwei9888,Python,"5,521",686,"1,018 stars this week",https://github.com//HKUDS/DeepCode,GitHub_Python_weekly,2025-09-05 02:38:29
13,Python,All Algorithms implemented in Python,cclauss,Python,"206,571","47,715","2,141 stars this week",https://github.com//TheAlgorithms/Python,GitHub_Python_weekly,2025-09-05 02:38:29
14,audiblez,Generate audiobooks from e-books,santinic,Python,"5,450",354,917 stars this week,https://github.com//santinic/audiblez,GitHub_Python_weekly,2025-09-05 02:38:29
15,ML-From-Scratch,Machine Learning From Scratch. Bare bones NumPy implementations of machine learning models and algorithms with a focus on accessibility. Aims to cover everything from linear regression to deep learning.,eriklindernoren,Python,"27,883","4,856",286 stars this week,https://github.com//eriklindernoren/ML-From-Scratch,GitHub_Python_weekly,2025-09-05 02:38:29
16,crewAI,"Framework for orchestrating role-playing, autonomous AI agents. By fostering collaborative intelligence, CrewAI empowers agents to work together seamlessly, tackling complex tasks.",joaomdmoura,Python,"37,528","4,950","1,306 stars this week",https://github.com//crewAIInc/crewAI,GitHub_Python_weekly,2025-09-05 02:38:29
17,graphrag,A modular graph-based Retrieval-Augmented Generation (RAG) system,AlonsoGuevara,Python,"27,829","2,887",284 stars this week,https://github.com//microsoft/graphrag,GitHub_Python_weekly,2025-09-05 02:38:29
1,mangle,,burakemir,Go,"2,179",103,428 stars this week,https://github.com//google/mangle,GitHub_Go_weekly,2025-09-05 02:38:29
2,Pulse,A responsive monitoring application for Proxmox VE that displays real-time metrics across multiple nodes,rcourtman,Go,"1,391",54,308 stars this week,https://github.com//rcourtman/Pulse,GitHub_Go_weekly,2025-09-05 02:38:29
3,nats-server,"High-Performance server for NATS.io, the cloud and edge native messaging system.",derekcollison,Go,"18,111","1,634",228 stars this week,https://github.com//nats-io/nats-server,GitHub_Go_weekly,2025-09-05 02:38:29
4,cobra,A Commander for modern Go CLI interactions,eparis,Go,"41,786","2,992",194 stars this week,https://github.com//spf13/cobra,GitHub_Go_weekly,2025-09-05 02:38:29
5,testify,A toolkit with common assertions and mocks that plays nicely with the standard library,ernesto-jimenez,Go,"25,118","1,672",44 stars this week,https://github.com//stretchr/testify,GitHub_Go_weekly,2025-09-05 02:38:29
6,homebox,A continuation of HomeBox the inventory and organization system built for the Home User,weblate,Go,"3,676",212,82 stars this week,https://github.com//sysadminsmedia/homebox,GitHub_Go_weekly,2025-09-05 02:38:29
7,traefik,The Cloud Native Application Proxy,ldez,Go,"56,470","5,470",221 stars this week,https://github.com//traefik/traefik,GitHub_Go_weekly,2025-09-05 02:38:29
8,aibrix,Cost-efficient and pluggable Infrastructure components for GenAI inference,Jeffwan,Go,"4,188",452,83 stars this week,https://github.com//vllm-project/aibrix,GitHub_Go_weekly,2025-09-05 02:38:29
9,cli,The official command line client for Cloud Foundry,XenoPhex,Go,"1,830",972,18 stars this week,https://github.com//cloudfoundry/cli,GitHub_Go_weekly,2025-09-05 02:38:29
10,hugo,The world’s fastest framework for building websites.,bep,Go,"83,272","8,000",165 stars this week,https://github.com//gohugoio/hugo,GitHub_Go_weekly,2025-09-05 02:38:29
11,livekit,End-to-end realtime stack for connecting humans and AI,boks1971,Go,"14,447","1,356",485 stars this week,https://github.com//livekit/livekit,GitHub_Go_weekly,2025-09-05 02:38:29
12,harbor,"An open source trusted cloud native registry project that stores, signs, and scans content.",ywk253100,Go,"26,365","4,950",88 stars this week,https://github.com//goharbor/harbor,GitHub_Go_weekly,2025-09-05 02:38:29
