index,title,desc,author,language,stars,forks,today_forks,url,type,datetime
16,kubernetes,Production-Grade Container Scheduling and Management,k8s-ci-robot,Go,"120,382","42,415",173 stars this week,https://github.com//kubernetes/kubernetes,GitHub_Go_weekly,2026-02-10 03:39:41
17,crossplane,The Cloud Native Control Plane,negz,Go,"11,392","1,135",42 stars this week,https://github.com//crossplane/crossplane,GitHub_Go_weekly,2026-02-10 03:39:41
18,Xray-core,"Xray, Penetrates Everything. Also the best v2ray-core. Where the magic happens. An open platform for various uses.",RPRX,Go,"34,914","4,939",337 stars this week,https://github.com//XTLS/Xray-core,GitHub_Go_weekly,2026-02-10 03:39:41
19,trufflehog,"Find, verify, and analyze leaked credentials",renovate,Go,"24,497","2,217",168 stars this week,https://github.com//trufflesecurity/trufflehog,GitHub_Go_weekly,2026-02-10 03:39:41
20,tailscale,"The easiest, most secure way to use WireGuard and 2FA.",bradfitz,Go,"28,124","2,275",349 stars this week,https://github.com//tailscale/tailscale,GitHub_Go_weekly,2026-02-10 03:39:41
21,lucky,"软硬路由公网神器,ipv6/ipv4 端口转发,反向代理,DDNS,WOL,ipv4 stun内网穿透,cron,acme,rclone,ftp,webdav,filebrowser",gdy666,Go,"7,328",686,113 stars this week,https://github.com//gdy666/lucky,GitHub_Go_weekly,2026-02-10 03:39:41
22,navidrome,🎧☁️ Your Personal Streaming Service,deluan,Go,"19,160","1,367",202 stars this week,https://github.com//navidrome/navidrome,GitHub_Go_weekly,2026-02-10 03:39:41
23,seaweedfs,"SeaweedFS is a fast distributed storage system for blobs, objects, files, and data lake, for billions of files! Blob store has O(1) disk seek, cloud tiering. Filer supports Cloud Drive, xDC replication, Kubernetes, POSIX FUSE mount, S3 API, S3 Gateway, Hadoop, WebDAV, encryption, Erasure Coding. Enterprise version is at seaweedfs.com.",chrislusf,Go,"30,024","2,696",145 stars this week,https://github.com//seaweedfs/seaweedfs,GitHub_Go_weekly,2026-02-10 03:39:41
1,3x-ui,"Xray panel supporting multi-protocol multi-user expire day & traffic & IP limit (Vmess, Vless, Trojan, ShadowSocks, Wireguard, Tunnel, Mixed, HTTP, Tun)",MHSanaei,HTML,"30,009","5,877",489 stars this week,https://github.com//MHSanaei/3x-ui,GitHub_HTML_weekly,2026-02-10 03:39:41
2,zphisher,An automated phishing tool with 30+ templates. This Tool is made for educational purpose only ! Author will not be responsible for any misuse of this toolkit !,htr-tech,HTML,"15,356","5,783",48 stars this week,https://github.com//htr-tech/zphisher,GitHub_HTML_weekly,2026-02-10 03:39:41
3,lumenpnp,The LumenPnP is an open source pick and place machine.,lucy-chapar,HTML,"3,221",441,37 stars this week,https://github.com//opulo-inc/lumenpnp,GitHub_HTML_weekly,2026-02-10 03:39:41
4,computer-science,🎓 Path to a free self-taught education in Computer Science!,ericdouglas,HTML,"201,155","25,019",305 stars this week,https://github.com//ossu/computer-science,GitHub_HTML_weekly,2026-02-10 03:39:41
5,awesome-compose,Awesome Docker Compose samples,glours,HTML,"43,827","8,013",131 stars this week,https://github.com//docker/awesome-compose,GitHub_HTML_weekly,2026-02-10 03:39:41
6,3d-force-graph,3D force-directed graph component using ThreeJS/WebGL,vasturiano,HTML,"5,783",943,23 stars this week,https://github.com//vasturiano/3d-force-graph,GitHub_HTML_weekly,2026-02-10 03:39:41
7,fonts,"Font files available from Google Fonts, and a public issue tracker for all things Google Fonts",m4rc1e,HTML,"19,684","2,842",33 stars this week,https://github.com//google/fonts,GitHub_HTML_weekly,2026-02-10 03:39:41
8,horilla,Horilla is a free and open source HR and CRM software.,horilla-opensource,HTML,"1,006",721,10 stars this week,https://github.com//horilla-opensource/horilla,GitHub_HTML_weekly,2026-02-10 03:39:41
9,Ask-out-your-Valentine,"A playful and interactive web experience for asking someone to be your Valentine, featuring charming GIFs and dynamic responses to 'Yes' and 'No' answers. Built with HTML, Tailwind CSS, and a sprinkle of JavaScript for interactivity.",CodeKageHQ,HTML,97,396,21 stars this week,https://github.com//CodeKageHQ/Ask-out-your-Valentine,GitHub_HTML_weekly,2026-02-10 03:39:41
10,html-css,Curso de HTML5 e CSS3,gustavoguanabara,HTML,"15,955","3,807",43 stars this week,https://github.com//gustavoguanabara/html-css,GitHub_HTML_weekly,2026-02-10 03:39:41
11,SONiC,Landing page for Software for Open Networking in the Cloud (SONiC) - https://sonic-net.github.io/SONiC/,xinliu-seattle,HTML,"2,685","1,279",7 stars this week,https://github.com//sonic-net/SONiC,GitHub_HTML_weekly,2026-02-10 03:39:41
12,garak,the LLM vulnerability scanner,leondz,HTML,"6,953",779,56 stars this week,https://github.com//NVIDIA/garak,GitHub_HTML_weekly,2026-02-10 03:39:41
1,playwright-cli,"CLI for common Playwright actions. Record and generate Playwright code, inspect selectors and take screenshots.",pavelfeldman,JavaScript,"2,817",114,519 stars this week,https://github.com//microsoft/playwright-cli,GitHub_JavaScript_weekly,2026-02-10 03:39:41
2,edex-ui,"A cross-platform, customizable science fiction terminal emulator with advanced monitoring & touchscreen support.",GitSquared,JavaScript,"44,168","2,984",108 stars this week,https://github.com//GitSquared/edex-ui,GitHub_JavaScript_weekly,2026-02-10 03:39:41
3,stremio-web,Stremio - Freedom to Stream,nklhtv,JavaScript,"8,959",998,43 stars this week,https://github.com//Stremio/stremio-web,GitHub_JavaScript_weekly,2026-02-10 03:39:41
4,Acode,Acode - powerful text/code editor for android,bajrangCoder,JavaScript,"4,493",801,73 stars this week,https://github.com//Acode-Foundation/Acode,GitHub_JavaScript_weekly,2026-02-10 03:39:41
5,escrcpy,📱 Display and control your Android device graphically with scrcpy.,viarotel,JavaScript,"8,033",584,435 stars this week,https://github.com//viarotel-org/escrcpy,GitHub_JavaScript_weekly,2026-02-10 03:39:41
6,Font-Awesome,"The iconic SVG, font, and CSS toolkit",sensibleworld,JavaScript,"76,320","12,251",45 stars this week,https://github.com//FortAwesome/Font-Awesome,GitHub_JavaScript_weekly,2026-02-10 03:39:41
7,easy-dataset,A powerful tool for creating datasets for LLM fine-tuning 、RAG and Eval,ConardLi,JavaScript,"13,306","1,319",222 stars this week,https://github.com//ConardLi/easy-dataset,GitHub_JavaScript_weekly,2026-02-10 03:39:41
8,ESPHomeDesigner,"A visual drag-and-drop editor for ESPHome displays (E-Ink, OLED, LCD, Touch), running as a Home Assistant integration or a standalone web app.",koosoli,JavaScript,639,32,51 stars this week,https://github.com//koosoli/ESPHomeDesigner,GitHub_JavaScript_weekly,2026-02-10 03:39:41
9,transformer-explainer,Transformer Explained Visually: Learn How LLM Transformer Models Work with Interactive Visualization,aereeeee,JavaScript,"6,703",716,160 stars this week,https://github.com//poloclub/transformer-explainer,GitHub_JavaScript_weekly,2026-02-10 03:39:41
10,claudecodeui,"Use Claude Code, Cursor CLI or Codex on mobile and web with CloudCLI (aka Claude Code UI). CloudCLI is a free open source webui/GUI that helps you manage your Claude Code session and projects remotely",viper151,JavaScript,"6,108",809,243 stars this week,https://github.com//siteboon/claudecodeui,GitHub_JavaScript_weekly,2026-02-10 03:39:41
11,bruno,Opensource IDE For Exploring and Testing API's (lightweight alternative to Postman/Insomnia),helloanoop,JavaScript,"40,757","2,103",312 stars this week,https://github.com//usebruno/bruno,GitHub_JavaScript_weekly,2026-02-10 03:39:41
12,github-readme-stats,⚡ Dynamically generated stats for your github readmes,qwerty541,JavaScript,"78,295","30,287",149 stars this week,https://github.com//anuraghazra/github-readme-stats,GitHub_JavaScript_weekly,2026-02-10 03:39:41
13,ez-tree,Procedural tree generator written with JavaScript and Three.js,dgreenheck,JavaScript,"1,163",142,149 stars this week,https://github.com//dgreenheck/ez-tree,GitHub_JavaScript_weekly,2026-02-10 03:39:41
14,mediacms,"MediaCMS is a modern, fully featured open source video and media CMS, written in Python/Django and React, featuring a REST API.",mgogoulos,JavaScript,"4,718",874,59 stars this week,https://github.com//mediacms-io/mediacms,GitHub_JavaScript_weekly,2026-02-10 03:39:41
1,shannon,"Fully autonomous AI hacker to find actual exploits in your web apps. Shannon has achieved a 96.15% success rate on the hint-free, source-aware XBOW Benchmark.",ajmallesh,TypeScript,"17,636","1,843","4,144 stars today",https://github.com//KeygraphHQ/shannon,GitHub_TypeScript_daily,2026-02-10 11:26:31
2,dexter,An autonomous agent for deep financial research,virattt,TypeScript,"13,629","1,630","1,115 stars today",https://github.com//virattt/dexter,GitHub_TypeScript_daily,2026-02-10 11:26:31
3,monty,"A minimal, secure Python interpreter written in Rust for use by AI",samuelcolvin,Rust,"4,023",148,"1,291 stars today",https://github.com//pydantic/monty,GitHub_Rust_daily,2026-02-10 11:26:31
4,TradingAgents-CN,基于多智能体LLM的中文金融交易框架 - TradingAgents中文增强版,hsliuping,Python,"16,332","3,581",149 stars today,https://github.com//hsliuping/TradingAgents-CN,GitHub_Python_daily,2026-02-10 11:26:31
5,AionUi,"Free, local, open-source 24/7 Cowork and OpenClaw for Gemini CLI, Claude Code, Codex, OpenCode, Qwen Code, Goose CLI, Auggie, and more | 🌟 Star if you like it!",kuishou68,TypeScript,"13,903","1,065",673 stars today,https://github.com//iOfficeAI/AionUi,GitHub_TypeScript_daily,2026-02-10 11:26:31
6,public-apis,A collective list of free APIs,matheusfelipeog,Python,"397,290","42,494",410 stars today,https://github.com//public-apis/public-apis,GitHub_Python_daily,2026-02-10 11:26:31
7,gh-aw,GitHub Agentic Workflows,Copilot,Go,967,81,260 stars today,https://github.com//github/gh-aw,GitHub_Go_daily,2026-02-10 11:26:31
8,awesome-llm-apps,"Collection of awesome LLM apps with AI Agents and RAG using OpenAI, Anthropic, Gemini and opensource models.",Shubhamsaboo,Python,"93,212","13,519",227 stars today,https://github.com//Shubhamsaboo/awesome-llm-apps,GitHub_Python_daily,2026-02-10 11:26:31
9,gitbutler,"The GitButler version control client, backed by Git, powered by Tauri/Rust/Svelte",krlvi,Rust,"18,673",807,376 stars today,https://github.com//gitbutlerapp/gitbutler,GitHub_Rust_daily,2026-02-10 11:26:31
10,litebox,A security-focused library OS supporting kernel- and user-mode execution,jaybosamiya-ms,Rust,"1,750",74,354 stars today,https://github.com//microsoft/litebox,GitHub_Rust_daily,2026-02-10 11:26:31
11,skills,Skills Catalog for Codex,gverma-openai,Python,"7,590",432,707 stars today,https://github.com//openai/skills,GitHub_Python_daily,2026-02-10 11:26:31
12,compound-engineering-plugin,Official Claude Code compound engineering plugin,kieranklaassen,TypeScript,"7,899",628,185 stars today,https://github.com//EveryInc/compound-engineering-plugin,GitHub_TypeScript_daily,2026-02-10 11:26:31
13,ebook2audiobook,"Generate audiobooks from e-books, voice cloning & 1158+ languages!",ROBERT-MCDOWELL,Python,"17,902","1,447",147 stars today,https://github.com//DrewThomasson/ebook2audiobook,GitHub_Python_daily,2026-02-10 11:26:31
1,shannon,"Fully autonomous AI hacker to find actual exploits in your web apps. Shannon has achieved a 96.15% success rate on the hint-free, source-aware XBOW Benchmark.",ajmallesh,TypeScript,"17,636","1,843","11,444 stars this week",https://github.com//KeygraphHQ/shannon,GitHub_TypeScript_weekly,2026-02-10 11:26:31
2,skills,Skills Catalog for Codex,gverma-openai,Python,"7,590",432,"5,086 stars this week",https://github.com//openai/skills,GitHub_Python_weekly,2026-02-10 11:26:31
3,claude-mem,"A Claude Code plugin that automatically captures everything Claude does during your coding sessions, compresses it with AI (using Claude's agent-sdk), and injects relevant context back into future sessions.",thedotmack,TypeScript,"26,312","1,753","8,856 stars this week",https://github.com//thedotmack/claude-mem,GitHub_TypeScript_weekly,2026-02-10 11:26:31
4,pi-mono,"AI agent toolkit: coding agent CLI, unified LLM API, TUI & web UI libraries, Slack bot, vLLM pods",badlogic,TypeScript,"9,111",922,"3,013 stars this week",https://github.com//badlogic/pi-mono,GitHub_TypeScript_weekly,2026-02-10 11:26:31
5,openclaw,Your own personal AI assistant. Any OS. Any Platform. The lobster way. 🦞,steipete,TypeScript,"180,050","29,877","30,956 stars this week",https://github.com//openclaw/openclaw,GitHub_TypeScript_weekly,2026-02-10 11:26:31
6,claude-code-hooks-mastery,Master Claude Code Hooks,disler,Python,"2,791",539,623 stars this week,https://github.com//disler/claude-code-hooks-mastery,GitHub_Python_weekly,2026-02-10 11:26:31
7,dexter,An autonomous agent for deep financial research,virattt,TypeScript,"13,629","1,630","3,510 stars this week",https://github.com//virattt/dexter,GitHub_TypeScript_weekly,2026-02-10 11:26:31
8,qmd,"mini cli search engine for your docs, knowledge bases, meeting notes, whatever. Tracking current sota approaches while being all local",tobi,TypeScript,"7,613",388,"1,911 stars this week",https://github.com//tobi/qmd,GitHub_TypeScript_weekly,2026-02-10 11:26:31
9,ChatDev,ChatDev 2.0: Dev All through LLM-powered Multi-Agent Collaboration,thinkwee,Python,"30,686","3,792","1,462 stars this week",https://github.com//OpenBMB/ChatDev,GitHub_Python_weekly,2026-02-10 11:26:31
10,nanochat,The best ChatGPT that $100 can buy.,karpathy,Python,"42,740","5,529","1,287 stars this week",https://github.com//karpathy/nanochat,GitHub_Python_weekly,2026-02-10 11:26:31
11,gh-aw,GitHub Agentic Workflows,Copilot,Go,967,81,322 stars this week,https://github.com//github/gh-aw,GitHub_Go_weekly,2026-02-10 11:26:31
12,99,Neovim AI agent done right,ThePrimeagen,Lua,"3,603",168,679 stars this week,https://github.com//ThePrimeagen/99,GitHub_Lua_weekly,2026-02-10 11:26:31
13,gitbutler,"The GitButler version control client, backed by Git, powered by Tauri/Rust/Svelte",krlvi,Rust,"18,673",807,992 stars this week,https://github.com//gitbutlerapp/gitbutler,GitHub_Rust_weekly,2026-02-10 11:26:31
14,Maestro,Agent Orchestration Command Center,pedramamini,TypeScript,"2,081",193,918 stars this week,https://github.com//pedramamini/Maestro,GitHub_TypeScript_weekly,2026-02-10 11:26:31
15,playwright-cli,"CLI for common Playwright actions. Record and generate Playwright code, inspect selectors and take screenshots.",pavelfeldman,JavaScript,"2,900",118,655 stars this week,https://github.com//microsoft/playwright-cli,GitHub_JavaScript_weekly,2026-02-10 11:26:31
16,WrenAI,"⚡️ GenBI (Generative BI) queries any database in natural language, generates accurate SQL (Text-to-SQL), charts (Text-to-Chart), and AI-powered business intelligence in seconds.",cyyeh,TypeScript,"14,276","1,531",581 stars this week,https://github.com//Canner/WrenAI,GitHub_TypeScript_weekly,2026-02-10 11:26:31
17,memU,"Memory for 24/7 proactive agents like openclaw (moltbot, clawdbot).",sairin1202,Python,"8,651",662,"1,582 stars this week",https://github.com//NevaMind-AI/memU,GitHub_Python_weekly,2026-02-10 11:26:31
1,openclaw,Your own personal AI assistant. Any OS. Any Platform. The lobster way. 🦞,steipete,TypeScript,"180,050","29,877","176,362 stars this month",https://github.com//openclaw/openclaw,GitHub_TypeScript_monthly,2026-02-10 11:26:31
2,superpowers,An agentic skills framework & software development methodology that works.,obra,Shell,"48,620","3,682","33,497 stars this month",https://github.com//obra/superpowers,GitHub_Shell_monthly,2026-02-10 11:26:31
3,opencode,The open source coding agent.,thdxr,TypeScript,"101,227","9,717","44,902 stars this month",https://github.com//anomalyco/opencode,GitHub_TypeScript_monthly,2026-02-10 11:26:31
4,skills,Public repository for Agent Skills,klazuka,Python,"66,711","6,650","30,374 stars this month",https://github.com//anthropics/skills,GitHub_Python_monthly,2026-02-10 11:26:31
5,AionUi,"Free, local, open-source 24/7 Cowork and OpenClaw for Gemini CLI, Claude Code, Codex, OpenCode, Qwen Code, Goose CLI, Auggie, and more | 🌟 Star if you like it!",kuishou68,TypeScript,"13,903","1,065","10,248 stars this month",https://github.com//iOfficeAI/AionUi,GitHub_TypeScript_monthly,2026-02-10 11:26:31
6,PageIndex,"📑 PageIndex: Document Index for Vectorless, Reasoning-based RAG",rejojer,Python,"14,504","1,053","9,458 stars this month",https://github.com//VectifyAI/PageIndex,GitHub_Python_monthly,2026-02-10 11:26:31
7,pi-mono,"AI agent toolkit: coding agent CLI, unified LLM API, TUI & web UI libraries, Slack bot, vLLM pods",badlogic,TypeScript,"9,111",922,"6,990 stars this month",https://github.com//badlogic/pi-mono,GitHub_TypeScript_monthly,2026-02-10 11:26:31
8,remotion,🎥 Make videos programmatically with React,JonnyBurger,TypeScript,"35,860","2,176","10,663 stars this month",https://github.com//remotion-dev/remotion,GitHub_TypeScript_monthly,2026-02-10 11:26:31
9,skills,Skills Catalog for Codex,gverma-openai,Python,"7,590",432,"6,027 stars this month",https://github.com//openai/skills,GitHub_Python_monthly,2026-02-10 11:26:31
10,qmd,"mini cli search engine for your docs, knowledge bases, meeting notes, whatever. Tracking current sota approaches while being all local",tobi,TypeScript,"7,613",388,"6,704 stars this month",https://github.com//tobi/qmd,GitHub_TypeScript_monthly,2026-02-10 11:26:31
11,system_prompts_leaks,"Collection of extracted System Prompts from popular chatbots like ChatGPT, Claude & Gemini",asgeirtj,JavaScript,"30,817","4,930","5,928 stars this month",https://github.com//asgeirtj/system_prompts_leaks,GitHub_JavaScript_monthly,2026-02-10 11:26:31
12,opencode-antigravity-auth,Enable Opencode to authenticate against Antigravity (Google's IDE) via OAuth so you can use Antigravity rate limits and access models like gemini-3-pro and claude-opus-4-5-thinking with your Google credentials.,tctinh,TypeScript,"7,983",540,"6,470 stars this month",https://github.com//NoeFabris/opencode-antigravity-auth,GitHub_TypeScript_monthly,2026-02-10 11:26:31
13,ralph-claude-code,Autonomous AI development loop for Claude Code with intelligent exit detection,frankbria,Shell,"6,571",461,"5,731 stars this month",https://github.com//frankbria/ralph-claude-code,GitHub_Shell_monthly,2026-02-10 11:26:31
14,shannon,"Fully autonomous AI hacker to find actual exploits in your web apps. Shannon has achieved a 96.15% success rate on the hint-free, source-aware XBOW Benchmark.",ajmallesh,TypeScript,"17,636","1,843","12,202 stars this month",https://github.com//KeygraphHQ/shannon,GitHub_TypeScript_monthly,2026-02-10 11:26:31
15,oh-my-opencode,the best agent harness,code-yeongyu,TypeScript,"29,963","2,221","17,541 stars this month",https://github.com//code-yeongyu/oh-my-opencode,GitHub_TypeScript_monthly,2026-02-10 11:26:31
16,claude-mem,"A Claude Code plugin that automatically captures everything Claude does during your coding sessions, compresses it with AI (using Claude's agent-sdk), and injects relevant context back into future sessions.",thedotmack,TypeScript,"26,312","1,753","13,547 stars this month",https://github.com//thedotmack/claude-mem,GitHub_TypeScript_monthly,2026-02-10 11:26:31
17,memU,"Memory for 24/7 proactive agents like openclaw (moltbot, clawdbot).",sairin1202,Python,"8,651",662,"4,547 stars this month",https://github.com//NevaMind-AI/memU,GitHub_Python_monthly,2026-02-10 11:26:31
18,awesome-claude-skills,"A curated list of awesome Claude Skills, resources, and tools for customizing Claude AI workflows",Prat011,Python,"33,237","3,185","16,455 stars this month",https://github.com//ComposioHQ/awesome-claude-skills,GitHub_Python_monthly,2026-02-10 11:26:31
19,99,Neovim AI agent done right,ThePrimeagen,Lua,"3,603",168,"2,602 stars this month",https://github.com//ThePrimeagen/99,GitHub_Lua_monthly,2026-02-10 11:26:31
20,claude-plugins-official,"Official, Anthropic-managed directory of high quality Claude Code Plugins.",noahzweben,Shell,"7,104",677,"4,897 stars this month",https://github.com//anthropics/claude-plugins-official,GitHub_Shell_monthly,2026-02-10 11:26:31
1,shannon,"Fully autonomous AI hacker to find actual exploits in your web apps. Shannon has achieved a 96.15% success rate on the hint-free, source-aware XBOW Benchmark.",ajmallesh,TypeScript,"17,636","1,843","11,444 stars this week",https://github.com//KeygraphHQ/shannon,GitHub_TypeScript_weekly,2026-02-10 11:26:31
2,skills,Skills Catalog for Codex,gverma-openai,Python,"7,590",432,"5,086 stars this week",https://github.com//openai/skills,GitHub_Python_weekly,2026-02-10 11:26:31
3,claude-mem,"A Claude Code plugin that automatically captures everything Claude does during your coding sessions, compresses it with AI (using Claude's agent-sdk), and injects relevant context back into future sessions.",thedotmack,TypeScript,"26,312","1,753","8,856 stars this week",https://github.com//thedotmack/claude-mem,GitHub_TypeScript_weekly,2026-02-10 11:26:31
4,pi-mono,"AI agent toolkit: coding agent CLI, unified LLM API, TUI & web UI libraries, Slack bot, vLLM pods",badlogic,TypeScript,"9,111",922,"3,013 stars this week",https://github.com//badlogic/pi-mono,GitHub_TypeScript_weekly,2026-02-10 11:26:31
5,openclaw,Your own personal AI assistant. Any OS. Any Platform. The lobster way. 🦞,steipete,TypeScript,"180,050","29,877","30,956 stars this week",https://github.com//openclaw/openclaw,GitHub_TypeScript_weekly,2026-02-10 11:26:31
6,claude-code-hooks-mastery,Master Claude Code Hooks,disler,Python,"2,791",539,623 stars this week,https://github.com//disler/claude-code-hooks-mastery,GitHub_Python_weekly,2026-02-10 11:26:31
7,dexter,An autonomous agent for deep financial research,virattt,TypeScript,"13,629","1,630","3,510 stars this week",https://github.com//virattt/dexter,GitHub_TypeScript_weekly,2026-02-10 11:26:31
8,qmd,"mini cli search engine for your docs, knowledge bases, meeting notes, whatever. Tracking current sota approaches while being all local",tobi,TypeScript,"7,613",388,"1,911 stars this week",https://github.com//tobi/qmd,GitHub_TypeScript_weekly,2026-02-10 11:26:31
9,ChatDev,ChatDev 2.0: Dev All through LLM-powered Multi-Agent Collaboration,thinkwee,Python,"30,686","3,792","1,462 stars this week",https://github.com//OpenBMB/ChatDev,GitHub_Python_weekly,2026-02-10 11:26:31
10,nanochat,The best ChatGPT that $100 can buy.,karpathy,Python,"42,740","5,529","1,287 stars this week",https://github.com//karpathy/nanochat,GitHub_Python_weekly,2026-02-10 11:26:31
11,gh-aw,GitHub Agentic Workflows,Copilot,Go,967,81,322 stars this week,https://github.com//github/gh-aw,GitHub_Go_weekly,2026-02-10 11:26:31
12,99,Neovim AI agent done right,ThePrimeagen,Lua,"3,603",168,679 stars this week,https://github.com//ThePrimeagen/99,GitHub_Lua_weekly,2026-02-10 11:26:31
13,gitbutler,"The GitButler version control client, backed by Git, powered by Tauri/Rust/Svelte",krlvi,Rust,"18,673",807,992 stars this week,https://github.com//gitbutlerapp/gitbutler,GitHub_Rust_weekly,2026-02-10 11:26:31
14,Maestro,Agent Orchestration Command Center,pedramamini,TypeScript,"2,081",193,918 stars this week,https://github.com//pedramamini/Maestro,GitHub_TypeScript_weekly,2026-02-10 11:26:31
15,playwright-cli,"CLI for common Playwright actions. Record and generate Playwright code, inspect selectors and take screenshots.",pavelfeldman,JavaScript,"2,900",118,655 stars this week,https://github.com//microsoft/playwright-cli,GitHub_JavaScript_weekly,2026-02-10 11:26:31
16,WrenAI,"⚡️ GenBI (Generative BI) queries any database in natural language, generates accurate SQL (Text-to-SQL), charts (Text-to-Chart), and AI-powered business intelligence in seconds.",cyyeh,TypeScript,"14,276","1,531",581 stars this week,https://github.com//Canner/WrenAI,GitHub_TypeScript_weekly,2026-02-10 11:26:31
17,memU,"Memory for 24/7 proactive agents like openclaw (moltbot, clawdbot).",sairin1202,Python,"8,651",662,"1,582 stars this week",https://github.com//NevaMind-AI/memU,GitHub_Python_weekly,2026-02-10 11:26:31
1,termux-app,Termux - a terminal emulator application for Android OS extendible by variety of packages.,agnostic-apollo,Java,"50,398","5,991",596 stars this week,https://github.com//termux/termux-app,GitHub_Java_weekly,2026-02-10 11:26:31
2,awesome-system-design-resources,Learn System Design concepts and prepare for interviews using free resources.,ashishps1,Java,"29,796","6,794",293 stars this week,https://github.com//ashishps1/awesome-system-design-resources,GitHub_Java_weekly,2026-02-10 11:26:31
3,GhidraMCP,MCP Server for Ghidra,LaurieWired,Java,"7,514",640,298 stars this week,https://github.com//LaurieWired/GhidraMCP,GitHub_Java_weekly,2026-02-10 11:26:31
4,thingsboard,"Open-source IoT Platform - Device management, data collection, processing and visualization.",ikulikov,Java,"21,103","6,126",65 stars this week,https://github.com//thingsboard/thingsboard,GitHub_Java_weekly,2026-02-10 11:26:31
5,fabric-example-mod,Example Fabric mod,modmuss50,Java,"2,114","1,228",18 stars this week,https://github.com//FabricMC/fabric-example-mod,GitHub_Java_weekly,2026-02-10 11:26:31
6,DSA-Bootcamp-Java,"This repository consists of the code samples, assignments, and notes for the Java data structures & algorithms + interview preparation bootcamp of WeMakeDevs.",kunal-kushwaha,Java,"21,886","13,066",92 stars this week,https://github.com//kunal-kushwaha/DSA-Bootcamp-Java,GitHub_Java_weekly,2026-02-10 11:26:31
7,zaproxy,The ZAP by Checkmarx Core project,psiinon,Java,"14,727","2,506",31 stars this week,https://github.com//zaproxy/zaproxy,GitHub_Java_weekly,2026-02-10 11:26:31
8,LSPosed,LSPosed Framework resuscitated,yujincheng08,Java,"9,518",597,119 stars this week,https://github.com//JingMatrix/LSPosed,GitHub_Java_weekly,2026-02-10 11:26:31
9,Paper,"The most widely used, high performance Minecraft server that aims to fix gameplay and mechanics inconsistencies",Machine-Maker,Java,"11,907","3,252",23 stars this week,https://github.com//PaperMC/Paper,GitHub_Java_weekly,2026-02-10 11:26:31
