index,title,desc,author,language,stars,forks,today_forks,url,type,datetime
3,shannon,"Fully autonomous AI hacker to find actual exploits in your web apps. Shannon has achieved a 96.15% success rate on the hint-free, source-aware XBOW Benchmark.",ajmallesh,TypeScript,"19,157","1,960","3,553 stars today",https://github.com//KeygraphHQ/shannon,GitHub_TypeScript_daily,2026-02-10 21:50:28
4,gh-aw,GitHub Agentic Workflows,Copilot,Go,"1,163",96,499 stars today,https://github.com//github/gh-aw,GitHub_Go_daily,2026-02-10 21:50:28
5,compound-engineering-plugin,Official Claude Code compound engineering plugin,kieranklaassen,TypeScript,"8,054",637,406 stars today,https://github.com//EveryInc/compound-engineering-plugin,GitHub_TypeScript_daily,2026-02-10 21:50:28
6,TradingAgents-CN,基于多智能体LLM的中文金融交易框架 - TradingAgents中文增强版,hsliuping,Python,"16,580","3,608",499 stars today,https://github.com//hsliuping/TradingAgents-CN,GitHub_Python_daily,2026-02-10 21:50:28
7,gitbutler,"The GitButler version control client, backed by Git, powered by Tauri/Rust/Svelte",krlvi,Rust,"18,795",810,260 stars today,https://github.com//gitbutlerapp/gitbutler,GitHub_Rust_daily,2026-02-10 21:50:28
8,claude-code-pm-course,Interactive course teaching Product Managers how to use Claude Code effectively,carlvellotti,MDX,677,139,46 stars today,https://github.com//carlvellotti/claude-code-pm-course,GitHub_MDX_daily,2026-02-10 21:50:28
9,awesome-llm-apps,"Collection of awesome LLM apps with AI Agents and RAG using OpenAI, Anthropic, Gemini and opensource models.",Shubhamsaboo,Python,"93,424","13,560",450 stars today,https://github.com//Shubhamsaboo/awesome-llm-apps,GitHub_Python_daily,2026-02-10 21:50:28
10,drawdb,"Free, simple, and intuitive online database diagram editor and SQL generator.",1ilit,JavaScript,"36,077","2,831",113 stars today,https://github.com//drawdb-io/drawdb,GitHub_JavaScript_daily,2026-02-10 21:50:28
11,monty,"A minimal, secure Python interpreter written in Rust for use by AI",samuelcolvin,Rust,"4,345",159,848 stars today,https://github.com//pydantic/monty,GitHub_Rust_daily,2026-02-10 21:50:28
12,free-llm-api-resources,A list of free LLM inference resources accessible via API.,cheahjs,Python,"8,496",842,108 stars today,https://github.com//cheahjs/free-llm-api-resources,GitHub_Python_daily,2026-02-10 21:50:28
13,claude-skills,65 Specialized Skills for Full-Stack Developers. Transform Claude Code into your expert pair programmer.,Jeffallan,Python,526,60,33 stars today,https://github.com//Jeffallan/claude-skills,GitHub_Python_daily,2026-02-10 21:50:28
14,dexter,An autonomous agent for deep financial research,virattt,TypeScript,"13,927","1,664",735 stars today,https://github.com//virattt/dexter,GitHub_TypeScript_daily,2026-02-10 21:50:28
1,shannon,"Fully autonomous AI hacker to find actual exploits in your web apps. Shannon has achieved a 96.15% success rate on the hint-free, source-aware XBOW Benchmark.",ajmallesh,TypeScript,"19,157","1,960","11,444 stars this week",https://github.com//KeygraphHQ/shannon,GitHub_TypeScript_weekly,2026-02-10 21:50:28
2,skills,Skills Catalog for Codex,gverma-openai,Python,"7,765",443,"5,086 stars this week",https://github.com//openai/skills,GitHub_Python_weekly,2026-02-10 21:50:28
3,claude-mem,"A Claude Code plugin that automatically captures everything Claude does during your coding sessions, compresses it with AI (using Claude's agent-sdk), and injects relevant context back into future sessions.",thedotmack,TypeScript,"26,661","1,780","8,856 stars this week",https://github.com//thedotmack/claude-mem,GitHub_TypeScript_weekly,2026-02-10 21:50:28
4,pi-mono,"AI agent toolkit: coding agent CLI, unified LLM API, TUI & web UI libraries, Slack bot, vLLM pods",badlogic,TypeScript,"9,804",968,"3,013 stars this week",https://github.com//badlogic/pi-mono,GitHub_TypeScript_weekly,2026-02-10 21:50:28
5,dexter,An autonomous agent for deep financial research,virattt,TypeScript,"13,927","1,664","3,510 stars this week",https://github.com//virattt/dexter,GitHub_TypeScript_weekly,2026-02-10 21:50:28
6,claude-code-hooks-mastery,Master Claude Code Hooks,disler,Python,"2,831",540,623 stars this week,https://github.com//disler/claude-code-hooks-mastery,GitHub_Python_weekly,2026-02-10 21:50:28
7,gh-aw,GitHub Agentic Workflows,Copilot,Go,"1,163",96,322 stars this week,https://github.com//github/gh-aw,GitHub_Go_weekly,2026-02-10 21:50:28
8,qmd,"mini cli search engine for your docs, knowledge bases, meeting notes, whatever. Tracking current sota approaches while being all local",tobi,TypeScript,"7,712",397,"1,911 stars this week",https://github.com//tobi/qmd,GitHub_TypeScript_weekly,2026-02-10 21:50:28
9,ChatDev,ChatDev 2.0: Dev All through LLM-powered Multi-Agent Collaboration,thinkwee,Python,"30,724","3,795","1,462 stars this week",https://github.com//OpenBMB/ChatDev,GitHub_Python_weekly,2026-02-10 21:50:28
10,UI-TARS-desktop,The Open-Source Multimodal AI Agent Stack: Connecting Cutting-Edge AI Models and Agent Infra,ulivz,TypeScript,"27,635","2,705","2,435 stars this week",https://github.com//bytedance/UI-TARS-desktop,GitHub_TypeScript_weekly,2026-02-10 21:50:28
11,UI-TARS,Pioneering Automated GUI Interaction with Native Agents,pooruss,Python,"9,466",685,305 stars this week,https://github.com//bytedance/UI-TARS,GitHub_Python_weekly,2026-02-10 21:50:28
12,WrenAI,"⚡️ GenBI (Generative BI) queries any database in natural language, generates accurate SQL (Text-to-SQL), charts (Text-to-Chart), and AI-powered business intelligence in seconds.",cyyeh,TypeScript,"14,309","1,531",581 stars this week,https://github.com//Canner/WrenAI,GitHub_TypeScript_weekly,2026-02-10 21:50:28
13,RD-Agent,"Research and development (R&D) is crucial for the enhancement of industrial productivity, especially in the AI era, where the core aspects of R&D are mainly focused on data and models. We are committed to automating these high-value generic R&D processes through R&D-Agent, which lets AI drive data-driven AI. 🔗https://aka.ms/RD-Agent-Tech-Report",you-n-g,Python,"10,952","1,260",393 stars this week,https://github.com//microsoft/RD-Agent,GitHub_Python_weekly,2026-02-10 21:50:28
14,99,Neovim AI agent done right,ThePrimeagen,Lua,"3,620",169,679 stars this week,https://github.com//ThePrimeagen/99,GitHub_Lua_weekly,2026-02-10 21:50:28
15,memU,"Memory for 24/7 proactive agents like openclaw (moltbot, clawdbot).",sairin1202,Python,"8,748",664,"1,582 stars this week",https://github.com//NevaMind-AI/memU,GitHub_Python_weekly,2026-02-10 21:50:28
1,openclaw,Your own personal AI assistant. Any OS. Any Platform. The lobster way. 🦞,steipete,TypeScript,"181,705","30,275","176,362 stars this month",https://github.com//openclaw/openclaw,GitHub_TypeScript_monthly,2026-02-10 21:50:28
2,superpowers,An agentic skills framework & software development methodology that works.,obra,Shell,"49,002","3,706","33,497 stars this month",https://github.com//obra/superpowers,GitHub_Shell_monthly,2026-02-10 21:50:28
3,AionUi,"Free, local, open-source 24/7 Cowork and OpenClaw for Gemini CLI, Claude Code, Codex, OpenCode, Qwen Code, Goose CLI, Auggie, and more | 🌟 Star if you like it!",kuishou68,TypeScript,"14,200","1,085","10,248 stars this month",https://github.com//iOfficeAI/AionUi,GitHub_TypeScript_monthly,2026-02-10 21:50:28
4,PageIndex,"📑 PageIndex: Document Index for Vectorless, Reasoning-based RAG",rejojer,Python,"14,605","1,063","9,458 stars this month",https://github.com//VectifyAI/PageIndex,GitHub_Python_monthly,2026-02-10 21:50:28
5,skills,Public repository for Agent Skills,klazuka,Python,"67,132","6,698","30,374 stars this month",https://github.com//anthropics/skills,GitHub_Python_monthly,2026-02-10 21:50:28
6,pi-mono,"AI agent toolkit: coding agent CLI, unified LLM API, TUI & web UI libraries, Slack bot, vLLM pods",badlogic,TypeScript,"9,804",968,"6,990 stars this month",https://github.com//badlogic/pi-mono,GitHub_TypeScript_monthly,2026-02-10 21:50:28
7,opencode,The open source coding agent.,thdxr,TypeScript,"101,598","9,772","44,902 stars this month",https://github.com//anomalyco/opencode,GitHub_TypeScript_monthly,2026-02-10 21:50:28
8,remotion,🎥 Make videos programmatically with React,JonnyBurger,TypeScript,"35,952","2,180","10,663 stars this month",https://github.com//remotion-dev/remotion,GitHub_TypeScript_monthly,2026-02-10 21:50:28
9,skills,Skills Catalog for Codex,gverma-openai,Python,"7,765",443,"6,027 stars this month",https://github.com//openai/skills,GitHub_Python_monthly,2026-02-10 21:50:28
10,qmd,"mini cli search engine for your docs, knowledge bases, meeting notes, whatever. Tracking current sota approaches while being all local",tobi,TypeScript,"7,712",397,"6,704 stars this month",https://github.com//tobi/qmd,GitHub_TypeScript_monthly,2026-02-10 21:50:28
11,system_prompts_leaks,"Collection of extracted System Prompts from popular chatbots like ChatGPT, Claude & Gemini",asgeirtj,JavaScript,"30,871","4,931","5,928 stars this month",https://github.com//asgeirtj/system_prompts_leaks,GitHub_JavaScript_monthly,2026-02-10 21:50:28
12,shannon,"Fully autonomous AI hacker to find actual exploits in your web apps. Shannon has achieved a 96.15% success rate on the hint-free, source-aware XBOW Benchmark.",ajmallesh,TypeScript,"19,157","1,960","12,202 stars this month",https://github.com//KeygraphHQ/shannon,GitHub_TypeScript_monthly,2026-02-10 21:50:28
13,opencode-antigravity-auth,Enable Opencode to authenticate against Antigravity (Google's IDE) via OAuth so you can use Antigravity rate limits and access models like gemini-3-pro and claude-opus-4-5-thinking with your Google credentials.,tctinh,TypeScript,"8,042",544,"6,470 stars this month",https://github.com//NoeFabris/opencode-antigravity-auth,GitHub_TypeScript_monthly,2026-02-10 21:50:28
14,claude-mem,"A Claude Code plugin that automatically captures everything Claude does during your coding sessions, compresses it with AI (using Claude's agent-sdk), and injects relevant context back into future sessions.",thedotmack,TypeScript,"26,661","1,780","13,547 stars this month",https://github.com//thedotmack/claude-mem,GitHub_TypeScript_monthly,2026-02-10 21:50:28
15,oh-my-opencode,the best agent harness,code-yeongyu,TypeScript,"30,147","2,231","17,541 stars this month",https://github.com//code-yeongyu/oh-my-opencode,GitHub_TypeScript_monthly,2026-02-10 21:50:28
16,memU,"Memory for 24/7 proactive agents like openclaw (moltbot, clawdbot).",sairin1202,Python,"8,748",664,"4,547 stars this month",https://github.com//NevaMind-AI/memU,GitHub_Python_monthly,2026-02-10 21:50:28
17,ralph-claude-code,Autonomous AI development loop for Claude Code with intelligent exit detection,frankbria,Shell,"6,606",461,"5,731 stars this month",https://github.com//frankbria/ralph-claude-code,GitHub_Shell_monthly,2026-02-10 21:50:28
18,99,Neovim AI agent done right,ThePrimeagen,Lua,"3,620",169,"2,602 stars this month",https://github.com//ThePrimeagen/99,GitHub_Lua_monthly,2026-02-10 21:50:28
1,shannon,"Fully autonomous AI hacker to find actual exploits in your web apps. Shannon has achieved a 96.15% success rate on the hint-free, source-aware XBOW Benchmark.",ajmallesh,TypeScript,"19,157","1,960","11,444 stars this week",https://github.com//KeygraphHQ/shannon,GitHub_TypeScript_weekly,2026-02-10 21:50:28
2,skills,Skills Catalog for Codex,gverma-openai,Python,"7,765",443,"5,086 stars this week",https://github.com//openai/skills,GitHub_Python_weekly,2026-02-10 21:50:28
3,claude-mem,"A Claude Code plugin that automatically captures everything Claude does during your coding sessions, compresses it with AI (using Claude's agent-sdk), and injects relevant context back into future sessions.",thedotmack,TypeScript,"26,661","1,780","8,856 stars this week",https://github.com//thedotmack/claude-mem,GitHub_TypeScript_weekly,2026-02-10 21:50:28
4,pi-mono,"AI agent toolkit: coding agent CLI, unified LLM API, TUI & web UI libraries, Slack bot, vLLM pods",badlogic,TypeScript,"9,804",968,"3,013 stars this week",https://github.com//badlogic/pi-mono,GitHub_TypeScript_weekly,2026-02-10 21:50:28
5,dexter,An autonomous agent for deep financial research,virattt,TypeScript,"13,927","1,664","3,510 stars this week",https://github.com//virattt/dexter,GitHub_TypeScript_weekly,2026-02-10 21:50:28
6,claude-code-hooks-mastery,Master Claude Code Hooks,disler,Python,"2,831",540,623 stars this week,https://github.com//disler/claude-code-hooks-mastery,GitHub_Python_weekly,2026-02-10 21:50:28
7,gh-aw,GitHub Agentic Workflows,Copilot,Go,"1,163",96,322 stars this week,https://github.com//github/gh-aw,GitHub_Go_weekly,2026-02-10 21:50:28
8,qmd,"mini cli search engine for your docs, knowledge bases, meeting notes, whatever. Tracking current sota approaches while being all local",tobi,TypeScript,"7,712",397,"1,911 stars this week",https://github.com//tobi/qmd,GitHub_TypeScript_weekly,2026-02-10 21:50:28
9,ChatDev,ChatDev 2.0: Dev All through LLM-powered Multi-Agent Collaboration,thinkwee,Python,"30,724","3,795","1,462 stars this week",https://github.com//OpenBMB/ChatDev,GitHub_Python_weekly,2026-02-10 21:50:28
10,UI-TARS-desktop,The Open-Source Multimodal AI Agent Stack: Connecting Cutting-Edge AI Models and Agent Infra,ulivz,TypeScript,"27,635","2,705","2,435 stars this week",https://github.com//bytedance/UI-TARS-desktop,GitHub_TypeScript_weekly,2026-02-10 21:50:28
11,UI-TARS,Pioneering Automated GUI Interaction with Native Agents,pooruss,Python,"9,466",685,305 stars this week,https://github.com//bytedance/UI-TARS,GitHub_Python_weekly,2026-02-10 21:50:28
12,WrenAI,"⚡️ GenBI (Generative BI) queries any database in natural language, generates accurate SQL (Text-to-SQL), charts (Text-to-Chart), and AI-powered business intelligence in seconds.",cyyeh,TypeScript,"14,309","1,531",581 stars this week,https://github.com//Canner/WrenAI,GitHub_TypeScript_weekly,2026-02-10 21:50:28
13,RD-Agent,"Research and development (R&D) is crucial for the enhancement of industrial productivity, especially in the AI era, where the core aspects of R&D are mainly focused on data and models. We are committed to automating these high-value generic R&D processes through R&D-Agent, which lets AI drive data-driven AI. 🔗https://aka.ms/RD-Agent-Tech-Report",you-n-g,Python,"10,952","1,260",393 stars this week,https://github.com//microsoft/RD-Agent,GitHub_Python_weekly,2026-02-10 21:50:28
14,99,Neovim AI agent done right,ThePrimeagen,Lua,"3,620",169,679 stars this week,https://github.com//ThePrimeagen/99,GitHub_Lua_weekly,2026-02-10 21:50:28
15,memU,"Memory for 24/7 proactive agents like openclaw (moltbot, clawdbot).",sairin1202,Python,"8,748",664,"1,582 stars this week",https://github.com//NevaMind-AI/memU,GitHub_Python_weekly,2026-02-10 21:50:28
1,GhidraMCP,MCP Server for Ghidra,LaurieWired,Java,"7,521",641,298 stars this week,https://github.com//LaurieWired/GhidraMCP,GitHub_Java_weekly,2026-02-10 21:50:28
2,awesome-system-design-resources,Learn System Design concepts and prepare for interviews using free resources.,ashishps1,Java,"29,808","6,796",293 stars this week,https://github.com//ashishps1/awesome-system-design-resources,GitHub_Java_weekly,2026-02-10 21:50:28
3,termux-app,Termux - a terminal emulator application for Android OS extendible by variety of packages.,agnostic-apollo,Java,"50,419","5,998",596 stars this week,https://github.com//termux/termux-app,GitHub_Java_weekly,2026-02-10 21:50:28
4,thingsboard,"Open-source IoT Platform - Device management, data collection, processing and visualization.",ikulikov,Java,"21,108","6,128",65 stars this week,https://github.com//thingsboard/thingsboard,GitHub_Java_weekly,2026-02-10 21:50:28
5,fabric-example-mod,Example Fabric mod,modmuss50,Java,"2,115","1,228",18 stars this week,https://github.com//FabricMC/fabric-example-mod,GitHub_Java_weekly,2026-02-10 21:50:28
6,GmsCore,Free implementation of Play Services,mar-v-in,Java,"12,180","2,547",83 stars this week,https://github.com//microg/GmsCore,GitHub_Java_weekly,2026-02-10 21:50:28
7,ghidra,Ghidra is a software reverse engineering (SRE) framework,ryanmkurtz,Java,"64,236","7,130",232 stars this week,https://github.com//NationalSecurityAgency/ghidra,GitHub_Java_weekly,2026-02-10 21:50:28
8,DSA-Bootcamp-Java,"This repository consists of the code samples, assignments, and notes for the Java data structures & algorithms + interview preparation bootcamp of WeMakeDevs.",kunal-kushwaha,Java,"21,894","13,068",92 stars this week,https://github.com//kunal-kushwaha/DSA-Bootcamp-Java,GitHub_Java_weekly,2026-02-10 21:50:28
9,Paper,"The most widely used, high performance Minecraft server that aims to fix gameplay and mechanics inconsistencies",Machine-Maker,Java,"11,909","3,253",23 stars this week,https://github.com//PaperMC/Paper,GitHub_Java_weekly,2026-02-10 21:50:28
10,intellij-community,IntelliJ IDEA & IntelliJ Platform,akozlova,Java,"19,684","5,686",47 stars this week,https://github.com//JetBrains/intellij-community,GitHub_Java_weekly,2026-02-10 21:50:28
11,termux-api,Termux add-on app which exposes device functionality as API to command line programs.,fornwall,Java,"3,436",712,35 stars this week,https://github.com//termux/termux-api,GitHub_Java_weekly,2026-02-10 21:50:28
12,PojavLauncher,A Minecraft: Java Edition Launcher for Android and iOS based on Boardwalk. Succeeded by https://github.com/AngelAuraMC/Amethyst-Android,khanhduytran0,Java,"8,682","1,836",25 stars this week,https://github.com//PojavLauncherTeam/PojavLauncher,GitHub_Java_weekly,2026-02-10 21:50:28
13,zaproxy,The ZAP by Checkmarx Core project,psiinon,Java,"14,730","2,506",31 stars this week,https://github.com//zaproxy/zaproxy,GitHub_Java_weekly,2026-02-10 21:50:28
14,awesome-low-level-design,Learn Low Level Design (LLD) and prepare for interviews using free resources.,ashishps1,Java,"21,962","5,382",339 stars this week,https://github.com//ashishps1/awesome-low-level-design,GitHub_Java_weekly,2026-02-10 21:50:28
15,LSPosed,LSPosed Framework resuscitated,yujincheng08,Java,"9,526",597,119 stars this week,https://github.com//JingMatrix/LSPosed,GitHub_Java_weekly,2026-02-10 21:50:28
16,openvsx,An open-source registry for VS Code extensions,amvanbaren,Java,"1,823",285,19 stars this week,https://github.com//eclipse/openvsx,GitHub_Java_weekly,2026-02-10 21:50:28
17,ZeroTermux,,hanxinhao000,Java,"2,343",180,30 stars this week,https://github.com//hanxinhao000/ZeroTermux,GitHub_Java_weekly,2026-02-10 21:50:28
18,Digital,A digital logic designer and circuit simulator.,hneemann,Java,"5,470",548,18 stars this week,https://github.com//hneemann/Digital,GitHub_Java_weekly,2026-02-10 21:50:28
19,Mindustry,The automation tower defense RTS,Anuken,Java,"26,516","3,348",111 stars this week,https://github.com//Anuken/Mindustry,GitHub_Java_weekly,2026-02-10 21:50:28
20,Apktool,A tool for reverse engineering Android apk files,iBotPeaches,Java,"23,851","3,890",64 stars this week,https://github.com//iBotPeaches/Apktool,GitHub_Java_weekly,2026-02-10 21:50:28
21,gravitino,"World's most powerful open data catalog for building a high-performance, geo-distributed and federated metadata lake.",yuqi1129,Java,"2,794",722,57 stars this week,https://github.com//apache/gravitino,GitHub_Java_weekly,2026-02-10 21:50:28
22,OpenRefine,"OpenRefine is a free, open source power tool for working with messy data and improving it",wetneb,Java,"11,743","2,126",19 stars this week,https://github.com//OpenRefine/OpenRefine,GitHub_Java_weekly,2026-02-10 21:50:28
1,skills,Skills Catalog for Codex,gverma-openai,Python,"7,765",443,"5,086 stars this week",https://github.com//openai/skills,GitHub_Python_weekly,2026-02-10 21:50:28
2,claude-code-hooks-mastery,Master Claude Code Hooks,disler,Python,"2,831",540,623 stars this week,https://github.com//disler/claude-code-hooks-mastery,GitHub_Python_weekly,2026-02-10 21:50:28
3,ChatDev,ChatDev 2.0: Dev All through LLM-powered Multi-Agent Collaboration,thinkwee,Python,"30,724","3,795","1,462 stars this week",https://github.com//OpenBMB/ChatDev,GitHub_Python_weekly,2026-02-10 21:50:28
4,UI-TARS,Pioneering Automated GUI Interaction with Native Agents,pooruss,Python,"9,466",685,305 stars this week,https://github.com//bytedance/UI-TARS,GitHub_Python_weekly,2026-02-10 21:50:28
5,RD-Agent,"Research and development (R&D) is crucial for the enhancement of industrial productivity, especially in the AI era, where the core aspects of R&D are mainly focused on data and models. We are committed to automating these high-value generic R&D processes through R&D-Agent, which lets AI drive data-driven AI. 🔗https://aka.ms/RD-Agent-Tech-Report",you-n-g,Python,"10,952","1,260",393 stars this week,https://github.com//microsoft/RD-Agent,GitHub_Python_weekly,2026-02-10 21:50:28
6,memU,"Memory for 24/7 proactive agents like openclaw (moltbot, clawdbot).",sairin1202,Python,"8,748",664,"1,582 stars this week",https://github.com//NevaMind-AI/memU,GitHub_Python_weekly,2026-02-10 21:50:28
7,nanochat,The best ChatGPT that $100 can buy.,karpathy,Python,"42,801","5,536","1,287 stars this week",https://github.com//karpathy/nanochat,GitHub_Python_weekly,2026-02-10 21:50:28
8,claude-skills,65 Specialized Skills for Full-Stack Developers. Transform Claude Code into your expert pair programmer.,Jeffallan,Python,526,60,249 stars this week,https://github.com//Jeffallan/claude-skills,GitHub_Python_weekly,2026-02-10 21:50:28
9,langextract,A Python library for extracting structured information from unstructured text using LLMs with precise source grounding and interactive visualization.,aksg87,Python,"26,921","1,844","2,685 stars this week",https://github.com//google/langextract,GitHub_Python_weekly,2026-02-10 21:50:28
10,review-prompts,AI review prompts,masoncl,Python,608,49,437 stars this week,https://github.com//masoncl/review-prompts,GitHub_Python_weekly,2026-02-10 21:50:28
11,cognee,Memory for AI Agents in 6 lines of code,Vasilije1990,Python,"12,154","1,195",591 stars this week,https://github.com//topoteretes/cognee,GitHub_Python_weekly,2026-02-10 21:50:28
12,public-apis,A collective list of free APIs,matheusfelipeog,Python,"397,586","42,529","2,782 stars this week",https://github.com//public-apis/public-apis,GitHub_Python_weekly,2026-02-10 21:50:28
13,heretic,Fully automatic censorship removal for language models,p-e-w,Python,"4,970",478,564 stars this week,https://github.com//p-e-w/heretic,GitHub_Python_weekly,2026-02-10 21:50:28
14,google_workspace_mcp,"Control Gmail, Google Calendar, Docs, Sheets, Slides, Chat, Forms, Tasks, Search & Drive with AI - Comprehensive Google Workspace / G Suite MCP Server & CLI Tool",taylorwilsdon,Python,"1,340",411,61 stars this week,https://github.com//taylorwilsdon/google_workspace_mcp,GitHub_Python_weekly,2026-02-10 21:50:28
1,gh-aw,GitHub Agentic Workflows,Copilot,Go,"1,163",96,322 stars this week,https://github.com//github/gh-aw,GitHub_Go_weekly,2026-02-10 21:50:28
2,trivy,"Find vulnerabilities, misconfigurations, secrets, SBOM in containers, Kubernetes, code repositories, clouds and more",knqyf263,Go,"31,840","2,943",615 stars this week,https://github.com//aquasecurity/trivy,GitHub_Go_weekly,2026-02-10 21:50:28
3,axonhub,"⚡️ Open-source AI Gateway — Use any SDK to call 100+ LLMs. Built-in failover, load balancing, cost control & end-to-end tracing.",looplj,Go,"1,813",204,190 stars this week,https://github.com//looplj/axonhub,GitHub_Go_weekly,2026-02-10 21:50:28
4,seanime,Open-source media server with a web interface and desktop app for anime and manga.,5rahim,Go,"2,797",174,187 stars this week,https://github.com//5rahim/seanime,GitHub_Go_weekly,2026-02-10 21:50:28
5,fiber,⚡️ Express inspired web framework written in Go,Fenny,Go,"39,179","1,953",116 stars this week,https://github.com//gofiber/fiber,GitHub_Go_weekly,2026-02-10 21:50:28
6,ollama,"Get up and running with Kimi-K2.5, GLM-4.7, DeepSeek, gpt-oss, Qwen, Gemma and other models.",mxyng,Go,"162,315","14,542",935 stars this week,https://github.com//ollama/ollama,GitHub_Go_weekly,2026-02-10 21:50:28
7,headscale,"An open source, self-hosted implementation of the Tailscale control server",kradalby,Go,"35,070","1,883",246 stars this week,https://github.com//juanfont/headscale,GitHub_Go_weekly,2026-02-10 21:50:28
8,s-ui,An advanced Web Panel • Built for SagerNet/Sing-Box,alireza0,Go,"7,379","1,176",139 stars this week,https://github.com//alireza0/s-ui,GitHub_Go_weekly,2026-02-10 21:50:28
9,navidrome,🎧☁️ Your Personal Streaming Service,deluan,Go,"19,182","1,367",201 stars this week,https://github.com//navidrome/navidrome,GitHub_Go_weekly,2026-02-10 21:50:28
10,k3s,Lightweight Kubernetes,brandond,Go,"32,144","2,594",108 stars this week,https://github.com//k3s-io/k3s,GitHub_Go_weekly,2026-02-10 21:50:28
11,ipatool,Command-line tool that allows searching and downloading app packages (known as ipa files) from the iOS App Store,majd,Go,"8,531",717,117 stars this week,https://github.com//majd/ipatool,GitHub_Go_weekly,2026-02-10 21:50:28
12,awesome-go,"A curated list of awesome Go frameworks, libraries and software",avelino,Go,"164,712","12,959",644 stars this week,https://github.com//avelino/awesome-go,GitHub_Go_weekly,2026-02-10 21:50:28
13,subfinder,Fast passive subdomain enumeration tool.,dependabot,Go,"13,047","1,507",66 stars this week,https://github.com//projectdiscovery/subfinder,GitHub_Go_weekly,2026-02-10 21:50:28
14,gateway-api,Repository for the next iteration of composite service (e.g. Ingress) and load balancing APIs.,k8s-ci-robot,Go,"2,638",663,23 stars this week,https://github.com//kubernetes-sigs/gateway-api,GitHub_Go_weekly,2026-02-10 21:50:28
15,kubernetes,Production-Grade Container Scheduling and Management,k8s-ci-robot,Go,"120,402","42,426",174 stars this week,https://github.com//kubernetes/kubernetes,GitHub_Go_weekly,2026-02-10 21:50:28
16,sing-box,The universal proxy platform,nekohasekai,Go,"30,451","3,573",234 stars this week,https://github.com//SagerNet/sing-box,GitHub_Go_weekly,2026-02-10 21:50:28
