index,title,desc,author,language,stars,forks,today_forks,url,type,datetime
17,crossplane,The Cloud Native Control Plane,negz,Go,"11,372","1,131",31 stars this week,https://github.com//crossplane/crossplane,GitHub_Go_weekly,2026-02-06 03:05:10
18,headscale,"An open source, self-hosted implementation of the Tailscale control server",kradalby,Go,"34,914","1,870",276 stars this week,https://github.com//juanfont/headscale,GitHub_Go_weekly,2026-02-06 03:05:10
19,llama-swap,"Reliable model swapping for any local OpenAI/Anthropic compatible server - llama.cpp, vllm, etc",mostlygeek,Go,"2,329",170,63 stars this week,https://github.com//mostlygeek/llama-swap,GitHub_Go_weekly,2026-02-06 03:05:10
1,unstructured,"Convert documents to structured data effortlessly. Unstructured is open-source ETL solution for transforming complex documents into clean, structured formats for language models. Visit our website to learn more about our enterprise grade Platform product for production grade workflows, partitioning, enrichments, chunking and embedding.",MthwRobinson,HTML,"13,895","1,153",124 stars this week,https://github.com//Unstructured-IO/unstructured,GitHub_HTML_weekly,2026-02-06 03:05:10
2,3x-ui,"Xray panel supporting multi-protocol multi-user expire day & traffic & IP limit (Vmess, Vless, Trojan, ShadowSocks, Wireguard, Tunnel, Mixed, HTTP, Tun)",MHSanaei,HTML,"29,775","5,843",467 stars this week,https://github.com//MHSanaei/3x-ui,GitHub_HTML_weekly,2026-02-06 03:05:10
3,tidytuesday,Official repo for the #tidytuesday project,jthomasmock,HTML,"7,961","2,546",20 stars this week,https://github.com//rfordatascience/tidytuesday,GitHub_HTML_weekly,2026-02-06 03:05:10
4,awesome-github-profile-readme-templates,This repository contains best profile readme's for your reference.,durgeshsamariya,HTML,"5,144","7,633",20 stars this week,https://github.com//durgeshsamariya/awesome-github-profile-readme-templates,GitHub_HTML_weekly,2026-02-06 03:05:10
5,garak,the LLM vulnerability scanner,leondz,HTML,"6,919",777,59 stars this week,https://github.com//NVIDIA/garak,GitHub_HTML_weekly,2026-02-06 03:05:10
6,Ask-out-your-Valentine,"A playful and interactive web experience for asking someone to be your Valentine, featuring charming GIFs and dynamic responses to 'Yes' and 'No' answers. Built with HTML, Tailwind CSS, and a sprinkle of JavaScript for interactivity.",CodeKageHQ,HTML,93,359,18 stars this week,https://github.com//CodeKageHQ/Ask-out-your-Valentine,GitHub_HTML_weekly,2026-02-06 03:05:10
7,awesome-compose,Awesome Docker Compose samples,glours,HTML,"43,768","8,001",124 stars this week,https://github.com//docker/awesome-compose,GitHub_HTML_weekly,2026-02-06 03:05:10
8,zphisher,An automated phishing tool with 30+ templates. This Tool is made for educational purpose only ! Author will not be responsible for any misuse of this toolkit !,htr-tech,HTML,"15,333","5,766",48 stars this week,https://github.com//htr-tech/zphisher,GitHub_HTML_weekly,2026-02-06 03:05:10
9,InstagramUnfollowers,Check if people follows you back on Instagram.,davidarroyo1234,HTML,"4,272",385,28 stars this week,https://github.com//davidarroyo1234/InstagramUnfollowers,GitHub_HTML_weekly,2026-02-06 03:05:10
10,AssetOpsBench,AssetOpsBench - Industry 4.0,ShuxinLin,HTML,945,139,62 stars this week,https://github.com//IBM/AssetOpsBench,GitHub_HTML_weekly,2026-02-06 03:05:10
11,fonts,"Font files available from Google Fonts, and a public issue tracker for all things Google Fonts",m4rc1e,HTML,"19,671","2,839",27 stars this week,https://github.com//google/fonts,GitHub_HTML_weekly,2026-02-06 03:05:10
12,Awesome-Linux-Software,🐧 A list of awesome Linux softwares,luong-komorebi,HTML,"24,848","2,167",52 stars this week,https://github.com//luong-komorebi/Awesome-Linux-Software,GitHub_HTML_weekly,2026-02-06 03:05:10
1,system_prompts_leaks,"Collection of extracted System Prompts from popular chatbots like ChatGPT, Claude & Gemini",asgeirtj,JavaScript,"30,259","4,861","4,301 stars this week",https://github.com//asgeirtj/system_prompts_leaks,GitHub_JavaScript_weekly,2026-02-06 03:05:10
2,playwright-cli,"CLI for common Playwright actions. Record and generate Playwright code, inspect selectors and take screenshots.",pavelfeldman,JavaScript,"2,250",93,642 stars this week,https://github.com//microsoft/playwright-cli,GitHub_JavaScript_weekly,2026-02-06 03:05:10
3,godot-mcp,"MCP server for interfacing with Godot game engine. Provides tools for launching the editor, running projects, and capturing debug output.",Coding-Solo,JavaScript,"1,671",184,98 stars this week,https://github.com//Coding-Solo/godot-mcp,GitHub_JavaScript_weekly,2026-02-06 03:05:10
4,edex-ui,"A cross-platform, customizable science fiction terminal emulator with advanced monitoring & touchscreen support.",GitSquared,JavaScript,"44,073","2,972",114 stars this week,https://github.com//GitSquared/edex-ui,GitHub_JavaScript_weekly,2026-02-06 03:05:10
5,Calibre-Web-Automated,Calibre-Web but Automated and with tons of New Features! Fully automate and simplify your eBook set up!,crocodilestick,JavaScript,"4,729",315,188 stars this week,https://github.com//crocodilestick/Calibre-Web-Automated,GitHub_JavaScript_weekly,2026-02-06 03:05:10
6,Acode,Acode - powerful text/code editor for android,bajrangCoder,JavaScript,"4,455",790,65 stars this week,https://github.com//Acode-Foundation/Acode,GitHub_JavaScript_weekly,2026-02-06 03:05:10
7,pixels,"Facilitates simple large scale processing of HLS Medical images, documents, zip files. OHIF Viewer, 2 segmentation models and interactive learning.",erinaldidb,JavaScript,323,104,104 stars this week,https://github.com//databricks-industry-solutions/pixels,GitHub_JavaScript_weekly,2026-02-06 03:05:10
8,claudecodeui,"Use Claude Code, Cursor CLI or Codex on mobile and web with CloudCLI (aka Claude Code UI). CloudCLI is a free open source webui/GUI that helps you manage your Claude Code session and projects remotely",viper151,JavaScript,"6,020",788,228 stars this week,https://github.com//siteboon/claudecodeui,GitHub_JavaScript_weekly,2026-02-06 03:05:10
9,whatsapp-web.js,A WhatsApp client library for NodeJS that connects through the WhatsApp Web browser app,pedroslopez,JavaScript,"21,093","4,856",444 stars this week,https://github.com//pedroslopez/whatsapp-web.js,GitHub_JavaScript_weekly,2026-02-06 03:05:10
10,drawio,"draw.io is a JavaScript, client-side editor for general diagramming.",davidjgraph,JavaScript,"3,495",629,86 stars this week,https://github.com//jgraph/drawio,GitHub_JavaScript_weekly,2026-02-06 03:05:10
11,Baileys,Socket-based TS/JavaScript API for WhatsApp Web,adiwajshing,JavaScript,"8,071","2,673",165 stars this week,https://github.com//WhiskeySockets/Baileys,GitHub_JavaScript_weekly,2026-02-06 03:05:10
12,awesome-copilot,"Community-contributed instructions, prompts, and configurations to help you make the most of GitHub Copilot.",aaronpowell,JavaScript,"20,244","2,323",819 stars this week,https://github.com//github/awesome-copilot,GitHub_JavaScript_weekly,2026-02-06 03:05:10
13,appscreen,Create screenshots for the iOS App Store,BlackMac,JavaScript,"1,364",138,382 stars this week,https://github.com//YUZU-Hub/appscreen,GitHub_JavaScript_weekly,2026-02-06 03:05:10
14,marktext,"📝A simple and elegant markdown editor, available for Linux, macOS and Windows.",Jocs,JavaScript,"53,679","3,968",171 stars this week,https://github.com//marktext/marktext,GitHub_JavaScript_weekly,2026-02-06 03:05:10
15,EmulatorJS,A web-based frontend for RetroArch,ethanaobrien,JavaScript,"3,055",827,288 stars this week,https://github.com//EmulatorJS/EmulatorJS,GitHub_JavaScript_weekly,2026-02-06 03:05:10
16,simple-icons,SVG icons for popular brands,PeterShaggyNoble,JavaScript,"24,393","3,039",114 stars this week,https://github.com//simple-icons/simple-icons,GitHub_JavaScript_weekly,2026-02-06 03:05:10
17,v86,"x86 PC emulator and x86-to-wasm JIT, running in the browser",copy,JavaScript,"22,147","1,692",28 stars this week,https://github.com//copy/v86,GitHub_JavaScript_weekly,2026-02-06 03:05:10
18,ez-tree,Procedural tree generator written with JavaScript and Three.js,dgreenheck,JavaScript,"1,135",141,114 stars this week,https://github.com//dgreenheck/ez-tree,GitHub_JavaScript_weekly,2026-02-06 03:05:10
19,Superalgos,"Free, open-source crypto trading bot, automated bitcoin / cryptocurrency trading software, algorithmic trading bots. Visually design your crypto trading bot, leveraging an integrated charting system, data-mining, backtesting, paper trading, and multi-server crypto bot deployments.",Luis-Fernando-Molina,JavaScript,"5,273","6,099",25 stars this week,https://github.com//Superalgos/Superalgos,GitHub_JavaScript_weekly,2026-02-06 03:05:10
20,mediacms,"MediaCMS is a modern, fully featured open source video and media CMS, written in Python/Django and React, featuring a REST API.",mgogoulos,JavaScript,"4,702",871,54 stars this week,https://github.com//mediacms-io/mediacms,GitHub_JavaScript_weekly,2026-02-06 03:05:10
1,UI-TARS-desktop,The Open-Source Multimodal AI Agent Stack: Connecting Cutting-Edge AI Models and Agent Infra,ulivz,TypeScript,"26,772","2,620",566 stars today,https://github.com//bytedance/UI-TARS-desktop,GitHub_TypeScript_daily,2026-02-06 10:53:45
2,skills,Skills Catalog for Codex,gverma-openai,Python,"4,339",245,621 stars today,https://github.com//openai/skills,GitHub_Python_daily,2026-02-06 10:53:45
3,claude-mem,"A Claude Code plugin that automatically captures everything Claude does during your coding sessions, compresses it with AI (using Claude's agent-sdk), and injects relevant context back into future sessions.",thedotmack,TypeScript,"23,767","1,572","1,930 stars today",https://github.com//thedotmack/claude-mem,GitHub_TypeScript_daily,2026-02-06 10:53:45
4,prek,"⚡ Better `pre-commit`, re-engineered in Rust",j178,Rust,"5,540",146,258 stars today,https://github.com//j178/prek,GitHub_Rust_daily,2026-02-06 10:53:45
5,cognee,Memory for AI Agents in 6 lines of code,Vasilije1990,Python,"11,864","1,160",74 stars today,https://github.com//topoteretes/cognee,GitHub_Python_daily,2026-02-06 10:53:45
6,superpowers,An agentic skills framework & software development methodology that works.,obra,Shell,"45,449","3,437",887 stars today,https://github.com//obra/superpowers,GitHub_Shell_daily,2026-02-06 10:53:45
7,trivy,"Find vulnerabilities, misconfigurations, secrets, SBOM in containers, Kubernetes, code repositories, clouds and more",knqyf263,Go,"31,383","2,910",25 stars today,https://github.com//aquasecurity/trivy,GitHub_Go_daily,2026-02-06 10:53:45
8,fish-shell,The user-friendly command line shell.,ridiculousfish,Rust,"32,400","2,214",28 stars today,https://github.com//fish-shell/fish-shell,GitHub_Rust_daily,2026-02-06 10:53:45
9,nvm,Node Version Manager - POSIX-compliant bash script to manage multiple active node.js versions,ljharb,Shell,"91,383","9,828",101 stars today,https://github.com//nvm-sh/nvm,GitHub_Shell_daily,2026-02-06 10:53:45
10,prompt-optimizer,一款提示词优化器，助力于编写高质量的提示词,linshenkx,TypeScript,"19,396","2,400",51 stars today,https://github.com//linshenkx/prompt-optimizer,GitHub_TypeScript_daily,2026-02-06 10:53:45
11,anet,Simple Rust VPN Client / Server,ZeroTworu,Rust,377,31,81 stars today,https://github.com//ZeroTworu/anet,GitHub_Rust_daily,2026-02-06 10:53:45
1,openclaw,Your own personal AI assistant. Any OS. Any Platform. The lobster way. 🦞,steipete,TypeScript,"168,086","26,819","68,757 stars this week",https://github.com//openclaw/openclaw,GitHub_TypeScript_weekly,2026-02-06 10:53:45
2,claude-mem,"A Claude Code plugin that automatically captures everything Claude does during your coding sessions, compresses it with AI (using Claude's agent-sdk), and injects relevant context back into future sessions.",thedotmack,TypeScript,"23,767","1,572","8,130 stars this week",https://github.com//thedotmack/claude-mem,GitHub_TypeScript_weekly,2026-02-06 10:53:45
3,system_prompts_leaks,"Collection of extracted System Prompts from popular chatbots like ChatGPT, Claude & Gemini",asgeirtj,JavaScript,"30,304","4,870","3,094 stars this week",https://github.com//asgeirtj/system_prompts_leaks,GitHub_JavaScript_weekly,2026-02-06 10:53:45
4,pi-mono,"AI agent toolkit: coding agent CLI, unified LLM API, TUI & web UI libraries, Slack bot, vLLM pods",badlogic,TypeScript,"7,243",734,"3,578 stars this week",https://github.com//badlogic/pi-mono,GitHub_TypeScript_weekly,2026-02-06 10:53:45
5,99,Neovim AI agent done right,ThePrimeagen,Lua,"3,370",154,"2,190 stars this week",https://github.com//ThePrimeagen/99,GitHub_Lua_weekly,2026-02-06 10:53:45
6,BitNet,Official inference framework for 1-bit LLMs,potassiummmm,Python,"27,928","2,270","2,054 stars this week",https://github.com//microsoft/BitNet,GitHub_Python_weekly,2026-02-06 10:53:45
7,kimi-cli,Kimi Code CLI is your next CLI agent.,stdrc,Python,"6,054",561,"1,226 stars this week",https://github.com//MoonshotAI/kimi-cli,GitHub_Python_weekly,2026-02-06 10:53:45
8,skills,Skills Catalog for Codex,gverma-openai,Python,"4,339",245,"1,887 stars this week",https://github.com//openai/skills,GitHub_Python_weekly,2026-02-06 10:53:45
9,playwright-cli,"CLI for common Playwright actions. Record and generate Playwright code, inspect selectors and take screenshots.",pavelfeldman,JavaScript,"2,280",93,620 stars this week,https://github.com//microsoft/playwright-cli,GitHub_JavaScript_weekly,2026-02-06 10:53:45
10,Maestro,Agent Orchestration Command Center,pedramamini,TypeScript,"1,830",171,"1,054 stars this week",https://github.com//pedramamini/Maestro,GitHub_TypeScript_weekly,2026-02-06 10:53:45
11,agent-lightning,The absolute trainer to light up AI agents.,actions-user,Python,"14,114","1,187","2,206 stars this week",https://github.com//microsoft/agent-lightning,GitHub_Python_weekly,2026-02-06 10:53:45
12,memU,"Memory for 24/7 proactive agents like openclaw (moltbot, clawdbot).",sairin1202,Python,"7,889",601,"1,952 stars this week",https://github.com//NevaMind-AI/memU,GitHub_Python_weekly,2026-02-06 10:53:45
13,claude-code-hooks-mastery,Master Claude Code Hooks,disler,Python,"2,557",513,397 stars this week,https://github.com//disler/claude-code-hooks-mastery,GitHub_Python_weekly,2026-02-06 10:53:45
14,PageIndex,"📑 PageIndex: Document Index for Vectorless, Reasoning-based RAG",rejojer,Python,"13,630",985,"2,960 stars this week",https://github.com//VectifyAI/PageIndex,GitHub_Python_weekly,2026-02-06 10:53:45
15,ext-apps,"Official repo for spec & SDK of MCP Apps protocol - standard for UIs embedded AI chatbots, served by MCP servers",ochafik,TypeScript,"1,378",152,614 stars this week,https://github.com//modelcontextprotocol/ext-apps,GitHub_TypeScript_weekly,2026-02-06 10:53:45
1,openclaw,Your own personal AI assistant. Any OS. Any Platform. The lobster way. 🦞,steipete,TypeScript,"168,086","26,819","164,864 stars this month",https://github.com//openclaw/openclaw,GitHub_TypeScript_monthly,2026-02-06 10:53:45
2,superpowers,An agentic skills framework & software development methodology that works.,obra,Shell,"45,449","3,437","31,332 stars this month",https://github.com//obra/superpowers,GitHub_Shell_monthly,2026-02-06 10:53:45
3,opencode,The open source coding agent.,thdxr,TypeScript,"98,539","9,336","49,728 stars this month",https://github.com//anomalyco/opencode,GitHub_TypeScript_monthly,2026-02-06 10:53:45
4,ralph-claude-code,Autonomous AI development loop for Claude Code with intelligent exit detection,frankbria,Shell,"6,368",443,"5,951 stars this month",https://github.com//frankbria/ralph-claude-code,GitHub_Shell_monthly,2026-02-06 10:53:45
5,skills,Public repository for Agent Skills,klazuka,Python,"64,075","6,322","30,463 stars this month",https://github.com//anthropics/skills,GitHub_Python_monthly,2026-02-06 10:53:45
6,PageIndex,"📑 PageIndex: Document Index for Vectorless, Reasoning-based RAG",rejojer,Python,"13,630",985,"8,994 stars this month",https://github.com//VectifyAI/PageIndex,GitHub_Python_monthly,2026-02-06 10:53:45
7,oh-my-opencode,The Best Agent Harness. Meet Sisyphus: The Batteries-Included Agent that codes like you.,code-yeongyu,TypeScript,"28,581","2,107","20,198 stars this month",https://github.com//code-yeongyu/oh-my-opencode,GitHub_TypeScript_monthly,2026-02-06 10:53:45
8,pi-mono,"AI agent toolkit: coding agent CLI, unified LLM API, TUI & web UI libraries, Slack bot, vLLM pods",badlogic,TypeScript,"7,243",734,"5,773 stars this month",https://github.com//badlogic/pi-mono,GitHub_TypeScript_monthly,2026-02-06 10:53:45
9,remotion,🎥 Make videos programmatically with React,JonnyBurger,TypeScript,"35,183","2,134","10,016 stars this month",https://github.com//remotion-dev/remotion,GitHub_TypeScript_monthly,2026-02-06 10:53:45
10,claude-plugins-official,"Official, Anthropic-managed directory of high quality Claude Code Plugins.",noahzweben,Shell,"6,649",643,"4,927 stars this month",https://github.com//anthropics/claude-plugins-official,GitHub_Shell_monthly,2026-02-06 10:53:45
11,system_prompts_leaks,"Collection of extracted System Prompts from popular chatbots like ChatGPT, Claude & Gemini",asgeirtj,JavaScript,"30,304","4,870","5,531 stars this month",https://github.com//asgeirtj/system_prompts_leaks,GitHub_JavaScript_monthly,2026-02-06 10:53:45
12,claude-code,"Claude Code is an agentic coding tool that lives in your terminal, understands your codebase, and helps you code faster by executing routine tasks, explaining complex code, and handling git workflows - all through natural language commands.",actions-user,Shell,"64,502","4,908","13,261 stars this month",https://github.com//anthropics/claude-code,GitHub_Shell_monthly,2026-02-06 10:53:45
13,Antigravity-Manager,Professional Antigravity Account Manager & Switcher. One-click seamless account switching for Antigravity Tools. Built with Tauri v2 + React (Rust).专业的 Antigravity 账号管理与切换工具。为 Antigravity 提供一键无缝账号切换功能。,lbjlaq,Rust,"21,466","2,428","13,180 stars this month",https://github.com//lbjlaq/Antigravity-Manager,GitHub_Rust_monthly,2026-02-06 10:53:45
14,UI-TARS-desktop,The Open-Source Multimodal AI Agent Stack: Connecting Cutting-Edge AI Models and Agent Infra,ulivz,TypeScript,"26,772","2,620","6,174 stars this month",https://github.com//bytedance/UI-TARS-desktop,GitHub_TypeScript_monthly,2026-02-06 10:53:45
15,awesome-claude-skills,"A curated list of awesome Claude Skills, resources, and tools for customizing Claude AI workflows",Prat011,Python,"30,863","2,960","15,839 stars this month",https://github.com//ComposioHQ/awesome-claude-skills,GitHub_Python_monthly,2026-02-06 10:53:45
16,claude-mem,"A Claude Code plugin that automatically captures everything Claude does during your coding sessions, compresses it with AI (using Claude's agent-sdk), and injects relevant context back into future sessions.",thedotmack,TypeScript,"23,767","1,572","13,297 stars this month",https://github.com//thedotmack/claude-mem,GitHub_TypeScript_monthly,2026-02-06 10:53:45
17,data-engineering-zoomcamp,Data Engineering Zoomcamp is a free 9-week course on building production-ready data pipelines. The next cohort starts in January 2026. Join the course here 👇🏼,alexeygrigorev,Jupyter Notebook,"38,065","7,669","3,953 stars this month",https://github.com//DataTalksClub/data-engineering-zoomcamp,GitHub_Jupyter Notebook_monthly,2026-02-06 10:53:45
1,openclaw,Your own personal AI assistant. Any OS. Any Platform. The lobster way. 🦞,steipete,TypeScript,"168,086","26,819","68,757 stars this week",https://github.com//openclaw/openclaw,GitHub_TypeScript_weekly,2026-02-06 10:53:45
2,claude-mem,"A Claude Code plugin that automatically captures everything Claude does during your coding sessions, compresses it with AI (using Claude's agent-sdk), and injects relevant context back into future sessions.",thedotmack,TypeScript,"23,767","1,572","8,130 stars this week",https://github.com//thedotmack/claude-mem,GitHub_TypeScript_weekly,2026-02-06 10:53:45
3,system_prompts_leaks,"Collection of extracted System Prompts from popular chatbots like ChatGPT, Claude & Gemini",asgeirtj,JavaScript,"30,304","4,870","3,094 stars this week",https://github.com//asgeirtj/system_prompts_leaks,GitHub_JavaScript_weekly,2026-02-06 10:53:45
4,pi-mono,"AI agent toolkit: coding agent CLI, unified LLM API, TUI & web UI libraries, Slack bot, vLLM pods",badlogic,TypeScript,"7,243",734,"3,578 stars this week",https://github.com//badlogic/pi-mono,GitHub_TypeScript_weekly,2026-02-06 10:53:45
5,99,Neovim AI agent done right,ThePrimeagen,Lua,"3,370",154,"2,190 stars this week",https://github.com//ThePrimeagen/99,GitHub_Lua_weekly,2026-02-06 10:53:45
6,BitNet,Official inference framework for 1-bit LLMs,potassiummmm,Python,"27,928","2,270","2,054 stars this week",https://github.com//microsoft/BitNet,GitHub_Python_weekly,2026-02-06 10:53:45
7,kimi-cli,Kimi Code CLI is your next CLI agent.,stdrc,Python,"6,054",561,"1,226 stars this week",https://github.com//MoonshotAI/kimi-cli,GitHub_Python_weekly,2026-02-06 10:53:45
8,skills,Skills Catalog for Codex,gverma-openai,Python,"4,339",245,"1,887 stars this week",https://github.com//openai/skills,GitHub_Python_weekly,2026-02-06 10:53:45
9,playwright-cli,"CLI for common Playwright actions. Record and generate Playwright code, inspect selectors and take screenshots.",pavelfeldman,JavaScript,"2,280",93,620 stars this week,https://github.com//microsoft/playwright-cli,GitHub_JavaScript_weekly,2026-02-06 10:53:45
10,Maestro,Agent Orchestration Command Center,pedramamini,TypeScript,"1,830",171,"1,054 stars this week",https://github.com//pedramamini/Maestro,GitHub_TypeScript_weekly,2026-02-06 10:53:45
11,agent-lightning,The absolute trainer to light up AI agents.,actions-user,Python,"14,114","1,187","2,206 stars this week",https://github.com//microsoft/agent-lightning,GitHub_Python_weekly,2026-02-06 10:53:45
12,memU,"Memory for 24/7 proactive agents like openclaw (moltbot, clawdbot).",sairin1202,Python,"7,889",601,"1,952 stars this week",https://github.com//NevaMind-AI/memU,GitHub_Python_weekly,2026-02-06 10:53:45
13,claude-code-hooks-mastery,Master Claude Code Hooks,disler,Python,"2,557",513,397 stars this week,https://github.com//disler/claude-code-hooks-mastery,GitHub_Python_weekly,2026-02-06 10:53:45
14,PageIndex,"📑 PageIndex: Document Index for Vectorless, Reasoning-based RAG",rejojer,Python,"13,630",985,"2,960 stars this week",https://github.com//VectifyAI/PageIndex,GitHub_Python_weekly,2026-02-06 10:53:45
15,ext-apps,"Official repo for spec & SDK of MCP Apps protocol - standard for UIs embedded AI chatbots, served by MCP servers",ochafik,TypeScript,"1,378",152,614 stars this week,https://github.com//modelcontextprotocol/ext-apps,GitHub_TypeScript_weekly,2026-02-06 10:53:45
1,termux-app,Termux - a terminal emulator application for Android OS extendible by variety of packages.,agnostic-apollo,Java,"50,199","5,971",867 stars this week,https://github.com//termux/termux-app,GitHub_Java_weekly,2026-02-06 10:53:45
2,NewPipe,A libre lightweight streaming front-end for Android.,Stypox,Java,"37,019","3,442",339 stars this week,https://github.com//TeamNewPipe/NewPipe,GitHub_Java_weekly,2026-02-06 10:53:45
3,Unexpected-Keyboard,A lightweight keyboard for Android,Julow,Java,"2,740",277,58 stars this week,https://github.com//Julow/Unexpected-Keyboard,GitHub_Java_weekly,2026-02-06 10:53:45
4,ghidra,Ghidra is a software reverse engineering (SRE) framework,ryanmkurtz,Java,"64,112","7,118",214 stars this week,https://github.com//NationalSecurityAgency/ghidra,GitHub_Java_weekly,2026-02-06 10:53:45
5,signal-cli,"signal-cli provides an unofficial commandline, JSON-RPC and dbus interface for the Signal messenger.",AsamK,Java,"4,113",364,67 stars this week,https://github.com//AsamK/signal-cli,GitHub_Java_weekly,2026-02-06 10:53:45
6,LSPosed,LSPosed Framework resuscitated,yujincheng08,Java,"9,458",592,108 stars this week,https://github.com//JingMatrix/LSPosed,GitHub_Java_weekly,2026-02-06 10:53:45
7,gson,A Java serialization/deserialization library to convert Java Objects into JSON and back,inder123,Java,"24,335","4,395",9 stars this week,https://github.com//google/gson,GitHub_Java_weekly,2026-02-06 10:53:45
8,Java,All Algorithms implemented in Java,alxkm,Java,"64,950","20,944",105 stars this week,https://github.com//TheAlgorithms/Java,GitHub_Java_weekly,2026-02-06 10:53:45
9,SmartTube,Browse media content with your own rules on Android TV,yuliskov,Java,"27,981","1,505",161 stars this week,https://github.com//yuliskov/SmartTube,GitHub_Java_weekly,2026-02-06 10:53:45
10,trino,"Official repository of Trino, the distributed SQL query engine for big data, formerly known as PrestoSQL (https://trino.io)",findepi,Java,"12,521","3,467",46 stars this week,https://github.com//trinodb/trino,GitHub_Java_weekly,2026-02-06 10:53:45
11,Telegram-X,The main repository of Telegram X — official alternative Telegram client for Android.,vkryl,Java,"5,203",923,52 stars this week,https://github.com//TGX-Android/Telegram-X,GitHub_Java_weekly,2026-02-06 10:53:45
12,flyway,Flyway by Redgate • Database Migrations Made Easy.,axelfontaine,Java,"9,513","1,593",40 stars this week,https://github.com//flyway/flyway,GitHub_Java_weekly,2026-02-06 10:53:45
13,JeecgBoot,【AI低代码平台】AI low-code platform empowers enterprises to quickly develop low-code solutions and build AI applications. 助力企业快速实现低代码开发和构建AI应用！ AI应用平台涵盖：AI应用、AI模型、AI聊天助手、知识库、AI流程编排、MCP和插件，聊天式业务操作等。 强大代码生成器：实现前后端一键生成，无需手写代码! 显著提升效率节省成本，又不失灵活~,zhangdaiscott,Java,"45,181","15,810",77 stars this week,https://github.com//jeecgboot/JeecgBoot,GitHub_Java_weekly,2026-02-06 10:53:45
