index,title,desc,author,language,stars,forks,today_forks,url,type,datetime
13,zaproxy,The ZAP by Checkmarx Core project,psiinon,Java,"14,735","2,507",37 stars this week,https://github.com//zaproxy/zaproxy,GitHub_Java_weekly,2026-02-11 15:19:40
14,awesome-low-level-design,Learn Low Level Design (LLD) and prepare for interviews using free resources.,ashishps1,Java,"21,994","5,391",365 stars this week,https://github.com//ashishps1/awesome-low-level-design,GitHub_Java_weekly,2026-02-11 15:19:40
15,LSPosed,LSPosed Framework resuscitated,yujincheng08,Java,"9,534",596,120 stars this week,https://github.com//JingMatrix/LSPosed,GitHub_Java_weekly,2026-02-11 15:19:40
16,openvsx,An open-source registry for VS Code extensions,amvanbaren,Java,"1,824",284,19 stars this week,https://github.com//eclipse/openvsx,GitHub_Java_weekly,2026-02-11 15:19:40
17,ZeroTermux,,hanxinhao000,Java,"2,346",182,29 stars this week,https://github.com//hanxinhao000/ZeroTermux,GitHub_Java_weekly,2026-02-11 15:19:40
18,Digital,A digital logic designer and circuit simulator.,hneemann,Java,"5,471",549,19 stars this week,https://github.com//hneemann/Digital,GitHub_Java_weekly,2026-02-11 15:19:40
19,Mindustry,The automation tower defense RTS,Anuken,Java,"26,527","3,346",109 stars this week,https://github.com//Anuken/Mindustry,GitHub_Java_weekly,2026-02-11 15:19:40
20,Apktool,A tool for reverse engineering Android apk files,iBotPeaches,Java,"23,859","3,892",63 stars this week,https://github.com//iBotPeaches/Apktool,GitHub_Java_weekly,2026-02-11 15:19:40
21,gravitino,"World's most powerful open data catalog for building a high-performance, geo-distributed and federated metadata lake.",yuqi1129,Java,"2,802",723,59 stars this week,https://github.com//apache/gravitino,GitHub_Java_weekly,2026-02-11 15:19:40
22,OpenRefine,"OpenRefine is a free, open source power tool for working with messy data and improving it",wetneb,Java,"11,743","2,126",19 stars this week,https://github.com//OpenRefine/OpenRefine,GitHub_Java_weekly,2026-02-11 15:19:40
1,skills,Skills Catalog for Codex,gverma-openai,Python,"7,892",448,"5,111 stars this week",https://github.com//openai/skills,GitHub_Python_weekly,2026-02-11 15:19:40
2,claude-code-hooks-mastery,Master Claude Code Hooks,disler,Python,"2,899",541,611 stars this week,https://github.com//disler/claude-code-hooks-mastery,GitHub_Python_weekly,2026-02-11 15:19:40
3,ChatDev,ChatDev 2.0: Dev All through LLM-powered Multi-Agent Collaboration,thinkwee,Python,"30,820","3,801","1,078 stars this week",https://github.com//OpenBMB/ChatDev,GitHub_Python_weekly,2026-02-11 15:19:40
4,UI-TARS,Pioneering Automated GUI Interaction with Native Agents,pooruss,Python,"9,498",689,320 stars this week,https://github.com//bytedance/UI-TARS,GitHub_Python_weekly,2026-02-11 15:19:40
5,RD-Agent,"Research and development (R&D) is crucial for the enhancement of industrial productivity, especially in the AI era, where the core aspects of R&D are mainly focused on data and models. We are committed to automating these high-value generic R&D processes through R&D-Agent, which lets AI drive data-driven AI. 🔗https://aka.ms/RD-Agent-Tech-Report",you-n-g,Python,"11,002","1,266",397 stars this week,https://github.com//microsoft/RD-Agent,GitHub_Python_weekly,2026-02-11 15:19:40
6,memU,"Memory for 24/7 proactive agents like openclaw (moltbot, clawdbot).",sairin1202,Python,"8,884",675,"1,555 stars this week",https://github.com//NevaMind-AI/memU,GitHub_Python_weekly,2026-02-11 15:19:40
7,nanochat,The best ChatGPT that $100 can buy.,karpathy,Python,"42,860","5,547",915 stars this week,https://github.com//karpathy/nanochat,GitHub_Python_weekly,2026-02-11 15:19:40
8,claude-skills,66 Specialized Skills for Full-Stack Developers. Transform Claude Code into your expert pair programmer.,Jeffallan,Python,999,84,350 stars this week,https://github.com//Jeffallan/claude-skills,GitHub_Python_weekly,2026-02-11 15:19:40
9,langextract,A Python library for extracting structured information from unstructured text using LLMs with precise source grounding and interactive visualization.,aksg87,Python,"29,251","1,964","3,377 stars this week",https://github.com//google/langextract,GitHub_Python_weekly,2026-02-11 15:19:40
10,review-prompts,AI review prompts,masoncl,Python,610,49,362 stars this week,https://github.com//masoncl/review-prompts,GitHub_Python_weekly,2026-02-11 15:19:40
11,cognee,Knowledge Engine for AI Agent Memory in 6 lines of code,Vasilije1990,Python,"12,207","1,200",610 stars this week,https://github.com//topoteretes/cognee,GitHub_Python_weekly,2026-02-11 15:19:40
12,public-apis,A collective list of free APIs,matheusfelipeog,Python,"397,750","42,541","2,796 stars this week",https://github.com//public-apis/public-apis,GitHub_Python_weekly,2026-02-11 15:19:40
13,heretic,Fully automatic censorship removal for language models,p-e-w,Python,"4,995",481,583 stars this week,https://github.com//p-e-w/heretic,GitHub_Python_weekly,2026-02-11 15:19:40
14,google_workspace_mcp,"Control Gmail, Google Calendar, Docs, Sheets, Slides, Chat, Forms, Tasks, Search & Drive with AI - Comprehensive Google Workspace / G Suite MCP Server & CLI Tool",taylorwilsdon,Python,"1,347",416,61 stars this week,https://github.com//taylorwilsdon/google_workspace_mcp,GitHub_Python_weekly,2026-02-11 15:19:40
1,gh-aw,GitHub Agentic Workflows,Copilot,Go,"1,446",111,811 stars this week,https://github.com//github/gh-aw,GitHub_Go_weekly,2026-02-11 15:19:40
2,trivy,"Find vulnerabilities, misconfigurations, secrets, SBOM in containers, Kubernetes, code repositories, clouds and more",knqyf263,Go,"31,850","2,943",630 stars this week,https://github.com//aquasecurity/trivy,GitHub_Go_weekly,2026-02-11 15:19:40
3,axonhub,"⚡️ Open-source AI Gateway — Use any SDK to call 100+ LLMs. Built-in failover, load balancing, cost control & end-to-end tracing.",looplj,Go,"1,826",204,157 stars this week,https://github.com//looplj/axonhub,GitHub_Go_weekly,2026-02-11 15:19:40
4,seanime,Open-source media server with a web interface and desktop app for anime and manga.,5rahim,Go,"2,804",175,214 stars this week,https://github.com//5rahim/seanime,GitHub_Go_weekly,2026-02-11 15:19:40
5,fiber,⚡️ Express inspired web framework written in Go,Fenny,Go,"39,182","1,953",100 stars this week,https://github.com//gofiber/fiber,GitHub_Go_weekly,2026-02-11 15:19:40
6,ollama,"Get up and running with Kimi-K2.5, GLM-4.7, DeepSeek, gpt-oss, Qwen, Gemma and other models.",mxyng,Go,"162,367","14,551",896 stars this week,https://github.com//ollama/ollama,GitHub_Go_weekly,2026-02-11 15:19:40
7,headscale,"An open source, self-hosted implementation of the Tailscale control server",kradalby,Go,"35,104","1,884",235 stars this week,https://github.com//juanfont/headscale,GitHub_Go_weekly,2026-02-11 15:19:40
8,s-ui,An advanced Web Panel • Built for SagerNet/Sing-Box,alireza0,Go,"7,392","1,179",144 stars this week,https://github.com//alireza0/s-ui,GitHub_Go_weekly,2026-02-11 15:19:40
9,navidrome,🎧☁️ Your Personal Streaming Service,deluan,Go,"19,199","1,366",186 stars this week,https://github.com//navidrome/navidrome,GitHub_Go_weekly,2026-02-11 15:19:40
10,k3s,Lightweight Kubernetes,brandond,Go,"32,153","2,594",105 stars this week,https://github.com//k3s-io/k3s,GitHub_Go_weekly,2026-02-11 15:19:40
11,ipatool,Command-line tool that allows searching and downloading app packages (known as ipa files) from the iOS App Store,majd,Go,"8,545",717,137 stars this week,https://github.com//majd/ipatool,GitHub_Go_weekly,2026-02-11 15:19:40
12,awesome-go,"A curated list of awesome Go frameworks, libraries and software",avelino,Go,"164,773","12,961",623 stars this week,https://github.com//avelino/awesome-go,GitHub_Go_weekly,2026-02-11 15:19:40
13,subfinder,Fast passive subdomain enumeration tool.,dependabot,Go,"13,055","1,506",66 stars this week,https://github.com//projectdiscovery/subfinder,GitHub_Go_weekly,2026-02-11 15:19:40
14,gateway-api,Repository for the next iteration of composite service (e.g. Ingress) and load balancing APIs.,k8s-ci-robot,Go,"2,639",663,24 stars this week,https://github.com//kubernetes-sigs/gateway-api,GitHub_Go_weekly,2026-02-11 15:19:40
15,kubernetes,Production-Grade Container Scheduling and Management,k8s-ci-robot,Go,"120,417","42,436",180 stars this week,https://github.com//kubernetes/kubernetes,GitHub_Go_weekly,2026-02-11 15:19:40
16,sing-box,The universal proxy platform,nekohasekai,Go,"30,475","3,574",238 stars this week,https://github.com//SagerNet/sing-box,GitHub_Go_weekly,2026-02-11 15:19:40
17,gin,"Gin is a high-performance HTTP web framework written in Go. It provides a Martini-like API but with significantly better performance—up to 40 times faster—thanks to httprouter. Gin is designed for building REST APIs, web applications, and microservices.",manucorporat,Go,"87,958","8,556",93 stars this week,https://github.com//gin-gonic/gin,GitHub_Go_weekly,2026-02-11 15:19:40
18,jira-cli,🔥 Feature-rich interactive Jira command line.,ankitpokhrel,Go,"5,105",323,50 stars this week,https://github.com//ankitpokhrel/jira-cli,GitHub_Go_weekly,2026-02-11 15:19:40
19,alertmanager,Prometheus Alertmanager,fabxc,Go,"8,350","2,402",17 stars this week,https://github.com//prometheus/alertmanager,GitHub_Go_weekly,2026-02-11 15:19:40
20,kustomize,Customization of kubernetes YAML configurations,monopole,Go,"11,936","2,363",20 stars this week,https://github.com//kubernetes-sigs/kustomize,GitHub_Go_weekly,2026-02-11 15:19:40
1,3x-ui,"Xray panel supporting multi-protocol multi-user expire day & traffic & IP limit (Vmess, Vless, Trojan, ShadowSocks, Wireguard, Tunnel, Mixed, HTTP, Tun)",MHSanaei,HTML,"30,130","5,891",488 stars this week,https://github.com//MHSanaei/3x-ui,GitHub_HTML_weekly,2026-02-11 15:19:40
2,zphisher,An automated phishing tool with 30+ templates. This Tool is made for educational purpose only ! Author will not be responsible for any misuse of this toolkit !,htr-tech,HTML,"15,367","5,785",51 stars this week,https://github.com//htr-tech/zphisher,GitHub_HTML_weekly,2026-02-11 15:19:40
3,lancedb,Developer-friendly OSS embedded retrieval library for multimodal AI. Search More; Manage Less.,wjones127,HTML,"8,887",744,147 stars this week,https://github.com//lancedb/lancedb,GitHub_HTML_weekly,2026-02-11 15:19:40
4,3d-force-graph,3D force-directed graph component using ThreeJS/WebGL,vasturiano,HTML,"5,785",943,22 stars this week,https://github.com//vasturiano/3d-force-graph,GitHub_HTML_weekly,2026-02-11 15:19:40
5,awesome-compose,Awesome Docker Compose samples,glours,HTML,"43,865","8,016",133 stars this week,https://github.com//docker/awesome-compose,GitHub_HTML_weekly,2026-02-11 15:19:40
6,Ask-out-your-Valentine,"A playful and interactive web experience for asking someone to be your Valentine, featuring charming GIFs and dynamic responses to 'Yes' and 'No' answers. Built with HTML, Tailwind CSS, and a sprinkle of JavaScript for interactivity.",CodeKageHQ,HTML,101,414,16 stars this week,https://github.com//CodeKageHQ/Ask-out-your-Valentine,GitHub_HTML_weekly,2026-02-11 15:19:40
7,fonts,"Font files available from Google Fonts, and a public issue tracker for all things Google Fonts",m4rc1e,HTML,"19,689","2,842",34 stars this week,https://github.com//google/fonts,GitHub_HTML_weekly,2026-02-11 15:19:40
8,tabler,Tabler is free and open-source HTML Dashboard UI Kit built on Bootstrap,codecalm,HTML,"40,707","4,335",39 stars this week,https://github.com//tabler/tabler,GitHub_HTML_weekly,2026-02-11 15:19:40
9,computer-science,🎓 Path to a free self-taught education in Computer Science!,ericdouglas,HTML,"201,195","25,023",288 stars this week,https://github.com//ossu/computer-science,GitHub_HTML_weekly,2026-02-11 15:19:40
10,aipyapp,AI-Powered Python & Python-Powered AI (Python-Use),lgxz,HTML,"3,407",339,113 stars this week,https://github.com//knownsec/aipyapp,GitHub_HTML_weekly,2026-02-11 15:19:40
11,horilla,Horilla is a free and open source HR and CRM software.,horilla-opensource,HTML,"1,009",719,8 stars this week,https://github.com//horilla-opensource/horilla,GitHub_HTML_weekly,2026-02-11 15:19:40
1,Epstein-doc-explorer,a graph explorer of the Epstein emails,claude,JavaScript,489,91,135 stars this week,https://github.com//maxandrews/Epstein-doc-explorer,GitHub_JavaScript_weekly,2026-02-11 15:19:40
2,playwright-cli,"CLI for common Playwright actions. Record and generate Playwright code, inspect selectors and take screenshots.",pavelfeldman,JavaScript,"3,060",120,837 stars this week,https://github.com//microsoft/playwright-cli,GitHub_JavaScript_weekly,2026-02-11 15:19:40
3,escrcpy,📱 Display and control your Android device graphically with scrcpy.,viarotel,JavaScript,"8,074",587,480 stars this week,https://github.com//viarotel-org/escrcpy,GitHub_JavaScript_weekly,2026-02-11 15:19:40
4,edex-ui,"A cross-platform, customizable science fiction terminal emulator with advanced monitoring & touchscreen support.",GitSquared,JavaScript,"44,193","2,989",155 stars this week,https://github.com//GitSquared/edex-ui,GitHub_JavaScript_weekly,2026-02-11 15:19:40
5,stremio-web,Stremio - Freedom to Stream,nklhtv,JavaScript,"8,965",999,49 stars this week,https://github.com//Stremio/stremio-web,GitHub_JavaScript_weekly,2026-02-11 15:19:40
6,Font-Awesome,"The iconic SVG, font, and CSS toolkit",sensibleworld,JavaScript,"76,325","12,248",45 stars this week,https://github.com//FortAwesome/Font-Awesome,GitHub_JavaScript_weekly,2026-02-11 15:19:40
7,godot-mcp,"MCP server for interfacing with Godot game engine. Provides tools for launching the editor, running projects, and capturing debug output.",Coding-Solo,JavaScript,"1,750",196,98 stars this week,https://github.com//Coding-Solo/godot-mcp,GitHub_JavaScript_weekly,2026-02-11 15:19:40
8,tvbox,OK影视、tvbox配置文件，如果喜欢，请Fork自用。使用前请仔细阅读仓库说明，一旦使用将被视为你已了解。,gaotianliuyun,JavaScript,"7,949","2,961",159 stars this week,https://github.com//qist/tvbox,GitHub_JavaScript_weekly,2026-02-11 15:19:40
9,claudecodeui,"Use Claude Code, Cursor CLI or Codex on mobile and web with CloudCLI (aka Claude Code UI). CloudCLI is a free open source webui/GUI that helps you manage your Claude Code session and projects remotely",viper151,JavaScript,"6,155",814,272 stars this week,https://github.com//siteboon/claudecodeui,GitHub_JavaScript_weekly,2026-02-11 15:19:40
10,transformer-explainer,Transformer Explained Visually: Learn How LLM Transformer Models Work with Interactive Visualization,aereeeee,JavaScript,"6,735",720,221 stars this week,https://github.com//poloclub/transformer-explainer,GitHub_JavaScript_weekly,2026-02-11 15:19:40
11,drawdb,"Free, simple, and intuitive online database diagram editor and SQL generator.",1ilit,JavaScript,"36,457","2,845",401 stars this week,https://github.com//drawdb-io/drawdb,GitHub_JavaScript_weekly,2026-02-11 15:19:40
12,ESPHomeDesigner,"A visual drag-and-drop editor for ESPHome displays (E-Ink, OLED, LCD, Touch), running as a Home Assistant integration or a standalone web app.",koosoli,JavaScript,652,32,56 stars this week,https://github.com//koosoli/ESPHomeDesigner,GitHub_JavaScript_weekly,2026-02-11 15:19:40
13,github-readme-stats,⚡ Dynamically generated stats for your github readmes,qwerty541,JavaScript,"78,321","30,360",157 stars this week,https://github.com//anuraghazra/github-readme-stats,GitHub_JavaScript_weekly,2026-02-11 15:19:40
14,easy-dataset,A powerful tool for creating datasets for LLM fine-tuning 、RAG and Eval,ConardLi,JavaScript,"13,337","1,326",299 stars this week,https://github.com//ConardLi/easy-dataset,GitHub_JavaScript_weekly,2026-02-11 15:19:40
