index,title,desc,author,language,stars,forks,today_forks,url,type,datetime
17,inngest,"The leading workflow orchestration platform. Run stateful step functions and AI workflows on serverless, servers, or the edge.",tonyhb,Go,"4,831",251,62 stars this week,https://github.com//inngest/inngest,GitHub_Go_weekly,2026-02-15 02:53:45
18,minio,"MinIO is a high-performance, S3 compatible object store, open sourced under GNU AGPLv3 license.",harshavardhana,Go,"60,256","7,007",150 stars this week,https://github.com//minio/minio,GitHub_Go_weekly,2026-02-15 02:53:45
19,mcp-grafana,MCP server for Grafana,sd2k,Go,"2,301",260,55 stars this week,https://github.com//grafana/mcp-grafana,GitHub_Go_weekly,2026-02-15 02:53:45
20,fiber,⚡️ Express inspired web framework written in Go,Fenny,Go,"39,206","1,957",102 stars this week,https://github.com//gofiber/fiber,GitHub_Go_weekly,2026-02-15 02:53:45
21,anubis,Weighs the soul of incoming HTTP requests to stop AI crawlers,Xe,Go,"16,926",496,215 stars this week,https://github.com//TecharoHQ/anubis,GitHub_Go_weekly,2026-02-15 02:53:45
22,vikunja,The to-do app to organize your life.,kolaente,Go,"3,332",306,94 stars this week,https://github.com//go-vikunja/vikunja,GitHub_Go_weekly,2026-02-15 02:53:45
23,kustomize,Customization of kubernetes YAML configurations,monopole,Go,"11,936","2,364",18 stars this week,https://github.com//kubernetes-sigs/kustomize,GitHub_Go_weekly,2026-02-15 02:53:45
1,3x-ui,"Xray panel supporting multi-protocol multi-user expire day & traffic & IP limit (Vmess, Vless, Trojan, ShadowSocks, Wireguard, Tunnel, Mixed, HTTP, Tun)",MHSanaei,HTML,"30,322","5,930",482 stars this week,https://github.com//MHSanaei/3x-ui,GitHub_HTML_weekly,2026-02-15 02:53:45
2,SONiC,Landing page for Software for Open Networking in the Cloud (SONiC) - https://sonic-net.github.io/SONiC/,xinliu-seattle,HTML,"2,690","1,284",6 stars this week,https://github.com//sonic-net/SONiC,GitHub_HTML_weekly,2026-02-15 02:53:45
3,lancedb,Developer-friendly OSS embedded retrieval library for multimodal AI. Search More; Manage Less.,wjones127,HTML,"8,938",748,150 stars this week,https://github.com//lancedb/lancedb,GitHub_HTML_weekly,2026-02-15 02:53:45
4,tabler,Tabler is free and open-source HTML Dashboard UI Kit built on Bootstrap,codecalm,HTML,"40,717","4,337",38 stars this week,https://github.com//tabler/tabler,GitHub_HTML_weekly,2026-02-15 02:53:45
5,html,HTML Standard,Hixie,HTML,"9,149","3,110",15 stars this week,https://github.com//whatwg/html,GitHub_HTML_weekly,2026-02-15 02:53:45
6,garak,the LLM vulnerability scanner,leondz,HTML,"6,979",782,54 stars this week,https://github.com//NVIDIA/garak,GitHub_HTML_weekly,2026-02-15 02:53:45
7,zphisher,An automated phishing tool with 30+ templates. This Tool is made for educational purpose only ! Author will not be responsible for any misuse of this toolkit !,htr-tech,HTML,"15,380","5,798",49 stars this week,https://github.com//htr-tech/zphisher,GitHub_HTML_weekly,2026-02-15 02:53:45
8,Ask-out-your-Valentine,"A playful and interactive web experience for asking someone to be your Valentine, featuring charming GIFs and dynamic responses to 'Yes' and 'No' answers. Built with HTML, Tailwind CSS, and a sprinkle of JavaScript for interactivity.",CodeKageHQ,HTML,111,494,15 stars this week,https://github.com//CodeKageHQ/Ask-out-your-Valentine,GitHub_HTML_weekly,2026-02-15 02:53:45
9,CamPhish,Grab cam shots & GPS location from target's phone front camera or PC webcam just sending a link.,techchipnet,HTML,"4,519","1,238",26 stars this week,https://github.com//techchipnet/CamPhish,GitHub_HTML_weekly,2026-02-15 02:53:45
10,recipes,"Application for managing recipes, planning meals, building shopping lists and much much more!",vabene1111,HTML,"7,994",764,34 stars this week,https://github.com//TandoorRecipes/recipes,GitHub_HTML_weekly,2026-02-15 02:53:45
11,AWS-Certified-Cloud-Practitioner-Notes,AWS Certified Cloud Practitioner Short Notes And Practice Exams (CLF-C02),kananinirav,HTML,"3,816","1,355",24 stars this week,https://github.com//kananinirav/AWS-Certified-Cloud-Practitioner-Notes,GitHub_HTML_weekly,2026-02-15 02:53:45
12,html-css-course,Watch the course: https://youtu.be/G3e-cpL7ofc,SuperSimpleDev,HTML,"1,899","1,301",4 stars this week,https://github.com//SuperSimpleDev/html-css-course,GitHub_HTML_weekly,2026-02-15 02:53:45
13,aipyapp,AI-Powered Python & Python-Powered AI (Python-Use),lgxz,HTML,"3,420",341,120 stars this week,https://github.com//knownsec/aipyapp,GitHub_HTML_weekly,2026-02-15 02:53:45
14,geist-font,,guidoferreyra,HTML,"3,222",94,71 stars this week,https://github.com//vercel/geist-font,GitHub_HTML_weekly,2026-02-15 02:53:45
1,mcp_excalidraw,,yctimlin,JavaScript,891,83,146 stars this week,https://github.com//yctimlin/mcp_excalidraw,GitHub_JavaScript_weekly,2026-02-15 02:53:45
2,playwright-cli,"CLI for common Playwright actions. Record and generate Playwright code, inspect selectors and take screenshots.",pavelfeldman,JavaScript,"3,456",131,869 stars this week,https://github.com//microsoft/playwright-cli,GitHub_JavaScript_weekly,2026-02-15 02:53:45
3,escrcpy,📱 Display and control your Android device graphically with scrcpy.,viarotel,JavaScript,"8,140",594,478 stars this week,https://github.com//viarotel-org/escrcpy,GitHub_JavaScript_weekly,2026-02-15 02:53:45
4,tvbox,OK影视、tvbox配置文件，如果喜欢，请Fork自用。使用前请仔细阅读仓库说明，一旦使用将被视为你已了解。,gaotianliuyun,JavaScript,"8,042","2,991",186 stars this week,https://github.com//qist/tvbox,GitHub_JavaScript_weekly,2026-02-15 02:53:45
5,drawdb,"Free, simple, and intuitive online database diagram editor and SQL generator.",1ilit,JavaScript,"36,590","2,852",766 stars this week,https://github.com//drawdb-io/drawdb,GitHub_JavaScript_weekly,2026-02-15 02:53:45
6,github-readme-stats,⚡ Dynamically generated stats for your github readmes,qwerty541,JavaScript,"78,358","30,464",145 stars this week,https://github.com//anuraghazra/github-readme-stats,GitHub_JavaScript_weekly,2026-02-15 02:53:45
7,edex-ui,"A cross-platform, customizable science fiction terminal emulator with advanced monitoring & touchscreen support.",GitSquared,JavaScript,"44,224","2,997",155 stars this week,https://github.com//GitSquared/edex-ui,GitHub_JavaScript_weekly,2026-02-15 02:53:45
8,BrasilAPI,Vamos transformar o Brasil em uma API?,LorhanSohaky,JavaScript,"10,195",694,81 stars this week,https://github.com//BrasilAPI/BrasilAPI,GitHub_JavaScript_weekly,2026-02-15 02:53:45
9,NotionNext,"使用 NextJS + Notion API 实现的，支持多种部署方案的静态博客，无需服务器、零门槛搭建网站，为Notion和所有创作者设计。 (A static blog built with NextJS and Notion API, supporting multiple deployment options. No server required, zero threshold to set up a website. Designed for Notion and all creators.)",tangly1024,JavaScript,"11,103","14,417",69 stars this week,https://github.com//tangly1024/NotionNext,GitHub_JavaScript_weekly,2026-02-15 02:53:45
10,cs249r_book,Introduction to Machine Learning Systems,profvjreddi,JavaScript,"18,189","2,127",362 stars this week,https://github.com//harvard-edge/cs249r_book,GitHub_JavaScript_weekly,2026-02-15 02:53:45
11,Epstein-doc-explorer,a graph explorer of the Epstein emails,claude,JavaScript,519,96,90 stars this week,https://github.com//maxandrews/Epstein-doc-explorer,GitHub_JavaScript_weekly,2026-02-15 02:53:45
