index,title,desc,author,language,stars,forks,today_forks,url,type,datetime
10,claude-plugins-official,"Official, Anthropic-managed directory of high quality Claude Code Plugins.",noahzweben,Shell,"6,671",644,"4,927 stars this month",https://github.com//anthropics/claude-plugins-official,GitHub_Shell_monthly,2026-02-06 15:11:19
11,system_prompts_leaks,"Collection of extracted System Prompts from popular chatbots like ChatGPT, Claude & Gemini",asgeirtj,JavaScript,"30,336","4,871","5,531 stars this month",https://github.com//asgeirtj/system_prompts_leaks,GitHub_JavaScript_monthly,2026-02-06 15:11:19
12,claude-code,"Claude Code is an agentic coding tool that lives in your terminal, understands your codebase, and helps you code faster by executing routine tasks, explaining complex code, and handling git workflows - all through natural language commands.",actions-user,Shell,"64,600","4,914","13,261 stars this month",https://github.com//anthropics/claude-code,GitHub_Shell_monthly,2026-02-06 15:11:19
13,Antigravity-Manager,Professional Antigravity Account Manager & Switcher. One-click seamless account switching for Antigravity Tools. Built with Tauri v2 + React (Rust).专业的 Antigravity 账号管理与切换工具。为 Antigravity 提供一键无缝账号切换功能。,lbjlaq,Rust,"21,536","2,436","13,180 stars this month",https://github.com//lbjlaq/Antigravity-Manager,GitHub_Rust_monthly,2026-02-06 15:11:19
14,UI-TARS-desktop,The Open-Source Multimodal AI Agent Stack: Connecting Cutting-Edge AI Models and Agent Infra,ulivz,TypeScript,"26,869","2,630","6,174 stars this month",https://github.com//bytedance/UI-TARS-desktop,GitHub_TypeScript_monthly,2026-02-06 15:11:19
15,awesome-claude-skills,"A curated list of awesome Claude Skills, resources, and tools for customizing Claude AI workflows",Prat011,Python,"30,964","2,974","15,839 stars this month",https://github.com//ComposioHQ/awesome-claude-skills,GitHub_Python_monthly,2026-02-06 15:11:19
16,claude-mem,"A Claude Code plugin that automatically captures everything Claude does during your coding sessions, compresses it with AI (using Claude's agent-sdk), and injects relevant context back into future sessions.",thedotmack,TypeScript,"23,914","1,579","13,297 stars this month",https://github.com//thedotmack/claude-mem,GitHub_TypeScript_monthly,2026-02-06 15:11:19
17,data-engineering-zoomcamp,Data Engineering Zoomcamp is a free 9-week course on building production-ready data pipelines. The next cohort starts in January 2026. Join the course here 👇🏼,alexeygrigorev,Jupyter Notebook,"38,083","7,670","3,953 stars this month",https://github.com//DataTalksClub/data-engineering-zoomcamp,GitHub_Jupyter Notebook_monthly,2026-02-06 15:11:19
1,openclaw,Your own personal AI assistant. Any OS. Any Platform. The lobster way. 🦞,steipete,TypeScript,"168,992","27,025","68,757 stars this week",https://github.com//openclaw/openclaw,GitHub_TypeScript_weekly,2026-02-06 15:11:19
2,claude-mem,"A Claude Code plugin that automatically captures everything Claude does during your coding sessions, compresses it with AI (using Claude's agent-sdk), and injects relevant context back into future sessions.",thedotmack,TypeScript,"23,914","1,579","8,130 stars this week",https://github.com//thedotmack/claude-mem,GitHub_TypeScript_weekly,2026-02-06 15:11:19
3,system_prompts_leaks,"Collection of extracted System Prompts from popular chatbots like ChatGPT, Claude & Gemini",asgeirtj,JavaScript,"30,336","4,871","3,094 stars this week",https://github.com//asgeirtj/system_prompts_leaks,GitHub_JavaScript_weekly,2026-02-06 15:11:19
4,pi-mono,"AI agent toolkit: coding agent CLI, unified LLM API, TUI & web UI libraries, Slack bot, vLLM pods",badlogic,TypeScript,"7,356",744,"3,578 stars this week",https://github.com//badlogic/pi-mono,GitHub_TypeScript_weekly,2026-02-06 15:11:19
5,99,Neovim AI agent done right,ThePrimeagen,Lua,"3,378",154,"2,190 stars this week",https://github.com//ThePrimeagen/99,GitHub_Lua_weekly,2026-02-06 15:11:19
6,BitNet,Official inference framework for 1-bit LLMs,potassiummmm,Python,"27,939","2,270","2,054 stars this week",https://github.com//microsoft/BitNet,GitHub_Python_weekly,2026-02-06 15:11:19
7,kimi-cli,Kimi Code CLI is your next CLI agent.,stdrc,Python,"6,067",563,"1,226 stars this week",https://github.com//MoonshotAI/kimi-cli,GitHub_Python_weekly,2026-02-06 15:11:19
8,skills,Skills Catalog for Codex,gverma-openai,Python,"4,455",249,"1,887 stars this week",https://github.com//openai/skills,GitHub_Python_weekly,2026-02-06 15:11:19
9,playwright-cli,"CLI for common Playwright actions. Record and generate Playwright code, inspect selectors and take screenshots.",pavelfeldman,JavaScript,"2,296",93,620 stars this week,https://github.com//microsoft/playwright-cli,GitHub_JavaScript_weekly,2026-02-06 15:11:19
10,Maestro,Agent Orchestration Command Center,pedramamini,TypeScript,"1,843",171,"1,054 stars this week",https://github.com//pedramamini/Maestro,GitHub_TypeScript_weekly,2026-02-06 15:11:19
11,agent-lightning,The absolute trainer to light up AI agents.,actions-user,Python,"14,121","1,188","2,206 stars this week",https://github.com//microsoft/agent-lightning,GitHub_Python_weekly,2026-02-06 15:11:19
12,memU,"Memory for 24/7 proactive agents like openclaw (moltbot, clawdbot).",sairin1202,Python,"7,951",607,"1,952 stars this week",https://github.com//NevaMind-AI/memU,GitHub_Python_weekly,2026-02-06 15:11:19
13,claude-code-hooks-mastery,Master Claude Code Hooks,disler,Python,"2,568",516,397 stars this week,https://github.com//disler/claude-code-hooks-mastery,GitHub_Python_weekly,2026-02-06 15:11:19
14,PageIndex,"📑 PageIndex: Document Index for Vectorless, Reasoning-based RAG",rejojer,Python,"13,679",988,"2,960 stars this week",https://github.com//VectifyAI/PageIndex,GitHub_Python_weekly,2026-02-06 15:11:19
15,ext-apps,"Official repo for spec & SDK of MCP Apps protocol - standard for UIs embedded AI chatbots, served by MCP servers",ochafik,TypeScript,"1,385",153,614 stars this week,https://github.com//modelcontextprotocol/ext-apps,GitHub_TypeScript_weekly,2026-02-06 15:11:19
1,termux-app,Termux - a terminal emulator application for Android OS extendible by variety of packages.,agnostic-apollo,Java,"50,207","5,973",867 stars this week,https://github.com//termux/termux-app,GitHub_Java_weekly,2026-02-06 15:11:19
2,NewPipe,A libre lightweight streaming front-end for Android.,Stypox,Java,"37,022","3,442",339 stars this week,https://github.com//TeamNewPipe/NewPipe,GitHub_Java_weekly,2026-02-06 15:11:19
3,Unexpected-Keyboard,A lightweight keyboard for Android,Julow,Java,"2,740",277,58 stars this week,https://github.com//Julow/Unexpected-Keyboard,GitHub_Java_weekly,2026-02-06 15:11:19
4,ghidra,Ghidra is a software reverse engineering (SRE) framework,ryanmkurtz,Java,"64,113","7,118",214 stars this week,https://github.com//NationalSecurityAgency/ghidra,GitHub_Java_weekly,2026-02-06 15:11:19
5,signal-cli,"signal-cli provides an unofficial commandline, JSON-RPC and dbus interface for the Signal messenger.",AsamK,Java,"4,115",365,67 stars this week,https://github.com//AsamK/signal-cli,GitHub_Java_weekly,2026-02-06 15:11:19
6,LSPosed,LSPosed Framework resuscitated,yujincheng08,Java,"9,462",592,108 stars this week,https://github.com//JingMatrix/LSPosed,GitHub_Java_weekly,2026-02-06 15:11:19
7,gson,A Java serialization/deserialization library to convert Java Objects into JSON and back,inder123,Java,"24,335","4,395",9 stars this week,https://github.com//google/gson,GitHub_Java_weekly,2026-02-06 15:11:19
8,Java,All Algorithms implemented in Java,alxkm,Java,"64,951","20,945",105 stars this week,https://github.com//TheAlgorithms/Java,GitHub_Java_weekly,2026-02-06 15:11:19
9,SmartTube,Browse media content with your own rules on Android TV,yuliskov,Java,"27,983","1,505",161 stars this week,https://github.com//yuliskov/SmartTube,GitHub_Java_weekly,2026-02-06 15:11:19
10,trino,"Official repository of Trino, the distributed SQL query engine for big data, formerly known as PrestoSQL (https://trino.io)",findepi,Java,"12,521","3,468",46 stars this week,https://github.com//trinodb/trino,GitHub_Java_weekly,2026-02-06 15:11:19
11,Telegram-X,The main repository of Telegram X — official alternative Telegram client for Android.,vkryl,Java,"5,204",923,52 stars this week,https://github.com//TGX-Android/Telegram-X,GitHub_Java_weekly,2026-02-06 15:11:19
12,flyway,Flyway by Redgate • Database Migrations Made Easy.,axelfontaine,Java,"9,513","1,593",40 stars this week,https://github.com//flyway/flyway,GitHub_Java_weekly,2026-02-06 15:11:19
13,JeecgBoot,【AI低代码平台】AI low-code platform empowers enterprises to quickly develop low-code solutions and build AI applications. 助力企业快速实现低代码开发和构建AI应用！ AI应用平台涵盖：AI应用、AI模型、AI聊天助手、知识库、AI流程编排、MCP和插件，聊天式业务操作等。 强大代码生成器：实现前后端一键生成，无需手写代码! 显著提升效率节省成本，又不失灵活~,zhangdaiscott,Java,"45,182","15,810",77 stars this week,https://github.com//jeecgboot/JeecgBoot,GitHub_Java_weekly,2026-02-06 15:11:19
14,bazel,"a fast, scalable, multi-language and extensible build system",lberki,Java,"25,087","4,402",48 stars this week,https://github.com//bazelbuild/bazel,GitHub_Java_weekly,2026-02-06 15:11:19
15,PojavLauncher,A Minecraft: Java Edition Launcher for Android and iOS based on Boardwalk. Succeeded by https://github.com/AngelAuraMC/Amethyst-Android,khanhduytran0,Java,"8,671","1,826",23 stars this week,https://github.com//PojavLauncherTeam/PojavLauncher,GitHub_Java_weekly,2026-02-06 15:11:19
16,thingsboard,"Open-source IoT Platform - Device management, data collection, processing and visualization.",ikulikov,Java,"21,082","6,106",60 stars this week,https://github.com//thingsboard/thingsboard,GitHub_Java_weekly,2026-02-06 15:11:19
17,AppManager,A full-featured package manager and viewer for Android,MuntashirAkon,Java,"7,324",418,59 stars this week,https://github.com//MuntashirAkon/AppManager,GitHub_Java_weekly,2026-02-06 15:11:19
18,unitycatalog,"Open, Multi-modal Catalog for Data & AI",BenWilson2,Java,"3,301",581,17 stars this week,https://github.com//unitycatalog/unitycatalog,GitHub_Java_weekly,2026-02-06 15:11:19
19,gravitino,"World's most powerful open data catalog for building a high-performance, geo-distributed and federated metadata lake.",yuqi1129,Java,"2,763",722,48 stars this week,https://github.com//apache/gravitino,GitHub_Java_weekly,2026-02-06 15:11:19
20,OpenSearch,🔎 Open source distributed and RESTful search engine.,dependabot,Java,"12,335","2,393",45 stars this week,https://github.com//opensearch-project/OpenSearch,GitHub_Java_weekly,2026-02-06 15:11:19
21,LLD,All Code of LLD Playlist,adityatandon15,Java,639,446,18 stars this week,https://github.com//adityatandon15/LLD,GitHub_Java_weekly,2026-02-06 15:11:19
1,BitNet,Official inference framework for 1-bit LLMs,potassiummmm,Python,"27,939","2,270","2,054 stars this week",https://github.com//microsoft/BitNet,GitHub_Python_weekly,2026-02-06 15:11:19
2,kimi-cli,Kimi Code CLI is your next CLI agent.,stdrc,Python,"6,067",563,"1,226 stars this week",https://github.com//MoonshotAI/kimi-cli,GitHub_Python_weekly,2026-02-06 15:11:19
3,skills,Skills Catalog for Codex,gverma-openai,Python,"4,455",249,"1,887 stars this week",https://github.com//openai/skills,GitHub_Python_weekly,2026-02-06 15:11:19
4,agent-lightning,The absolute trainer to light up AI agents.,actions-user,Python,"14,121","1,188","2,206 stars this week",https://github.com//microsoft/agent-lightning,GitHub_Python_weekly,2026-02-06 15:11:19
5,memU,"Memory for 24/7 proactive agents like openclaw (moltbot, clawdbot).",sairin1202,Python,"7,951",607,"1,952 stars this week",https://github.com//NevaMind-AI/memU,GitHub_Python_weekly,2026-02-06 15:11:19
6,claude-code-hooks-mastery,Master Claude Code Hooks,disler,Python,"2,568",516,397 stars this week,https://github.com//disler/claude-code-hooks-mastery,GitHub_Python_weekly,2026-02-06 15:11:19
7,PageIndex,"📑 PageIndex: Document Index for Vectorless, Reasoning-based RAG",rejojer,Python,"13,679",988,"2,960 stars this week",https://github.com//VectifyAI/PageIndex,GitHub_Python_weekly,2026-02-06 15:11:19
8,nanochat,The best ChatGPT that $100 can buy.,karpathy,Python,"42,357","5,471","1,328 stars this week",https://github.com//karpathy/nanochat,GitHub_Python_weekly,2026-02-06 15:11:19
9,calibre,The official source code repository for the calibre ebook manager,kovidgoyal,Python,"24,024","2,553",551 stars this week,https://github.com//kovidgoyal/calibre,GitHub_Python_weekly,2026-02-06 15:11:19
10,ChatDev,ChatDev 2.0: Dev All through LLM-powered Multi-Agent Collaboration,thinkwee,Python,"30,368","3,754","1,215 stars this week",https://github.com//OpenBMB/ChatDev,GitHub_Python_weekly,2026-02-06 15:11:19
11,PaddleOCR,"Turn any PDF or image document into structured data for your AI. A powerful, lightweight OCR toolkit that bridges the gap between images/PDFs and LLMs. Supports 100+ languages.",LDOUBLEV,Python,"70,287","9,793","1,303 stars this week",https://github.com//PaddlePaddle/PaddleOCR,GitHub_Python_weekly,2026-02-06 15:11:19
12,chatgpt-on-wechat,CowAgent是基于大模型的超级AI助理，能主动思考和任务规划、访问操作系统和外部资源、创造和执行Skills、拥有长期记忆并不断成长。同时支持飞书、钉钉、企业微信应用、微信公众号、网页等接入，可选择OpenAI/Claude/Gemini/DeepSeek/ Qwen/GLM/Kimi/LinkAI，能处理文本、语音、图片和文件，可快速搭建个人AI助手和企业数字员工。,zhayujie,Python,"41,094","9,715",229 stars this week,https://github.com//zhayujie/chatgpt-on-wechat,GitHub_Python_weekly,2026-02-06 15:11:19
13,hrms,Open Source HR and Payroll Software,ruchamahabal,Python,"7,453","2,044",234 stars this week,https://github.com//frappe/hrms,GitHub_Python_weekly,2026-02-06 15:11:19
14,cognee,Memory for AI Agents in 6 lines of code,Vasilije1990,Python,"11,906","1,166",321 stars this week,https://github.com//topoteretes/cognee,GitHub_Python_weekly,2026-02-06 15:11:19
15,claude-skills,65 Specialized Skills for Full-Stack Developers. Transform Claude Code into your expert pair programmer.,Jeffallan,Python,301,34,122 stars this week,https://github.com//Jeffallan/claude-skills,GitHub_Python_weekly,2026-02-06 15:11:19
16,yt-dlp,A feature-rich command-line audio/video downloader,dstftw,Python,"145,981","11,827","1,261 stars this week",https://github.com//yt-dlp/yt-dlp,GitHub_Python_weekly,2026-02-06 15:11:19
1,qui,"A fast, single-binary qBittorrent web UI: manage multiple instances, automate torrent workflows, and cross-seed across trackers.",s0up4200,Go,"3,082",85,601 stars this week,https://github.com//autobrr/qui,GitHub_Go_weekly,2026-02-06 15:11:19
2,k3s,Lightweight Kubernetes,brandond,Go,"32,096","2,588",95 stars this week,https://github.com//k3s-io/k3s,GitHub_Go_weekly,2026-02-06 15:11:19
3,ingress-nginx,Ingress NGINX Controller for Kubernetes,aledbf,Go,"19,428","8,520",31 stars this week,https://github.com//kubernetes/ingress-nginx,GitHub_Go_weekly,2026-02-06 15:11:19
4,netbird,"Connect your devices into a secure WireGuard®-based overlay network with SSO, MFA and granular access controls.",mlsmaycon,Go,"22,212","1,084",862 stars this week,https://github.com//netbirdio/netbird,GitHub_Go_weekly,2026-02-06 15:11:19
5,vault,"A tool for secrets management, encryption as a service, and privileged access management",jefferai,Go,"34,970","4,588",429 stars this week,https://github.com//hashicorp/vault,GitHub_Go_weekly,2026-02-06 15:11:19
6,ollama,"Get up and running with Kimi-K2.5, GLM-4.7, DeepSeek, gpt-oss, Qwen, Gemma and other models.",mxyng,Go,"161,890","14,469",904 stars this week,https://github.com//ollama/ollama,GitHub_Go_weekly,2026-02-06 15:11:19
7,opentelemetry-collector-contrib,Contrib repository for the OpenTelemetry Collector,renovate,Go,"4,382","3,305",63 stars this week,https://github.com//open-telemetry/opentelemetry-collector-contrib,GitHub_Go_weekly,2026-02-06 15:11:19
8,axonhub,"⚡️ Open-source AI Gateway — Use any SDK to call 100+ LLMs. Built-in failover, load balancing, cost control & end-to-end tracing.",looplj,Go,"1,733",194,190 stars this week,https://github.com//looplj/axonhub,GitHub_Go_weekly,2026-02-06 15:11:19
9,tailscale,"The easiest, most secure way to use WireGuard and 2FA.",bradfitz,Go,"27,974","2,271",378 stars this week,https://github.com//tailscale/tailscale,GitHub_Go_weekly,2026-02-06 15:11:19
10,cloudflared,Cloudflare Tunnel client,chungthuang,Go,"12,932","1,166",109 stars this week,https://github.com//cloudflare/cloudflared,GitHub_Go_weekly,2026-02-06 15:11:19
11,terraform-provider-aws,The AWS Provider enables Terraform to manage AWS resources.,ewbankkit,Go,"10,733","9,941",18 stars this week,https://github.com//hashicorp/terraform-provider-aws,GitHub_Go_weekly,2026-02-06 15:11:19
12,Xray-core,"Xray, Penetrates Everything. Also the best v2ray-core. Where the magic happens. An open platform for various uses.",RPRX,Go,"34,817","4,929",333 stars this week,https://github.com//XTLS/Xray-core,GitHub_Go_weekly,2026-02-06 15:11:19
13,SafeLine,SafeLine is a self-hosted WAF(Web Application Firewall) / reverse proxy to protect your web apps from attacks and exploits.,xbingW,Go,"20,619","1,328",248 stars this week,https://github.com//chaitin/SafeLine,GitHub_Go_weekly,2026-02-06 15:11:19
14,CloudflareSpeedTest,🌩「自选优选 IP」测试 Cloudflare CDN 延迟和速度，获取最快 IP ！当然也支持其他 CDN / 多个解析 IP 的网站 ~,XIU2,Go,"24,574","4,790",153 stars this week,https://github.com//XIU2/CloudflareSpeedTest,GitHub_Go_weekly,2026-02-06 15:11:19
15,quic-go,A production-ready QUIC implementation in pure Go,marten-seemann,Go,"11,398","1,511",33 stars this week,https://github.com//quic-go/quic-go,GitHub_Go_weekly,2026-02-06 15:11:19
16,trivy,"Find vulnerabilities, misconfigurations, secrets, SBOM in containers, Kubernetes, code repositories, clouds and more",knqyf263,Go,"31,411","2,914",156 stars this week,https://github.com//aquasecurity/trivy,GitHub_Go_weekly,2026-02-06 15:11:19
17,crossplane,The Cloud Native Control Plane,negz,Go,"11,372","1,131",32 stars this week,https://github.com//crossplane/crossplane,GitHub_Go_weekly,2026-02-06 15:11:19
18,headscale,"An open source, self-hosted implementation of the Tailscale control server",kradalby,Go,"34,932","1,874",270 stars this week,https://github.com//juanfont/headscale,GitHub_Go_weekly,2026-02-06 15:11:19
19,llama-swap,"Reliable model swapping for any local OpenAI/Anthropic compatible server - llama.cpp, vllm, etc",mostlygeek,Go,"2,332",170,65 stars this week,https://github.com//mostlygeek/llama-swap,GitHub_Go_weekly,2026-02-06 15:11:19
1,unstructured,"Convert documents to structured data effortlessly. Unstructured is open-source ETL solution for transforming complex documents into clean, structured formats for language models. Visit our website to learn more about our enterprise grade Platform product for production grade workflows, partitioning, enrichments, chunking and embedding.",MthwRobinson,HTML,"13,896","1,153",82 stars this week,https://github.com//Unstructured-IO/unstructured,GitHub_HTML_weekly,2026-02-06 15:11:19
2,3x-ui,"Xray panel supporting multi-protocol multi-user expire day & traffic & IP limit (Vmess, Vless, Trojan, ShadowSocks, Wireguard, Tunnel, Mixed, HTTP, Tun)",MHSanaei,HTML,"29,808","5,848",479 stars this week,https://github.com//MHSanaei/3x-ui,GitHub_HTML_weekly,2026-02-06 15:11:19
3,tidytuesday,Official repo for the #tidytuesday project,jthomasmock,HTML,"7,962","2,546",18 stars this week,https://github.com//rfordatascience/tidytuesday,GitHub_HTML_weekly,2026-02-06 15:11:19
4,awesome-github-profile-readme-templates,This repository contains best profile readme's for your reference.,durgeshsamariya,HTML,"5,147","7,634",20 stars this week,https://github.com//durgeshsamariya/awesome-github-profile-readme-templates,GitHub_HTML_weekly,2026-02-06 15:11:19
5,garak,the LLM vulnerability scanner,leondz,HTML,"6,922",777,50 stars this week,https://github.com//NVIDIA/garak,GitHub_HTML_weekly,2026-02-06 15:11:19
6,Ask-out-your-Valentine,"A playful and interactive web experience for asking someone to be your Valentine, featuring charming GIFs and dynamic responses to 'Yes' and 'No' answers. Built with HTML, Tailwind CSS, and a sprinkle of JavaScript for interactivity.",CodeKageHQ,HTML,95,363,20 stars this week,https://github.com//CodeKageHQ/Ask-out-your-Valentine,GitHub_HTML_weekly,2026-02-06 15:11:19
7,awesome-compose,Awesome Docker Compose samples,glours,HTML,"43,774","8,002",123 stars this week,https://github.com//docker/awesome-compose,GitHub_HTML_weekly,2026-02-06 15:11:19
8,zphisher,An automated phishing tool with 30+ templates. This Tool is made for educational purpose only ! Author will not be responsible for any misuse of this toolkit !,htr-tech,HTML,"15,333","5,770",52 stars this week,https://github.com//htr-tech/zphisher,GitHub_HTML_weekly,2026-02-06 15:11:19
9,InstagramUnfollowers,Check if people follows you back on Instagram.,davidarroyo1234,HTML,"4,274",385,30 stars this week,https://github.com//davidarroyo1234/InstagramUnfollowers,GitHub_HTML_weekly,2026-02-06 15:11:19
10,AssetOpsBench,AssetOpsBench - Industry 4.0,ShuxinLin,HTML,947,139,68 stars this week,https://github.com//IBM/AssetOpsBench,GitHub_HTML_weekly,2026-02-06 15:11:19
11,fonts,"Font files available from Google Fonts, and a public issue tracker for all things Google Fonts",m4rc1e,HTML,"19,674","2,840",29 stars this week,https://github.com//google/fonts,GitHub_HTML_weekly,2026-02-06 15:11:19
12,Awesome-Linux-Software,🐧 A list of awesome Linux softwares,luong-komorebi,HTML,"24,853","2,167",41 stars this week,https://github.com//luong-komorebi/Awesome-Linux-Software,GitHub_HTML_weekly,2026-02-06 15:11:19
1,system_prompts_leaks,"Collection of extracted System Prompts from popular chatbots like ChatGPT, Claude & Gemini",asgeirtj,JavaScript,"30,336","4,871","3,094 stars this week",https://github.com//asgeirtj/system_prompts_leaks,GitHub_JavaScript_weekly,2026-02-06 15:11:19
2,playwright-cli,"CLI for common Playwright actions. Record and generate Playwright code, inspect selectors and take screenshots.",pavelfeldman,JavaScript,"2,296",93,620 stars this week,https://github.com//microsoft/playwright-cli,GitHub_JavaScript_weekly,2026-02-06 15:11:19
3,godot-mcp,"MCP server for interfacing with Godot game engine. Provides tools for launching the editor, running projects, and capturing debug output.",Coding-Solo,JavaScript,"1,680",184,94 stars this week,https://github.com//Coding-Solo/godot-mcp,GitHub_JavaScript_weekly,2026-02-06 15:11:19
4,edex-ui,"A cross-platform, customizable science fiction terminal emulator with advanced monitoring & touchscreen support.",GitSquared,JavaScript,"44,078","2,974",118 stars this week,https://github.com//GitSquared/edex-ui,GitHub_JavaScript_weekly,2026-02-06 15:11:19
5,Calibre-Web-Automated,Calibre-Web but Automated and with tons of New Features! Fully automate and simplify your eBook set up!,crocodilestick,JavaScript,"4,736",316,179 stars this week,https://github.com//crocodilestick/Calibre-Web-Automated,GitHub_JavaScript_weekly,2026-02-06 15:11:19
6,Acode,Acode - powerful text/code editor for android,bajrangCoder,JavaScript,"4,460",792,73 stars this week,https://github.com//Acode-Foundation/Acode,GitHub_JavaScript_weekly,2026-02-06 15:11:19
7,pixels,"Facilitates simple large scale processing of HLS Medical images, documents, zip files. OHIF Viewer, 2 segmentation models and interactive learning.",erinaldidb,JavaScript,324,105,107 stars this week,https://github.com//databricks-industry-solutions/pixels,GitHub_JavaScript_weekly,2026-02-06 15:11:19
8,claudecodeui,"Use Claude Code, Cursor CLI or Codex on mobile and web with CloudCLI (aka Claude Code UI). CloudCLI is a free open source webui/GUI that helps you manage your Claude Code session and projects remotely",viper151,JavaScript,"6,035",789,228 stars this week,https://github.com//siteboon/claudecodeui,GitHub_JavaScript_weekly,2026-02-06 15:11:19
9,whatsapp-web.js,A WhatsApp client library for NodeJS that connects through the WhatsApp Web browser app,pedroslopez,JavaScript,"21,096","4,868",439 stars this week,https://github.com//pedroslopez/whatsapp-web.js,GitHub_JavaScript_weekly,2026-02-06 15:11:19
10,drawio,"draw.io is a JavaScript, client-side editor for general diagramming.",davidjgraph,JavaScript,"3,497",630,88 stars this week,https://github.com//jgraph/drawio,GitHub_JavaScript_weekly,2026-02-06 15:11:19
11,Baileys,Socket-based TS/JavaScript API for WhatsApp Web,adiwajshing,JavaScript,"8,079","2,676",163 stars this week,https://github.com//WhiskeySockets/Baileys,GitHub_JavaScript_weekly,2026-02-06 15:11:19
12,awesome-copilot,"Community-contributed instructions, prompts, and configurations to help you make the most of GitHub Copilot.",aaronpowell,JavaScript,"20,308","2,337",773 stars this week,https://github.com//github/awesome-copilot,GitHub_JavaScript_weekly,2026-02-06 15:11:19
13,appscreen,Create screenshots for the iOS App Store,BlackMac,JavaScript,"1,370",138,396 stars this week,https://github.com//YUZU-Hub/appscreen,GitHub_JavaScript_weekly,2026-02-06 15:11:19
14,marktext,"📝A simple and elegant markdown editor, available for Linux, macOS and Windows.",Jocs,JavaScript,"53,691","3,970",165 stars this week,https://github.com//marktext/marktext,GitHub_JavaScript_weekly,2026-02-06 15:11:19
15,EmulatorJS,A web-based frontend for RetroArch,ethanaobrien,JavaScript,"3,056",826,297 stars this week,https://github.com//EmulatorJS/EmulatorJS,GitHub_JavaScript_weekly,2026-02-06 15:11:19
16,simple-icons,SVG icons for popular brands,PeterShaggyNoble,JavaScript,"24,397","3,039",116 stars this week,https://github.com//simple-icons/simple-icons,GitHub_JavaScript_weekly,2026-02-06 15:11:19
