index,title,desc,author,language,stars,forks,today_forks,url,type,datetime
4,cs249r_book,Introduction to Machine Learning Systems,profvjreddi,JavaScript,"20,685","2,392","2,419 stars this week",https://github.com//harvard-edge/cs249r_book,GitHub_JavaScript_weekly,2026-02-23 02:54:42
5,server-survival,"Tower defense game that teaches cloud architecture. Build infrastructure, survive traffic, learn scaling.",pshenok,JavaScript,"5,306",615,412 stars this week,https://github.com//pshenok/server-survival,GitHub_JavaScript_weekly,2026-02-23 02:54:42
6,get-shit-done,"A light-weight and powerful meta-prompting, context engineering and spec-driven development system for Claude Code and OpenCode.",glittercowboy,JavaScript,"17,473","1,583","3,044 stars this week",https://github.com//gsd-build/get-shit-done,GitHub_JavaScript_weekly,2026-02-23 02:54:42
7,SillyTavern,LLM Frontend for Power Users.,Cohee1207,JavaScript,"23,401","4,773",297 stars this week,https://github.com//SillyTavern/SillyTavern,GitHub_JavaScript_weekly,2026-02-23 02:54:42
8,uptime-kuma,A fancy self-hosted monitoring tool,louislam,JavaScript,"83,119","7,430",298 stars this week,https://github.com//louislam/uptime-kuma,GitHub_JavaScript_weekly,2026-02-23 02:54:42
9,github-readme-stats,⚡ Dynamically generated stats for your github readmes,qwerty541,JavaScript,"78,485","30,787",137 stars this week,https://github.com//anuraghazra/github-readme-stats,GitHub_JavaScript_weekly,2026-02-23 02:54:42
10,eslint,Find and fix problems in your JavaScript code.,nzakas,JavaScript,"27,101","4,923",212 stars this week,https://github.com//eslint/eslint,GitHub_JavaScript_weekly,2026-02-23 02:54:42
11,live,✯ 可直连访问的电视/广播图标库与相关工具项目 ✯ 🔕 永久免费 直连访问 完整开源 不断完善的台标 支持IPv4/IPv6双栈访问 🔕,github-actions,JavaScript,"27,684","4,168",84 stars this week,https://github.com//fanmingming/live,GitHub_JavaScript_weekly,2026-02-23 02:54:42
12,bruno,Opensource IDE For Exploring and Testing API's (lightweight alternative to Postman/Insomnia),helloanoop,JavaScript,"41,033","2,134",186 stars this week,https://github.com//usebruno/bruno,GitHub_JavaScript_weekly,2026-02-23 02:54:42
13,Cronicle,"A simple, distributed task scheduler and runner with a web based UI.",jhuckaby,JavaScript,"5,486",481,94 stars this week,https://github.com//jhuckaby/Cronicle,GitHub_JavaScript_weekly,2026-02-23 02:54:42
14,awesome-copilot,"Community-contributed instructions, prompts, and configurations to help you make the most of GitHub Copilot.",aaronpowell,JavaScript,"22,130","2,533",862 stars this week,https://github.com//github/awesome-copilot,GitHub_JavaScript_weekly,2026-02-23 02:54:42
