index,title,desc,author,language,stars,forks,today_forks,url,type,datetime
6,NetherSX2-patch,Continuation of NetherSX2 based on AetherSX2 4248,Trixarian,HTML,"2,038",69,32 stars this week,https://github.com//Trixarian/NetherSX2-patch,GitHub_HTML_weekly,2026-02-24 03:22:14
7,awesome-compose,Awesome Docker Compose samples,glours,HTML,"44,070","8,043",143 stars this week,https://github.com//docker/awesome-compose,GitHub_HTML_weekly,2026-02-24 03:22:14
8,awesome-generative-ai-guide,"A one stop repository for generative AI research updates, interview resources, notebooks and much more!",aishwaryanr,HTML,"24,840","5,288",189 stars this week,https://github.com//aishwaryanr/awesome-generative-ai-guide,GitHub_HTML_weekly,2026-02-24 03:22:14
9,styleguide,Style guides for Google-originated open-source projects,tonyruscoe,HTML,"39,020","13,006",67 stars this week,https://github.com//google/styleguide,GitHub_HTML_weekly,2026-02-24 03:22:14
10,free-for-dev,"A list of SaaS, PaaS and IaaS offerings that have free tiers of interest to devops and infradev",ripienaar,HTML,"118,130","12,119",208 stars this week,https://github.com//ripienaar/free-for-dev,GitHub_HTML_weekly,2026-02-24 03:22:14
11,meshery,"Meshery, the cloud native manager",leecalcote,HTML,"9,986","3,076",94 stars this week,https://github.com//meshery/meshery,GitHub_HTML_weekly,2026-02-24 03:22:14
12,wpt,"Test suites for Web platform specs — including WHATWG, W3C, and others",jgraham,HTML,"5,780","3,675",7 stars this week,https://github.com//web-platform-tests/wpt,GitHub_HTML_weekly,2026-02-24 03:22:14
13,git-github,Repositorio del Curso de Git y GitHub,mauricios11,HTML,"1,430","1,820",33 stars this week,https://github.com//platzi/git-github,GitHub_HTML_weekly,2026-02-24 03:22:14
14,html-css,Curso de HTML5 e CSS3,gustavoguanabara,HTML,"16,011","3,815",38 stars this week,https://github.com//gustavoguanabara/html-css,GitHub_HTML_weekly,2026-02-24 03:22:14
1,aios-core,Synkra AIOS: AI-Orchestrated System for Full Stack Development - Core Framework v4.0,claude,JavaScript,"1,718",607,953 stars this week,https://github.com//SynkraAI/aios-core,GitHub_JavaScript_weekly,2026-02-24 03:22:14
2,stremio-web,Stremio - Freedom to Stream,nklhtv,JavaScript,"9,899","1,075",632 stars this week,https://github.com//Stremio/stremio-web,GitHub_JavaScript_weekly,2026-02-24 03:22:14
3,mcp_excalidraw,,yctimlin,JavaScript,"1,136",104,208 stars this week,https://github.com//yctimlin/mcp_excalidraw,GitHub_JavaScript_weekly,2026-02-24 03:22:14
4,cs249r_book,Introduction to Machine Learning Systems,profvjreddi,JavaScript,"20,814","2,405","2,512 stars this week",https://github.com//harvard-edge/cs249r_book,GitHub_JavaScript_weekly,2026-02-24 03:22:14
5,get-shit-done,"A light-weight and powerful meta-prompting, context engineering and spec-driven development system for Claude Code and OpenCode.",glittercowboy,JavaScript,"18,374","1,648","3,182 stars this week",https://github.com//gsd-build/get-shit-done,GitHub_JavaScript_weekly,2026-02-24 03:22:14
6,uptime-kuma,A fancy self-hosted monitoring tool,louislam,JavaScript,"83,164","7,435",312 stars this week,https://github.com//louislam/uptime-kuma,GitHub_JavaScript_weekly,2026-02-24 03:22:14
7,SillyTavern,LLM Frontend for Power Users.,Cohee1207,JavaScript,"23,447","4,776",295 stars this week,https://github.com//SillyTavern/SillyTavern,GitHub_JavaScript_weekly,2026-02-24 03:22:14
8,awesome-copilot,"Community-contributed instructions, prompts, and configurations to help you make the most of GitHub Copilot.",aaronpowell,JavaScript,"22,246","2,549",871 stars this week,https://github.com//github/awesome-copilot,GitHub_JavaScript_weekly,2026-02-24 03:22:14
9,eslint,Find and fix problems in your JavaScript code.,nzakas,JavaScript,"27,106","4,926",216 stars this week,https://github.com//eslint/eslint,GitHub_JavaScript_weekly,2026-02-24 03:22:14
10,github-readme-stats,⚡ Dynamically generated stats for your github readmes,qwerty541,JavaScript,"78,497","30,839",134 stars this week,https://github.com//anuraghazra/github-readme-stats,GitHub_JavaScript_weekly,2026-02-24 03:22:14
11,bruno,Opensource IDE For Exploring and Testing API's (lightweight alternative to Postman/Insomnia),helloanoop,JavaScript,"41,060","2,138",195 stars this week,https://github.com//usebruno/bruno,GitHub_JavaScript_weekly,2026-02-24 03:22:14
12,Cronicle,"A simple, distributed task scheduler and runner with a web based UI.",jhuckaby,JavaScript,"5,487",482,95 stars this week,https://github.com//jhuckaby/Cronicle,GitHub_JavaScript_weekly,2026-02-24 03:22:14
13,cli,"Command-line tool to customize Spotify client. Supports Windows, macOS, and Linux.",khanhas,JavaScript,"22,216",840,70 stars this week,https://github.com//spicetify/cli,GitHub_JavaScript_weekly,2026-02-24 03:22:14
