index,title,desc,author,language,stars,forks,today_forks,url,type,datetime
14,bazel,"a fast, scalable, multi-language and extensible build system",lberki,Java,"25,087","4,402",48 stars this week,https://github.com//bazelbuild/bazel,GitHub_Java_weekly,2026-02-06 10:53:45
15,PojavLauncher,A Minecraft: Java Edition Launcher for Android and iOS based on Boardwalk. Succeeded by https://github.com/AngelAuraMC/Amethyst-Android,khanhduytran0,Java,"8,671","1,825",23 stars this week,https://github.com//PojavLauncherTeam/PojavLauncher,GitHub_Java_weekly,2026-02-06 10:53:45
16,thingsboard,"Open-source IoT Platform - Device management, data collection, processing and visualization.",ikulikov,Java,"21,081","6,106",60 stars this week,https://github.com//thingsboard/thingsboard,GitHub_Java_weekly,2026-02-06 10:53:45
17,AppManager,A full-featured package manager and viewer for Android,MuntashirAkon,Java,"7,324",418,59 stars this week,https://github.com//MuntashirAkon/AppManager,GitHub_Java_weekly,2026-02-06 10:53:45
18,unitycatalog,"Open, Multi-modal Catalog for Data & AI",BenWilson2,Java,"3,300",581,17 stars this week,https://github.com//unitycatalog/unitycatalog,GitHub_Java_weekly,2026-02-06 10:53:45
19,gravitino,"World's most powerful open data catalog for building a high-performance, geo-distributed and federated metadata lake.",yuqi1129,Java,"2,761",721,48 stars this week,https://github.com//apache/gravitino,GitHub_Java_weekly,2026-02-06 10:53:45
20,OpenSearch,🔎 Open source distributed and RESTful search engine.,dependabot,Java,"12,333","2,393",45 stars this week,https://github.com//opensearch-project/OpenSearch,GitHub_Java_weekly,2026-02-06 10:53:45
21,LLD,All Code of LLD Playlist,adityatandon15,Java,638,446,18 stars this week,https://github.com//adityatandon15/LLD,GitHub_Java_weekly,2026-02-06 10:53:45
1,BitNet,Official inference framework for 1-bit LLMs,potassiummmm,Python,"27,928","2,270","2,054 stars this week",https://github.com//microsoft/BitNet,GitHub_Python_weekly,2026-02-06 10:53:45
2,kimi-cli,Kimi Code CLI is your next CLI agent.,stdrc,Python,"6,054",561,"1,226 stars this week",https://github.com//MoonshotAI/kimi-cli,GitHub_Python_weekly,2026-02-06 10:53:45
3,skills,Skills Catalog for Codex,gverma-openai,Python,"4,339",245,"1,887 stars this week",https://github.com//openai/skills,GitHub_Python_weekly,2026-02-06 10:53:45
4,agent-lightning,The absolute trainer to light up AI agents.,actions-user,Python,"14,114","1,187","2,206 stars this week",https://github.com//microsoft/agent-lightning,GitHub_Python_weekly,2026-02-06 10:53:45
5,memU,"Memory for 24/7 proactive agents like openclaw (moltbot, clawdbot).",sairin1202,Python,"7,889",601,"1,952 stars this week",https://github.com//NevaMind-AI/memU,GitHub_Python_weekly,2026-02-06 10:53:45
6,claude-code-hooks-mastery,Master Claude Code Hooks,disler,Python,"2,557",513,397 stars this week,https://github.com//disler/claude-code-hooks-mastery,GitHub_Python_weekly,2026-02-06 10:53:45
7,PageIndex,"📑 PageIndex: Document Index for Vectorless, Reasoning-based RAG",rejojer,Python,"13,630",985,"2,960 stars this week",https://github.com//VectifyAI/PageIndex,GitHub_Python_weekly,2026-02-06 10:53:45
8,nanochat,The best ChatGPT that $100 can buy.,karpathy,Python,"42,337","5,467","1,328 stars this week",https://github.com//karpathy/nanochat,GitHub_Python_weekly,2026-02-06 10:53:45
9,calibre,The official source code repository for the calibre ebook manager,kovidgoyal,Python,"24,020","2,551",551 stars this week,https://github.com//kovidgoyal/calibre,GitHub_Python_weekly,2026-02-06 10:53:45
10,ChatDev,ChatDev 2.0: Dev All through LLM-powered Multi-Agent Collaboration,thinkwee,Python,"30,347","3,748","1,215 stars this week",https://github.com//OpenBMB/ChatDev,GitHub_Python_weekly,2026-02-06 10:53:45
11,PaddleOCR,"Turn any PDF or image document into structured data for your AI. A powerful, lightweight OCR toolkit that bridges the gap between images/PDFs and LLMs. Supports 100+ languages.",LDOUBLEV,Python,"70,272","9,789","1,303 stars this week",https://github.com//PaddlePaddle/PaddleOCR,GitHub_Python_weekly,2026-02-06 10:53:45
12,chatgpt-on-wechat,CowAgent是基于大模型的超级AI助理，能主动思考和任务规划、访问操作系统和外部资源、创造和执行Skills、拥有长期记忆并不断成长。同时支持飞书、钉钉、企业微信应用、微信公众号、网页等接入，可选择OpenAI/Claude/Gemini/DeepSeek/ Qwen/GLM/Kimi/LinkAI，能处理文本、语音、图片和文件，可快速搭建个人AI助手和企业数字员工。,zhayujie,Python,"41,083","9,712",229 stars this week,https://github.com//zhayujie/chatgpt-on-wechat,GitHub_Python_weekly,2026-02-06 10:53:45
13,hrms,Open Source HR and Payroll Software,ruchamahabal,Python,"7,450","2,044",234 stars this week,https://github.com//frappe/hrms,GitHub_Python_weekly,2026-02-06 10:53:45
14,cognee,Memory for AI Agents in 6 lines of code,Vasilije1990,Python,"11,864","1,160",321 stars this week,https://github.com//topoteretes/cognee,GitHub_Python_weekly,2026-02-06 10:53:45
15,claude-skills,65 Specialized Skills for Full-Stack Developers. Transform Claude Code into your expert pair programmer.,Jeffallan,Python,297,33,122 stars this week,https://github.com//Jeffallan/claude-skills,GitHub_Python_weekly,2026-02-06 10:53:45
16,yt-dlp,A feature-rich command-line audio/video downloader,dstftw,Python,"145,962","11,824","1,261 stars this week",https://github.com//yt-dlp/yt-dlp,GitHub_Python_weekly,2026-02-06 10:53:45
1,qui,"A fast, single-binary qBittorrent web UI: manage multiple instances, automate torrent workflows, and cross-seed across trackers.",s0up4200,Go,"3,081",84,601 stars this week,https://github.com//autobrr/qui,GitHub_Go_weekly,2026-02-06 10:53:45
2,k3s,Lightweight Kubernetes,brandond,Go,"32,090","2,588",95 stars this week,https://github.com//k3s-io/k3s,GitHub_Go_weekly,2026-02-06 10:53:45
3,ingress-nginx,Ingress NGINX Controller for Kubernetes,aledbf,Go,"19,427","8,520",31 stars this week,https://github.com//kubernetes/ingress-nginx,GitHub_Go_weekly,2026-02-06 10:53:45
4,netbird,"Connect your devices into a secure WireGuard®-based overlay network with SSO, MFA and granular access controls.",mlsmaycon,Go,"22,207","1,084",862 stars this week,https://github.com//netbirdio/netbird,GitHub_Go_weekly,2026-02-06 10:53:45
5,vault,"A tool for secrets management, encryption as a service, and privileged access management",jefferai,Go,"34,968","4,587",429 stars this week,https://github.com//hashicorp/vault,GitHub_Go_weekly,2026-02-06 10:53:45
6,ollama,"Get up and running with Kimi-K2.5, GLM-4.7, DeepSeek, gpt-oss, Qwen, Gemma and other models.",mxyng,Go,"161,874","14,465",904 stars this week,https://github.com//ollama/ollama,GitHub_Go_weekly,2026-02-06 10:53:45
7,opentelemetry-collector-contrib,Contrib repository for the OpenTelemetry Collector,renovate,Go,"4,382","3,305",63 stars this week,https://github.com//open-telemetry/opentelemetry-collector-contrib,GitHub_Go_weekly,2026-02-06 10:53:45
8,axonhub,"⚡️ Open-source AI Gateway — Use any SDK to call 100+ LLMs. Built-in failover, load balancing, cost control & end-to-end tracing.",looplj,Go,"1,729",194,190 stars this week,https://github.com//looplj/axonhub,GitHub_Go_weekly,2026-02-06 10:53:45
9,tailscale,"The easiest, most secure way to use WireGuard and 2FA.",bradfitz,Go,"27,967","2,271",378 stars this week,https://github.com//tailscale/tailscale,GitHub_Go_weekly,2026-02-06 10:53:45
10,cloudflared,Cloudflare Tunnel client,chungthuang,Go,"12,931","1,166",109 stars this week,https://github.com//cloudflare/cloudflared,GitHub_Go_weekly,2026-02-06 10:53:45
11,terraform-provider-aws,The AWS Provider enables Terraform to manage AWS resources.,ewbankkit,Go,"10,733","9,939",18 stars this week,https://github.com//hashicorp/terraform-provider-aws,GitHub_Go_weekly,2026-02-06 10:53:45
12,Xray-core,"Xray, Penetrates Everything. Also the best v2ray-core. Where the magic happens. An open platform for various uses.",RPRX,Go,"34,812","4,928",333 stars this week,https://github.com//XTLS/Xray-core,GitHub_Go_weekly,2026-02-06 10:53:45
13,SafeLine,SafeLine is a self-hosted WAF(Web Application Firewall) / reverse proxy to protect your web apps from attacks and exploits.,xbingW,Go,"20,619","1,328",248 stars this week,https://github.com//chaitin/SafeLine,GitHub_Go_weekly,2026-02-06 10:53:45
14,CloudflareSpeedTest,🌩「自选优选 IP」测试 Cloudflare CDN 延迟和速度，获取最快 IP ！当然也支持其他 CDN / 多个解析 IP 的网站 ~,XIU2,Go,"24,572","4,790",153 stars this week,https://github.com//XIU2/CloudflareSpeedTest,GitHub_Go_weekly,2026-02-06 10:53:45
15,quic-go,A production-ready QUIC implementation in pure Go,marten-seemann,Go,"11,396","1,511",33 stars this week,https://github.com//quic-go/quic-go,GitHub_Go_weekly,2026-02-06 10:53:45
16,trivy,"Find vulnerabilities, misconfigurations, secrets, SBOM in containers, Kubernetes, code repositories, clouds and more",knqyf263,Go,"31,383","2,910",156 stars this week,https://github.com//aquasecurity/trivy,GitHub_Go_weekly,2026-02-06 10:53:45
17,crossplane,The Cloud Native Control Plane,negz,Go,"11,372","1,131",32 stars this week,https://github.com//crossplane/crossplane,GitHub_Go_weekly,2026-02-06 10:53:45
18,headscale,"An open source, self-hosted implementation of the Tailscale control server",kradalby,Go,"34,922","1,872",270 stars this week,https://github.com//juanfont/headscale,GitHub_Go_weekly,2026-02-06 10:53:45
19,llama-swap,"Reliable model swapping for any local OpenAI/Anthropic compatible server - llama.cpp, vllm, etc",mostlygeek,Go,"2,331",170,65 stars this week,https://github.com//mostlygeek/llama-swap,GitHub_Go_weekly,2026-02-06 10:53:45
1,unstructured,"Convert documents to structured data effortlessly. Unstructured is open-source ETL solution for transforming complex documents into clean, structured formats for language models. Visit our website to learn more about our enterprise grade Platform product for production grade workflows, partitioning, enrichments, chunking and embedding.",MthwRobinson,HTML,"13,895","1,153",82 stars this week,https://github.com//Unstructured-IO/unstructured,GitHub_HTML_weekly,2026-02-06 10:53:45
2,3x-ui,"Xray panel supporting multi-protocol multi-user expire day & traffic & IP limit (Vmess, Vless, Trojan, ShadowSocks, Wireguard, Tunnel, Mixed, HTTP, Tun)",MHSanaei,HTML,"29,794","5,843",479 stars this week,https://github.com//MHSanaei/3x-ui,GitHub_HTML_weekly,2026-02-06 10:53:45
3,tidytuesday,Official repo for the #tidytuesday project,jthomasmock,HTML,"7,962","2,546",18 stars this week,https://github.com//rfordatascience/tidytuesday,GitHub_HTML_weekly,2026-02-06 10:53:45
4,awesome-github-profile-readme-templates,This repository contains best profile readme's for your reference.,durgeshsamariya,HTML,"5,147","7,634",20 stars this week,https://github.com//durgeshsamariya/awesome-github-profile-readme-templates,GitHub_HTML_weekly,2026-02-06 10:53:45
5,garak,the LLM vulnerability scanner,leondz,HTML,"6,921",777,50 stars this week,https://github.com//NVIDIA/garak,GitHub_HTML_weekly,2026-02-06 10:53:45
6,Ask-out-your-Valentine,"A playful and interactive web experience for asking someone to be your Valentine, featuring charming GIFs and dynamic responses to 'Yes' and 'No' answers. Built with HTML, Tailwind CSS, and a sprinkle of JavaScript for interactivity.",CodeKageHQ,HTML,94,361,20 stars this week,https://github.com//CodeKageHQ/Ask-out-your-Valentine,GitHub_HTML_weekly,2026-02-06 10:53:45
7,awesome-compose,Awesome Docker Compose samples,glours,HTML,"43,771","8,001",123 stars this week,https://github.com//docker/awesome-compose,GitHub_HTML_weekly,2026-02-06 10:53:45
8,zphisher,An automated phishing tool with 30+ templates. This Tool is made for educational purpose only ! Author will not be responsible for any misuse of this toolkit !,htr-tech,HTML,"15,331","5,767",52 stars this week,https://github.com//htr-tech/zphisher,GitHub_HTML_weekly,2026-02-06 10:53:45
9,InstagramUnfollowers,Check if people follows you back on Instagram.,davidarroyo1234,HTML,"4,274",385,30 stars this week,https://github.com//davidarroyo1234/InstagramUnfollowers,GitHub_HTML_weekly,2026-02-06 10:53:45
10,AssetOpsBench,AssetOpsBench - Industry 4.0,ShuxinLin,HTML,946,139,68 stars this week,https://github.com//IBM/AssetOpsBench,GitHub_HTML_weekly,2026-02-06 10:53:45
11,fonts,"Font files available from Google Fonts, and a public issue tracker for all things Google Fonts",m4rc1e,HTML,"19,673","2,840",29 stars this week,https://github.com//google/fonts,GitHub_HTML_weekly,2026-02-06 10:53:45
12,Awesome-Linux-Software,🐧 A list of awesome Linux softwares,luong-komorebi,HTML,"24,851","2,167",41 stars this week,https://github.com//luong-komorebi/Awesome-Linux-Software,GitHub_HTML_weekly,2026-02-06 10:53:45
1,system_prompts_leaks,"Collection of extracted System Prompts from popular chatbots like ChatGPT, Claude & Gemini",asgeirtj,JavaScript,"30,305","4,870","3,094 stars this week",https://github.com//asgeirtj/system_prompts_leaks,GitHub_JavaScript_weekly,2026-02-06 10:53:45
2,playwright-cli,"CLI for common Playwright actions. Record and generate Playwright code, inspect selectors and take screenshots.",pavelfeldman,JavaScript,"2,280",93,620 stars this week,https://github.com//microsoft/playwright-cli,GitHub_JavaScript_weekly,2026-02-06 10:53:45
3,godot-mcp,"MCP server for interfacing with Godot game engine. Provides tools for launching the editor, running projects, and capturing debug output.",Coding-Solo,JavaScript,"1,677",184,94 stars this week,https://github.com//Coding-Solo/godot-mcp,GitHub_JavaScript_weekly,2026-02-06 10:53:45
4,edex-ui,"A cross-platform, customizable science fiction terminal emulator with advanced monitoring & touchscreen support.",GitSquared,JavaScript,"44,076","2,973",118 stars this week,https://github.com//GitSquared/edex-ui,GitHub_JavaScript_weekly,2026-02-06 10:53:45
5,Calibre-Web-Automated,Calibre-Web but Automated and with tons of New Features! Fully automate and simplify your eBook set up!,crocodilestick,JavaScript,"4,732",316,179 stars this week,https://github.com//crocodilestick/Calibre-Web-Automated,GitHub_JavaScript_weekly,2026-02-06 10:53:45
6,Acode,Acode - powerful text/code editor for android,bajrangCoder,JavaScript,"4,458",792,73 stars this week,https://github.com//Acode-Foundation/Acode,GitHub_JavaScript_weekly,2026-02-06 10:53:45
7,pixels,"Facilitates simple large scale processing of HLS Medical images, documents, zip files. OHIF Viewer, 2 segmentation models and interactive learning.",erinaldidb,JavaScript,323,105,107 stars this week,https://github.com//databricks-industry-solutions/pixels,GitHub_JavaScript_weekly,2026-02-06 10:53:45
8,claudecodeui,"Use Claude Code, Cursor CLI or Codex on mobile and web with CloudCLI (aka Claude Code UI). CloudCLI is a free open source webui/GUI that helps you manage your Claude Code session and projects remotely",viper151,JavaScript,"6,028",788,228 stars this week,https://github.com//siteboon/claudecodeui,GitHub_JavaScript_weekly,2026-02-06 10:53:45
9,whatsapp-web.js,A WhatsApp client library for NodeJS that connects through the WhatsApp Web browser app,pedroslopez,JavaScript,"21,096","4,865",439 stars this week,https://github.com//pedroslopez/whatsapp-web.js,GitHub_JavaScript_weekly,2026-02-06 10:53:45
10,drawio,"draw.io is a JavaScript, client-side editor for general diagramming.",davidjgraph,JavaScript,"3,496",630,88 stars this week,https://github.com//jgraph/drawio,GitHub_JavaScript_weekly,2026-02-06 10:53:45
11,Baileys,Socket-based TS/JavaScript API for WhatsApp Web,adiwajshing,JavaScript,"8,077","2,675",163 stars this week,https://github.com//WhiskeySockets/Baileys,GitHub_JavaScript_weekly,2026-02-06 10:53:45
12,awesome-copilot,"Community-contributed instructions, prompts, and configurations to help you make the most of GitHub Copilot.",aaronpowell,JavaScript,"20,291","2,332",773 stars this week,https://github.com//github/awesome-copilot,GitHub_JavaScript_weekly,2026-02-06 10:53:45
13,appscreen,Create screenshots for the iOS App Store,BlackMac,JavaScript,"1,368",138,396 stars this week,https://github.com//YUZU-Hub/appscreen,GitHub_JavaScript_weekly,2026-02-06 10:53:45
14,marktext,"📝A simple and elegant markdown editor, available for Linux, macOS and Windows.",Jocs,JavaScript,"53,684","3,969",165 stars this week,https://github.com//marktext/marktext,GitHub_JavaScript_weekly,2026-02-06 10:53:45
15,EmulatorJS,A web-based frontend for RetroArch,ethanaobrien,JavaScript,"3,055",827,297 stars this week,https://github.com//EmulatorJS/EmulatorJS,GitHub_JavaScript_weekly,2026-02-06 10:53:45
16,simple-icons,SVG icons for popular brands,PeterShaggyNoble,JavaScript,"24,397","3,039",116 stars this week,https://github.com//simple-icons/simple-icons,GitHub_JavaScript_weekly,2026-02-06 10:53:45
17,v86,"x86 PC emulator and x86-to-wasm JIT, running in the browser",copy,JavaScript,"22,149","1,692",27 stars this week,https://github.com//copy/v86,GitHub_JavaScript_weekly,2026-02-06 10:53:45
18,ez-tree,Procedural tree generator written with JavaScript and Three.js,dgreenheck,JavaScript,"1,139",141,122 stars this week,https://github.com//dgreenheck/ez-tree,GitHub_JavaScript_weekly,2026-02-06 10:53:45
19,Superalgos,"Free, open-source crypto trading bot, automated bitcoin / cryptocurrency trading software, algorithmic trading bots. Visually design your crypto trading bot, leveraging an integrated charting system, data-mining, backtesting, paper trading, and multi-server crypto bot deployments.",Luis-Fernando-Molina,JavaScript,"5,273","6,099",24 stars this week,https://github.com//Superalgos/Superalgos,GitHub_JavaScript_weekly,2026-02-06 10:53:45
20,mediacms,"MediaCMS is a modern, fully featured open source video and media CMS, written in Python/Django and React, featuring a REST API.",mgogoulos,JavaScript,"4,705",871,56 stars this week,https://github.com//mediacms-io/mediacms,GitHub_JavaScript_weekly,2026-02-06 10:53:45
1,UI-TARS-desktop,The Open-Source Multimodal AI Agent Stack: Connecting Cutting-Edge AI Models and Agent Infra,ulivz,TypeScript,"26,869","2,630",566 stars today,https://github.com//bytedance/UI-TARS-desktop,GitHub_TypeScript_daily,2026-02-06 15:11:19
2,skills,Skills Catalog for Codex,gverma-openai,Python,"4,455",249,621 stars today,https://github.com//openai/skills,GitHub_Python_daily,2026-02-06 15:11:19
3,claude-mem,"A Claude Code plugin that automatically captures everything Claude does during your coding sessions, compresses it with AI (using Claude's agent-sdk), and injects relevant context back into future sessions.",thedotmack,TypeScript,"23,914","1,579","1,930 stars today",https://github.com//thedotmack/claude-mem,GitHub_TypeScript_daily,2026-02-06 15:11:19
4,prek,"⚡ Better `pre-commit`, re-engineered in Rust",j178,Rust,"5,584",149,258 stars today,https://github.com//j178/prek,GitHub_Rust_daily,2026-02-06 15:11:19
5,cognee,Memory for AI Agents in 6 lines of code,Vasilije1990,Python,"11,906","1,166",74 stars today,https://github.com//topoteretes/cognee,GitHub_Python_daily,2026-02-06 15:11:19
6,superpowers,An agentic skills framework & software development methodology that works.,obra,Shell,"45,657","3,451",887 stars today,https://github.com//obra/superpowers,GitHub_Shell_daily,2026-02-06 15:11:19
7,trivy,"Find vulnerabilities, misconfigurations, secrets, SBOM in containers, Kubernetes, code repositories, clouds and more",knqyf263,Go,"31,411","2,914",25 stars today,https://github.com//aquasecurity/trivy,GitHub_Go_daily,2026-02-06 15:11:19
8,fish-shell,The user-friendly command line shell.,ridiculousfish,Rust,"32,426","2,219",28 stars today,https://github.com//fish-shell/fish-shell,GitHub_Rust_daily,2026-02-06 15:11:19
9,nvm,Node Version Manager - POSIX-compliant bash script to manage multiple active node.js versions,ljharb,Shell,"91,404","9,829",101 stars today,https://github.com//nvm-sh/nvm,GitHub_Shell_daily,2026-02-06 15:11:19
10,prompt-optimizer,一款提示词优化器，助力于编写高质量的提示词,linshenkx,TypeScript,"19,472","2,409",51 stars today,https://github.com//linshenkx/prompt-optimizer,GitHub_TypeScript_daily,2026-02-06 15:11:19
11,anet,Simple Rust VPN Client / Server,ZeroTworu,Rust,424,38,81 stars today,https://github.com//ZeroTworu/anet,GitHub_Rust_daily,2026-02-06 15:11:19
1,openclaw,Your own personal AI assistant. Any OS. Any Platform. The lobster way. 🦞,steipete,TypeScript,"168,992","27,025","68,757 stars this week",https://github.com//openclaw/openclaw,GitHub_TypeScript_weekly,2026-02-06 15:11:19
2,claude-mem,"A Claude Code plugin that automatically captures everything Claude does during your coding sessions, compresses it with AI (using Claude's agent-sdk), and injects relevant context back into future sessions.",thedotmack,TypeScript,"23,914","1,579","8,130 stars this week",https://github.com//thedotmack/claude-mem,GitHub_TypeScript_weekly,2026-02-06 15:11:19
3,system_prompts_leaks,"Collection of extracted System Prompts from popular chatbots like ChatGPT, Claude & Gemini",asgeirtj,JavaScript,"30,336","4,871","3,094 stars this week",https://github.com//asgeirtj/system_prompts_leaks,GitHub_JavaScript_weekly,2026-02-06 15:11:19
4,pi-mono,"AI agent toolkit: coding agent CLI, unified LLM API, TUI & web UI libraries, Slack bot, vLLM pods",badlogic,TypeScript,"7,356",744,"3,578 stars this week",https://github.com//badlogic/pi-mono,GitHub_TypeScript_weekly,2026-02-06 15:11:19
5,99,Neovim AI agent done right,ThePrimeagen,Lua,"3,378",154,"2,190 stars this week",https://github.com//ThePrimeagen/99,GitHub_Lua_weekly,2026-02-06 15:11:19
6,BitNet,Official inference framework for 1-bit LLMs,potassiummmm,Python,"27,939","2,270","2,054 stars this week",https://github.com//microsoft/BitNet,GitHub_Python_weekly,2026-02-06 15:11:19
7,kimi-cli,Kimi Code CLI is your next CLI agent.,stdrc,Python,"6,067",563,"1,226 stars this week",https://github.com//MoonshotAI/kimi-cli,GitHub_Python_weekly,2026-02-06 15:11:19
8,skills,Skills Catalog for Codex,gverma-openai,Python,"4,455",249,"1,887 stars this week",https://github.com//openai/skills,GitHub_Python_weekly,2026-02-06 15:11:19
9,playwright-cli,"CLI for common Playwright actions. Record and generate Playwright code, inspect selectors and take screenshots.",pavelfeldman,JavaScript,"2,296",93,620 stars this week,https://github.com//microsoft/playwright-cli,GitHub_JavaScript_weekly,2026-02-06 15:11:19
10,Maestro,Agent Orchestration Command Center,pedramamini,TypeScript,"1,843",171,"1,054 stars this week",https://github.com//pedramamini/Maestro,GitHub_TypeScript_weekly,2026-02-06 15:11:19
11,agent-lightning,The absolute trainer to light up AI agents.,actions-user,Python,"14,121","1,188","2,206 stars this week",https://github.com//microsoft/agent-lightning,GitHub_Python_weekly,2026-02-06 15:11:19
12,memU,"Memory for 24/7 proactive agents like openclaw (moltbot, clawdbot).",sairin1202,Python,"7,951",607,"1,952 stars this week",https://github.com//NevaMind-AI/memU,GitHub_Python_weekly,2026-02-06 15:11:19
13,claude-code-hooks-mastery,Master Claude Code Hooks,disler,Python,"2,568",516,397 stars this week,https://github.com//disler/claude-code-hooks-mastery,GitHub_Python_weekly,2026-02-06 15:11:19
14,PageIndex,"📑 PageIndex: Document Index for Vectorless, Reasoning-based RAG",rejojer,Python,"13,679",988,"2,960 stars this week",https://github.com//VectifyAI/PageIndex,GitHub_Python_weekly,2026-02-06 15:11:19
15,ext-apps,"Official repo for spec & SDK of MCP Apps protocol - standard for UIs embedded AI chatbots, served by MCP servers",ochafik,TypeScript,"1,385",153,614 stars this week,https://github.com//modelcontextprotocol/ext-apps,GitHub_TypeScript_weekly,2026-02-06 15:11:19
1,openclaw,Your own personal AI assistant. Any OS. Any Platform. The lobster way. 🦞,steipete,TypeScript,"168,992","27,025","164,864 stars this month",https://github.com//openclaw/openclaw,GitHub_TypeScript_monthly,2026-02-06 15:11:19
2,superpowers,An agentic skills framework & software development methodology that works.,obra,Shell,"45,657","3,451","31,332 stars this month",https://github.com//obra/superpowers,GitHub_Shell_monthly,2026-02-06 15:11:19
3,opencode,The open source coding agent.,thdxr,TypeScript,"98,714","9,351","49,728 stars this month",https://github.com//anomalyco/opencode,GitHub_TypeScript_monthly,2026-02-06 15:11:19
4,ralph-claude-code,Autonomous AI development loop for Claude Code with intelligent exit detection,frankbria,Shell,"6,375",443,"5,951 stars this month",https://github.com//frankbria/ralph-claude-code,GitHub_Shell_monthly,2026-02-06 15:11:19
5,skills,Public repository for Agent Skills,klazuka,Python,"64,281","6,350","30,463 stars this month",https://github.com//anthropics/skills,GitHub_Python_monthly,2026-02-06 15:11:19
6,PageIndex,"📑 PageIndex: Document Index for Vectorless, Reasoning-based RAG",rejojer,Python,"13,679",988,"8,994 stars this month",https://github.com//VectifyAI/PageIndex,GitHub_Python_monthly,2026-02-06 15:11:19
7,oh-my-opencode,The Best Agent Harness. Meet Sisyphus: The Batteries-Included Agent that codes like you.,code-yeongyu,TypeScript,"28,669","2,113","20,198 stars this month",https://github.com//code-yeongyu/oh-my-opencode,GitHub_TypeScript_monthly,2026-02-06 15:11:19
8,pi-mono,"AI agent toolkit: coding agent CLI, unified LLM API, TUI & web UI libraries, Slack bot, vLLM pods",badlogic,TypeScript,"7,356",744,"5,773 stars this month",https://github.com//badlogic/pi-mono,GitHub_TypeScript_monthly,2026-02-06 15:11:19
9,remotion,🎥 Make videos programmatically with React,JonnyBurger,TypeScript,"35,218","2,137","10,016 stars this month",https://github.com//remotion-dev/remotion,GitHub_TypeScript_monthly,2026-02-06 15:11:19
