index,title,desc,author,language,stars,forks,today_forks,url,type,datetime
4,OpenClash,A Clash Client For OpenWrt,vernesong,HTML,"23,404","3,677",119 stars this week,https://github.com//vernesong/OpenClash,GitHub_HTML_weekly,2026-01-04 14:48:52
5,UsbGpib,"Versatile, cheap and portable USB to GPIB converter (USBTMC class based)",xyphro,HTML,551,76,70 stars this week,https://github.com//xyphro/UsbGpib,GitHub_HTML_weekly,2026-01-04 14:48:52
6,FreeDomain,DigitalPlat FreeDomain: Free Domain For Everyone,EdwardLab,HTML,"137,039","2,438","2,505 stars this week",https://github.com//DigitalPlatDev/FreeDomain,GitHub_HTML_weekly,2026-01-04 14:48:52
7,ArkOS-R3XS,Community Maintained Image of ArkOS for the RetroBox Console / Game Station / Game Consoie R35S / R36S / PowKiddy RGB20S,AeolusUX,HTML,"1,320",51,31 stars this week,https://github.com//AeolusUX/ArkOS-R3XS,GitHub_HTML_weekly,2026-01-04 14:48:52
8,home-assistant.io,📘 Home Assistant User documentation,frenck,HTML,"7,746","8,050",37 stars this week,https://github.com//home-assistant/home-assistant.io,GitHub_HTML_weekly,2026-01-04 14:48:52
9,computer-science,🎓 Path to a free self-taught education in Computer Science!,ericdouglas,HTML,"199,779","24,859",320 stars this week,https://github.com//ossu/computer-science,GitHub_HTML_weekly,2026-01-04 14:48:52
10,blog_os,Writing an OS in Rust,phil-opp,HTML,"17,180","1,189",24 stars this week,https://github.com//phil-opp/blog_os,GitHub_HTML_weekly,2026-01-04 14:48:52
11,Evil-M5Project,"Evil-M5Project is an innovative tool developed for ethical hacking and exploration of WiFi networks. It's compatible with Cardputer, Atoms3, Fire, core2. You can scan, monitor, and interact with WiFi networks in a controlled environment. This project is designed for educational purposes, aiding in understanding network security and vulnerabilities",7h30th3r0n3,HTML,"1,787",176,32 stars this week,https://github.com//7h30th3r0n3/Evil-M5Project,GitHub_HTML_weekly,2026-01-04 14:48:52
12,n8n-docs,"Documentation for n8n, a fair-code licensed automation tool with a free community edition and powerful enterprise options. Build AI functionality into your workflows.",tanay1337,HTML,"1,364","3,399",16 stars this week,https://github.com//n8n-io/n8n-docs,GitHub_HTML_weekly,2026-01-04 14:48:52
13,wanderer,wanderer is a self-hosted trail database. Save your adventures!,Flomp,HTML,"3,236",141,36 stars this week,https://github.com//Flomp/wanderer,GitHub_HTML_weekly,2026-01-04 14:48:52
14,NetherSX2-patch,Continuation of NetherSX2 based on AetherSX2 4248,Trixarian,HTML,"1,843",68,29 stars this week,https://github.com//Trixarian/NetherSX2-patch,GitHub_HTML_weekly,2026-01-04 14:48:52
1,cs249r_book,Introduction to Machine Learning Systems,profvjreddi,JavaScript,"15,077","1,715","3,439 stars this week",https://github.com//harvard-edge/cs249r_book,GitHub_JavaScript_weekly,2026-01-04 14:48:52
2,uptime-kuma,A fancy self-hosted monitoring tool,louislam,JavaScript,"80,757","7,199",524 stars this week,https://github.com//louislam/uptime-kuma,GitHub_JavaScript_weekly,2026-01-04 14:48:52
3,ToolJet,"ToolJet is the open-source foundation of ToolJet AI - the AI-native platform for building internal tools, dashboard, business applications, workflows and AI agents 🚀",Navaneeth-pk,JavaScript,"37,110","4,916",49 stars this week,https://github.com//ToolJet/ToolJet,GitHub_JavaScript_weekly,2026-01-04 14:48:52
4,github-readme-stats,⚡ Dynamically generated stats for your github readmes,qwerty541,JavaScript,"77,771","28,868",162 stars this week,https://github.com//anuraghazra/github-readme-stats,GitHub_JavaScript_weekly,2026-01-04 14:48:52
5,desktop,Welcome to a calmer internet,mr-cheffy,JavaScript,"39,227","1,258",354 stars this week,https://github.com//zen-browser/desktop,GitHub_JavaScript_weekly,2026-01-04 14:48:52
6,express,"Fast, unopinionated, minimalist web framework for node.",tj,JavaScript,"68,478","22,030",48 stars this week,https://github.com//expressjs/express,GitHub_JavaScript_weekly,2026-01-04 14:48:52
7,openmtp,OpenMTP - Advanced Android File Transfer Application for macOS,ganeshrvel,JavaScript,"5,954",241,71 stars this week,https://github.com//ganeshrvel/openmtp,GitHub_JavaScript_weekly,2026-01-04 14:48:52
8,GDevelop,"🎮 Open-source, cross-platform 2D/3D/multiplayer game engine designed for everyone.",4ian,JavaScript,"19,054","1,208",230 stars this week,https://github.com//4ian/GDevelop,GitHub_JavaScript_weekly,2026-01-04 14:48:52
9,AIClient-2-API,"Simulates Gemini CLI, Antigravity, Qwen Code, and Kiro client requests, compatible with the OpenAI API. It supports thousands of Gemini model requests per day and offers free use of the built-in Claude model in Kiro. Easily connect to any client via the API, making AI development more efficient!",justlikemaki,JavaScript,"2,206",347,162 stars this week,https://github.com//justlovemaki/AIClient-2-API,GitHub_JavaScript_weekly,2026-01-04 14:48:52
10,tvbox,OK影视、tvbox配置文件，如果喜欢，请Fork自用。使用前请仔细阅读仓库说明，一旦使用将被视为你已了解。,gaotianliuyun,JavaScript,"7,336","2,777",98 stars this week,https://github.com//qist/tvbox,GitHub_JavaScript_weekly,2026-01-04 14:48:52
11,no-as-a-service,"No-as-a-Service (NaaS) is a simple API that returns a random rejection reason. Use it when you need a realistic excuse, a fun “no,” or want to simulate being turned down in style.",hotheadhacker,JavaScript,"4,606",272,488 stars this week,https://github.com//hotheadhacker/no-as-a-service,GitHub_JavaScript_weekly,2026-01-04 14:48:52
12,OpenSign,🔥 The free & Open Source DocuSign alternative,prafull-opensignlabs,JavaScript,"5,755",606,214 stars this week,https://github.com//OpenSignLabs/OpenSign,GitHub_JavaScript_weekly,2026-01-04 14:48:52
1,OpenBB,"Financial data platform for analysts, quants and AI agents.",jmaslek,Python,"56,648","5,510",440 stars today,https://github.com//OpenBB-finance/OpenBB,GitHub_Python_daily,2026-01-04 21:00:50
2,openai-cookbook,Examples and guides for using the OpenAI API,ted-at-openai,Jupyter Notebook,"70,526","11,835",43 stars today,https://github.com//openai/openai-cookbook,GitHub_Jupyter Notebook_daily,2026-01-04 21:00:50
3,nocodb,🔥 🔥 🔥 Open Source Airtable Alternative,o1lab,TypeScript,"60,452","4,497",375 stars today,https://github.com//nocodb/nocodb,GitHub_TypeScript_daily,2026-01-04 21:00:50
4,docker-android,🤖 A minimal and customizable Docker image running the Android emulator as a service.,HQarroum,Shell,"2,348",140,410 stars today,https://github.com//HQarroum/docker-android,GitHub_Shell_daily,2026-01-04 21:00:50
5,memos,"An open-source, self-hosted note-taking service. Your thoughts, your data, your control — no tracking, no ads, no subscription fees.",boojack,Go,"50,986","3,673","1,799 stars today",https://github.com//usememos/memos,GitHub_Go_daily,2026-01-04 21:00:50
6,ai-hedge-fund,An AI Hedge Fund Team,virattt,Python,"44,437","7,844",88 stars today,https://github.com//virattt/ai-hedge-fund,GitHub_Python_daily,2026-01-04 21:00:50
7,newsnow,Elegant reading of real-time and hottest news,ourongxing,TypeScript,"16,503","4,795",332 stars today,https://github.com//ourongxing/newsnow,GitHub_TypeScript_daily,2026-01-04 21:00:50
8,opencode,The open source coding agent.,thdxr,TypeScript,"47,048","4,043",990 stars today,https://github.com//anomalyco/opencode,GitHub_TypeScript_daily,2026-01-04 21:00:50
9,seanime,Open-source media server with a web interface and desktop app for anime and manga.,5rahim,Go,"1,902",131,406 stars today,https://github.com//5rahim/seanime,GitHub_Go_daily,2026-01-04 21:00:50
10,cpython,The Python programming language,gvanrossum,Python,"70,619","33,814",27 stars today,https://github.com//python/cpython,GitHub_Python_daily,2026-01-04 21:00:50
1,vibe-kanban,"Get 10X more out of Claude Code, Codex or any coding agent",stunningpixels,Rust,"12,313","1,137","4,973 stars this week",https://github.com//BloopAI/vibe-kanban,GitHub_Rust_weekly,2026-01-04 21:00:50
2,memos,"An open-source, self-hosted note-taking service. Your thoughts, your data, your control — no tracking, no ads, no subscription fees.",boojack,Go,"50,986","3,673","1,996 stars this week",https://github.com//usememos/memos,GitHub_Go_weekly,2026-01-04 21:00:50
3,SpotiFLAC,"Get Spotify tracks in true FLAC from Tidal, Qobuz & Amazon Music — no account required.",afkarxyz,TypeScript,"2,243",128,"1,418 stars this week",https://github.com//afkarxyz/SpotiFLAC,GitHub_TypeScript_weekly,2026-01-04 21:00:50
4,cs249r_book,Introduction to Machine Learning Systems,profvjreddi,JavaScript,"15,120","1,721","3,439 stars this week",https://github.com//harvard-edge/cs249r_book,GitHub_JavaScript_weekly,2026-01-04 21:00:50
5,chatterbox,SoTA open-source TTS,fatchord,Python,"20,522","2,677","2,328 stars this week",https://github.com//resemble-ai/chatterbox,GitHub_Python_weekly,2026-01-04 21:00:50
6,gumroad,Sell stuff and see what sticks,devin-ai-integration,Ruby,"8,119","1,564",272 stars this week,https://github.com//antiwork/gumroad,GitHub_Ruby_weekly,2026-01-04 21:00:50
7,Personal_AI_Infrastructure,Personal AI Infrastructure for upgrading humans.,danielmiessler,TypeScript,"3,200",573,769 stars this week,https://github.com//danielmiessler/Personal_AI_Infrastructure,GitHub_TypeScript_weekly,2026-01-04 21:00:50
8,metube,Self-hosted YouTube downloader (web UI for youtube-dl / yt-dlp),alexta69,Python,"11,955",810,652 stars this week,https://github.com//alexta69/metube,GitHub_Python_weekly,2026-01-04 21:00:50
9,computer-use-preview,,sammccauley117,Python,"2,520",321,537 stars this week,https://github.com//google-gemini/computer-use-preview,GitHub_Python_weekly,2026-01-04 21:00:50
1,claude-mem,"A Claude Code plugin that automatically captures everything Claude does during your coding sessions, compresses it with AI (using Claude's agent-sdk), and injects relevant context back into future sessions.",thedotmack,TypeScript,"10,184",622,"9,616 stars this month",https://github.com//thedotmack/claude-mem,GitHub_TypeScript_monthly,2026-01-04 21:00:50
2,VibeVoice,Open-Source Frontier Voice AI,YaoyaoChang,Python,"19,459","2,160","9,365 stars this month",https://github.com//microsoft/VibeVoice,GitHub_Python_monthly,2026-01-04 21:00:50
3,next-ai-draw-io,"A next.js web application that integrates AI capabilities with draw.io diagrams. This app allows you to create, modify, and enhance diagrams through natural language commands and AI-assisted visualization.",DayuanJiang,TypeScript,"16,658","1,715","14,163 stars this month",https://github.com//DayuanJiang/next-ai-draw-io,GitHub_TypeScript_monthly,2026-01-04 21:00:50
4,exo,Run your own AI cluster at home with everyday devices 📱💻 🖥️⌚,AlexCheema,Python,"39,360","2,658","6,763 stars this month",https://github.com//exo-explore/exo,GitHub_Python_monthly,2026-01-04 21:00:50
5,vibe-kanban,"Get 10X more out of Claude Code, Codex or any coding agent",stunningpixels,Rust,"12,313","1,137","5,578 stars this month",https://github.com//BloopAI/vibe-kanban,GitHub_Rust_monthly,2026-01-04 21:00:50
6,opencode,The open source coding agent.,thdxr,TypeScript,"47,048","4,043","11,263 stars this month",https://github.com//anomalyco/opencode,GitHub_TypeScript_monthly,2026-01-04 21:00:50
7,chatterbox,SoTA open-source TTS,fatchord,Python,"20,522","2,677","5,600 stars this month",https://github.com//resemble-ai/chatterbox,GitHub_Python_monthly,2026-01-04 21:00:50
8,WeKnora,"LLM-powered framework for deep document understanding, semantic retrieval, and context-aware answers using RAG paradigm.",lyingbug,Go,"10,860","1,166","3,097 stars this month",https://github.com//Tencent/WeKnora,GitHub_Go_monthly,2026-01-04 21:00:50
9,claude-code,"Claude Code is an agentic coding tool that lives in your terminal, understands your codebase, and helps you code faster by executing routine tasks, explaining complex code, and handling git workflows - all through natural language commands.",actions-user,Shell,"50,979","3,656","6,425 stars this month",https://github.com//anthropics/claude-code,GitHub_Shell_monthly,2026-01-04 21:00:50
10,agents.md,"AGENTS.md — a simple, open format for guiding coding agents",romainhuet,TypeScript,"14,070",993,"5,262 stars this month",https://github.com//agentsmd/agents.md,GitHub_TypeScript_monthly,2026-01-04 21:00:50
11,sim,Open-source platform to build and deploy AI agent workflows.,waleedlatif1,TypeScript,"24,924","3,113","6,387 stars this month",https://github.com//simstudioai/sim,GitHub_TypeScript_monthly,2026-01-04 21:00:50
12,hello-agents,📚 《从零开始构建智能体》——从零开始的智能体原理与实践教程,jjyaoao,Python,"14,134","1,504","8,456 stars this month",https://github.com//datawhalechina/hello-agents,GitHub_Python_monthly,2026-01-04 21:00:50
13,skills,Public repository for Agent Skills,klazuka,Python,"32,782","2,969","13,018 stars this month",https://github.com//anthropics/skills,GitHub_Python_monthly,2026-01-04 21:00:50
14,cutile-python,cuTile is a programming model for writing parallel kernels for NVIDIA GPUs,haijieg,Python,"1,730",88,"1,733 stars this month",https://github.com//NVIDIA/cutile-python,GitHub_Python_monthly,2026-01-04 21:00:50
15,Personal_AI_Infrastructure,Personal AI Infrastructure for upgrading humans.,danielmiessler,TypeScript,"3,200",573,"1,854 stars this month",https://github.com//danielmiessler/Personal_AI_Infrastructure,GitHub_TypeScript_monthly,2026-01-04 21:00:50
1,vibe-kanban,"Get 10X more out of Claude Code, Codex or any coding agent",stunningpixels,Rust,"12,313","1,137","4,973 stars this week",https://github.com//BloopAI/vibe-kanban,GitHub_Rust_weekly,2026-01-04 21:00:50
2,memos,"An open-source, self-hosted note-taking service. Your thoughts, your data, your control — no tracking, no ads, no subscription fees.",boojack,Go,"50,986","3,673","1,996 stars this week",https://github.com//usememos/memos,GitHub_Go_weekly,2026-01-04 21:00:50
3,SpotiFLAC,"Get Spotify tracks in true FLAC from Tidal, Qobuz & Amazon Music — no account required.",afkarxyz,TypeScript,"2,243",128,"1,418 stars this week",https://github.com//afkarxyz/SpotiFLAC,GitHub_TypeScript_weekly,2026-01-04 21:00:50
4,cs249r_book,Introduction to Machine Learning Systems,profvjreddi,JavaScript,"15,120","1,721","3,439 stars this week",https://github.com//harvard-edge/cs249r_book,GitHub_JavaScript_weekly,2026-01-04 21:00:50
5,chatterbox,SoTA open-source TTS,fatchord,Python,"20,522","2,677","2,328 stars this week",https://github.com//resemble-ai/chatterbox,GitHub_Python_weekly,2026-01-04 21:00:50
6,gumroad,Sell stuff and see what sticks,devin-ai-integration,Ruby,"8,119","1,564",272 stars this week,https://github.com//antiwork/gumroad,GitHub_Ruby_weekly,2026-01-04 21:00:50
7,Personal_AI_Infrastructure,Personal AI Infrastructure for upgrading humans.,danielmiessler,TypeScript,"3,200",573,769 stars this week,https://github.com//danielmiessler/Personal_AI_Infrastructure,GitHub_TypeScript_weekly,2026-01-04 21:00:50
8,metube,Self-hosted YouTube downloader (web UI for youtube-dl / yt-dlp),alexta69,Python,"11,955",810,652 stars this week,https://github.com//alexta69/metube,GitHub_Python_weekly,2026-01-04 21:00:50
9,computer-use-preview,,sammccauley117,Python,"2,520",321,537 stars this week,https://github.com//google-gemini/computer-use-preview,GitHub_Python_weekly,2026-01-04 21:00:50
1,termux-app,Termux - a terminal emulator application for Android OS extendible by variety of packages.,agnostic-apollo,Java,"48,439","5,789",254 stars this week,https://github.com//termux/termux-app,GitHub_Java_weekly,2026-01-04 21:00:50
2,Create,[NeoForge Mod] Building Tools and Aesthetic Technology,simibubi,Java,"3,885","1,191",17 stars this week,https://github.com//Creators-of-Create/Create,GitHub_Java_weekly,2026-01-04 21:00:50
3,voxy,An LoD rendering mod for minecraft,MCRcortex,Java,603,147,65 stars this week,https://github.com//MCRcortex/voxy,GitHub_Java_weekly,2026-01-04 21:00:50
4,mockito,Most popular Mocking framework for unit tests written in Java,mockitoguy,Java,"15,384","2,648",43 stars this week,https://github.com//mockito/mockito,GitHub_Java_weekly,2026-01-04 21:00:50
5,Paper,"The most widely used, high performance Minecraft server that aims to fix gameplay and mechanics inconsistencies",Machine-Maker,Java,"11,815","3,193",25 stars this week,https://github.com//PaperMC/Paper,GitHub_Java_weekly,2026-01-04 21:00:50
6,PojavLauncher,A Minecraft: Java Edition Launcher for Android and iOS based on Boardwalk. Succeeded by https://github.com/AngelAuraMC/Amethyst-Android,khanhduytran0,Java,"8,599","1,791",19 stars this week,https://github.com//PojavLauncherTeam/PojavLauncher,GitHub_Java_weekly,2026-01-04 21:00:50
7,lawnchair,No clever tagline needed.,sunnygoyal,Java,"11,749","1,412",65 stars this week,https://github.com//LawnchairLauncher/lawnchair,GitHub_Java_weekly,2026-01-04 21:00:50
8,thingsboard,"Open-source IoT Platform - Device management, data collection, processing and visualization.",ikulikov,Java,"20,874","6,012",185 stars this week,https://github.com//thingsboard/thingsboard,GitHub_Java_weekly,2026-01-04 21:00:50
9,kestra,Event Driven Orchestration & Scheduling Platform for Mission Critical Applications,tchiotludo,Java,"26,214","2,430",93 stars this week,https://github.com//kestra-io/kestra,GitHub_Java_weekly,2026-01-04 21:00:50
10,awesome-leetcode-resources,Awesome LeetCode resources to learn Data Structures and Algorithms and prepare for Coding Interviews.,ashishps1,Java,"14,970","3,275",170 stars this week,https://github.com//ashishps1/awesome-leetcode-resources,GitHub_Java_weekly,2026-01-04 21:00:50
11,GhidraMCP,MCP Server for Ghidra,LaurieWired,Java,"6,986",557,159 stars this week,https://github.com//LaurieWired/GhidraMCP,GitHub_Java_weekly,2026-01-04 21:00:50
12,himarket,"HiMarket is an enterprise-level ""AI Capability Marketplace and Developer Ecosystem Hub."" It is not merely a simple aggregation of traditional APIs, but rather a comprehensive platform that packages, publishes, manages, and operates core AI assets such as enterprise Model APIs, MCP Servers, Agent APIs, etc., through standardized product formats.",learnerjohn,Java,574,89,85 stars this week,https://github.com//higress-group/himarket,GitHub_Java_weekly,2026-01-04 21:00:50
13,DSA-Bootcamp-Java,"This repository consists of the code samples, assignments, and notes for the Java data structures & algorithms + interview preparation bootcamp of WeMakeDevs.",kunal-kushwaha,Java,"21,506","12,900",82 stars this week,https://github.com//kunal-kushwaha/DSA-Bootcamp-Java,GitHub_Java_weekly,2026-01-04 21:00:50
14,Xed-Editor,Advanced Text Editor for Android,RohitKushvaha01,Java,"1,468",88,74 stars this week,https://github.com//Xed-Editor/Xed-Editor,GitHub_Java_weekly,2026-01-04 21:00:50
15,fabric-example-mod,Example Fabric mod,modmuss50,Java,"2,066","1,184",10 stars this week,https://github.com//FabricMC/fabric-example-mod,GitHub_Java_weekly,2026-01-04 21:00:50
16,NewPipe,A libre lightweight streaming front-end for Android.,Stypox,Java,"36,126","3,359",104 stars this week,https://github.com//TeamNewPipe/NewPipe,GitHub_Java_weekly,2026-01-04 21:00:50
17,meteor-client,Based Minecraft utility mod.,MineGame159,Java,"3,153","1,293",23 stars this week,https://github.com//MeteorDevelopment/meteor-client,GitHub_Java_weekly,2026-01-04 21:00:50
18,guava,Google core libraries for Java,cpovirk,Java,"51,393","11,127",35 stars this week,https://github.com//google/guava,GitHub_Java_weekly,2026-01-04 21:00:50
19,Telegram,Telegram for Android source,xaxtix,Java,"28,257","9,176",74 stars this week,https://github.com//DrKLO/Telegram,GitHub_Java_weekly,2026-01-04 21:00:50
20,AutoJs6,安卓平台 JavaScript 自动化工具 (Auto.js 二次开发项目),clearw5,Java,"5,151","1,481",47 stars this week,https://github.com//SuperMonster003/AutoJs6,GitHub_Java_weekly,2026-01-04 21:00:50
1,chatterbox,SoTA open-source TTS,fatchord,Python,"20,522","2,677","2,328 stars this week",https://github.com//resemble-ai/chatterbox,GitHub_Python_weekly,2026-01-04 21:00:50
2,metube,Self-hosted YouTube downloader (web UI for youtube-dl / yt-dlp),alexta69,Python,"11,955",810,652 stars this week,https://github.com//alexta69/metube,GitHub_Python_weekly,2026-01-04 21:00:50
3,computer-use-preview,,sammccauley117,Python,"2,520",321,537 stars this week,https://github.com//google-gemini/computer-use-preview,GitHub_Python_weekly,2026-01-04 21:00:50
4,skills,Public repository for Agent Skills,klazuka,Python,"32,782","2,969","4,377 stars this week",https://github.com//anthropics/skills,GitHub_Python_weekly,2026-01-04 21:00:50
5,olmocr,Toolkit for linearizing PDFs for LLM datasets/training,jakep-allenai,Python,"16,567","1,304",187 stars this week,https://github.com//allenai/olmocr,GitHub_Python_weekly,2026-01-04 21:00:50
6,LEANN,"RAG on Everything with LEANN. Enjoy 97% storage savings while running a fast, accurate, and 100% private RAG application on your personal device.",yichuan-w,Python,"8,045",722,"1,471 stars this week",https://github.com//yichuan-w/LEANN,GitHub_Python_weekly,2026-01-04 21:00:50
7,faster-whisper,Faster Whisper transcription with CTranslate2,guillaumekln,Python,"20,168","1,683",494 stars this week,https://github.com//SYSTRAN/faster-whisper,GitHub_Python_weekly,2026-01-04 21:00:50
8,OpenBB,"Financial data platform for analysts, quants and AI agents.",jmaslek,Python,"56,648","5,510",582 stars this week,https://github.com//OpenBB-finance/OpenBB,GitHub_Python_weekly,2026-01-04 21:00:50
9,mealie,Mealie is a self hosted recipe manager and meal planner with a RestAPI backend and a reactive frontend application built in Vue for a pleasant user experience for the whole family. Easily add recipes into your database by providing the url and mealie will automatically import the relevant data or add a family recipe with the UI editor,hay-kot,Python,"11,010","1,080",108 stars this week,https://github.com//mealie-recipes/mealie,GitHub_Python_weekly,2026-01-04 21:00:50
10,claude-code-templates,CLI tool for configuring and monitoring Claude Code,davila7,Python,"14,582","1,257",622 stars this week,https://github.com//davila7/claude-code-templates,GitHub_Python_weekly,2026-01-04 21:00:50
11,docker-android,Android in docker solution with noVNC supported and video recording,budtmo,Python,"13,904","1,613",129 stars this week,https://github.com//budtmo/docker-android,GitHub_Python_weekly,2026-01-04 21:00:50
12,agents,Trade autonomously on Polymarket using AI Agents,alexnicita,Python,"1,572",403,557 stars this week,https://github.com//Polymarket/agents,GitHub_Python_weekly,2026-01-04 21:00:50
13,pathway,"Python ETL framework for stream processing, real-time analytics, LLM pipelines, and RAG.",Pathway-Dev,Python,"56,266","1,538","4,849 stars this week",https://github.com//pathwaycom/pathway,GitHub_Python_weekly,2026-01-04 21:00:50
1,memos,"An open-source, self-hosted note-taking service. Your thoughts, your data, your control — no tracking, no ads, no subscription fees.",boojack,Go,"50,986","3,673","1,996 stars this week",https://github.com//usememos/memos,GitHub_Go_weekly,2026-01-04 21:00:50
2,age,"A simple, modern and secure encryption tool (and Go library) with small explicit keys, no config options, and UNIX-style composability.",FiloSottile,Go,"20,812",596,321 stars this week,https://github.com//FiloSottile/age,GitHub_Go_weekly,2026-01-04 21:00:50
3,netbird,"Connect your devices into a secure WireGuard®-based overlay network with SSO, MFA and granular access controls.",mlsmaycon,Go,"20,645","1,003",269 stars this week,https://github.com//netbirdio/netbird,GitHub_Go_weekly,2026-01-04 21:00:50
4,Fabric,Fabric is an open-source framework for augmenting humans using AI. It provides a modular system for solving specific problems using a crowdsourced set of AI prompts that can be used anywhere.,danielmiessler,Go,"37,702","3,773",743 stars this week,https://github.com//danielmiessler/Fabric,GitHub_Go_weekly,2026-01-04 21:00:50
5,hugo,The world’s fastest framework for building websites.,bep,Go,"85,777","8,159",197 stars this week,https://github.com//gohugoio/hugo,GitHub_Go_weekly,2026-01-04 21:00:50
6,homebox,A continuation of HomeBox the inventory and organization system built for the Home User,weblate,Go,"4,734",299,156 stars this week,https://github.com//sysadminsmedia/homebox,GitHub_Go_weekly,2026-01-04 21:00:50
7,go-ios,"This is an operating system independent implementation of iOS device features. You can run UI tests, launch or kill apps, install apps etc. with it.",danielpaulus,Go,"1,707",276,218 stars this week,https://github.com//danielpaulus/go-ios,GitHub_Go_weekly,2026-01-04 21:00:50
8,oh-my-posh,The most customisable and low-latency cross platform/shell prompt renderer,JanDeDobbeleer,Go,"21,095","2,653",136 stars this week,https://github.com//JanDeDobbeleer/oh-my-posh,GitHub_Go_weekly,2026-01-04 21:00:50
9,axonhub,"AxonHub is a modern AI gateway system that provides a unified OpenAI ( Chat Completion, Responses), Anthropic, Gemini and AI SDK compatible API",looplj,Go,"1,212",141,224 stars this week,https://github.com//looplj/axonhub,GitHub_Go_weekly,2026-01-04 21:00:50
10,dagger,An open-source runtime for composable workflows. Great for AI agents and CI/CD.,aluzzardi,Go,"15,225",840,64 stars this week,https://github.com//dagger/dagger,GitHub_Go_weekly,2026-01-04 21:00:50
11,awesome-go,"A curated list of awesome Go frameworks, libraries and software",avelino,Go,"161,725","12,870",654 stars this week,https://github.com//avelino/awesome-go,GitHub_Go_weekly,2026-01-04 21:00:50
12,beszel,"Lightweight server monitoring hub with historical data, docker stats, and alerts.",henrygd,Go,"18,300",582,312 stars this week,https://github.com//henrygd/beszel,GitHub_Go_weekly,2026-01-04 21:00:50
