index,title,desc,author,language,stars,forks,today_forks,url,type,datetime
8,zoraxy,A general purpose HTTP reverse proxy and forwarding tool. Now written in Go!,tobychui,HTML,"4,790",268,68 stars this week,https://github.com//tobychui/zoraxy,GitHub_HTML_weekly,2026-01-03 10:20:57
9,ArkOS-R3XS,Community Maintained Image of ArkOS for the RetroBox Console / Game Station / Game Consoie R35S / R36S / PowKiddy RGB20S,AeolusUX,HTML,"1,318",49,32 stars this week,https://github.com//AeolusUX/ArkOS-R3XS,GitHub_HTML_weekly,2026-01-03 10:20:57
10,hugo-theme-stack,Card-style Hugo theme designed for bloggers,CaiJimmy,HTML,"6,169","1,950",26 stars this week,https://github.com//CaiJimmy/hugo-theme-stack,GitHub_HTML_weekly,2026-01-03 10:20:57
11,home-assistant.io,📘 Home Assistant User documentation,frenck,HTML,"7,743","8,049",37 stars this week,https://github.com//home-assistant/home-assistant.io,GitHub_HTML_weekly,2026-01-03 10:20:57
12,Evil-M5Project,"Evil-M5Project is an innovative tool developed for ethical hacking and exploration of WiFi networks. It's compatible with Cardputer, Atoms3, Fire, core2. You can scan, monitor, and interact with WiFi networks in a controlled environment. This project is designed for educational purposes, aiding in understanding network security and vulnerabilities",7h30th3r0n3,HTML,"1,786",175,37 stars this week,https://github.com//7h30th3r0n3/Evil-M5Project,GitHub_HTML_weekly,2026-01-03 10:20:57
13,NetherSX2-patch,Continuation of NetherSX2 based on AetherSX2 4248,Trixarian,HTML,"1,841",68,34 stars this week,https://github.com//Trixarian/NetherSX2-patch,GitHub_HTML_weekly,2026-01-03 10:20:57
14,n8n-docs,"Documentation for n8n, a fair-code licensed automation tool with a free community edition and powerful enterprise options. Build AI functionality into your workflows.",tanay1337,HTML,"1,360","3,394",14 stars this week,https://github.com//n8n-io/n8n-docs,GitHub_HTML_weekly,2026-01-03 10:20:57
15,wpt,"Test suites for Web platform specs — including WHATWG, W3C, and others",jgraham,HTML,"5,700","3,603",13 stars this week,https://github.com//web-platform-tests/wpt,GitHub_HTML_weekly,2026-01-03 10:20:57
16,hugo-PaperMod,"A fast, clean, responsive Hugo theme.",adityatelange,HTML,"12,903","3,319",38 stars this week,https://github.com//adityatelange/hugo-PaperMod,GitHub_HTML_weekly,2026-01-03 10:20:57
1,cs249r_book,Introduction to Machine Learning Systems,profvjreddi,JavaScript,"14,871","1,685","3,444 stars this week",https://github.com//harvard-edge/cs249r_book,GitHub_JavaScript_weekly,2026-01-03 10:20:57
2,desktop,Welcome to a calmer internet,mr-cheffy,JavaScript,"39,204","1,256",377 stars this week,https://github.com//zen-browser/desktop,GitHub_JavaScript_weekly,2026-01-03 10:20:57
3,uptime-kuma,A fancy self-hosted monitoring tool,louislam,JavaScript,"80,702","7,194",511 stars this week,https://github.com//louislam/uptime-kuma,GitHub_JavaScript_weekly,2026-01-03 10:20:57
4,OpenSign,🔥 The free & Open Source DocuSign alternative,prafull-opensignlabs,JavaScript,"5,753",606,214 stars this week,https://github.com//OpenSignLabs/OpenSign,GitHub_JavaScript_weekly,2026-01-03 10:20:57
5,ToolJet,"ToolJet is the open-source foundation of ToolJet AI - the AI-native platform for building internal tools, dashboard, business applications, workflows and AI agents 🚀",Navaneeth-pk,JavaScript,"37,106","4,917",49 stars this week,https://github.com//ToolJet/ToolJet,GitHub_JavaScript_weekly,2026-01-03 10:20:57
6,LinkSwift,一个基于 JavaScript 的网盘文件下载地址获取工具。基于【网盘直链下载助手】修改 ，支持 百度网盘 / 阿里云盘 / 中国移动云盘 / 天翼云盘 / 迅雷云盘 / 夸克网盘 / UC网盘 / 123云盘 八大网盘,hmjz100,JavaScript,"10,800",595,387 stars this week,https://github.com//hmjz100/LinkSwift,GitHub_JavaScript_weekly,2026-01-03 10:20:57
7,AIClient-2-API,"Simulates Gemini CLI, Antigravity, Qwen Code, and Kiro client requests, compatible with the OpenAI API. It supports thousands of Gemini model requests per day and offers free use of the built-in Claude model in Kiro. Easily connect to any client via the API, making AI development more efficient!",justlikemaki,JavaScript,"2,170",339,154 stars this week,https://github.com//justlovemaki/AIClient-2-API,GitHub_JavaScript_weekly,2026-01-03 10:20:57
8,openmtp,OpenMTP - Advanced Android File Transfer Application for macOS,ganeshrvel,JavaScript,"5,947",241,98 stars this week,https://github.com//ganeshrvel/openmtp,GitHub_JavaScript_weekly,2026-01-03 10:20:57
9,no-as-a-service,"No-as-a-Service (NaaS) is a simple API that returns a random rejection reason. Use it when you need a realistic excuse, a fun “no,” or want to simulate being turned down in style.",hotheadhacker,JavaScript,"4,576",268,497 stars this week,https://github.com//hotheadhacker/no-as-a-service,GitHub_JavaScript_weekly,2026-01-03 10:20:57
10,webvm,Virtual Machine for the Web,alexp-sssup,JavaScript,"16,189","2,997",175 stars this week,https://github.com//leaningtech/webvm,GitHub_JavaScript_weekly,2026-01-03 10:20:57
11,Web-Dev-For-Beginners,"24 Lessons, 12 Weeks, Get Started as a Web Developer",jlooper,JavaScript,"94,856","14,955",151 stars this week,https://github.com//microsoft/Web-Dev-For-Beginners,GitHub_JavaScript_weekly,2026-01-03 10:20:57
12,tvbox,OK影视、tvbox配置文件，如果喜欢，请Fork自用。使用前请仔细阅读仓库说明，一旦使用将被视为你已了解。,gaotianliuyun,JavaScript,"7,317","2,776",99 stars this week,https://github.com//qist/tvbox,GitHub_JavaScript_weekly,2026-01-03 10:20:57
13,lighthouse,"Automated auditing, performance metrics, and best practices for the web.",paulirish,JavaScript,"29,675","9,631",19 stars this week,https://github.com//GoogleChrome/lighthouse,GitHub_JavaScript_weekly,2026-01-03 10:20:57
14,GDevelop,"🎮 Open-source, cross-platform 2D/3D/multiplayer game engine designed for everyone.",4ian,JavaScript,"19,022","1,207",226 stars this week,https://github.com//4ian/GDevelop,GitHub_JavaScript_weekly,2026-01-03 10:20:57
15,free-games-claimer,"Automatically claims free games and DLCs on the Epic Games Store, Amazon Prime Gaming and GOG.",vogler,JavaScript,"3,895",221,135 stars this week,https://github.com//vogler/free-games-claimer,GitHub_JavaScript_weekly,2026-01-03 10:20:57
1,docker-android,🤖 A minimal and customizable Docker image running the Android emulator as a service.,HQarroum,Shell,"1,851",118,474 stars today,https://github.com//HQarroum/docker-android,GitHub_Shell_daily,2026-01-03 14:47:56
2,nocodb,🔥 🔥 🔥 Open Source Airtable Alternative,o1lab,TypeScript,"59,960","4,460",112 stars today,https://github.com//nocodb/nocodb,GitHub_TypeScript_daily,2026-01-03 14:47:56
3,openai-cookbook,Examples and guides for using the OpenAI API,ted-at-openai,Jupyter Notebook,"70,457","11,826",30 stars today,https://github.com//openai/openai-cookbook,GitHub_Jupyter Notebook_daily,2026-01-03 14:47:56
4,newsnow,Elegant reading of real-time and hottest news,ourongxing,TypeScript,"16,105","4,726",220 stars today,https://github.com//ourongxing/newsnow,GitHub_TypeScript_daily,2026-01-03 14:47:56
5,awesome-math,A curated list of awesome mathematics resources,rossant,Python,"13,020","1,273",117 stars today,https://github.com//rossant/awesome-math,GitHub_Python_daily,2026-01-03 14:47:56
6,memos,"An open-source, self-hosted note-taking service. Your thoughts, your data, your control — no tracking, no ads, no subscription fees.",boojack,Go,"49,032","3,543",661 stars today,https://github.com//usememos/memos,GitHub_Go_daily,2026-01-03 14:47:56
7,GitHubDaily,"坚持分享 GitHub 上高质量、有趣实用的开源技术教程、开发者工具、编程网站、技术资讯。A list cool, interesting projects of GitHub.",Freelander,,"43,900","4,421",53 stars today,https://github.com//GitHubDaily/GitHubDaily,GitHub__daily,2026-01-03 14:47:56
8,faster-whisper,Faster Whisper transcription with CTranslate2,guillaumekln,Python,"20,097","1,681",107 stars today,https://github.com//SYSTRAN/faster-whisper,GitHub_Python_daily,2026-01-03 14:47:56
9,zigbee2mqtt,"Zigbee 🐝 to MQTT bridge 🌉, get rid of your proprietary Zigbee bridges 🔨",Koenkk,TypeScript,"14,529","1,885",15 stars today,https://github.com//Koenkk/zigbee2mqtt,GitHub_TypeScript_daily,2026-01-03 14:47:56
1,vibe-kanban,"Get 10X more out of Claude Code, Codex or any coding agent",stunningpixels,Rust,"11,491","1,035","4,424 stars this week",https://github.com//BloopAI/vibe-kanban,GitHub_Rust_weekly,2026-01-03 14:47:56
2,chatterbox,SoTA open-source TTS,fatchord,Python,"20,316","2,652","2,316 stars this week",https://github.com//resemble-ai/chatterbox,GitHub_Python_weekly,2026-01-03 14:47:56
3,skills,Public repository for Agent Skills,klazuka,Python,"31,936","2,893","4,277 stars this week",https://github.com//anthropics/skills,GitHub_Python_weekly,2026-01-03 14:47:56
4,cs249r_book,Introduction to Machine Learning Systems,profvjreddi,JavaScript,"14,897","1,691","3,444 stars this week",https://github.com//harvard-edge/cs249r_book,GitHub_JavaScript_weekly,2026-01-03 14:47:56
5,Infographic,"🦋 An Infographic Generation and Rendering Framework, bring words to life with AI!",Aarebecca,TypeScript,"2,640",168,"1,391 stars this week",https://github.com//antvis/Infographic,GitHub_TypeScript_weekly,2026-01-03 14:47:56
6,SpotiFLAC,"Get Spotify tracks in true FLAC from Tidal, Qobuz & Amazon Music — no account required.",afkarxyz,TypeScript,"2,107",124,"1,305 stars this week",https://github.com//afkarxyz/SpotiFLAC,GitHub_TypeScript_weekly,2026-01-03 14:47:56
7,metube,Self-hosted YouTube downloader (web UI for youtube-dl / yt-dlp),alexta69,Python,"11,863",801,592 stars this week,https://github.com//alexta69/metube,GitHub_Python_weekly,2026-01-03 14:47:56
8,gumroad,Sell stuff and see what sticks,devin-ai-integration,Ruby,"8,083","1,558",251 stars this week,https://github.com//antiwork/gumroad,GitHub_Ruby_weekly,2026-01-03 14:47:56
9,zapret-discord-youtube,,Flowseal,Batchfile,"20,522","1,711",877 stars this week,https://github.com//Flowseal/zapret-discord-youtube,GitHub_Batchfile_weekly,2026-01-03 14:47:56
10,Personal_AI_Infrastructure,Personal AI Infrastructure for upgrading humans.,danielmiessler,TypeScript,"2,957",544,740 stars this week,https://github.com//danielmiessler/Personal_AI_Infrastructure,GitHub_TypeScript_weekly,2026-01-03 14:47:56
11,rendercv,"CV/resume generator for academics and engineers, YAML to PDF",sinaatalay,Python,"13,996",946,"2,071 stars this week",https://github.com//rendercv/rendercv,GitHub_Python_weekly,2026-01-03 14:47:56
12,iptv,Collection of publicly available IPTV channels from all over the world,freearhey,TypeScript,"108,288","5,207","1,195 stars this week",https://github.com//iptv-org/iptv,GitHub_TypeScript_weekly,2026-01-03 14:47:56
1,claude-mem,"A Claude Code plugin that automatically captures everything Claude does during your coding sessions, compresses it with AI (using Claude's agent-sdk), and injects relevant context back into future sessions.",thedotmack,TypeScript,"10,011",609,"9,505 stars this month",https://github.com//thedotmack/claude-mem,GitHub_TypeScript_monthly,2026-01-03 14:47:56
2,next-ai-draw-io,"A next.js web application that integrates AI capabilities with draw.io diagrams. This app allows you to create, modify, and enhance diagrams through natural language commands and AI-assisted visualization.",DayuanJiang,TypeScript,"16,426","1,691","14,593 stars this month",https://github.com//DayuanJiang/next-ai-draw-io,GitHub_TypeScript_monthly,2026-01-03 14:47:56
3,exo,Run your own AI cluster at home with everyday devices 📱💻 🖥️⌚,AlexCheema,Python,"39,279","2,651","6,701 stars this month",https://github.com//exo-explore/exo,GitHub_Python_monthly,2026-01-03 14:47:56
4,sim,Open-source platform to build and deploy AI agent workflows.,waleedlatif1,TypeScript,"24,874","3,108","6,371 stars this month",https://github.com//simstudioai/sim,GitHub_TypeScript_monthly,2026-01-03 14:47:56
5,hello-agents,📚 《从零开始构建智能体》——从零开始的智能体原理与实践教程,jjyaoao,Python,"13,849","1,466","8,438 stars this month",https://github.com//datawhalechina/hello-agents,GitHub_Python_monthly,2026-01-03 14:47:56
6,chatterbox,SoTA open-source TTS,fatchord,Python,"20,316","2,652","5,467 stars this month",https://github.com//resemble-ai/chatterbox,GitHub_Python_monthly,2026-01-03 14:47:56
7,vibe-kanban,"Get 10X more out of Claude Code, Codex or any coding agent",stunningpixels,Rust,"11,491","1,035","5,046 stars this month",https://github.com//BloopAI/vibe-kanban,GitHub_Rust_monthly,2026-01-03 14:47:56
8,fizzy,Kanban as it should be. Not as it has been.,jzimdars,Ruby,"6,501",835,"6,499 stars this month",https://github.com//basecamp/fizzy,GitHub_Ruby_monthly,2026-01-03 14:47:56
9,opencode,The open source coding agent.,thdxr,TypeScript,"45,818","3,963","11,006 stars this month",https://github.com//anomalyco/opencode,GitHub_TypeScript_monthly,2026-01-03 14:47:56
10,agents.md,"AGENTS.md — a simple, open format for guiding coding agents",romainhuet,TypeScript,"13,920",983,"5,175 stars this month",https://github.com//agentsmd/agents.md,GitHub_TypeScript_monthly,2026-01-03 14:47:56
11,WeKnora,"LLM-powered framework for deep document understanding, semantic retrieval, and context-aware answers using RAG paradigm.",lyingbug,Go,"10,777","1,158","3,080 stars this month",https://github.com//Tencent/WeKnora,GitHub_Go_monthly,2026-01-03 14:47:56
12,claude-quickstarts,A collection of projects designed to help developers quickly get started with building deployable applications using the Claude API,x5a,Python,"13,136","2,186","2,636 stars this month",https://github.com//anthropics/claude-quickstarts,GitHub_Python_monthly,2026-01-03 14:47:56
13,cocoindex,"Data transformation framework for AI. Ultra performant, with incremental processing. 🌟 Star if you like it!",badmonster0,Rust,"5,612",412,"2,128 stars this month",https://github.com//cocoindex-io/cocoindex,GitHub_Rust_monthly,2026-01-03 14:47:56
14,skills,Public repository for Agent Skills,klazuka,Python,"31,936","2,893","12,685 stars this month",https://github.com//anthropics/skills,GitHub_Python_monthly,2026-01-03 14:47:56
15,rustfs,"🚀2.3x faster than MinIO for 4KB object payloads. RustFS is an open-source, S3-compatible high-performance object storage system supporting migration and coexistence with other S3-compatible platforms such as MinIO and Ceph.",houseme,Rust,"18,954",814,"7,197 stars this month",https://github.com//rustfs/rustfs,GitHub_Rust_monthly,2026-01-03 14:47:56
16,Personal_AI_Infrastructure,Personal AI Infrastructure for upgrading humans.,danielmiessler,TypeScript,"2,957",544,"1,791 stars this month",https://github.com//danielmiessler/Personal_AI_Infrastructure,GitHub_TypeScript_monthly,2026-01-03 14:47:56
17,claude-code,"Claude Code is an agentic coding tool that lives in your terminal, understands your codebase, and helps you code faster by executing routine tasks, explaining complex code, and handling git workflows - all through natural language commands.",actions-user,Shell,"50,608","3,613","6,365 stars this month",https://github.com//anthropics/claude-code,GitHub_Shell_monthly,2026-01-03 14:47:56
1,vibe-kanban,"Get 10X more out of Claude Code, Codex or any coding agent",stunningpixels,Rust,"11,491","1,035","4,424 stars this week",https://github.com//BloopAI/vibe-kanban,GitHub_Rust_weekly,2026-01-03 14:47:56
2,chatterbox,SoTA open-source TTS,fatchord,Python,"20,316","2,652","2,316 stars this week",https://github.com//resemble-ai/chatterbox,GitHub_Python_weekly,2026-01-03 14:47:56
3,skills,Public repository for Agent Skills,klazuka,Python,"31,936","2,893","4,277 stars this week",https://github.com//anthropics/skills,GitHub_Python_weekly,2026-01-03 14:47:56
4,cs249r_book,Introduction to Machine Learning Systems,profvjreddi,JavaScript,"14,897","1,691","3,444 stars this week",https://github.com//harvard-edge/cs249r_book,GitHub_JavaScript_weekly,2026-01-03 14:47:56
5,Infographic,"🦋 An Infographic Generation and Rendering Framework, bring words to life with AI!",Aarebecca,TypeScript,"2,640",168,"1,391 stars this week",https://github.com//antvis/Infographic,GitHub_TypeScript_weekly,2026-01-03 14:47:56
6,SpotiFLAC,"Get Spotify tracks in true FLAC from Tidal, Qobuz & Amazon Music — no account required.",afkarxyz,TypeScript,"2,107",124,"1,305 stars this week",https://github.com//afkarxyz/SpotiFLAC,GitHub_TypeScript_weekly,2026-01-03 14:47:56
7,metube,Self-hosted YouTube downloader (web UI for youtube-dl / yt-dlp),alexta69,Python,"11,863",801,592 stars this week,https://github.com//alexta69/metube,GitHub_Python_weekly,2026-01-03 14:47:56
8,gumroad,Sell stuff and see what sticks,devin-ai-integration,Ruby,"8,083","1,558",251 stars this week,https://github.com//antiwork/gumroad,GitHub_Ruby_weekly,2026-01-03 14:47:56
9,zapret-discord-youtube,,Flowseal,Batchfile,"20,522","1,711",877 stars this week,https://github.com//Flowseal/zapret-discord-youtube,GitHub_Batchfile_weekly,2026-01-03 14:47:56
10,Personal_AI_Infrastructure,Personal AI Infrastructure for upgrading humans.,danielmiessler,TypeScript,"2,957",544,740 stars this week,https://github.com//danielmiessler/Personal_AI_Infrastructure,GitHub_TypeScript_weekly,2026-01-03 14:47:56
11,rendercv,"CV/resume generator for academics and engineers, YAML to PDF",sinaatalay,Python,"13,996",946,"2,071 stars this week",https://github.com//rendercv/rendercv,GitHub_Python_weekly,2026-01-03 14:47:56
12,iptv,Collection of publicly available IPTV channels from all over the world,freearhey,TypeScript,"108,288","5,207","1,195 stars this week",https://github.com//iptv-org/iptv,GitHub_TypeScript_weekly,2026-01-03 14:47:56
1,lawnchair,No clever tagline needed.,sunnygoyal,Java,"11,744","1,411",77 stars this week,https://github.com//LawnchairLauncher/lawnchair,GitHub_Java_weekly,2026-01-03 14:47:56
2,termux-app,Termux - a terminal emulator application for Android OS extendible by variety of packages.,agnostic-apollo,Java,"48,384","5,784",249 stars this week,https://github.com//termux/termux-app,GitHub_Java_weekly,2026-01-03 14:47:56
3,Create,[NeoForge Mod] Building Tools and Aesthetic Technology,simibubi,Java,"3,881","1,189",18 stars this week,https://github.com//Creators-of-Create/Create,GitHub_Java_weekly,2026-01-03 14:47:56
4,voxy,An LoD rendering mod for minecraft,MCRcortex,Java,593,145,62 stars this week,https://github.com//MCRcortex/voxy,GitHub_Java_weekly,2026-01-03 14:47:56
5,Mindustry,The automation tower defense RTS,Anuken,Java,"26,115","3,330",73 stars this week,https://github.com//Anuken/Mindustry,GitHub_Java_weekly,2026-01-03 14:47:56
6,Xed-Editor,Advanced Text Editor for Android,RohitKushvaha01,Java,"1,460",88,88 stars this week,https://github.com//Xed-Editor/Xed-Editor,GitHub_Java_weekly,2026-01-03 14:47:56
7,halo,强大易用的开源建站工具。,ruibaby,Java,"37,652","10,179",92 stars this week,https://github.com//halo-dev/halo,GitHub_Java_weekly,2026-01-03 14:47:56
8,fesod,Fast. Easy. Done. Processing spreadsheets without worrying about large files causing OOM.,psxjoy,Java,"5,636",463,63 stars this week,https://github.com//apache/fesod,GitHub_Java_weekly,2026-01-03 14:47:56
9,Paper,"The most widely used, high performance Minecraft server that aims to fix gameplay and mechanics inconsistencies",Machine-Maker,Java,"11,806","3,190",24 stars this week,https://github.com//PaperMC/Paper,GitHub_Java_weekly,2026-01-03 14:47:56
10,himarket,"HiMarket is an enterprise-level ""AI Capability Marketplace and Developer Ecosystem Hub."" It is not merely a simple aggregation of traditional APIs, but rather a comprehensive platform that packages, publishes, manages, and operates core AI assets such as enterprise Model APIs, MCP Servers, Agent APIs, etc., through standardized product formats.",learnerjohn,Java,549,85,77 stars this week,https://github.com//higress-group/himarket,GitHub_Java_weekly,2026-01-03 14:47:56
11,GhidraMCP,MCP Server for Ghidra,LaurieWired,Java,"6,970",556,158 stars this week,https://github.com//LaurieWired/GhidraMCP,GitHub_Java_weekly,2026-01-03 14:47:56
12,awesome-leetcode-resources,Awesome LeetCode resources to learn Data Structures and Algorithms and prepare for Coding Interviews.,ashishps1,Java,"14,942","3,268",157 stars this week,https://github.com//ashishps1/awesome-leetcode-resources,GitHub_Java_weekly,2026-01-03 14:47:56
13,meteor-client,Based Minecraft utility mod.,MineGame159,Java,"3,154","1,292",26 stars this week,https://github.com//MeteorDevelopment/meteor-client,GitHub_Java_weekly,2026-01-03 14:47:56
14,kafka,Mirror of Apache Kafka,ijuma,Java,"31,638","14,876",54 stars this week,https://github.com//apache/kafka,GitHub_Java_weekly,2026-01-03 14:47:56
15,Shizuku-API,The API and the developer guide for Shizuku and Sui.,RikkaW,Java,"1,817",700,16 stars this week,https://github.com//RikkaApps/Shizuku-API,GitHub_Java_weekly,2026-01-03 14:47:56
16,mockito,Most popular Mocking framework for unit tests written in Java,mockitoguy,Java,"15,385","2,649",43 stars this week,https://github.com//mockito/mockito,GitHub_Java_weekly,2026-01-03 14:47:56
17,fabric-example-mod,Example Fabric mod,modmuss50,Java,"2,065","1,184",10 stars this week,https://github.com//FabricMC/fabric-example-mod,GitHub_Java_weekly,2026-01-03 14:47:56
18,rewrite,Automated mass refactoring of source code.,jkschneider,Java,"3,229",496,65 stars this week,https://github.com//openrewrite/rewrite,GitHub_Java_weekly,2026-01-03 14:47:56
1,chatterbox,SoTA open-source TTS,fatchord,Python,"20,316","2,652","2,316 stars this week",https://github.com//resemble-ai/chatterbox,GitHub_Python_weekly,2026-01-03 14:47:56
2,skills,Public repository for Agent Skills,klazuka,Python,"31,936","2,893","4,277 stars this week",https://github.com//anthropics/skills,GitHub_Python_weekly,2026-01-03 14:47:56
3,metube,Self-hosted YouTube downloader (web UI for youtube-dl / yt-dlp),alexta69,Python,"11,863",801,592 stars this week,https://github.com//alexta69/metube,GitHub_Python_weekly,2026-01-03 14:47:56
4,rendercv,"CV/resume generator for academics and engineers, YAML to PDF",sinaatalay,Python,"13,996",946,"2,071 stars this week",https://github.com//rendercv/rendercv,GitHub_Python_weekly,2026-01-03 14:47:56
5,LEANN,"RAG on Everything with LEANN. Enjoy 97% storage savings while running a fast, accurate, and 100% private RAG application on your personal device.",yichuan-w,Python,"7,988",720,"1,630 stars this week",https://github.com//yichuan-w/LEANN,GitHub_Python_weekly,2026-01-03 14:47:56
6,computer-use-preview,,sammccauley117,Python,"2,450",314,521 stars this week,https://github.com//google-gemini/computer-use-preview,GitHub_Python_weekly,2026-01-03 14:47:56
7,Yuxi-Know,"结合LightRAG 知识库的知识图谱智能体平台。 An agent platform that integrates a LightRAG knowledge base and knowledge graphs. Build with LangChain v1 + Vue + FastAPI, support DeepAgents、MinerU PDF、Neo4j 、MCP.",xerrors,Python,"3,706",443,331 stars this week,https://github.com//xerrors/Yuxi-Know,GitHub_Python_weekly,2026-01-03 14:47:56
8,LightX2V,Light Image Video Generation Inference Framework,helloyongyang,Python,"1,665",119,114 stars this week,https://github.com//ModelTC/LightX2V,GitHub_Python_weekly,2026-01-03 14:47:56
9,tinygrad,You like pytorch? You like micrograd? You love tinygrad! ❤️,github-actions,Python,"31,067","3,818",138 stars this week,https://github.com//tinygrad/tinygrad,GitHub_Python_weekly,2026-01-03 14:47:56
10,agents,Trade autonomously on Polymarket using AI Agents,alexnicita,Python,"1,538",386,547 stars this week,https://github.com//Polymarket/agents,GitHub_Python_weekly,2026-01-03 14:47:56
11,olmocr,Toolkit for linearizing PDFs for LLM datasets/training,jakep-allenai,Python,"16,557","1,304",187 stars this week,https://github.com//allenai/olmocr,GitHub_Python_weekly,2026-01-03 14:47:56
12,parlant,LLM agents built for control. Designed for real-world use. Deployed in minutes.,mc-dorzo,Python,"17,164","1,445",371 stars this week,https://github.com//emcie-co/parlant,GitHub_Python_weekly,2026-01-03 14:47:56
1,age,"A simple, modern and secure encryption tool (and Go library) with small explicit keys, no config options, and UNIX-style composability.",FiloSottile,Go,"20,787",594,309 stars this week,https://github.com//FiloSottile/age,GitHub_Go_weekly,2026-01-03 14:47:56
2,netbird,"Connect your devices into a secure WireGuard®-based overlay network with SSO, MFA and granular access controls.",mlsmaycon,Go,"20,623","1,001",267 stars this week,https://github.com//netbirdio/netbird,GitHub_Go_weekly,2026-01-03 14:47:56
3,axonhub,"AxonHub is a modern AI gateway system that provides a unified OpenAI ( Chat Completion, Responses), Anthropic, Gemini and AI SDK compatible API",looplj,Go,"1,203",136,233 stars this week,https://github.com//looplj/axonhub,GitHub_Go_weekly,2026-01-03 14:47:56
4,Fabric,Fabric is an open-source framework for augmenting humans using AI. It provides a modular system for solving specific problems using a crowdsourced set of AI prompts that can be used anywhere.,danielmiessler,Go,"37,572","3,762",784 stars this week,https://github.com//danielmiessler/Fabric,GitHub_Go_weekly,2026-01-03 14:47:56
5,hugo,The world’s fastest framework for building websites.,bep,Go,"85,730","8,159",199 stars this week,https://github.com//gohugoio/hugo,GitHub_Go_weekly,2026-01-03 14:47:56
6,memos,"An open-source, self-hosted note-taking service. Your thoughts, your data, your control — no tracking, no ads, no subscription fees.",boojack,Go,"49,032","3,543","1,079 stars this week",https://github.com//usememos/memos,GitHub_Go_weekly,2026-01-03 14:47:56
7,ezbookkeeping,"A lightweight, self-hosted personal finance app with a user-friendly interface and powerful bookkeeping features.",mayswind,Go,"3,622",372,173 stars this week,https://github.com//mayswind/ezbookkeeping,GitHub_Go_weekly,2026-01-03 14:47:56
