index,title,desc,author,language,stars,forks,today_forks,url,type,datetime
7,openmtp,OpenMTP - Advanced Android File Transfer Application for macOS,ganeshrvel,JavaScript,"5,951",241,98 stars this week,https://github.com//ganeshrvel/openmtp,GitHub_JavaScript_weekly,2026-01-04 02:43:09
8,GDevelop,"🎮 Open-source, cross-platform 2D/3D/multiplayer game engine designed for everyone.",4ian,JavaScript,"19,040","1,208",226 stars this week,https://github.com//4ian/GDevelop,GitHub_JavaScript_weekly,2026-01-04 02:43:09
9,AIClient-2-API,"Simulates Gemini CLI, Antigravity, Qwen Code, and Kiro client requests, compatible with the OpenAI API. It supports thousands of Gemini model requests per day and offers free use of the built-in Claude model in Kiro. Easily connect to any client via the API, making AI development more efficient!",justlikemaki,JavaScript,"2,189",343,154 stars this week,https://github.com//justlovemaki/AIClient-2-API,GitHub_JavaScript_weekly,2026-01-04 02:43:09
10,tvbox,OK影视、tvbox配置文件，如果喜欢，请Fork自用。使用前请仔细阅读仓库说明，一旦使用将被视为你已了解。,gaotianliuyun,JavaScript,"7,326","2,777",99 stars this week,https://github.com//qist/tvbox,GitHub_JavaScript_weekly,2026-01-04 02:43:09
11,no-as-a-service,"No-as-a-Service (NaaS) is a simple API that returns a random rejection reason. Use it when you need a realistic excuse, a fun “no,” or want to simulate being turned down in style.",hotheadhacker,JavaScript,"4,592",269,497 stars this week,https://github.com//hotheadhacker/no-as-a-service,GitHub_JavaScript_weekly,2026-01-04 02:43:09
12,OpenSign,🔥 The free & Open Source DocuSign alternative,prafull-opensignlabs,JavaScript,"5,753",607,214 stars this week,https://github.com//OpenSignLabs/OpenSign,GitHub_JavaScript_weekly,2026-01-04 02:43:09
1,memos,"An open-source, self-hosted note-taking service. Your thoughts, your data, your control — no tracking, no ads, no subscription fees.",boojack,Go,"50,279","3,622",819 stars today,https://github.com//usememos/memos,GitHub_Go_daily,2026-01-04 10:39:31
2,newsnow,Elegant reading of real-time and hottest news,ourongxing,TypeScript,"16,328","4,763",314 stars today,https://github.com//ourongxing/newsnow,GitHub_TypeScript_daily,2026-01-04 10:39:31
3,pathway,"Python ETL framework for stream processing, real-time analytics, LLM pipelines, and RAG.",Pathway-Dev,Python,"55,982","1,530","1,219 stars today",https://github.com//pathwaycom/pathway,GitHub_Python_daily,2026-01-04 10:39:31
4,OpenBB,"Financial data platform for analysts, quants and AI agents.",jmaslek,Python,"56,469","5,495",195 stars today,https://github.com//OpenBB-finance/OpenBB,GitHub_Python_daily,2026-01-04 10:39:31
5,docker-android,🤖 A minimal and customizable Docker image running the Android emulator as a service.,HQarroum,Shell,"2,176",131,518 stars today,https://github.com//HQarroum/docker-android,GitHub_Shell_daily,2026-01-04 10:39:31
6,beancount,Beancount: Double-Entry Accounting from Text Files.,blais,Python,"4,972",385,111 stars today,https://github.com//beancount/beancount,GitHub_Python_daily,2026-01-04 10:39:31
7,maplibre-gl-js,MapLibre GL JS - Interactive vector tile maps in the browser,dependabot,TypeScript,"9,097",957,23 stars today,https://github.com//maplibre/maplibre-gl-js,GitHub_TypeScript_daily,2026-01-04 10:39:31
8,nuclear,Streaming music player that finds free music for you,nukeop,TypeScript,"16,804","1,254",96 stars today,https://github.com//nukeop/nuclear,GitHub_TypeScript_daily,2026-01-04 10:39:31
1,vibe-kanban,"Get 10X more out of Claude Code, Codex or any coding agent",stunningpixels,Rust,"11,998","1,106","4,973 stars this week",https://github.com//BloopAI/vibe-kanban,GitHub_Rust_weekly,2026-01-04 10:39:31
2,cs249r_book,Introduction to Machine Learning Systems,profvjreddi,JavaScript,"15,042","1,711","3,439 stars this week",https://github.com//harvard-edge/cs249r_book,GitHub_JavaScript_weekly,2026-01-04 10:39:31
3,SpotiFLAC,"Get Spotify tracks in true FLAC from Tidal, Qobuz & Amazon Music — no account required.",afkarxyz,TypeScript,"2,196",126,"1,418 stars this week",https://github.com//afkarxyz/SpotiFLAC,GitHub_TypeScript_weekly,2026-01-04 10:39:31
4,chatterbox,SoTA open-source TTS,fatchord,Python,"20,447","2,668","2,328 stars this week",https://github.com//resemble-ai/chatterbox,GitHub_Python_weekly,2026-01-04 10:39:31
5,metube,Self-hosted YouTube downloader (web UI for youtube-dl / yt-dlp),alexta69,Python,"11,926",806,652 stars this week,https://github.com//alexta69/metube,GitHub_Python_weekly,2026-01-04 10:39:31
6,gumroad,Sell stuff and see what sticks,devin-ai-integration,Ruby,"8,109","1,560",272 stars this week,https://github.com//antiwork/gumroad,GitHub_Ruby_weekly,2026-01-04 10:39:31
7,memos,"An open-source, self-hosted note-taking service. Your thoughts, your data, your control — no tracking, no ads, no subscription fees.",boojack,Go,"50,279","3,622","1,996 stars this week",https://github.com//usememos/memos,GitHub_Go_weekly,2026-01-04 10:39:31
8,zapret-discord-youtube,,Flowseal,Batchfile,"20,563","1,716",702 stars this week,https://github.com//Flowseal/zapret-discord-youtube,GitHub_Batchfile_weekly,2026-01-04 10:39:31
9,skills,Public repository for Agent Skills,klazuka,Python,"32,353","2,925","4,377 stars this week",https://github.com//anthropics/skills,GitHub_Python_weekly,2026-01-04 10:39:31
10,computer-use-preview,,sammccauley117,Python,"2,487",316,537 stars this week,https://github.com//google-gemini/computer-use-preview,GitHub_Python_weekly,2026-01-04 10:39:31
11,Personal_AI_Infrastructure,Personal AI Infrastructure for upgrading humans.,danielmiessler,TypeScript,"3,100",561,769 stars this week,https://github.com//danielmiessler/Personal_AI_Infrastructure,GitHub_TypeScript_weekly,2026-01-04 10:39:31
12,postiz-app,"📨 The ultimate social media scheduling tool, with a bunch of AI 🤖",nevo-david,TypeScript,"25,791","4,366",780 stars this week,https://github.com//gitroomhq/postiz-app,GitHub_TypeScript_weekly,2026-01-04 10:39:31
1,claude-mem,"A Claude Code plugin that automatically captures everything Claude does during your coding sessions, compresses it with AI (using Claude's agent-sdk), and injects relevant context back into future sessions.",thedotmack,TypeScript,"10,112",614,"9,616 stars this month",https://github.com//thedotmack/claude-mem,GitHub_TypeScript_monthly,2026-01-04 10:39:31
2,VibeVoice,Open-Source Frontier Voice AI,YaoyaoChang,Python,"19,407","2,155","9,365 stars this month",https://github.com//microsoft/VibeVoice,GitHub_Python_monthly,2026-01-04 10:39:31
3,next-ai-draw-io,"A next.js web application that integrates AI capabilities with draw.io diagrams. This app allows you to create, modify, and enhance diagrams through natural language commands and AI-assisted visualization.",DayuanJiang,TypeScript,"16,532","1,702","14,163 stars this month",https://github.com//DayuanJiang/next-ai-draw-io,GitHub_TypeScript_monthly,2026-01-04 10:39:31
4,exo,Run your own AI cluster at home with everyday devices 📱💻 🖥️⌚,AlexCheema,Python,"39,328","2,654","6,763 stars this month",https://github.com//exo-explore/exo,GitHub_Python_monthly,2026-01-04 10:39:31
5,opencode,The open source coding agent.,thdxr,TypeScript,"46,391","4,010","11,263 stars this month",https://github.com//anomalyco/opencode,GitHub_TypeScript_monthly,2026-01-04 10:39:31
6,hello-agents,📚 《从零开始构建智能体》——从零开始的智能体原理与实践教程,jjyaoao,Python,"13,967","1,480","8,456 stars this month",https://github.com//datawhalechina/hello-agents,GitHub_Python_monthly,2026-01-04 10:39:31
7,WeKnora,"LLM-powered framework for deep document understanding, semantic retrieval, and context-aware answers using RAG paradigm.",lyingbug,Go,"10,820","1,161","3,097 stars this month",https://github.com//Tencent/WeKnora,GitHub_Go_monthly,2026-01-04 10:39:31
8,agents.md,"AGENTS.md — a simple, open format for guiding coding agents",romainhuet,TypeScript,"14,002",990,"5,262 stars this month",https://github.com//agentsmd/agents.md,GitHub_TypeScript_monthly,2026-01-04 10:39:31
9,chatterbox,SoTA open-source TTS,fatchord,Python,"20,447","2,668","5,600 stars this month",https://github.com//resemble-ai/chatterbox,GitHub_Python_monthly,2026-01-04 10:39:31
10,vibe-kanban,"Get 10X more out of Claude Code, Codex or any coding agent",stunningpixels,Rust,"11,998","1,106","5,578 stars this month",https://github.com//BloopAI/vibe-kanban,GitHub_Rust_monthly,2026-01-04 10:39:31
11,sim,Open-source platform to build and deploy AI agent workflows.,waleedlatif1,TypeScript,"24,903","3,111","6,387 stars this month",https://github.com//simstudioai/sim,GitHub_TypeScript_monthly,2026-01-04 10:39:31
12,claude-code,"Claude Code is an agentic coding tool that lives in your terminal, understands your codebase, and helps you code faster by executing routine tasks, explaining complex code, and handling git workflows - all through natural language commands.",actions-user,Shell,"50,794","3,632","6,425 stars this month",https://github.com//anthropics/claude-code,GitHub_Shell_monthly,2026-01-04 10:39:31
13,skills,Public repository for Agent Skills,klazuka,Python,"32,353","2,925","13,018 stars this month",https://github.com//anthropics/skills,GitHub_Python_monthly,2026-01-04 10:39:31
14,claude-quickstarts,A collection of projects designed to help developers quickly get started with building deployable applications using the Claude API,x5a,Python,"13,171","2,194","2,647 stars this month",https://github.com//anthropics/claude-quickstarts,GitHub_Python_monthly,2026-01-04 10:39:31
15,Personal_AI_Infrastructure,Personal AI Infrastructure for upgrading humans.,danielmiessler,TypeScript,"3,100",561,"1,854 stars this month",https://github.com//danielmiessler/Personal_AI_Infrastructure,GitHub_TypeScript_monthly,2026-01-04 10:39:31
16,cocoindex,"Data transformation framework for AI. Ultra performant, with incremental processing. 🌟 Star if you like it!",badmonster0,Rust,"5,644",415,"2,146 stars this month",https://github.com//cocoindex-io/cocoindex,GitHub_Rust_monthly,2026-01-04 10:39:31
1,vibe-kanban,"Get 10X more out of Claude Code, Codex or any coding agent",stunningpixels,Rust,"11,998","1,106","4,973 stars this week",https://github.com//BloopAI/vibe-kanban,GitHub_Rust_weekly,2026-01-04 10:39:31
2,cs249r_book,Introduction to Machine Learning Systems,profvjreddi,JavaScript,"15,042","1,711","3,439 stars this week",https://github.com//harvard-edge/cs249r_book,GitHub_JavaScript_weekly,2026-01-04 10:39:31
3,SpotiFLAC,"Get Spotify tracks in true FLAC from Tidal, Qobuz & Amazon Music — no account required.",afkarxyz,TypeScript,"2,196",126,"1,418 stars this week",https://github.com//afkarxyz/SpotiFLAC,GitHub_TypeScript_weekly,2026-01-04 10:39:31
4,chatterbox,SoTA open-source TTS,fatchord,Python,"20,447","2,668","2,328 stars this week",https://github.com//resemble-ai/chatterbox,GitHub_Python_weekly,2026-01-04 10:39:31
5,metube,Self-hosted YouTube downloader (web UI for youtube-dl / yt-dlp),alexta69,Python,"11,926",806,652 stars this week,https://github.com//alexta69/metube,GitHub_Python_weekly,2026-01-04 10:39:31
6,gumroad,Sell stuff and see what sticks,devin-ai-integration,Ruby,"8,109","1,560",272 stars this week,https://github.com//antiwork/gumroad,GitHub_Ruby_weekly,2026-01-04 10:39:31
7,memos,"An open-source, self-hosted note-taking service. Your thoughts, your data, your control — no tracking, no ads, no subscription fees.",boojack,Go,"50,279","3,622","1,996 stars this week",https://github.com//usememos/memos,GitHub_Go_weekly,2026-01-04 10:39:31
8,zapret-discord-youtube,,Flowseal,Batchfile,"20,563","1,716",702 stars this week,https://github.com//Flowseal/zapret-discord-youtube,GitHub_Batchfile_weekly,2026-01-04 10:39:31
9,skills,Public repository for Agent Skills,klazuka,Python,"32,353","2,925","4,377 stars this week",https://github.com//anthropics/skills,GitHub_Python_weekly,2026-01-04 10:39:31
10,computer-use-preview,,sammccauley117,Python,"2,487",316,537 stars this week,https://github.com//google-gemini/computer-use-preview,GitHub_Python_weekly,2026-01-04 10:39:31
11,Personal_AI_Infrastructure,Personal AI Infrastructure for upgrading humans.,danielmiessler,TypeScript,"3,100",561,769 stars this week,https://github.com//danielmiessler/Personal_AI_Infrastructure,GitHub_TypeScript_weekly,2026-01-04 10:39:31
12,postiz-app,"📨 The ultimate social media scheduling tool, with a bunch of AI 🤖",nevo-david,TypeScript,"25,791","4,366",780 stars this week,https://github.com//gitroomhq/postiz-app,GitHub_TypeScript_weekly,2026-01-04 10:39:31
1,termux-app,Termux - a terminal emulator application for Android OS extendible by variety of packages.,agnostic-apollo,Java,"48,422","5,789",254 stars this week,https://github.com//termux/termux-app,GitHub_Java_weekly,2026-01-04 10:39:31
2,Create,[NeoForge Mod] Building Tools and Aesthetic Technology,simibubi,Java,"3,884","1,189",17 stars this week,https://github.com//Creators-of-Create/Create,GitHub_Java_weekly,2026-01-04 10:39:31
3,Xed-Editor,Advanced Text Editor for Android,RohitKushvaha01,Java,"1,464",88,74 stars this week,https://github.com//Xed-Editor/Xed-Editor,GitHub_Java_weekly,2026-01-04 10:39:31
4,voxy,An LoD rendering mod for minecraft,MCRcortex,Java,600,147,65 stars this week,https://github.com//MCRcortex/voxy,GitHub_Java_weekly,2026-01-04 10:39:31
5,thingsboard,"Open-source IoT Platform - Device management, data collection, processing and visualization.",ikulikov,Java,"20,868","6,012",185 stars this week,https://github.com//thingsboard/thingsboard,GitHub_Java_weekly,2026-01-04 10:39:31
6,Paper,"The most widely used, high performance Minecraft server that aims to fix gameplay and mechanics inconsistencies",Machine-Maker,Java,"11,814","3,192",25 stars this week,https://github.com//PaperMC/Paper,GitHub_Java_weekly,2026-01-04 10:39:31
7,mockito,Most popular Mocking framework for unit tests written in Java,mockitoguy,Java,"15,384","2,648",43 stars this week,https://github.com//mockito/mockito,GitHub_Java_weekly,2026-01-04 10:39:31
8,cloudstack,Apache CloudStack is an opensource Infrastructure as a Service (IaaS) cloud computing platform,yadvr,Java,"2,752","1,256",7 stars this week,https://github.com//apache/cloudstack,GitHub_Java_weekly,2026-01-04 10:39:31
9,GhidraMCP,MCP Server for Ghidra,LaurieWired,Java,"6,981",557,159 stars this week,https://github.com//LaurieWired/GhidraMCP,GitHub_Java_weekly,2026-01-04 10:39:31
10,awesome-leetcode-resources,Awesome LeetCode resources to learn Data Structures and Algorithms and prepare for Coding Interviews.,ashishps1,Java,"14,960","3,271",170 stars this week,https://github.com//ashishps1/awesome-leetcode-resources,GitHub_Java_weekly,2026-01-04 10:39:31
11,lawnchair,No clever tagline needed.,sunnygoyal,Java,"11,745","1,412",65 stars this week,https://github.com//LawnchairLauncher/lawnchair,GitHub_Java_weekly,2026-01-04 10:39:31
12,himarket,"HiMarket is an enterprise-level ""AI Capability Marketplace and Developer Ecosystem Hub."" It is not merely a simple aggregation of traditional APIs, but rather a comprehensive platform that packages, publishes, manages, and operates core AI assets such as enterprise Model APIs, MCP Servers, Agent APIs, etc., through standardized product formats.",learnerjohn,Java,561,87,85 stars this week,https://github.com//higress-group/himarket,GitHub_Java_weekly,2026-01-04 10:39:31
13,kestra,Event Driven Orchestration & Scheduling Platform for Mission Critical Applications,tchiotludo,Java,"26,212","2,426",93 stars this week,https://github.com//kestra-io/kestra,GitHub_Java_weekly,2026-01-04 10:39:31
14,meteor-client,Based Minecraft utility mod.,MineGame159,Java,"3,153","1,293",23 stars this week,https://github.com//MeteorDevelopment/meteor-client,GitHub_Java_weekly,2026-01-04 10:39:31
15,Mindustry,The automation tower defense RTS,Anuken,Java,"26,122","3,331",70 stars this week,https://github.com//Anuken/Mindustry,GitHub_Java_weekly,2026-01-04 10:39:31
16,DSA-Bootcamp-Java,"This repository consists of the code samples, assignments, and notes for the Java data structures & algorithms + interview preparation bootcamp of WeMakeDevs.",kunal-kushwaha,Java,"21,498","12,895",82 stars this week,https://github.com//kunal-kushwaha/DSA-Bootcamp-Java,GitHub_Java_weekly,2026-01-04 10:39:31
17,Telegram,Telegram for Android source,xaxtix,Java,"28,258","9,175",74 stars this week,https://github.com//DrKLO/Telegram,GitHub_Java_weekly,2026-01-04 10:39:31
18,fabric-example-mod,Example Fabric mod,modmuss50,Java,"2,066","1,185",10 stars this week,https://github.com//FabricMC/fabric-example-mod,GitHub_Java_weekly,2026-01-04 10:39:31
19,guava,Google core libraries for Java,cpovirk,Java,"51,390","11,125",35 stars this week,https://github.com//google/guava,GitHub_Java_weekly,2026-01-04 10:39:31
20,kafka,Mirror of Apache Kafka,ijuma,Java,"31,640","14,875",49 stars this week,https://github.com//apache/kafka,GitHub_Java_weekly,2026-01-04 10:39:31
1,chatterbox,SoTA open-source TTS,fatchord,Python,"20,447","2,668","2,328 stars this week",https://github.com//resemble-ai/chatterbox,GitHub_Python_weekly,2026-01-04 10:39:31
2,metube,Self-hosted YouTube downloader (web UI for youtube-dl / yt-dlp),alexta69,Python,"11,926",806,652 stars this week,https://github.com//alexta69/metube,GitHub_Python_weekly,2026-01-04 10:39:31
3,skills,Public repository for Agent Skills,klazuka,Python,"32,354","2,925","4,377 stars this week",https://github.com//anthropics/skills,GitHub_Python_weekly,2026-01-04 10:39:31
4,computer-use-preview,,sammccauley117,Python,"2,487",316,537 stars this week,https://github.com//google-gemini/computer-use-preview,GitHub_Python_weekly,2026-01-04 10:39:31
5,LEANN,"RAG on Everything with LEANN. Enjoy 97% storage savings while running a fast, accurate, and 100% private RAG application on your personal device.",yichuan-w,Python,"8,025",721,"1,471 stars this week",https://github.com//yichuan-w/LEANN,GitHub_Python_weekly,2026-01-04 10:39:31
6,olmocr,Toolkit for linearizing PDFs for LLM datasets/training,jakep-allenai,Python,"16,564","1,304",187 stars this week,https://github.com//allenai/olmocr,GitHub_Python_weekly,2026-01-04 10:39:31
7,faster-whisper,Faster Whisper transcription with CTranslate2,guillaumekln,Python,"20,149","1,683",494 stars this week,https://github.com//SYSTRAN/faster-whisper,GitHub_Python_weekly,2026-01-04 10:39:31
8,mealie,Mealie is a self hosted recipe manager and meal planner with a RestAPI backend and a reactive frontend application built in Vue for a pleasant user experience for the whole family. Easily add recipes into your database by providing the url and mealie will automatically import the relevant data or add a family recipe with the UI editor,hay-kot,Python,"11,008","1,080",108 stars this week,https://github.com//mealie-recipes/mealie,GitHub_Python_weekly,2026-01-04 10:39:31
9,claude-code-templates,CLI tool for configuring and monitoring Claude Code,davila7,Python,"14,519","1,253",622 stars this week,https://github.com//davila7/claude-code-templates,GitHub_Python_weekly,2026-01-04 10:39:31
10,agents,Trade autonomously on Polymarket using AI Agents,alexnicita,Python,"1,560",398,557 stars this week,https://github.com//Polymarket/agents,GitHub_Python_weekly,2026-01-04 10:39:31
1,memos,"An open-source, self-hosted note-taking service. Your thoughts, your data, your control — no tracking, no ads, no subscription fees.",boojack,Go,"50,279","3,622","1,996 stars this week",https://github.com//usememos/memos,GitHub_Go_weekly,2026-01-04 10:39:31
2,age,"A simple, modern and secure encryption tool (and Go library) with small explicit keys, no config options, and UNIX-style composability.",FiloSottile,Go,"20,806",595,321 stars this week,https://github.com//FiloSottile/age,GitHub_Go_weekly,2026-01-04 10:39:31
3,netbird,"Connect your devices into a secure WireGuard®-based overlay network with SSO, MFA and granular access controls.",mlsmaycon,Go,"20,639","1,003",269 stars this week,https://github.com//netbirdio/netbird,GitHub_Go_weekly,2026-01-04 10:39:31
4,Fabric,Fabric is an open-source framework for augmenting humans using AI. It provides a modular system for solving specific problems using a crowdsourced set of AI prompts that can be used anywhere.,danielmiessler,Go,"37,638","3,765",743 stars this week,https://github.com//danielmiessler/Fabric,GitHub_Go_weekly,2026-01-04 10:39:31
5,hugo,The world’s fastest framework for building websites.,bep,Go,"85,750","8,161",197 stars this week,https://github.com//gohugoio/hugo,GitHub_Go_weekly,2026-01-04 10:39:31
6,go-ios,"This is an operating system independent implementation of iOS device features. You can run UI tests, launch or kill apps, install apps etc. with it.",danielpaulus,Go,"1,686",275,218 stars this week,https://github.com//danielpaulus/go-ios,GitHub_Go_weekly,2026-01-04 10:39:31
7,axonhub,"AxonHub is a modern AI gateway system that provides a unified OpenAI ( Chat Completion, Responses), Anthropic, Gemini and AI SDK compatible API",looplj,Go,"1,206",140,224 stars this week,https://github.com//looplj/axonhub,GitHub_Go_weekly,2026-01-04 10:39:31
8,dagger,An open-source runtime for composable workflows. Great for AI agents and CI/CD.,aluzzardi,Go,"15,224",839,64 stars this week,https://github.com//dagger/dagger,GitHub_Go_weekly,2026-01-04 10:39:31
9,oh-my-posh,The most customisable and low-latency cross platform/shell prompt renderer,JanDeDobbeleer,Go,"21,095","2,655",136 stars this week,https://github.com//JanDeDobbeleer/oh-my-posh,GitHub_Go_weekly,2026-01-04 10:39:31
10,beszel,"Lightweight server monitoring hub with historical data, docker stats, and alerts.",henrygd,Go,"18,289",581,312 stars this week,https://github.com//henrygd/beszel,GitHub_Go_weekly,2026-01-04 10:39:31
11,homebox,A continuation of HomeBox the inventory and organization system built for the Home User,weblate,Go,"4,727",298,156 stars this week,https://github.com//sysadminsmedia/homebox,GitHub_Go_weekly,2026-01-04 10:39:31
12,pgx,PostgreSQL driver and toolkit for Go,jackc,Go,"13,122",979,46 stars this week,https://github.com//jackc/pgx,GitHub_Go_weekly,2026-01-04 10:39:31
13,Scriberr,Self-hosted AI audio transcription,rishikanthc,Go,"1,801",132,189 stars this week,https://github.com//rishikanthc/Scriberr,GitHub_Go_weekly,2026-01-04 10:39:31
14,glance,A self-hosted dashboard that puts all your feeds in one place,svilenmarkov,Go,"30,913","1,153",305 stars this week,https://github.com//glanceapp/glance,GitHub_Go_weekly,2026-01-04 10:39:31
15,validator,"💯Go Struct and Field validation, including Cross Field, Cross Struct, Map, Slice and Array diving",nodivbyzero,Go,"19,533","1,397",28 stars this week,https://github.com//go-playground/validator,GitHub_Go_weekly,2026-01-04 10:39:31
16,syncthing,Open Source Continuous File Synchronization,calmh,Go,"78,728","4,871",207 stars this week,https://github.com//syncthing/syncthing,GitHub_Go_weekly,2026-01-04 10:39:31
1,free-for-dev,"A list of SaaS, PaaS and IaaS offerings that have free tiers of interest to devops and infradev",ripienaar,HTML,"116,966","11,959",441 stars this week,https://github.com//ripienaar/free-for-dev,GitHub_HTML_weekly,2026-01-04 10:39:31
2,hugo-theme-stack,Card-style Hugo theme designed for bloggers,CaiJimmy,HTML,"6,168","1,950",24 stars this week,https://github.com//CaiJimmy/hugo-theme-stack,GitHub_HTML_weekly,2026-01-04 10:39:31
3,epg,Utilities for downloading the EPG (Electronic Program Guide) for thousands of TV channels from hundreds of sources.,freearhey,HTML,"2,665",387,32 stars this week,https://github.com//iptv-org/epg,GitHub_HTML_weekly,2026-01-04 10:39:31
4,OpenClash,A Clash Client For OpenWrt,vernesong,HTML,"23,403","3,677",119 stars this week,https://github.com//vernesong/OpenClash,GitHub_HTML_weekly,2026-01-04 10:39:31
5,UsbGpib,"Versatile, cheap and portable USB to GPIB converter (USBTMC class based)",xyphro,HTML,551,76,70 stars this week,https://github.com//xyphro/UsbGpib,GitHub_HTML_weekly,2026-01-04 10:39:31
6,FreeDomain,DigitalPlat FreeDomain: Free Domain For Everyone,EdwardLab,HTML,"136,979","2,434","2,505 stars this week",https://github.com//DigitalPlatDev/FreeDomain,GitHub_HTML_weekly,2026-01-04 10:39:31
7,ArkOS-R3XS,Community Maintained Image of ArkOS for the RetroBox Console / Game Station / Game Consoie R35S / R36S / PowKiddy RGB20S,AeolusUX,HTML,"1,320",51,31 stars this week,https://github.com//AeolusUX/ArkOS-R3XS,GitHub_HTML_weekly,2026-01-04 10:39:31
8,home-assistant.io,📘 Home Assistant User documentation,frenck,HTML,"7,746","8,051",37 stars this week,https://github.com//home-assistant/home-assistant.io,GitHub_HTML_weekly,2026-01-04 10:39:31
9,computer-science,🎓 Path to a free self-taught education in Computer Science!,ericdouglas,HTML,"199,769","24,858",320 stars this week,https://github.com//ossu/computer-science,GitHub_HTML_weekly,2026-01-04 10:39:31
10,blog_os,Writing an OS in Rust,phil-opp,HTML,"17,178","1,189",24 stars this week,https://github.com//phil-opp/blog_os,GitHub_HTML_weekly,2026-01-04 10:39:31
11,Evil-M5Project,"Evil-M5Project is an innovative tool developed for ethical hacking and exploration of WiFi networks. It's compatible with Cardputer, Atoms3, Fire, core2. You can scan, monitor, and interact with WiFi networks in a controlled environment. This project is designed for educational purposes, aiding in understanding network security and vulnerabilities",7h30th3r0n3,HTML,"1,786",176,32 stars this week,https://github.com//7h30th3r0n3/Evil-M5Project,GitHub_HTML_weekly,2026-01-04 10:39:31
12,n8n-docs,"Documentation for n8n, a fair-code licensed automation tool with a free community edition and powerful enterprise options. Build AI functionality into your workflows.",tanay1337,HTML,"1,364","3,398",16 stars this week,https://github.com//n8n-io/n8n-docs,GitHub_HTML_weekly,2026-01-04 10:39:31
