index,title,desc,author,language,stars,forks,today_forks,url,type,datetime
8,keploy,"API, Integration, E2E Testing Agent for Developers that actually work. Generate tests, mocks/stubs for your APIs!",gouravkrosx,Go,"14,459","1,918",824 stars this week,https://github.com//keploy/keploy,GitHub_Go_weekly,2026-01-03 14:47:56
9,syncthing,Open Source Continuous File Synchronization,calmh,Go,"78,702","4,870",198 stars this week,https://github.com//syncthing/syncthing,GitHub_Go_weekly,2026-01-03 14:47:56
10,beszel,"Lightweight server monitoring hub with historical data, docker stats, and alerts.",henrygd,Go,"18,259",578,349 stars this week,https://github.com//henrygd/beszel,GitHub_Go_weekly,2026-01-03 14:47:56
11,awesome-go,"A curated list of awesome Go frameworks, libraries and software",avelino,Go,"161,605","12,867",648 stars this week,https://github.com//avelino/awesome-go,GitHub_Go_weekly,2026-01-03 14:47:56
12,homebox,A continuation of HomeBox the inventory and organization system built for the Home User,weblate,Go,"4,706",297,173 stars this week,https://github.com//sysadminsmedia/homebox,GitHub_Go_weekly,2026-01-03 14:47:56
13,oh-my-posh,The most customisable and low-latency cross platform/shell prompt renderer,JanDeDobbeleer,Go,"21,083","2,654",129 stars this week,https://github.com//JanDeDobbeleer/oh-my-posh,GitHub_Go_weekly,2026-01-03 14:47:56
14,glance,A self-hosted dashboard that puts all your feeds in one place,svilenmarkov,Go,"30,876","1,152",282 stars this week,https://github.com//glanceapp/glance,GitHub_Go_weekly,2026-01-03 14:47:56
15,dagger,An open-source runtime for composable workflows. Great for AI agents and CI/CD.,aluzzardi,Go,"15,219",838,60 stars this week,https://github.com//dagger/dagger,GitHub_Go_weekly,2026-01-03 14:47:56
1,free-for-dev,"A list of SaaS, PaaS and IaaS offerings that have free tiers of interest to devops and infradev",ripienaar,HTML,"116,935","11,954",417 stars this week,https://github.com//ripienaar/free-for-dev,GitHub_HTML_weekly,2026-01-03 14:47:56
2,FreeDomain,DigitalPlat FreeDomain: Free Domain For Everyone,EdwardLab,HTML,"136,770","2,425","2,709 stars this week",https://github.com//DigitalPlatDev/FreeDomain,GitHub_HTML_weekly,2026-01-03 14:47:56
3,OpenClash,A Clash Client For OpenWrt,vernesong,HTML,"23,391","3,677",124 stars this week,https://github.com//vernesong/OpenClash,GitHub_HTML_weekly,2026-01-03 14:47:56
4,WatermarkRemover-AI,"AI-Powered Watermark Remover using Florence-2 and LaMA: Remove watermarks from images and videos, including AI-generated content from Sora, Runway, and others. Features a modern PyWebview GUI.",D-Ogi,HTML,903,188,45 stars this week,https://github.com//D-Ogi/WatermarkRemover-AI,GitHub_HTML_weekly,2026-01-03 14:47:56
5,computer-science,🎓 Path to a free self-taught education in Computer Science!,ericdouglas,HTML,"199,741","24,855",315 stars this week,https://github.com//ossu/computer-science,GitHub_HTML_weekly,2026-01-03 14:47:56
6,blog_os,Writing an OS in Rust,phil-opp,HTML,"17,176","1,189",31 stars this week,https://github.com//phil-opp/blog_os,GitHub_HTML_weekly,2026-01-03 14:47:56
7,UsbGpib,"Versatile, cheap and portable USB to GPIB converter (USBTMC class based)",xyphro,HTML,551,76,77 stars this week,https://github.com//xyphro/UsbGpib,GitHub_HTML_weekly,2026-01-03 14:47:56
8,zoraxy,A general purpose HTTP reverse proxy and forwarding tool. Now written in Go!,tobychui,HTML,"4,790",268,68 stars this week,https://github.com//tobychui/zoraxy,GitHub_HTML_weekly,2026-01-03 14:47:56
9,ArkOS-R3XS,Community Maintained Image of ArkOS for the RetroBox Console / Game Station / Game Consoie R35S / R36S / PowKiddy RGB20S,AeolusUX,HTML,"1,319",50,32 stars this week,https://github.com//AeolusUX/ArkOS-R3XS,GitHub_HTML_weekly,2026-01-03 14:47:56
10,hugo-theme-stack,Card-style Hugo theme designed for bloggers,CaiJimmy,HTML,"6,169","1,951",26 stars this week,https://github.com//CaiJimmy/hugo-theme-stack,GitHub_HTML_weekly,2026-01-03 14:47:56
11,home-assistant.io,📘 Home Assistant User documentation,frenck,HTML,"7,744","8,049",37 stars this week,https://github.com//home-assistant/home-assistant.io,GitHub_HTML_weekly,2026-01-03 14:47:56
12,Evil-M5Project,"Evil-M5Project is an innovative tool developed for ethical hacking and exploration of WiFi networks. It's compatible with Cardputer, Atoms3, Fire, core2. You can scan, monitor, and interact with WiFi networks in a controlled environment. This project is designed for educational purposes, aiding in understanding network security and vulnerabilities",7h30th3r0n3,HTML,"1,786",176,37 stars this week,https://github.com//7h30th3r0n3/Evil-M5Project,GitHub_HTML_weekly,2026-01-03 14:47:56
13,NetherSX2-patch,Continuation of NetherSX2 based on AetherSX2 4248,Trixarian,HTML,"1,841",68,34 stars this week,https://github.com//Trixarian/NetherSX2-patch,GitHub_HTML_weekly,2026-01-03 14:47:56
14,n8n-docs,"Documentation for n8n, a fair-code licensed automation tool with a free community edition and powerful enterprise options. Build AI functionality into your workflows.",tanay1337,HTML,"1,360","3,394",14 stars this week,https://github.com//n8n-io/n8n-docs,GitHub_HTML_weekly,2026-01-03 14:47:56
15,wpt,"Test suites for Web platform specs — including WHATWG, W3C, and others",jgraham,HTML,"5,700","3,603",13 stars this week,https://github.com//web-platform-tests/wpt,GitHub_HTML_weekly,2026-01-03 14:47:56
16,hugo-PaperMod,"A fast, clean, responsive Hugo theme.",adityatelange,HTML,"12,904","3,319",38 stars this week,https://github.com//adityatelange/hugo-PaperMod,GitHub_HTML_weekly,2026-01-03 14:47:56
1,cs249r_book,Introduction to Machine Learning Systems,profvjreddi,JavaScript,"14,897","1,691","3,444 stars this week",https://github.com//harvard-edge/cs249r_book,GitHub_JavaScript_weekly,2026-01-03 14:47:56
2,desktop,Welcome to a calmer internet,mr-cheffy,JavaScript,"39,204","1,256",377 stars this week,https://github.com//zen-browser/desktop,GitHub_JavaScript_weekly,2026-01-03 14:47:56
3,uptime-kuma,A fancy self-hosted monitoring tool,louislam,JavaScript,"80,706","7,194",511 stars this week,https://github.com//louislam/uptime-kuma,GitHub_JavaScript_weekly,2026-01-03 14:47:56
4,OpenSign,🔥 The free & Open Source DocuSign alternative,prafull-opensignlabs,JavaScript,"5,753",607,214 stars this week,https://github.com//OpenSignLabs/OpenSign,GitHub_JavaScript_weekly,2026-01-03 14:47:56
5,ToolJet,"ToolJet is the open-source foundation of ToolJet AI - the AI-native platform for building internal tools, dashboard, business applications, workflows and AI agents 🚀",Navaneeth-pk,JavaScript,"37,107","4,917",49 stars this week,https://github.com//ToolJet/ToolJet,GitHub_JavaScript_weekly,2026-01-03 14:47:56
6,LinkSwift,一个基于 JavaScript 的网盘文件下载地址获取工具。基于【网盘直链下载助手】修改 ，支持 百度网盘 / 阿里云盘 / 中国移动云盘 / 天翼云盘 / 迅雷云盘 / 夸克网盘 / UC网盘 / 123云盘 八大网盘,hmjz100,JavaScript,"10,815",597,387 stars this week,https://github.com//hmjz100/LinkSwift,GitHub_JavaScript_weekly,2026-01-03 14:47:56
7,AIClient-2-API,"Simulates Gemini CLI, Antigravity, Qwen Code, and Kiro client requests, compatible with the OpenAI API. It supports thousands of Gemini model requests per day and offers free use of the built-in Claude model in Kiro. Easily connect to any client via the API, making AI development more efficient!",justlikemaki,JavaScript,"2,175",339,154 stars this week,https://github.com//justlovemaki/AIClient-2-API,GitHub_JavaScript_weekly,2026-01-03 14:47:56
8,openmtp,OpenMTP - Advanced Android File Transfer Application for macOS,ganeshrvel,JavaScript,"5,948",241,98 stars this week,https://github.com//ganeshrvel/openmtp,GitHub_JavaScript_weekly,2026-01-03 14:47:56
9,no-as-a-service,"No-as-a-Service (NaaS) is a simple API that returns a random rejection reason. Use it when you need a realistic excuse, a fun “no,” or want to simulate being turned down in style.",hotheadhacker,JavaScript,"4,580",268,497 stars this week,https://github.com//hotheadhacker/no-as-a-service,GitHub_JavaScript_weekly,2026-01-03 14:47:56
10,webvm,Virtual Machine for the Web,alexp-sssup,JavaScript,"16,194","2,998",175 stars this week,https://github.com//leaningtech/webvm,GitHub_JavaScript_weekly,2026-01-03 14:47:56
11,Web-Dev-For-Beginners,"24 Lessons, 12 Weeks, Get Started as a Web Developer",jlooper,JavaScript,"94,856","14,955",151 stars this week,https://github.com//microsoft/Web-Dev-For-Beginners,GitHub_JavaScript_weekly,2026-01-03 14:47:56
12,tvbox,OK影视、tvbox配置文件，如果喜欢，请Fork自用。使用前请仔细阅读仓库说明，一旦使用将被视为你已了解。,gaotianliuyun,JavaScript,"7,318","2,776",99 stars this week,https://github.com//qist/tvbox,GitHub_JavaScript_weekly,2026-01-03 14:47:56
13,lighthouse,"Automated auditing, performance metrics, and best practices for the web.",paulirish,JavaScript,"29,675","9,631",19 stars this week,https://github.com//GoogleChrome/lighthouse,GitHub_JavaScript_weekly,2026-01-03 14:47:56
14,GDevelop,"🎮 Open-source, cross-platform 2D/3D/multiplayer game engine designed for everyone.",4ian,JavaScript,"19,027","1,207",226 stars this week,https://github.com//4ian/GDevelop,GitHub_JavaScript_weekly,2026-01-03 14:47:56
15,free-games-claimer,"Automatically claims free games and DLCs on the Epic Games Store, Amazon Prime Gaming and GOG.",vogler,JavaScript,"3,895",221,135 stars this week,https://github.com//vogler/free-games-claimer,GitHub_JavaScript_weekly,2026-01-03 14:47:56
1,memos,"An open-source, self-hosted note-taking service. Your thoughts, your data, your control — no tracking, no ads, no subscription fees.",boojack,Go,"49,350","3,563",841 stars today,https://github.com//usememos/memos,GitHub_Go_daily,2026-01-03 21:00:16
2,newsnow,Elegant reading of real-time and hottest news,ourongxing,TypeScript,"16,180","4,741",314 stars today,https://github.com//ourongxing/newsnow,GitHub_TypeScript_daily,2026-01-03 21:00:16
3,pathway,"Python ETL framework for stream processing, real-time analytics, LLM pipelines, and RAG.",Pathway-Dev,Python,"55,795","1,518","1,274 stars today",https://github.com//pathwaycom/pathway,GitHub_Python_daily,2026-01-03 21:00:16
4,OpenBB,"Financial data platform for analysts, quants and AI agents.",jmaslek,Python,"56,226","5,469",52 stars today,https://github.com//OpenBB-finance/OpenBB,GitHub_Python_daily,2026-01-03 21:00:16
5,docker-android,🤖 A minimal and customizable Docker image running the Android emulator as a service.,HQarroum,Shell,"1,960",121,525 stars today,https://github.com//HQarroum/docker-android,GitHub_Shell_daily,2026-01-03 21:00:16
6,beancount,Beancount: Double-Entry Accounting from Text Files.,blais,Python,"4,878",384,111 stars today,https://github.com//beancount/beancount,GitHub_Python_daily,2026-01-03 21:00:16
7,maplibre-gl-js,MapLibre GL JS - Interactive vector tile maps in the browser,dependabot,TypeScript,"8,929",951,25 stars today,https://github.com//maplibre/maplibre-gl-js,GitHub_TypeScript_daily,2026-01-03 21:00:16
8,nuclear,Streaming music player that finds free music for you,nukeop,TypeScript,"16,655","1,249",95 stars today,https://github.com//nukeop/nuclear,GitHub_TypeScript_daily,2026-01-03 21:00:16
1,vibe-kanban,"Get 10X more out of Claude Code, Codex or any coding agent",stunningpixels,Rust,"11,636","1,048","4,424 stars this week",https://github.com//BloopAI/vibe-kanban,GitHub_Rust_weekly,2026-01-03 21:00:16
2,cs249r_book,Introduction to Machine Learning Systems,profvjreddi,JavaScript,"14,952","1,697","3,444 stars this week",https://github.com//harvard-edge/cs249r_book,GitHub_JavaScript_weekly,2026-01-03 21:00:16
3,SpotiFLAC,"Get Spotify tracks in true FLAC from Tidal, Qobuz & Amazon Music — no account required.",afkarxyz,TypeScript,"2,131",126,"1,305 stars this week",https://github.com//afkarxyz/SpotiFLAC,GitHub_TypeScript_weekly,2026-01-03 21:00:16
4,chatterbox,SoTA open-source TTS,fatchord,Python,"20,351","2,653","2,316 stars this week",https://github.com//resemble-ai/chatterbox,GitHub_Python_weekly,2026-01-03 21:00:16
5,metube,Self-hosted YouTube downloader (web UI for youtube-dl / yt-dlp),alexta69,Python,"11,879",805,592 stars this week,https://github.com//alexta69/metube,GitHub_Python_weekly,2026-01-03 21:00:16
6,gumroad,Sell stuff and see what sticks,devin-ai-integration,Ruby,"8,088","1,559",251 stars this week,https://github.com//antiwork/gumroad,GitHub_Ruby_weekly,2026-01-03 21:00:16
7,memos,"An open-source, self-hosted note-taking service. Your thoughts, your data, your control — no tracking, no ads, no subscription fees.",boojack,Go,"49,350","3,563","1,079 stars this week",https://github.com//usememos/memos,GitHub_Go_weekly,2026-01-03 21:00:16
8,zapret-discord-youtube,,Flowseal,Batchfile,"20,535","1,713",877 stars this week,https://github.com//Flowseal/zapret-discord-youtube,GitHub_Batchfile_weekly,2026-01-03 21:00:16
9,skills,Public repository for Agent Skills,klazuka,Python,"32,054","2,909","4,277 stars this week",https://github.com//anthropics/skills,GitHub_Python_weekly,2026-01-03 21:00:16
10,computer-use-preview,,sammccauley117,Python,"2,455",314,521 stars this week,https://github.com//google-gemini/computer-use-preview,GitHub_Python_weekly,2026-01-03 21:00:16
11,Personal_AI_Infrastructure,Personal AI Infrastructure for upgrading humans.,danielmiessler,TypeScript,"2,991",550,740 stars this week,https://github.com//danielmiessler/Personal_AI_Infrastructure,GitHub_TypeScript_weekly,2026-01-03 21:00:16
12,postiz-app,"📨 The ultimate social media scheduling tool, with a bunch of AI 🤖",nevo-david,TypeScript,"25,746","4,361",778 stars this week,https://github.com//gitroomhq/postiz-app,GitHub_TypeScript_weekly,2026-01-03 21:00:16
1,claude-mem,"A Claude Code plugin that automatically captures everything Claude does during your coding sessions, compresses it with AI (using Claude's agent-sdk), and injects relevant context back into future sessions.",thedotmack,TypeScript,"10,045",611,"9,505 stars this month",https://github.com//thedotmack/claude-mem,GitHub_TypeScript_monthly,2026-01-03 21:00:16
2,VibeVoice,Open-Source Frontier Voice AI,YaoyaoChang,Python,"19,359","2,150","9,352 stars this month",https://github.com//microsoft/VibeVoice,GitHub_Python_monthly,2026-01-03 21:00:16
3,next-ai-draw-io,"A next.js web application that integrates AI capabilities with draw.io diagrams. This app allows you to create, modify, and enhance diagrams through natural language commands and AI-assisted visualization.",DayuanJiang,TypeScript,"16,456","1,695","14,593 stars this month",https://github.com//DayuanJiang/next-ai-draw-io,GitHub_TypeScript_monthly,2026-01-03 21:00:16
4,exo,Run your own AI cluster at home with everyday devices 📱💻 🖥️⌚,AlexCheema,Python,"39,288","2,653","6,701 stars this month",https://github.com//exo-explore/exo,GitHub_Python_monthly,2026-01-03 21:00:16
5,opencode,The open source coding agent.,thdxr,TypeScript,"45,992","3,978","11,006 stars this month",https://github.com//anomalyco/opencode,GitHub_TypeScript_monthly,2026-01-03 21:00:16
6,hello-agents,📚 《从零开始构建智能体》——从零开始的智能体原理与实践教程,jjyaoao,Python,"13,886","1,470","8,438 stars this month",https://github.com//datawhalechina/hello-agents,GitHub_Python_monthly,2026-01-03 21:00:16
7,WeKnora,"LLM-powered framework for deep document understanding, semantic retrieval, and context-aware answers using RAG paradigm.",lyingbug,Go,"10,786","1,159","3,080 stars this month",https://github.com//Tencent/WeKnora,GitHub_Go_monthly,2026-01-03 21:00:16
8,agents.md,"AGENTS.md — a simple, open format for guiding coding agents",romainhuet,TypeScript,"13,946",985,"5,175 stars this month",https://github.com//agentsmd/agents.md,GitHub_TypeScript_monthly,2026-01-03 21:00:16
9,chatterbox,SoTA open-source TTS,fatchord,Python,"20,351","2,653","5,467 stars this month",https://github.com//resemble-ai/chatterbox,GitHub_Python_monthly,2026-01-03 21:00:16
10,vibe-kanban,"Get 10X more out of Claude Code, Codex or any coding agent",stunningpixels,Rust,"11,636","1,048","5,046 stars this month",https://github.com//BloopAI/vibe-kanban,GitHub_Rust_monthly,2026-01-03 21:00:16
11,sim,Open-source platform to build and deploy AI agent workflows.,waleedlatif1,TypeScript,"24,879","3,108","6,371 stars this month",https://github.com//simstudioai/sim,GitHub_TypeScript_monthly,2026-01-03 21:00:16
12,claude-code,"Claude Code is an agentic coding tool that lives in your terminal, understands your codebase, and helps you code faster by executing routine tasks, explaining complex code, and handling git workflows - all through natural language commands.",actions-user,Shell,"50,651","3,619","6,365 stars this month",https://github.com//anthropics/claude-code,GitHub_Shell_monthly,2026-01-03 21:00:16
13,skills,Public repository for Agent Skills,klazuka,Python,"32,054","2,909","12,685 stars this month",https://github.com//anthropics/skills,GitHub_Python_monthly,2026-01-03 21:00:16
14,claude-quickstarts,A collection of projects designed to help developers quickly get started with building deployable applications using the Claude API,x5a,Python,"13,147","2,189","2,636 stars this month",https://github.com//anthropics/claude-quickstarts,GitHub_Python_monthly,2026-01-03 21:00:16
15,Personal_AI_Infrastructure,Personal AI Infrastructure for upgrading humans.,danielmiessler,TypeScript,"2,991",550,"1,791 stars this month",https://github.com//danielmiessler/Personal_AI_Infrastructure,GitHub_TypeScript_monthly,2026-01-03 21:00:16
16,cocoindex,"Data transformation framework for AI. Ultra performant, with incremental processing. 🌟 Star if you like it!",badmonster0,Rust,"5,621",414,"2,128 stars this month",https://github.com//cocoindex-io/cocoindex,GitHub_Rust_monthly,2026-01-03 21:00:16
1,vibe-kanban,"Get 10X more out of Claude Code, Codex or any coding agent",stunningpixels,Rust,"11,636","1,048","4,424 stars this week",https://github.com//BloopAI/vibe-kanban,GitHub_Rust_weekly,2026-01-03 21:00:16
2,cs249r_book,Introduction to Machine Learning Systems,profvjreddi,JavaScript,"14,952","1,697","3,444 stars this week",https://github.com//harvard-edge/cs249r_book,GitHub_JavaScript_weekly,2026-01-03 21:00:16
3,SpotiFLAC,"Get Spotify tracks in true FLAC from Tidal, Qobuz & Amazon Music — no account required.",afkarxyz,TypeScript,"2,131",126,"1,305 stars this week",https://github.com//afkarxyz/SpotiFLAC,GitHub_TypeScript_weekly,2026-01-03 21:00:16
4,chatterbox,SoTA open-source TTS,fatchord,Python,"20,351","2,653","2,316 stars this week",https://github.com//resemble-ai/chatterbox,GitHub_Python_weekly,2026-01-03 21:00:16
5,metube,Self-hosted YouTube downloader (web UI for youtube-dl / yt-dlp),alexta69,Python,"11,879",805,592 stars this week,https://github.com//alexta69/metube,GitHub_Python_weekly,2026-01-03 21:00:16
6,gumroad,Sell stuff and see what sticks,devin-ai-integration,Ruby,"8,088","1,559",251 stars this week,https://github.com//antiwork/gumroad,GitHub_Ruby_weekly,2026-01-03 21:00:16
7,memos,"An open-source, self-hosted note-taking service. Your thoughts, your data, your control — no tracking, no ads, no subscription fees.",boojack,Go,"49,350","3,563","1,079 stars this week",https://github.com//usememos/memos,GitHub_Go_weekly,2026-01-03 21:00:16
8,zapret-discord-youtube,,Flowseal,Batchfile,"20,535","1,713",877 stars this week,https://github.com//Flowseal/zapret-discord-youtube,GitHub_Batchfile_weekly,2026-01-03 21:00:16
9,skills,Public repository for Agent Skills,klazuka,Python,"32,054","2,909","4,277 stars this week",https://github.com//anthropics/skills,GitHub_Python_weekly,2026-01-03 21:00:16
10,computer-use-preview,,sammccauley117,Python,"2,455",314,521 stars this week,https://github.com//google-gemini/computer-use-preview,GitHub_Python_weekly,2026-01-03 21:00:16
11,Personal_AI_Infrastructure,Personal AI Infrastructure for upgrading humans.,danielmiessler,TypeScript,"2,991",550,740 stars this week,https://github.com//danielmiessler/Personal_AI_Infrastructure,GitHub_TypeScript_weekly,2026-01-03 21:00:16
12,postiz-app,"📨 The ultimate social media scheduling tool, with a bunch of AI 🤖",nevo-david,TypeScript,"25,746","4,361",778 stars this week,https://github.com//gitroomhq/postiz-app,GitHub_TypeScript_weekly,2026-01-03 21:00:16
1,termux-app,Termux - a terminal emulator application for Android OS extendible by variety of packages.,agnostic-apollo,Java,"48,396","5,786",249 stars this week,https://github.com//termux/termux-app,GitHub_Java_weekly,2026-01-03 21:00:16
2,Create,[NeoForge Mod] Building Tools and Aesthetic Technology,simibubi,Java,"3,882","1,188",18 stars this week,https://github.com//Creators-of-Create/Create,GitHub_Java_weekly,2026-01-03 21:00:16
3,Xed-Editor,Advanced Text Editor for Android,RohitKushvaha01,Java,"1,462",88,88 stars this week,https://github.com//Xed-Editor/Xed-Editor,GitHub_Java_weekly,2026-01-03 21:00:16
4,voxy,An LoD rendering mod for minecraft,MCRcortex,Java,597,145,62 stars this week,https://github.com//MCRcortex/voxy,GitHub_Java_weekly,2026-01-03 21:00:16
5,thingsboard,"Open-source IoT Platform - Device management, data collection, processing and visualization.",ikulikov,Java,"20,853","6,012",169 stars this week,https://github.com//thingsboard/thingsboard,GitHub_Java_weekly,2026-01-03 21:00:16
6,Paper,"The most widely used, high performance Minecraft server that aims to fix gameplay and mechanics inconsistencies",Machine-Maker,Java,"11,808","3,189",24 stars this week,https://github.com//PaperMC/Paper,GitHub_Java_weekly,2026-01-03 21:00:16
7,mockito,Most popular Mocking framework for unit tests written in Java,mockitoguy,Java,"15,384","2,648",43 stars this week,https://github.com//mockito/mockito,GitHub_Java_weekly,2026-01-03 21:00:16
8,cloudstack,Apache CloudStack is an opensource Infrastructure as a Service (IaaS) cloud computing platform,yadvr,Java,"2,752","1,256",8 stars this week,https://github.com//apache/cloudstack,GitHub_Java_weekly,2026-01-03 21:00:16
9,GhidraMCP,MCP Server for Ghidra,LaurieWired,Java,"6,973",556,158 stars this week,https://github.com//LaurieWired/GhidraMCP,GitHub_Java_weekly,2026-01-03 21:00:16
10,awesome-leetcode-resources,Awesome LeetCode resources to learn Data Structures and Algorithms and prepare for Coding Interviews.,ashishps1,Java,"14,949","3,269",157 stars this week,https://github.com//ashishps1/awesome-leetcode-resources,GitHub_Java_weekly,2026-01-03 21:00:16
11,lawnchair,No clever tagline needed.,sunnygoyal,Java,"11,743","1,412",77 stars this week,https://github.com//LawnchairLauncher/lawnchair,GitHub_Java_weekly,2026-01-03 21:00:16
12,himarket,"HiMarket is an enterprise-level ""AI Capability Marketplace and Developer Ecosystem Hub."" It is not merely a simple aggregation of traditional APIs, but rather a comprehensive platform that packages, publishes, manages, and operates core AI assets such as enterprise Model APIs, MCP Servers, Agent APIs, etc., through standardized product formats.",learnerjohn,Java,555,85,77 stars this week,https://github.com//higress-group/himarket,GitHub_Java_weekly,2026-01-03 21:00:16
13,kestra,Event Driven Orchestration & Scheduling Platform for Mission Critical Applications,tchiotludo,Java,"26,209","2,426",91 stars this week,https://github.com//kestra-io/kestra,GitHub_Java_weekly,2026-01-03 21:00:16
14,meteor-client,Based Minecraft utility mod.,MineGame159,Java,"3,155","1,293",26 stars this week,https://github.com//MeteorDevelopment/meteor-client,GitHub_Java_weekly,2026-01-03 21:00:16
15,Mindustry,The automation tower defense RTS,Anuken,Java,"26,118","3,331",73 stars this week,https://github.com//Anuken/Mindustry,GitHub_Java_weekly,2026-01-03 21:00:16
16,DSA-Bootcamp-Java,"This repository consists of the code samples, assignments, and notes for the Java data structures & algorithms + interview preparation bootcamp of WeMakeDevs.",kunal-kushwaha,Java,"21,491","12,894",78 stars this week,https://github.com//kunal-kushwaha/DSA-Bootcamp-Java,GitHub_Java_weekly,2026-01-03 21:00:16
17,Telegram,Telegram for Android source,xaxtix,Java,"28,256","9,174",72 stars this week,https://github.com//DrKLO/Telegram,GitHub_Java_weekly,2026-01-03 21:00:16
18,fabric-example-mod,Example Fabric mod,modmuss50,Java,"2,065","1,185",10 stars this week,https://github.com//FabricMC/fabric-example-mod,GitHub_Java_weekly,2026-01-03 21:00:16
19,guava,Google core libraries for Java,cpovirk,Java,"51,388","11,125",34 stars this week,https://github.com//google/guava,GitHub_Java_weekly,2026-01-03 21:00:16
20,kafka,Mirror of Apache Kafka,ijuma,Java,"31,638","14,876",54 stars this week,https://github.com//apache/kafka,GitHub_Java_weekly,2026-01-03 21:00:16
1,chatterbox,SoTA open-source TTS,fatchord,Python,"20,351","2,653","2,316 stars this week",https://github.com//resemble-ai/chatterbox,GitHub_Python_weekly,2026-01-03 21:00:16
2,metube,Self-hosted YouTube downloader (web UI for youtube-dl / yt-dlp),alexta69,Python,"11,879",805,592 stars this week,https://github.com//alexta69/metube,GitHub_Python_weekly,2026-01-03 21:00:16
3,skills,Public repository for Agent Skills,klazuka,Python,"32,054","2,909","4,277 stars this week",https://github.com//anthropics/skills,GitHub_Python_weekly,2026-01-03 21:00:16
4,computer-use-preview,,sammccauley117,Python,"2,455",314,521 stars this week,https://github.com//google-gemini/computer-use-preview,GitHub_Python_weekly,2026-01-03 21:00:16
5,LEANN,"RAG on Everything with LEANN. Enjoy 97% storage savings while running a fast, accurate, and 100% private RAG application on your personal device.",yichuan-w,Python,"8,001",720,"1,630 stars this week",https://github.com//yichuan-w/LEANN,GitHub_Python_weekly,2026-01-03 21:00:16
6,olmocr,Toolkit for linearizing PDFs for LLM datasets/training,jakep-allenai,Python,"16,559","1,304",187 stars this week,https://github.com//allenai/olmocr,GitHub_Python_weekly,2026-01-03 21:00:16
