index,title,desc,author,language,stars,forks,today_forks,url,type,datetime
6,3x-ui,"Xray panel supporting multi-protocol multi-user expire day & traffic & IP limit (Vmess, Vless, Trojan, ShadowSocks, Wireguard, Tunnel, Mixed, HTTP, Tun)",MHSanaei,HTML,"29,299","5,776",379 stars this week,https://github.com//MHSanaei/3x-ui,GitHub_HTML_weekly,2026-01-29 15:05:31
7,Top10,Official OWASP Top 10 Document Repository,vanderaj,HTML,"5,188","1,014",38 stars this week,https://github.com//OWASP/Top10,GitHub_HTML_weekly,2026-01-29 15:05:31
8,unstructured,"Convert documents to structured data effortlessly. Unstructured is open-source ETL solution for transforming complex documents into clean, structured formats for language models. Visit our website to learn more about our enterprise grade Platform product for production grade workflows, partitioning, enrichments, chunking and embedding.",MthwRobinson,HTML,"13,796","1,146",93 stars this week,https://github.com//Unstructured-IO/unstructured,GitHub_HTML_weekly,2026-01-29 15:05:31
9,confluent-kafka-go,Confluent's Apache Kafka Golang client,edenhill,HTML,"5,098",696,12 stars this week,https://github.com//confluentinc/confluent-kafka-go,GitHub_HTML_weekly,2026-01-29 15:05:31
10,html-css,Curso de HTML5 e CSS3,gustavoguanabara,HTML,"15,907","3,804",47 stars this week,https://github.com//gustavoguanabara/html-css,GitHub_HTML_weekly,2026-01-29 15:05:31
11,ecma262,"Status, process, and documents for ECMA-262",jmdyck,HTML,"15,579","1,389",12 stars this week,https://github.com//tc39/ecma262,GitHub_HTML_weekly,2026-01-29 15:05:31
12,wpt,"Test suites for Web platform specs — including WHATWG, W3C, and others",jgraham,HTML,"5,753","3,639",20 stars this week,https://github.com//web-platform-tests/wpt,GitHub_HTML_weekly,2026-01-29 15:05:31
13,Delta,,apna-college,HTML,"1,018","1,205",7 stars this week,https://github.com//apna-college/Delta,GitHub_HTML_weekly,2026-01-29 15:05:31
1,awesome-copilot,"Community-contributed instructions, prompts, and configurations to help you make the most of GitHub Copilot.",aaronpowell,JavaScript,"19,392","2,212",981 stars this week,https://github.com//github/awesome-copilot,GitHub_JavaScript_weekly,2026-01-29 15:05:31
2,anime,JavaScript animation engine,juliangarnier,JavaScript,"66,267","4,436",221 stars this week,https://github.com//juliangarnier/anime,GitHub_JavaScript_weekly,2026-01-29 15:05:31
3,social-analyzer,"API, CLI, and Web App for analyzing and finding a person's profile in 1000 social media \ websites",giga-a,JavaScript,"20,659","1,922",223 stars this week,https://github.com//qeeqbox/social-analyzer,GitHub_JavaScript_weekly,2026-01-29 15:05:31
4,system_prompts_leaks,"Collection of extracted System Prompts from popular chatbots like ChatGPT, Claude & Gemini",asgeirtj,JavaScript,"26,903","4,303",928 stars this week,https://github.com//asgeirtj/system_prompts_leaks,GitHub_JavaScript_weekly,2026-01-29 15:05:31
5,jquery,jQuery JavaScript Library,jeresig,JavaScript,"59,815","20,499",49 stars this week,https://github.com//jquery/jquery,GitHub_JavaScript_weekly,2026-01-29 15:05:31
6,godot-mcp,"MCP server for interfacing with Godot game engine. Provides tools for launching the editor, running projects, and capturing debug output.",Coding-Solo,JavaScript,"1,571",177,94 stars this week,https://github.com//Coding-Solo/godot-mcp,GitHub_JavaScript_weekly,2026-01-29 15:05:31
7,quasar,Quasar Framework - Build high-performance VueJS user interfaces in record time,rstoenescu,JavaScript,"27,061","3,683",22 stars this week,https://github.com//quasarframework/quasar,GitHub_JavaScript_weekly,2026-01-29 15:05:31
8,smallweb,Kagi Small Web,vprelovac,JavaScript,"1,132",481,46 stars this week,https://github.com//kagisearch/smallweb,GitHub_JavaScript_weekly,2026-01-29 15:05:31
9,node,Node.js JavaScript runtime ✨🐢🚀✨,Trott,JavaScript,"115,422","34,539",150 stars this week,https://github.com//nodejs/node,GitHub_JavaScript_weekly,2026-01-29 15:05:31
10,cli,the package manager for JavaScript,isaacs,JavaScript,"9,475","4,096",21 stars this week,https://github.com//npm/cli,GitHub_JavaScript_weekly,2026-01-29 15:05:31
