index,title,desc,author,language,stars,forks,today_forks,url,type,datetime
1,docker-android,🤖 A minimal and customizable Docker image running the Android emulator as a service.,HQarroum,Shell,"1,624",95,474 stars today,https://github.com//HQarroum/docker-android,GitHub_Shell_daily,2026-01-03 02:45:02
2,nocodb,🔥 🔥 🔥 Open Source Airtable Alternative,o1lab,TypeScript,"59,877","4,450",110 stars today,https://github.com//nocodb/nocodb,GitHub_TypeScript_daily,2026-01-03 02:45:02
3,openai-cookbook,Examples and guides for using the OpenAI API,ted-at-openai,Jupyter Notebook,"70,350","11,810",28 stars today,https://github.com//openai/openai-cookbook,GitHub_Jupyter Notebook_daily,2026-01-03 02:45:02
4,newsnow,Elegant reading of real-time and hottest news,ourongxing,TypeScript,"15,979","4,702",213 stars today,https://github.com//ourongxing/newsnow,GitHub_TypeScript_daily,2026-01-03 02:45:02
5,awesome-math,A curated list of awesome mathematics resources,rossant,Python,"12,918","1,266",112 stars today,https://github.com//rossant/awesome-math,GitHub_Python_daily,2026-01-03 02:45:02
6,memos,"An open-source, self-hosted note-taking service. Your thoughts, your data, your control — no tracking, no ads, no subscription fees.",boojack,Go,"48,727","3,512",655 stars today,https://github.com//usememos/memos,GitHub_Go_daily,2026-01-03 02:45:02
7,GitHubDaily,"坚持分享 GitHub 上高质量、有趣实用的开源技术教程、开发者工具、编程网站、技术资讯。A list cool, interesting projects of GitHub.",Freelander,,"43,764","4,417",48 stars today,https://github.com//GitHubDaily/GitHubDaily,GitHub__daily,2026-01-03 02:45:02
8,faster-whisper,Faster Whisper transcription with CTranslate2,guillaumekln,Python,"20,001","1,674",102 stars today,https://github.com//SYSTRAN/faster-whisper,GitHub_Python_daily,2026-01-03 02:45:02
9,zigbee2mqtt,"Zigbee 🐝 to MQTT bridge 🌉, get rid of your proprietary Zigbee bridges 🔨",Koenkk,TypeScript,"14,477","1,881",11 stars today,https://github.com//Koenkk/zigbee2mqtt,GitHub_TypeScript_daily,2026-01-03 02:45:02
1,vibe-kanban,"Get 10X more out of Claude Code, Codex or any coding agent",stunningpixels,Rust,"11,296","1,013","3,727 stars this week",https://github.com//BloopAI/vibe-kanban,GitHub_Rust_weekly,2026-01-03 02:45:02
2,chatterbox,SoTA open-source TTS,fatchord,Python,"20,253","2,644","2,596 stars this week",https://github.com//resemble-ai/chatterbox,GitHub_Python_weekly,2026-01-03 02:45:02
3,skills,Public repository for Agent Skills,klazuka,Python,"31,750","2,876","4,237 stars this week",https://github.com//anthropics/skills,GitHub_Python_weekly,2026-01-03 02:45:02
4,cs249r_book,Introduction to Machine Learning Systems,profvjreddi,JavaScript,"14,807","1,678","2,943 stars this week",https://github.com//harvard-edge/cs249r_book,GitHub_JavaScript_weekly,2026-01-03 02:45:02
5,Infographic,"🦋 An Infographic Generation and Rendering Framework, bring words to life with AI!",Aarebecca,TypeScript,"2,539",161,"1,600 stars this week",https://github.com//antvis/Infographic,GitHub_TypeScript_weekly,2026-01-03 02:45:02
6,SpotiFLAC,"Get Spotify tracks in true FLAC from Tidal, Qobuz & Amazon Music — no account required.",afkarxyz,TypeScript,"2,061",119,"1,100 stars this week",https://github.com//afkarxyz/SpotiFLAC,GitHub_TypeScript_weekly,2026-01-03 02:45:02
7,metube,Self-hosted YouTube downloader (web UI for youtube-dl / yt-dlp),alexta69,Python,"11,836",799,515 stars this week,https://github.com//alexta69/metube,GitHub_Python_weekly,2026-01-03 02:45:02
8,gumroad,Sell stuff and see what sticks,devin-ai-integration,Ruby,"8,070","1,553",214 stars this week,https://github.com//antiwork/gumroad,GitHub_Ruby_weekly,2026-01-03 02:45:02
9,zapret-discord-youtube,,Flowseal,Batchfile,"20,514","1,710",889 stars this week,https://github.com//Flowseal/zapret-discord-youtube,GitHub_Batchfile_weekly,2026-01-03 02:45:02
10,rendercv,"CV/resume generator for academics and engineers, YAML to PDF",sinaatalay,Python,"13,918",940,"3,717 stars this week",https://github.com//rendercv/rendercv,GitHub_Python_weekly,2026-01-03 02:45:02
11,iptv,Collection of publicly available IPTV channels from all over the world,freearhey,TypeScript,"108,233","5,201","1,185 stars this week",https://github.com//iptv-org/iptv,GitHub_TypeScript_weekly,2026-01-03 02:45:02
1,claude-mem,"A Claude Code plugin that automatically captures everything Claude does during your coding sessions, compresses it with AI (using Claude's agent-sdk), and injects relevant context back into future sessions.",thedotmack,TypeScript,"9,964",609,"9,400 stars this month",https://github.com//thedotmack/claude-mem,GitHub_TypeScript_monthly,2026-01-03 02:45:02
2,next-ai-draw-io,"A next.js web application that integrates AI capabilities with draw.io diagrams. This app allows you to create, modify, and enhance diagrams through natural language commands and AI-assisted visualization.",DayuanJiang,TypeScript,"16,375","1,689","14,681 stars this month",https://github.com//DayuanJiang/next-ai-draw-io,GitHub_TypeScript_monthly,2026-01-03 02:45:02
3,exo,Run your own AI cluster at home with everyday devices 📱💻 🖥️⌚,AlexCheema,Python,"39,241","2,648","6,634 stars this month",https://github.com//exo-explore/exo,GitHub_Python_monthly,2026-01-03 02:45:02
4,sim,Open-source platform to build and deploy AI agent workflows.,waleedlatif1,TypeScript,"24,855","3,108","6,337 stars this month",https://github.com//simstudioai/sim,GitHub_TypeScript_monthly,2026-01-03 02:45:02
5,hello-agents,📚 《从零开始构建智能体》——从零开始的智能体原理与实践教程,jjyaoao,Python,"13,812","1,462","8,432 stars this month",https://github.com//datawhalechina/hello-agents,GitHub_Python_monthly,2026-01-03 02:45:02
6,chatterbox,SoTA open-source TTS,fatchord,Python,"20,253","2,644","5,335 stars this month",https://github.com//resemble-ai/chatterbox,GitHub_Python_monthly,2026-01-03 02:45:02
7,vibe-kanban,"Get 10X more out of Claude Code, Codex or any coding agent",stunningpixels,Rust,"11,296","1,013","4,376 stars this month",https://github.com//BloopAI/vibe-kanban,GitHub_Rust_monthly,2026-01-03 02:45:02
8,fizzy,Kanban as it should be. Not as it has been.,jzimdars,Ruby,"6,483",834,"6,467 stars this month",https://github.com//basecamp/fizzy,GitHub_Ruby_monthly,2026-01-03 02:45:02
9,opencode,The open source coding agent.,thdxr,TypeScript,"45,593","3,941","10,740 stars this month",https://github.com//sst/opencode,GitHub_TypeScript_monthly,2026-01-03 02:45:02
10,agents.md,"AGENTS.md — a simple, open format for guiding coding agents",romainhuet,TypeScript,"13,870",979,"5,072 stars this month",https://github.com//agentsmd/agents.md,GitHub_TypeScript_monthly,2026-01-03 02:45:02
11,WeKnora,"LLM-powered framework for deep document understanding, semantic retrieval, and context-aware answers using RAG paradigm.",lyingbug,Go,"10,766","1,156","3,059 stars this month",https://github.com//Tencent/WeKnora,GitHub_Go_monthly,2026-01-03 02:45:02
12,claude-quickstarts,A collection of projects designed to help developers quickly get started with building deployable applications using the Claude API,x5a,Python,"13,122","2,185","2,617 stars this month",https://github.com//anthropics/claude-quickstarts,GitHub_Python_monthly,2026-01-03 02:45:02
13,cocoindex,"Data transformation framework for AI. Ultra performant, with incremental processing. 🌟 Star if you like it!",badmonster0,Rust,"5,602",412,"2,107 stars this month",https://github.com//cocoindex-io/cocoindex,GitHub_Rust_monthly,2026-01-03 02:45:02
14,skills,Public repository for Agent Skills,klazuka,Python,"31,750","2,876","12,382 stars this month",https://github.com//anthropics/skills,GitHub_Python_monthly,2026-01-03 02:45:02
15,rustfs,"🚀2.3x faster than MinIO for 4KB object payloads. RustFS is an open-source, S3-compatible high-performance object storage system supporting migration and coexistence with other S3-compatible platforms such as MinIO and Ceph.",houseme,Rust,"18,923",814,"7,145 stars this month",https://github.com//rustfs/rustfs,GitHub_Rust_monthly,2026-01-03 02:45:02
16,claude-code,"Claude Code is an agentic coding tool that lives in your terminal, understands your codebase, and helps you code faster by executing routine tasks, explaining complex code, and handling git workflows - all through natural language commands.",actions-user,Shell,"50,519","3,606","6,332 stars this month",https://github.com//anthropics/claude-code,GitHub_Shell_monthly,2026-01-03 02:45:02
1,vibe-kanban,"Get 10X more out of Claude Code, Codex or any coding agent",stunningpixels,Rust,"11,296","1,013","3,727 stars this week",https://github.com//BloopAI/vibe-kanban,GitHub_Rust_weekly,2026-01-03 02:45:02
2,chatterbox,SoTA open-source TTS,fatchord,Python,"20,253","2,644","2,596 stars this week",https://github.com//resemble-ai/chatterbox,GitHub_Python_weekly,2026-01-03 02:45:02
3,skills,Public repository for Agent Skills,klazuka,Python,"31,750","2,876","4,237 stars this week",https://github.com//anthropics/skills,GitHub_Python_weekly,2026-01-03 02:45:02
4,cs249r_book,Introduction to Machine Learning Systems,profvjreddi,JavaScript,"14,807","1,678","2,943 stars this week",https://github.com//harvard-edge/cs249r_book,GitHub_JavaScript_weekly,2026-01-03 02:45:02
5,Infographic,"🦋 An Infographic Generation and Rendering Framework, bring words to life with AI!",Aarebecca,TypeScript,"2,539",161,"1,600 stars this week",https://github.com//antvis/Infographic,GitHub_TypeScript_weekly,2026-01-03 02:45:02
6,SpotiFLAC,"Get Spotify tracks in true FLAC from Tidal, Qobuz & Amazon Music — no account required.",afkarxyz,TypeScript,"2,061",119,"1,100 stars this week",https://github.com//afkarxyz/SpotiFLAC,GitHub_TypeScript_weekly,2026-01-03 02:45:02
7,metube,Self-hosted YouTube downloader (web UI for youtube-dl / yt-dlp),alexta69,Python,"11,836",799,515 stars this week,https://github.com//alexta69/metube,GitHub_Python_weekly,2026-01-03 02:45:02
8,gumroad,Sell stuff and see what sticks,devin-ai-integration,Ruby,"8,070","1,553",214 stars this week,https://github.com//antiwork/gumroad,GitHub_Ruby_weekly,2026-01-03 02:45:02
9,zapret-discord-youtube,,Flowseal,Batchfile,"20,514","1,710",889 stars this week,https://github.com//Flowseal/zapret-discord-youtube,GitHub_Batchfile_weekly,2026-01-03 02:45:02
10,rendercv,"CV/resume generator for academics and engineers, YAML to PDF",sinaatalay,Python,"13,918",940,"3,717 stars this week",https://github.com//rendercv/rendercv,GitHub_Python_weekly,2026-01-03 02:45:02
11,iptv,Collection of publicly available IPTV channels from all over the world,freearhey,TypeScript,"108,233","5,201","1,185 stars this week",https://github.com//iptv-org/iptv,GitHub_TypeScript_weekly,2026-01-03 02:45:02
1,lawnchair,No clever tagline needed.,sunnygoyal,Java,"11,739","1,410",81 stars this week,https://github.com//LawnchairLauncher/lawnchair,GitHub_Java_weekly,2026-01-03 02:45:02
2,termux-app,Termux - a terminal emulator application for Android OS extendible by variety of packages.,agnostic-apollo,Java,"48,364","5,781",244 stars this week,https://github.com//termux/termux-app,GitHub_Java_weekly,2026-01-03 02:45:02
3,Create,[NeoForge Mod] Building Tools and Aesthetic Technology,simibubi,Java,"3,879","1,189",18 stars this week,https://github.com//Creators-of-Create/Create,GitHub_Java_weekly,2026-01-03 02:45:02
4,voxy,An LoD rendering mod for minecraft,MCRcortex,Java,587,143,63 stars this week,https://github.com//MCRcortex/voxy,GitHub_Java_weekly,2026-01-03 02:45:02
5,Mindustry,The automation tower defense RTS,Anuken,Java,"26,109","3,329",64 stars this week,https://github.com//Anuken/Mindustry,GitHub_Java_weekly,2026-01-03 02:45:02
6,Xed-Editor,Advanced Text Editor for Android,RohitKushvaha01,Java,"1,457",87,88 stars this week,https://github.com//Xed-Editor/Xed-Editor,GitHub_Java_weekly,2026-01-03 02:45:02
7,halo,强大易用的开源建站工具。,ruibaby,Java,"37,649","10,178",98 stars this week,https://github.com//halo-dev/halo,GitHub_Java_weekly,2026-01-03 02:45:02
8,fesod,Fast. Easy. Done. Processing spreadsheets without worrying about large files causing OOM.,psxjoy,Java,"5,636",464,112 stars this week,https://github.com//apache/fesod,GitHub_Java_weekly,2026-01-03 02:45:02
9,Paper,"The most widely used, high performance Minecraft server that aims to fix gameplay and mechanics inconsistencies",Machine-Maker,Java,"11,805","3,190",24 stars this week,https://github.com//PaperMC/Paper,GitHub_Java_weekly,2026-01-03 02:45:02
10,himarket,"HiMarket is an enterprise-level ""AI Capability Marketplace and Developer Ecosystem Hub."" It is not merely a simple aggregation of traditional APIs, but rather a comprehensive platform that packages, publishes, manages, and operates core AI assets such as enterprise Model APIs, MCP Servers, Agent APIs, etc., through standardized product formats.",learnerjohn,Java,542,85,74 stars this week,https://github.com//higress-group/himarket,GitHub_Java_weekly,2026-01-03 02:45:02
11,GhidraMCP,MCP Server for Ghidra,LaurieWired,Java,"6,965",556,155 stars this week,https://github.com//LaurieWired/GhidraMCP,GitHub_Java_weekly,2026-01-03 02:45:02
12,awesome-leetcode-resources,Awesome LeetCode resources to learn Data Structures and Algorithms and prepare for Coding Interviews.,ashishps1,Java,"14,929","3,267",155 stars this week,https://github.com//ashishps1/awesome-leetcode-resources,GitHub_Java_weekly,2026-01-03 02:45:02
13,meteor-client,Based Minecraft utility mod.,MineGame159,Java,"3,152","1,292",24 stars this week,https://github.com//MeteorDevelopment/meteor-client,GitHub_Java_weekly,2026-01-03 02:45:02
14,kafka,Mirror of Apache Kafka,ijuma,Java,"31,637","14,875",59 stars this week,https://github.com//apache/kafka,GitHub_Java_weekly,2026-01-03 02:45:02
15,Shizuku-API,The API and the developer guide for Shizuku and Sui.,RikkaW,Java,"1,815",700,16 stars this week,https://github.com//RikkaApps/Shizuku-API,GitHub_Java_weekly,2026-01-03 02:45:02
16,mockito,Most popular Mocking framework for unit tests written in Java,mockitoguy,Java,"15,385","2,649",43 stars this week,https://github.com//mockito/mockito,GitHub_Java_weekly,2026-01-03 02:45:02
17,fabric-example-mod,Example Fabric mod,modmuss50,Java,"2,065","1,184",6 stars this week,https://github.com//FabricMC/fabric-example-mod,GitHub_Java_weekly,2026-01-03 02:45:02
18,rewrite,Automated mass refactoring of source code.,jkschneider,Java,"3,227",496,62 stars this week,https://github.com//openrewrite/rewrite,GitHub_Java_weekly,2026-01-03 02:45:02
1,chatterbox,SoTA open-source TTS,fatchord,Python,"20,253","2,644","2,596 stars this week",https://github.com//resemble-ai/chatterbox,GitHub_Python_weekly,2026-01-03 02:45:02
2,skills,Public repository for Agent Skills,klazuka,Python,"31,750","2,876","4,237 stars this week",https://github.com//anthropics/skills,GitHub_Python_weekly,2026-01-03 02:45:02
3,metube,Self-hosted YouTube downloader (web UI for youtube-dl / yt-dlp),alexta69,Python,"11,836",799,515 stars this week,https://github.com//alexta69/metube,GitHub_Python_weekly,2026-01-03 02:45:02
4,rendercv,"CV/resume generator for academics and engineers, YAML to PDF",sinaatalay,Python,"13,918",940,"3,717 stars this week",https://github.com//rendercv/rendercv,GitHub_Python_weekly,2026-01-03 02:45:02
5,LEANN,"RAG on Everything with LEANN. Enjoy 97% storage savings while running a fast, accurate, and 100% private RAG application on your personal device.",yichuan-w,Python,"7,957",720,"1,709 stars this week",https://github.com//yichuan-w/LEANN,GitHub_Python_weekly,2026-01-03 02:45:02
6,computer-use-preview,,sammccauley117,Python,"2,438",312,495 stars this week,https://github.com//google-gemini/computer-use-preview,GitHub_Python_weekly,2026-01-03 02:45:02
7,Yuxi-Know,"结合LightRAG 知识库的知识图谱智能体平台。 An agent platform that integrates a LightRAG knowledge base and knowledge graphs. Build with LangChain v1 + Vue + FastAPI, support DeepAgents、MinerU PDF、Neo4j 、MCP.",xerrors,Python,"3,699",442,582 stars this week,https://github.com//xerrors/Yuxi-Know,GitHub_Python_weekly,2026-01-03 02:45:02
8,LightX2V,Light Image Video Generation Inference Framework,helloyongyang,Python,"1,662",117,272 stars this week,https://github.com//ModelTC/LightX2V,GitHub_Python_weekly,2026-01-03 02:45:02
9,tinygrad,You like pytorch? You like micrograd? You love tinygrad! ❤️,github-actions,Python,"31,068","3,817",136 stars this week,https://github.com//tinygrad/tinygrad,GitHub_Python_weekly,2026-01-03 02:45:02
10,agents,Trade autonomously on Polymarket using AI Agents,alexnicita,Python,"1,526",383,355 stars this week,https://github.com//Polymarket/agents,GitHub_Python_weekly,2026-01-03 02:45:02
11,olmocr,Toolkit for linearizing PDFs for LLM datasets/training,jakep-allenai,Python,"16,557","1,303",187 stars this week,https://github.com//allenai/olmocr,GitHub_Python_weekly,2026-01-03 02:45:02
12,parlant,LLM agents built for control. Designed for real-world use. Deployed in minutes.,mc-dorzo,Python,"17,148","1,444",359 stars this week,https://github.com//emcie-co/parlant,GitHub_Python_weekly,2026-01-03 02:45:02
1,age,"A simple, modern and secure encryption tool (and Go library) with small explicit keys, no config options, and UNIX-style composability.",FiloSottile,Go,"20,776",593,294 stars this week,https://github.com//FiloSottile/age,GitHub_Go_weekly,2026-01-03 02:45:02
2,netbird,"Connect your devices into a secure WireGuard®-based overlay network with SSO, MFA and granular access controls.",mlsmaycon,Go,"20,614","1,001",264 stars this week,https://github.com//netbirdio/netbird,GitHub_Go_weekly,2026-01-03 02:45:02
3,axonhub,"AxonHub is a modern AI gateway system that provides a unified OpenAI ( Chat Completion, Responses), Anthropic, Gemini and AI SDK compatible API",looplj,Go,"1,201",133,237 stars this week,https://github.com//looplj/axonhub,GitHub_Go_weekly,2026-01-03 02:45:02
4,Fabric,Fabric is an open-source framework for augmenting humans using AI. It provides a modular system for solving specific problems using a crowdsourced set of AI prompts that can be used anywhere.,danielmiessler,Go,"37,552","3,757",832 stars this week,https://github.com//danielmiessler/Fabric,GitHub_Go_weekly,2026-01-03 02:45:02
5,hugo,The world’s fastest framework for building websites.,bep,Go,"85,720","8,158",190 stars this week,https://github.com//gohugoio/hugo,GitHub_Go_weekly,2026-01-03 02:45:02
6,memos,"An open-source, self-hosted note-taking service. Your thoughts, your data, your control — no tracking, no ads, no subscription fees.",boojack,Go,"48,727","3,512",607 stars this week,https://github.com//usememos/memos,GitHub_Go_weekly,2026-01-03 02:45:02
7,ezbookkeeping,"A lightweight, self-hosted personal finance app with a user-friendly interface and powerful bookkeeping features.",mayswind,Go,"3,611",372,177 stars this week,https://github.com//mayswind/ezbookkeeping,GitHub_Go_weekly,2026-01-03 02:45:02
8,keploy,"API, Integration, E2E Testing Agent for Developers that actually work. Generate tests, mocks/stubs for your APIs!",gouravkrosx,Go,"14,429","1,917",766 stars this week,https://github.com//keploy/keploy,GitHub_Go_weekly,2026-01-03 02:45:02
9,syncthing,Open Source Continuous File Synchronization,calmh,Go,"78,686","4,869",185 stars this week,https://github.com//syncthing/syncthing,GitHub_Go_weekly,2026-01-03 02:45:02
10,beszel,"Lightweight server monitoring hub with historical data, docker stats, and alerts.",henrygd,Go,"18,247",577,342 stars this week,https://github.com//henrygd/beszel,GitHub_Go_weekly,2026-01-03 02:45:02
11,awesome-go,"A curated list of awesome Go frameworks, libraries and software",avelino,Go,"161,555","12,866",665 stars this week,https://github.com//avelino/awesome-go,GitHub_Go_weekly,2026-01-03 02:45:02
12,homebox,A continuation of HomeBox the inventory and organization system built for the Home User,weblate,Go,"4,697",298,188 stars this week,https://github.com//sysadminsmedia/homebox,GitHub_Go_weekly,2026-01-03 02:45:02
13,oh-my-posh,The most customisable and low-latency cross platform/shell prompt renderer,JanDeDobbeleer,Go,"21,078","2,656",129 stars this week,https://github.com//JanDeDobbeleer/oh-my-posh,GitHub_Go_weekly,2026-01-03 02:45:02
14,glance,A self-hosted dashboard that puts all your feeds in one place,svilenmarkov,Go,"30,852","1,151",280 stars this week,https://github.com//glanceapp/glance,GitHub_Go_weekly,2026-01-03 02:45:02
15,dagger,An open-source runtime for composable workflows. Great for AI agents and CI/CD.,aluzzardi,Go,"15,218",838,58 stars this week,https://github.com//dagger/dagger,GitHub_Go_weekly,2026-01-03 02:45:02
1,free-for-dev,"A list of SaaS, PaaS and IaaS offerings that have free tiers of interest to devops and infradev",ripienaar,HTML,"116,917","11,952",364 stars this week,https://github.com//ripienaar/free-for-dev,GitHub_HTML_weekly,2026-01-03 02:45:02
2,FreeDomain,DigitalPlat FreeDomain: Free Domain For Everyone,EdwardLab,HTML,"136,677","2,421","3,027 stars this week",https://github.com//DigitalPlatDev/FreeDomain,GitHub_HTML_weekly,2026-01-03 02:45:02
3,OpenClash,A Clash Client For OpenWrt,vernesong,HTML,"23,385","3,677",132 stars this week,https://github.com//vernesong/OpenClash,GitHub_HTML_weekly,2026-01-03 02:45:02
4,WatermarkRemover-AI,AI-Powered Watermark Remover using Florence-2 and LaMA Models: A Python application leveraging state-of-the-art deep learning models to effectively remove watermarks from images with a user-friendly PyQt6 interface.,D-Ogi,HTML,901,188,75 stars this week,https://github.com//D-Ogi/WatermarkRemover-AI,GitHub_HTML_weekly,2026-01-03 02:45:02
5,computer-science,🎓 Path to a free self-taught education in Computer Science!,ericdouglas,HTML,"199,733","24,852",313 stars this week,https://github.com//ossu/computer-science,GitHub_HTML_weekly,2026-01-03 02:45:02
6,blog_os,Writing an OS in Rust,phil-opp,HTML,"17,172","1,189",34 stars this week,https://github.com//phil-opp/blog_os,GitHub_HTML_weekly,2026-01-03 02:45:02
7,UsbGpib,"Versatile, cheap and portable USB to GPIB converter (USBTMC class based)",xyphro,HTML,550,76,77 stars this week,https://github.com//xyphro/UsbGpib,GitHub_HTML_weekly,2026-01-03 02:45:02
8,zoraxy,A general purpose HTTP reverse proxy and forwarding tool. Now written in Go!,tobychui,HTML,"4,788",268,113 stars this week,https://github.com//tobychui/zoraxy,GitHub_HTML_weekly,2026-01-03 02:45:02
9,ArkOS-R3XS,Community Maintained Image of ArkOS for the RetroBox Console / Game Station / Game Consoie R35S / R36S / PowKiddy RGB20S,AeolusUX,HTML,"1,315",49,31 stars this week,https://github.com//AeolusUX/ArkOS-R3XS,GitHub_HTML_weekly,2026-01-03 02:45:02
10,hugo-theme-stack,Card-style Hugo theme designed for bloggers,CaiJimmy,HTML,"6,168","1,949",25 stars this week,https://github.com//CaiJimmy/hugo-theme-stack,GitHub_HTML_weekly,2026-01-03 02:45:02
11,home-assistant.io,📘 Home Assistant User documentation,frenck,HTML,"7,742","8,049",39 stars this week,https://github.com//home-assistant/home-assistant.io,GitHub_HTML_weekly,2026-01-03 02:45:02
12,Evil-M5Project,"Evil-M5Project is an innovative tool developed for ethical hacking and exploration of WiFi networks. It's compatible with Cardputer, Atoms3, Fire, core2. You can scan, monitor, and interact with WiFi networks in a controlled environment. This project is designed for educational purposes, aiding in understanding network security and vulnerabilities",7h30th3r0n3,HTML,"1,782",175,35 stars this week,https://github.com//7h30th3r0n3/Evil-M5Project,GitHub_HTML_weekly,2026-01-03 02:45:02
13,NetherSX2-patch,Continuation of NetherSX2 based on AetherSX2 4248,Trixarian,HTML,"1,838",68,30 stars this week,https://github.com//Trixarian/NetherSX2-patch,GitHub_HTML_weekly,2026-01-03 02:45:02
14,n8n-docs,"Documentation for n8n, a fair-code licensed automation tool with a free community edition and powerful enterprise options. Build AI functionality into your workflows.",tanay1337,HTML,"1,359","3,392",16 stars this week,https://github.com//n8n-io/n8n-docs,GitHub_HTML_weekly,2026-01-03 02:45:02
15,wpt,"Test suites for Web platform specs — including WHATWG, W3C, and others",jgraham,HTML,"5,698","3,602",19 stars this week,https://github.com//web-platform-tests/wpt,GitHub_HTML_weekly,2026-01-03 02:45:02
16,hugo-PaperMod,"A fast, clean, responsive Hugo theme.",adityatelange,HTML,"12,902","3,318",37 stars this week,https://github.com//adityatelange/hugo-PaperMod,GitHub_HTML_weekly,2026-01-03 02:45:02
1,cs249r_book,Introduction to Machine Learning Systems,profvjreddi,JavaScript,"14,807","1,678","2,943 stars this week",https://github.com//harvard-edge/cs249r_book,GitHub_JavaScript_weekly,2026-01-03 02:45:02
2,desktop,Welcome to a calmer internet,mr-cheffy,JavaScript,"39,202","1,255",464 stars this week,https://github.com//zen-browser/desktop,GitHub_JavaScript_weekly,2026-01-03 02:45:02
3,uptime-kuma,A fancy self-hosted monitoring tool,louislam,JavaScript,"80,694","7,194",506 stars this week,https://github.com//louislam/uptime-kuma,GitHub_JavaScript_weekly,2026-01-03 02:45:02
4,OpenSign,🔥 The free & Open Source DocuSign alternative,prafull-opensignlabs,JavaScript,"5,752",606,195 stars this week,https://github.com//OpenSignLabs/OpenSign,GitHub_JavaScript_weekly,2026-01-03 02:45:02
5,ToolJet,"ToolJet is the open-source foundation of ToolJet AI - the AI-native platform for building internal tools, dashboard, business applications, workflows and AI agents 🚀",Navaneeth-pk,JavaScript,"37,106","4,916",49 stars this week,https://github.com//ToolJet/ToolJet,GitHub_JavaScript_weekly,2026-01-03 02:45:02
