type,datetime,index,id,title,desc,hot,url,img,createtime
知乎热榜,2025-06-22 11:14:20,18,1919672700458206420,日本通胀继续高歌猛进，5 月核心 CPI 同比上升3.7%，计划大幅减少超长国债发行，日本经济怎么了？,日本5月核心CPI同比上升3.7%，连续45个月同比上涨，且升幅超出市场预期的3.6%。当月普通粳米价格同比大涨101%。日本央行行长植田和男重申央行立场，若经济展望实现就会加息。日本的实际利率明显偏低。 日本财务省宣布，计划在本财年大幅削减超长期国债发行量，总计将减少3.2万亿日元（约合220亿美元）。这一削减幅度远超此前市场普遍预期的2.3万亿日元。日本5月核心CPI同比上涨3.7%-新华网,56 万热度,https://www.zhihu.com/question/1919672700458206420,https://pic1.zhimg.com/50/v2-fbc14a1490380e682ba04625d0e600c6_b.jpg,2025-06-21 00:27:17
知乎热榜,2025-06-22 11:14:20,19,1920056695834501395,伊朗伊斯兰革命卫队称，将打击美国在中东地区的所有利益，可能包括哪些目标？,【环球网报道】据伊朗媒体22日报道，伊朗伊斯兰革命卫队称，美国必须等待严厉的惩罚，并表示将打击美国在中东地区的所有利益。 与此同时，伊朗国家电视台报道称，该地区的每一名美国公民和军事人员都是“合法目标”。伊媒：伊朗伊斯兰革命卫队称，将打击美国在中东地区的所有利益,55 万热度,https://www.zhihu.com/question/1920056695834501395,https://pic1.zhimg.com/80/v2-9de1417d6277f432ab0e68e967be9d6e_1440w.jpg,2025-06-22 01:53:09
知乎热榜,2025-06-22 11:14:20,20,1918974228620902487,令狐冲没有对不起林平之，林平之为何对他恨之入骨？,,55 万热度,https://www.zhihu.com/question/1918974228620902487,https://picx.zhimg.com/50/v2-ebd7e83c37692350ced52b5e5ed87989_b.jpg,2025-06-19 02:11:48
知乎热榜,2025-06-22 11:14:20,21,7345552605,为什么《还珠格格 3》紫薇和知画成为闺中密友，让大家这么不满意？,在《还珠格格第3部》大结局，尔康陪着乾隆皇帝，万里迢迢从北京城去大理看望小燕子他们，谈话中，或许是为了安慰小燕子他们的内疚，尔康说了一句“紫薇跟知画已经成为闺中密友”，这句话被广大小燕子粉拿来吐槽紫薇…,50 万热度,https://www.zhihu.com/question/7345552605,https://picx.zhimg.com/80/v2-c5b0eca0f10710ece70943c59179244f_1440w.webp?source=1def8aca,2024-12-20 00:09:24
知乎热榜,2025-06-22 11:14:20,22,1917923431732732334,少女乐队题材会不会成为国内网文新方向？,22年的孤独摇滚，23年的《BanG Dream！》，和今年的《Ave Mujika》，让少女乐队题材从日本ACG烂大街的异世界穿越题材脱颖而出，成了日本ACG文化新的发展方向，那国内网文能不能也仿照这个套路，写少女乐队的故事？,48 万热度,https://www.zhihu.com/question/1917923431732732334,https://pic1.zhimg.com/v2-f79c3a62c6bba573dd1665502394420c_xl.jpg?source=57bbeac9,2025-06-16 04:36:19
知乎热榜,2025-06-22 11:14:20,23,479090064,是什么原因让你决定开始练书法？,,48 万热度,https://www.zhihu.com/question/479090064,https://pic2.zhimg.com/50/v2-6b1a3e4a78ea9f8a09e9ed922feb48b3_b.jpg,2021-08-11 15:20:07
知乎热榜,2025-06-22 11:14:20,24,667581128,明日香的幸福是什么？,,48 万热度,https://www.zhihu.com/question/667581128,https://pica.zhimg.com/80/v2-c839e91e6f14ea8f70145e4f0103db85_1440w.webp?source=1def8aca,2024-09-19 06:19:01
知乎热榜,2025-06-22 11:14:20,25,486412889,有没有什么冷门的高颜值女演员？,,48 万热度,https://www.zhihu.com/question/486412889,https://pic1.zhimg.com/50/v2-1c4c882549ca08bce6226124f3b70071_720w.webp?source=1def8aca,2021-09-12 12:19:48
知乎热榜,2025-06-22 11:14:20,26,1919429015539790939,陈楚生第一，马嘉祺淘汰，如何评价《歌手 2025》第六期所有歌手的演唱？,,48 万热度,https://www.zhihu.com/question/1919429015539790939,https://picx.zhimg.com/80/v2-67b0c0277437aae6df960e7cf5b38d03_1440w.webp?source=1def8aca,2025-06-20 08:18:58
知乎热榜,2025-06-22 11:14:20,27,498464062,一定要让孩子经历很多失败才能成长吗？直接告诉孩子直接避免不行吗？,,48 万热度,https://www.zhihu.com/question/498464062,https://pica.zhimg.com/50/v2-a36cdad098360cc847380c9e0682eae6_b.jpg,2021-11-12 10:55:40
知乎热榜,2025-06-22 11:14:20,28,1888560700802180541,英语基础较弱，怎样才能阅读完一本英文小说？,,48 万热度,https://www.zhihu.com/question/1888560700802180541,https://pic1.zhimg.com/50/v2-bcb37e02f09d4a73d75d0a603f5dd682_b.jpg,2025-03-27 03:59:18
知乎热榜,2025-06-22 11:14:20,29,661910197,能够自己一个人创业的全栈web码农fullstack developer要会哪些技术？,"UI设计：figma，adobe 前端：html，css，js，ts，react，vue 后端：node，数据库，cloud，docker, linux 如果是真正的全栈，上面的这些技术都是必须牢牢掌握好的吧？还有哪些技术需要掌握的？目标是一个人，从UI设计到前端到后端到上线，一个人可以完成所有技术工作，也就是自己做一个项目创业。",48 万热度,https://www.zhihu.com/question/661910197,https://picx.zhimg.com/80/v2-7138b82ea37455c75861a255e1fa0301_720w.webp?source=1def8aca,2024-07-18 01:44:45
知乎热榜,2025-06-22 11:14:20,30,590658604,为何我们要警惕“网红家装设计”？,,48 万热度,https://www.zhihu.com/question/590658604,https://pic4.zhimg.com/50/v2-b939964c883afc109ab2730dd7cd64f7_b.jpg,2023-03-19 15:01:39
知乎热搜,2025-06-22 12:31:36,1,,金价跌跌不休,,,https://www.zhihu.com/search?q=%E9%87%91%E4%BB%B7%E8%B7%8C%E8%B7%8C%E4%B8%8D%E4%BC%91,,
知乎热搜,2025-06-22 12:31:36,2,,胖真的是一件很丢人的事吗,,,https://www.zhihu.com/search?q=%E8%83%96%E7%9C%9F%E7%9A%84%E6%98%AF%E4%B8%80%E4%BB%B6%E5%BE%88%E4%B8%A2%E4%BA%BA%E7%9A%84%E4%BA%8B%E5%90%97,,
知乎热搜,2025-06-22 12:31:36,3,,英国央行维持利率不变,,,https://www.zhihu.com/search?q=%E8%8B%B1%E5%9B%BD%E5%A4%AE%E8%A1%8C%E7%BB%B4%E6%8C%81%E5%88%A9%E7%8E%87%E4%B8%8D%E5%8F%98,,
知乎热搜,2025-06-22 12:31:36,4,,人民日报谈单依纯改编歌曲李白,,,https://www.zhihu.com/search?q=%E4%BA%BA%E6%B0%91%E6%97%A5%E6%8A%A5%E8%B0%88%E5%8D%95%E4%BE%9D%E7%BA%AF%E6%94%B9%E7%BC%96%E6%AD%8C%E6%9B%B2%E6%9D%8E%E7%99%BD,,
知乎热搜,2025-06-22 12:31:36,5,,八旬老人诊断胃炎被以癌症切全胃,,,https://www.zhihu.com/search?q=%E5%85%AB%E6%97%AC%E8%80%81%E4%BA%BA%E8%AF%8A%E6%96%AD%E8%83%83%E7%82%8E%E8%A2%AB%E4%BB%A5%E7%99%8C%E7%97%87%E5%88%87%E5%85%A8%E8%83%83,,
知乎热搜,2025-06-22 12:31:36,6,,蜂鸟音乐指控邓紫棋侵权,,,https://www.zhihu.com/search?q=%E8%9C%82%E9%B8%9F%E9%9F%B3%E4%B9%90%E6%8C%87%E6%8E%A7%E9%82%93%E7%B4%AB%E6%A3%8B%E4%BE%B5%E6%9D%83,,
知乎热搜,2025-06-22 12:31:36,7,,京东正式进军酒旅市场,,,https://www.zhihu.com/search?q=%E4%BA%AC%E4%B8%9C%E6%AD%A3%E5%BC%8F%E8%BF%9B%E5%86%9B%E9%85%92%E6%97%85%E5%B8%82%E5%9C%BA,,
知乎热搜,2025-06-22 12:31:36,8,,郑钦文退出柏林赛,,,https://www.zhihu.com/search?q=%E9%83%91%E9%92%A6%E6%96%87%E9%80%80%E5%87%BA%E6%9F%8F%E6%9E%97%E8%B5%9B,,
知乎热搜,2025-06-22 12:31:36,9,,男子动漫城充值14.8万举报后遭恐吓,,,https://www.zhihu.com/search?q=%E7%94%B7%E5%AD%90%E5%8A%A8%E6%BC%AB%E5%9F%8E%E5%85%85%E5%80%BC14.8%E4%B8%87%E4%B8%BE%E6%8A%A5%E5%90%8E%E9%81%AD%E6%81%90%E5%90%93,,
知乎热搜,2025-06-22 12:31:36,10,,美国参议院通过稳定币天才法案,,,https://www.zhihu.com/search?q=%E7%BE%8E%E5%9B%BD%E5%8F%82%E8%AE%AE%E9%99%A2%E9%80%9A%E8%BF%87%E7%A8%B3%E5%AE%9A%E5%B8%81%E5%A4%A9%E6%89%8D%E6%B3%95%E6%A1%88,,
知乎热搜,2025-06-22 12:31:36,11,,京东618,,,https://www.zhihu.com/search?q=%E4%BA%AC%E4%B8%9C618,,
知乎热搜,2025-06-22 12:31:36,12,,李雪琴方回应被实名举报,,,https://www.zhihu.com/search?q=%E6%9D%8E%E9%9B%AA%E7%90%B4%E6%96%B9%E5%9B%9E%E5%BA%94%E8%A2%AB%E5%AE%9E%E5%90%8D%E4%B8%BE%E6%8A%A5,,
知乎热搜,2025-06-22 12:31:36,13,,李国庆再婚,,,https://www.zhihu.com/search?q=%E6%9D%8E%E5%9B%BD%E5%BA%86%E5%86%8D%E5%A9%9A,,
知乎热搜,2025-06-22 12:31:36,14,,京东正式官宣进军酒旅,,,https://www.zhihu.com/search?q=%E4%BA%AC%E4%B8%9C%E6%AD%A3%E5%BC%8F%E5%AE%98%E5%AE%A3%E8%BF%9B%E5%86%9B%E9%85%92%E6%97%85,,
知乎热搜,2025-06-22 12:31:36,15,,李国庆再婚北大校友,,,https://www.zhihu.com/search?q=%E6%9D%8E%E5%9B%BD%E5%BA%86%E5%86%8D%E5%A9%9A%E5%8C%97%E5%A4%A7%E6%A0%A1%E5%8F%8B,,
知乎热搜,2025-06-22 12:31:36,16,,邓紫棋拒绝下架重录歌曲,,,https://www.zhihu.com/search?q=%E9%82%93%E7%B4%AB%E6%A3%8B%E6%8B%92%E7%BB%9D%E4%B8%8B%E6%9E%B6%E9%87%8D%E5%BD%95%E6%AD%8C%E6%9B%B2,,
知乎热搜,2025-06-22 12:31:36,17,,以色列人不让乌克兰人进入防空洞,,,https://www.zhihu.com/search?q=%E4%BB%A5%E8%89%B2%E5%88%97%E4%BA%BA%E4%B8%8D%E8%AE%A9%E4%B9%8C%E5%85%8B%E5%85%B0%E4%BA%BA%E8%BF%9B%E5%85%A5%E9%98%B2%E7%A9%BA%E6%B4%9E,,
知乎热搜,2025-06-22 12:31:36,18,,美联储四度维持利率不变,,,https://www.zhihu.com/search?q=%E7%BE%8E%E8%81%94%E5%82%A8%E5%9B%9B%E5%BA%A6%E7%BB%B4%E6%8C%81%E5%88%A9%E7%8E%87%E4%B8%8D%E5%8F%98,,
知乎热搜,2025-06-22 12:31:36,19,,沃尔特收购湖人交易估值100亿美元,,,https://www.zhihu.com/search?q=%E6%B2%83%E5%B0%94%E7%89%B9%E6%94%B6%E8%B4%AD%E6%B9%96%E4%BA%BA%E4%BA%A4%E6%98%93%E4%BC%B0%E5%80%BC100%E4%BA%BF%E7%BE%8E%E5%85%83,,
知乎热搜,2025-06-22 12:31:36,20,,中国女篮战胜日本女篮,,,https://www.zhihu.com/search?q=%E4%B8%AD%E5%9B%BD%E5%A5%B3%E7%AF%AE%E6%88%98%E8%83%9C%E6%97%A5%E6%9C%AC%E5%A5%B3%E7%AF%AE,,
知乎热搜,2025-06-22 12:31:36,21,,34 岁教授王虹在北京大学开数学讲座,,,https://www.zhihu.com/search?q=34%20%E5%B2%81%E6%95%99%E6%8E%88%E7%8E%8B%E8%99%B9%E5%9C%A8%E5%8C%97%E4%BA%AC%E5%A4%A7%E5%AD%A6%E5%BC%80%E6%95%B0%E5%AD%A6%E8%AE%B2%E5%BA%A7,,
知乎热搜,2025-06-22 12:31:36,22,,58同城被曝大规模裁员,,,https://www.zhihu.com/search?q=58%E5%90%8C%E5%9F%8E%E8%A2%AB%E6%9B%9D%E5%A4%A7%E8%A7%84%E6%A8%A1%E8%A3%81%E5%91%98,,
知乎热搜,2025-06-22 12:31:36,23,,女子22年化妆不卸妆脸红成关公,,,https://www.zhihu.com/search?q=%E5%A5%B3%E5%AD%9022%E5%B9%B4%E5%8C%96%E5%A6%86%E4%B8%8D%E5%8D%B8%E5%A6%86%E8%84%B8%E7%BA%A2%E6%88%90%E5%85%B3%E5%85%AC,,
知乎热搜,2025-06-22 12:31:36,24,,多地查摆年轻干部玩心重混日子等问题,,,https://www.zhihu.com/search?q=%E5%A4%9A%E5%9C%B0%E6%9F%A5%E6%91%86%E5%B9%B4%E8%BD%BB%E5%B9%B2%E9%83%A8%E7%8E%A9%E5%BF%83%E9%87%8D%E6%B7%B7%E6%97%A5%E5%AD%90%E7%AD%89%E9%97%AE%E9%A2%98,,
知乎热搜,2025-06-22 12:31:36,25,,焕羽开播,,,https://www.zhihu.com/search?q=%E7%84%95%E7%BE%BD%E5%BC%80%E6%92%AD,,
知乎热榜,2025-06-22 12:31:36,1,601882469,假设把地球上所有的铀235集中起来做成一个大核弹，放到马里亚纳海沟里引爆，地球会不会被炸成两半？,假设所有的U235全部裂变，暂不考虑裂变弹理论上线，不然太没得玩了,701 万热度,https://www.zhihu.com/question/601882469,https://pic1.zhimg.com/80/v2-ee23ee85ea2922bb73bace2b3d28bf79_1440w.webp?source=1def8aca,2023-05-19 07:40:56
知乎热榜,2025-06-22 12:31:36,2,1919427133593321475,武磊在西班牙巴塞罗那进行了二次手术，是因为华山医院运动医学科技术不行吗？,6月19日深夜，武磊在个人视频社交媒体发布了自己的最新情况——他已在巴塞罗那完成膝关节手术，并逐步开始简单的弯曲康复。https://baijiahao.baidu.com/s?id=1835450455091783333&wfr=spider&for=pc 武磊当时受伤，选择华山医院手术，目的赶上6月份的世预赛，结果效果很差，在中超打打停停，直接告别世预赛。 这是继武磊今年1月第一次膝盖手术、康复和复出比赛后，第二次选择手术，显然之前的恢复没有达到预期效果。 据了解，此次武磊是通过西班牙人俱乐部搭线，约到了西班牙著名的Ramon Cugat拉蒙·库加特医生团队，做关节镜手术。拉蒙·库加特医生的团队与足球界有着深厚的联系，为众多足球运动员提供过医疗服务，包括瓜迪奥拉、“小豌豆”埃尔南德斯、“小白”伊涅斯塔、“葫芦娃”大卫·比利亚、“托妞”托雷斯等。 武磊预计将在一周后回国。,502 万热度,https://www.zhihu.com/question/1919427133593321475,https://picx.zhimg.com/80/v2-49da0ece16ebfcecc6f8977c013efb2e_1440w.png,2025-06-20 08:11:29
知乎热榜,2025-06-22 12:31:36,3,1919723992455058509,如何看待英雄联盟前职业选手mlxg官司输了，被强制执行2500w？,[图片],389 万热度,https://www.zhihu.com/question/1919723992455058509,https://picx.zhimg.com/80/v2-2ce1af527f80e5197a559067e8081b67_1440w.webp?source=1def8aca,2025-06-21 03:51:06
知乎热榜,2025-06-22 12:31:36,4,1919790712322520153,延边大学毕业典礼上，食堂阿姨的发言为什么能让许多同学落泪？,6月20日，吉林省延边大学2025届学生毕业典礼暨学位授予仪式上，一位食堂阿姨上台演讲，她真诚朴实的话语让不少台下毕业生眼泛泪花，有网友评论称：“这个发言，没有套话，全是感情”“第一次见食堂阿姨上台讲话”。截至6月21日傍晚6时许，延边大学官方抖音号发布的两段演讲视频总点赞量已超40万，各大央媒也纷纷转发这位阿姨的演讲。 延边大学食堂阿姨在毕业典礼发言（视频截图） 视频中，这位食堂阿姨诚挚地说道：“别嫌阿姨啰嗦，真的是有太多的放心不下。外卖虽然方便，总不如自己做的营养健康，熬夜加班的时候别总拿泡面凑合。难过委屈了，千万别一个人扛着。”“在家里，你们是爸爸妈妈的宝贝，在学校，你们也是叔叔阿姨的宝贝。后勤的叔叔阿姨们，特意为你们准备了一份毕业小礼物，我们后勤所有服务人员加班加点包制了15000个饺子。在叔叔阿姨眼中，你们就是未来的天之骄子。” 刘晓梅在延边大学毕业典礼上演讲（视频截图） 在视频评论区，有不少网友深受感动，并留下评论：“阿姨年轻时也是秋雅级别的校花”“阿姨不光厨艺好，记忆力也好，全程脱稿”“这是延边大学最好的名片”。 6月21日，极目新闻记者联系到参加了此次毕业典礼的学生，一名参与毕业典礼演唱的大二学生称，他很喜欢吃这位食堂阿姨做的饭，她的档口就在二食堂一楼，最拿手的菜是风味砂锅，经常去二食堂的同学都知道。 对于这次食堂阿姨在毕业典礼上的演讲爆火一事，他表示并不觉得奇怪，“因为用心说的话，大家彼此都能产生共鸣，肯定能打动人心。” 另一名学生告诉极目新闻记者，他也并不认识这位食堂阿姨，但天天都能见到她，“之前没有感到她有什么不同，只觉得她做的饭特别好吃。” 延边大学后勤保障处官网显示，这位食堂阿姨名叫刘晓梅，这次作为后勤服务育人代表，在2025届毕业典礼上发言。她在发言时曾自我介绍：“对，是我，二食堂一楼宝哥风味砂锅居档口的阿姨，也是后勤保障处饮食服务中心的一名职工，我叫刘晓梅。” 21日下午，极目新闻记者联系到刘晓梅，她表示，她只是食堂后勤的一名普通职工，感谢大家对她的关注，并婉拒了记者的采访。延边大学食堂阿姨毕业典礼演讲全程脱稿听哭毕业生，当事人：我只是食堂后勤的一名普通职工_腾讯新闻,358 万热度,https://www.zhihu.com/question/1919790712322520153,https://pica.zhimg.com/80/v2-bb087b1fbbff61bc9d31f1d056fc2061_1440w.png,2025-06-21 08:16:13
知乎热榜,2025-06-22 12:31:36,5,1919823098213033728,如何评价《酱园弄》里各位主演的演技？,陈可辛导演的《酱园弄.悬案》汇聚了奥斯卡评委、内地无大奖满贯影后章子怡；金鸡奖金晋影帝雷佳音；金鸡奖新晋最佳女配赵丽颖；内地电视剧营销王者杨幂；提名次数无敌易烊千玺这么多大牌，大家感受到演技盛宴了吗？,263 万热度,https://www.zhihu.com/question/1919823098213033728,https://pic1.zhimg.com/80/v2-2a4b9d25b69037d5a0d101610d4fd66d_1440w.webp?source=1def8aca,2025-06-21 10:24:55
知乎热榜,2025-06-22 12:31:36,6,1920027937140339395,特朗普称美国完成对伊朗三处核设施的打击，具体情况如何？伊朗会如何反击？,当地时间6月21日，美国总统特朗普在其社交媒体“真实社交”上发文称，美国已完成对伊朗福尔多、纳坦兹和伊斯法罕三处核设施的袭击。 另据路透社消息，美国官员称，美国B-2轰炸机参与了对伊朗核基地的打击。 伊朗方面对此暂无回应。（总台记者 张颖哲） 更多资讯请下载央视新闻客户端,248 万热度,https://www.zhihu.com/question/1920027937140339395,https://pic1.zhimg.com/v2-f478e6570405d9d0d93b68b562cdc984_1440w.png,2025-06-21 23:58:52
知乎热榜,2025-06-22 12:31:36,7,1912664993297576889,中国在战国时期打仗就动不动几十万人，是不是夸大十倍的结果?,那时一共才多少人口啊，全民皆兵也没那么多人吧,233 万热度,https://www.zhihu.com/question/1912664993297576889,https://pic2.zhimg.com/50/v2-fe7a7079268c163b80713871b8216411_b.jpg,2025-06-01 16:21:10
知乎热榜,2025-06-22 12:31:36,8,1919918352379404876,如何看待6月20日中国足协公告重罚四川青年竞技俱乐部，取消其参赛成绩和资格，禁赛两年，罚款5万？,2025年6月20日，中国足协发布公告称，四川青年竞技足球俱乐部，因为在与重庆瀚达的比赛中消极比赛，对俱乐部以下处罚： 1、取消四川青年竞技2025中冠比赛资格和赛区名次； 2、取消该俱乐部未来两年参加中国足球协会赛事的资格； 3、取消该场比赛结果； 4、对俱乐部罚款5万元； 5、对俱乐部官员吴欣聪和主教练阿尔贝托·加西亚·西科塔禁止进入体育场12个月。 四川青年竞技真的消极比赛了吗？足协的做法合理吗？,201 万热度,https://www.zhihu.com/question/1919918352379404876,https://pica.zhimg.com/80/v2-6c7ec1cbfd529091b9aa5e7be6f736ff_1440w.png,2025-06-21 16:43:25
知乎热榜,2025-06-22 12:31:36,9,1920082721021080572,伊朗否认特朗普言论，称「福尔多核设施仅地上部分受损，且可以修复」，伊朗将何时以及如何回应美国？,伊朗议会库姆省代表梅南·莱希当地时间6月22日早间表示，与美国总统特朗普所声称的相反，伊朗福尔多核设施并未遭到严重破坏，主要受损的是地上部分，且可以修复。更多资讯请下载央视新闻客户端,179 万热度,https://www.zhihu.com/question/1920082721021080572,https://pic1.zhimg.com/80/v2-6c51e93d7a50af4cedd1e5686247156f_1440w.webp,2025-06-22 03:36:34
知乎热榜,2025-06-22 12:31:36,10,1912084383940191973,想买一个只用来睡觉，几乎不开的车，最低成本是多少？,,158 万热度,https://www.zhihu.com/question/1912084383940191973,https://picx.zhimg.com/50/v2-6f1247be6859a39ac1db2d76d489294b_b.jpg,2025-05-31 01:54:01
知乎热榜,2025-06-22 12:31:36,11,1919347780696122490,苏宁易购拟 4 元出售四家家乐福子公司，预计增利 5.72 亿元，如何看待此举？苏宁易购经营现状如何？,6月19日，苏宁易购集团股份有限公司（以下简称苏宁易购）发布公告称，全资子公司苏宁国际的控股子公司荷兰家乐福（中国）控股有限公司（以下简称荷兰家乐福）拟出售子公司股权，合计出售金额4元。 苏宁易购公告中称，荷兰家乐福近日与上海有安法律咨询有限公司（代上海家福启纾企业服务合伙企业（有限合伙））签订《股权转让协议》，分别以1元对价出售持有的宁波家乐福商业有限公司、杭州家乐福超市有限公司、株洲家乐福商业有限公司、沈阳家乐福商业有限公司100%股权，合计出售金额为4元。本次交易不构成关联交易，亦不构成重大资产重组。 对于此次交易的影响，苏宁易购表示，本次交易有助于减轻公司债务负担，改善公司经营业绩，降低企业经营和管理风险。苏宁易购预计，本次交易将对本期财务状况和经营成果产生积极影响，预计将增加公司归母净利润约5.72亿元。https://app.dahecube.com/nweb/news/20250619/238687nb796b692b40.htm,87 万热度,https://www.zhihu.com/question/1919347780696122490,https://pica.zhimg.com/50/v2-d0e5be2b8189bc92da423aa4d6ff2b54_b.jpg,2025-06-20 02:56:10
知乎热榜,2025-06-22 12:31:36,12,1918414336449291928,到底是人类驯化了狗，还是小狗驯化了人类？,《人类简史》人类以为驯化了小麦，其实是小麦驯化了人类。 当我们给宠物狗穿上定制羽绒服时 当我们每天定时绕着小区遛弯时 当我们在电商平台为进口狗粮比价时 小狗狗用湿漉漉的眼神驯化了人类的情感需求，而人类用衣食住行的全包式服务，把狼的后代变成了沙发上的撒娇精。 这场持续万年的双向驯化里，我们以为自己是主人，却不知不觉活成了狗的专属铲屎官。,81 万热度,https://www.zhihu.com/question/1918414336449291928,https://pic4.zhimg.com/50/v2-07ae896a13627eb21738cd5d00516077_b.jpg,2025-06-17 13:07:00
知乎热榜,2025-06-22 12:31:36,13,1920061519980369864,特朗普称伊朗关键的核浓缩设施已被「彻底摧毁」，伊朗还有何底牌？会同意结束这场战争吗？,美国东部时间21日22时，美国总统特朗普就袭击伊朗核设施发表全国讲话。特朗普称，伊朗关键的核浓缩设施已被彻底摧毁。更多资讯请下载央视新闻客户端,80 万热度,https://www.zhihu.com/question/1920061519980369864,https://pic2.zhimg.com/50/v2-b85132b3849e97e89e59d9137974e6fd_b.jpg,2025-06-22 02:12:19
