index,title,desc,author,language,stars,forks,today_forks,url,type,datetime
15,mcp-playwright,"Playwright Model Context Protocol Server - Tool to automate Browsers and APIs in Claude Desktop, Cline, Cursor IDE and More 🔌",executeautomation,TypeScript,"2,541",195,467 stars this week,https://github.com//executeautomation/mcp-playwright,GitHub_TypeScript_weekly,2025-04-08 14:32:47
16,awesome-python,"An opinionated list of awesome Python frameworks, libraries, software and resources.",vinta,Python,"239,650","25,512",816 stars this week,https://github.com//vinta/awesome-python,GitHub_Python_weekly,2025-04-08 14:32:47
1,spring-boot,"Spring Boot helps you to create Spring-powered, production-grade applications and services with absolute minimum fuss.",wilkinsona,Java,"76,751","41,070",126 stars this week,https://github.com//spring-projects/spring-boot,GitHub_Java_weekly,2025-04-08 14:32:47
2,LSPosed,LSPosed Framework,yujincheng08,Java,"19,736","3,272",127 stars this week,https://github.com//LSPosed/LSPosed,GitHub_Java_weekly,2025-04-08 14:32:47
3,guava,Google core libraries for Java,cpovirk,Java,"50,665","10,976",46 stars this week,https://github.com//google/guava,GitHub_Java_weekly,2025-04-08 14:32:47
4,dbeaver,Free universal database tool and SQL client,serge-rider,Java,"42,866","3,644",322 stars this week,https://github.com//dbeaver/dbeaver,GitHub_Java_weekly,2025-04-08 14:32:47
5,so-novel,小说下载器 | 小说下载工具 | 小说下载神器 | 免费小说 | 网络小说 | 免费下载 | 网文下载,freeok,Java,"2,307",180,333 stars this week,https://github.com//freeok/so-novel,GitHub_Java_weekly,2025-04-08 14:32:47
6,AndroRAT,A Simple android remote administration tool using sockets. It uses java on the client side and python on the server side,karma9874,Java,"3,626","1,117",56 stars this week,https://github.com//karma9874/AndroRAT,GitHub_Java_weekly,2025-04-08 14:32:47
7,Ehviewer_CN_SXJ,ehviewer，用爱发电，快乐前行,xiaojieonly,Java,"16,544",449,174 stars this week,https://github.com//xiaojieonly/Ehviewer_CN_SXJ,GitHub_Java_weekly,2025-04-08 14:32:47
8,spring-ai-alibaba,Agentic AI Framework for Java Developers,chickenlj,Java,"2,172",404,219 stars this week,https://github.com//alibaba/spring-ai-alibaba,GitHub_Java_weekly,2025-04-08 14:32:47
9,HMCL,"A Minecraft Launcher which is multi-functional, cross-platform and popular",huanghongxun,Java,"7,448",706,43 stars this week,https://github.com//HMCL-dev/HMCL,GitHub_Java_weekly,2025-04-08 14:32:47
10,Paper,"The most widely used, high performance Minecraft server that aims to fix gameplay and mechanics inconsistencies",Machine-Maker,Java,"10,799","2,495",72 stars this week,https://github.com//PaperMC/Paper,GitHub_Java_weekly,2025-04-08 14:32:47
11,nifi,Apache NiFi,markap14,Java,"5,231","2,787",24 stars this week,https://github.com//apache/nifi,GitHub_Java_weekly,2025-04-08 14:32:47
12,Mindustry,The automation tower defense RTS,Anuken,Java,"23,576","3,056",51 stars this week,https://github.com//Anuken/Mindustry,GitHub_Java_weekly,2025-04-08 14:32:47
13,baritone,google maps for block game,leijurv,Java,"7,652","1,552",31 stars this week,https://github.com//cabaletta/baritone,GitHub_Java_weekly,2025-04-08 14:32:47
14,hertzbeat,"Apache HertzBeat(incubating) is a real-time monitoring system with agentless, performance cluster, prometheus-compatible, custom monitoring and status page building capabilities.",tomsun28,Java,"6,146","1,081",44 stars this week,https://github.com//apache/hertzbeat,GitHub_Java_weekly,2025-04-08 14:32:47
15,DSA-Bootcamp-Java,"This repository consists of the code samples, assignments, and notes for the Java data structures & algorithms + interview preparation bootcamp of WeMakeDevs.",kunal-kushwaha,Java,"18,732","11,820",75 stars this week,https://github.com//kunal-kushwaha/DSA-Bootcamp-Java,GitHub_Java_weekly,2025-04-08 14:32:47
16,OpenSearch,🔎 Open source distributed and RESTful search engine.,dependabot,Java,"10,479","1,978",56 stars this week,https://github.com//opensearch-project/OpenSearch,GitHub_Java_weekly,2025-04-08 14:32:47
1,crawl4ai,"🚀🤖 Crawl4AI: Open-source LLM Friendly Web Crawler & Scraper. Don't be shy, join here: https://discord.gg/jP8KfhDhyN",unclecode,Python,"37,931","3,358","2,885 stars this week",https://github.com//unclecode/crawl4ai,GitHub_Python_weekly,2025-04-08 14:32:47
2,fastmcp,"The fast, Pythonic way to build Model Context Protocol servers 🚀",jlowin,Python,"4,002",191,"1,183 stars this week",https://github.com//jlowin/fastmcp,GitHub_Python_weekly,2025-04-08 14:32:47
3,awesome-python,"An opinionated list of awesome Python frameworks, libraries, software and resources.",vinta,Python,"239,650","25,512",816 stars this week,https://github.com//vinta/awesome-python,GitHub_Python_weekly,2025-04-08 14:32:47
4,arxiv-mcp-server,A Model Context Protocol server for searching and analyzing arXiv papers,blazickjp,Python,764,46,315 stars this week,https://github.com//blazickjp/arxiv-mcp-server,GitHub_Python_weekly,2025-04-08 14:32:47
5,markitdown,Python tool for converting files and office documents to Markdown.,afourney,Python,"44,884","2,131","2,175 stars this week",https://github.com//microsoft/markitdown,GitHub_Python_weekly,2025-04-08 14:32:47
6,llama-models,Utilities intended for use with Llama models.,ashwinb,Python,"6,624","1,080",581 stars this week,https://github.com//meta-llama/llama-models,GitHub_Python_weekly,2025-04-08 14:32:47
7,graphiti,Build Real-Time Knowledge Graphs for AI Agents,prasmussen15,Python,"3,456",269,331 stars this week,https://github.com//getzep/graphiti,GitHub_Python_weekly,2025-04-08 14:32:47
8,mcp-agent,Build effective agents using Model Context Protocol and simple workflow patterns,saqadri,Python,"3,181",320,678 stars this week,https://github.com//lastmile-ai/mcp-agent,GitHub_Python_weekly,2025-04-08 14:32:47
9,Nugget,Unlock the fullest potential of your device,leminlimez,Python,"2,518",162,116 stars this week,https://github.com//leminlimez/Nugget,GitHub_Python_weekly,2025-04-08 14:32:47
10,nautilus_trader,A high-performance algorithmic trading platform and event-driven backtester,cjdsellers,Python,"4,949",750,159 stars this week,https://github.com//nautechsystems/nautilus_trader,GitHub_Python_weekly,2025-04-08 14:32:47
11,mindsdb,AI's query engine - Platform for building AI that can learn and answer questions over large scale federated data.,StpMax,Python,"27,638","4,955",115 stars this week,https://github.com//mindsdb/mindsdb,GitHub_Python_weekly,2025-04-08 14:32:47
12,OpenHands,"🙌 OpenHands: Code Less, Make More",dependabot,Python,"52,548","5,826",907 stars this week,https://github.com//All-Hands-AI/OpenHands,GitHub_Python_weekly,2025-04-08 14:32:47
13,web-ui,Run AI Agent in your browser.,warmshao,Python,"11,462","1,847","1,091 stars this week",https://github.com//browser-use/web-ui,GitHub_Python_weekly,2025-04-08 14:32:47
1,mcp-go,"A Go implementation of the Model Context Protocol (MCP), enabling seamless integration between LLM applications and external data sources and tools.",ezynda3,Go,"2,549",211,815 stars this week,https://github.com//mark3labs/mcp-go,GitHub_Go_weekly,2025-04-08 14:32:47
2,whatsmeow,Go library for the WhatsApp web multidevice API,tulir,Go,"3,358",526,394 stars this week,https://github.com//tulir/whatsmeow,GitHub_Go_weekly,2025-04-08 14:32:47
3,higress,🤖 AI Gateway | AI Native API Gateway,johnlanni,Go,"4,789",626,562 stars this week,https://github.com//alibaba/higress,GitHub_Go_weekly,2025-04-08 14:32:47
4,fleet,"Open-source platform for IT, security, and infrastructure teams. (Linux, macOS, Chrome, Windows, cloud, data center)",eashaw,Go,"4,670",541,971 stars this week,https://github.com//fleetdm/fleet,GitHub_Go_weekly,2025-04-08 14:32:47
5,fzf,🌸 A command-line fuzzy finder,junegunn,Go,"69,251","2,487",182 stars this week,https://github.com//junegunn/fzf,GitHub_Go_weekly,2025-04-08 14:32:47
6,gqlgen,go generate based graphql server library,vektah,Go,"10,233","1,202",19 stars this week,https://github.com//99designs/gqlgen,GitHub_Go_weekly,2025-04-08 14:32:47
7,terraform-provider-aws,The AWS Provider enables Terraform to manage AWS resources.,ewbankkit,Go,"10,235","9,425",65 stars this week,https://github.com//hashicorp/terraform-provider-aws,GitHub_Go_weekly,2025-04-08 14:32:47
8,headscale,"An open source, self-hosted implementation of the Tailscale control server",kradalby,Go,"26,976","1,440",618 stars this week,https://github.com//juanfont/headscale,GitHub_Go_weekly,2025-04-08 14:32:47
9,mcp-grafana,MCP server for Grafana,sd2k,Go,374,28,120 stars this week,https://github.com//grafana/mcp-grafana,GitHub_Go_weekly,2025-04-08 14:32:47
10,assets,"A comprehensive, up-to-date collection of information about several thousands (!) of crypto tokens.",Cryptocool1,Go,"4,828","23,488",16 stars this week,https://github.com//trustwallet/assets,GitHub_Go_weekly,2025-04-08 14:32:47
11,BloodHound,Six Degrees of Domain Admin,mistahj67,Go,"1,520",162,29 stars this week,https://github.com//SpecterOps/BloodHound,GitHub_Go_weekly,2025-04-08 14:32:47
12,golangci-lint,Fast linters runner for Go,dependabot,Go,"16,699","1,440",64 stars this week,https://github.com//golangci/golangci-lint,GitHub_Go_weekly,2025-04-08 14:32:47
13,trivy,"Find vulnerabilities, misconfigurations, secrets, SBOM in containers, Kubernetes, code repositories, clouds and more",knqyf263,Go,"25,347","2,489",118 stars this week,https://github.com//aquasecurity/trivy,GitHub_Go_weekly,2025-04-08 14:32:47
14,mcphost,A CLI host application that enables Large Language Models (LLMs) to interact with external tools through the Model Context Protocol (MCP).,ezynda3,Go,517,71,83 stars this week,https://github.com//mark3labs/mcphost,GitHub_Go_weekly,2025-04-08 14:32:47
15,lux,👾 Fast and simple video download library and CLI tool written in Go,iawia002,Go,"29,067","3,101",121 stars this week,https://github.com//iawia002/lux,GitHub_Go_weekly,2025-04-08 14:32:47
16,lazygit,simple terminal UI for git commands,jesseduffield,Go,"58,538","2,007",336 stars this week,https://github.com//jesseduffield/lazygit,GitHub_Go_weekly,2025-04-08 14:32:47
17,LocalAI,"🤖 The free, Open Source alternative to OpenAI, Claude and others. Self-hosted and local-first. Drop-in replacement for OpenAI, running on consumer-grade hardware. No GPU required. Runs gguf, transformers, diffusers and many more models architectures. Features: Generate Text, Audio, Video, Images, Voice Cloning, Distributed, P2P inference",mudler,Go,"31,569","2,396",239 stars this week,https://github.com//mudler/LocalAI,GitHub_Go_weekly,2025-04-08 14:32:47
18,opentelemetry-go-contrib,Collection of extensions for OpenTelemetry-Go.,renovate,Go,"1,372",643,12 stars this week,https://github.com//open-telemetry/opentelemetry-go-contrib,GitHub_Go_weekly,2025-04-08 14:32:47
19,istio,"Connect, secure, control, and observe services.",howardjohn,Go,"36,697","7,929",51 stars this week,https://github.com//istio/istio,GitHub_Go_weekly,2025-04-08 14:32:47
20,neko,A self hosted virtual browser that runs in docker and uses WebRTC.,m1k1o,Go,"9,987",689,182 stars this week,https://github.com//m1k1o/neko,GitHub_Go_weekly,2025-04-08 14:32:47
21,tdl,📥 A Telegram toolkit written in Golang,iyear,Go,"5,229",516,75 stars this week,https://github.com//iyear/tdl,GitHub_Go_weekly,2025-04-08 14:32:47
22,coder,Provision remote development environments via Terraform,dependabot,Go,"9,412",838,94 stars this week,https://github.com//coder/coder,GitHub_Go_weekly,2025-04-08 14:32:47
1,cs-self-learning,计算机自学指南,PKUFlyingPig,HTML,"61,874","7,213",417 stars this week,https://github.com//PKUFlyingPig/cs-self-learning,GitHub_HTML_weekly,2025-04-08 14:32:47
2,chosen,"Deprecated - Chosen is a library for making long, unwieldy select boxes more friendly.",pfiller,HTML,"22,060","4,129",65 stars this week,https://github.com//harvesthq/chosen,GitHub_HTML_weekly,2025-04-08 14:32:47
3,Web-dev-mini-projects,The repository contains the list of awesome✨ & cool web development beginner-friendly✌️ projects!,Ayushparikh-code,HTML,"3,992","1,505",36 stars this week,https://github.com//Ayushparikh-code/Web-dev-mini-projects,GitHub_HTML_weekly,2025-04-08 14:32:47
4,n8n-docs,"Documentation for n8n, a fair-code licensed automation tool with a free community edition and powerful enterprise options. Build AI functionality into your workflows.",StarfallProjects,HTML,366,735,19 stars this week,https://github.com//n8n-io/n8n-docs,GitHub_HTML_weekly,2025-04-08 14:32:47
5,Chicago95,A rendition of everyone's favorite 1995 Microsoft operating system for Linux.,grassmunk,HTML,"4,895",163,29 stars this week,https://github.com//grassmunk/Chicago95,GitHub_HTML_weekly,2025-04-08 14:32:47
6,website,Kubernetes website and documentation repo:,k8s-ci-robot,HTML,"4,850","14,705",24 stars this week,https://github.com//kubernetes/website,GitHub_HTML_weekly,2025-04-08 14:32:47
7,html-css,Curso de HTML5 e CSS3,gustavoguanabara,HTML,"14,716","3,557",54 stars this week,https://github.com//gustavoguanabara/html-css,GitHub_HTML_weekly,2025-04-08 14:32:47
8,learning-area,GitHub repo for the MDN Learning Area.,chrisdavidmills,HTML,"7,218","27,246",20 stars this week,https://github.com//mdn/learning-area,GitHub_HTML_weekly,2025-04-08 14:32:47
9,alpine,"A rugged, minimal framework for composing JavaScript behavior in your markup.",calebporzio,HTML,"29,398","1,280",52 stars this week,https://github.com//alpinejs/alpine,GitHub_HTML_weekly,2025-04-08 14:32:47
10,training-kit,Open source courseware for Git and GitHub,brianamarie,HTML,"4,524","4,377",32 stars this week,https://github.com//github/training-kit,GitHub_HTML_weekly,2025-04-08 14:32:47
11,fastText,Library for fast text representation and classification.,EdouardGrave,HTML,"26,148","4,752",18 stars this week,https://github.com//facebookresearch/fastText,GitHub_HTML_weekly,2025-04-08 14:32:47
12,fonts,"Font files available from Google Fonts, and a public issue tracker for all things Google Fonts",m4rc1e,HTML,"18,720","2,710",57 stars this week,https://github.com//google/fonts,GitHub_HTML_weekly,2025-04-08 14:32:47
13,InstagramUnfollowers,Check if people follows you back on Instagram.,davidarroyo1234,HTML,"3,457",313,22 stars this week,https://github.com//davidarroyo1234/InstagramUnfollowers,GitHub_HTML_weekly,2025-04-08 14:32:47
14,github-slideshow,A robot powered training repository 🤖,githubteacher,HTML,322,241,157 stars this week,https://github.com//sunnyoggcp/github-slideshow,GitHub_HTML_weekly,2025-04-08 14:32:47
15,epg,Utilities for downloading the EPG (Electronic Program Guide) for thousands of TV channels from hundreds of sources.,freearhey,HTML,"2,093",270,14 stars this week,https://github.com//iptv-org/epg,GitHub_HTML_weekly,2025-04-08 14:32:47
16,ML-For-Beginners,"12 weeks, 26 lessons, 52 quizzes, classic Machine Learning for all",jlooper,HTML,"71,750","15,412",128 stars this week,https://github.com//microsoft/ML-For-Beginners,GitHub_HTML_weekly,2025-04-08 14:32:47
1,open-webui,"User-friendly AI Interface (Supports Ollama, OpenAI API, ...)",tjbck,JavaScript,"88,198","10,954","1,730 stars this week",https://github.com//open-webui/open-webui,GitHub_JavaScript_weekly,2025-04-08 14:32:47
2,react,The library for web and native user interfaces.,zpao,JavaScript,"234,263","48,162",375 stars this week,https://github.com//facebook/react,GitHub_JavaScript_weekly,2025-04-08 14:32:47
3,awesome-chatgpt-prompts,This repo includes ChatGPT prompt curation to use ChatGPT and other LLM tools better.,f,JavaScript,"122,681","16,442",424 stars this week,https://github.com//f/awesome-chatgpt-prompts,GitHub_JavaScript_weekly,2025-04-08 14:32:47
4,mcp-jetbrains,"A model context protocol server to work with JetBrains IDEs: IntelliJ, PyCharm, WebStorm, etc. Also, works with Android Studio",MaXal,JavaScript,432,37,71 stars this week,https://github.com//JetBrains/mcp-jetbrains,GitHub_JavaScript_weekly,2025-04-08 14:32:47
5,bootstrap,"The most popular HTML, CSS, and JavaScript framework for developing responsive, mobile first projects on the web.",mdo,JavaScript,"172,098","79,073",293 stars this week,https://github.com//twbs/bootstrap,GitHub_JavaScript_weekly,2025-04-08 14:32:47
6,jellyfin-web,The Free Software Media System - Official Web Client,thornbill,JavaScript,"2,671","1,384",22 stars this week,https://github.com//jellyfin/jellyfin-web,GitHub_JavaScript_weekly,2025-04-08 14:32:47
7,anime,JavaScript animation engine,juliangarnier,JavaScript,"54,921","3,831","3,542 stars this week",https://github.com//juliangarnier/anime,GitHub_JavaScript_weekly,2025-04-08 14:32:47
8,translate,"AI i18n, Two lines of js realize automatic html translation. No need to change the page, no language configuration file, no API key, SEO friendly!",xnx3,JavaScript,936,130,139 stars this week,https://github.com//xnx3/translate,GitHub_JavaScript_weekly,2025-04-08 14:32:47
9,next.js,The React Framework,ijjk,JavaScript,"130,879","28,080",214 stars this week,https://github.com//vercel/next.js,GitHub_JavaScript_weekly,2025-04-08 14:32:47
10,cli,the package manager for JavaScript,isaacs,JavaScript,"8,795","3,384",30 stars this week,https://github.com//npm/cli,GitHub_JavaScript_weekly,2025-04-08 14:32:47
11,pipedream,"Connect APIs, remarkably fast. Free for developers.",dylburger,JavaScript,"9,517","5,302",70 stars this week,https://github.com//PipedreamHQ/pipedream,GitHub_JavaScript_weekly,2025-04-08 14:32:47
12,cryptpad,"Collaborative office suite, end-to-end encrypted and open-source.",yflory,JavaScript,"6,168",694,62 stars this week,https://github.com//cryptpad/cryptpad,GitHub_JavaScript_weekly,2025-04-08 14:32:47
13,3x-ui,Xray panel supporting multi-protocol multi-user expire day & traffic & IP limit (Vmess & Vless & Trojan & ShadowSocks & Wireguard),MHSanaei,JavaScript,"18,331","3,825",198 stars this week,https://github.com//MHSanaei/3x-ui,GitHub_JavaScript_weekly,2025-04-08 14:32:47
14,mediacms,"MediaCMS is a modern, fully featured open source video and media CMS, written in Python/Django and React, featuring a REST API.",mgogoulos,JavaScript,"3,300",600,24 stars this week,https://github.com//mediacms-io/mediacms,GitHub_JavaScript_weekly,2025-04-08 14:32:47
15,node,Node.js JavaScript runtime ✨🐢🚀✨,Trott,JavaScript,"110,518","31,202",174 stars this week,https://github.com//nodejs/node,GitHub_JavaScript_weekly,2025-04-08 14:32:47
16,Sigma-Web-Dev-Course,Source Code for Sigma Web Development Course,CodeWithHarry,JavaScript,"8,002","2,424",96 stars this week,https://github.com//CodeWithHarry/Sigma-Web-Dev-Course,GitHub_JavaScript_weekly,2025-04-08 14:32:47
1,markitdown,Python tool for converting files and office documents to Markdown.,afourney,Python,"45,440","2,148","1,957 stars today",https://github.com//microsoft/markitdown,GitHub_Python_daily,2025-04-08 20:46:48
2,LightRAG,"""LightRAG: Simple and Fast Retrieval-Augmented Generation""",danielaskdd,Python,"13,847","1,961",147 stars today,https://github.com//HKUDS/LightRAG,GitHub_Python_daily,2025-04-08 20:46:48
3,supabase-mcp,Connect Supabase to your AI assistants,gregnr,TypeScript,683,36,193 stars today,https://github.com//supabase-community/supabase-mcp,GitHub_TypeScript_daily,2025-04-08 20:46:48
4,n8n,"Fair-code workflow automation platform with native AI capabilities. Combine visual building with custom code, self-host or cloud, 400+ integrations.",janober,TypeScript,"76,511","20,387",626 stars today,https://github.com//n8n-io/n8n,GitHub_TypeScript_daily,2025-04-08 20:46:48
5,maxun,🔥Open Source No Code Web Data Extraction Platform. Turn Websites To APIs & Spreadsheets With No-Code Robots In Minutes🔥,amhsirak,TypeScript,"10,182",819,166 stars today,https://github.com//getmaxun/maxun,GitHub_TypeScript_daily,2025-04-08 20:46:48
6,llm-cookbook,面向开发者的 LLM 入门教程，吴恩达大模型系列课程中文版,logan-zou,Jupyter Notebook,"17,489","2,164",440 stars today,https://github.com//datawhalechina/llm-cookbook,GitHub_Jupyter Notebook_daily,2025-04-08 20:46:48
7,Summer2025-Internships,Collection of Summer 2025 tech internships!,actions-user,,"37,072","2,891",138 stars today,https://github.com//SimplifyJobs/Summer2025-Internships,GitHub__daily,2025-04-08 20:46:48
8,SpacetimeDB,Multiplayer at the speed of light,Centril,Rust,"11,804",393,346 stars today,https://github.com//clockworklabs/SpacetimeDB,GitHub_Rust_daily,2025-04-08 20:46:48
9,FunASR,"A Fundamental End-to-End Speech Recognition Toolkit and Open Source SOTA Pretrained Models, Supporting Speech Recognition, Voice Activity Detection, Text Post-processing etc.",LauraGPT,Python,"9,408",955,24 stars today,https://github.com//modelscope/FunASR,GitHub_Python_daily,2025-04-08 20:46:48
10,chartdb,Database diagrams editor that allows you to visualize and design your DB with a single query.,guyb1,TypeScript,"14,943",726,372 stars today,https://github.com//chartdb/chartdb,GitHub_TypeScript_daily,2025-04-08 20:46:48
11,llama-cookbook,"Welcome to the Llama Cookbook! This is your go to guide for Building with Llama: Getting started with Inference, Fine-Tuning, RAG. We also show you how to solve end to end problems using Llama model family and using them on various provider services",HamidShojanazeri,Jupyter Notebook,"16,901","2,423",209 stars today,https://github.com//meta-llama/llama-cookbook,GitHub_Jupyter Notebook_daily,2025-04-08 20:46:48
12,anime,JavaScript animation engine,juliangarnier,JavaScript,"55,110","3,835",801 stars today,https://github.com//juliangarnier/anime,GitHub_JavaScript_daily,2025-04-08 20:46:48
13,cuda-python,CUDA Python: Performance meets Productivity,leofang,Python,"1,542",113,50 stars today,https://github.com//NVIDIA/cuda-python,GitHub_Python_daily,2025-04-08 20:46:48
14,PhysX,NVIDIA PhysX SDK,preist-nvidia,C++,"3,569",471,158 stars today,https://github.com//NVIDIA-Omniverse/PhysX,GitHub_C++_daily,2025-04-08 20:46:48
15,gin,"Gin is a HTTP web framework written in Go (Golang). It features a Martini-like API with much better performance -- up to 40 times faster. If you need smashing performance, get yourself some Gin.",manucorporat,Go,"81,400","8,161",45 stars today,https://github.com//gin-gonic/gin,GitHub_Go_daily,2025-04-08 20:46:48
16,redmine,Mirror of redmine code source - Official Subversion repository is at https://svn.redmine.org/redmine - contact: @vividtone or maeda (at) farend (dot) jp,jplang,Ruby,"5,482","2,357",25 stars today,https://github.com//redmine/redmine,GitHub_Ruby_daily,2025-04-08 20:46:48
17,union,"The trust-minimized, zero-knowledge bridging protocol, designed for censorship resistance, extremely high security, and usage in decentralized finance.",cor,Rust,"52,796","2,653",448 stars today,https://github.com//unionlabs/union,GitHub_Rust_daily,2025-04-08 20:46:48
18,protobuf,Protocol Buffers - Google's data interchange format,haberman,C++,"67,071","15,657",11 stars today,https://github.com//protocolbuffers/protobuf,GitHub_C++_daily,2025-04-08 20:46:48
1,youtube-music,YouTube Music Desktop App bundled with custom plugins (and built-in ad blocker / downloader),JellyBrick,TypeScript,"17,616",913,"3,998 stars this week",https://github.com//th-ch/youtube-music,GitHub_TypeScript_weekly,2025-04-08 20:46:48
2,gitdiagram,"Free, simple, fast interactive diagrams for any GitHub repository",ahmedkhaleel2004,TypeScript,"8,723",578,"3,358 stars this week",https://github.com//ahmedkhaleel2004/gitdiagram,GitHub_TypeScript_weekly,2025-04-08 20:46:48
3,awesome-mcp-servers,A collection of MCP servers.,punkpeye,,"33,548","2,317","9,776 stars this week",https://github.com//punkpeye/awesome-mcp-servers,GitHub__weekly,2025-04-08 20:46:48
4,nvm,Node Version Manager - POSIX-compliant bash script to manage multiple active node.js versions,ljharb,Shell,"83,809","8,566",760 stars this week,https://github.com//nvm-sh/nvm,GitHub_Shell_weekly,2025-04-08 20:46:48
5,mcp-go,"A Go implementation of the Model Context Protocol (MCP), enabling seamless integration between LLM applications and external data sources and tools.",ezynda3,Go,"2,597",213,815 stars this week,https://github.com//mark3labs/mcp-go,GitHub_Go_weekly,2025-04-08 20:46:48
6,zapret-discord-youtube,,Flowseal,Batchfile,"11,859",755,424 stars this week,https://github.com//Flowseal/zapret-discord-youtube,GitHub_Batchfile_weekly,2025-04-08 20:46:48
7,markitdown,Python tool for converting files and office documents to Markdown.,afourney,Python,"45,440","2,148","2,175 stars this week",https://github.com//microsoft/markitdown,GitHub_Python_weekly,2025-04-08 20:46:48
8,cookbook,Examples and guides for using the Gemini API,Giom-V,Jupyter Notebook,"12,058","1,577",804 stars this week,https://github.com//google-gemini/cookbook,GitHub_Jupyter Notebook_weekly,2025-04-08 20:46:48
9,avante.nvim,Use your Neovim like using Cursor AI IDE!,yetone,Lua,"12,430",514,503 stars this week,https://github.com//yetone/avante.nvim,GitHub_Lua_weekly,2025-04-08 20:46:48
10,crawl4ai,"🚀🤖 Crawl4AI: Open-source LLM Friendly Web Crawler & Scraper. Don't be shy, join here: https://discord.gg/jP8KfhDhyN",unclecode,Python,"38,049","3,374","2,885 stars this week",https://github.com//unclecode/crawl4ai,GitHub_Python_weekly,2025-04-08 20:46:48
11,awesome-cursorrules,📄 A curated list of awesome .cursorrules files,PatrickJS,,"20,716","1,544","1,939 stars this week",https://github.com//PatrickJS/awesome-cursorrules,GitHub__weekly,2025-04-08 20:46:48
12,fastmcp,"The fast, Pythonic way to build Model Context Protocol servers 🚀",jlowin,Python,"4,036",192,"1,183 stars this week",https://github.com//jlowin/fastmcp,GitHub_Python_weekly,2025-04-08 20:46:48
13,iptv,Collection of publicly available IPTV channels from all over the world,freearhey,TypeScript,"92,044","3,339",565 stars this week,https://github.com//iptv-org/iptv,GitHub_TypeScript_weekly,2025-04-08 20:46:48
