index,title,desc,author,language,stars,forks,today_forks,url,type,datetime
12,CiLocks,"Crack Interface lockscreen, Metasploit and More Android/IOS Hacking",LoliC0d3,HTML,"2,512",460,29 stars this week,https://github.com//tegal1337/CiLocks,GitHub_HTML_weekly,2025-05-03 14:30:52
13,n8n-docs,"Documentation for n8n, a fair-code licensed automation tool with a free community edition and powerful enterprise options. Build AI functionality into your workflows.",tanay1337,HTML,435,890,16 stars this week,https://github.com//n8n-io/n8n-docs,GitHub_HTML_weekly,2025-05-03 14:30:52
14,tabler,Tabler is free and open-source HTML Dashboard UI Kit built on Bootstrap,codecalm,HTML,"39,220","4,139",78 stars this week,https://github.com//tabler/tabler,GitHub_HTML_weekly,2025-05-03 14:30:52
1,drawdb,"Free, simple, and intuitive online database diagram editor and SQL generator.",1ilit,JavaScript,"29,498","2,061","1,307 stars this week",https://github.com//drawdb-io/drawdb,GitHub_JavaScript_weekly,2025-05-03 14:30:52
2,uptime-kuma,A fancy self-hosted monitoring tool,louislam,JavaScript,"68,602","6,023",924 stars this week,https://github.com//louislam/uptime-kuma,GitHub_JavaScript_weekly,2025-05-03 14:30:52
3,hiring-without-whiteboards,⭐️ Companies that don't have a broken hiring process,bors,JavaScript,"48,334","3,767",119 stars this week,https://github.com//poteto/hiring-without-whiteboards,GitHub_JavaScript_weekly,2025-05-03 14:30:52
4,bruno,Opensource IDE For Exploring and Testing Api's (lightweight alternative to postman/insomnia),helloanoop,JavaScript,"33,126","1,567",426 stars this week,https://github.com//usebruno/bruno,GitHub_JavaScript_weekly,2025-05-03 14:30:52
5,open-webui,"User-friendly AI Interface (Supports Ollama, OpenAI API, ...)",tjbck,JavaScript,"92,869","11,763","1,491 stars this week",https://github.com//open-webui/open-webui,GitHub_JavaScript_weekly,2025-05-03 14:30:52
6,next.js,The React Framework,ijjk,JavaScript,"131,541","28,297",225 stars this week,https://github.com//vercel/next.js,GitHub_JavaScript_weekly,2025-05-03 14:30:52
7,Font-Awesome,"The iconic SVG, font, and CSS toolkit",robmadole,JavaScript,"75,170","12,213",159 stars this week,https://github.com//FortAwesome/Font-Awesome,GitHub_JavaScript_weekly,2025-05-03 14:30:52
8,GSAP,"GSAP (GreenSock Animation Platform), a JavaScript animation library for the modern web",jackdoyle,JavaScript,"20,935","1,766",242 stars this week,https://github.com//greensock/GSAP,GitHub_JavaScript_weekly,2025-05-03 14:30:52
9,st-memory-enhancement,SillyTavern酒馆的长期记忆增强插件,muyoou,JavaScript,270,23,72 stars this week,https://github.com//muyoou/st-memory-enhancement,GitHub_JavaScript_weekly,2025-05-03 14:30:52
10,FreeTube,An Open Source YouTube app for privacy,dependabot,JavaScript,"17,668","1,146",95 stars this week,https://github.com//FreeTubeApp/FreeTube,GitHub_JavaScript_weekly,2025-05-03 14:30:52
11,node-red,Low-code programming for event-driven applications,knolleary,JavaScript,"21,008","3,551",82 stars this week,https://github.com//node-red/node-red,GitHub_JavaScript_weekly,2025-05-03 14:30:52
12,snapdrop,A Progressive Web App for local file sharing,RobinLinus,JavaScript,"19,060","1,811",126 stars this week,https://github.com//SnapDrop/snapdrop,GitHub_JavaScript_weekly,2025-05-03 14:30:52
13,cli,"Command-line tool to customize Spotify client. Supports Windows, MacOS, and Linux.",khanhas,JavaScript,"20,097",769,76 stars this week,https://github.com//spicetify/cli,GitHub_JavaScript_weekly,2025-05-03 14:30:52
14,reveal.js,The HTML Presentation Framework,hakimel,JavaScript,"68,812","16,724",59 stars this week,https://github.com//hakimel/reveal.js,GitHub_JavaScript_weekly,2025-05-03 14:30:52
15,GDevelop,"🎮 Open-source, cross-platform 2D/3D/multiplayer game engine designed for everyone.",4ian,JavaScript,"13,941",972,129 stars this week,https://github.com//4ian/GDevelop,GitHub_JavaScript_weekly,2025-05-03 14:30:52
16,Interstellar,One of the most popular modern web proxies with blazing fast speeds and a variety of games.,xbubbo,JavaScript,"1,484","18,120",20 stars this week,https://github.com//UseInterstellar/Interstellar,GitHub_JavaScript_weekly,2025-05-03 14:30:52
1,aci,"ACI.dev is the open source platform that connects your AI agents to 600+ tool integrations with multi-tenant auth, granular permissions, and access through direct function calling or a unified MCP server.",thisisfixer,Python,"1,698",118,244 stars today,https://github.com//aipotheosis-labs/aci,GitHub_Python_daily,2025-05-03 20:42:34
2,union,"The trust-minimized, zero-knowledge bridging protocol, designed for censorship resistance, extremely high security, and usage in decentralized finance.",cor,Rust,"56,495","2,835",375 stars today,https://github.com//unionlabs/union,GitHub_Rust_daily,2025-05-03 20:42:34
3,Atmosphere,Atmosphère is a work-in-progress customized firmware for the Nintendo Switch.,SciresM,C++,"15,878","1,269",47 stars today,https://github.com//Atmosphere-NX/Atmosphere,GitHub_C++_daily,2025-05-03 20:42:34
4,Deep-Live-Cam,real time face swap and one-click video deepfake with only a single image,hacksider,Python,"58,532","8,267","1,524 stars today",https://github.com//hacksider/Deep-Live-Cam,GitHub_Python_daily,2025-05-03 20:42:34
5,mcp-server-cloudflare,,geelen,TypeScript,"1,647",125,69 stars today,https://github.com//cloudflare/mcp-server-cloudflare,GitHub_TypeScript_daily,2025-05-03 20:42:34
6,aws-sdk-java-v2,The official AWS SDK for Java - Version 2,aws-sdk-java-automation,Java,"2,353",904,15 stars today,https://github.com//aws/aws-sdk-java-v2,GitHub_Java_daily,2025-05-03 20:42:34
7,winutil,"Chris Titus Tech's Windows Utility - Install Programs, Tweaks, Fixes, and Updates",ChrisTitusTech,PowerShell,"33,522","1,879",143 stars today,https://github.com//ChrisTitusTech/winutil,GitHub_PowerShell_daily,2025-05-03 20:42:34
8,Python-100-Days,Python - 100天从新手到大师,jackfrued,Jupyter Notebook,"165,599","53,690",212 stars today,https://github.com//jackfrued/Python-100-Days,GitHub_Jupyter Notebook_daily,2025-05-03 20:42:34
9,headscale,"An open source, self-hosted implementation of the Tailscale control server",kradalby,Go,"27,585","1,485",20 stars today,https://github.com//juanfont/headscale,GitHub_Go_daily,2025-05-03 20:42:34
10,koreader,"An ebook reader application supporting PDF, DjVu, EPUB, FB2 and many more formats, running on Cervantes, Kindle, Kobo, PocketBook and Android devices",houqp,Lua,"20,858","1,417",47 stars today,https://github.com//koreader/koreader,GitHub_Lua_daily,2025-05-03 20:42:34
11,jj,A Git-compatible VCS that is both simple and powerful,yuja,Rust,"12,905",468,98 stars today,https://github.com//jj-vcs/jj,GitHub_Rust_daily,2025-05-03 20:42:34
12,Zero,Experience email the way you want with 0 – the first open source email app that puts your privacy and safety first (coming soon). Join the discord: https://discord.gg/0email,MrgSub,TypeScript,"5,544",455,53 stars today,https://github.com//Mail-0/Zero,GitHub_TypeScript_daily,2025-05-03 20:42:34
13,system-design-primer,Learn how to design large-scale systems. Prep for the system design interview. Includes Anki flashcards.,donnemartin,Python,"297,881","49,502",122 stars today,https://github.com//donnemartin/system-design-primer,GitHub_Python_daily,2025-05-03 20:42:34
14,MNN,"MNN is a blazing fast, lightweight deep learning framework, battle-tested by business-critical use cases in Alibaba. Full multimodal LLM Android App:[MNN-LLM-Android](./apps/Android/MnnLlmChat/README.md)",MNNTeam,C++,"10,559","1,831",98 stars today,https://github.com//alibaba/MNN,GitHub_C++_daily,2025-05-03 20:42:34
15,pydantic,Data validation using Python type hints,samuelcolvin,Python,"23,516","2,104",13 stars today,https://github.com//pydantic/pydantic,GitHub_Python_daily,2025-05-03 20:42:34
16,alacritty,"A cross-platform, OpenGL terminal emulator.",chrisduerr,Rust,"58,554","3,102",17 stars today,https://github.com//alacritty/alacritty,GitHub_Rust_daily,2025-05-03 20:42:34
17,filament,"A collection of beautiful full-stack components for Laravel. The perfect starting point for your next app. Using Livewire, Alpine.js and Tailwind CSS.",danharrin,PHP,"23,111","3,388",25 stars today,https://github.com//filamentphp/filament,GitHub_PHP_daily,2025-05-03 20:42:34
18,zphisher,An automated phishing tool with 30+ templates. This Tool is made for educational purpose only ! Author will not be responsible for any misuse of this toolkit !,htr-tech,HTML,"12,610","4,621",10 stars today,https://github.com//htr-tech/zphisher,GitHub_HTML_daily,2025-05-03 20:42:34
19,littlefs,A little fail-safe filesystem designed for microcontrollers,geky,C,"5,704",855,118 stars today,https://github.com//littlefs-project/littlefs,GitHub_C_daily,2025-05-03 20:42:34
20,sunnypilot,sunnypilot is an open source driver assistance system. sunnypilot offers the user a unique driving experience for over 300 supported car makes and models with modified behaviors of driving assist engagements. sunnypilot complies with the safety policy from comma.ai's openpilot as accurately as possible.,adeebshihadeh,Python,"1,061",850,6 stars today,https://github.com//sunnypilot/sunnypilot,GitHub_Python_daily,2025-05-03 20:42:34
1,Deep-Live-Cam,real time face swap and one-click video deepfake with only a single image,hacksider,Python,"58,532","8,267","6,689 stars this week",https://github.com//hacksider/Deep-Live-Cam,GitHub_Python_weekly,2025-05-03 20:42:34
2,leaked-system-prompts,Collection of leaked system prompts,jujumilk3,,"5,817",646,"2,422 stars this week",https://github.com//jujumilk3/leaked-system-prompts,GitHub__weekly,2025-05-03 20:42:34
3,suna,Suna - Open Source Generalist AI Agent,markokraemer,TypeScript,"9,535","1,183","4,443 stars this week",https://github.com//kortix-ai/suna,GitHub_TypeScript_weekly,2025-05-03 20:42:34
4,rowboat,AI-powered multi-agent builder,ramnique,TypeScript,"2,463",182,"1,530 stars this week",https://github.com//rowboatlabs/rowboat,GitHub_TypeScript_weekly,2025-05-03 20:42:34
5,Agent-S,Agent S: an open agentic framework that uses computers like a human,alckasoc,Python,"3,957",384,"1,448 stars this week",https://github.com//simular-ai/Agent-S,GitHub_Python_weekly,2025-05-03 20:42:34
6,generative-ai-for-beginners,"21 Lessons, Get Started Building with Generative AI 🔗 https://microsoft.github.io/generative-ai-for-beginners/",koreyspace,Jupyter Notebook,"82,076","42,135","2,304 stars this week",https://github.com//microsoft/generative-ai-for-beginners,GitHub_Jupyter Notebook_weekly,2025-05-03 20:42:34
7,lapce,Lightning-fast and Powerful Code Editor written in Rust,dzhou121,Rust,"36,009","1,119",826 stars this week,https://github.com//lapce/lapce,GitHub_Rust_weekly,2025-05-03 20:42:34
8,ladybird,Truly independent web browser,awesomekling,C++,"38,191","1,586",635 stars this week,https://github.com//LadybirdBrowser/ladybird,GitHub_C++_weekly,2025-05-03 20:42:34
9,drawdb,"Free, simple, and intuitive online database diagram editor and SQL generator.",1ilit,JavaScript,"29,512","2,064","1,307 stars this week",https://github.com//drawdb-io/drawdb,GitHub_JavaScript_weekly,2025-05-03 20:42:34
10,hyprnote,AI Notepad for back-to-back meetings. Local-first & Extensible.,yujonglee,TypeScript,"1,741",79,850 stars this week,https://github.com//fastrepl/hyprnote,GitHub_TypeScript_weekly,2025-05-03 20:42:34
11,Hunyuan3D-2,High-Resolution 3D Assets Generation with Large Scale Hunyuan3D Diffusion Models.,Zeqiang-Lai,Python,"9,281",781,570 stars this week,https://github.com//Tencent/Hunyuan3D-2,GitHub_Python_weekly,2025-05-03 20:42:34
12,graphiti,Build Real-Time Knowledge Graphs for AI Agents,prasmussen15,Python,"7,859",522,"3,128 stars this week",https://github.com//getzep/graphiti,GitHub_Python_weekly,2025-05-03 20:42:34
13,hyperswitch,"An open source payments switch written in Rust to make payments fast, reliable and affordable",hyperswitch-bot,Rust,"17,677","2,176","1,582 stars this week",https://github.com//juspay/hyperswitch,GitHub_Rust_weekly,2025-05-03 20:42:34
14,developer-roadmap,"Interactive roadmaps, guides and other educational content to help developers grow in their careers.",kamranahmedse,TypeScript,"317,129","41,137","1,306 stars this week",https://github.com//kamranahmedse/developer-roadmap,GitHub_TypeScript_weekly,2025-05-03 20:42:34
15,devops-exercises,"Linux, Jenkins, AWS, SRE, Prometheus, Docker, Python, Ansible, Git, Kubernetes, Terraform, OpenStack, SQL, NoSQL, Azure, GCP, DNS, Elastic, Network, Virtualization. DevOps Interview Questions",surister,Python,"75,553","16,825","1,082 stars this week",https://github.com//bregman-arie/devops-exercises,GitHub_Python_weekly,2025-05-03 20:42:34
16,trivy,"Find vulnerabilities, misconfigurations, secrets, SBOM in containers, Kubernetes, code repositories, clouds and more",knqyf263,Go,"26,099","2,528",442 stars this week,https://github.com//aquasecurity/trivy,GitHub_Go_weekly,2025-05-03 20:42:34
17,windows,Windows inside a Docker container.,kroese,Shell,"34,847","2,491",454 stars this week,https://github.com//dockur/windows,GitHub_Shell_weekly,2025-05-03 20:42:34
1,cursor-free-vip,[Support 0.49.x]（Reset Cursor AI MachineID & Bypass Higher Token Limit） Cursor Ai ，自动重置机器ID ， 免费升级使用Pro功能: You've reached your trial request limit. / Too many free trial accounts used on this machine. Please upgrade to pro. We have this limit in place to prevent abuse. Please let us know if you believe this is a mistake.,yeongpin,Python,"23,120","2,880","18,138 stars this month",https://github.com//yeongpin/cursor-free-vip,GitHub_Python_monthly,2025-05-03 20:42:34
2,cvelistV5,CVE cache of the official CVE List in CVE JSON 5 format,hkong-mitre,,"1,964",448,990 stars this month,https://github.com//CVEProject/cvelistV5,GitHub__monthly,2025-05-03 20:42:34
3,leaked-system-prompts,Collection of leaked system prompts,jujumilk3,,"5,817",646,"3,603 stars this month",https://github.com//jujumilk3/leaked-system-prompts,GitHub__monthly,2025-05-03 20:42:34
4,Deep-Live-Cam,real time face swap and one-click video deepfake with only a single image,hacksider,Python,"58,532","8,267","8,147 stars this month",https://github.com//hacksider/Deep-Live-Cam,GitHub_Python_monthly,2025-05-03 20:42:34
5,markitdown,Python tool for converting files and office documents to Markdown.,afourney,Python,"55,793","2,826","14,024 stars this month",https://github.com//microsoft/markitdown,GitHub_Python_monthly,2025-05-03 20:42:34
6,fastmcp,"🚀 The fast, Pythonic way to build MCP servers and clients",jlowin,Python,"8,364",437,"4,864 stars this month",https://github.com//jlowin/fastmcp,GitHub_Python_monthly,2025-05-03 20:42:34
7,n8n,"Fair-code workflow automation platform with native AI capabilities. Combine visual building with custom code, self-host or cloud, 400+ integrations.",janober,TypeScript,"88,362","24,103","14,439 stars this month",https://github.com//n8n-io/n8n,GitHub_TypeScript_monthly,2025-05-03 20:42:34
8,graphiti,Build Real-Time Knowledge Graphs for AI Agents,prasmussen15,Python,"7,859",522,"4,791 stars this month",https://github.com//getzep/graphiti,GitHub_Python_monthly,2025-05-03 20:42:34
9,Agent-S,Agent S: an open agentic framework that uses computers like a human,alckasoc,Python,"3,957",384,"2,452 stars this month",https://github.com//simular-ai/Agent-S,GitHub_Python_monthly,2025-05-03 20:42:34
10,cua,c/ua is the Docker Container for Computer-Use AI Agents.,f-trycua,Python,"5,418",212,"2,032 stars this month",https://github.com//trycua/cua,GitHub_Python_monthly,2025-05-03 20:42:34
11,inbox-zero,AI personal assistant for email. Open source app to help you reach inbox zero fast.,elie222,TypeScript,"7,237",741,"3,040 stars this month",https://github.com//elie222/inbox-zero,GitHub_TypeScript_monthly,2025-05-03 20:42:34
12,drawdb,"Free, simple, and intuitive online database diagram editor and SQL generator.",1ilit,JavaScript,"29,512","2,064","3,206 stars this month",https://github.com//drawdb-io/drawdb,GitHub_JavaScript_monthly,2025-05-03 20:42:34
13,mcp-go,"A Go implementation of the Model Context Protocol (MCP), enabling seamless integration between LLM applications and external data sources and tools.",ezynda3,Go,"4,395",354,"2,543 stars this month",https://github.com//mark3labs/mcp-go,GitHub_Go_monthly,2025-05-03 20:42:34
14,Qwen3,"Qwen3 is the large language model series developed by Qwen team, Alibaba Cloud.",jklj077,Shell,"20,034","1,306","3,587 stars this month",https://github.com//QwenLM/Qwen3,GitHub_Shell_monthly,2025-05-03 20:42:34
15,ai-agents-for-beginners,10 Lessons to Get Started Building AI Agents,koreyspace,Jupyter Notebook,"18,096","4,628","8,716 stars this month",https://github.com//microsoft/ai-agents-for-beginners,GitHub_Jupyter Notebook_monthly,2025-05-03 20:42:34
16,llama-models,Utilities intended for use with Llama models.,ashwinb,Python,"6,934","1,135",967 stars this month,https://github.com//meta-llama/llama-models,GitHub_Python_monthly,2025-05-03 20:42:34
17,activepieces,AI Agents & MCPs & AI Workflow Automation • (280+ MCP servers for AI agents) • AI Automation / AI Agent with MCPs • AI Workflows & AI Agents • MCPs for AI Agents,abuaboud,TypeScript,"14,353","1,871","1,926 stars this month",https://github.com//activepieces/activepieces,GitHub_TypeScript_monthly,2025-05-03 20:42:34
1,Deep-Live-Cam,real time face swap and one-click video deepfake with only a single image,hacksider,Python,"58,532","8,267","6,689 stars this week",https://github.com//hacksider/Deep-Live-Cam,GitHub_Python_weekly,2025-05-03 20:42:34
2,leaked-system-prompts,Collection of leaked system prompts,jujumilk3,,"5,817",646,"2,422 stars this week",https://github.com//jujumilk3/leaked-system-prompts,GitHub__weekly,2025-05-03 20:42:34
3,suna,Suna - Open Source Generalist AI Agent,markokraemer,TypeScript,"9,535","1,183","4,443 stars this week",https://github.com//kortix-ai/suna,GitHub_TypeScript_weekly,2025-05-03 20:42:34
4,rowboat,AI-powered multi-agent builder,ramnique,TypeScript,"2,463",182,"1,530 stars this week",https://github.com//rowboatlabs/rowboat,GitHub_TypeScript_weekly,2025-05-03 20:42:34
5,Agent-S,Agent S: an open agentic framework that uses computers like a human,alckasoc,Python,"3,957",384,"1,448 stars this week",https://github.com//simular-ai/Agent-S,GitHub_Python_weekly,2025-05-03 20:42:34
6,generative-ai-for-beginners,"21 Lessons, Get Started Building with Generative AI 🔗 https://microsoft.github.io/generative-ai-for-beginners/",koreyspace,Jupyter Notebook,"82,076","42,135","2,304 stars this week",https://github.com//microsoft/generative-ai-for-beginners,GitHub_Jupyter Notebook_weekly,2025-05-03 20:42:34
7,lapce,Lightning-fast and Powerful Code Editor written in Rust,dzhou121,Rust,"36,009","1,119",826 stars this week,https://github.com//lapce/lapce,GitHub_Rust_weekly,2025-05-03 20:42:34
8,ladybird,Truly independent web browser,awesomekling,C++,"38,191","1,586",635 stars this week,https://github.com//LadybirdBrowser/ladybird,GitHub_C++_weekly,2025-05-03 20:42:34
9,drawdb,"Free, simple, and intuitive online database diagram editor and SQL generator.",1ilit,JavaScript,"29,512","2,064","1,307 stars this week",https://github.com//drawdb-io/drawdb,GitHub_JavaScript_weekly,2025-05-03 20:42:34
10,hyprnote,AI Notepad for back-to-back meetings. Local-first & Extensible.,yujonglee,TypeScript,"1,741",79,850 stars this week,https://github.com//fastrepl/hyprnote,GitHub_TypeScript_weekly,2025-05-03 20:42:34
11,Hunyuan3D-2,High-Resolution 3D Assets Generation with Large Scale Hunyuan3D Diffusion Models.,Zeqiang-Lai,Python,"9,281",781,570 stars this week,https://github.com//Tencent/Hunyuan3D-2,GitHub_Python_weekly,2025-05-03 20:42:34
12,graphiti,Build Real-Time Knowledge Graphs for AI Agents,prasmussen15,Python,"7,859",522,"3,128 stars this week",https://github.com//getzep/graphiti,GitHub_Python_weekly,2025-05-03 20:42:34
13,hyperswitch,"An open source payments switch written in Rust to make payments fast, reliable and affordable",hyperswitch-bot,Rust,"17,677","2,176","1,582 stars this week",https://github.com//juspay/hyperswitch,GitHub_Rust_weekly,2025-05-03 20:42:34
14,developer-roadmap,"Interactive roadmaps, guides and other educational content to help developers grow in their careers.",kamranahmedse,TypeScript,"317,129","41,137","1,306 stars this week",https://github.com//kamranahmedse/developer-roadmap,GitHub_TypeScript_weekly,2025-05-03 20:42:34
15,devops-exercises,"Linux, Jenkins, AWS, SRE, Prometheus, Docker, Python, Ansible, Git, Kubernetes, Terraform, OpenStack, SQL, NoSQL, Azure, GCP, DNS, Elastic, Network, Virtualization. DevOps Interview Questions",surister,Python,"75,553","16,825","1,082 stars this week",https://github.com//bregman-arie/devops-exercises,GitHub_Python_weekly,2025-05-03 20:42:34
16,trivy,"Find vulnerabilities, misconfigurations, secrets, SBOM in containers, Kubernetes, code repositories, clouds and more",knqyf263,Go,"26,099","2,528",442 stars this week,https://github.com//aquasecurity/trivy,GitHub_Go_weekly,2025-05-03 20:42:34
17,windows,Windows inside a Docker container.,kroese,Shell,"34,847","2,491",454 stars this week,https://github.com//dockur/windows,GitHub_Shell_weekly,2025-05-03 20:42:34
1,Stirling-PDF,#1 Locally hosted web application that allows you to perform various operations on PDF files,Frooodle,Java,"57,422","4,822",862 stars this week,https://github.com//Stirling-Tools/Stirling-PDF,GitHub_Java_weekly,2025-05-03 20:42:34
2,automq,AutoMQ is a stateless Kafka on S3. 10x Cost-Effective. No Cross-AZ Traffic Cost. Autoscale in seconds. Single-digit ms latency. Multi-AZ Availability.,ijuma,Java,"6,096",409,390 stars this week,https://github.com//AutoMQ/automq,GitHub_Java_weekly,2025-05-03 20:42:34
3,conductor,Conductor is an event driven orchestration platform providing durable and highly resilient execution engine for your applications,v1r3n,Java,"21,584",578,"1,040 stars this week",https://github.com//conductor-oss/conductor,GitHub_Java_weekly,2025-05-03 20:42:34
4,NewPipe,A libre lightweight streaming front-end for Android.,Stypox,Java,"33,682","3,188",98 stars this week,https://github.com//TeamNewPipe/NewPipe,GitHub_Java_weekly,2025-05-03 20:42:34
5,quarkus,Quarkus: Supersonic Subatomic Java.,gsmet,Java,"14,463","2,834",109 stars this week,https://github.com//quarkusio/quarkus,GitHub_Java_weekly,2025-05-03 20:42:34
6,SmartTube,Advanced player for set-top boxes and tvs running Android OS,yuliskov,Java,"22,490","1,201",146 stars this week,https://github.com//yuliskov/SmartTube,GitHub_Java_weekly,2025-05-03 20:42:34
7,thingsboard,"Open-source IoT Platform - Device management, data collection, processing and visualization.",ikulikov,Java,"18,760","5,528",70 stars this week,https://github.com//thingsboard/thingsboard,GitHub_Java_weekly,2025-05-03 20:42:34
8,nacos,"an easy-to-use dynamic service discovery, configuration and service management platform for building cloud native applications.",KomachiSion,Java,"31,303","13,003",62 stars this week,https://github.com//alibaba/nacos,GitHub_Java_weekly,2025-05-03 20:42:34
9,Sa-Token,一个轻量级 Java 权限认证框架，让鉴权变得简单、优雅！—— 登录认证、权限认证、分布式Session会话、微服务网关鉴权、单点登录、OAuth2.0,click33,Java,"17,543","2,728",86 stars this week,https://github.com//dromara/Sa-Token,GitHub_Java_weekly,2025-05-03 20:42:34
10,Mindustry,The automation tower defense RTS,Anuken,Java,"23,816","3,085",80 stars this week,https://github.com//Anuken/Mindustry,GitHub_Java_weekly,2025-05-03 20:42:34
11,zuul,"Zuul is a gateway service that provides dynamic routing, monitoring, resiliency, security, and more.",kerumai,Java,"13,721","2,412",26 stars this week,https://github.com//Netflix/zuul,GitHub_Java_weekly,2025-05-03 20:42:34
12,vprofile-project,,hkhcoder,Java,576,"2,798",21 stars this week,https://github.com//hkhcoder/vprofile-project,GitHub_Java_weekly,2025-05-03 20:42:34
13,awesome-leetcode-resources,Awesome LeetCode resources to learn Data Structures and Algorithms and prepare for Coding Interviews.,ashishps1,Java,"9,910","2,340",205 stars this week,https://github.com//ashishps1/awesome-leetcode-resources,GitHub_Java_weekly,2025-05-03 20:42:34
14,cassandra,Apache Cassandra®,jbellis,Java,"9,176","3,701",18 stars this week,https://github.com//apache/cassandra,GitHub_Java_weekly,2025-05-03 20:42:34
15,keycloak,Open Source Identity and Access Management For Modern Applications and Services,stianst,Java,"26,953","7,256",151 stars this week,https://github.com//keycloak/keycloak,GitHub_Java_weekly,2025-05-03 20:42:34
16,pulsar,Apache Pulsar - distributed pub-sub messaging system,merlimat,Java,"14,594","3,633",22 stars this week,https://github.com//apache/pulsar,GitHub_Java_weekly,2025-05-03 20:42:34
17,starrocks,"The world's fastest open query engine for sub-second analytics both on and off the data lakehouse. With the flexibility to support nearly any scenario, StarRocks provides best-in-class performance for multi-dimensional analytics, real-time analytics, and ad-hoc queries. A Linux Foundation project.",EsoragotoSpirit,Java,"9,949","1,981",55 stars this week,https://github.com//StarRocks/starrocks,GitHub_Java_weekly,2025-05-03 20:42:34
18,aws-sdk-java-v2,The official AWS SDK for Java - Version 2,aws-sdk-java-automation,Java,"2,353",904,49 stars this week,https://github.com//aws/aws-sdk-java-v2,GitHub_Java_weekly,2025-05-03 20:42:34
19,cloudstack,Apache CloudStack is an opensource Infrastructure as a Service (IaaS) cloud computing platform,rohityadavcloud,Java,"2,341","1,176",11 stars this week,https://github.com//apache/cloudstack,GitHub_Java_weekly,2025-05-03 20:42:34
20,libgdx,Desktop/Android/HTML5/iOS Java game development framework,NathanSweet,Java,"23,987","6,486",32 stars this week,https://github.com//libgdx/libgdx,GitHub_Java_weekly,2025-05-03 20:42:34
