index,title,desc,author,language,stars,forks,today_forks,url,type,datetime
2,factorio-learning-environment,"A non-saturating, open-ended environment for evaluating LLMs in Factorio",JackHopkins,HTML,589,23,126 stars this week,https://github.com//JackHopkins/factorio-learning-environment,GitHub_HTML_weekly,2025-03-22 02:30:40
3,free-for-dev,"A list of SaaS, PaaS and IaaS offerings that have free tiers of interest to devops and infradev",ripienaar,HTML,"92,991","10,071",274 stars this week,https://github.com//ripienaar/free-for-dev,GitHub_HTML_weekly,2025-03-22 02:30:40
4,website,Kubernetes website and documentation repo:,k8s-ci-robot,HTML,"4,826","14,674",33 stars this week,https://github.com//kubernetes/website,GitHub_HTML_weekly,2025-03-22 02:30:40
5,html-css,Curso de HTML5 e CSS3,gustavoguanabara,HTML,"14,611","3,528",59 stars this week,https://github.com//gustavoguanabara/html-css,GitHub_HTML_weekly,2025-03-22 02:30:40
6,git-github,Repositorio del Curso de Git y GitHub,aminespinoza10,HTML,391,524,38 stars this week,https://github.com//platzi/git-github,GitHub_HTML_weekly,2025-03-22 02:30:40
7,3d-force-graph,3D force-directed graph component using ThreeJS/WebGL,vasturiano,HTML,"5,077",862,34 stars this week,https://github.com//vasturiano/3d-force-graph,GitHub_HTML_weekly,2025-03-22 02:30:40
8,InstagramUnfollowers,Check if people follows you back on Instagram.,davidarroyo1234,HTML,"3,402",305,36 stars this week,https://github.com//davidarroyo1234/InstagramUnfollowers,GitHub_HTML_weekly,2025-03-22 02:30:40
9,CamPhish,Grab cam shots & GPS location from target's phone front camera or PC webcam just sending a link.,techchipnet,HTML,"3,560",971,31 stars this week,https://github.com//techchipnet/CamPhish,GitHub_HTML_weekly,2025-03-22 02:30:40
10,cve,Gather and update all available and newest CVEs with their PoC.,trickest-workflows,HTML,"6,815",864,15 stars this week,https://github.com//trickest/cve,GitHub_HTML_weekly,2025-03-22 02:30:40
11,huxpro.github.io,My Blog / Jekyll Themes / PWA,Huxpro,HTML,"7,317","5,982",23 stars this week,https://github.com//Huxpro/huxpro.github.io,GitHub_HTML_weekly,2025-03-22 02:30:40
1,drawio,"draw.io is a JavaScript, client-side editor for general diagramming.",davidjgraph,JavaScript,946,187,140 stars this week,https://github.com//jgraph/drawio,GitHub_JavaScript_weekly,2025-03-22 02:30:40
2,Web-Dev-For-Beginners,"24 Lessons, 12 Weeks, Get Started as a Web Developer",jlooper,JavaScript,"85,887","12,815",234 stars this week,https://github.com//microsoft/Web-Dev-For-Beginners,GitHub_JavaScript_weekly,2025-03-22 02:30:40
3,firecrawl-mcp-server,"Official Firecrawl MCP Server - Adds powerful web scraping to Cursor, Claude and any other LLM clients.",vrknetha,JavaScript,"1,510",117,590 stars this week,https://github.com//mendableai/firecrawl-mcp-server,GitHub_JavaScript_weekly,2025-03-22 02:30:40
4,next.js,The React Framework,ijjk,JavaScript,"130,418","27,956",280 stars this week,https://github.com//vercel/next.js,GitHub_JavaScript_weekly,2025-03-22 02:30:40
5,mcp-server-browserbase,Allow LLMs to control a browser with Browserbase and Stagehand,filip-michalsky,TypeScript,367,53,95 stars this week,https://github.com//browserbase/mcp-server-browserbase,GitHub_TypeScript_weekly,2025-03-22 02:30:40
6,3x-ui,Xray panel supporting multi-protocol multi-user expire day & traffic & IP limit (Vmess & Vless & Trojan & ShadowSocks & Wireguard),MHSanaei,JavaScript,"17,892","3,752",199 stars this week,https://github.com//MHSanaei/3x-ui,GitHub_JavaScript_weekly,2025-03-22 02:30:40
7,mcp-jetbrains,"A model context protocol server to work with JetBrains IDEs: IntelliJ, PyCharm, WebStorm, etc. Also, works with Android Studio",MaXal,JavaScript,254,26,69 stars this week,https://github.com//JetBrains/mcp-jetbrains,GitHub_JavaScript_weekly,2025-03-22 02:30:40
8,handsontable,"JavaScript Data Grid / Data Table with a Spreadsheet Look & Feel. Works with React, Angular, and Vue. Supported by the Handsontable team ⚡",warpech,JavaScript,"20,710","3,123",95 stars this week,https://github.com//handsontable/handsontable,GitHub_JavaScript_weekly,2025-03-22 02:30:40
9,generative-ai-with-javascript,Join a time-traveling adventure where you meet history’s legends while learning Generative AI technologies! ✨,sinedied,JavaScript,328,130,70 stars this week,https://github.com//microsoft/generative-ai-with-javascript,GitHub_JavaScript_weekly,2025-03-22 02:30:40
10,supergateway,Run MCP stdio servers over SSE and SSE over stdio. AI gateway.,Nedomas,JavaScript,347,30,80 stars this week,https://github.com//supercorp-ai/supergateway,GitHub_JavaScript_weekly,2025-03-22 02:30:40
11,dayjs,⏰ Day.js 2kB immutable date-time library alternative to Moment.js with the same modern API,iamkun,JavaScript,"47,552","2,339",51 stars this week,https://github.com//iamkun/dayjs,GitHub_JavaScript_weekly,2025-03-22 02:30:40
12,Ghost,"Independent technology for modern publishing, memberships, subscriptions and newsletters.",ErisDS,JavaScript,"48,726","10,640",96 stars this week,https://github.com//TryGhost/Ghost,GitHub_JavaScript_weekly,2025-03-22 02:30:40
13,three.js,JavaScript 3D Library.,mrdoob,JavaScript,"105,158","35,634",226 stars this week,https://github.com//mrdoob/three.js,GitHub_JavaScript_weekly,2025-03-22 02:30:40
14,Weibo_PublicOpinion_AnalysisSystem,An excellent Weibo public opinion analysis and prediction system.,666ghj,JavaScript,232,66,21 stars this week,https://github.com//666ghj/Weibo_PublicOpinion_AnalysisSystem,GitHub_JavaScript_weekly,2025-03-22 02:30:40
15,stdlib,✨ Standard library for JavaScript and Node.js. ✨,kgryte,JavaScript,"5,022",739,71 stars this week,https://github.com//stdlib-js/stdlib,GitHub_JavaScript_weekly,2025-03-22 02:30:40
