index,title,desc,author,language,stars,forks,today_forks,url,type,datetime
2,free-for-dev,"A list of SaaS, PaaS and IaaS offerings that have free tiers of interest to devops and infradev",ripienaar,HTML,"100,136","10,731","1,425 stars this week",https://github.com//ripienaar/free-for-dev,GitHub_HTML_weekly,2025-06-26 02:41:27
3,windmill,"Open-source developer platform to power your entire infra and turn scripts into webhooks, workflows and UIs. Fastest workflow engine (13x vs Airflow). Open-source alternative to Retool and Temporal.",rubenfiszel,HTML,"13,790",726,417 stars this week,https://github.com//windmill-labs/windmill,GitHub_HTML_weekly,2025-06-26 02:41:27
4,zphisher,An automated phishing tool with 30+ templates. This Tool is made for educational purpose only ! Author will not be responsible for any misuse of this toolkit !,htr-tech,HTML,"13,507","4,890",51 stars this week,https://github.com//htr-tech/zphisher,GitHub_HTML_weekly,2025-06-26 02:41:27
5,MeshCentral,A complete web-based remote monitoring and management web site. Once setup you can install agents and perform remote desktop session to devices on the local network or over the Internet.,Ylianst,HTML,"5,149",668,37 stars this week,https://github.com//Ylianst/MeshCentral,GitHub_HTML_weekly,2025-06-26 02:41:27
6,unstructured,"Convert documents to structured data effortlessly. Unstructured is open-source ETL solution for transforming complex documents into clean, structured formats for language models. Visit our website to learn more about our enterprise grade Platform product for production grade workflows, partitioning, enrichments, chunking and embedding.",MthwRobinson,HTML,"11,721",966,185 stars this week,https://github.com//Unstructured-IO/unstructured,GitHub_HTML_weekly,2025-06-26 02:41:27
7,labs-ai-tools-for-devs,Your trusted home for discovering MCP tools – seamlessly integrated into Docker,ColinMcNeil,HTML,316,68,22 stars this week,https://github.com//docker/labs-ai-tools-for-devs,GitHub_HTML_weekly,2025-06-26 02:41:27
8,public-pentesting-reports,A list of public penetration test reports published by several consulting firms and academic security groups.,juliocesarfort,HTML,"8,969","2,043",39 stars this week,https://github.com//juliocesarfort/public-pentesting-reports,GitHub_HTML_weekly,2025-06-26 02:41:27
9,home-assistant.io,📘 Home Assistant User documentation,frenck,HTML,"6,679","7,732",40 stars this week,https://github.com//home-assistant/home-assistant.io,GitHub_HTML_weekly,2025-06-26 02:41:27
10,Configure-Xray-with-VLESS-Reality-on-VPS-server,"Подробная инструкция (как в pdf, так и в md формате) о настройке своего совбственного Xray-VPS-сервера (с протоколом VLESS XTLS-Reality через панель 3x-ui), а также настройке клиентских приложений (ПК и телефон)",EmptyLibra,HTML,774,227,30 stars this week,https://github.com//EmptyLibra/Configure-Xray-with-VLESS-Reality-on-VPS-server,GitHub_HTML_weekly,2025-06-26 02:41:27
11,Security-101,"8 Lessons, Kick-start Your Cybersecurity Learning.",banreyms,HTML,"5,309",679,45 stars this week,https://github.com//microsoft/Security-101,GitHub_HTML_weekly,2025-06-26 02:41:27
12,NetherSX2-patch,Unofficial Patches for NetherSX2,Trixarian,HTML,"1,338",52,78 stars this week,https://github.com//Trixarian/NetherSX2-patch,GitHub_HTML_weekly,2025-06-26 02:41:27
13,n8n-docs,"Documentation for n8n, a fair-code licensed automation tool with a free community edition and powerful enterprise options. Build AI functionality into your workflows.",tanay1337,HTML,666,"1,573",31 stars this week,https://github.com//n8n-io/n8n-docs,GitHub_HTML_weekly,2025-06-26 02:41:27
14,AWS-Certified-Cloud-Practitioner-Notes,AWS Certified Cloud Practitioner Short Notes And Practice Exams (CLF-C02),kananinirav,HTML,"2,976","1,126",38 stars this week,https://github.com//kananinirav/AWS-Certified-Cloud-Practitioner-Notes,GitHub_HTML_weekly,2025-06-26 02:41:27
15,JavaScript30,30 Day Vanilla JS Challenge,wesbos,HTML,"28,516","39,686",32 stars this week,https://github.com//wesbos/JavaScript30,GitHub_HTML_weekly,2025-06-26 02:41:27
1,automatisch,The open source Zapier alternative. Build workflow automation without spending time and money.,farukaydin,JavaScript,"11,613",846,"2,488 stars this week",https://github.com//automatisch/automatisch,GitHub_JavaScript_weekly,2025-06-26 02:41:27
2,Web-Dev-For-Beginners,"24 Lessons, 12 Weeks, Get Started as a Web Developer",jlooper,JavaScript,"89,817","13,547",963 stars this week,https://github.com//microsoft/Web-Dev-For-Beginners,GitHub_JavaScript_weekly,2025-06-26 02:41:27
3,3x-ui,Xray panel supporting multi-protocol multi-user expire day & traffic & IP limit (Vmess & Vless & Trojan & ShadowSocks & Wireguard),MHSanaei,JavaScript,"20,697","4,438",317 stars this week,https://github.com//MHSanaei/3x-ui,GitHub_JavaScript_weekly,2025-06-26 02:41:27
4,hiring-without-whiteboards,⭐️ Companies that don't have a broken hiring process,bors,JavaScript,"48,808","3,789",97 stars this week,https://github.com//poteto/hiring-without-whiteboards,GitHub_JavaScript_weekly,2025-06-26 02:41:27
5,TwitchAdSolutions,,pixeltris,JavaScript,"9,426",540,165 stars this week,https://github.com//pixeltris/TwitchAdSolutions,GitHub_JavaScript_weekly,2025-06-26 02:41:27
6,Sigma-Web-Dev-Course,Source Code for Sigma Web Development Course,CodeWithHarry,JavaScript,"8,898","2,628",123 stars this week,https://github.com//CodeWithHarry/Sigma-Web-Dev-Course,GitHub_JavaScript_weekly,2025-06-26 02:41:27
7,next.js,The React Framework,ijjk,JavaScript,"132,694","28,678",210 stars this week,https://github.com//vercel/next.js,GitHub_JavaScript_weekly,2025-06-26 02:41:27
8,engine,"Powerful web graphics runtime built on WebGL, WebGPU, WebXR and glTF",willeastcott,JavaScript,"10,357","1,427",44 stars this week,https://github.com//playcanvas/engine,GitHub_JavaScript_weekly,2025-06-26 02:41:27
9,ai-app-lab,,yinchengfeng-bytedance,JavaScript,"1,477",276,46 stars this week,https://github.com//volcengine/ai-app-lab,GitHub_JavaScript_weekly,2025-06-26 02:41:27
10,htmx,</> htmx - high power tools for HTML,1cg,JavaScript,"45,105","1,454",110 stars this week,https://github.com//bigskysoftware/htmx,GitHub_JavaScript_weekly,2025-06-26 02:41:27
11,webvm,Virtual Machine for the Web,alexp-sssup,JavaScript,"14,218","2,557",899 stars this week,https://github.com//leaningtech/webvm,GitHub_JavaScript_weekly,2025-06-26 02:41:27
12,multipleWindow3dScene,"A quick example of how one can ""synchronize"" a 3d scene across multiple windows using three.js and localStorage",bgstaal,JavaScript,"18,415","2,849",200 stars this week,https://github.com//bgstaal/multipleWindow3dScene,GitHub_JavaScript_weekly,2025-06-26 02:41:27
13,node,Node.js JavaScript runtime ✨🐢🚀✨,Trott,JavaScript,"111,891","31,940",141 stars this week,https://github.com//nodejs/node,GitHub_JavaScript_weekly,2025-06-26 02:41:27
14,30-Days-Of-JavaScript,"30 days of JavaScript programming challenge is a step-by-step guide to learn JavaScript programming language in 30 days. This challenge may take more than 100 days, please just follow your own pace. These videos may help too: https://www.youtube.com/channel/UC7PNRuno1rzYPb1xLa4yktw",Asabeneh,JavaScript,"44,629","10,244",197 stars this week,https://github.com//Asabeneh/30-Days-Of-JavaScript,GitHub_JavaScript_weekly,2025-06-26 02:41:27
15,brave-browser,"Brave browser for Android, iOS, Linux, macOS, Windows.",brave-browser-releases,JavaScript,"19,556","2,630",71 stars this week,https://github.com//brave/brave-browser,GitHub_JavaScript_weekly,2025-06-26 02:41:27
16,OpenSign,🔥 The free & Open Source DocuSign alternative,prafull-opensignlabs,JavaScript,"4,761",449,50 stars this week,https://github.com//OpenSignLabs/OpenSign,GitHub_JavaScript_weekly,2025-06-26 02:41:27
17,nuclei-templates,Community curated list of templates for the nuclei engine to find security vulnerabilities.,actions-user,JavaScript,"10,347","2,887",31 stars this week,https://github.com//projectdiscovery/nuclei-templates,GitHub_JavaScript_weekly,2025-06-26 02:41:27
18,generative-ai-with-javascript,Join a time-traveling adventure where you meet history’s legends while learning Generative AI technologies! ✨,sinedied,JavaScript,737,465,44 stars this week,https://github.com//microsoft/generative-ai-with-javascript,GitHub_JavaScript_weekly,2025-06-26 02:41:27
