type,datetime,index,id,title,desc,hot,url,img,createtime
知乎热榜,2025-03-22 14:10:45,21,15332668661,大家评论「一眼 DeepSeek」时，一般是看到了什么才做出的这个判断？,经常能看到一些回答的评论区有类似的说法（包括我自己也会发类似评论） 但是，大家会判错么？ AI 味儿是一种什么味儿？不同的 AI 味儿是否不同？ 判断是否 AI 创作，创作者、阅读者、知乎社区应该怎么做？ 以及，有公正客观可信赖的 AI 鉴别工具么？,56 万热度,https://www.zhihu.com/question/15332668661,https://pic1.zhimg.com/80/v2-58e7e5c2697875bd86308b9bcf3bb12a_1440w.jpg,2025-03-19 06:40:50
知乎热榜,2025-03-22 14:10:45,22,332996631,去过老挝后你最大的感受是什么？,,54 万热度,https://www.zhihu.com/question/332996631,https://pic1.zhimg.com/80/v2-726fcf3ae16ea326bdfa9c8892af835b_1440w.webp?source=1def8aca,2019-07-02 20:00:37
知乎热榜,2025-03-22 14:10:45,23,15139110880,“早恋”这一概念是否会因为生育率过低而逐渐淡化或消失?,,54 万热度,https://www.zhihu.com/question/15139110880,https://picx.zhimg.com/80/v2-f29916c21001862607063daa4d418ae2_1440w.jpg,2025-03-16 15:24:27
知乎热榜,2025-03-22 14:10:45,24,1886328868585071732,如何评价动画片《Ave Mujica》第十二集中丰川祥子的中二表现？,原来这就是所谓的“JK斗财阀”啊？你不能在需要包饺子的时候才想起这是少女乐队世界。,54 万热度,https://www.zhihu.com/question/1886328868585071732,https://pic2.zhimg.com/50/v2-321d084785d45e980a534726c2013a3b_b.jpg,2025-03-21 00:10:48
知乎热榜,2025-03-22 14:10:45,25,65569190,历史上真的存在石器时代吗？,水是人类生存的第一要务，近水平原是最适宜人类发展的地方，人类古代著名文明都是大河文明。大河平原石器并不必然易得，可能多说还是不一得，为何会有石器时代？石器在当时可能还是奢侈品。 不可否认史前遗迹石器多有，但是这个是不是因为石器更易留存，而不是当时石器占主导地位？,54 万热度,https://www.zhihu.com/question/65569190,https://pica.zhimg.com/80/v2-0ffaf4f670162d227c76ba8e488a4c45_1440w.webp?source=1def8aca,2017-09-19 10:54:15
知乎热榜,2025-03-22 14:10:45,26,15390619471,新能源车平均降价 3 万元，B 级车起售价降至 10 万内，超八成经销商价格倒挂，对行业有哪些影响？,“ID这款车型目前一口价最低配13.99万元起，相较于之前，全系都有不同程度的现金优惠。”3月17日，北京某大众经销商告诉《每日经济新闻》记者。 据记者了解，当前某ID车型，已将起售价下调至11.99万元，比原建议零售价低了4.3万元。上述大众经销商称：“从2024年下半年开始，这款ID车型在终端市场的售价就有所下降，如果叠加一些限时礼包，综合优惠一度达到6万元左右。” 当前，在售的纯电动车型中，ID.系列降价并非孤例。中国汽车流通协会乘用车市场信息联席分会（以下简称乘联分会）最近公布的一份统计显示，今年1~2月，总体乘用车市场新车的降价幅度平均达到3万元，有超过20款新能源车型开启“狂暴式降价”。其中，纯电动新上市车型平均降价3.9万元，降幅17%。 一线调查 | “不降3万、5万元没诚意”！新能源车平均降3万元，超八成经销商价格倒挂 | 每经网,54 万热度,https://www.zhihu.com/question/15390619471,https://pica.zhimg.com/80/v2-a9ae88fc8b287dd9b7639d2e3f2ff5d6_1440w.png,2025-03-20 01:35:54
知乎热榜,2025-03-22 14:10:45,27,19664006,如何高效率地提高厨艺？,跟随电视节目或者美食博客学菜，只能死记硬背下几个菜谱而已。 如何灵活运用调料，掌握不同食材烹饪原理，像明白化学反应一样理解烧菜？,54 万热度,https://www.zhihu.com/question/19664006,https://pic2.zhimg.com/50/v2-8648d1a9e996ef77c53eb75b675b9695_b.jpg,2011-05-22 12:27:08
知乎热榜,2025-03-22 14:10:45,28,15354436487,《刺客信条：影》在Steam全球热销榜的排名已经升至第一，如何评价这一成绩？,在国区热销榜也来到了第二名的位置,54 万热度,https://www.zhihu.com/question/15354436487,https://pic1.zhimg.com/80/v2-695c297efe0d84acd36f623a47f0d437_1440w.webp?source=1def8aca,2025-03-19 10:50:48
知乎热榜,2025-03-22 14:10:45,29,15471955320,李嘉诚旗下长和公布港口收入， 去年 53 个港口收入 453 亿港元，同比增长 11%，如何解读？,3月20日下午，处于舆论风口的长和发布2024年业绩报告。 2024年度公司总营收4766.8亿港元，同比增长3.3%。 按IFRS16前基准，普通股股东应占基本溢利为港币207.7亿元，与2023年相比，以当地货币计算下跌10%。按IFRS16后基准，普通股股东应占呈报溢利为港币170.88亿元，较去年减少27%。2024年度每股呈报盈利为港币4.46元。董事会建议派发末期股息每股港币1.51元。联同中期股息每股港币0.69元，全年股息为每股港币2.2元。 长和拥有4项核心业务，分别是港口及相关服务、零售、基建、电讯。 2024年长和港口及相关服务部门录得收益452.82亿港元，较2023年增加11%。2024年长和港口整体吞吐量增加6%，至8750万个标准货柜。 长和表示，此部门是全球最具领导地位之港口网络，截至2024年12月31日，在24个国家53个港口拥有共295个营运泊位之权益。该部门包括集团于和记港口集团旗下公司之80%权益及其持有30.07%权益之上市联营公司和记港口信托。 长和称，展望2025年，由于航运公司转至新联盟及持续地缘政治风险影响全球贸易，预计年初出现之供应链中断情况可能带来阻力。然而，亚洲及中东地区预期继续温和自然增长，加上现有码头设施扩建及策略伙伴关系加强，此部门于来年之营运业绩有望改进。 值得注意的是，本月初，长和拟向美国贝莱德牵头的财团转让其持有和运营的，分布于23个国家的43个港口，其中包括巴拿马运河两端的港口，总价值228亿美元。 重磅！李嘉诚旗下长和公布：全球53个港口贡献453亿港元收入，吞吐量达8750万个标准货柜，公司净利润207亿港元,54 万热度,https://www.zhihu.com/question/15471955320,https://pic4.zhimg.com/v2-82d432d667bf1c73dace5a3a86666567_1440w.jpg,2025-03-21 04:58:31
知乎热榜,2025-03-22 14:10:45,30,21538837,如何评价电影《十月围城》？,,54 万热度,https://www.zhihu.com/question/21538837,https://pic3.zhimg.com/50/v2-e2f852aeb89b7a33cb03ef5aff9d87b2_b.jpg,2013-08-25 09:16:46
知乎热搜,2025-03-22 15:09:50,1,,有哪些故意缩短产品寿命的设计,,,https://www.zhihu.com/search?q=%E6%9C%89%E5%93%AA%E4%BA%9B%E6%95%85%E6%84%8F%E7%BC%A9%E7%9F%AD%E4%BA%A7%E5%93%81%E5%AF%BF%E5%91%BD%E7%9A%84%E8%AE%BE%E8%AE%A1,,
知乎热搜,2025-03-22 15:09:50,2,,你见过最令你震撼的一张图片是什么,,,https://www.zhihu.com/search?q=%E4%BD%A0%E8%A7%81%E8%BF%87%E6%9C%80%E4%BB%A4%E4%BD%A0%E9%9C%87%E6%92%BC%E7%9A%84%E4%B8%80%E5%BC%A0%E5%9B%BE%E7%89%87%E6%98%AF%E4%BB%80%E4%B9%88,,
知乎热搜,2025-03-22 15:09:50,3,,如何看待美国识字率只有 79％,,,https://www.zhihu.com/search?q=%E5%A6%82%E4%BD%95%E7%9C%8B%E5%BE%85%E7%BE%8E%E5%9B%BD%E8%AF%86%E5%AD%97%E7%8E%87%E5%8F%AA%E6%9C%89%2079%EF%BC%85,,
知乎热搜,2025-03-22 15:09:50,4,,张学友广州演唱会取消,,,https://www.zhihu.com/search?q=%E5%BC%A0%E5%AD%A6%E5%8F%8B%E5%B9%BF%E5%B7%9E%E6%BC%94%E5%94%B1%E4%BC%9A%E5%8F%96%E6%B6%88,,
知乎热搜,2025-03-22 15:09:50,5,,董明珠称「我跟雷军不要竞争」,,,https://www.zhihu.com/search?q=%E8%91%A3%E6%98%8E%E7%8F%A0%E7%A7%B0%E3%80%8C%E6%88%91%E8%B7%9F%E9%9B%B7%E5%86%9B%E4%B8%8D%E8%A6%81%E7%AB%9E%E4%BA%89%E3%80%8D,,
知乎热搜,2025-03-22 15:09:50,6,,罗伯逊晋级半决赛,,,https://www.zhihu.com/search?q=%E7%BD%97%E4%BC%AF%E9%80%8A%E6%99%8B%E7%BA%A7%E5%8D%8A%E5%86%B3%E8%B5%9B,,
知乎热搜,2025-03-22 15:09:50,7,,独行侠vs灰熊,,,https://www.zhihu.com/search?q=%E7%8B%AC%E8%A1%8C%E4%BE%A0vs%E7%81%B0%E7%86%8A,,
知乎热搜,2025-03-22 15:09:50,8,,联合国直升机遭袭27人丧生,,,https://www.zhihu.com/search?q=%E8%81%94%E5%90%88%E5%9B%BD%E7%9B%B4%E5%8D%87%E6%9C%BA%E9%81%AD%E8%A2%AD27%E4%BA%BA%E4%B8%A7%E7%94%9F,,
知乎热搜,2025-03-22 15:09:50,9,,俄军称在库尔斯克州转入全线大规模进攻,,,https://www.zhihu.com/search?q=%E4%BF%84%E5%86%9B%E7%A7%B0%E5%9C%A8%E5%BA%93%E5%B0%94%E6%96%AF%E5%85%8B%E5%B7%9E%E8%BD%AC%E5%85%A5%E5%85%A8%E7%BA%BF%E5%A4%A7%E8%A7%84%E6%A8%A1%E8%BF%9B%E6%94%BB,,
知乎热搜,2025-03-22 15:09:50,10,,拜仁联赛主场37次对阵波鸿,,,https://www.zhihu.com/search?q=%E6%8B%9C%E4%BB%81%E8%81%94%E8%B5%9B%E4%B8%BB%E5%9C%BA37%E6%AC%A1%E5%AF%B9%E9%98%B5%E6%B3%A2%E9%B8%BF,,
知乎热搜,2025-03-22 15:09:50,11,,养老服务向全体老年人拓展,,,https://www.zhihu.com/search?q=%E5%85%BB%E8%80%81%E6%9C%8D%E5%8A%A1%E5%90%91%E5%85%A8%E4%BD%93%E8%80%81%E5%B9%B4%E4%BA%BA%E6%8B%93%E5%B1%95,,
知乎热搜,2025-03-22 15:09:50,12,,哈马斯称应立即开启停火协议第二阶段谈判,,,https://www.zhihu.com/search?q=%E5%93%88%E9%A9%AC%E6%96%AF%E7%A7%B0%E5%BA%94%E7%AB%8B%E5%8D%B3%E5%BC%80%E5%90%AF%E5%81%9C%E7%81%AB%E5%8D%8F%E8%AE%AE%E7%AC%AC%E4%BA%8C%E9%98%B6%E6%AE%B5%E8%B0%88%E5%88%A4,,
知乎热搜,2025-03-22 15:09:50,13,,「人造太阳」关键系统通过验收,,,https://www.zhihu.com/search?q=%E3%80%8C%E4%BA%BA%E9%80%A0%E5%A4%AA%E9%98%B3%E3%80%8D%E5%85%B3%E9%94%AE%E7%B3%BB%E7%BB%9F%E9%80%9A%E8%BF%87%E9%AA%8C%E6%94%B6,,
知乎热搜,2025-03-22 15:09:50,14,,下一代「人造太阳」关键系统通过验收,,,https://www.zhihu.com/search?q=%E4%B8%8B%E4%B8%80%E4%BB%A3%E3%80%8C%E4%BA%BA%E9%80%A0%E5%A4%AA%E9%98%B3%E3%80%8D%E5%85%B3%E9%94%AE%E7%B3%BB%E7%BB%9F%E9%80%9A%E8%BF%87%E9%AA%8C%E6%94%B6,,
知乎热搜,2025-03-22 15:09:50,15,,库里正式达成25000分里程碑,,,https://www.zhihu.com/search?q=%E5%BA%93%E9%87%8C%E6%AD%A3%E5%BC%8F%E8%BE%BE%E6%88%9025000%E5%88%86%E9%87%8C%E7%A8%8B%E7%A2%91,,
知乎热搜,2025-03-22 15:09:50,16,,国际乒联公布徐克与女运动员聊天记录,,,https://www.zhihu.com/search?q=%E5%9B%BD%E9%99%85%E4%B9%92%E8%81%94%E5%85%AC%E5%B8%83%E5%BE%90%E5%85%8B%E4%B8%8E%E5%A5%B3%E8%BF%90%E5%8A%A8%E5%91%98%E8%81%8A%E5%A4%A9%E8%AE%B0%E5%BD%95,,
知乎热搜,2025-03-22 15:09:50,17,,我国成功发射通信技术试验卫星十五号,,,https://www.zhihu.com/search?q=%E6%88%91%E5%9B%BD%E6%88%90%E5%8A%9F%E5%8F%91%E5%B0%84%E9%80%9A%E4%BF%A1%E6%8A%80%E6%9C%AF%E8%AF%95%E9%AA%8C%E5%8D%AB%E6%98%9F%E5%8D%81%E4%BA%94%E5%8F%B7,,
知乎热搜,2025-03-22 15:09:50,18,,零跑B10预售,,,https://www.zhihu.com/search?q=%E9%9B%B6%E8%B7%91B10%E9%A2%84%E5%94%AE,,
知乎热榜,2025-03-22 15:09:50,1,15500308602,如何评价蔚来发布 2024 年财报，称全年亏损 204 亿，四季度亏损 66 亿？,3月21日下午消息，蔚来(NYSE： NIO； HKEX： 9866； SGX： NIO)今日发布了截至12月31日的2024年第四季度及全年财报。第四季度，总营收为197.034亿元，同比增长15.2%，环比增长5.5%。净亏损71.115亿元，同比增亏32.5%，环比增亏40.6%。不按美国通用会计准则，调整后的净亏损为66.222亿元，同比增亏37.9% ，环比增亏50.1%。 2024年全年，总营收为657.316亿元，与2023年相比增长18.2%。净亏损224.017亿元，而2023年净亏损207.198亿元。不按美国通用会计准则，调整后的净亏损为204.732亿元，而2023年净亏损183.507亿元。营收创新高、亏损在扩大，蔚来想要今年四季度盈利,690 万热度,https://www.zhihu.com/question/15500308602,https://picx.zhimg.com/80/v2-61d9a914bc3fb2851d29429baa03f052_1440w.webp?source=1def8aca,2025-03-21 10:22:44
知乎热榜,2025-03-22 15:09:50,2,15463753362,学生买房给上海教授养老，去世后教授家属要霸占房产，真实情况是怎样的？教授家属能继承房产吗？,老师居住环境艰苦 学生“豪气送房” 1983年，二十出头的张玮成为了上海音乐学院资深声乐教授陈老师的学生，就此开启了一段特殊的师生缘分。 当时，陈老师住在上海音乐学院教工宿舍，一间仅15平米的小房间里，厨房、卫生间还要和邻居四口之家共用。 而陈老师的弟弟于1984年调到上海交通大学任教，一直都单身的姐弟俩就此相依为命。 因为当时音乐学院条件有限，直到1996年退休，一直单身没结婚的陈老师都没能分到一套独立的福利房。住房问题成为老师姐弟俩生活中最大的难题，这个心病也被一众与陈老师有着非常深厚情谊的学生们看在眼里。 老师的辛酸，深深刺痛了学生张玮。 张玮表示，自从1983年认识陈老师之后，就深深地被陈老师的个人魅力所折服。在她看来，陈老师不仅专业能力强，对待学生方面与为人师表方面更是无可挑剔。渐渐地，她便与陈老师成为了“忘年交”。在她心里，陈老师就像她的另一个母亲一样，让她尊敬，令她爱戴。 面对老师生活的窘境，2001年，张玮做出了一个重大决定：全款买下法华镇路一套125平米的房子，给两位老师居住。 为此，张玮称自己不仅倾尽了积蓄，还卖掉一套商品房，只为让他们能有尊严地安享晚年。 张玮表示，考虑到老师看重户口，为了让他们住得安心，张玮还让两位老师把户口也一起迁过来。但因为不是亲属关系就不能迁户，张玮为此还在房产证上加上了两位老师的名字。 四十年里，张玮与两位老师亲密无间，每年节假日、生日宴，张玮都陪伴在老师身边，让没有子女的两位老师尽享天伦之乐，如同一家人。 老师去世房难讨回 后来，陈老师及弟弟先后去世，给老师操办完后事的张玮想要拿回自己购买的这套房产，在办理房产变更手续时，却发生了意外。 陈老师远在外地的两位外甥在已经继承了老人上百万的存款之后，拒绝了张玮变更产证的要求。 在张玮看来，这套房屋是她全款买来给老师居住的，产证上加名字只是为了给非血缘关系的老师报户口。因此，产权登记与实质权益的分配不是一码事。 况且，两位外甥因亲属关系较远，又常年居住在外地，仅是隔几年来看望两位老人一次，无其他联系及赡养行为。 现代版“农夫与蛇”？学生买房给上海教授养老，去世后教授家属要霸占房产？,345 万热度,https://www.zhihu.com/question/15463753362,https://pic1.zhimg.com/v2-cfe269a6a6ae4af77d76bffecc88da2c_1440w.jpg,2025-03-21 01:54:31
知乎热榜,2025-03-22 15:09:50,3,15410965237,南航回应称「超薄座椅」是市场主流产品，更节能环保舒适，这会影响乘客飞行选择吗？你能接受「超薄座椅」吗？,近日，有媒体报道称，南方航空公司（以下简称“南方航空”）在部分航线换上了“超薄座椅”。该类座椅比传统飞机座椅薄得多，厚度大约只有人手一拳宽。 《经济参考报》记者注意到，许多网友在社交媒体上分享了乘坐南方航空“超薄座椅”的经历。 记者根据网友分享乘坐的飞机，编号B6761，在航旅纵横App搜索到今日（3月20日）的多个航班，包括CZ2133、CZ2303、CZ2304，均为南方航空承运，且飞机机型均为空客320-232。 航旅纵横App显示上述航班座位数均为180个，且全部为经济舱座位。与此前媒体报道的“南方航空将多舱位型号转变为全经济舱，并推出‘超薄座椅’”内容一致。 记者联系了南方航空，南方航空方面告诉记者，网传“超薄座椅”的说法，按航空业界的标准称谓，应是“轻薄型座椅”。南航对已到翻新年限的部分飞机采用“轻薄型座椅”，主要有三点考虑：一是该类型座椅更加节能环保；二是该类型座椅更符合人体工学设计；三是该类型座椅是目前市场主流座椅产品之一。南航表示，他们选用的“轻薄型座椅”由中航工业旗下的航宇嘉泰公司生产，该公司是三大航C919飞机座椅供应商。南航选用的JT220E型号经济舱座椅是目前市场主流产品之一，是三大航C919和南航A320neo系列、B737-8上都在使用的同型号座椅，可媲美国外厂家同类产品，目前已成功跻身波音、空客和中商飞的座椅供应商可选产品目录清单中。 “轻薄型座椅”照片（南方航空供图） 针对乘坐“轻薄型座椅”，有网友表示不能接受，也有网友表示不重要。 那乘客能否提前了解哪些航班有轻薄型座椅？就此，记者向南方航空客服咨询，客服回复公司内部并无相关公告，暂时无法查询。 今年1月，南方航空发布了2024年业绩预告，南方航空预计2024年度净利润为-12.5亿元到-18.7亿元，扣除非经常性损益后的净利润为-33.5亿元到-43.8亿元。2023年，南航的净利润为-42.09亿元，这意味着2024年大幅减亏。（实习生赵月对本文亦有贡献） 内容来源“超薄座椅”引热议 南航回应：是市场主流产品 更节能环保舒适_飞机_经济舱_航班,298 万热度,https://www.zhihu.com/question/15410965237,https://pic1.zhimg.com/80/v2-3ed731ef40b04a5a21aab61a1709fa8d_1440w.webp?source=1def8aca,2025-03-20 07:24:36
知乎热榜,2025-03-22 15:09:50,4,15540927075,黄子韬称准备跨界做卫生巾，他能做好吗？哪些关键环节要特别注意？,近日，黄子韬近期公开表示计划打造透明化卫生巾工厂，这一想法源于对315晚会曝光的劣质卫生巾事件的关注，以及他个人对女性健康议题的重视。他自2024年底开始筹备该项目，并让徐艺洋参与产品测试，目前已尝试了3-4款样品，但仍存在瑕疵需改进。 3月15日晚播出的中央广播电视总台“3·15”晚会上，曝光了多个知名品牌的卫生巾、纸尿裤残次料被翻新“二次销售”，此事引发消费者对卫生巾质量的担忧。 △ 3·15晚会丨涉多个知名品牌！卫生巾、纸尿裤残次料 竟被翻新“二次销售” 黄子韬在直播中称自己真的看不下去了，那些赚卫生巾黑心钱的人真的太恶心了。黄子韬透露想做透明化卫生巾工厂，徐艺洋已经试了3~4款，不能保证完全没有瑕疵，但绝对干净安全。 对此，网友们纷纷在评论区表示支持，有网友认为他敢给徐艺洋试，就证明他对干净安全这方面挺有信心的。还有网友表示，“赶紧去做，多上心哈，建立长期有效的监管机制，保证健康卫生是最重要的。”你如何看待？ 黄子韬直播称准备跨界卖卫生巾，徐艺洋已经试了三四款，网友：支持，做得好一定买！,283 万热度,https://www.zhihu.com/question/15540927075,https://pic2.zhimg.com/80/v2-39735627b63e017cbb888a2199459c1d_1440w.webp,2025-03-22 04:03:35
知乎热榜,2025-03-22 15:09:50,5,15542326351,一景区招 60 岁以上老人带薪钓鱼扮演 NPC ，时薪 20 元还包吃，怎么看待此事？,3月21日，湖南宁乡市炭河古城发布一则招聘公告。 公告称，景区招募100名“姜太公”，要求是身体健康会钓鱼的60岁以上农民，年龄越大越容易被选中，上班时间可以睡觉、发呆、打盹、闲聊，每天工作2—4小时，时薪20元还包吃。 景区工作人员回应称，主要招人是扮演NPC，一个钓鱼的姜太公形象，也不是短期工，没有别的要求。 公开资料显示，炭河古城因炭河里遗址而来，位于湖南省宁乡市，为中国首个周文化主题公园。 来源：九派新闻 内容来源一景区招60岁以上老人带薪钓鱼：时薪20元还包吃，能发呆打盹_姜太公_宁乡_湖南,239 万热度,https://www.zhihu.com/question/15542326351,https://pic1.zhimg.com/80/v2-8821408bb591aed7822494d47b1bfdae_1440w.png,2025-03-22 05:05:03
知乎热榜,2025-03-22 15:09:50,6,15513417646,特斯拉门店进入警戒状态，所有车辆启动哨兵模式，特朗普称破坏特斯拉可能获刑二十年，马斯克该如何扭转局面？,"近期，全美多地频繁发生针对特斯拉经销店、特斯拉汽车及充电桩的蓄意破坏事件，一些地区还发生了抵制购买特斯拉汽车的抗议活动。 据CCTV国际时讯3月21日报道，美国东部时间3月20日深夜，美国总统特朗普在其创建的“真实社交”平台上发帖说，“那些破坏特斯拉汽车的人有很大可能会被判入狱长达20年，包括（破坏行动的）资助者。”按美国媒体说法，特斯拉之所以成为打砸、纵火、抗议的对象，是因为马斯克在特朗普政府中扮演重要角色，他操刀联邦政府大裁员，并支持欧洲极右翼政党和政治理念，这在美国和欧洲都引发一些民众的不满。 在回应一个关于“要求加强特斯拉美国和加拿大展厅和服务中心安保”的帖子下面，特斯拉CEO马斯克3月21日发文回应称，特斯拉线下门店已全面提升安保级别，所有车辆均激活""哨兵模式""（Sentry Mode）。 3月20日，马斯克也曾在转发特斯拉帖子的时候表示，“特斯拉哨兵模式可以捕捉任何试图伤害它的人的视频。” 特斯拉频遭纵火焚烧，FBI 启动反恐调查，从政给马斯克和特斯拉带来了什么？新华社分享页",212 万热度,https://www.zhihu.com/question/15513417646,https://picx.zhimg.com/80/v2-510bc61cadba44c02c37809e7dd0bcca_1440w.webp?source=1def8aca,2025-03-21 13:24:19
知乎热榜,2025-03-22 15:09:50,7,400578757,唐僧师徒取经路上能吃到最顶级的斋饭都有什么?,,186 万热度,https://www.zhihu.com/question/400578757,https://picx.zhimg.com/80/v2-c2738f2092cdfd2f8285171e363ee42e_1440w.webp?source=1def8aca,2020-06-10 07:18:45
知乎热榜,2025-03-22 15:09:50,8,1886761141583204886,传奇重量级拳王乔治·福尔曼去世，享年 76 岁，如何评价他的一生？他曾对拳击界产生过多大的影响？,3月22日，据媒体报道，美国重量级拳击传奇人物乔治·福尔曼于当地时间3月21日去世，享年76岁 他曾两次夺得世界重量级拳击冠军 乔治·福尔曼是当之无愧的传奇拳王，他在1968年夏季奥运会重量级比赛中获得金牌，随后于1973年转入职业拳坛，并在第二回合KO了当时不败的乔·弗雷泽，赢得了世界重量级拳王头衔。这场胜利也使他获得了TheRing的重量级拳王头衔。 1974年，福尔曼与穆罕默德·阿里进行了“丛林之战”，当时他在第八回合被意外击倒而输掉比赛，这场比赛堪称史上最著名的拳击赛。 1977年输给吉米杨(JimmyYoung)后，福尔曼首次退役并成为一名牧师。 1987年，38岁的他重返拳坛。 1994年，福尔曼第二次夺得冠军，并完成了不可思议的壮举。当时45岁的他，在点数落后的情况下，打出组合拳将迈克尔·穆勒击倒，45岁零299天的福尔曼再次成为世界重量级拳王，同时也成为拳击史上最年长的重量级冠军。 1997年福尔曼彻底退役，当时他已经48岁。战绩为76胜5负，其中68次KO对手。 2002年，他被《拳台》杂志评选为过去80年来最伟大的25位拳击手之一，《拳台》杂志将他评为有史以来最伟大的拳击手第九名。美国传奇拳王乔治·福尔曼去世,179 万热度,https://www.zhihu.com/question/1886761141583204886,https://picx.zhimg.com/80/v2-6e56906a1fb54ed046f1172097abaa58_1440w.png,2025-03-22 04:48:30
知乎热榜,2025-03-22 15:09:50,9,348571901,按理说机械硬盘和固态硬盘使用得当寿命几乎一样长，但为什么网上传言机械硬盘更容易坏？,,162 万热度,https://www.zhihu.com/question/348571901,https://pic1.zhimg.com/80/v2-73d457952da0c7a746fc7e77a63e796d_1440w.webp?source=1def8aca,2019-09-30 12:41:46
知乎热榜,2025-03-22 15:09:50,10,15454866996,好不容易归化了塞尔吉尼奥，为何国足踢沙特，伊万科维奇一分钟都不让他上?,其实国足输沙特也正常，只是有一点让人想不通，好不容易归化了塞尔吉尼奥，为何国足踢沙特，伊万科维奇一分钟都不让他上，多少给塞尔吉尼奥一个机会呢,152 万热度,https://www.zhihu.com/question/15454866996,https://picx.zhimg.com/80/v2-ab66ec28b0130d17f68942632eb4048a_1440w.webp?source=1def8aca,2025-03-20 20:21:52
