type,datetime,index,id,title,desc,hot,url,img,createtime
知乎热榜,2025-04-02 08:15:51,25,1890155339598492566,金秀贤遭打脸，和未成年金赛纶的约会视频曝光，如何看待事件发展？,3月31日，金秀贤正式召开记者会回应和金赛纶的恋情相关。他坚称和金赛纶只交往了1年，声泪俱下的讲述自己的无奈和遭受的威胁。在现场更是多次痛哭流涕，上演了出道以来最精彩的哭戏。 金秀贤表示公司并未逼死金赛纶，自己之所以不愿承认和金赛纶的恋情，是不想让《眼泪女王》剧组的付出付之东流。至于不接金赛纶电话，则是考虑到分手后要小心翼翼一些。金秀贤全程对金赛纶没有丝毫的愧疚，道歉也只针对粉丝。他甚至还准备起诉金赛纶家属，向对方索赔120亿韩元，可谓心狠至极。 不过中韩网友对金秀贤的回应都不满意，还有眼尖的网友发现金秀贤虽然特意没有刮胡子，但却精心的做了妆发。因为金秀贤是自然卷，不做头发就是卷的。而在这样的情境之下，金秀贤还有心思去打扮自己，再上演这么一出“哭戏”，也被指没有心。 不过爆料方显然没打算惯着他，火速就甩出了金秀贤撒谎的证据。爆料方晒出了一则视频，视频中金秀贤坐在餐桌前吃辣鸡块汤，金赛纶不停问金秀贤好不好吃。虽然金赛纶没有露面，但声音确实是她的。 爆料方还公开了这则视频的元数据，显示是在2018年6月20日晚上11点拍摄的。很显然当时两人就已经在交往了，当时金赛纶在读高二，还是未成年。但金秀贤在记者发布会上却说和金赛纶是2019年才开始交往，很显然是撒谎了。 另外，记者还公开了金秀贤拍的金赛纶睡觉照片。并表示这些只是其中一些小尺度的，为了金赛纶的名誉考虑，记者没有全部公开。 此外，金秀贤2018年凌晨1点，在家里给金赛纶唱情歌的视频也公开了。 可以说记者每次甩出的证据都是雷神之锤，反观金秀贤方的证据却经不起推敲。 金秀贤在记者会上提供的证据也被网友质疑了，他称2016年和金赛纶聊天的人并不是自己，聊天记录是伪造的。金秀贤找权威的鉴定机构鉴定了，语气并不是他的。网友不禁想问：难道同一个人和恋人、朋友、陌生人说话的语气会是一样的吗？打脸了！金秀贤偷拍金赛纶睡觉照曝光，两人深夜约会视频也公开了,73 万热度,https://www.zhihu.com/question/1890155339598492566,https://picx.zhimg.com/80/v2-642c1319eb19bf3ca475486f8dd0a293_1440w.png,2025-03-31 13:35:50
知乎热榜,2025-04-02 08:15:51,26,1890472654609289929,如何评价2025年4月米哈游《原神》伊法立绘？,#原神# #伊法# #蔚风引灵# ▌蔚风引灵 · 伊法 急救如急袭 === 「上次伊法从我这顺了两罐蜜走，我猜又是去给小龙们做饼干吃了。别误会，我不是在抱怨，就是希望他做完能记得给我留点。」 ——欧洛伦 伊法总是从天而降，提着枪俯冲过来，一副声势浩大的样子，导致很多人的第一反应，都是以为来自花羽会的支援部队到了。 然而仔细一瞧，哥们戴着胸卡、背着医疗包，虽然不清楚身边那个圆圆的东西究竟是怎么回事，但整体来讲，像是个医生。 大伙儿想着「哦哦，原来是空投医疗救援！」，一边迎上去，向他说明情况。 伊法倒不是很在意人们的态度，眼睛只盯着需要治疗的龙伙伴。等处理好龙的伤势，再顺便给周围的人解决些小问题。 一来二去，很多人都认得了这位兽医的身影，走在路上碰到，一定会招手打声招呼。 伊法并不记得每一个人的脸，但面对友善的问候时他总是面带笑容：「你也好，哥们！」,72 万热度,https://www.zhihu.com/question/1890472654609289929,https://pic3.zhimg.com/50/v2-35e21a7eccfb9673b32c2d4c78676bc2_b.jpg,2025-04-01 10:36:44
知乎热榜,2025-04-02 08:15:51,27,1888995364901738325,先秦时期《诗经》中有哪些关于游春的记载？,,71 万热度,https://www.zhihu.com/question/1888995364901738325,https://pic1.zhimg.com/80/v2-ef7dd11a6eb77498fee4994f4ae06627_1440w.webp?source=1def8aca,2025-03-28 08:46:30
知乎热榜,2025-04-02 08:15:51,28,307447081,你觉得，数学改变了你的哪些方面？,你觉得，数学改变了你的哪些方面？,69 万热度,https://www.zhihu.com/question/307447081,https://pica.zhimg.com/50/v2-4d4a67bf1a077c57dc03af8fcd4af5ee_b.jpg,2018-12-30 04:49:22
知乎热榜,2025-04-02 08:15:51,29,1890062317879780331,男子花 500 万买到「坟景房」，眼皮子底下几百座坟，最近的仅 30 米，可以找开发商退房索赔吗？,通州区金地北京壹街区多位业主近日向北京日报客户端反映，新房交付在即，却发现期待中环境优美的绿地洋房竟成了“坟景房”。“打开窗户，眼皮子底下就是几百座坟。”最近的住宅楼距离墓地仅约30米。业主顿足惊呼，被开发商的一纸“迁坟公告”忽悠了。记者前往现场了解情况。 现场 住宅楼离墓地仅约30米 “最近快收房了，我满怀期待地来看新家。可一来就傻眼了，窗户下边是一大片墓地。”业主王先生说着，带记者来到小区外的墓地。几百座墓碑高低错落，坟墓之间很紧凑，一些墓前还摆放着祭品。根据碑文，记者注意到，这些墓碑中较新的立于2024年。 墓地北侧一路之隔就是金地壹街区6号地块的住宅区，墓地与居民楼相距仅约30米。“小区现在还在建设收尾，马上就要收房了。”王先生说，期待已久的新家变成了“坟景房”，这让他感觉非常糟心。 据业主介绍，6号地块约有140多户居民，其中有3栋楼超30户居民“开窗见坟”，视野直接受到南侧墓地影响。墓地也在其他楼栋住户的可见范围内，但有一定遮挡。“中间这栋是楼王，买房时我特意选了位置最好的地方，以为对面是一片绿地，没想到等交房时正对着的却成了几百座墓碑。”王先生无奈地说，当时看房时就是看中了这里环境好，“周围规划了很多艺术街区，销售员还组织我们参观了附近的艺术工作室，拜访了一些艺术家，氛围很好。买房看沙盘的时候，沙盘上小区南侧也是绿地。房子原本是买来给老人养老的，现在都不敢跟老人提新房的事。” 记者分别探访了中层和高层住户，透过窗户放眼望去，视线范围内墓碑林立。王先生说，南侧窗户没有任何遮挡，是通风、采光、视野最好的一扇窗，如今不仅风景变成了坟景，安全问题也让他担忧。“这么多墓，难免有人前来祭奠，一旦有明火烧纸可能还会引发火情。” 住宅区距离墓地仅约30米。 遭遇 买房前被承诺“肯定迁走” 据了解，金地北京壹街区由北京金地通达房地产开发有限公司于2021年开工建设，以低密度洋房为特点，目前一期、二期住宅已经完成交付，三期6号地块预计于4月30日交房。 业主黄先生告诉记者，自己是2023年购买的该小区期房，当时房屋仍在建设中，只能看到小区大概的位置。他在考察周围环境时，并未发现小区南侧一路之隔就是坟地。“当时工地周围都做了很高的围挡，根本看不到里面的情况。”他告诉记者，合同中的项目周边不利因素条款中，确实提及了小区东北侧及南侧各有现状陵园一处，可能存在视线影响。“但并没说明具体位置、面积和距离，销售人员也没明确提示过。直到临近交房去了现场，从楼上往下看，我才知道墓地居然距离这么近。” 多位业主对记者表示，对于小区南侧的墓地并不知情，且购房时销售人员从未提及此事。有业主说：“签合同的时候，销售人员一直说合同是有关部门审核过的制式合同，没有问题，也无法更改，而且签合同的时间很短，厚厚的一百多页合同要签名的地方特别多，关于墓地的内容就几句话，在很靠后的位置，也没有加粗或突出标记，都没注意到就被催着签完了。” 也有部分业主说，自己在购房时就已经获知小区南侧有一处墓地，所以特意进行了咨询。“但销售人员信誓旦旦地承诺墓地一定会迁走，我才决定缴纳购房款的。” 业主提供的信息显示，销售人员曾再三承诺交房前墓地一定会迁走，不会对居住品质有任何影响，并且表示和有关部门确认过，已经在联系亲属对坟墓进行认领登记了，且发布了迁坟公告。为让业主放心，还向业主出示了迁坟公告。 业主林女士当时仍不放心，还特意跑到现场去核实，发现墓地前的铁门上果然张贴着这样一张公告，便吃下一颗“定心丸”，最终缴纳了购房款。但两年过去，眼看就要交房了，小区南侧的墓地不仅没有迁走，坟还越来越多。 从屋内向外看，墓碑密密麻麻。 “花500万买坟景房，眼皮子底下就是几百座，太糟心！”_腾讯新闻,68 万热度,https://www.zhihu.com/question/1890062317879780331,https://picx.zhimg.com/50/v2-d5f2b42ae3fcf8033a5750d8ed0a97ab_b.jpg,2025-03-31 07:26:12
知乎热榜,2025-04-02 08:15:51,30,1889027380091261765,存在主义强调个人主义，但如何回应「集体责任」问题？,,65 万热度,https://www.zhihu.com/question/1889027380091261765,https://picx.zhimg.com/80/v2-6cb94693d5ee414400c618a18995ed0b_1440w.png,2025-03-28 10:53:43
知乎热搜,2025-04-02 09:12:47,1,,湖人战胜火箭,,,https://www.zhihu.com/search?q=%E6%B9%96%E4%BA%BA%E6%88%98%E8%83%9C%E7%81%AB%E7%AE%AD,,
知乎热搜,2025-04-02 09:12:47,2,,愚人节,,,https://www.zhihu.com/search?q=%E6%84%9A%E4%BA%BA%E8%8A%82,,
知乎热搜,2025-04-02 09:12:47,3,,多家银行宣布下调存款利率,,,https://www.zhihu.com/search?q=%E5%A4%9A%E5%AE%B6%E9%93%B6%E8%A1%8C%E5%AE%A3%E5%B8%83%E4%B8%8B%E8%B0%83%E5%AD%98%E6%AC%BE%E5%88%A9%E7%8E%87,,
知乎热搜,2025-04-02 09:12:47,4,,你干过最牛的一件事是什么,,,https://www.zhihu.com/search?q=%E4%BD%A0%E5%B9%B2%E8%BF%87%E6%9C%80%E7%89%9B%E7%9A%84%E4%B8%80%E4%BB%B6%E4%BA%8B%E6%98%AF%E4%BB%80%E4%B9%88,,
知乎热搜,2025-04-02 09:12:47,5,,羽毛球,,,https://www.zhihu.com/search?q=%E7%BE%BD%E6%AF%9B%E7%90%83,,
知乎热搜,2025-04-02 09:12:47,6,,工业克苏鲁什么意思,,,https://www.zhihu.com/search?q=%E5%B7%A5%E4%B8%9A%E5%85%8B%E8%8B%8F%E9%B2%81%E4%BB%80%E4%B9%88%E6%84%8F%E6%80%9D,,
知乎热搜,2025-04-02 09:12:47,7,,为什么月薪 2 万的沈琳愿意卖卤肉,,,https://www.zhihu.com/search?q=%E4%B8%BA%E4%BB%80%E4%B9%88%E6%9C%88%E8%96%AA%202%20%E4%B8%87%E7%9A%84%E6%B2%88%E7%90%B3%E6%84%BF%E6%84%8F%E5%8D%96%E5%8D%A4%E8%82%89,,
知乎热搜,2025-04-02 09:12:47,8,,长的漂亮真的很有优势吗,,,https://www.zhihu.com/search?q=%E9%95%BF%E7%9A%84%E6%BC%82%E4%BA%AE%E7%9C%9F%E7%9A%84%E5%BE%88%E6%9C%89%E4%BC%98%E5%8A%BF%E5%90%97,,
知乎热搜,2025-04-02 09:12:47,9,,河北廊坊永清县 4.2 级地震,,,https://www.zhihu.com/search?q=%E6%B2%B3%E5%8C%97%E5%BB%8A%E5%9D%8A%E6%B0%B8%E6%B8%85%E5%8E%BF%204.2%20%E7%BA%A7%E5%9C%B0%E9%9C%87,,
知乎热搜,2025-04-02 09:12:47,10,,中国肥胖率最高的省是河北,,,https://www.zhihu.com/search?q=%E4%B8%AD%E5%9B%BD%E8%82%A5%E8%83%96%E7%8E%87%E6%9C%80%E9%AB%98%E7%9A%84%E7%9C%81%E6%98%AF%E6%B2%B3%E5%8C%97,,
知乎热搜,2025-04-02 09:12:47,11,,义乌购房新政公布,,,https://www.zhihu.com/search?q=%E4%B9%89%E4%B9%8C%E8%B4%AD%E6%88%BF%E6%96%B0%E6%94%BF%E5%85%AC%E5%B8%83,,
知乎热搜,2025-04-02 09:12:47,12,,医生：少吃水果能少生很多病,,,https://www.zhihu.com/search?q=%E5%8C%BB%E7%94%9F%EF%BC%9A%E5%B0%91%E5%90%83%E6%B0%B4%E6%9E%9C%E8%83%BD%E5%B0%91%E7%94%9F%E5%BE%88%E5%A4%9A%E7%97%85,,
知乎热搜,2025-04-02 09:12:47,13,,多家银行消费贷利率阶段性上调,,,https://www.zhihu.com/search?q=%E5%A4%9A%E5%AE%B6%E9%93%B6%E8%A1%8C%E6%B6%88%E8%B4%B9%E8%B4%B7%E5%88%A9%E7%8E%87%E9%98%B6%E6%AE%B5%E6%80%A7%E4%B8%8A%E8%B0%83,,
知乎热搜,2025-04-02 09:12:47,14,,消费贷利率 3% 以下或被叫停,,,https://www.zhihu.com/search?q=%E6%B6%88%E8%B4%B9%E8%B4%B7%E5%88%A9%E7%8E%87%203%25%20%E4%BB%A5%E4%B8%8B%E6%88%96%E8%A2%AB%E5%8F%AB%E5%81%9C,,
知乎热搜,2025-04-02 09:12:47,15,,马斯克：人类首次极地轨道飞行将发射,,,https://www.zhihu.com/search?q=%E9%A9%AC%E6%96%AF%E5%85%8B%EF%BC%9A%E4%BA%BA%E7%B1%BB%E9%A6%96%E6%AC%A1%E6%9E%81%E5%9C%B0%E8%BD%A8%E9%81%93%E9%A3%9E%E8%A1%8C%E5%B0%86%E5%8F%91%E5%B0%84,,
知乎热搜,2025-04-02 09:12:47,16,,无人驾驶航空器运营合格证颁发,,,https://www.zhihu.com/search?q=%E6%97%A0%E4%BA%BA%E9%A9%BE%E9%A9%B6%E8%88%AA%E7%A9%BA%E5%99%A8%E8%BF%90%E8%90%A5%E5%90%88%E6%A0%BC%E8%AF%81%E9%A2%81%E5%8F%91,,
知乎热搜,2025-04-02 09:12:47,17,,中国渔船遇袭三名中国人失踪,,,https://www.zhihu.com/search?q=%E4%B8%AD%E5%9B%BD%E6%B8%94%E8%88%B9%E9%81%87%E8%A2%AD%E4%B8%89%E5%90%8D%E4%B8%AD%E5%9B%BD%E4%BA%BA%E5%A4%B1%E8%B8%AA,,
知乎热搜,2025-04-02 09:12:47,18,,韩国庆尚南道山清郡火灾主火扑灭,,,https://www.zhihu.com/search?q=%E9%9F%A9%E5%9B%BD%E5%BA%86%E5%B0%9A%E5%8D%97%E9%81%93%E5%B1%B1%E6%B8%85%E9%83%A1%E7%81%AB%E7%81%BE%E4%B8%BB%E7%81%AB%E6%89%91%E7%81%AD,,
知乎热搜,2025-04-02 09:12:47,19,,见义勇为荣誉被冒领,,,https://www.zhihu.com/search?q=%E8%A7%81%E4%B9%89%E5%8B%87%E4%B8%BA%E8%8D%A3%E8%AA%89%E8%A2%AB%E5%86%92%E9%A2%86,,
知乎热搜,2025-04-02 09:12:47,20,,中国航空首批民用运营合格证颁发,,,https://www.zhihu.com/search?q=%E4%B8%AD%E5%9B%BD%E8%88%AA%E7%A9%BA%E9%A6%96%E6%89%B9%E6%B0%91%E7%94%A8%E8%BF%90%E8%90%A5%E5%90%88%E6%A0%BC%E8%AF%81%E9%A2%81%E5%8F%91,,
知乎热搜,2025-04-02 09:12:47,21,,中国低空飞行载人时代开启,,,https://www.zhihu.com/search?q=%E4%B8%AD%E5%9B%BD%E4%BD%8E%E7%A9%BA%E9%A3%9E%E8%A1%8C%E8%BD%BD%E4%BA%BA%E6%97%B6%E4%BB%A3%E5%BC%80%E5%90%AF,,
知乎热搜,2025-04-02 09:12:47,22,,NBA爆发大规模冲突,,,https://www.zhihu.com/search?q=NBA%E7%88%86%E5%8F%91%E5%A4%A7%E8%A7%84%E6%A8%A1%E5%86%B2%E7%AA%81,,
知乎热搜,2025-04-02 09:12:47,23,,「甲亢哥」中国行直播,,,https://www.zhihu.com/search?q=%E3%80%8C%E7%94%B2%E4%BA%A2%E5%93%A5%E3%80%8D%E4%B8%AD%E5%9B%BD%E8%A1%8C%E7%9B%B4%E6%92%AD,,
知乎热搜,2025-04-02 09:12:47,24,,甲亢哥中国行,,,https://www.zhihu.com/search?q=%E7%94%B2%E4%BA%A2%E5%93%A5%E4%B8%AD%E5%9B%BD%E8%A1%8C,,
知乎热搜,2025-04-02 09:12:47,25,,距深圳市约170公里发现1亿吨油田,,,https://www.zhihu.com/search?q=%E8%B7%9D%E6%B7%B1%E5%9C%B3%E5%B8%82%E7%BA%A6170%E5%85%AC%E9%87%8C%E5%8F%91%E7%8E%B01%E4%BA%BF%E5%90%A8%E6%B2%B9%E7%94%B0,,
知乎热搜,2025-04-02 09:12:47,26,,南京全面取消商品房限售,,,https://www.zhihu.com/search?q=%E5%8D%97%E4%BA%AC%E5%85%A8%E9%9D%A2%E5%8F%96%E6%B6%88%E5%95%86%E5%93%81%E6%88%BF%E9%99%90%E5%94%AE,,
知乎热搜,2025-04-02 09:12:47,27,,非法捕捞水中软黄金鳗苗 4 人当场被抓,,,https://www.zhihu.com/search?q=%E9%9D%9E%E6%B3%95%E6%8D%95%E6%8D%9E%E6%B0%B4%E4%B8%AD%E8%BD%AF%E9%BB%84%E9%87%91%E9%B3%97%E8%8B%97%204%20%E4%BA%BA%E5%BD%93%E5%9C%BA%E8%A2%AB%E6%8A%93,,
知乎热榜,2025-04-02 09:12:47,1,1890675416567641364,东部战区位台湾海峡中、南海域组织「海峡雷霆-2025A」演练，由联合利剑变为海峡雷霆，意味着什么？,东部战区新闻发言人施毅陆军大校表示，4月2日，中国人民解放军东部战区位台湾海峡中部、南部相关海域组织“海峡雷霆-2025A”演练，重点实施查证识别、警告驱离、拦截扣押等科目，检验部队区域管控、联合封控、精打击要能力。更多资讯请下载央视新闻客户端,4460 万热度,https://www.zhihu.com/question/1890675416567641364,https://pic1.zhimg.com/80/v2-a3f365ddc1e2a416306a0eb7f6549d79_1440w.png,2025-04-02 00:02:26
知乎热榜,2025-04-02 09:12:47,2,1890395295365427794,新能源汽车发生车祸后似乎比油车更容易起火，是这样吗？,,608 万热度,https://www.zhihu.com/question/1890395295365427794,https://picx.zhimg.com/80/v2-9f42abca17101b2f2ee66e142707f96d_1440w.webp?source=1def8aca,2025-04-01 05:29:20
知乎热榜,2025-04-02 09:12:47,3,1890152838069445220,领导在一次会议上严厉批评了你，而实际上错误是由另一位同事小王造成的，你怎么办?,「瞎扯办公室」征稿中，邀请你用「瞎扯」调戏一下生活，优秀回答有机会入选知乎日报《瞎扯》栏目哦～ 我简单扯两句」有奖活动主链接：www.zhihu.com/parker/campaign/188864385232954185,499 万热度,https://www.zhihu.com/question/1890152838069445220,https://picx.zhimg.com/80/v2-6135f88b50f7bb6e26a4949c3b4c25a5_1440w.png,2025-03-31 13:25:53
知乎热榜,2025-04-02 09:12:47,4,1890105053098009745,「甲亢哥」来华直播登上多国社媒榜单热门，为什么这种「体验」形成的反差能让外国人这么惊讶？,,338 万热度,https://www.zhihu.com/question/1890105053098009745,https://picx.zhimg.com/80/v2-b8c028c74521ddefa627d33f84eb9550_1440w.webp?source=1def8aca,2025-03-31 10:16:01
知乎热榜,2025-04-02 09:12:47,5,284130542,电影《我不是药神》里的格列卫，从药企的角度看，卖25000一瓶的价格是否高了？,今天看到一篇微信文章，说贵有贵的道理，药企也没错。 那么25000一瓶的格列卫，从药企角度看真的不高吗？ 格列卫的研发过程中，没有因为格列卫的研发技术而产生其他的药品吗？比如说航天技术的研发，可以顺带提高导弹技术等其他方面。 望解惑,288 万热度,https://www.zhihu.com/question/284130542,https://picx.zhimg.com/50/v2-ff8ffe6a43b4a9f694e70d863a8355d9_b.jpg,2018-07-06 07:20:08
知乎热榜,2025-04-02 09:12:47,6,1890552979020537873,SU7事故引发对智能辅助驾驶及 AEB 安全功能的质疑，会对智驾产生哪些影响？车主还会信任这些功能吗？,就在“智能驾驶向自动驾驶进阶”成为行业共识时，小米SU7的事故猛地敲响了现实的警钟——技术愿景与落地使用之间的鸿沟清晰可见。 3月29日22时44分，一辆小米SU7标准版在德上高速公路池祁段行驶过程中遭遇严重交通事故。车上三人身亡。 智驾安全性遭质疑 是驾驶人太轻信智驾系统，没有尽到关注义务，还是智驾系统不可靠，对障碍物识别太迟？互联网上，智能辅助驾驶到底安不安全，引起了广泛的争论。 本次事故中身亡的罗某，其母亲在接受媒体采访时表示，她曾告诫女儿，现在技术不完善，不能盲目相信，自己开才放心，“她还反驳我，说有各种（证明安全）的依据”。 近年，随着智能辅助驾驶系统装上新能源汽车，网络和论坛上关于智能辅助系统安全性的数据证明和言论有很多，如“智能驾驶的事故率是人工驾驶的1/10以内”，“随着智能驾驶能力的提高，并且越来越多的智能驾驶升级到完全自动驾驶，这个数字可以做到百分之一到千分之一之间。”然而，在惨痛现实面前，理论安全与实际安全再次展开辩论。 “我觉得技术始终是要发展进步的，我们在要做的事情，就是让它更加合规科学，更符合用户的行为习惯。”上述智驾公司人士表示。事故前2秒提示障碍物！小米SU7碰撞爆燃，智能辅助驾驶可靠吗？,169 万热度,https://www.zhihu.com/question/1890552979020537873,https://pic1.zhimg.com/80/v2-9ea7925beebec4f6ed865ac264d46509_1440w.jpg,2025-04-01 15:55:54
知乎热榜,2025-04-02 09:12:47,7,1890428133892671408,我们真的需要「零百加速三四秒」的平民跑车吗？掌控得了吗？,市面上大家开的车零百加速大都十秒开外，中高级车一般在8秒上下，基本8秒涵盖了90%以上的车。几百万的跑车零百四五秒，因为买车门槛太高存量不多。（前面说的是油车） 但当电车，混动随随便便就能去到四五秒，三四秒时，买车门槛已降低至几十万，购车年龄会一降再降，当一个个喜欢拥抱高科技的新手司机，操控着这么一部暴力机器，你认为他会悠悠的开吗？安全吗？能掌控得了吗？,153 万热度,https://www.zhihu.com/question/1890428133892671408,https://pic1.zhimg.com/80/v2-241dca86cc1c7e119d8b034a6a25df91_1440w.webp?source=1def8aca,2025-04-01 07:39:49
知乎热榜,2025-04-02 09:12:47,8,1890054557519816321,黄霄雲翻唱华晨宇作品被质疑偷歌，具体情况如何？华晨宇方最新回应称拒绝音乐版权擦边，黄霄雲是否侵权？,4月2日，针对黄霄云翻唱《烟火里的尘埃》的版权争议，@华晨宇工作室发文称经过昨日一天的主动沟通，双方未能达成有效共识。华晨宇方表示避重就轻不是解决问题的方式，同时拒绝音乐版权擦边行为。4月2日，@华晨宇工作室 发文回应近期与歌手黄霄云的版权争议。 华晨宇方表示：经过昨日一天的主动沟通，很遗憾双方未能达成有效共识。我方坚持立场：避重就轻不是解决问题的方式，同时拒绝音乐版权擦边行为。我们一直秉持开放的心态欢迎优秀音乐人交流共进，但与此同时希望音乐作品能够多一些纯粹原创，少一些模糊“借鉴”。尊重音乐创作者的作品创意是原创音乐人的基本职业道德素养，每一份饱含心血的成果都应该被认可和保护。 华晨宇方回应“黄霄云翻唱版权争议”：未能达成共识，拒绝音乐版权擦边 3月31日，黄霄雲工作室账号发布声明并配文：“近日，我方发现部分网络用户就黄霄雲女士翻唱华晨宇先生(原唱)歌曲《烟火里的尘埃》一事，通过自媒体平台散布及大肆传播不实言论，恶意诋毁黄霄雲女士声誉的行为，已严重侵害黄霄雲女士的个人名誉及正面社会形象。” 华晨宇方回应 4月1日，@华晨宇全球歌迷会官博 发布声明：“某艺人拥有的是《烟火里的尘埃》使用版权，而非《孩子》live版的使用版权，也并未向华晨宇方沟通借鉴和声改编一事，其使用范围应仅限于《烟火里的尘埃》歌曲本身，若要进行改编也是在原创的基础上自行创作或购买使用版权，而非直接裁剪他人创作内容。” 随后，@华晨宇全球歌迷会官博 再次发文：“翻唱作为一种再创作形式，本应是对原作的致敬与新解，但若直接引用原作而未明确标注或取得授权，恐有模糊原创与演绎界限之嫌。此举虽可能出于对原作的喜爱，却也是对原创者心血价值的侵害，希望音乐人在无论是翻唱、改编抑或二次创作中都应有清晰的授权声明。这是音乐生态良性发展的基石，愿所有热爱不被辜负，愿每一份创作皆被尊重。” 4月2日，@华晨宇工作室 发文：“经过昨日一天的主动沟通，很遗憾双方未能达成有效共识。我方坚持立场：避重就轻不是解决问题的方式，同时拒绝音乐版权擦边行为。” 黄霄雲翻唱华晨宇作品被质疑偷歌，双方都回应了！,150 万热度,https://www.zhihu.com/question/1890054557519816321,https://picx.zhimg.com/80/v2-0be3980a67a19bc039005f226dd7725e_1440w.png,2025-03-31 06:55:22
知乎热榜,2025-04-02 09:12:47,9,1888651011868062054,海昏侯墓中出土大量儒家典籍，暗示他可能具备深厚的儒学修养，史书称其「荒淫无道」是否被刻意夸大？,,146 万热度,https://www.zhihu.com/question/1888651011868062054,https://pic1.zhimg.com/80/v2-ca4f664b161dc0f52e37aaf6d1279a82_1440w.webp?source=1def8aca,2025-03-27 09:58:10
知乎热榜,2025-04-02 09:12:47,10,1888549513762922527,南方航空 2024 年净亏 16.96 亿元，连续 5 年亏损，如此难盈利的民航，商业模有哪些缺点？,人民财讯3月26日电，南方航空(600029)3月26日晚间发布2024年年度报告，2024年实现营业收入1742.24亿元，同比增长8.94%；归属于上市公司股东的净亏损为16.96亿元，上年同期净亏损42.09亿元。报告期内，集团运输总周转量为36208百万吨公里，比上年同期上升21.54%；旅客运输量164.73百万人次，比上年同期上升15.84%；客座率为84.38%，比上年同期上升6.28百分点；集团旅客运输收入为1464.5亿元，占集团主营业务收入的比例为86.96%。 南方航空：2024年净利润亏损16.96亿元 同比减亏近六成,139 万热度,https://www.zhihu.com/question/1888549513762922527,https://picx.zhimg.com/80/v2-422711c3208f29c0149936d95de594ca_1440w.webp?source=1def8aca,2025-03-27 03:14:51
知乎热榜,2025-04-02 09:12:47,11,1890707894518936402,24-25 赛季 NBA 常规赛森林狼胜掘金，约基奇 61+大三双 ，威少致命失误，如何评价本场比赛？,改字,131 万热度,https://www.zhihu.com/question/1890707894518936402,https://pic1.zhimg.com/80/v2-dd3455d6d4dc5de8cbdfc747ca91667c_1440w.webp?source=1def8aca,2025-04-02 02:11:29
知乎热榜,2025-04-02 09:12:47,12,1889767394043487419,如何评价教 Speed 甲亢哥功夫的嵩山梁师傅，这位梁小龙师傅什么来头？为何能被全球圈粉？,[图片],127 万热度,https://www.zhihu.com/question/1889767394043487419,https://picx.zhimg.com/80/v2-bb9d33d3f63d286887aad25dd7acd3f6_1440w.webp?source=1def8aca,2025-03-30 11:54:16
