type,datetime,index,id,title,desc,hot,url,img,createtime
知乎热搜,2025-03-24 09:13:18,2,,有哪些故意缩短产品寿命的设计,,,https://www.zhihu.com/search?q=%E6%9C%89%E5%93%AA%E4%BA%9B%E6%95%85%E6%84%8F%E7%BC%A9%E7%9F%AD%E4%BA%A7%E5%93%81%E5%AF%BF%E5%91%BD%E7%9A%84%E8%AE%BE%E8%AE%A1,,
知乎热搜,2025-03-24 09:13:18,3,,你见过最令你震撼的一张图片是什么,,,https://www.zhihu.com/search?q=%E4%BD%A0%E8%A7%81%E8%BF%87%E6%9C%80%E4%BB%A4%E4%BD%A0%E9%9C%87%E6%92%BC%E7%9A%84%E4%B8%80%E5%BC%A0%E5%9B%BE%E7%89%87%E6%98%AF%E4%BB%80%E4%B9%88,,
知乎热搜,2025-03-24 09:13:18,4,,如何看待美国识字率只有 79％,,,https://www.zhihu.com/search?q=%E5%A6%82%E4%BD%95%E7%9C%8B%E5%BE%85%E7%BE%8E%E5%9B%BD%E8%AF%86%E5%AD%97%E7%8E%87%E5%8F%AA%E6%9C%89%2079%EF%BC%85,,
知乎热搜,2025-03-24 09:13:18,5,,俄军称在库尔斯克州转入全线大规模进攻,,,https://www.zhihu.com/search?q=%E4%BF%84%E5%86%9B%E7%A7%B0%E5%9C%A8%E5%BA%93%E5%B0%94%E6%96%AF%E5%85%8B%E5%B7%9E%E8%BD%AC%E5%85%A5%E5%85%A8%E7%BA%BF%E5%A4%A7%E8%A7%84%E6%A8%A1%E8%BF%9B%E6%94%BB,,
知乎热搜,2025-03-24 09:13:18,6,,拜仁联赛主场37次对阵波鸿,,,https://www.zhihu.com/search?q=%E6%8B%9C%E4%BB%81%E8%81%94%E8%B5%9B%E4%B8%BB%E5%9C%BA37%E6%AC%A1%E5%AF%B9%E9%98%B5%E6%B3%A2%E9%B8%BF,,
知乎热搜,2025-03-24 09:13:18,7,,养老服务向全体老年人拓展,,,https://www.zhihu.com/search?q=%E5%85%BB%E8%80%81%E6%9C%8D%E5%8A%A1%E5%90%91%E5%85%A8%E4%BD%93%E8%80%81%E5%B9%B4%E4%BA%BA%E6%8B%93%E5%B1%95,,
知乎热搜,2025-03-24 09:13:18,8,,哈马斯称应立即开启停火协议第二阶段谈判,,,https://www.zhihu.com/search?q=%E5%93%88%E9%A9%AC%E6%96%AF%E7%A7%B0%E5%BA%94%E7%AB%8B%E5%8D%B3%E5%BC%80%E5%90%AF%E5%81%9C%E7%81%AB%E5%8D%8F%E8%AE%AE%E7%AC%AC%E4%BA%8C%E9%98%B6%E6%AE%B5%E8%B0%88%E5%88%A4,,
知乎热搜,2025-03-24 09:13:18,9,,「人造太阳」关键系统通过验收,,,https://www.zhihu.com/search?q=%E3%80%8C%E4%BA%BA%E9%80%A0%E5%A4%AA%E9%98%B3%E3%80%8D%E5%85%B3%E9%94%AE%E7%B3%BB%E7%BB%9F%E9%80%9A%E8%BF%87%E9%AA%8C%E6%94%B6,,
知乎热搜,2025-03-24 09:13:18,10,,下一代「人造太阳」关键系统通过验收,,,https://www.zhihu.com/search?q=%E4%B8%8B%E4%B8%80%E4%BB%A3%E3%80%8C%E4%BA%BA%E9%80%A0%E5%A4%AA%E9%98%B3%E3%80%8D%E5%85%B3%E9%94%AE%E7%B3%BB%E7%BB%9F%E9%80%9A%E8%BF%87%E9%AA%8C%E6%94%B6,,
知乎热搜,2025-03-24 09:13:18,11,,库里正式达成25000分里程碑,,,https://www.zhihu.com/search?q=%E5%BA%93%E9%87%8C%E6%AD%A3%E5%BC%8F%E8%BE%BE%E6%88%9025000%E5%88%86%E9%87%8C%E7%A8%8B%E7%A2%91,,
知乎热搜,2025-03-24 09:13:18,12,,国际乒联公布徐克与女运动员聊天记录,,,https://www.zhihu.com/search?q=%E5%9B%BD%E9%99%85%E4%B9%92%E8%81%94%E5%85%AC%E5%B8%83%E5%BE%90%E5%85%8B%E4%B8%8E%E5%A5%B3%E8%BF%90%E5%8A%A8%E5%91%98%E8%81%8A%E5%A4%A9%E8%AE%B0%E5%BD%95,,
知乎热搜,2025-03-24 09:13:18,13,,我国成功发射通信技术试验卫星十五号,,,https://www.zhihu.com/search?q=%E6%88%91%E5%9B%BD%E6%88%90%E5%8A%9F%E5%8F%91%E5%B0%84%E9%80%9A%E4%BF%A1%E6%8A%80%E6%9C%AF%E8%AF%95%E9%AA%8C%E5%8D%AB%E6%98%9F%E5%8D%81%E4%BA%94%E5%8F%B7,,
知乎热搜,2025-03-24 09:13:18,14,,零跑B10预售,,,https://www.zhihu.com/search?q=%E9%9B%B6%E8%B7%91B10%E9%A2%84%E5%94%AE,,
知乎热搜,2025-03-24 09:13:18,15,,合肥成为我国第 18 座千万人口之城,,,https://www.zhihu.com/search?q=%E5%90%88%E8%82%A5%E6%88%90%E4%B8%BA%E6%88%91%E5%9B%BD%E7%AC%AC%2018%20%E5%BA%A7%E5%8D%83%E4%B8%87%E4%BA%BA%E5%8F%A3%E4%B9%8B%E5%9F%8E,,
知乎热搜,2025-03-24 09:13:18,16,,安徽人口数出炉,,,https://www.zhihu.com/search?q=%E5%AE%89%E5%BE%BD%E4%BA%BA%E5%8F%A3%E6%95%B0%E5%87%BA%E7%82%89,,
知乎热搜,2025-03-24 09:13:18,17,,哪咤2票房破149亿,,,https://www.zhihu.com/search?q=%E5%93%AA%E5%92%A42%E7%A5%A8%E6%88%BF%E7%A0%B4149%E4%BA%BF,,
知乎热搜,2025-03-24 09:13:18,18,,马斯克发现美政府数千亿美元虚假合同,,,https://www.zhihu.com/search?q=%E9%A9%AC%E6%96%AF%E5%85%8B%E5%8F%91%E7%8E%B0%E7%BE%8E%E6%94%BF%E5%BA%9C%E6%95%B0%E5%8D%83%E4%BA%BF%E7%BE%8E%E5%85%83%E8%99%9A%E5%81%87%E5%90%88%E5%90%8C,,
知乎热搜,2025-03-24 09:13:18,19,,伊朗称废除核计划谈判不会发生,,,https://www.zhihu.com/search?q=%E4%BC%8A%E6%9C%97%E7%A7%B0%E5%BA%9F%E9%99%A4%E6%A0%B8%E8%AE%A1%E5%88%92%E8%B0%88%E5%88%A4%E4%B8%8D%E4%BC%9A%E5%8F%91%E7%94%9F,,
知乎热搜,2025-03-24 09:13:18,20,,富埃戈火山喷发,,,https://www.zhihu.com/search?q=%E5%AF%8C%E5%9F%83%E6%88%88%E7%81%AB%E5%B1%B1%E5%96%B7%E5%8F%91,,
知乎热搜,2025-03-24 09:13:18,21,,乒乓球女乒蒯曼晋级,,,https://www.zhihu.com/search?q=%E4%B9%92%E4%B9%93%E7%90%83%E5%A5%B3%E4%B9%92%E8%92%AF%E6%9B%BC%E6%99%8B%E7%BA%A7,,
知乎热搜,2025-03-24 09:13:18,22,,哪咤2登陆英国,,,https://www.zhihu.com/search?q=%E5%93%AA%E5%92%A42%E7%99%BB%E9%99%86%E8%8B%B1%E5%9B%BD,,
知乎热搜,2025-03-24 09:13:18,23,,新能源汽车产销及出口增长均超50%,,,https://www.zhihu.com/search?q=%E6%96%B0%E8%83%BD%E6%BA%90%E6%B1%BD%E8%BD%A6%E4%BA%A7%E9%94%80%E5%8F%8A%E5%87%BA%E5%8F%A3%E5%A2%9E%E9%95%BF%E5%9D%87%E8%B6%8550%25,,
知乎热搜,2025-03-24 09:13:18,24,,文旅业人财两旺,,,https://www.zhihu.com/search?q=%E6%96%87%E6%97%85%E4%B8%9A%E4%BA%BA%E8%B4%A2%E4%B8%A4%E6%97%BA,,
知乎热搜,2025-03-24 09:13:18,25,,上海博物馆海外分馆将落户美国,,,https://www.zhihu.com/search?q=%E4%B8%8A%E6%B5%B7%E5%8D%9A%E7%89%A9%E9%A6%86%E6%B5%B7%E5%A4%96%E5%88%86%E9%A6%86%E5%B0%86%E8%90%BD%E6%88%B7%E7%BE%8E%E5%9B%BD,,
知乎热榜,2025-03-24 09:13:18,1,15446816958,为什么经过315曝光华莱士几乎没影响杨铭宇黄焖鸡遭到集体抵制?,,1347 万热度,https://www.zhihu.com/question/15446816958,https://picx.zhimg.com/v2-59f34e86a087dc2c57f4099c8273790d_1440w.jpg,2025-03-20 14:42:41
知乎热榜,2025-03-24 09:13:18,2,15485397123,子午工程二期通过国家验收，这个工程是做什么的？有多厉害？未来将在哪些领域发挥作用？,今天（21日），面向空间天气研究的国家重大科技基础设施——子午工程二期通过国家验收，与子午工程一期组成了世界最大的空间环境地基综合监测网，这是我国建成的国际首个覆盖日地空间全圈层（太阳风-磁层-电离层-中高层大气）的综合性空间环境地基监测设施，标志着我国空间环境地基监测能力跃居世界领先地位。国家重大科技基础设施子午工程二期通过国家验收 --新闻报道-中国共产党新闻网,1116 万热度,https://www.zhihu.com/question/15485397123,https://picx.zhimg.com/80/v2-5f04167efb2f90a37a580213087afe8f_1440w.png,2025-03-21 07:38:38
知乎热榜,2025-03-24 09:13:18,3,15627778194,吴艳妮 8.01 秒打破女子60米栏全国纪录，怎样评价她的表现？,3月23日，在南京世界田联室内锦标赛女子60米栏半决赛中，中国运动员吴艳妮以8秒01的成绩再次刷新个人最好成绩，并打破尘封11年的全国纪录。 赛后，激动的吴艳妮在向全场观众致谢后，泪洒赛场。 但吴艳妮的成绩不如第二小组的第3、第4名，没能拿到决赛门票。虽然吴艳妮遗憾无缘决赛，但再次隔空击败只跑出8秒03的日本名将田中佑美。 刚刚，8.01秒！吴艳妮打破女子60米栏全国纪录！-上游新闻 汇聚向上的力量,958 万热度,https://www.zhihu.com/question/15627778194,https://pic1.zhimg.com/80/v2-7cb1a70a444aa2772de3ef6c239f9a63_1440w.webp?source=1def8aca,2025-03-23 13:20:16
知乎热榜,2025-03-24 09:13:18,4,15578148896,石破茂与王毅会面时，背后挂着「解衣」二字，你认出来了吗？有哪些寓意？,3月21日，中共中央政治局委员、外交部长王毅在东京出席日本首相石破茂集体会见中日韩三国外长时，座位后方的墙壁上挂着一副书法作品。这幅书法作品上写的到底是什么汉字？又是什么意思呢？石破茂与王毅会面时 背后的两个汉字你会读吗？,529 万热度,https://www.zhihu.com/question/15578148896,https://pic1.zhimg.com/v2-3d9b4a5d020ad10c6d0d7987e441dbac_1440w.png,2025-03-22 14:18:12
知乎热榜,2025-03-24 09:13:18,5,15619242556,曝奔驰裁员 3 万人，斥巨资鼓励自愿离职，最高获赔 400 万元，怎样看这一做法？奔驰遇到了哪些问题？,"近日，据德国《Handelsblatt》报道，梅赛德斯管理层将在 4 月给所有员工发信，鼓励员工自愿离职。 据报道，奔驰管理层将在 4 月给所有员工发信，提供非常丰厚的遣散费，以鼓励员工自愿离职。对于月薪近 8 万人民币且在公司工作至少 30 年的中层经理来说，遣散费超过 400 万人民币；而对于一名 30 多岁、月薪约 4.8 万人民币的工厂工人，遣散费也略高于 80 万人民币。 奔驰首席执行官奥拉・卡列尼乌斯（Ola K ä llenius）希望这份优厚的离职补偿能够鼓励约 3 万名员工自愿离职。 相关细节已经与企业职工委员会达成了一致，埃尔贡・吕马利表示："" 如果你不想离职，那也不必离开。但如果你选择离职，就会得到一笔丰厚的补偿。"" 这种看似 "" 慷慨 "" 的做法，实际上是奔驰在困境中做出的艰难抉择。 在汽车行业加速向电动化、智能化转型的浪潮中，传统汽车巨头们面临着前所未有的挑战。 一方面在中国这个庞大的市场，奔驰汽车的销量正急剧下滑。中国电动汽车品牌凭借其在电池技术、智能驾驶等领域的优势，以及更具竞争力的价格，逐渐抢占了奔驰等传统豪华品牌的市场份额。 据相关数据显示，奔驰 2024 年其全年销量为 68.36 万辆，同比下滑 7.3%，中国成为奔驰全球降幅最大的单一市场。在新能源领域，奔驰的纯电动汽车销量仅为 18.51 万辆，同比大跌 23.1%。尽管部分核心豪华产品如长轴距 GLC SUV 和长轴距 C 级车仍保持增长，但整体下滑趋势依然明显。 另外奔驰希望通过优化员工结构，能够更加灵活地应对市场变化，加快向电动化、智能化转型的步伐。https://baijiahao.baidu.com/s?id=1827369396253978250&wfr=spider&for=pc",520 万热度,https://www.zhihu.com/question/15619242556,https://pic1.zhimg.com/80/v2-5de3316698c67f71cddcb73dc645beed_1440w.webp?source=1def8aca,2025-03-23 11:03:05
知乎热榜,2025-03-24 09:13:18,6,15470790067,江西一县称因人口出生率下降，教师规模产生剩余，拟研究转岗分流政策，如何看待这一现象？,近日，江西省万年县政府办在“问政江西”平台答复网友关于今年是否招聘英语教师的问题时，披露了该县因人口出生率下降，科学测算出学生规模将逐年缩减、教师规模产生剩余。 万年县政府办根据县教体局调查情况回复称，“2025年万年县不会招聘英语老师，我县政府十分重视教育工作，2017年前后，政府连续出台保障措施，招聘教师以满足教育教学的需要。但近年来人口出生率严重下降（出生人口从2008年的7934人到2024年的2478人），经科学测算，截至今年，学生人数将会以年平均4000多人的规模递减，按照师生比测算，教师也要以230多名的规模产生剩余，且主要是语数英教师。” 万年县政府办表示，“为妥善应对，有效利用师资资源，我县正在未雨绸缪，科学谋划，拟着手研究制定教师转岗分流、调节教师结构性均衡方面的相关政策，对有富余的相关专业教师短期内不再考虑招聘。” 而在去年，根据万年县“五型”办消息披露，万年县根据上级教师招聘工作的要求，结合本县教育发展的实际需求，决定通过全省统一招聘的方式，补充高中教师15人。此外，为加强万年县教育人才队伍建设，提高教育教学质量，计划面向硕士及以上学位研究生引进高层次教育人才10人。 资料来源万年县：测算将年均剩余超230名教师，拟研究转岗分流政策_招聘_教育_县政府办,422 万热度,https://www.zhihu.com/question/15470790067,https://pica.zhimg.com/80/v2-00082485d80322f8372ecd61d3e84dd7_1440w.webp?source=1def8aca,2025-03-21 04:14:10
知乎热榜,2025-03-24 09:13:18,7,14863879786,迪士尼被曝对瑞秋·齐格勒主演的新《白雪公主》毫无信心，称其是2.7亿美元的灾难，这部电影质量究竟如何？,据外媒报道，内部人士透露，迪士尼对由瑞秋·齐格勒（Rachel Zegler）和盖尔·加朵（Gal Gadot）主演的新版白雪公主“毫无信心” ，并认为新版这是一个“2.7亿美元的灾难”。 此前有消息称，由于《白雪公主》的主题和主演人选遭到强烈反对，该片好莱坞首映将“缩减规模”。 《综艺》杂志透露，迪士尼不会像其他类似项目那样给予这部电影同样的红毯待遇。 资料来源新白雪公主曝光！迪士尼内部人士：这是一个“2.7亿美元的灾难”_盖尔·加_Gadot_Zegler,286 万热度,https://www.zhihu.com/question/14863879786,https://pic1.zhimg.com/80/v2-e65a9b9a89566187a081bedde33db7db_1440w.webp?source=1def8aca,2025-03-13 08:56:07
知乎热榜,2025-03-24 09:13:18,8,1886724020151485837,美国很多地方废弃，为啥很多人宁可在街上流浪，也没有人去开荒种地呢？,,240 万热度,https://www.zhihu.com/question/1886724020151485837,https://pic1.zhimg.com/80/v2-502cd04bcd19d782220129c665e4727c_1440w.webp?source=1def8aca,2025-03-22 02:21:00
知乎热榜,2025-03-24 09:13:18,9,3257311792,为什么有的动物用舌头喝水而不用嘴直接喝？,是它们用嘴喝不了，还是因为什么？ 比如最常见的狗，就是用舌头把水卷起来喝，还有大象用鼻子喝，等等。 大象肯定是用嘴也能喝，只不过鼻子方便。那其它的动物呢？ （图片我养的守宫伸舌头舔水） ——— 11.23补充一下，看了大家的回答，好像有个很重要的点被忽视了。就是，动物用舌头卷水还是直接喝，和能不能形成负压吸上来，其实并不对立。比如可以把嘴当成一个 碗，低头，让水进到嘴里，然后咽下就行，而不是非要吸上去。此外，我也想过是不是狗的吻比较长，导致用嘴喝水容易呛鼻子，但是短吻的动物一样也有不用嘴直接盛水喝的。大象 可以用鼻子喝水是因为体内有一层结构可以把气管隔开不会呛水，应该把这个特例单算。,230 万热度,https://www.zhihu.com/question/3257311792,https://pic1.zhimg.com/80/v2-4cb1b3b65ed48a57b11bad5eb865fda4_1440w.gif,2024-11-05 14:18:29
知乎热榜,2025-03-24 09:13:18,10,15539424051,二手平台发霉橘子标价 500 元，这是玩梗还是真有科研价值？霉变的橘子有哪些危害？,近日，某二手物品交易平台上涌现大量“霉变橘子”交易帖，更有信息称“发霉的橘子在网上竟卖出了天价”。 有媒体报道，山东一女子在家中发现了新商机，那就是完全发霉变绿的橘子，单单一个发毛的橘子在网上就能卖到500元的价格，真是长见识了！ 当事人表示，本来想扔掉了，结果在软件上一看，发现卖的人还挺多，最后把这个橘子出掉了。 “发霉橘子”突然爆火卖出天价，网友称“我直接扔了”，专家紧急提醒_腾讯新闻,214 万热度,https://www.zhihu.com/question/15539424051,https://pic1.zhimg.com/80/v2-e513c26fb5e2b120546b89c4ef1a1070_1440w.webp?source=1def8aca,2025-03-22 03:32:50
知乎热榜,2025-03-24 09:13:18,11,15628277578,台湾「大罢免」全面升温，国民党将在全台陆续举办政策说明会反制大罢免，会带来哪些影响？,据台媒报道，民进党发起的“大罢免”活动全面升温。国民党将在全台陆续举办政策说明会，反制大罢免。[中国新闻]台湾“大罢免”全面升温,199 万热度,https://www.zhihu.com/question/15628277578,https://pic1.zhimg.com/80/v2-ff81731581e57056ffeb3623ddb49454_1440w.png,2025-03-23 13:28:45
知乎热榜,2025-03-24 09:13:18,12,14159370972,人类明明是顶级杂食动物，胃酸接近食腐动物，为什么连生肉都不敢吃？,,185 万热度,https://www.zhihu.com/question/14159370972,https://picx.zhimg.com/80/v2-1792bf309cb59e6396a3d6eafbffe3fb_1440w.webp?source=1def8aca,2025-03-05 12:41:52
知乎热榜,2025-03-24 09:13:18,13,15629139415,C 罗称「我只想葡萄牙赢，若我不上场能赢我会马上同意」，如何评价他的观点？,直播吧03月23日讯 葡萄牙vs丹麦的次回合对决即将打响，赛前，C罗被问到了球队应该拿出怎样不同的表现，来扭转首回合的失利。 C罗：“我们必须踢得更好，我们已经踢过很多比赛，明天我们会尽力做到最好。我不相信有任何人会不想拿出好的表现。有时候只是事情行不通，任何踢过球的人都明白我在说什么。” “明天如果我进球，那很好，如果是其他球员，对我来说也一样。如果葡萄牙要赢球，需要我不上场，那我会马上同意。”“即使我不在球队里，我也会继续这么说，我至死都会捍卫这件球衣。如果我不进球而球队能赢，我会开心地回家。这就是我们的生活，我期待明天，因为我知道我们会拿出好的表现。”C罗：我只想葡萄牙赢，若我不上场能赢我会马上同意-直播吧手机版,157 万热度,https://www.zhihu.com/question/15629139415,https://pic1.zhimg.com/50/v2-6510b0968619c52bd087fe88e2287fba_b.jpg,2025-03-23 13:41:37
知乎热榜,2025-03-24 09:13:18,14,15579727999,美国官宣的六代机 F-47 到底有没有鸭翼？,网上关于美国六代机的图片满天飞，但是几乎不重样，到底是什么构型？ 讲武谈兵｜美官宣六代机F-47，为什么选麻烦不断的波音？_澎湃防务_澎湃新闻-The Paper,135 万热度,https://www.zhihu.com/question/15579727999,https://pic4.zhimg.com/50/v2-405dc2249b817f747448bb15e8126793_b.jpg,2025-03-22 14:40:34
知乎热榜,2025-03-24 09:13:18,15,15614552198,三只羊再次道歉「今后将继续按照应赔尽赔原则，执行退一赔三标准」，除了事后赔偿，商家更应该重视哪些环节？,关于停业整改情况的通报 尊敬的消费者、粉丝、社会公众及媒体朋友们： 针对我公司前期在直播带货“香港美诚”牌月饼和“鲜多裕”牌澳洲谷饲牛肉卷中存在的相关问题，给消费者带来了损失和伤害，我们感到无比自责。这暴露出我公司在经营管理中存在突出问题，我们对此负有不可推卸的责任。在此，再次向大家真诚道歉。 自合肥市联合调查组发布情况通报后，我们立即成立了以董事会成员为总负责的整改工作组，包括招商、选品、品控、核价、督查、售后服务、退赔等7个专项小组，全方位进行排查、整改。 一、2024年10月11日，我们按照行政处罚决定书足额缴纳罚款6894.95万元。 二、对于“香港美诚”牌月饼和“鲜多裕”牌澳洲谷饲牛肉卷产品，目前已累计赔付2777.85万元，今后将继续按照应赔尽赔原则，执行退一赔三标准，做好退赔工作。 三、严格把关产品质量，新筛选、签定3家第三方专业品控机构，分品类编制食品、化妆品等7类品控作业指导书，按规范严格把控产品质量。 四、严格甄选品牌合作，进一步提升自营品占比，提高准入门槛，合作品牌压减80%。 五、严格直播讲解和主播管理，设置多层审核环节，加强直播内容审查，确保卖点信息与产品信息的统一性、准确性。严格遵守《网络主播行为规范》，制定《主播违法违规行为处理办法》，加强网络文明行为规范，设置专人专项检查，对违规主播及时清退、解约。 六、严格售后服务标准，开设专门售后服务账号“三只羊网络售后”，对经认定的问题产品，我们承诺先行垫付退赔款，提高消费者售后服务体验。 感谢大家对我们的批评、监督和帮助，今后我们将严格落实行业标准，积极承担并履行相应的法律义务和社会责任，用实际行动回馈大家对我们的认可、信任与支持。 在此一并公布： 社会监督电话：4008686087 邮箱：service@sanzhiyang.cn 欢迎大家多提宝贵意见建议。 合肥三只羊网络科技有限公司 2025年3月23日“三只羊”通报停业整改情况，再次道歉,123 万热度,https://www.zhihu.com/question/15614552198,https://pica.zhimg.com/80/v2-5e5df17cf17557eac3f74d5c36b00b28_1440w.png,2025-03-23 09:41:11
知乎热榜,2025-03-24 09:13:18,16,15601692283,2025 中国发展高层论坛提及，我国将综合施策扩大消费，此举将带来哪些影响？,今天（3月23日），中国发展高层论坛2025年年会在北京举行，在此次年会上，中央财经委员会办公室分管日常工作的副主任、中央农村工作领导小组办公室主任韩文秀表示，我国将综合施策扩大消费，不断形成高质量发展与高品质生活相互促进，相得益彰的局面。 韩文秀表示，我国将增强消费能力，在促进经济增长，提高劳动生产率的基础上，增加城乡居民的收入，优化收入分配结构，提升居民收入在国民收入中的比重，让消费者有钱能消费。同时，要扩大服务消费。 韩文秀介绍，这是下一步扩大消费的重点领域。要积极发展首发经济、健康经济、冰雪经济、银发经济，把文化旅游业发展成为重要的支柱产业，创造更多高质量的服务消费产品和场景，让消费者有更多中高端服务可以消费。 韩文秀表示，我国将继续优化消费环境。形成保护消费者权益的强大政策。减少后顾之忧。 此外，今年将提高城乡居民基础养老金最低标准，适当提高退休人员基本养老金，加快发展第三支柱养老保险，今后还要稳步提高公共服务和社会保障的水平。（央视新闻）2025中国发展高层论坛：我国将综合施策扩大消费,110 万热度,https://www.zhihu.com/question/15601692283,https://pic1.zhimg.com/80/v2-316e179d02722b31b9a078796ed29581_1440w.png,2025-03-23 05:17:56
知乎热榜,2025-03-24 09:13:18,17,15647895466,24-25赛季NBA常规赛雷霆 103:101 快船，如何评价这场比赛？,,99 万热度,https://www.zhihu.com/question/15647895466,https://picx.zhimg.com/50/v2-b4d0ef8f92bce7d1d05913334afebb3b_b.jpg,2025-03-24 01:10:56
知乎热榜,2025-03-24 09:13:18,18,13534216952,研究生联系导师回复「我现在名额有限，你先多问问」是不是没希望了？,考研本校联系的本科毕设导师，这样是不是委婉拒绝了 ———–分割线——— 感谢大家的回复，已经联系上我们的系主任了，也面谈过了，很好的一位老师。现在全力准备复试了！,89 万热度,https://www.zhihu.com/question/13534216952,https://pic1.zhimg.com/80/v2-2b1bfd1dc59dae626e22a41b6b43473c_1440w.jpg,2025-02-27 06:04:28
知乎热榜,2025-03-24 09:13:18,19,15351696100,如果CS比赛中有支21个完美c+段位的选手组成的战队，它们能否夺冠？,假设这支战队的设定是由21个C+段位的选手一起上阵参与比赛，那请问在21打5的比赛中它们能否击败绿龙小蜜蜂等强队，夺得上海major的冠军？,74 万热度,https://www.zhihu.com/question/15351696100,https://picx.zhimg.com/80/v2-f62afac28d2285bffa242f321709e498_1440w.jpg,2025-03-19 10:09:30
知乎热榜,2025-03-24 09:13:18,20,15579316464,特朗普撤销拜登、哈里斯、希拉里、布林肯、沙利文安全许可，出于什么考量？此举有何影响？,特朗普宣布撤销哈里斯以及希拉里安全许可 央视新闻消息，当地时间3月21日，美国总统特朗普撤销前副总统卡玛拉·哈里斯、前国务卿希拉里·克林顿、前国务卿安东尼·布林肯、前国家安全顾问雅各布·沙利文、前总统拜登以及其家人等人的安全许可。 声明称，该命令将立即取消他们对机密信息的访问，并且所有执行部门和机构的负责人将撤销这些人员对美国政府设施的未陪同访问权限。 前总统拜登安全许可已被撤销 特朗普当地时间2月7日说，他已撤销前总统拜登的安全许可，取消其接收机密信息的权限。此外，据多家美国媒体报道，特朗普称他已撤销拜登政府的国务卿布林肯和总统国家安全事务助理沙利文的安全许可。更多资讯请下载央视新闻客户端,73 万热度,https://www.zhihu.com/question/15579316464,https://picx.zhimg.com/80/v2-7ad93e74059a74741e8c7bfcad16605c_1440w.webp?source=1def8aca,2025-03-22 14:34:52
