type,datetime,index,id,title,desc,hot,url,img,createtime
知乎热榜,2025-04-29 05:13:12,21,1899103841334589081,《凡人修仙传》，乱星海的实力有天南的实力强吗？,乱星海的实力有天南的实力强嘛？有懂的道友分析一下,87 万热度,https://www.zhihu.com/question/1899103841334589081,https://picx.zhimg.com/80/v2-bc8884851a15bc0fed05f3adfa952530_1440w.jpg,2025-04-25 06:13:59
知乎热榜,2025-04-29 05:13:12,22,1899830226948678804,如果国际空间站出现严重问题，中国空间站能否完全替代国际空间站？,此前：NASA 发出警告，国际空间站进入迄今为止最危险时期，目前存在哪些问题？若不解决将面临哪些风险？ 如果国际空间站真的陷入危机，我们的空间站是否就成为世界各国唯一/最优的选择？届时能否承担起所有的航天科研等各项需求？,82 万热度,https://www.zhihu.com/question/1899830226948678804,https://picx.zhimg.com/80/v2-6aa6081d6b6aa64b7301092979992353_1440w.jpg,2025-04-27 06:20:23
知乎热榜,2025-04-29 05:13:12,23,1898134888395314297,为什么13个学科门类里，只有哲学和历史学没有专属的大学名称词缀？,关联问题1：科研院所与高等院校是机构合并、职能分立还是保持现状更好？ 关联问题2：现有学部/学科门类和专业类/一级学科的设置，能否整合成一套兼容性良好的体系? 关联问题3：结合人口形势、产业需求和政策约束，我国“十四五”乃至中长期高等教育会怎么发展? 文学：上海外国语大学（外国语）、北京语言大学（语言）、绍兴文理学院（文理） 法学：中国政法大学（政法）、中央民族大学（民族）、北京青年政治学院（政治） 理学：武汉理工大学（理工）、中国科学技术大学（科技） 工学：哈尔滨工业大学（工业）、哈尔滨工程大学（工程）、中国地质大学（地质）、中国矿业大学（矿业）、中国石油大学（石油）、华北电力大学（电力）、银川能源学院（能源）、石家庄铁道大学（铁道）、大连交通大学（铁道→交通）、中国计量大学（计量）、武汉纺织大学（纺织）、郑州轻工业大学（纺织→轻工业）、北京航空航天大学（航空航天）、南京信息工程大学（气象→信息工程）… 经济学：中央财经大学（财经） 、对外经济贸易大学（经贸） 管理学：国家行政学院（行政）、南京审计大学（审计） 农学：中国农业大学（农业）、浙江农林大学（农林） 、西北农林科技大学（农林科技）、南京林业大学（林业）、中南林业科技大学（林业科技）、中国海洋大学（水产→海洋） 医学：中国医科大学（医科） 、中国药科大学（药科）、北京中医药大学（中医药） 、甘肃卫生职业学院（卫生） 军事学：国防科技大学（国防） 、中国人民解放军陆军工程大学（解放军） 艺术学：中央戏剧学院（戏剧）、中央美术学院（美术）、中央音乐学院（音乐）、北京舞蹈学院（舞蹈）、北京电影学院（电影）、中国传媒大学（传媒）… 教育学：北京师范大学（师范）,81 万热度,https://www.zhihu.com/question/1898134888395314297,https://pic2.zhimg.com/50/v2-b53408e06b2eb8c021c101d52e3326e9_b.jpg,2025-04-22 14:03:43
知乎热榜,2025-04-29 05:13:12,24,1897312268926021661,肥胖或取代吸烟成为第一致癌因素，肥胖会带来哪些癌症风险？怎样合理控制体重？,国际癌症研究机构明确指出，肥胖至少与13种癌症风险相关。有专家认为，肥胖将可能取代吸烟，成为癌症最大的可干预的危险因素。肥胖或取代吸烟成为第一致癌因素,79 万热度,https://www.zhihu.com/question/1897312268926021661,https://picx.zhimg.com/80/v2-4e6ecc7993bda7d3e1533d782e15a636_1440w.webp?source=1def8aca,2025-04-20 07:34:55
知乎热榜,2025-04-29 05:13:12,25,1900203461963904331,什么是协和「4+4」学制？这种学制有哪些优势和问题？,,77 万热度,https://www.zhihu.com/question/1900203461963904331,https://pic1.zhimg.com/80/v2-df54af0d43d8cdb5cedc98b6a8215de3_1440w.jpg,2025-04-28 07:03:29
知乎热榜,2025-04-29 05:13:12,26,570222535,《魔兽》系列的巨魔究竟有多惨?,,76 万热度,https://www.zhihu.com/question/570222535,https://pic2.zhimg.com/50/v2-5421c066e5e0d2c89df87f212c03a2f7_b.jpg,2022-12-02 18:04:18
知乎热榜,2025-04-29 05:13:12,27,55945858,乒乓球技术的先进性与落后究竟取决于什么因素？何谓先进？,近来看很多国乒新秀小将都是打质量练反手拧拉，打得特别好的如樊振东，很亮眼的如梁靖坤，都是这方面的球手。 但是看吴敬平教练称马龙技术全面且是技术最先进，可龙队并不是以反手拧拉和力量为主打技术的呀，那么到底什么算先进呢？到底技术先进和落后意味着什么？,76 万热度,https://www.zhihu.com/question/55945858,,2017-02-17 11:26:49
知乎热榜,2025-04-29 05:13:12,28,443529235,可否能看看你家可爱的猫猫?,,71 万热度,https://www.zhihu.com/question/443529235,https://pica.zhimg.com/50/v2-fd3b2c5af4dbb924ff99aec56e3ad9ec_b.jpg,2021-02-08 15:42:36
知乎热榜,2025-04-29 05:13:12,29,1899116124781671954,既然指针的本质是地址，那为啥还需要指定数据类型呢？地址不就是一串 0x 数字吗？,,66 万热度,https://www.zhihu.com/question/1899116124781671954,,2025-04-25 07:02:48
知乎热榜,2025-04-29 05:13:12,30,1898452718651147698,为什么国内没有发展出 Rivendell、Crust、Surly 这种休闲自行车大牌？,,65 万热度,https://www.zhihu.com/question/1898452718651147698,https://pic4.zhimg.com/50/v2-161c9bfffc310b9234478b0d969febc5_b.jpg,2025-04-23 11:06:39
知乎热搜,2025-04-29 07:13:34,1,,工业企业利润由降转增,,,https://www.zhihu.com/search?q=%E5%B7%A5%E4%B8%9A%E4%BC%81%E4%B8%9A%E5%88%A9%E6%B6%A6%E7%94%B1%E9%99%8D%E8%BD%AC%E5%A2%9E,,
知乎热搜,2025-04-29 07:13:34,2,,降维打击到底有多恐怖,,,https://www.zhihu.com/search?q=%E9%99%8D%E7%BB%B4%E6%89%93%E5%87%BB%E5%88%B0%E5%BA%95%E6%9C%89%E5%A4%9A%E6%81%90%E6%80%96,,
知乎热搜,2025-04-29 07:13:34,3,,苹果 C 口和安卓 C 口有什么区别,,,https://www.zhihu.com/search?q=%E8%8B%B9%E6%9E%9C%20C%20%E5%8F%A3%E5%92%8C%E5%AE%89%E5%8D%93%20C%20%E5%8F%A3%E6%9C%89%E4%BB%80%E4%B9%88%E5%8C%BA%E5%88%AB,,
知乎热搜,2025-04-29 07:13:34,4,,为什么说狼人杀压根没有逻辑,,,https://www.zhihu.com/search?q=%E4%B8%BA%E4%BB%80%E4%B9%88%E8%AF%B4%E7%8B%BC%E4%BA%BA%E6%9D%80%E5%8E%8B%E6%A0%B9%E6%B2%A1%E6%9C%89%E9%80%BB%E8%BE%91,,
知乎热搜,2025-04-29 07:13:34,5,,潘凤是怎么混成大将的,,,https://www.zhihu.com/search?q=%E6%BD%98%E5%87%A4%E6%98%AF%E6%80%8E%E4%B9%88%E6%B7%B7%E6%88%90%E5%A4%A7%E5%B0%86%E7%9A%84,,
知乎热搜,2025-04-29 07:13:34,6,,为什么贾玲突然消失了,,,https://www.zhihu.com/search?q=%E4%B8%BA%E4%BB%80%E4%B9%88%E8%B4%BE%E7%8E%B2%E7%AA%81%E7%84%B6%E6%B6%88%E5%A4%B1%E4%BA%86,,
知乎热搜,2025-04-29 07:13:34,7,,王者荣耀崩了,,,https://www.zhihu.com/search?q=%E7%8E%8B%E8%80%85%E8%8D%A3%E8%80%80%E5%B4%A9%E4%BA%86,,
知乎热搜,2025-04-29 07:13:34,8,,知乎旧物节,,,https://www.zhihu.com/search?q=%E7%9F%A5%E4%B9%8E%E6%97%A7%E7%89%A9%E8%8A%82,,
知乎热搜,2025-04-29 07:13:34,9,,寻找穿越时光的旧物,,,https://www.zhihu.com/search?q=%E5%AF%BB%E6%89%BE%E7%A9%BF%E8%B6%8A%E6%97%B6%E5%85%89%E7%9A%84%E6%97%A7%E7%89%A9,,
知乎热搜,2025-04-29 07:13:34,10,,哪件旧物是你一直保留着的,,,https://www.zhihu.com/search?q=%E5%93%AA%E4%BB%B6%E6%97%A7%E7%89%A9%E6%98%AF%E4%BD%A0%E4%B8%80%E7%9B%B4%E4%BF%9D%E7%95%99%E7%9D%80%E7%9A%84,,
知乎热搜,2025-04-29 07:13:34,11,,穿越时光的旧物,,,https://www.zhihu.com/search?q=%E7%A9%BF%E8%B6%8A%E6%97%B6%E5%85%89%E7%9A%84%E6%97%A7%E7%89%A9,,
知乎热搜,2025-04-29 07:13:34,12,,神舟二十号载人飞船发射升空,,,https://www.zhihu.com/search?q=%E7%A5%9E%E8%88%9F%E4%BA%8C%E5%8D%81%E5%8F%B7%E8%BD%BD%E4%BA%BA%E9%A3%9E%E8%88%B9%E5%8F%91%E5%B0%84%E5%8D%87%E7%A9%BA,,
知乎热搜,2025-04-29 07:13:34,13,,神二十发射取得圆满成功,,,https://www.zhihu.com/search?q=%E7%A5%9E%E4%BA%8C%E5%8D%81%E5%8F%91%E5%B0%84%E5%8F%96%E5%BE%97%E5%9C%86%E6%BB%A1%E6%88%90%E5%8A%9F,,
知乎热搜,2025-04-29 07:13:34,14,,神舟二十号航天员乘组顺利入驻「天宫」,,,https://www.zhihu.com/search?q=%E7%A5%9E%E8%88%9F%E4%BA%8C%E5%8D%81%E5%8F%B7%E8%88%AA%E5%A4%A9%E5%91%98%E4%B9%98%E7%BB%84%E9%A1%BA%E5%88%A9%E5%85%A5%E9%A9%BB%E3%80%8C%E5%A4%A9%E5%AE%AB%E3%80%8D,,
知乎热搜,2025-04-29 07:13:34,15,,网传腾讯音乐拟收购喜马拉雅,,,https://www.zhihu.com/search?q=%E7%BD%91%E4%BC%A0%E8%85%BE%E8%AE%AF%E9%9F%B3%E4%B9%90%E6%8B%9F%E6%94%B6%E8%B4%AD%E5%96%9C%E9%A9%AC%E6%8B%89%E9%9B%85,,
知乎热搜,2025-04-29 07:13:34,16,,郑钦文0:2波塔波娃,,,https://www.zhihu.com/search?q=%E9%83%91%E9%92%A6%E6%96%870%3A2%E6%B3%A2%E5%A1%94%E6%B3%A2%E5%A8%83,,
知乎热搜,2025-04-29 07:13:34,17,,强基计划多所 985 取消竞赛生破格入围政策,,,https://www.zhihu.com/search?q=%E5%BC%BA%E5%9F%BA%E8%AE%A1%E5%88%92%E5%A4%9A%E6%89%80%20985%20%E5%8F%96%E6%B6%88%E7%AB%9E%E8%B5%9B%E7%94%9F%E7%A0%B4%E6%A0%BC%E5%85%A5%E5%9B%B4%E6%94%BF%E7%AD%96,,
知乎热搜,2025-04-29 07:13:34,18,,教育部增设游戏艺术设计专业,,,https://www.zhihu.com/search?q=%E6%95%99%E8%82%B2%E9%83%A8%E5%A2%9E%E8%AE%BE%E6%B8%B8%E6%88%8F%E8%89%BA%E6%9C%AF%E8%AE%BE%E8%AE%A1%E4%B8%93%E4%B8%9A,,
知乎热搜,2025-04-29 07:13:34,19,,五一大量外国人涌入中国,,,https://www.zhihu.com/search?q=%E4%BA%94%E4%B8%80%E5%A4%A7%E9%87%8F%E5%A4%96%E5%9B%BD%E4%BA%BA%E6%B6%8C%E5%85%A5%E4%B8%AD%E5%9B%BD,,
知乎热搜,2025-04-29 07:13:34,20,,杨瀚森宣布参加NBA选秀,,,https://www.zhihu.com/search?q=%E6%9D%A8%E7%80%9A%E6%A3%AE%E5%AE%A3%E5%B8%83%E5%8F%82%E5%8A%A0NBA%E9%80%89%E7%A7%80,,
知乎热搜,2025-04-29 07:13:34,21,,网传中日友好医院外科医生出轨多人,,,https://www.zhihu.com/search?q=%E7%BD%91%E4%BC%A0%E4%B8%AD%E6%97%A5%E5%8F%8B%E5%A5%BD%E5%8C%BB%E9%99%A2%E5%A4%96%E7%A7%91%E5%8C%BB%E7%94%9F%E5%87%BA%E8%BD%A8%E5%A4%9A%E4%BA%BA,,
知乎热搜,2025-04-29 07:13:34,22,,中日友好医院肖飞,,,https://www.zhihu.com/search?q=%E4%B8%AD%E6%97%A5%E5%8F%8B%E5%A5%BD%E5%8C%BB%E9%99%A2%E8%82%96%E9%A3%9E,,
知乎热搜,2025-04-29 07:13:34,23,,湘江半马女配速员跑崩,,,https://www.zhihu.com/search?q=%E6%B9%98%E6%B1%9F%E5%8D%8A%E9%A9%AC%E5%A5%B3%E9%85%8D%E9%80%9F%E5%91%98%E8%B7%91%E5%B4%A9,,
知乎热搜,2025-04-29 07:13:34,24,,印度未事先通知突然开闸泄洪,,,https://www.zhihu.com/search?q=%E5%8D%B0%E5%BA%A6%E6%9C%AA%E4%BA%8B%E5%85%88%E9%80%9A%E7%9F%A5%E7%AA%81%E7%84%B6%E5%BC%80%E9%97%B8%E6%B3%84%E6%B4%AA,,
知乎热搜,2025-04-29 07:13:34,25,,饿了么将逐步取消外卖超时扣罚,,,https://www.zhihu.com/search?q=%E9%A5%BF%E4%BA%86%E4%B9%88%E5%B0%86%E9%80%90%E6%AD%A5%E5%8F%96%E6%B6%88%E5%A4%96%E5%8D%96%E8%B6%85%E6%97%B6%E6%89%A3%E7%BD%9A,,
知乎热榜,2025-04-29 07:13:34,1,1900286031774843467,西班牙和葡萄牙遭遇大规模停电，交通、通信、医疗等一度瘫痪，民众疯抢物资，目前情况怎么样？为什么会停电？,4月28日，西班牙和葡萄牙遭遇大规模停电，影响超过5000万伊比利亚半岛民众，交通、通信、医疗等关键领域一度瘫痪，法国南部等周边地区也受短暂波及。截至当地时间21时左右，持续了将近10个小时的停电才开始结束，各地电力逐步恢复。但在西班牙，不少民众已经开始抢购物资。目前停电原因尚不明确。 欧盟委员会执行副主席特蕾莎·里贝拉当日对外表示，此次大停电是近年来欧洲记录到的最严重事件之一。 伊比利亚半岛陷入大瘫痪 法国南部等周边地区受波及 因遭遇大范围停电，西班牙多地通信服务中断，民众只能依靠收音机获取信息，马德里网球公开赛被迫暂停；铁路基础设施管理局称列车大范围停运，马德里部分地铁疏散人群，多条路段因交通信号灯失灵出现堵塞，机场虽启用应急电力系统，但部分航班仍延误。 △4月28日，在西班牙马德里，马德里公开赛网球比赛场馆内，观众在大停电期间闲逛。 △4月28日，西班牙马德里一地铁站空无一人。 葡萄牙方面，全国多地交通信号灯受影响，部分地区地铁暂时关闭，公共安全部门提醒公共照明或受波及。欧洲航空安全组织指出，此次停电影响了往返马德里、巴塞罗那和里斯本的航班。 接近西班牙边境的法国南部巴斯克地区也一度出现了短暂停电现象，持续数分钟后迅速恢复供电。法国电网公司证实，受影响的是与西班牙电网直接互联的地区。 此外，与西班牙和法国毗邻的安道尔公国的电力供应也一度中断，但得益于与法国电网的自动重连机制，电力供应在几秒钟内迅速恢复。 停电发生后 民众开始抢购生活物资 大范围停电让西班牙民众感到不知所措。因为不知道停电会持续多久，很多人涌向超市购买食品和饮用水。更多资讯请下载央视新闻客户端 马德里网球公开赛正在进行，但比赛却因为停电而不得不暂停。据外媒报道，整个伊比利亚半岛，包括西班牙、葡萄牙全部停电，法国部分地区也受到了影响。目前停电原因尚不清楚。离谱新闻！西班牙葡萄牙整个伊比利亚半岛停电，马德里公开赛暂停-直播吧,2219 万热度,https://www.zhihu.com/question/1900286031774843467,https://picx.zhimg.com/80/v2-239d3e2d4074dee825f9c5f960a6d23b_1440w.webp?source=1def8aca,2025-04-28 12:31:35
知乎热榜,2025-04-29 07:13:34,2,1900300358229652607,阿里通义千问 Qwen3 系列模型正式发布，该模型有哪些技术亮点？,4 月 29 日消息，今日凌晨，阿里巴巴发布了新一代通义千问 Qwen3 模型，一举登顶全球最强开源模型。 这是国内首个“混合推理模型”，将“快思考”与“慢思考”集成进同一个模型，大大节省算力消耗。 经过后训练的模型，例如 Qwen3-30B-A3B，以及它们的预训练基座模型（如 Qwen3-30B-A3B-Base）已在各大平台上开放使用。同时，阿里云开源了两个 MoE 模型的权重：Qwen3-235B-A22B，一个拥有 2350 多亿总参数和 220 多亿激活参数的大模型Qwen3-30B-A3B，一个拥有约 300 亿总参数和 30 亿激活参数的小型 MoE 模型。 此外，六个 Dense 模型也已开源，包括 Qwen3-32B、Qwen3-14B、Qwen3-8B、Qwen3-4B、Qwen3-1.7B 和 Qwen3-0.6B，均在 Apache 2.0 许可下开源。 据阿里云介绍，其旗舰模型Qwen3-235B-A22B在代码、数学、通用能力等基准测试中，与 DeepSeek-R1、o1、o3-mini、Grok-3 和 Gemini-2.5-Pro 等顶级模型相比，表现出极具竞争力的结果。此外，小型 MoE 模型 Qwen3-30B-A3B 的激活参数数量是 QwQ-32B 的 10%，表现更胜一筹，甚至像 Qwen3-4B 这样的小模型也能匹敌 Qwen2.5-72B-Instruct 的性能。核心亮点多种思考模式 Qwen3 模型支持两种思考模式：思考模式：在这种模式下，模型会逐步推理，经过深思熟虑后给出最终答案。这种方法非常适合需要深入思考的复杂问题。非思考模式：在此模式中，模型提供快速、近乎即时的响应，适用于那些对速度要求高于深度的简单问题。 这种灵活性使用户能够根据具体任务控制模型进行“思考”的程度。例如，复杂的问题可以通过扩展推理步骤来解决，而简单的问题则可以直接快速作答，无需延迟。 至关重要的是，这两种模式的结合大大增强了模型实现稳定且高效的“思考预算”控制能力。如上文所述，Qwen3 展现出可扩展且平滑的性能提升，这与分配的计算推理预算直接相关。这样的设计让用户能够更轻松地为不同任务配置特定的预算，在成本效益和推理质量之间实现更优的平衡。多语言 Qwen3 模型支持 119 种语言和方言，例如简体中文、繁体中文、粤语等。这一广泛的多语言能力为国际应用开辟了新的可能性，让全球用户都能受益于这些模型的强大功能阿里发布国内首个“混合推理模型”Qwen3 并开源：支持两种思考模式，预训练约 36 万亿个 token、119 种语言和方言,1073 万热度,https://www.zhihu.com/question/1900300358229652607,https://picx.zhimg.com/80/v2-852c80daea2f5bba0091c75dfff853b3_1440w.jpg,2025-04-28 13:28:31
知乎热榜,2025-04-29 07:13:34,3,1900491722468865099,24-25赛季NBA季后赛火箭 106:109 勇士，如何评价这场比赛？,,734 万热度,https://www.zhihu.com/question/1900491722468865099,https://pic1.zhimg.com/80/v2-39b5cc00ed312d6c39065101c3f7d420_1440w.webp?source=1def8aca,2025-04-29 02:08:56
知乎热榜,2025-04-29 07:13:34,4,30651530,加拿大的石油储备世界第二，为什么大家似乎都关注中东的石油为多呢？,加拿大是美国进口石油的最大来源国，可是媒体上经常提到美国是为了中东的石油而战，让人感觉中东才是最大的石油来源。如何解释这一貌似矛盾的现象？（出处：《第三次工业革命》2012年6月第1版P189),413 万热度,https://www.zhihu.com/question/30651530,https://picx.zhimg.com/80/881f9d64e8950f2c7bc308b4e7d9a029_1440w.webp?source=1def8aca,2015-05-25 02:39:19
知乎热榜,2025-04-29 07:13:34,5,1899458861376713751,小米起诉山寨马桶厂商「小米零度」获赔 3000 万元，这一判决对知识产权保护有何重要意义？,近日，上海市第三中级人民法院宣判一起知识产权侵权案。小米科技有限责任公司（以下简称“小米”）起诉山寨厂商“小米零度”商标侵权及不正当竞争纠纷案胜诉，获赔3000万元。该案因侵权商品销售额高达1.3亿元，成为知识产权保护领域的又一典型案例。 据法院查明，自2022年11月起，“小米零度”在电商平台销售智能马桶及花洒，商品使用“小米零度”字样及与小米商标近似的“M”形标识，并以“小爱小爱”作为语音唤醒指令，与小米旗下语音助手“小爱同学”高度相似。 小米公司主张，“小米”商标为驰名商标，被告的行为易导致消费者混淆，构成商标侵权；而“小爱小爱”语音指令模仿“小爱同学”，属于不正当竞争。因此， 被告“小米零度”辩称，其商标经国家商标局核准注册，与小米商标不构成近似，且“小爱小爱”与“小爱同学”存在差异，无法唤醒小米设备，故不构成侵权。其律师还指出，小米的文字商标并未注册在马桶品类上，且他们的商标经过国家商标总局认证，不应认定为侵权。山寨小米马桶爆卖1.3亿，小米起诉获赔3000万,353 万热度,https://www.zhihu.com/question/1899458861376713751,https://pic1.zhimg.com/80/v2-c215de0016c03510accf4a4a3dfbedde_1440w.png,2025-04-26 05:44:42
知乎热榜,2025-04-29 07:13:34,6,1899584705143206537,五一将有大量外国人涌入中国，日韩、新加坡最多，是什么吸引他们此时来中国？,五一长假即将到来，除了国内游必然火爆，跨境游也将出现井喷，尤其是在购物离境退税“即买即退”等举措的助推下，大量国外游客即将涌入中国。 在线旅游预订平台数据显示，截至目前，今年五一入境游订单量同比增长173％，游客主要来自周边的韩国、日本、新加坡等国，还有泰国、马来西亚、印尼等东南亚国家。 航旅纵横数据也显示，截至4月24日，五一假期出入境航线机票预订量超过103万张，比去年同期增长约25％。 从机票价格来看，五一节前错峰出行更划算。 比如5月1-5日北京往返吉隆坡，避开夜间飞行的机票价格已超过7400元，而在4月29日-5月3日往返，同一航班价格便宜了一半。 国内方面，5月1-5日北京往返杭州，避开夜间飞行的机票价格接近3000元，而改到4月29日-5月3日就不到1000元。 据国家移民管理局数据，240小时过境免签政策实施以来，截至3月31日，全国各口岸入境外国人同比增长40.2％，其中免签入境占比达71.3％。 成都边检站的数据显示，2025年第一季度成都入境游火爆，航空口岸接待外国人35.4万人次，同比激增70.18％，其中泰国、马来西亚游客最爱来成都。五一将有大量外国人涌入中国：日韩、新加坡最多,275 万热度,https://www.zhihu.com/question/1899584705143206537,https://picx.zhimg.com/80/v2-b1d62a3e0b570657ada5b6671b45b583_1440w.jpg,2025-04-26 14:04:46
知乎热榜,2025-04-29 07:13:34,7,1900459547069505968,如何评价《明末：渊虚之羽》2025年4月发布的最新实机预告片，对得起248这个售价吗？,,222 万热度,https://www.zhihu.com/question/1900459547069505968,https://picx.zhimg.com/80/v2-71bc723d9f5d7558c74523e30debac71_1440w.png,2025-04-29 00:01:04
知乎热榜,2025-04-29 07:13:34,8,1900156997212550309,猪猪侠正式入职京东外卖，曾因「外卖工服配色撞衫猪猪侠」引关注，你觉得双方合作将带来哪些新体验？,4 月 28 日，京东外卖官宣与动画 IP 猪猪侠联动，猪猪侠 GG Bond 正式入职京东外卖。 曾因“外卖工服配色撞衫猪猪侠”引关注，京东外卖晒出猪猪侠入职申请表_腾讯新闻,195 万热度,https://www.zhihu.com/question/1900156997212550309,https://pic1.zhimg.com/80/v2-4582eb04ba6e2ae079f4d6ca17b5931f_1440w.png,2025-04-28 03:58:51
知乎热榜,2025-04-29 07:13:34,9,1899745186277490701,泡泡玛特拉布布 3.0 开售被抢空，有联名款原价 599 元炒到 1.4 万，消费者究竟在为什么买单？,4月25日，LABUBU3.0系列线下发售，广州泡泡玛特门店大排长龙。新品原价99元，二手市场加价至130元，端盒更贵。 受欢迎的不止最新款，以去年发售的LABUBU与Vans联名款为例，发售价为599元的潮玩在二手市场上已经涨价到14839元。 很难用语言描述为什么一个小小的玩偶会让那么多消费者陷入痴迷。,169 万热度,https://www.zhihu.com/question/1899745186277490701,https://pica.zhimg.com/80/v2-613b67100c6b5e07074a9d1370cdbf3a_1440w.webp?source=1def8aca,2025-04-27 00:42:27
知乎热榜,2025-04-29 07:13:34,10,1898763060996466675,灰鹦鹉爆粗口三年未改，园方称形成习惯后只能慢慢调整，难矫正的原因在哪？ 有更好的办法吗？,近日，有游客发视频显示，在云南野生动物园，一名游客对一只灰鹦鹉打招呼，遭这只灰鹦鹉（下称“小灰”）脏话“回敬”。 早在2022年8月，“小灰”因模仿人类说脏话意外走红，园方曾公开表示已对其进行“矫正教育”。但如今三年过去，网友发出疑问“不是早就被教育过了吗”。 4月23日，云南野生动物园一名工作人员对此事回应称：“‘小灰’已形成固定语言模式，我们也在持续引导，目前只能是慢慢调整。”云南野生动物园一只灰鹦鹉爆粗口三年未改？园方回应：已形成固定语言,128 万热度,https://www.zhihu.com/question/1898763060996466675,https://pic1.zhimg.com/50/v2-621ca9e3acc8df3db3d4daa6671306eb_720w.webp?source=1def8aca,2025-04-24 07:39:51
知乎热榜,2025-04-29 07:13:34,11,370388031,为什么我完全get不到克苏鲁神话恐怖的点？,不仅get不到恐怖的点，甚至觉得有点神秘的美，偶尔有时会想笑...,108 万热度,https://www.zhihu.com/question/370388031,https://pic1.zhimg.com/50/v2-e9da3a50bf5179c86fd90600f0fee5ea_b.jpg,2020-02-07 17:16:32
知乎热榜,2025-04-29 07:13:34,12,1900451655742387538,瑞幸咖啡被曝不同账号点单价格不同，会员点单更贵，为何出现这种情况？如何认定商家是用券促活还是「杀熟」？,近日，有网友发现，瑞幸咖啡在网络平台上针对不同消费者给出了不同的商品价格。记者在四部手机上，同时打开了瑞幸咖啡微信小程序，结果发现，生椰拿铁在每个账号显示的实际价格分别是9.9元、10.9元、10.9元和13.9元，4个账号中单价最贵的竟是点单最多、积分最高的黑金鹿。不少消费者表示遇到过类似现象。对此，门店工作人人员回应称，每个门店优惠不一样，不同商圈的价格也会有差异。官方客服也称，不会出现点得多的账户反而价格更高的情况。 此外，很多消费者在订酒店、打车等时，也遇到过类似情况。法律界人士指出，如果是“随机发放优惠券”，并不能绝对地认定为“大数据杀熟”。但如果是通过大数据分析，针对某些特定消费群体发放特定消费券，造成同一商品价格不同则涉嫌大数据杀熟，侵犯了消费者的公平交易权。消费者可以收集证据，如截图、电话录音等，向平台投诉，也可以向市监部门或消费者保护协会举报或反映。老顾客反而更贵？记者实测：同款饮品四部手机点出三种价格_荔枝新闻,106 万热度,https://www.zhihu.com/question/1900451655742387538,https://picx.zhimg.com/80/v2-21c8b8c9259d493947b1e226372ba067_1440w.webp?source=1def8aca,2025-04-28 23:29:43
