type,datetime,index,id,title,desc,hot,url,img,createtime
知乎热榜,2025-03-03 02:17:38,15,13697633888,如何看待 Skype 将于2025年5月被关闭？,微软于2025年2月28日宣布Skype将于当年5月停运，并建议用户迁移至Microsoft Teams。 https://www.microsoft.com/en-us/microsoft-365/blog/2025/02/28/the-next-chapter-moving-from-skype-to-microsoft-teams/,22 万热度,https://www.zhihu.com/question/13697633888,,2025-02-28 17:16:44
知乎热榜,2025-03-03 02:17:38,16,13888453008,乌总统泽连斯基称「若乌克兰可以加入北约，愿意辞职」，乌克兰能加入北约吗？局势会如何发展？,当地时间3月2日，正在访问英国的乌克兰总统泽连斯基在接受采访时表示，若乌克兰可以加入北约，他愿意辞职。 泽连斯基还表示，假如相关各方都准备好，那么乌克兰会签署矿产协议。 泽连斯基2月28日访美期间在白宫与特朗普、美国副总统万斯举行会谈。三人在媒体前爆发激烈争吵，泽连斯基提前离开白宫。双方计划在会晤后召开的联合记者会被取消，美乌矿产协议未签署。 此前于2月23日，泽连斯基曾表示，如果能带来和平，他愿意辞去总统职务，或者用他的辞职换取乌克兰加入北约。 更多资讯请下载央视新闻客户端,20 万热度,https://www.zhihu.com/question/13888453008,https://pic2.zhimg.com/v2-65087c54302f963ce15186a47c74a791_1440w.jpg,2025-03-02 23:51:43
知乎热榜,2025-03-03 02:17:38,17,13652553611,欧盟委员会主席冯德莱恩称「印度和欧盟将争取 2025 年达成自由贸易协议」，双方有哪些合作？,欧盟委员会主席冯德莱恩2月28日表示，印度和欧盟将努力在今年达成自由贸易协议。“欧盟和印度之间的自由贸易协定，将是世界上同类协议中最大的。”冯德莱恩在新德里的一个活动上说道，“你可以相信我会全力以赴确保我们能够实现目标”，欧盟和印度总理纳莫迪已同意“推动在今年内完成”。 冯德莱恩：印度和欧盟将争取今年达成自由贸易协议,19 万热度,https://www.zhihu.com/question/13652553611,https://pic2.zhimg.com/50/v2-841e0792666c05a8f63e2b008d9bda0f_b.jpg,2025-02-28 07:49:48
知乎热榜,2025-03-03 02:17:38,18,13540678000,「考研改成绩骗父母」生意火爆，商家利用前端技术暂时修改网页两天接几百单，如何看待此事？,截至2月26日，各省考研初试成绩已公布两天，学子们可谓“几家欢喜几家愁”。与此同时，封面新闻记者在多个社交平台上搜索“考研查分”时发现，含有“考研成绩p图”“考研成绩修改”等字眼的帖子数量高达数百条。 记者以学生身份咨询多个商家，发现“考研改成绩”的服务形式主要分为提供截图、提供录屏和提供网页操作三种，价格从5元到69元不等。有商家更是坦言“出成绩两天，已接几百单，服务范围涉及全国各地，主要目的是伪造一个看似合理的分数，让父母支持自己再次备战考研。” 2月26日，封面新闻记者致电研招网，相关工作人员表示，“研招网的数据由招生单位负责上报，分数出错、分数造假等也由招生单位负责，跟考生出示的成绩截图无关。”律师表示，商家通过搭设假网站为他人提供查询服务而获利的，可能构成非法经营罪。 提供“研招网页面” 价格5元到69元不等 2月25日，封面新闻记者在社交媒体平台上发现了诸多标题为“修改考研成绩”的帖子。这些帖子大多以“不是p图，是网页修改”“应付或者安慰家里人”为文案。 随后，记者以学生身份咨询了多位商家。其中一个商家表示，“不是简单的图片编辑，是在网站上进行高级计算机技术操作，仅用于生成首页到查询页的模拟流程，是定制网页，能让你放心在家长面前查分”。 据商家介绍，修改成绩需要提供学信网账号和密码，而显示分数由买家确定。有两个套餐选择，套餐一为可实操网页，两周不限次数查询，售价69。套餐二提供成绩页面截图，售价39。 此外，商家还展示了操作流程视频，并表示成绩是商家提前录入的，后续无论买家登录多少次看到的都是伪造成绩。记者还发现，所谓的定制网页，跟研招网几乎没有区别，连网站下方的运营信息都标识得清清楚楚。 完整全文“考研改成绩骗父母”商家两天接几百单，价格5元到69元不等 律师：商家涉非法经营罪_分数_网页_服务,15 万热度,https://www.zhihu.com/question/13540678000,https://pic1.zhimg.com/v2-8cb2f0f7964ae2991255a62f321cff60_1440w.jpg,2025-02-27 07:05:40
知乎热榜,2025-03-03 02:17:38,19,13653601935,两名溶洞潜水科考人员被困， 69 小时后营救后奇迹生还，这么危险的潜水科研值得么？,2月5日，两名科考队员在广西百色市田阳区的一个溶洞内潜水时失联，后经当地公安、应急、消防、急救等多部门长达69个小时的联合搜救，最终成功将失联队员营救出来。从目前公开的报道和所知资料来看，此次救援创造了国内首例洞穴潜水救援成功奇迹。 69小时生死营救，国内首例洞穴潜水救援成功！_澎湃号·媒体_澎湃新闻-The Paper,15 万热度,https://www.zhihu.com/question/13653601935,https://pic3.zhimg.com/v2-5dedd36d0277f030340346bc8477aa36_1440w.jpg,2025-02-28 08:00:06
知乎热榜,2025-03-03 02:17:38,20,13647450592,如何评价比亚迪与大疆合作发布的智能车载无人机「灵鸢」？,2025 年 3 月 2 日，比亚迪携手大疆，在深圳举办了智能车载无人机系统发布会，并将该系统正式定名为「灵鸢」。「灵鸢」实现了车与无人机的整车集成，并将覆盖比亚迪旗下多品牌及车型，实现技术普及。发布会上，搭载「灵鸢」系统的方程豹 豹8 无人机版正式上市。,14 万热度,https://www.zhihu.com/question/13647450592,https://picx.zhimg.com/50/v2-07398418152591d5f985e39b41685d93_b.jpg,2025-02-28 07:02:19
知乎热榜,2025-03-03 02:17:38,21,29211448,西雅图是一座怎样的城市？,原题是你为什么喜欢或者是为什么不喜欢西雅图？想听听大家的看法~,13 万热度,https://www.zhihu.com/question/29211448,https://picx.zhimg.com/80/v2-7fa369d4995ae5b1baf29369189981ec_1440w.webp?source=1def8aca,2015-04-01 03:03:17
知乎热榜,2025-03-03 02:17:38,22,13753404816,如何看待《怪物猎人·荒野》的差评如潮？,截至2025年3月1日，怪物猎人荒野国区共17k的评测，19%好评，中文评价数量占总体评价数量的63%,12 万热度,https://www.zhihu.com/question/13753404816,https://pic1.zhimg.com/80/v2-1a3609a5c857a9d608a3474da731eb4a_1440w.webp?source=1def8aca,2025-03-01 09:24:09
知乎热榜,2025-03-03 02:17:38,23,10397352064,为什么功夫片里中国人都是以技降力，没有以力降技的？,就是在功夫片里（甚至扩大到所有动作片），中国人一定不是体型最壮的，力气最大的。比如说《叶问4》里，哥连一个下劈掌，打骨折了螳螂拳师傅格挡的手臂。就算最后哥连被叶问揍了，看着也不爽啊。 我就想看张志磊这种2米01，125kg体型和世界拳王技巧的中国人，暴揍杰森斯坦森这种178的，甚至托尼贾这种不到170的。可能被泰拳秀一秀，但最后一力降十会，一拳把对手肝都打爆的那种电影。 有没有这种电影推荐啊？,11 万热度,https://www.zhihu.com/question/10397352064,https://pic4.zhimg.com/80/5714fa5b14a32a7ab4660c97ee47b89d_1440w.webp,2025-01-23 15:23:25
知乎热榜,2025-03-03 02:17:38,24,11906192085,《哪吒之魔童闹海》中无量仙翁为什么说天元鼎是阐教根基？,无量仙翁在天元鼎被破的时候说的,10 万热度,https://www.zhihu.com/question/11906192085,https://pica.zhimg.com/80/v2-96edb48054fe1db77d5ca50159e4695a_1440w.webp,2025-02-11 05:52:08
知乎热榜,2025-03-03 02:17:38,25,13714911172,2024 年个税年度汇算于 3 月 1 日开始，申报有哪些注意事项？你是可以退税还是要补税？,个税年度汇算将于3月1日开始。个税汇算是指纳税人需汇总上一年度工资薪金、劳务报酬、稿酬、特许权使用费等四项综合所得合并计税，向税务部门办理汇算，并结清应退或应补税款。 如果在平时预缴税款时，没有申报或者申报不全专项附加扣除，在年度汇算时进行补充申报，就可能导致应纳税额减少，从而产生退税。若纳税人在2024年取得了职业资格证书，按照规定，在取得相关证书的当年，可享受继续教育专项附加扣除，这也可能产生退税。 需要注意的是，同一年度内取得多个职业资格证书，只能填报享受其中一个，即最多只能享受3600元扣除优惠；不同年度获得不同证书则可以多次享受。继续教育专项附加扣除包含学历（学位）继续教育和职业资格继续教育，同一年度内取得了职业资格证书和学历（学位）继续教育，两者属于不同继续教育类型，可以叠加享受。 综上所述，2024年度个税汇算清缴在退税预约时间、汇算范围、退税条件以及专项附加扣除方面都有明确的规定，纳税人需要按照规定的时间和流程进行办理。个税年度汇算将于3月1日开始_央广网,10 万热度,https://www.zhihu.com/question/13714911172,https://picx.zhimg.com/80/v2-0980d5681064669c7d188470b06c6748_1440w.png,2025-03-01 01:09:53
知乎热榜,2025-03-03 02:17:38,26,23448967,为什么枯山水在中国不流行？,枯山水在日本这么盛行，为什么在文化相似的中国却很罕见？,10 万热度,https://www.zhihu.com/question/23448967,https://pica.zhimg.com/80/v2-36ed61389bf0afcf631c5942cfe4f0a2_1440w.webp?source=1def8aca,2014-04-17 11:07:54
知乎热榜,2025-03-03 02:17:38,27,4266763579,炒股让你明白了什么真理？,今天又是大跌，这几天迅速转盈成亏，枉费心机这么久。回本清仓是目前唯一念头。,9 万热度,https://www.zhihu.com/question/4266763579,https://pic2.zhimg.com/50/v2-1297953d87677b2dc6816e9ebee9613f_b.jpg,2024-11-15 13:41:06
知乎热榜,2025-03-03 02:17:38,28,13595730820,如何评价景甜、张晚意主演的古装剧《似锦》?,,8 万热度,https://www.zhihu.com/question/13595730820,https://pic2.zhimg.com/50/v2-d778a97390abfe1613f238e8fc0e20cf_b.jpg,2025-02-27 17:33:39
知乎热榜,2025-03-03 02:17:38,29,13807832463,24-25赛季NBA常规赛勇士 119:126 76人，如何评价这场比赛？,,8 万热度,https://www.zhihu.com/question/13807832463,https://picx.zhimg.com/80/v2-c73174ce3749aa8dc6007d6c0126fe21_1440w.webp?source=1def8aca,2025-03-02 01:41:17
知乎热榜,2025-03-03 02:17:38,30,13755153969,《无畏契约》2025 曼谷大师赛败者组决赛 EDG 1:3 不敌 T1，如何评价这场比赛？,,8 万热度,https://www.zhihu.com/question/13755153969,https://pic2.zhimg.com/50/v2-954b367e2e18d85327c7baeedba06433_b.jpg,2025-03-01 09:45:43
