type,datetime,index,id,title,desc,hot,url,img,createtime
知乎热榜,2025-03-24 06:16:31,16,15614552198,三只羊再次道歉「今后将继续按照应赔尽赔原则，执行退一赔三标准」，除了事后赔偿，商家更应该重视哪些环节？,关于停业整改情况的通报 尊敬的消费者、粉丝、社会公众及媒体朋友们： 针对我公司前期在直播带货“香港美诚”牌月饼和“鲜多裕”牌澳洲谷饲牛肉卷中存在的相关问题，给消费者带来了损失和伤害，我们感到无比自责。这暴露出我公司在经营管理中存在突出问题，我们对此负有不可推卸的责任。在此，再次向大家真诚道歉。 自合肥市联合调查组发布情况通报后，我们立即成立了以董事会成员为总负责的整改工作组，包括招商、选品、品控、核价、督查、售后服务、退赔等7个专项小组，全方位进行排查、整改。 一、2024年10月11日，我们按照行政处罚决定书足额缴纳罚款6894.95万元。 二、对于“香港美诚”牌月饼和“鲜多裕”牌澳洲谷饲牛肉卷产品，目前已累计赔付2777.85万元，今后将继续按照应赔尽赔原则，执行退一赔三标准，做好退赔工作。 三、严格把关产品质量，新筛选、签定3家第三方专业品控机构，分品类编制食品、化妆品等7类品控作业指导书，按规范严格把控产品质量。 四、严格甄选品牌合作，进一步提升自营品占比，提高准入门槛，合作品牌压减80%。 五、严格直播讲解和主播管理，设置多层审核环节，加强直播内容审查，确保卖点信息与产品信息的统一性、准确性。严格遵守《网络主播行为规范》，制定《主播违法违规行为处理办法》，加强网络文明行为规范，设置专人专项检查，对违规主播及时清退、解约。 六、严格售后服务标准，开设专门售后服务账号“三只羊网络售后”，对经认定的问题产品，我们承诺先行垫付退赔款，提高消费者售后服务体验。 感谢大家对我们的批评、监督和帮助，今后我们将严格落实行业标准，积极承担并履行相应的法律义务和社会责任，用实际行动回馈大家对我们的认可、信任与支持。 在此一并公布： 社会监督电话：4008686087 邮箱：service@sanzhiyang.cn 欢迎大家多提宝贵意见建议。 合肥三只羊网络科技有限公司 2025年3月23日“三只羊”通报停业整改情况，再次道歉,151 万热度,https://www.zhihu.com/question/15614552198,https://pica.zhimg.com/80/v2-5e5df17cf17557eac3f74d5c36b00b28_1440w.png,2025-03-23 09:41:11
知乎热榜,2025-03-24 06:16:31,17,1886724020151485837,美国很多地方废弃，为啥很多人宁可在街上流浪，也没有人去开荒种地呢？,,150 万热度,https://www.zhihu.com/question/1886724020151485837,https://pic1.zhimg.com/80/v2-502cd04bcd19d782220129c665e4727c_1440w.webp?source=1def8aca,2025-03-22 02:21:00
知乎热榜,2025-03-24 06:16:31,18,14159370972,人类明明是顶级杂食动物，胃酸接近食腐动物，为什么连生肉都不敢吃？,,138 万热度,https://www.zhihu.com/question/14159370972,https://picx.zhimg.com/80/v2-1792bf309cb59e6396a3d6eafbffe3fb_1440w.webp?source=1def8aca,2025-03-05 12:41:52
知乎热榜,2025-03-24 06:16:31,19,15629139415,C 罗称「我只想葡萄牙赢，若我不上场能赢我会马上同意」，如何评价他的观点？,直播吧03月23日讯 葡萄牙vs丹麦的次回合对决即将打响，赛前，C罗被问到了球队应该拿出怎样不同的表现，来扭转首回合的失利。 C罗：“我们必须踢得更好，我们已经踢过很多比赛，明天我们会尽力做到最好。我不相信有任何人会不想拿出好的表现。有时候只是事情行不通，任何踢过球的人都明白我在说什么。” “明天如果我进球，那很好，如果是其他球员，对我来说也一样。如果葡萄牙要赢球，需要我不上场，那我会马上同意。”“即使我不在球队里，我也会继续这么说，我至死都会捍卫这件球衣。如果我不进球而球队能赢，我会开心地回家。这就是我们的生活，我期待明天，因为我知道我们会拿出好的表现。”C罗：我只想葡萄牙赢，若我不上场能赢我会马上同意-直播吧手机版,138 万热度,https://www.zhihu.com/question/15629139415,https://pic1.zhimg.com/50/v2-6510b0968619c52bd087fe88e2287fba_b.jpg,2025-03-23 13:41:37
知乎热榜,2025-03-24 06:16:31,20,1886386539191316855,死后立遗嘱要子女将自己骨灰撒向空中随风而去，违法吗？,,120 万热度,https://www.zhihu.com/question/1886386539191316855,https://pic1.zhimg.com/80/v2-7b665bb7e2f3ffa835165ff22224a880_1440w.webp?source=1def8aca,2025-03-21 03:59:58
知乎热榜,2025-03-24 06:16:31,21,15579316464,特朗普撤销拜登、哈里斯、希拉里、布林肯、沙利文安全许可，出于什么考量？此举有何影响？,特朗普宣布撤销哈里斯以及希拉里安全许可 央视新闻消息，当地时间3月21日，美国总统特朗普撤销前副总统卡玛拉·哈里斯、前国务卿希拉里·克林顿、前国务卿安东尼·布林肯、前国家安全顾问雅各布·沙利文、前总统拜登以及其家人等人的安全许可。 声明称，该命令将立即取消他们对机密信息的访问，并且所有执行部门和机构的负责人将撤销这些人员对美国政府设施的未陪同访问权限。 前总统拜登安全许可已被撤销 特朗普当地时间2月7日说，他已撤销前总统拜登的安全许可，取消其接收机密信息的权限。此外，据多家美国媒体报道，特朗普称他已撤销拜登政府的国务卿布林肯和总统国家安全事务助理沙利文的安全许可。更多资讯请下载央视新闻客户端,120 万热度,https://www.zhihu.com/question/15579316464,https://picx.zhimg.com/80/v2-7ad93e74059a74741e8c7bfcad16605c_1440w.webp?source=1def8aca,2025-03-22 14:34:52
知乎热榜,2025-03-24 06:16:31,22,1885983399811975115,为什么现实中人们大多有礼貌地劝架，网络上则容易生气加入骂仗？是「媒介」影响了人的行为选择吗？,现实中有两个人闹矛盾了！第三者如果想管，很多时候很有礼貌地去劝两个人不要吵架了，于是真正地起到了作用！确实和解了，网络上就不同了，看到两个人因为观点不同而吵架，第三者往往不会去劝架，认可一方的观点，加入吵架，帮助其中一个人怼或者辱骂另一个人！于是本来两个人吵架五分钟就能结束争吵了！上升为十几个人吵架，一个小时也结束不了争吵！结局往往是两败俱伤谁也没说服谁的观点！真不明白为什么现实中人们能表现的素质那么高，网络上能表现的那么爱斤斤计较,119 万热度,https://www.zhihu.com/question/1885983399811975115,https://pic1.zhimg.com/80/v2-b54933bd442673e85e941dc560e0862e_1440w.png,2025-03-20 01:18:02
知乎热榜,2025-03-24 06:16:31,23,13086337689,如何看待逐渐没落的港片电影及电视剧？港影的出路在哪里？,是人们看固定题材疲劳了?,107 万热度,https://www.zhihu.com/question/13086337689,https://pic1.zhimg.com/80/v2-45c49413de30630ffc0acaf83f682a47_1440w.webp?source=1def8aca,2025-02-23 01:46:10
知乎热榜,2025-03-24 06:16:31,24,32317150,各位遇到哪些因为文化差异或者地域差异闹出的笑话？,今天翻了时报，看见了，这个，偶然想到的。 餐馆老板顿时傻眼，幸好民警及时调解平息事态 记者 聂炜昌 鱼香肉丝怎么没有“鱼味”？昨天，一外地女游客在九龙坡谢家湾一小区门口就餐，点了一盘鱼香肉丝。但女游客吃了几口，认为鱼香肉丝没有“鱼味”，厨师做的不正宗。随后，女子和餐馆老板较真，要讨个说法。老板无奈，只得拨打110报警。 老板遭质问“这是鱼香肉丝？” 刘小姐20多岁，山西人，几天前到重庆旅游。7月16日下午6点左右，在谢家湾一小区附近，刘小姐找了一家个体餐馆就餐。餐馆老板姓赵，今年33岁，合川人，以前做过厨师，在这里经营餐馆已经一年多。 拿着菜单，刘小姐只点了一盘鱼香肉丝。不过，数分钟后，等菜上桌，刚吃两口，刘小姐感觉味道不对劲，于是叫来了老板及厨师。 “你这是鱼香肉丝吗？”刘小姐向老板质问，并要求老板做一道正宗的鱼香肉丝。面对刘小姐的质问，老板当即傻了眼，自己从来没遇到过这种要求。 老板马上解释，自己店里做的鱼香肉丝就是这个味。可刘小姐认为，老板是在狡辩，是在欺骗消费者。随即，她在店里大吵起来，并拨打了110报警。 游客不仅拒付款还要求赔偿 此时正值吃饭高峰，刘小姐的大吵大闹让客人纷纷绕道而行。老板无奈，认为刘小姐是吃饭想赖账，也拨打了报警电话。 接到报警，谢家湾派出所民警很快赶到餐馆。刘小姐告诉民警，今天吃到的鱼香肉丝，与自己在山西老家吃的鱼香肉丝完全不一样，而且一点“鱼”味都没有，根本不是鱼香肉丝的味道。同时，刘小姐坚持要老板退钱，并赔偿损失。,106 万热度,https://www.zhihu.com/question/32317150,https://pic1.zhimg.com/80/v2-f75c14ed0113474475798e391f42205b_1440w.webp?source=1def8aca,2015-07-18 05:40:24
知乎热榜,2025-03-24 06:16:31,25,267692668,《魔兽争霸 3》中有哪些奇怪的单位？,,95 万热度,https://www.zhihu.com/question/267692668,https://picx.zhimg.com/v2-642f9ccd0ba048026af289a792233bad_qhd.jpg?source=57bbeac9,2018-02-25 03:07:02
知乎热榜,2025-03-24 06:16:31,26,15188918067,发改委鼓励有条件的地方探索设置中小学春秋假，这一规划有可能实现吗？会带来哪些积极影响？,国家发展改革委副主任李春临表示，针对大家反映突出的加班文化盛行等重点问题，《提振消费专项行动方案》专门就保障休息休假权益提出了相关的举措。方案通过强化执行监督来落实带薪年休假制度，明确不得违法延长劳动者工作时间，同时鼓励弹性错峰休假，鼓励有条件的地方结合实际探索设置中小学春秋假。 资料来源国家发改委：鼓励有条件的地方探索设置中小学春秋假_李春临_方案_新华财经,85 万热度,https://www.zhihu.com/question/15188918067,https://picx.zhimg.com/80/v2-aa59480cbc827b01930e6d25dc3ed61a_1440w.webp?source=1def8aca,2025-03-17 07:42:13
知乎热榜,2025-03-24 06:16:31,27,618009234,曹操挟天子以令诸侯，但是为啥我感觉好像没人听他的？,袁绍、袁术、刘表、刘备、孙权等等群雄好像没有一个人听他的。,84 万热度,https://www.zhihu.com/question/618009234,https://pica.zhimg.com/80/v2-716590dd89b64e175eb4bc660da87598_1440w.webp?source=1def8aca,2023-08-18 11:55:11
知乎热榜,2025-03-24 06:16:31,28,15399041545,为什么晴雯打骂小丫头是大丫头特权是真性情，而王夫人撵走晴雯是佛口蛇心？,,78 万热度,https://www.zhihu.com/question/15399041545,https://pic1.zhimg.com/50/v2-050c5632e77b439e5b95148605360ee8_b.jpg,2025-03-20 04:56:39
知乎热榜,2025-03-24 06:16:31,29,12472437164,为什么一支足球球队要养二三十个球员？,上场不需要这么多，养这么多多费钱啊，场上11个人，额外再养两三个替补，不就ok了，十五个足够了,77 万热度,https://www.zhihu.com/question/12472437164,https://pica.zhimg.com/50/v2-77dea410c5fe4fcdbef3d08b39774cf2_b.jpg,2025-02-17 02:33:49
知乎热榜,2025-03-24 06:16:31,30,15297421977,中国如果像《茶杯头》那样致敬经典动画作品制作一部游戏，是否可行？,黑猫警长、宝莲灯、哪吒闹海、小蝌蚪找妈妈、没头脑与不高兴...感觉有诸多经典角色可以发掘并借鉴 本问题投稿「游戏妙问」活动，活动详情及 Steam 充值卡兑换地址：https://s.zhihu.com/2_3mXn0R,74 万热度,https://www.zhihu.com/question/15297421977,https://picx.zhimg.com/80/v2-350074fe88018301d6ce95af3776bf95_1440w.webp?source=1def8aca,2025-03-18 14:15:34
知乎热搜,2025-03-24 07:12:17,1,,以前的铁道部算是一个超级大部门吗,,,https://www.zhihu.com/search?q=%E4%BB%A5%E5%89%8D%E7%9A%84%E9%93%81%E9%81%93%E9%83%A8%E7%AE%97%E6%98%AF%E4%B8%80%E4%B8%AA%E8%B6%85%E7%BA%A7%E5%A4%A7%E9%83%A8%E9%97%A8%E5%90%97,,
知乎热搜,2025-03-24 07:12:17,2,,有哪些故意缩短产品寿命的设计,,,https://www.zhihu.com/search?q=%E6%9C%89%E5%93%AA%E4%BA%9B%E6%95%85%E6%84%8F%E7%BC%A9%E7%9F%AD%E4%BA%A7%E5%93%81%E5%AF%BF%E5%91%BD%E7%9A%84%E8%AE%BE%E8%AE%A1,,
知乎热搜,2025-03-24 07:12:17,3,,你见过最令你震撼的一张图片是什么,,,https://www.zhihu.com/search?q=%E4%BD%A0%E8%A7%81%E8%BF%87%E6%9C%80%E4%BB%A4%E4%BD%A0%E9%9C%87%E6%92%BC%E7%9A%84%E4%B8%80%E5%BC%A0%E5%9B%BE%E7%89%87%E6%98%AF%E4%BB%80%E4%B9%88,,
知乎热搜,2025-03-24 07:12:17,4,,如何看待美国识字率只有 79％,,,https://www.zhihu.com/search?q=%E5%A6%82%E4%BD%95%E7%9C%8B%E5%BE%85%E7%BE%8E%E5%9B%BD%E8%AF%86%E5%AD%97%E7%8E%87%E5%8F%AA%E6%9C%89%2079%EF%BC%85,,
知乎热搜,2025-03-24 07:12:17,5,,俄军称在库尔斯克州转入全线大规模进攻,,,https://www.zhihu.com/search?q=%E4%BF%84%E5%86%9B%E7%A7%B0%E5%9C%A8%E5%BA%93%E5%B0%94%E6%96%AF%E5%85%8B%E5%B7%9E%E8%BD%AC%E5%85%A5%E5%85%A8%E7%BA%BF%E5%A4%A7%E8%A7%84%E6%A8%A1%E8%BF%9B%E6%94%BB,,
知乎热搜,2025-03-24 07:12:17,6,,拜仁联赛主场37次对阵波鸿,,,https://www.zhihu.com/search?q=%E6%8B%9C%E4%BB%81%E8%81%94%E8%B5%9B%E4%B8%BB%E5%9C%BA37%E6%AC%A1%E5%AF%B9%E9%98%B5%E6%B3%A2%E9%B8%BF,,
知乎热搜,2025-03-24 07:12:17,7,,养老服务向全体老年人拓展,,,https://www.zhihu.com/search?q=%E5%85%BB%E8%80%81%E6%9C%8D%E5%8A%A1%E5%90%91%E5%85%A8%E4%BD%93%E8%80%81%E5%B9%B4%E4%BA%BA%E6%8B%93%E5%B1%95,,
知乎热搜,2025-03-24 07:12:17,8,,哈马斯称应立即开启停火协议第二阶段谈判,,,https://www.zhihu.com/search?q=%E5%93%88%E9%A9%AC%E6%96%AF%E7%A7%B0%E5%BA%94%E7%AB%8B%E5%8D%B3%E5%BC%80%E5%90%AF%E5%81%9C%E7%81%AB%E5%8D%8F%E8%AE%AE%E7%AC%AC%E4%BA%8C%E9%98%B6%E6%AE%B5%E8%B0%88%E5%88%A4,,
知乎热搜,2025-03-24 07:12:17,9,,「人造太阳」关键系统通过验收,,,https://www.zhihu.com/search?q=%E3%80%8C%E4%BA%BA%E9%80%A0%E5%A4%AA%E9%98%B3%E3%80%8D%E5%85%B3%E9%94%AE%E7%B3%BB%E7%BB%9F%E9%80%9A%E8%BF%87%E9%AA%8C%E6%94%B6,,
知乎热搜,2025-03-24 07:12:17,10,,下一代「人造太阳」关键系统通过验收,,,https://www.zhihu.com/search?q=%E4%B8%8B%E4%B8%80%E4%BB%A3%E3%80%8C%E4%BA%BA%E9%80%A0%E5%A4%AA%E9%98%B3%E3%80%8D%E5%85%B3%E9%94%AE%E7%B3%BB%E7%BB%9F%E9%80%9A%E8%BF%87%E9%AA%8C%E6%94%B6,,
知乎热搜,2025-03-24 07:12:17,11,,库里正式达成25000分里程碑,,,https://www.zhihu.com/search?q=%E5%BA%93%E9%87%8C%E6%AD%A3%E5%BC%8F%E8%BE%BE%E6%88%9025000%E5%88%86%E9%87%8C%E7%A8%8B%E7%A2%91,,
知乎热搜,2025-03-24 07:12:17,12,,国际乒联公布徐克与女运动员聊天记录,,,https://www.zhihu.com/search?q=%E5%9B%BD%E9%99%85%E4%B9%92%E8%81%94%E5%85%AC%E5%B8%83%E5%BE%90%E5%85%8B%E4%B8%8E%E5%A5%B3%E8%BF%90%E5%8A%A8%E5%91%98%E8%81%8A%E5%A4%A9%E8%AE%B0%E5%BD%95,,
知乎热搜,2025-03-24 07:12:17,13,,我国成功发射通信技术试验卫星十五号,,,https://www.zhihu.com/search?q=%E6%88%91%E5%9B%BD%E6%88%90%E5%8A%9F%E5%8F%91%E5%B0%84%E9%80%9A%E4%BF%A1%E6%8A%80%E6%9C%AF%E8%AF%95%E9%AA%8C%E5%8D%AB%E6%98%9F%E5%8D%81%E4%BA%94%E5%8F%B7,,
知乎热搜,2025-03-24 07:12:17,14,,零跑B10预售,,,https://www.zhihu.com/search?q=%E9%9B%B6%E8%B7%91B10%E9%A2%84%E5%94%AE,,
知乎热搜,2025-03-24 07:12:17,15,,合肥成为我国第 18 座千万人口之城,,,https://www.zhihu.com/search?q=%E5%90%88%E8%82%A5%E6%88%90%E4%B8%BA%E6%88%91%E5%9B%BD%E7%AC%AC%2018%20%E5%BA%A7%E5%8D%83%E4%B8%87%E4%BA%BA%E5%8F%A3%E4%B9%8B%E5%9F%8E,,
知乎热搜,2025-03-24 07:12:17,16,,安徽人口数出炉,,,https://www.zhihu.com/search?q=%E5%AE%89%E5%BE%BD%E4%BA%BA%E5%8F%A3%E6%95%B0%E5%87%BA%E7%82%89,,
知乎热搜,2025-03-24 07:12:17,17,,哪咤2票房破149亿,,,https://www.zhihu.com/search?q=%E5%93%AA%E5%92%A42%E7%A5%A8%E6%88%BF%E7%A0%B4149%E4%BA%BF,,
知乎热搜,2025-03-24 07:12:17,18,,马斯克发现美政府数千亿美元虚假合同,,,https://www.zhihu.com/search?q=%E9%A9%AC%E6%96%AF%E5%85%8B%E5%8F%91%E7%8E%B0%E7%BE%8E%E6%94%BF%E5%BA%9C%E6%95%B0%E5%8D%83%E4%BA%BF%E7%BE%8E%E5%85%83%E8%99%9A%E5%81%87%E5%90%88%E5%90%8C,,
知乎热搜,2025-03-24 07:12:17,19,,伊朗称废除核计划谈判不会发生,,,https://www.zhihu.com/search?q=%E4%BC%8A%E6%9C%97%E7%A7%B0%E5%BA%9F%E9%99%A4%E6%A0%B8%E8%AE%A1%E5%88%92%E8%B0%88%E5%88%A4%E4%B8%8D%E4%BC%9A%E5%8F%91%E7%94%9F,,
知乎热搜,2025-03-24 07:12:17,20,,富埃戈火山喷发,,,https://www.zhihu.com/search?q=%E5%AF%8C%E5%9F%83%E6%88%88%E7%81%AB%E5%B1%B1%E5%96%B7%E5%8F%91,,
知乎热搜,2025-03-24 07:12:17,21,,乒乓球女乒蒯曼晋级,,,https://www.zhihu.com/search?q=%E4%B9%92%E4%B9%93%E7%90%83%E5%A5%B3%E4%B9%92%E8%92%AF%E6%9B%BC%E6%99%8B%E7%BA%A7,,
知乎热搜,2025-03-24 07:12:17,22,,哪咤2登陆英国,,,https://www.zhihu.com/search?q=%E5%93%AA%E5%92%A42%E7%99%BB%E9%99%86%E8%8B%B1%E5%9B%BD,,
知乎热搜,2025-03-24 07:12:17,23,,新能源汽车产销及出口增长均超50%,,,https://www.zhihu.com/search?q=%E6%96%B0%E8%83%BD%E6%BA%90%E6%B1%BD%E8%BD%A6%E4%BA%A7%E9%94%80%E5%8F%8A%E5%87%BA%E5%8F%A3%E5%A2%9E%E9%95%BF%E5%9D%87%E8%B6%8550%25,,
知乎热搜,2025-03-24 07:12:17,24,,文旅业人财两旺,,,https://www.zhihu.com/search?q=%E6%96%87%E6%97%85%E4%B8%9A%E4%BA%BA%E8%B4%A2%E4%B8%A4%E6%97%BA,,
知乎热榜,2025-03-24 07:12:17,1,15485397123,子午工程二期通过国家验收，这个工程是做什么的？有多厉害？未来将在哪些领域发挥作用？,今天（21日），面向空间天气研究的国家重大科技基础设施——子午工程二期通过国家验收，与子午工程一期组成了世界最大的空间环境地基综合监测网，这是我国建成的国际首个覆盖日地空间全圈层（太阳风-磁层-电离层-中高层大气）的综合性空间环境地基监测设施，标志着我国空间环境地基监测能力跃居世界领先地位。国家重大科技基础设施子午工程二期通过国家验收 --新闻报道-中国共产党新闻网,1304 万热度,https://www.zhihu.com/question/15485397123,https://picx.zhimg.com/80/v2-5f04167efb2f90a37a580213087afe8f_1440w.png,2025-03-21 07:38:38
知乎热榜,2025-03-24 07:12:17,2,15446816958,为什么经过315曝光华莱士几乎没影响杨铭宇黄焖鸡遭到集体抵制?,,1235 万热度,https://www.zhihu.com/question/15446816958,https://picx.zhimg.com/v2-59f34e86a087dc2c57f4099c8273790d_1440w.jpg,2025-03-20 14:42:41
知乎热榜,2025-03-24 07:12:17,3,15627778194,吴艳妮 8.01 秒打破女子60米栏全国纪录，怎样评价她的表现？,3月23日，在南京世界田联室内锦标赛女子60米栏半决赛中，中国运动员吴艳妮以8秒01的成绩再次刷新个人最好成绩，并打破尘封11年的全国纪录。 赛后，激动的吴艳妮在向全场观众致谢后，泪洒赛场。 但吴艳妮的成绩不如第二小组的第3、第4名，没能拿到决赛门票。虽然吴艳妮遗憾无缘决赛，但再次隔空击败只跑出8秒03的日本名将田中佑美。 刚刚，8.01秒！吴艳妮打破女子60米栏全国纪录！-上游新闻 汇聚向上的力量,793 万热度,https://www.zhihu.com/question/15627778194,https://pic1.zhimg.com/80/v2-7cb1a70a444aa2772de3ef6c239f9a63_1440w.webp?source=1def8aca,2025-03-23 13:20:16
知乎热榜,2025-03-24 07:12:17,4,15619242556,曝奔驰裁员 3 万人，斥巨资鼓励自愿离职，最高获赔 400 万元，怎样看这一做法？奔驰遇到了哪些问题？,"近日，据德国《Handelsblatt》报道，梅赛德斯管理层将在 4 月给所有员工发信，鼓励员工自愿离职。 据报道，奔驰管理层将在 4 月给所有员工发信，提供非常丰厚的遣散费，以鼓励员工自愿离职。对于月薪近 8 万人民币且在公司工作至少 30 年的中层经理来说，遣散费超过 400 万人民币；而对于一名 30 多岁、月薪约 4.8 万人民币的工厂工人，遣散费也略高于 80 万人民币。 奔驰首席执行官奥拉・卡列尼乌斯（Ola K ä llenius）希望这份优厚的离职补偿能够鼓励约 3 万名员工自愿离职。 相关细节已经与企业职工委员会达成了一致，埃尔贡・吕马利表示："" 如果你不想离职，那也不必离开。但如果你选择离职，就会得到一笔丰厚的补偿。"" 这种看似 "" 慷慨 "" 的做法，实际上是奔驰在困境中做出的艰难抉择。 在汽车行业加速向电动化、智能化转型的浪潮中，传统汽车巨头们面临着前所未有的挑战。 一方面在中国这个庞大的市场，奔驰汽车的销量正急剧下滑。中国电动汽车品牌凭借其在电池技术、智能驾驶等领域的优势，以及更具竞争力的价格，逐渐抢占了奔驰等传统豪华品牌的市场份额。 据相关数据显示，奔驰 2024 年其全年销量为 68.36 万辆，同比下滑 7.3%，中国成为奔驰全球降幅最大的单一市场。在新能源领域，奔驰的纯电动汽车销量仅为 18.51 万辆，同比大跌 23.1%。尽管部分核心豪华产品如长轴距 GLC SUV 和长轴距 C 级车仍保持增长，但整体下滑趋势依然明显。 另外奔驰希望通过优化员工结构，能够更加灵活地应对市场变化，加快向电动化、智能化转型的步伐。https://baijiahao.baidu.com/s?id=1827369396253978250&wfr=spider&for=pc",452 万热度,https://www.zhihu.com/question/15619242556,https://pic1.zhimg.com/80/v2-5de3316698c67f71cddcb73dc645beed_1440w.webp?source=1def8aca,2025-03-23 11:03:05
知乎热榜,2025-03-24 07:12:17,5,15578148896,石破茂与王毅会面时，背后挂着「解衣」二字，你认出来了吗？有哪些寓意？,3月21日，中共中央政治局委员、外交部长王毅在东京出席日本首相石破茂集体会见中日韩三国外长时，座位后方的墙壁上挂着一副书法作品。这幅书法作品上写的到底是什么汉字？又是什么意思呢？石破茂与王毅会面时 背后的两个汉字你会读吗？,447 万热度,https://www.zhihu.com/question/15578148896,https://pic1.zhimg.com/v2-3d9b4a5d020ad10c6d0d7987e441dbac_1440w.png,2025-03-22 14:18:12
知乎热榜,2025-03-24 07:12:17,6,15470790067,江西一县称因人口出生率下降，教师规模产生剩余，拟研究转岗分流政策，如何看待这一现象？,近日，江西省万年县政府办在“问政江西”平台答复网友关于今年是否招聘英语教师的问题时，披露了该县因人口出生率下降，科学测算出学生规模将逐年缩减、教师规模产生剩余。 万年县政府办根据县教体局调查情况回复称，“2025年万年县不会招聘英语老师，我县政府十分重视教育工作，2017年前后，政府连续出台保障措施，招聘教师以满足教育教学的需要。但近年来人口出生率严重下降（出生人口从2008年的7934人到2024年的2478人），经科学测算，截至今年，学生人数将会以年平均4000多人的规模递减，按照师生比测算，教师也要以230多名的规模产生剩余，且主要是语数英教师。” 万年县政府办表示，“为妥善应对，有效利用师资资源，我县正在未雨绸缪，科学谋划，拟着手研究制定教师转岗分流、调节教师结构性均衡方面的相关政策，对有富余的相关专业教师短期内不再考虑招聘。” 而在去年，根据万年县“五型”办消息披露，万年县根据上级教师招聘工作的要求，结合本县教育发展的实际需求，决定通过全省统一招聘的方式，补充高中教师15人。此外，为加强万年县教育人才队伍建设，提高教育教学质量，计划面向硕士及以上学位研究生引进高层次教育人才10人。 资料来源万年县：测算将年均剩余超230名教师，拟研究转岗分流政策_招聘_教育_县政府办,340 万热度,https://www.zhihu.com/question/15470790067,https://pica.zhimg.com/80/v2-00082485d80322f8372ecd61d3e84dd7_1440w.webp?source=1def8aca,2025-03-21 04:14:10
知乎热榜,2025-03-24 07:12:17,7,439647670,为何很多家庭都张贴了世界地图？,,323 万热度,https://www.zhihu.com/question/439647670,https://pic1.zhimg.com/80/v2-69ea8bafd6e39dc9e1c864eb0075bd06_720w.png,2021-01-16 06:29:29
知乎热榜,2025-03-24 07:12:17,8,3257311792,为什么有的动物用舌头喝水而不用嘴直接喝？,是它们用嘴喝不了，还是因为什么？ 比如最常见的狗，就是用舌头把水卷起来喝，还有大象用鼻子喝，等等。 大象肯定是用嘴也能喝，只不过鼻子方便。那其它的动物呢？ （图片我养的守宫伸舌头舔水） ——— 11.23补充一下，看了大家的回答，好像有个很重要的点被忽视了。就是，动物用舌头卷水还是直接喝，和能不能形成负压吸上来，其实并不对立。比如可以把嘴当成一个 碗，低头，让水进到嘴里，然后咽下就行，而不是非要吸上去。此外，我也想过是不是狗的吻比较长，导致用嘴喝水容易呛鼻子，但是短吻的动物一样也有不用嘴直接盛水喝的。大象 可以用鼻子喝水是因为体内有一层结构可以把气管隔开不会呛水，应该把这个特例单算。,243 万热度,https://www.zhihu.com/question/3257311792,https://pic1.zhimg.com/80/v2-4cb1b3b65ed48a57b11bad5eb865fda4_1440w.gif,2024-11-05 14:18:29
