type,datetime,index,id,title,desc,hot,url,img,createtime
知乎热榜,2025-02-22 00:46:51,18,12748327160,美团表示将为全职及稳定兼职骑手缴纳社保，如何看待此事？,美团官方公众号发文，为积极构建和谐劳动关系，美团根据新就业形态的特点和新就业群体的实际需求，认真落实骑手权益保障，持续推进骑手社保工作。2022年7月以来，在人社部指导下，美团率先启动新就业形态人员职业伤害保障试点，已出资14亿为7个试点省市的全量骑手缴纳职业伤害保费，未来将进一步覆盖所有省市所有骑手。去年以来，美团就骑手缴纳养老保险等社保方案做了认真研究，选择了不同区域不同城市进行深入调研，并在有关部门的指导下形成了初步试点方案，目前正在搭建骑手社保相关的信息系统，预计2025年二季度开始实施，逐步为全职及稳定兼职骑手缴纳社保。美团：将为全职及稳定兼职骑手缴纳社保 | 每经网,23 万热度,https://www.zhihu.com/question/12748327160,https://picx.zhimg.com/50/v2-0995d98a77dfb245d2350491f060d13f_b.jpg,2025-02-19 14:11:18
知乎热榜,2025-02-22 00:46:51,19,12593006245,为什么西方在公元前300就拥有了《几何原本》这本数学瑰宝，但直到1582年才拥有了一个像样的历法？,2.20根据当前回答的总结 1.当前回答的公共性问题就是都在输出观点，而没有史实论证。 2.两个回答给了喜帕恰斯的史实证据，但这是个无效证据，因为喜帕恰斯是靠纯观测与相关历史记载推算的太阳回归年，并没有用到几何原本的数学知识，所以所答非所问。 3.当前答主们对于历法的定义与概念是相对模糊的。不明白回归年精度的意义，不清楚什么叫像样的历法，不了解天文观测与历法的区别。 打个比方一个人观测到某一天太阳中午的高度角是一年中最高的，方尖碑的影子最短，好的这天就是夏至，这叫天文观测。 而历法是我看日历就知道哪天是夏至（比如日历标注6月21日夏至）。但儒略历的问题是每使用大约400年左右就有3天误差，那历法上写的夏至日也就和真正的夏至日差了三天了。这严格上来讲就算不上是像样的历法了，因为失去了看日历知天象的功能。 希望新的回答有更深入的见解。 2.19细化问题描述。 看了几篇回答好像都没有get到问题的要点。我用deepseek将问题描述更加具体些。 问deepseek： 假设你是一位公元前50年的古罗马的数学家，天文学家，你熟练掌握《几何原本》中全部数学知识，以及拥有50年时长的立杆观影记录。现在请你根据以上数据创造历法，请问你如何做可以提高历法经度，请写明你的工作记录以及所应用到的数学知识出处和最终你算的一个回归年的时间长度。 答案见截图 通过以上deepseek的推导步骤，西方古人完全可以根据几何原本的数学知识创造一个非常精确的历法。但究竟是和原因他们没有创造出来呢？ 目前回答里有说什么他们不需要，这就好比一个饿了三天的人，眼前有一盘宫保鸡丁和一盘生鸡肉，他不吃宫保鸡丁，反而吃生鸡肉，我问为什么？然后你回答他不饿。这种单纯的观点就不要写了。谢谢,23 万热度,https://www.zhihu.com/question/12593006245,https://picx.zhimg.com/80/v2-9cbc812e816f2ac38dcfbe4cda518b7b_1440w.webp?source=1def8aca,2025-02-18 05:26:12
知乎热榜,2025-02-22 00:46:51,20,12888202283,2 月 21 日A股两市成交额超2万亿，恒生科技指数涨超 6%，阿里巴巴涨超14%，如何看待市场行情？,恒生科技指数涨6.53% 阿里巴巴涨超14% 2月21日，香港恒生指数收涨3.99%，恒生科技指数涨6.53%。中兴通讯涨超17%，哔哩哔哩涨超16%，中国联通、联想集团涨超15%，阿里巴巴涨超14%，中国电信涨超12%，中芯国际涨超7%，腾讯控股涨超6%。 收评：科创50指数大涨5.97%创近2年新高 两市成交额超2万亿 2月21日，市场全天震荡走高，创业板指领涨，科创50指数涨近6%，创2023年4月26日以来新高。沪深两市全天成交额2.19万亿，较上个交易日放量4360亿，自2024年12月13日以来再度突破2万亿。盘面上，市场热点集中在算力、芯片等方向，个股涨多跌少，全市场超2800只个股上涨，逾150股涨停或涨超10%。从板块来看，算力概念股再度爆发，光环新网等30余股涨停。国资云概念股震荡走强，中国联通、中国电信双双涨停。芯片股表现活跃，寒武纪涨停。机器人概念股维持强势，中大力德等多股续创历史新高。板块方面，液冷服务器、国资云、算力、半导体等板块涨幅居前，贵金属、银行、服装、中药等板块跌幅居前。截至收盘，沪指涨0.85%，深成指涨1.82%，创业板指涨2.51%。 道指跌超450点，中概指数涨1.6%；以色列发生空巴士爆炸事件；央行：落实落细金融支持民营经济25条各项举措；华为“黑科技”曝光丨每经早参 | 每经网,23 万热度,https://www.zhihu.com/question/12888202283,https://pic1.zhimg.com/80/v2-39b0880b97ab4aae4750f1ec9a5dcd80_1440w.png,2025-02-21 01:25:51
知乎热榜,2025-02-22 00:46:51,21,12817892568,京东、美团相继为骑手缴社保，外卖行业用工规范会收紧吗？未来骑手会从「灵活就业」走向「正式雇佣」模式吗？,在京东宣布给外卖小哥缴纳“五险一金”几小时后，美团火速跟进。 19日晚间，美团官方公众号发文，为积极构建和谐劳动关系，美团根据新就业形态的特点和新就业群体的实际需求，认真落实骑手权益保障，持续推进骑手社保工作，目前正在搭建骑手社保相关的信息系统，预计2025年二季度开始实施，逐步为全职及稳定兼职骑手缴纳社保。 美团提到2022年7月以来，在人社部指导下，美团率先启动新就业形态人员职业伤害保障试点，已出资14亿为7个试点省市的全量骑手缴纳职业伤害保费，未来将进一步覆盖所有省市所有骑手。去年以来，美团就骑手缴纳养老保险等社保方案做了认真研究，选择了不同区域不同城市进行深入调研，并在有关部门的指导下形成了初步试点方案。 不过美团起了大早赶了晚集。 19日上午，京东宣布，自2025年3月1日起，京东将逐步为京东外卖全职骑手缴纳五险一金，为兼职骑手提供意外险和健康医疗险。继给快递小哥缴纳五险一金后，京东再次成为首个为外卖骑手缴纳五险一金的平台。京东愿与社会各界共同推动、不断完善外卖骑手权益保障。 外卖卷起来了！京东“奇袭”，为外卖骑手缴纳五险一金！几小时后美团选择跟进，为骑手提供社保,23 万热度,https://www.zhihu.com/question/12817892568,,2025-02-20 07:32:59
知乎热榜,2025-02-22 00:46:51,22,12636871054,DeepSeek 思维链展示的是真实思考过程吗？还是为了更像人类思维而展示的呢？,,23 万热度,https://www.zhihu.com/question/12636871054,,2025-02-18 13:07:29
知乎热榜,2025-02-22 00:46:51,23,11925817910,胖东来将开「网课」分享工作方法和生活方法，你如何看待「胖东来」模式的推广？企业复制这种模式难吗？,2月11日，胖东来创始人于东来在个人账号连发三条信息，公布2025年企业帮扶等一系列计划，包括安排网上课堂、计划成立中国梦践行联盟企业群体等。于东来发文称，今年胖东来也会安排网上课堂，逐步分享胖东来的工作方法和生活方法，满足中小企业个体经营者学习的需求。详见：于东来最新发声：胖东来网上课堂即将开课，尝试吸收少许企业成为学员 - 21财经,23 万热度,https://www.zhihu.com/question/11925817910,,2025-02-11 09:06:12
知乎热榜,2025-02-22 00:46:51,24,11740653238,哪吒与漫威超级英雄（如蜘蛛侠）对比，谁的战力更强？,,23 万热度,https://www.zhihu.com/question/11740653238,https://picx.zhimg.com/70/v2-3893a6b004f9db31207df76bcb1093fc_1440w.avis?source=172ae18b&biz_tag=Post,2025-02-09 10:35:57
知乎热榜,2025-02-22 00:46:51,25,576408832,三国里面的张角真的是为了百姓着想还是为了自己的野心？,,23 万热度,https://www.zhihu.com/question/576408832,https://pica.zhimg.com/80/v2-5693792f20449308c0ad337006337b0d_1440w.png,2023-01-03 00:03:01
知乎热榜,2025-02-22 00:46:51,26,661473641,健身房的私教课真的有用吗？,,22 万热度,https://www.zhihu.com/question/661473641,https://pic3.zhimg.com/50/v2-00ad4d35a525ccff8d8a764705e9806c_b.jpg,2024-07-12 22:06:27
知乎热榜,2025-02-22 00:46:51,27,12854488855,江苏发布 15 条生育支持措施，生育一孩也将享 50% 社保补贴，还有哪些内容值得关注？,《若干措施》立足群众需求，坚持问题导向，注重务实创新，提出了一揽子政策措施，主要包括强化生育服务支持，加强育幼服务体系建设，强化教育、住房、就业等支持措施，营造生育友好社会氛围等四个方面15条。希望通过这些政策措施的实施，让群众生育养育安心贴心，让生育友好可感可及，努力托起万千家庭稳稳的幸福。 第一、强化生育服务支持。从我们去年开展的育龄群众生育支持政策需求调查看，群众最期盼的是生育补贴、生育服务、假期保障等政策。《若干措施》积极回应群众关切，提出了针对性支持政策举措，为生育减负、为生活提质。 一是进一步减轻家庭经济负担。一方面，加强生育医疗费用保障。强调扩大生育保险覆盖面，减轻生育医疗费用负担。如，全面落实失业女职工生育保险参保及生育津贴待遇政策。根据新修订的《江苏省失业保险规定》，今年3月1日起，对女性失业人员在领取失业保险金期间生育的，一次性加发3个月的失业保险金。 我们将推动落实好这项政策。再如，落实分娩镇痛、辅助生殖技术和无创产前基因诊断服务纳入医保支付政策。去年7月1日起，我省已将13个辅助生殖类医疗服务和分娩镇痛等项目纳入医保基金支付范围。 下一步，我省将进一步优化完善医保和生育保险相关政策，有效减轻家庭生育负担。同时，推进生育津贴免申即享。另一方面，落实好生育补贴制度。前期我省个别县区已经探索实施了生育奖励政策，对生育二孩、三孩的家庭给予生育奖励和育儿奖励。 我们将在落实好国家生育补贴制度的基础上，鼓励有条件的地方对生育二孩、三孩的家庭加大补贴力度。 二是完善生育休假制度。包括优化生育假期成本共担机制，将企业支付女职工产假期间的社会保险费用补贴标准，在现行的对生育二孩、三孩补贴基础上，扩大到对生育一孩的给予50%的补贴。强调严格落实产假、延长产假、男方护理假、哺乳假、育儿假等制度及相关待遇。 三是优化生殖健康服务。继续深入实施母婴安全行动和出生缺陷防治能力2个提升计划，进一步提高母婴安全保障水平；加强生育友好医院建设，增加高品质、普惠型产科床位设置，做优生育医疗保健服务，持续提升群众生育服务体验。开展青少年性与生殖健康促进行动，实施女性生殖健康促进项目。关于生育、产假、托育…江苏重磅发布！,22 万热度,https://www.zhihu.com/question/12854488855,https://picx.zhimg.com/80/v2-7e514449f656564479af0162d19e04e2_1440w.png,2025-02-20 14:13:29
知乎热榜,2025-02-22 00:46:51,28,12788004521,创业需要解决的核心问题是什么？,做自由职业或者小本买卖或者轻资产创业。最需要什么样的硬性条件及心理建设。才能稳打稳扎的走下去。,22 万热度,https://www.zhihu.com/question/12788004521,,2025-02-20 02:28:55
知乎热榜,2025-02-22 00:46:51,29,12880896074,34 岁女子坐 8 小时高铁后诱发肺栓塞，心脏骤停 2 次，久坐为何会诱发肺栓塞？哪些人容易中招？,2月20日，34岁的广州街坊李小姐（化姓）即将办理出院，让所有牵挂她的人终于长舒一口气。让她经历了两次心脏骤停、住了10天ICU、生命危在旦夕的祸首竟然是因在高铁上久坐8小时，引起了致命性肺栓塞。 50分钟内，2次心脏骤停！ 2月4日，春节假期最后一天，李小姐在从四川旅游结束后，踏上了返回广州的高铁，旅途中的8个小时她没怎么活动。 当天20时许，高铁到达广州南站，李小姐起身后不久，突然出现剧烈胸痛、上腹痛，并一度晕厥。她的丈夫立即呼叫120。医护人员迅速赶到现场，发现她面色紫绀，指脉氧饱和度仅为70%（正常值为95%～100%），情况十分危急，便将李小姐转运至祈福医院。 然而，死神并未给医护人员太多时间。在转运过程中，李小姐的心跳和呼吸突然停止！医护人员立即进行持续心脏胸外按压，争分夺秒地将李小姐送往急诊科。 20点40分，李小姐被推入急诊科，此时她已无自主心跳和呼吸，全身皮肤冰冷，面唇紫绀，双侧瞳孔对光反射消失，生命体征消失。急诊科副主任医师赖幸桦立即开通危重症救治绿色通道，组织医护接手进行高质量心肺复苏，并进行气管插管和呼吸机机械通气，静脉用药抢救治疗。经过14分钟的紧张抢救，李小姐于20点54分恢复自主心律，血氧饱和度升至88%。 然而，死神并未轻易退却。21点12分，李小姐的心跳再次停止！医护人员毫不迟疑，再次进行心脏胸外按压及药物复苏，并请ICU、心内科、呼吸内科相关专科专家联合会诊。6分钟后，李小姐成功恢复自主心律且维持稳定。随后，她被护送至放射科进行肺动脉CTA等检查，明确诊断为高危急性肺栓塞。 赖幸桦表示：“肺栓塞是一种极其凶险的疾病，死亡率极高。急诊科的抢救只是第一步，后续在ICU治疗才是真正的考验。” 生死一线的肺栓塞抢救 检查结果显示，李小姐双肺存在大面积肺栓塞，情况不容乐观。ICU主任刘云松和主治医师马雪琪立即制定了溶栓治疗和后备方案。 马雪琪回忆道：“李小姐转入ICU时仍处于深昏迷状态，GCS评分仅为3分（意识状态最差评分），我们立即给予呼吸循环支持和脑保护治疗，并随即进行溶栓治疗。溶栓是针对肺栓塞的关键治疗手段，通过将溶栓药物注入体内，溶解堵塞肺动脉的血栓，恢复肺部血流，从而缓解急性缺氧状态，减轻右心负担。通过溶栓治疗，李小姐的氧合情况和循环状态逐渐改善。” 除了溶栓治疗，器官支持也是治疗的重要措施。马雪琪补充道：“李小姐因长时间缺氧，身体多个器官功能受到严重影响，尤其是肺部和心脏。团队的医护人员通过呼吸机机械通气，维持患者的呼吸功能，确保充足的氧气供应；通过药物调节，维持血压稳定，保障重要器官的血液灌注。同时，我们还进行了24小时不间断的监测和护理，随时应对可能出现的并发症。” 经过ICU团队的精心治疗和护理，李小姐的病情逐渐稳定，各项生命体征趋于正常，最终成功脱离生命危险。 数据显示，2024年我国全年客运量高达645亿人次，其中铁路旅客发送量达到43.12亿人次，同比增长11.9%。铁路运输，尤其是高铁，其便捷性和高效性成为人们出行的首选。然而，长时间乘坐交通工具并久坐不动，会显著增加肺栓塞的风险。据马雪琪介绍，血栓通常起源于下肢深静脉，久坐会导致血液循环减慢，从而增加血栓形成的风险。李小姐的经历就是一个典型的警示案例。 马雪琪特别提醒：“预防肺栓塞的关键在于避免长时间不动。对于长途出行的旅客，建议每隔1-2小时起身活动，哪怕是简单的伸展运动或在车厢内走动几分钟，都能有效促进血液循环。特别是有静脉曲张、肥胖、吸烟等高危因素的人群，更应格外注意。” 此外，马雪琪还建议，在长途旅行中多喝水，保持身体水分充足，避免血液黏稠度过高。同时，穿着舒适的衣物和鞋子，避免过紧的束缚，以免影响血液循环。 肺栓塞的早期症状可能不明显，长时间坐车后，一旦出现胸痛、呼吸困难、晕厥等症状，应立即就医。马雪琪强调：“早期诊断和治疗是挽救生命的关键。每一分钟都可能决定生死！”,21 万热度,https://www.zhihu.com/question/12880896074,https://picx.zhimg.com/80/v2-9e68ca1e04521ac37f2410b3eb9c0ee3_1440w.webp?source=1def8aca,2025-02-20 23:58:07
知乎热榜,2025-02-22 00:46:51,30,12951226969,欧冠 1/8 决赛抽签出炉，马德里德比上演，利物浦对阵巴黎，拜仁药厂内战，你看好谁能晋级？,直播吧02月21日讯 2024/25赛季欧冠淘汰赛抽签结果已经出炉，皇马与马竞上演马德里德比，拜仁与药厂将本赛季第4次交手，巴黎抽到利物浦。1/8决赛捉对厮杀，争夺8个晋级名额。 欧冠1/8决赛对阵：（种子队在后，先客后主） 上半区： 埃因霍温（荷甲）vs阿森纳（英超） 皇家马德里（西甲）vs马德里竞技（西甲） 巴黎圣日耳曼（法甲）vs利物浦（英超） 布鲁日（比甲）vs阿斯顿维拉（英超） 下半区： 本菲卡（葡超）vs巴塞罗那（西甲） 多特蒙德(德甲）vs里尔（法甲） 拜仁慕尼黑（德甲）vs勒沃库森（德甲） 费耶诺德（荷甲）vs国际米兰（意甲）欧冠1/8决赛：皇马vs马竞德比战、巴黎碰利物浦、拜仁药厂内战-直播吧,21 万热度,https://www.zhihu.com/question/12951226969,https://pica.zhimg.com/50/v2-044c37e21e0f6b6a0f45b35624353d8e_b.jpg,2025-02-21 12:25:51
