type,datetime,index,id,title,desc,hot,url,img,createtime
知乎热榜,2025-04-29 09:13:59,15,1897235336293225701,中国大型水陆两栖飞机「鲲龙」AG600 历经十二年攻坚终「取证」，可用于灭火及救援，具有哪些意义？,我国首次按照中国民航适航规章完全自主研制的大型水陆两栖灭火飞机“鲲龙”AG600在京获颁中国民航局型号合格证，证明了其设计符合适航标准，标志着AG600飞机研制取得圆满成功，获得了进入市场的“准入证”。 AG600飞机是为满足我国应急救援体系和国家自然灾害防治体系建设迫切需要而研制的重大航空装备，是全球起飞重量最大的民用水陆两栖飞机。它同时具备飞机和船的特征，能上天、能入海，最大起飞重量60吨，可载水12吨，最小平飞速度每小时220千米，最大实用航程达到4500千米，可以灵活执行灭火、物资转送、通信中继等多种任务，是一个多用途的大型航空装备平台。 AG600飞机2012年提出型号合格证（TC）申请，2016年总装下线，2017年在珠海陆上首飞，2018年在湖北荆门水上首飞，2020年在山东青岛海上首飞，2023年6月具备执行灭火任务能力，2024年7月获得首个型号检查核准书，2025年2月全面完成审定试飞。 通过AG600的研制，我国建立了大型水陆两栖飞机设计、生产制造、系统配套、试验试飞、保障服务体系，使我国具备了自主研发大型水陆两栖飞机的技术和工业能力，实现了我国民机产业发展在大型特种用途飞机领域的历史性跨越。 根据国际民用航空公约及民航法相关规定，航空器必须取得适航证才能投入运行。适航证件分为“TC”（型号合格证）、“PC”（生产许可证）和“AC”（单机适航证）。AG600此次取得的型号合格证主要用于证明航空器的设计是符合适航标准，可以理解为通过了“毕业考试”，取得了“毕业证”。 在获颁型号合格证（TC）后，AG600还需要获取生产许可证（PC）和单机适航证（AC），在交付给最终用户后还需要对用户开展人员培训、维修培训等方面的工作，确保航空器的正确使用和维护。 下一步，中国航空工业集团将瞄准满足我国应急救援体系和国家自然灾害防治体系建设迫切需要，持续推动AG600飞机系列化发展，进一步构建航空应急救援服务体系。,87 万热度,https://www.zhihu.com/question/1897235336293225701,https://pic2.zhimg.com/50/v2-f82e2c8b3f66c1699835a69475b28405_b.jpg,2025-04-20 02:29:13
知乎热榜,2025-04-29 09:13:59,16,1900156997212550309,猪猪侠正式入职京东外卖，曾因「外卖工服配色撞衫猪猪侠」引关注，你觉得双方合作将带来哪些新体验？,4 月 28 日，京东外卖官宣与动画 IP 猪猪侠联动，猪猪侠 GG Bond 正式入职京东外卖。 曾因“外卖工服配色撞衫猪猪侠”引关注，京东外卖晒出猪猪侠入职申请表_腾讯新闻,83 万热度,https://www.zhihu.com/question/1900156997212550309,https://pic1.zhimg.com/80/v2-4582eb04ba6e2ae079f4d6ca17b5931f_1440w.png,2025-04-28 03:58:51
知乎热榜,2025-04-29 09:13:59,17,1900072381575325188,东风日产N7爆单，订单破10000 台，为什么N7会大卖？应该以什么心态看合资新能源车型的爆单？,东风日产N7于2025年4月27日正式上市后迅速引发市场热捧，订单量突破1万台，成为合资品牌新能源车型的现象级爆款 N7定位超舒适中高级纯电轿车，空间宽敞，设计简约，超舒适四件套，直接把客厅搬进车里，简直家用车天花板。,82 万热度,https://www.zhihu.com/question/1900072381575325188,https://pic4.zhimg.com/50/v2-4db604c62caf087672296b501e080037_b.jpg,2025-04-27 22:22:37
知乎热榜,2025-04-29 09:13:59,18,1898763060996466675,灰鹦鹉爆粗口三年未改，园方称形成习惯后只能慢慢调整，难矫正的原因在哪？ 有更好的办法吗？,近日，有游客发视频显示，在云南野生动物园，一名游客对一只灰鹦鹉打招呼，遭这只灰鹦鹉（下称“小灰”）脏话“回敬”。 早在2022年8月，“小灰”因模仿人类说脏话意外走红，园方曾公开表示已对其进行“矫正教育”。但如今三年过去，网友发出疑问“不是早就被教育过了吗”。 4月23日，云南野生动物园一名工作人员对此事回应称：“‘小灰’已形成固定语言模式，我们也在持续引导，目前只能是慢慢调整。”云南野生动物园一只灰鹦鹉爆粗口三年未改？园方回应：已形成固定语言,81 万热度,https://www.zhihu.com/question/1898763060996466675,https://pic1.zhimg.com/50/v2-621ca9e3acc8df3db3d4daa6671306eb_720w.webp?source=1def8aca,2025-04-24 07:39:51
知乎热榜,2025-04-29 09:13:59,19,307464793,有什么你先想好的创意，后来发现其实早就有人发明出来了？,高二上期，学电磁，我想到了用通电导线的磁场测电流这个想法，后来我发现有磁电式电流表这货,80 万热度,https://www.zhihu.com/question/307464793,https://pic3.zhimg.com/v2-303f8cd07c01b70567b483dc9593dd36_1440w.jpg,2018-12-30 08:44:47
知乎热榜,2025-04-29 09:13:59,20,341251599,为什么《火影忍者》团藏不跟纲手争夺第五代火影？,三代凉后，不是团藏当火影的最佳时机吗？,73 万热度,https://www.zhihu.com/question/341251599,https://pica.zhimg.com/50/v2-6a7e9648e717692f82f57f76def4eeb6_b.jpg,2019-08-18 10:07:15
知乎热榜,2025-04-29 09:13:59,21,1900490775093055649,如何评价最新发布的 iQOO Z10 Turbo 系列，都有哪些亮点值得关注？,4 月 28 日，iQOO Z10 Turbo 系列正式发布，首批搭载第四代骁龙 8s ，叠加自研电竞芯片 Q1 ，还有 120W+7000mAh 闪充续航组合。你觉得都有哪些值得关注的亮点？,70 万热度,https://www.zhihu.com/question/1900490775093055649,https://pic1.zhimg.com/50/v2-e43be8154eef401836e91853e3429010_b.jpg,2025-04-29 02:05:10
知乎热榜,2025-04-29 09:13:59,22,1897674410502086817,中国试点支持外籍医生开设诊所，对外籍医生有哪些要求？对医疗行业会有哪些影响？,《加快推进服务业扩大开放综合试点工作方案》提出，在医疗领域，支持外籍医生开设诊所；境外医疗专业技术人员短期执业；支持开办外资护理学院；允许以捐资方式举办非营利性医疗机构、养老机构；支持建设基因与细胞治疗专利专题数据库；探索优化罕见病药品进口抽检模式等。中国试点支持外籍医生开设诊所,70 万热度,https://www.zhihu.com/question/1897674410502086817,https://pica.zhimg.com/80/v2-f65aeca971802f0ef2b7fc3674c9c601_1440w.jpg,2025-04-21 07:33:56
知乎热榜,2025-04-29 09:13:59,23,13236001805,山西搞文旅能不能成？如果不行，山西的出路在哪里？,文旅产业就算做起来，农民能跟着致富吗？,70 万热度,https://www.zhihu.com/question/13236001805,,2025-02-24 10:34:36
知乎热榜,2025-04-29 09:13:59,24,1897312268926021661,肥胖或取代吸烟成为第一致癌因素，肥胖会带来哪些癌症风险？怎样合理控制体重？,国际癌症研究机构明确指出，肥胖至少与13种癌症风险相关。有专家认为，肥胖将可能取代吸烟，成为癌症最大的可干预的危险因素。肥胖或取代吸烟成为第一致癌因素,69 万热度,https://www.zhihu.com/question/1897312268926021661,https://picx.zhimg.com/80/v2-4e6ecc7993bda7d3e1533d782e15a636_1440w.webp?source=1def8aca,2025-04-20 07:34:55
知乎热榜,2025-04-29 09:13:59,25,1900203461963904331,什么是协和「4+4」学制？这种学制有哪些优势和问题？,,69 万热度,https://www.zhihu.com/question/1900203461963904331,https://pic1.zhimg.com/80/v2-df54af0d43d8cdb5cedc98b6a8215de3_1440w.jpg,2025-04-28 07:03:29
知乎热榜,2025-04-29 09:13:59,26,1900480048840025235,2025 空调巨头接连布局 AI，为什么只有美的被用户买单？,当科技品牌开始押注 AI 赛道，美的空调为何凭搭载大模型、AI 无风感、AI 省电、健康管理的产品突围？,69 万热度,https://www.zhihu.com/question/1900480048840025235,https://pic1.zhimg.com/50/v2-194414bbdd6a0e493605f2e09585933a_b.jpg,2025-04-29 01:22:32
知乎热榜,2025-04-29 09:13:59,27,656487946,未来长期租房生活可行吗？,我目前租的房子，一个月房租3500，房子非常不错，位置很好，装修也很好。如果要买下来需要190万，首付20%再加上各种税费，需要51.4万，每个月还贷款7034元。 我以后不打算要孩子，不用考虑小孩上学等问题。工作在体制内，公积金目前可以覆盖房租。 我想法是租房生活40年，家里准备的首付存起来对抗家人生病等各种风险。退休后回到老家盖一栋房子住或者全国各地旅居。 请问大家这种想法有什么风险？ 如果有风险有没有除了买房以外的化解风险的办法？,67 万热度,https://www.zhihu.com/question/656487946,,2024-05-19 04:09:05
知乎热榜,2025-04-29 09:13:59,28,1899513047774627533,看到被裁员的同学领了大礼包可以出国旅游一段时间再找下家还涨薪十分眼馋，该怎么调教内心呢？,前几年很多身边的同学领了大礼包毕业了，还赚了一大波舆论的同情，情绪价值拉满。结果他们领了几十万的大礼包可以轻松几个月去日本欧美各种玩，然后直接去下家还涨薪。自己思考了一下虽然自己主动离职去下家也能涨薪，但是血亏了几十万的大礼包啊，而且被公司裁了可以道德绑架站在舆论制高点，主动离职期权也不保了，而且有种辜负前司的感觉。今年hc大大扩增，而且公司营业额暴涨大概率不会大规模裁员了，真的很羡慕前两年被裁员的同学，前两年被裁员的同学是真真正正的吃到了时代的红利，该怎么调教内心呢？,66 万热度,https://www.zhihu.com/question/1899513047774627533,https://pic4.zhimg.com/50/v2-14e3e445c7743fe17923a15e3658a555_b.jpg,2025-04-26 09:20:01
知乎热榜,2025-04-29 09:13:59,29,370388031,为什么我完全get不到克苏鲁神话恐怖的点？,不仅get不到恐怖的点，甚至觉得有点神秘的美，偶尔有时会想笑...,66 万热度,https://www.zhihu.com/question/370388031,https://pic1.zhimg.com/50/v2-e9da3a50bf5179c86fd90600f0fee5ea_b.jpg,2020-02-07 17:16:32
知乎热榜,2025-04-29 09:13:59,30,11989316509,电视剧《大明王朝 1566》中，裕王李妃献给嘉靖的那本《血经》究竟是怎么来的？,按照剧情，这本血经应该是沈一石临死前留给芸娘救命之物。可是，沈一石又是从何处得到这本书的？,59 万热度,https://www.zhihu.com/question/11989316509,https://pic4.zhimg.com/50/v2-665114be73e036d3c233e4429b996a35_b.jpg,2025-02-12 03:07:34
知乎热搜,2025-04-29 10:14:01,1,,工业企业利润由降转增,,,https://www.zhihu.com/search?q=%E5%B7%A5%E4%B8%9A%E4%BC%81%E4%B8%9A%E5%88%A9%E6%B6%A6%E7%94%B1%E9%99%8D%E8%BD%AC%E5%A2%9E,,
知乎热搜,2025-04-29 10:14:01,2,,降维打击到底有多恐怖,,,https://www.zhihu.com/search?q=%E9%99%8D%E7%BB%B4%E6%89%93%E5%87%BB%E5%88%B0%E5%BA%95%E6%9C%89%E5%A4%9A%E6%81%90%E6%80%96,,
知乎热搜,2025-04-29 10:14:01,3,,苹果 C 口和安卓 C 口有什么区别,,,https://www.zhihu.com/search?q=%E8%8B%B9%E6%9E%9C%20C%20%E5%8F%A3%E5%92%8C%E5%AE%89%E5%8D%93%20C%20%E5%8F%A3%E6%9C%89%E4%BB%80%E4%B9%88%E5%8C%BA%E5%88%AB,,
知乎热搜,2025-04-29 10:14:01,4,,潘凤是怎么混成大将的,,,https://www.zhihu.com/search?q=%E6%BD%98%E5%87%A4%E6%98%AF%E6%80%8E%E4%B9%88%E6%B7%B7%E6%88%90%E5%A4%A7%E5%B0%86%E7%9A%84,,
知乎热搜,2025-04-29 10:14:01,5,,为什么贾玲突然消失了,,,https://www.zhihu.com/search?q=%E4%B8%BA%E4%BB%80%E4%B9%88%E8%B4%BE%E7%8E%B2%E7%AA%81%E7%84%B6%E6%B6%88%E5%A4%B1%E4%BA%86,,
知乎热搜,2025-04-29 10:14:01,6,,王者荣耀崩了,,,https://www.zhihu.com/search?q=%E7%8E%8B%E8%80%85%E8%8D%A3%E8%80%80%E5%B4%A9%E4%BA%86,,
知乎热搜,2025-04-29 10:14:01,7,,知乎旧物节,,,https://www.zhihu.com/search?q=%E7%9F%A5%E4%B9%8E%E6%97%A7%E7%89%A9%E8%8A%82,,
知乎热搜,2025-04-29 10:14:01,8,,寻找穿越时光的旧物,,,https://www.zhihu.com/search?q=%E5%AF%BB%E6%89%BE%E7%A9%BF%E8%B6%8A%E6%97%B6%E5%85%89%E7%9A%84%E6%97%A7%E7%89%A9,,
知乎热搜,2025-04-29 10:14:01,9,,哪件旧物是你一直保留着的,,,https://www.zhihu.com/search?q=%E5%93%AA%E4%BB%B6%E6%97%A7%E7%89%A9%E6%98%AF%E4%BD%A0%E4%B8%80%E7%9B%B4%E4%BF%9D%E7%95%99%E7%9D%80%E7%9A%84,,
知乎热搜,2025-04-29 10:14:01,10,,穿越时光的旧物,,,https://www.zhihu.com/search?q=%E7%A9%BF%E8%B6%8A%E6%97%B6%E5%85%89%E7%9A%84%E6%97%A7%E7%89%A9,,
知乎热搜,2025-04-29 10:14:01,11,,神舟二十号载人飞船发射升空,,,https://www.zhihu.com/search?q=%E7%A5%9E%E8%88%9F%E4%BA%8C%E5%8D%81%E5%8F%B7%E8%BD%BD%E4%BA%BA%E9%A3%9E%E8%88%B9%E5%8F%91%E5%B0%84%E5%8D%87%E7%A9%BA,,
知乎热搜,2025-04-29 10:14:01,12,,神二十发射取得圆满成功,,,https://www.zhihu.com/search?q=%E7%A5%9E%E4%BA%8C%E5%8D%81%E5%8F%91%E5%B0%84%E5%8F%96%E5%BE%97%E5%9C%86%E6%BB%A1%E6%88%90%E5%8A%9F,,
知乎热搜,2025-04-29 10:14:01,13,,神舟二十号航天员乘组顺利入驻「天宫」,,,https://www.zhihu.com/search?q=%E7%A5%9E%E8%88%9F%E4%BA%8C%E5%8D%81%E5%8F%B7%E8%88%AA%E5%A4%A9%E5%91%98%E4%B9%98%E7%BB%84%E9%A1%BA%E5%88%A9%E5%85%A5%E9%A9%BB%E3%80%8C%E5%A4%A9%E5%AE%AB%E3%80%8D,,
知乎热搜,2025-04-29 10:14:01,14,,网传腾讯音乐拟收购喜马拉雅,,,https://www.zhihu.com/search?q=%E7%BD%91%E4%BC%A0%E8%85%BE%E8%AE%AF%E9%9F%B3%E4%B9%90%E6%8B%9F%E6%94%B6%E8%B4%AD%E5%96%9C%E9%A9%AC%E6%8B%89%E9%9B%85,,
知乎热搜,2025-04-29 10:14:01,15,,强基计划多所 985 取消竞赛生破格入围政策,,,https://www.zhihu.com/search?q=%E5%BC%BA%E5%9F%BA%E8%AE%A1%E5%88%92%E5%A4%9A%E6%89%80%20985%20%E5%8F%96%E6%B6%88%E7%AB%9E%E8%B5%9B%E7%94%9F%E7%A0%B4%E6%A0%BC%E5%85%A5%E5%9B%B4%E6%94%BF%E7%AD%96,,
知乎热搜,2025-04-29 10:14:01,16,,五一大量外国人涌入中国,,,https://www.zhihu.com/search?q=%E4%BA%94%E4%B8%80%E5%A4%A7%E9%87%8F%E5%A4%96%E5%9B%BD%E4%BA%BA%E6%B6%8C%E5%85%A5%E4%B8%AD%E5%9B%BD,,
知乎热搜,2025-04-29 10:14:01,17,,杨瀚森宣布参加NBA选秀,,,https://www.zhihu.com/search?q=%E6%9D%A8%E7%80%9A%E6%A3%AE%E5%AE%A3%E5%B8%83%E5%8F%82%E5%8A%A0NBA%E9%80%89%E7%A7%80,,
知乎热搜,2025-04-29 10:14:01,18,,巴萨3比2皇马,,,https://www.zhihu.com/search?q=%E5%B7%B4%E8%90%A83%E6%AF%942%E7%9A%87%E9%A9%AC,,
知乎热搜,2025-04-29 10:14:01,19,,网传中日友好医院外科医生出轨多人,,,https://www.zhihu.com/search?q=%E7%BD%91%E4%BC%A0%E4%B8%AD%E6%97%A5%E5%8F%8B%E5%A5%BD%E5%8C%BB%E9%99%A2%E5%A4%96%E7%A7%91%E5%8C%BB%E7%94%9F%E5%87%BA%E8%BD%A8%E5%A4%9A%E4%BA%BA,,
知乎热搜,2025-04-29 10:14:01,20,,中日友好医院肖飞,,,https://www.zhihu.com/search?q=%E4%B8%AD%E6%97%A5%E5%8F%8B%E5%A5%BD%E5%8C%BB%E9%99%A2%E8%82%96%E9%A3%9E,,
知乎热搜,2025-04-29 10:14:01,21,,湘江半马女配速员跑崩,,,https://www.zhihu.com/search?q=%E6%B9%98%E6%B1%9F%E5%8D%8A%E9%A9%AC%E5%A5%B3%E9%85%8D%E9%80%9F%E5%91%98%E8%B7%91%E5%B4%A9,,
知乎热搜,2025-04-29 10:14:01,22,,姆巴佩打进生涯首个任意球破门,,,https://www.zhihu.com/search?q=%E5%A7%86%E5%B7%B4%E4%BD%A9%E6%89%93%E8%BF%9B%E7%94%9F%E6%B6%AF%E9%A6%96%E4%B8%AA%E4%BB%BB%E6%84%8F%E7%90%83%E7%A0%B4%E9%97%A8,,
知乎热搜,2025-04-29 10:14:01,23,,饿了么将逐步取消外卖超时扣罚,,,https://www.zhihu.com/search?q=%E9%A5%BF%E4%BA%86%E4%B9%88%E5%B0%86%E9%80%90%E6%AD%A5%E5%8F%96%E6%B6%88%E5%A4%96%E5%8D%96%E8%B6%85%E6%97%B6%E6%89%A3%E7%BD%9A,,
知乎热搜,2025-04-29 10:14:01,24,,为什么李亚鹏版「笑傲江湖」评分反升,,,https://www.zhihu.com/search?q=%E4%B8%BA%E4%BB%80%E4%B9%88%E6%9D%8E%E4%BA%9A%E9%B9%8F%E7%89%88%E3%80%8C%E7%AC%91%E5%82%B2%E6%B1%9F%E6%B9%96%E3%80%8D%E8%AF%84%E5%88%86%E5%8F%8D%E5%8D%87,,
知乎热榜,2025-04-29 10:14:01,1,1900286031774843467,西班牙和葡萄牙遭遇大规模停电，交通、通信、医疗等一度瘫痪，民众疯抢物资，目前情况怎么样？为什么会停电？,4月28日，西班牙和葡萄牙遭遇大规模停电，影响超过5000万伊比利亚半岛民众，交通、通信、医疗等关键领域一度瘫痪，法国南部等周边地区也受短暂波及。截至当地时间21时左右，持续了将近10个小时的停电才开始结束，各地电力逐步恢复。但在西班牙，不少民众已经开始抢购物资。目前停电原因尚不明确。 欧盟委员会执行副主席特蕾莎·里贝拉当日对外表示，此次大停电是近年来欧洲记录到的最严重事件之一。 伊比利亚半岛陷入大瘫痪 法国南部等周边地区受波及 因遭遇大范围停电，西班牙多地通信服务中断，民众只能依靠收音机获取信息，马德里网球公开赛被迫暂停；铁路基础设施管理局称列车大范围停运，马德里部分地铁疏散人群，多条路段因交通信号灯失灵出现堵塞，机场虽启用应急电力系统，但部分航班仍延误。 △4月28日，在西班牙马德里，马德里公开赛网球比赛场馆内，观众在大停电期间闲逛。 △4月28日，西班牙马德里一地铁站空无一人。 葡萄牙方面，全国多地交通信号灯受影响，部分地区地铁暂时关闭，公共安全部门提醒公共照明或受波及。欧洲航空安全组织指出，此次停电影响了往返马德里、巴塞罗那和里斯本的航班。 接近西班牙边境的法国南部巴斯克地区也一度出现了短暂停电现象，持续数分钟后迅速恢复供电。法国电网公司证实，受影响的是与西班牙电网直接互联的地区。 此外，与西班牙和法国毗邻的安道尔公国的电力供应也一度中断，但得益于与法国电网的自动重连机制，电力供应在几秒钟内迅速恢复。 停电发生后 民众开始抢购生活物资 大范围停电让西班牙民众感到不知所措。因为不知道停电会持续多久，很多人涌向超市购买食品和饮用水。更多资讯请下载央视新闻客户端 马德里网球公开赛正在进行，但比赛却因为停电而不得不暂停。据外媒报道，整个伊比利亚半岛，包括西班牙、葡萄牙全部停电，法国部分地区也受到了影响。目前停电原因尚不清楚。离谱新闻！西班牙葡萄牙整个伊比利亚半岛停电，马德里公开赛暂停-直播吧,1093 万热度,https://www.zhihu.com/question/1900286031774843467,https://picx.zhimg.com/80/v2-239d3e2d4074dee825f9c5f960a6d23b_1440w.webp?source=1def8aca,2025-04-28 12:31:35
知乎热榜,2025-04-29 10:14:01,2,1900491722468865099,24-25赛季NBA季后赛火箭 106:109 勇士，如何评价这场比赛？,,781 万热度,https://www.zhihu.com/question/1900491722468865099,https://pic1.zhimg.com/80/v2-39b5cc00ed312d6c39065101c3f7d420_1440w.webp?source=1def8aca,2025-04-29 02:08:56
知乎热榜,2025-04-29 10:14:01,3,1900300358229652607,阿里通义千问 Qwen3 系列模型正式发布，该模型有哪些技术亮点？,4 月 29 日消息，今日凌晨，阿里巴巴发布了新一代通义千问 Qwen3 模型，一举登顶全球最强开源模型。 这是国内首个“混合推理模型”，将“快思考”与“慢思考”集成进同一个模型，大大节省算力消耗。 经过后训练的模型，例如 Qwen3-30B-A3B，以及它们的预训练基座模型（如 Qwen3-30B-A3B-Base）已在各大平台上开放使用。同时，阿里云开源了两个 MoE 模型的权重：Qwen3-235B-A22B，一个拥有 2350 多亿总参数和 220 多亿激活参数的大模型Qwen3-30B-A3B，一个拥有约 300 亿总参数和 30 亿激活参数的小型 MoE 模型。 此外，六个 Dense 模型也已开源，包括 Qwen3-32B、Qwen3-14B、Qwen3-8B、Qwen3-4B、Qwen3-1.7B 和 Qwen3-0.6B，均在 Apache 2.0 许可下开源。 据阿里云介绍，其旗舰模型Qwen3-235B-A22B在代码、数学、通用能力等基准测试中，与 DeepSeek-R1、o1、o3-mini、Grok-3 和 Gemini-2.5-Pro 等顶级模型相比，表现出极具竞争力的结果。此外，小型 MoE 模型 Qwen3-30B-A3B 的激活参数数量是 QwQ-32B 的 10%，表现更胜一筹，甚至像 Qwen3-4B 这样的小模型也能匹敌 Qwen2.5-72B-Instruct 的性能。核心亮点多种思考模式 Qwen3 模型支持两种思考模式：思考模式：在这种模式下，模型会逐步推理，经过深思熟虑后给出最终答案。这种方法非常适合需要深入思考的复杂问题。非思考模式：在此模式中，模型提供快速、近乎即时的响应，适用于那些对速度要求高于深度的简单问题。 这种灵活性使用户能够根据具体任务控制模型进行“思考”的程度。例如，复杂的问题可以通过扩展推理步骤来解决，而简单的问题则可以直接快速作答，无需延迟。 至关重要的是，这两种模式的结合大大增强了模型实现稳定且高效的“思考预算”控制能力。如上文所述，Qwen3 展现出可扩展且平滑的性能提升，这与分配的计算推理预算直接相关。这样的设计让用户能够更轻松地为不同任务配置特定的预算，在成本效益和推理质量之间实现更优的平衡。多语言 Qwen3 模型支持 119 种语言和方言，例如简体中文、繁体中文、粤语等。这一广泛的多语言能力为国际应用开辟了新的可能性，让全球用户都能受益于这些模型的强大功能阿里发布国内首个“混合推理模型”Qwen3 并开源：支持两种思考模式，预训练约 36 万亿个 token、119 种语言和方言,452 万热度,https://www.zhihu.com/question/1900300358229652607,https://picx.zhimg.com/80/v2-852c80daea2f5bba0091c75dfff853b3_1440w.jpg,2025-04-28 13:28:31
知乎热榜,2025-04-29 10:14:01,4,1899458861376713751,小米起诉山寨马桶厂商「小米零度」获赔 3000 万元，这一判决对知识产权保护有何重要意义？,近日，上海市第三中级人民法院宣判一起知识产权侵权案。小米科技有限责任公司（以下简称“小米”）起诉山寨厂商“小米零度”商标侵权及不正当竞争纠纷案胜诉，获赔3000万元。该案因侵权商品销售额高达1.3亿元，成为知识产权保护领域的又一典型案例。 据法院查明，自2022年11月起，“小米零度”在电商平台销售智能马桶及花洒，商品使用“小米零度”字样及与小米商标近似的“M”形标识，并以“小爱小爱”作为语音唤醒指令，与小米旗下语音助手“小爱同学”高度相似。 小米公司主张，“小米”商标为驰名商标，被告的行为易导致消费者混淆，构成商标侵权；而“小爱小爱”语音指令模仿“小爱同学”，属于不正当竞争。因此， 被告“小米零度”辩称，其商标经国家商标局核准注册，与小米商标不构成近似，且“小爱小爱”与“小爱同学”存在差异，无法唤醒小米设备，故不构成侵权。其律师还指出，小米的文字商标并未注册在马桶品类上，且他们的商标经过国家商标总局认证，不应认定为侵权。山寨小米马桶爆卖1.3亿，小米起诉获赔3000万,431 万热度,https://www.zhihu.com/question/1899458861376713751,https://pic1.zhimg.com/80/v2-c215de0016c03510accf4a4a3dfbedde_1440w.png,2025-04-26 05:44:42
知乎热榜,2025-04-29 10:14:01,5,1899745186277490701,泡泡玛特拉布布 3.0 开售被抢空，有联名款原价 599 元炒到 1.4 万，消费者究竟在为什么买单？,4月25日，LABUBU3.0系列线下发售，广州泡泡玛特门店大排长龙。新品原价99元，二手市场加价至130元，端盒更贵。 受欢迎的不止最新款，以去年发售的LABUBU与Vans联名款为例，发售价为599元的潮玩在二手市场上已经涨价到14839元。 很难用语言描述为什么一个小小的玩偶会让那么多消费者陷入痴迷。,354 万热度,https://www.zhihu.com/question/1899745186277490701,https://pica.zhimg.com/80/v2-613b67100c6b5e07074a9d1370cdbf3a_1440w.webp?source=1def8aca,2025-04-27 00:42:27
知乎热榜,2025-04-29 10:14:01,6,1900230974308071261,幸福航空被曝欠薪 9 个月，飞行员送外卖空姐卖爆米花自谋生计，该航司经营出了什么问题？具体情况如何？,4月27日晚，幸福航空官方网站发布《关于幸福航空官网及微官网不正常航班延误证明功能暂停的通知》，称近期进行优化升级，系统暂停不正常航班延误证明功能，后续恢复正常后将及时通知。@荔枝新闻记者采访多名幸福航空员工，他们均表示好几个月没拿到工资，社保公积金很久不交，只能自己找活养家糊口，飞行员为了谋生送外卖、做家教，空姐卖爆米花，安全员跑滴滴等。 荔枝新闻记者查询幸福航空多趟航班信息，4月28日至30日的状态均显示为“取消”或“暂无数据”。据了解 幸福航空2024年在审理中的案件有66个，其中近半数案件的案由是“劳动争议”，幸福航空飞行员、空乘、地勤等多个岗位的员工被公司拖欠工资。https://view.inews.qq.com/a/20250428V0715M00?uid=8QMf2Xxf64AYsDff&chlid=user_center&suid=8QMf2Xxf64AYsDff&cur_vid=f1131lx6fva,265 万热度,https://www.zhihu.com/question/1900230974308071261,https://pic3.zhimg.com/50/v2-f2939bb18e68818e19f694773e5399ec_b.jpg,2025-04-28 08:52:48
