type,datetime,index,id,title,desc,hot,url,img,createtime
知乎热榜,2025-03-22 10:11:50,2,15463753362,学生买房给上海教授养老，去世后教授家属要霸占房产，真实情况是怎样的？教授家属能继承房产吗？,老师居住环境艰苦 学生“豪气送房” 1983年，二十出头的张玮成为了上海音乐学院资深声乐教授陈老师的学生，就此开启了一段特殊的师生缘分。 当时，陈老师住在上海音乐学院教工宿舍，一间仅15平米的小房间里，厨房、卫生间还要和邻居四口之家共用。 而陈老师的弟弟于1984年调到上海交通大学任教，一直都单身的姐弟俩就此相依为命。 因为当时音乐学院条件有限，直到1996年退休，一直单身没结婚的陈老师都没能分到一套独立的福利房。住房问题成为老师姐弟俩生活中最大的难题，这个心病也被一众与陈老师有着非常深厚情谊的学生们看在眼里。 老师的辛酸，深深刺痛了学生张玮。 张玮表示，自从1983年认识陈老师之后，就深深地被陈老师的个人魅力所折服。在她看来，陈老师不仅专业能力强，对待学生方面与为人师表方面更是无可挑剔。渐渐地，她便与陈老师成为了“忘年交”。在她心里，陈老师就像她的另一个母亲一样，让她尊敬，令她爱戴。 面对老师生活的窘境，2001年，张玮做出了一个重大决定：全款买下法华镇路一套125平米的房子，给两位老师居住。 为此，张玮称自己不仅倾尽了积蓄，还卖掉一套商品房，只为让他们能有尊严地安享晚年。 张玮表示，考虑到老师看重户口，为了让他们住得安心，张玮还让两位老师把户口也一起迁过来。但因为不是亲属关系就不能迁户，张玮为此还在房产证上加上了两位老师的名字。 四十年里，张玮与两位老师亲密无间，每年节假日、生日宴，张玮都陪伴在老师身边，让没有子女的两位老师尽享天伦之乐，如同一家人。 老师去世房难讨回 后来，陈老师及弟弟先后去世，给老师操办完后事的张玮想要拿回自己购买的这套房产，在办理房产变更手续时，却发生了意外。 陈老师远在外地的两位外甥在已经继承了老人上百万的存款之后，拒绝了张玮变更产证的要求。 在张玮看来，这套房屋是她全款买来给老师居住的，产证上加名字只是为了给非血缘关系的老师报户口。因此，产权登记与实质权益的分配不是一码事。 况且，两位外甥因亲属关系较远，又常年居住在外地，仅是隔几年来看望两位老人一次，无其他联系及赡养行为。 现代版“农夫与蛇”？学生买房给上海教授养老，去世后教授家属要霸占房产？,507 万热度,https://www.zhihu.com/question/15463753362,https://pic1.zhimg.com/v2-cfe269a6a6ae4af77d76bffecc88da2c_1440w.jpg,2025-03-21 01:54:31
知乎热榜,2025-03-22 10:11:50,3,15477690929,985 研究生退学摆摊卖土豆泥日入 700 元，称想过自己想要的生活，你赞同这样的职业选择吗？,近日，一则关于985研究生退学摆摊卖土豆泥，日入700元的新闻引发了广泛讨论。虽没有招牌和广告，但他的生意却异常火爆。 复旦研究生退学摆摊日入700元 网友：他有更多的选择 你不上学试试看,296 万热度,https://www.zhihu.com/question/15477690929,https://picx.zhimg.com/50/v2-b21c3f0faee786525f40f189ef3cdb3b_b.jpg,2025-03-21 06:20:55
知乎热榜,2025-03-22 10:11:50,4,15500308602,如何评价蔚来发布 2024 年财报，称全年亏损 204 亿，四季度亏损 66 亿？,3月21日下午消息，蔚来(NYSE： NIO； HKEX： 9866； SGX： NIO)今日发布了截至12月31日的2024年第四季度及全年财报。第四季度，总营收为197.034亿元，同比增长15.2%，环比增长5.5%。净亏损71.115亿元，同比增亏32.5%，环比增亏40.6%。不按美国通用会计准则，调整后的净亏损为66.222亿元，同比增亏37.9% ，环比增亏50.1%。 2024年全年，总营收为657.316亿元，与2023年相比增长18.2%。净亏损224.017亿元，而2023年净亏损207.198亿元。不按美国通用会计准则，调整后的净亏损为204.732亿元，而2023年净亏损183.507亿元。营收创新高、亏损在扩大，蔚来想要今年四季度盈利,255 万热度,https://www.zhihu.com/question/15500308602,https://picx.zhimg.com/80/v2-61d9a914bc3fb2851d29429baa03f052_1440w.webp?source=1def8aca,2025-03-21 10:22:44
知乎热榜,2025-03-22 10:11:50,5,15489636283,台湾邀请日本前自卫队官员任职，中方已向日方提出交涉，如何看待这一行为？台湾当局有何目的？,3月21日，外交部发言人毛宁主持例行记者会。有记者就台湾聘请日本前自卫队统合幕僚长岩崎茂担任顾问提问。 毛宁表示，台湾是中国领土不可分割的一部分，台湾问题纯属中国内政，不容任何外来干涉，一个中国原则是中日关系的政治基础，今年是中国人民抗日战争暨世界反法西斯战争胜利80周年，日本在台湾问题上对中国人民负有历史罪责，尤应谨言慎行，以实际行动兑现坚持一个中国原则的承诺。中方已经就有关动向向日方提出了交涉，民进党当局勾连外部势力谋“独”挑衅也是不会得逞的。 更多资讯请下载央视新闻客户端,215 万热度,https://www.zhihu.com/question/15489636283,https://picx.zhimg.com/80/v2-ed410e234de707125b732d0e7c94b5ca_1440w.png,2025-03-21 08:21:38
知乎热榜,2025-03-22 10:11:50,6,15410965237,南航回应称「超薄座椅」是市场主流产品，更节能环保舒适，这会影响乘客飞行选择吗？你能接受「超薄座椅」吗？,近日，有媒体报道称，南方航空公司（以下简称“南方航空”）在部分航线换上了“超薄座椅”。该类座椅比传统飞机座椅薄得多，厚度大约只有人手一拳宽。 《经济参考报》记者注意到，许多网友在社交媒体上分享了乘坐南方航空“超薄座椅”的经历。 记者根据网友分享乘坐的飞机，编号B6761，在航旅纵横App搜索到今日（3月20日）的多个航班，包括CZ2133、CZ2303、CZ2304，均为南方航空承运，且飞机机型均为空客320-232。 航旅纵横App显示上述航班座位数均为180个，且全部为经济舱座位。与此前媒体报道的“南方航空将多舱位型号转变为全经济舱，并推出‘超薄座椅’”内容一致。 记者联系了南方航空，南方航空方面告诉记者，网传“超薄座椅”的说法，按航空业界的标准称谓，应是“轻薄型座椅”。南航对已到翻新年限的部分飞机采用“轻薄型座椅”，主要有三点考虑：一是该类型座椅更加节能环保；二是该类型座椅更符合人体工学设计；三是该类型座椅是目前市场主流座椅产品之一。南航表示，他们选用的“轻薄型座椅”由中航工业旗下的航宇嘉泰公司生产，该公司是三大航C919飞机座椅供应商。南航选用的JT220E型号经济舱座椅是目前市场主流产品之一，是三大航C919和南航A320neo系列、B737-8上都在使用的同型号座椅，可媲美国外厂家同类产品，目前已成功跻身波音、空客和中商飞的座椅供应商可选产品目录清单中。 “轻薄型座椅”照片（南方航空供图） 针对乘坐“轻薄型座椅”，有网友表示不能接受，也有网友表示不重要。 那乘客能否提前了解哪些航班有轻薄型座椅？就此，记者向南方航空客服咨询，客服回复公司内部并无相关公告，暂时无法查询。 今年1月，南方航空发布了2024年业绩预告，南方航空预计2024年度净利润为-12.5亿元到-18.7亿元，扣除非经常性损益后的净利润为-33.5亿元到-43.8亿元。2023年，南航的净利润为-42.09亿元，这意味着2024年大幅减亏。（实习生赵月对本文亦有贡献） 内容来源“超薄座椅”引热议 南航回应：是市场主流产品 更节能环保舒适_飞机_经济舱_航班,176 万热度,https://www.zhihu.com/question/15410965237,https://pic1.zhimg.com/80/v2-3ed731ef40b04a5a21aab61a1709fa8d_1440w.webp?source=1def8aca,2025-03-20 07:24:36
知乎热榜,2025-03-22 10:11:50,7,15513417646,特斯拉门店进入警戒状态，所有车辆启动哨兵模式，特朗普称破坏特斯拉可能获刑二十年，马斯克该如何扭转局面？,"近期，全美多地频繁发生针对特斯拉经销店、特斯拉汽车及充电桩的蓄意破坏事件，一些地区还发生了抵制购买特斯拉汽车的抗议活动。 据CCTV国际时讯3月21日报道，美国东部时间3月20日深夜，美国总统特朗普在其创建的“真实社交”平台上发帖说，“那些破坏特斯拉汽车的人有很大可能会被判入狱长达20年，包括（破坏行动的）资助者。”按美国媒体说法，特斯拉之所以成为打砸、纵火、抗议的对象，是因为马斯克在特朗普政府中扮演重要角色，他操刀联邦政府大裁员，并支持欧洲极右翼政党和政治理念，这在美国和欧洲都引发一些民众的不满。 在回应一个关于“要求加强特斯拉美国和加拿大展厅和服务中心安保”的帖子下面，特斯拉CEO马斯克3月21日发文回应称，特斯拉线下门店已全面提升安保级别，所有车辆均激活""哨兵模式""（Sentry Mode）。 3月20日，马斯克也曾在转发特斯拉帖子的时候表示，“特斯拉哨兵模式可以捕捉任何试图伤害它的人的视频。” 特斯拉频遭纵火焚烧，FBI 启动反恐调查，从政给马斯克和特斯拉带来了什么？新华社分享页",168 万热度,https://www.zhihu.com/question/15513417646,https://picx.zhimg.com/80/v2-510bc61cadba44c02c37809e7dd0bcca_1440w.webp?source=1def8aca,2025-03-21 13:24:19
知乎热榜,2025-03-22 10:11:50,8,14350570126,我追着太阳跑，跑得比它还快，这样我就见不到太阳下山了，我就永远不会老了，是真的吗?,,165 万热度,https://www.zhihu.com/question/14350570126,https://picx.zhimg.com/80/v2-6726a23b0b0af200db63ffb7a87ac2e0_1440w.jpg,2025-03-07 12:46:09
知乎热榜,2025-03-22 10:11:50,9,15392438959,许家印前妻与清盘方继续「拉扯」，意外曝光还有两名未成年子女，是否会对恒大分红和薪酬的追讨产生影响？,金融界3月19日消息 在公众视野消失已久的许家印前妻丁玉梅传来最新消息，事关追讨恒大60亿美元分红和薪酬。 3月18日中国香港特区高等法院驳回。对于许家印前妻丁玉梅于2月提出的两项与中国恒大集团清盘有关的两项申请，此次被驳回的申请，包括为保护隐私要求闭门聆讯，以及修订资产冻结令以明确其可自由动用的资产范围。法官在驳回相关申请的在判词中强调指出：需要公开聆讯以确保清盘透明、保护公众利益。此外，其还下令丁玉梅需向恒大清盘人支付诉讼费。 2月28日，许家印前妻丁玉梅正请求香港高等法院澄清其因禁令所承担的义务。丁玉梅的律师表示，她已收到清算人寄来的300多封信件，要求提供更多有关其资产的信息。其法律代表庭审中表示，求法院将丁玉梅的披露义务限制在必要范围内。 首先，丁玉梅要求修订资产冻结令，明确哪些资产不在冻结范围内，以便她能够自由支配部分资产。丁玉梅提出了一系列豁免要求，包括豁免她其中一个银行户口的美金资产，不回答清盘人的某些问题，以及不持续更新其资产信息等。其次，丁玉梅以保护隐私为由，申请闭门聆讯，避免公开审理对其生活造成尴尬和不便。 意外爆出还有两名未成年子女 值得注意的是在本次香港高等法院披露的法律文件中，有一条信息引发外界关注。丁玉梅在申请闭门聆讯的众多理由中，丁玉梅认为，司法公开不代表需要公开其私生活及资产详情，公开聆讯可能损害其声誉，并影响她与两名未成年子女及两名未成年孙子女的生活。 不过法院披露的文件中并未透露有关丁玉梅的两个未成年子女以及两个未成年孙子女的父母信息。 在此之前据公开资料显示，许家印与丁玉梅在1983年结婚，婚后育有两子，长子许智健，次子许腾鹤，二人均已成年。长子许智健此前在恒大负责物业、园林等业务，拥有加拿大永居权。 目前丁玉梅、许智健母子尚未被抓，而许家印以及次子许腾鹤在2023年已经被抓。 2023年9月28日，许家印因涉嫌违法犯罪，已被依法采取强制措施。据知情人士透露，许家印的二儿子许腾鹤在许家印被采取强制措施之前已被带走。2024年5月，证监会依法对恒大地产债券欺诈发行及信息披露违法案作出行政处罚决定，对恒大地产责令改正、给予警告并罚款41.75亿元，对恒大地产时任董事长、实际控制人许家印处以顶格罚款4700万元并采取终身证券市场禁入措施。 许腾鹤曾参与恒大系事务众多，且均属于管理层职位。他曾担任恒大集团珠三角公司董事长多年，也曾主导过恒大财富的重要工作。在恒大内部，许腾鹤被称作Peter，此前一次受到关注是2021年12月，其被国外媒体曝出，以1250万美元折价出售了位于美国洛杉矶日落大道上的一栋豪宅。 除了两名神秘的子女之外，在本次披露的法律文件中，清盘人还透露丁玉梅自2024年8月以来已支出400万美元，并认为这足以表明即便有限制，其仍能在短期内花费巨额资金。 2024年7月，香港和伦敦的法院对丁玉梅发出全球资产冻结禁令，以追回许家印、丁玉梅和恒大前高管等人约60亿美元的分红及酬金。 据腾讯新闻《潜望》报道称，2023年7月下旬从知情人士处获悉，许家印的“前妻”丁玉梅在得知内地有企业家因许家印被边控后，随即买了机票离开香港。在此之前，她一直在香港协助有关机构进行恒大集团的债务重组事宜。 目前，恒大的清算人正在向包括丁玉梅在内的七名被告追讨60亿美元的分红和薪酬，作为试图挽回债权人在这家房地产公司投资损失的一部分。2024年9月，在被中国恒大清算人起诉后，英国一家法院冻结了丁玉梅的资产，允许她每个月至多支取高达2万英镑（约合18.6万元人民币）作为生活费。法庭文件显示，丁玉梅被允许支付每月的生活费，并在8月份支付高达35万英镑的律师费。 2023年，许家印被曝光已经与丁玉梅在2022年技术性离婚。 中国恒大于2023年8月14日晚间公布一系列公告显示，丁玉梅被称为“独立于本公司及其关联人士的第三方”，并未如此前一般被列为许家印配偶。 在此前披露的2021年年报中，丁玉梅在公告中的身份为董事局主席许家印配偶。在2021年底，许家印及丁玉梅共同出售中国恒大12亿股股票，作为一致行动人，许家印及丁玉梅持有中国恒大股份比例从76.69%下降至67.87%。 当时，外界对于许家印转移财产，切割债务的质疑骤起，有人质疑此举或为“技术性离婚”。 技术性离婚之后，许家印前妻丁玉梅曾于2024年2月26日入禀香港高等法院，向许家印次子许腾鹤追讨折合逾10亿港元。 2024年2月26日，许家印前妻丁玉梅2月26日入禀香港高等法院，向许家印次子许腾鹤追讨折合逾10亿港元。入禀状称，根据原告与被告于2020年6月16日签订的贷款协议，被告未有在约定还款日向原告人还款，因此原告向被告申索港币7.3248亿元，当中包括贷款本金港币5亿元、利息港币4500万元及每日逾期利息港币逾18万元；美元4097万元，当中包括本金美元3000万元、利息美元270万元及每日逾期利息美元827万元。 至于此次母子之间的纠纷，有分析指出或为技术性讨债，丁玉梅可能通过这个方式来隔离风险，确认这笔债权的合法性，从而最终保下二儿子的部分财产。 公开资料显示，丁玉梅1957年1月出生于安徽濉溪县丁姜楼村，大学毕业后被分配到河南省舞阳钢铁公司上班。1982年，许家印从武汉钢铁学院（现武汉科技大学）冶金系毕业，随后被分配到河南舞阳钢铁厂工作。1983年，许家印与同在舞钢工作的丁玉梅结为夫妻。 丁玉梅在婚后带着一双儿子南下深圳陪许家印创业，在一次采访中许家印回忆，一家四口住逼仄的出租屋，夏天连电风扇都舍不得开。 值得注意的是许家印对丁玉梅的评价颇高。 许家印对外界描述丁玉梅称：“她有学历，有自己的事业，但是为了照顾我，都放弃了”“我欠她太多，婚后这么多年，我们有吵架但从没真正翻过脸。别的我不敢说是公司第一，但我们夫妻的感情，不自夸的说，一直是恒大人学习的榜样。” 来源：金融界 完整内容来源事关追讨恒大60亿美元分红和薪酬！许家印前妻与清盘方继续“拉扯”，意外爆出还有两名未成年子女，半年多时间花费400万美金_丁玉梅_许腾鹤_资产,157 万热度,https://www.zhihu.com/question/15392438959,https://picx.zhimg.com/80/v2-a1f69e07cb6a264d857395d6167e007f_1440w.webp?source=1def8aca,2025-03-20 02:10:15
知乎热榜,2025-03-22 10:11:50,10,348571901,按理说机械硬盘和固态硬盘使用得当寿命几乎一样长，但为什么网上传言机械硬盘更容易坏？,,128 万热度,https://www.zhihu.com/question/348571901,https://pic1.zhimg.com/80/v2-73d457952da0c7a746fc7e77a63e796d_1440w.webp?source=1def8aca,2019-09-30 12:41:46
知乎热榜,2025-03-22 10:11:50,11,15399558159,波士顿动力展示人形机器人 Atlas 新技能，能跑步、爬行、翻筋斗，如何评价该功能？有哪些应用场景？,3 月 20 日消息，波士顿动力昨日晚间发布了一段关于人形机器人 Atlas 的新演示视频，展示使用动作捕捉套件开发的强化学习策略。波士顿动力人形机器人Atlas新技能：跑步、爬行、霹雳舞、翻筋斗,123 万热度,https://www.zhihu.com/question/15399558159,https://picx.zhimg.com/80/v2-aa6e44162c84fa6178456bafa398190c_1440w.webp?source=1def8aca,2025-03-20 05:09:10
知乎热榜,2025-03-22 10:11:50,12,15381004398,2025 年中科院分区表发布，与往年相比有哪些变化？还有哪些信息值得关注？,很多1区降为2区，也有很多2区升为1区。大家怎么看？重磅！2025 中科院分区表发布，附名单,112 万热度,https://www.zhihu.com/question/15381004398,https://pic1.zhimg.com/80/v2-defd4386e6b7284ff6ae5227951a458d_1440w.png,2025-03-19 16:38:17
知乎热榜,2025-03-22 10:11:50,13,15454866996,好不容易归化了塞尔吉尼奥，为何国足踢沙特，伊万科维奇一分钟都不让他上?,其实国足输沙特也正常，只是有一点让人想不通，好不容易归化了塞尔吉尼奥，为何国足踢沙特，伊万科维奇一分钟都不让他上，多少给塞尔吉尼奥一个机会呢,100 万热度,https://www.zhihu.com/question/15454866996,https://picx.zhimg.com/80/v2-ab66ec28b0130d17f68942632eb4048a_1440w.webp?source=1def8aca,2025-03-20 20:21:52
知乎热榜,2025-03-22 10:11:50,14,332996631,去过老挝后你最大的感受是什么？,,95 万热度,https://www.zhihu.com/question/332996631,https://pic1.zhimg.com/80/v2-726fcf3ae16ea326bdfa9c8892af835b_1440w.webp?source=1def8aca,2019-07-02 20:00:37
知乎热榜,2025-03-22 10:11:50,15,15419704938,如何评价《原神》的水仙十字系列任务？,,93 万热度,https://www.zhihu.com/question/15419704938,https://pic1.zhimg.com/80/v2-f0bea26d6c100360b7f3db0cc145cd49_1440w.webp?source=1def8aca,2025-03-20 08:50:07
知乎热榜,2025-03-22 10:11:50,16,15352042475,如何看待孙杨赛前占道热身，被官方催促「尽快离水，不要再继续训练」？,https://weibo.com/3847642518/Pjfetskht?refer_flag=1001030103_,92 万热度,https://www.zhihu.com/question/15352042475,https://pica.zhimg.com/80/v2-efe0df70e108607fb943cc6506c7c5be_1440w.jpg,2025-03-19 10:14:37
知乎热榜,2025-03-22 10:11:50,17,15469206165,如何评价《哪吒 2》延长上映至 4 月 30 日，最终票房能到多少？,3月21日，@电影哪吒之魔童闹海 发博宣布延长上映至4月30日：“你们的每一份陪伴，都如暖阳般照亮前路！春暖花开，继续相见吧！” 此前，2月19日，春节档票房冠军《哪吒之魔童闹海》宣布延长上映至3月30日。 再次延长！《哪吒2》官宣：将上映至4月30日,92 万热度,https://www.zhihu.com/question/15469206165,https://pic1.zhimg.com/80/v2-508163a1f9a4fd11b137d4900a78b483_1440w.png,2025-03-21 03:39:03
知乎热榜,2025-03-22 10:11:50,18,15475073304,刘强东最新朋友圈发文称「技术算法不应该用来压榨最底层兄弟」，如何看待他的这一发声？对行业意味着什么？,3月21日，据网传截图显示，近日刘强东在朋友圈发文评价京东为快递员缴纳五险一金一事，对此，界面新闻向京东求证，对方回应，截图内容属实。刘强东称，去年是创业20年以来最有成就感的时候，因为仅仅快递小哥就有1200多个兄弟退休了。每人可领取数十万公积金、每月5350元退休金，并享受医保全覆盖。 刘强东称，我们所学的知识、商业模式、技术算法都不应该是用来压榨社会最底层的兄弟们的，我们的利润、市值和财富更不应该建立在底层百姓无保障的生活之上的。 刘强东呼吁所有快递员和骑手都可以获得五险一金待遇，因为今天中国几大平台的利润和市值完全可以支撑，期待各阶层一起幸福生活。 刘强东：我们所学的知识、商业模式、技术算法都不应该用来压榨社会最底层的兄弟们|界面新闻 · 快讯,92 万热度,https://www.zhihu.com/question/15475073304,https://picx.zhimg.com/80/v2-0eca0af5083664af92a98bbe35ace638_1440w.webp?source=1def8aca,2025-03-21 05:53:12
知乎热榜,2025-03-22 10:11:50,19,15411354161,世预赛在即，球迷又是去灵隐寺祈福，又是敢用自己三年桃花换出线，国足出线到底有多大希望？,国足球迷为了出线能有多努力，灵隐寺都安排上了，真是逆风如解意容易要出线啊！ 2025年3月19日，杭州灵隐寺迎来了一群特殊的访客——身穿红色国足球衣的球迷们。他们手持香火，虔诚地在观音菩萨像前祈愿，希望国足在即将到来的世预赛中取得佳绩。这一幕不仅让人感受到球迷对国足的深厚情感，也引发了关于体育与信仰、传统与现代的深刻思考。 随着2026年美加墨世界杯亚洲区预选赛18强赛的临近，国足即将在3月21日凌晨客场挑战沙特队。这场比赛对国足出线形势至关重要，球迷们的热情也随之高涨。近日，多位球迷选择前往灵隐寺祈福，他们手持国足球员的照片，身披围巾，背后贴着“就支持国足那咋了”的标语，成为寺庙中一道独特的风景线。 球迷们的这一举动，既是对国足的支持，也是一种精神寄托。有网友调侃道：“球迷小哥们围着香炉念叨‘求派十八罗汉附体，救国足出线吧！’这画面既搞笑又感人。”尽管这种“赛博功德”看似有些玄学，但背后却是球迷对国足深深的期待与热爱。正如一位球迷所说：“无论结果如何，我们都希望用自己的方式为国足加油。” 灵隐寺作为中国著名的佛教圣地，承载着无数人的美好愿景。球迷们选择在这里祈福，不仅是因为其深厚的文化底蕴，更是因为这里象征着希望与力量。他们将体育精神与传统文化相结合，展现了现代球迷独特的表达方式。 然而，国足要想在赛场上取得突破，仅靠球迷的祈愿显然不够。沙特队作为亚洲劲旅，历史交锋中占据明显优势，国足客场取胜的难度不小。但球迷们依然充满期待，正如《足球报》记者李璇所言：“风水轮流转，也该国足赢一回了。” 观音诞辰接新KPI了！数位国足球迷赴灵隐寺参拜，保佑国足进世界杯_新闻频道_中华网,91 万热度,https://www.zhihu.com/question/15411354161,https://pic1.zhimg.com/80/v2-f0b4c9761ee78bca9bbef4485bec7f49_1440w.png,2025-03-20 07:28:47
知乎热榜,2025-03-22 10:11:50,20,15462719197,如何评价酷睿 Ultra 200H 系列的实际表现？是否能全面兼顾 AI、续航与轻薄表现？,搭载新一代酷睿 200H 系列处理器的轻薄本已开始陆续上市。根据Intel官方说法，新二代酷睿Ultra 处理器相比第一代实现了 CPU、核显、AI算力与能效的全面升级，其中多核性能与能效的提升幅度均达到了 20% 以上，AI 算力高达 99 TOPS，进一步提升 AI PC 动力，可以让轻薄本也能同时拥有强劲的 AI、续航和游戏性能表现。目前已搭载酷睿 200H 系列的新一代轻薄本产品实际表现如何？如今的低价轻薄本是否也不再只有「轻薄」，可以真正意义上做到性能与续航兼顾？,77 万热度,https://www.zhihu.com/question/15462719197,https://pica.zhimg.com/50/v2-7843c80a8959bda70bbd619a85496424_b.jpg,2025-03-21 01:34:11
