type,datetime,index,id,title,desc,hot,url,img,createtime
知乎热榜,2025-04-29 03:33:43,11,1900119661791634118,女子赤脚踏入 4.8 亿年晶花池拍照，称系政府招商允许进入，这种行为会对晶花池造成哪些影响？要担责吗？,4月27日，贵州道真县一招商考察团队女子赤脚进入奥陶纪晶花池拍照，引发生态保护争议。该晶花池位于大磏镇水利工程意外发现的封闭洞穴内，当事人陈女士称系政府招商允许进入，已四次考察进入该洞穴。中国地质学会洞穴专委会秘书长张远海称，人体油脂与指甲油将打破沉积物万年化学平衡，专业人士的基本原则是进入洞穴不踩水。目前该洞穴已全面封闭，当地文旅局证实涉事者为招商对象。女子回应赤脚踏入4.8亿年晶花池拍照 专家：水池遭不可逆污染,102 万热度,https://www.zhihu.com/question/1900119661791634118,https://picx.zhimg.com/80/v2-e2fac5fb8757f79bd44df1a6225a160a_720w.webp?source=1def8aca,2025-04-28 01:30:29
知乎热榜,2025-04-29 03:33:43,12,1900122859931672753,如何评价利物浦第20个冠军?,提前4轮夺冠，大家来聊聊@,100 万热度,https://www.zhihu.com/question/1900122859931672753,https://pica.zhimg.com/50/v2-bfb1191de214ee5a3653c0a630b4d164_b.jpg,2025-04-28 01:43:12
知乎热榜,2025-04-29 03:33:43,13,1897674410502086817,中国试点支持外籍医生开设诊所，对外籍医生有哪些要求？对医疗行业会有哪些影响？,《加快推进服务业扩大开放综合试点工作方案》提出，在医疗领域，支持外籍医生开设诊所；境外医疗专业技术人员短期执业；支持开办外资护理学院；允许以捐资方式举办非营利性医疗机构、养老机构；支持建设基因与细胞治疗专利专题数据库；探索优化罕见病药品进口抽检模式等。中国试点支持外籍医生开设诊所,100 万热度,https://www.zhihu.com/question/1897674410502086817,https://pica.zhimg.com/80/v2-f65aeca971802f0ef2b7fc3674c9c601_1440w.jpg,2025-04-21 07:33:56
知乎热榜,2025-04-29 03:33:43,14,1900136131661625340,如何评价媒体发文称「美债震荡动摇美元霸权根基」？,近期，美国滥施关税政策对国际金融市场造成直接冲击，美国股市、债市、汇市出现了三者齐跌的罕见现象。其中，美国10年期国债收益率由4月4日的4.01%一度升至4月11日的4.49%，创下自2001年“9·11”事件以来的最大单周涨幅。收益率飙升对应的是美债价格的大幅下跌，进而引发全球对美国债市场系统性风险的普遍担忧。 4月以来，美长期国债收益率快速上升及其导致的市场巨震，主要受四重因素驱动： 一是美国政府滥施关税引发美国经济再通胀预期。市场预测，仅美国对华关税加征至245%这一举动，就将显著推高其进口商品价格，恶化美国中低收入群体生活水平，并推高其未来通胀预期。通胀预期升高导致美联储降息空间收窄，进而推高长期国债收益率。 二是外国投资者购美债意愿进一步下降。在地缘政治博弈加剧背景下，近期欧洲机构投资者投资美元资产的规模明显下降。同时，美元指数显著贬值，市场对美国财政赤字可持续性的担忧及美国长期利率继续上升的预期，都降低了外国投资者短期内继续购买美国债的意愿，这也会推升美长期国债收益率。 三是美国债收益率单边飙升导致国债基差交易快速平仓。过去，美国债市场上有大量通过杠杆放大的国债现货与期货套利交易。现在，美长期国债收益率大幅上升，国债现货价格暴跌，导致从事基差交易的套利者被迫平仓止损，从而产生了较大规模的国债卖出，进一步抬升其长期国债利率。 四是美国债作为全球安全资产的声誉被严重削弱。白宫经济顾问委员会主席斯蒂芬·米兰近期在一份报告中提出，未来要“强制”外国投资者将所持美债置换为超长期低息债券，并限制投资者直接在市场上出售这些美债。如果外国投资者拒绝“合作”，美国政府将会对这些投资者的投资收益征收高额税收。这种金融霸凌行径将会严重侵蚀美国债的声誉和信用。在相关预期作用下，当前外国主权投资者购买美国债的意愿明显下降，这也将导致美国债收益率上升。 人民日报刊文：美债震荡动摇美元霸权根基,100 万热度,https://www.zhihu.com/question/1900136131661625340,https://pic1.zhimg.com/50/v2-dd7af46ae3e2b6d24df18a7470019dca_b.jpg,2025-04-28 02:35:56
知乎热榜,2025-04-29 03:33:43,15,1900459547069505968,如何评价《明末：渊虚之羽》2025年4月发布的最新实机预告片，对得起248这个售价吗？,,100 万热度,https://www.zhihu.com/question/1900459547069505968,https://picx.zhimg.com/80/v2-71bc723d9f5d7558c74523e30debac71_1440w.png,2025-04-29 00:01:04
知乎热榜,2025-04-29 03:33:43,16,1900203461963904331,什么是协和「4+4」学制？这种学制有哪些优势和问题？,,99 万热度,https://www.zhihu.com/question/1900203461963904331,https://pic1.zhimg.com/80/v2-df54af0d43d8cdb5cedc98b6a8215de3_1440w.jpg,2025-04-28 07:03:29
知乎热榜,2025-04-29 03:33:43,17,1900072381575325188,东风日产N7爆单，订单破10000 台，为什么N7会大卖？应该以什么心态看合资新能源车型的爆单？,东风日产N7于2025年4月27日正式上市后迅速引发市场热捧，订单量突破1万台，成为合资品牌新能源车型的现象级爆款 N7定位超舒适中高级纯电轿车，空间宽敞，设计简约，超舒适四件套，直接把客厅搬进车里，简直家用车天花板。,98 万热度,https://www.zhihu.com/question/1900072381575325188,https://pic4.zhimg.com/50/v2-4db604c62caf087672296b501e080037_b.jpg,2025-04-27 22:22:37
知乎热榜,2025-04-29 03:33:43,18,1900228399844294909,《光与影：33号远征队》发售三天销量超过100万，Steam在线人数突破12万，为何剧情有雷还能卖爆？,Sandfall官宣回合制RPG游戏《光与影：33号远征队》发售三天，游戏销量超过100万套。官方还澄清，该数据并不含Game Pass玩家。,97 万热度,https://www.zhihu.com/question/1900228399844294909,https://picx.zhimg.com/80/v2-8f3d8c3142262a159b71b77310b796ba_1440w.webp?source=1def8aca,2025-04-28 08:42:35
知乎热榜,2025-04-29 03:33:43,19,530441426,如何评价NBA篮球运动员追梦格林？,,96 万热度,https://www.zhihu.com/question/530441426,https://pic3.zhimg.com/50/v2-28aeb4ce14b89aa57c6b7041ea3fb9cc_b.jpg,2022-04-28 04:31:16
知乎热榜,2025-04-29 03:33:43,20,1899826576629130303,网友吐槽 iPhone 闹钟调休不响致迟到，客服称无法自动识别节假日，如何从技术上优化？有必要改进吗？,据了解，由于iPhone的闹钟无法识别法定节假日，系统不会自动将调休的周末算成工作日。对此苹果客服表示：iPhone闹钟需要手动添加设置，没有办法自动识别节假日，这个情况会记录反馈，后期工程部可能会作相关采纳。网友吐槽iPhone闹钟不能识别调休导致迟到，苹果客服回应_腾讯新闻,92 万热度,https://www.zhihu.com/question/1899826576629130303,https://pica.zhimg.com/80/v2-2632ee4dfb7fedf60ec6bbacb045dd78_1440w.png,2025-04-27 06:05:52
知乎热榜,2025-04-29 03:33:43,21,1897312268926021661,肥胖或取代吸烟成为第一致癌因素，肥胖会带来哪些癌症风险？怎样合理控制体重？,国际癌症研究机构明确指出，肥胖至少与13种癌症风险相关。有专家认为，肥胖将可能取代吸烟，成为癌症最大的可干预的危险因素。肥胖或取代吸烟成为第一致癌因素,88 万热度,https://www.zhihu.com/question/1897312268926021661,https://picx.zhimg.com/80/v2-4e6ecc7993bda7d3e1533d782e15a636_1440w.webp?source=1def8aca,2025-04-20 07:34:55
知乎热榜,2025-04-29 03:33:43,22,1900302764250206950,如何看待米哈游创始人刘伟获得全国劳动模范？,[3 张图片],82 万热度,https://www.zhihu.com/question/1900302764250206950,https://pic3.zhimg.com/v2-6691b41fec3b76673fca6f57275cb92a_r.jpg,2025-04-28 13:38:04
知乎热榜,2025-04-29 03:33:43,23,1899932391042147948,张译拿影帝后宣布暂时息影，称「等到自己特别满意时再接戏」，如何看待他的选择？,4月27日，第二十届中国电影华表奖颁奖活动在山东青岛举行，张译成为继刘佩琦、李雪健之后，第三位拥有两座华表奖优秀男演员奖杯的演员。2023年，张译曾凭借《我和我的祖国》首次获得这一奖项。 他在群访中回应目前暂时息影“充电”的状态，说之前作品太密了，接下来还会继续停一阵，扎根生活，等到自己特别满意时再接戏。“很感谢今天这份鼓励，它像是我和观众的一份契约，拿了这个奖，不好好去生活，不好好演戏，会对不起观众，对不起自己。”继刘佩琦、李雪健之后 张译成第三位二封华表影帝男演员,79 万热度,https://www.zhihu.com/question/1899932391042147948,https://picx.zhimg.com/80/v2-77565866e0ee50b6a85371c5a7e339c5_720w.png,2025-04-27 13:06:21
知乎热榜,2025-04-29 03:33:43,24,1899103841334589081,《凡人修仙传》，乱星海的实力有天南的实力强吗？,乱星海的实力有天南的实力强嘛？有懂的道友分析一下,77 万热度,https://www.zhihu.com/question/1899103841334589081,,2025-04-25 06:13:59
知乎热榜,2025-04-29 03:33:43,25,1898134888395314297,为什么13个学科门类里，只有哲学和历史学没有专属的大学名称词缀？,关联问题1：科研院所与高等院校是机构合并、职能分立还是保持现状更好？ 关联问题2：现有学部/学科门类和专业类/一级学科的设置，能否整合成一套兼容性良好的体系? 关联问题3：结合人口形势、产业需求和政策约束，我国“十四五”乃至中长期高等教育会怎么发展? 文学：上海外国语大学（外国语）、北京语言大学（语言）、绍兴文理学院（文理） 法学：中国政法大学（政法）、中央民族大学（民族）、北京青年政治学院（政治） 理学：武汉理工大学（理工）、中国科学技术大学（科技） 工学：哈尔滨工业大学（工业）、哈尔滨工程大学（工程）、中国地质大学（地质）、中国矿业大学（矿业）、中国石油大学（石油）、华北电力大学（电力）、银川能源学院（能源）、石家庄铁道大学（铁道）、大连交通大学（铁道→交通）、中国计量大学（计量）、武汉纺织大学（纺织）、郑州轻工业大学（纺织→轻工业）、北京航空航天大学（航空航天）、南京信息工程大学（气象→信息工程）… 经济学：中央财经大学（财经） 、对外经济贸易大学（经贸） 管理学：国家行政学院（行政）、南京审计大学（审计） 农学：中国农业大学（农业）、浙江农林大学（农林） 、西北农林科技大学（农林科技）、南京林业大学（林业）、中南林业科技大学（林业科技）、中国海洋大学（水产→海洋） 医学：中国医科大学（医科） 、中国药科大学（药科）、北京中医药大学（中医药） 、甘肃卫生职业学院（卫生） 军事学：国防科技大学（国防） 、中国人民解放军陆军工程大学（解放军） 艺术学：中央戏剧学院（戏剧）、中央美术学院（美术）、中央音乐学院（音乐）、北京舞蹈学院（舞蹈）、北京电影学院（电影）、中国传媒大学（传媒）… 教育学：北京师范大学（师范）,77 万热度,https://www.zhihu.com/question/1898134888395314297,https://pic2.zhimg.com/50/v2-b53408e06b2eb8c021c101d52e3326e9_b.jpg,2025-04-22 14:03:43
知乎热榜,2025-04-29 03:33:43,26,570222535,《魔兽》系列的巨魔究竟有多惨?,,72 万热度,https://www.zhihu.com/question/570222535,https://pic2.zhimg.com/50/v2-5421c066e5e0d2c89df87f212c03a2f7_b.jpg,2022-12-02 18:04:18
知乎热榜,2025-04-29 03:33:43,27,1894171275213121052,你在打游戏打到什么程度时会红温，甚至删游戏？,,68 万热度,https://www.zhihu.com/question/1894171275213121052,https://picx.zhimg.com/80/v2-775227739a4dcfbef17e2ed47f17bba0_1440w.jpg,2025-04-11 15:33:44
知乎热榜,2025-04-29 03:33:43,28,1898561030344410133,中国为什么执着于任何产业都国产替代？,如果全中国都使用国产货，外国人一分钱都赚不到会出现什么情况,59 万热度,https://www.zhihu.com/question/1898561030344410133,,2025-04-23 18:17:03
知乎热榜,2025-04-29 03:33:43,29,1899625770072127338,为啥我总感觉有些科学家说宇宙年龄是一百多亿年的论断有点无法让人信服？,凭借人类目前的手段、能力有这样的论断无法让人信服。,58 万热度,https://www.zhihu.com/question/1899625770072127338,https://pic1.zhimg.com/v2-2c458db07d989793b30f1f7faffa075f_r.jpg?source=1def8aca,2025-04-26 16:47:56
知乎热榜,2025-04-29 03:33:43,30,1897678724008224331,中国航天发展至今，最让你印象深刻的发射任务是哪次？为什么？,,58 万热度,https://www.zhihu.com/question/1897678724008224331,https://picx.zhimg.com/80/v2-bd7c3cc64ca91efd6c1090d6afb8f7fd_1440w.webp?source=1def8aca,2025-04-21 07:51:04
知乎热搜,2025-04-29 04:14:18,1,,工业企业利润由降转增,,,https://www.zhihu.com/search?q=%E5%B7%A5%E4%B8%9A%E4%BC%81%E4%B8%9A%E5%88%A9%E6%B6%A6%E7%94%B1%E9%99%8D%E8%BD%AC%E5%A2%9E,,
知乎热搜,2025-04-29 04:14:18,2,,降维打击到底有多恐怖,,,https://www.zhihu.com/search?q=%E9%99%8D%E7%BB%B4%E6%89%93%E5%87%BB%E5%88%B0%E5%BA%95%E6%9C%89%E5%A4%9A%E6%81%90%E6%80%96,,
知乎热搜,2025-04-29 04:14:18,3,,WBG对战IG,,,https://www.zhihu.com/search?q=WBG%E5%AF%B9%E6%88%98IG,,
知乎热搜,2025-04-29 04:14:18,4,,苹果 C 口和安卓 C 口有什么区别,,,https://www.zhihu.com/search?q=%E8%8B%B9%E6%9E%9C%20C%20%E5%8F%A3%E5%92%8C%E5%AE%89%E5%8D%93%20C%20%E5%8F%A3%E6%9C%89%E4%BB%80%E4%B9%88%E5%8C%BA%E5%88%AB,,
知乎热搜,2025-04-29 04:14:18,5,,为什么说狼人杀压根没有逻辑,,,https://www.zhihu.com/search?q=%E4%B8%BA%E4%BB%80%E4%B9%88%E8%AF%B4%E7%8B%BC%E4%BA%BA%E6%9D%80%E5%8E%8B%E6%A0%B9%E6%B2%A1%E6%9C%89%E9%80%BB%E8%BE%91,,
知乎热搜,2025-04-29 04:14:18,6,,王者荣耀崩了,,,https://www.zhihu.com/search?q=%E7%8E%8B%E8%80%85%E8%8D%A3%E8%80%80%E5%B4%A9%E4%BA%86,,
知乎热搜,2025-04-29 04:14:18,7,,知乎旧物节,,,https://www.zhihu.com/search?q=%E7%9F%A5%E4%B9%8E%E6%97%A7%E7%89%A9%E8%8A%82,,
知乎热搜,2025-04-29 04:14:18,8,,寻找穿越时光的旧物,,,https://www.zhihu.com/search?q=%E5%AF%BB%E6%89%BE%E7%A9%BF%E8%B6%8A%E6%97%B6%E5%85%89%E7%9A%84%E6%97%A7%E7%89%A9,,
知乎热搜,2025-04-29 04:14:18,9,,哪件旧物是你一直保留着的,,,https://www.zhihu.com/search?q=%E5%93%AA%E4%BB%B6%E6%97%A7%E7%89%A9%E6%98%AF%E4%BD%A0%E4%B8%80%E7%9B%B4%E4%BF%9D%E7%95%99%E7%9D%80%E7%9A%84,,
知乎热搜,2025-04-29 04:14:18,10,,穿越时光的旧物,,,https://www.zhihu.com/search?q=%E7%A9%BF%E8%B6%8A%E6%97%B6%E5%85%89%E7%9A%84%E6%97%A7%E7%89%A9,,
知乎热搜,2025-04-29 04:14:18,11,,神舟二十号载人飞船发射升空,,,https://www.zhihu.com/search?q=%E7%A5%9E%E8%88%9F%E4%BA%8C%E5%8D%81%E5%8F%B7%E8%BD%BD%E4%BA%BA%E9%A3%9E%E8%88%B9%E5%8F%91%E5%B0%84%E5%8D%87%E7%A9%BA,,
知乎热搜,2025-04-29 04:14:18,12,,神二十发射取得圆满成功,,,https://www.zhihu.com/search?q=%E7%A5%9E%E4%BA%8C%E5%8D%81%E5%8F%91%E5%B0%84%E5%8F%96%E5%BE%97%E5%9C%86%E6%BB%A1%E6%88%90%E5%8A%9F,,
知乎热搜,2025-04-29 04:14:18,13,,神舟二十号航天员乘组顺利入驻「天宫」,,,https://www.zhihu.com/search?q=%E7%A5%9E%E8%88%9F%E4%BA%8C%E5%8D%81%E5%8F%B7%E8%88%AA%E5%A4%A9%E5%91%98%E4%B9%98%E7%BB%84%E9%A1%BA%E5%88%A9%E5%85%A5%E9%A9%BB%E3%80%8C%E5%A4%A9%E5%AE%AB%E3%80%8D,,
知乎热搜,2025-04-29 04:14:18,14,,openai图像生成模型api发布,,,https://www.zhihu.com/search?q=openai%E5%9B%BE%E5%83%8F%E7%94%9F%E6%88%90%E6%A8%A1%E5%9E%8Bapi%E5%8F%91%E5%B8%83,,
知乎热搜,2025-04-29 04:14:18,15,,网传腾讯音乐拟收购喜马拉雅,,,https://www.zhihu.com/search?q=%E7%BD%91%E4%BC%A0%E8%85%BE%E8%AE%AF%E9%9F%B3%E4%B9%90%E6%8B%9F%E6%94%B6%E8%B4%AD%E5%96%9C%E9%A9%AC%E6%8B%89%E9%9B%85,,
知乎热搜,2025-04-29 04:14:18,16,,郑钦文0:2波塔波娃,,,https://www.zhihu.com/search?q=%E9%83%91%E9%92%A6%E6%96%870%3A2%E6%B3%A2%E5%A1%94%E6%B3%A2%E5%A8%83,,
知乎热搜,2025-04-29 04:14:18,17,,莫兰特重伤,,,https://www.zhihu.com/search?q=%E8%8E%AB%E5%85%B0%E7%89%B9%E9%87%8D%E4%BC%A4,,
知乎热搜,2025-04-29 04:14:18,18,,强基计划多所 985 取消竞赛生破格入围政策,,,https://www.zhihu.com/search?q=%E5%BC%BA%E5%9F%BA%E8%AE%A1%E5%88%92%E5%A4%9A%E6%89%80%20985%20%E5%8F%96%E6%B6%88%E7%AB%9E%E8%B5%9B%E7%94%9F%E7%A0%B4%E6%A0%BC%E5%85%A5%E5%9B%B4%E6%94%BF%E7%AD%96,,
知乎热搜,2025-04-29 04:14:18,19,,教育部增设游戏艺术设计专业,,,https://www.zhihu.com/search?q=%E6%95%99%E8%82%B2%E9%83%A8%E5%A2%9E%E8%AE%BE%E6%B8%B8%E6%88%8F%E8%89%BA%E6%9C%AF%E8%AE%BE%E8%AE%A1%E4%B8%93%E4%B8%9A,,
知乎热搜,2025-04-29 04:14:18,20,,五一大量外国人涌入中国,,,https://www.zhihu.com/search?q=%E4%BA%94%E4%B8%80%E5%A4%A7%E9%87%8F%E5%A4%96%E5%9B%BD%E4%BA%BA%E6%B6%8C%E5%85%A5%E4%B8%AD%E5%9B%BD,,
知乎热搜,2025-04-29 04:14:18,21,,杨瀚森宣布参加NBA选秀,,,https://www.zhihu.com/search?q=%E6%9D%A8%E7%80%9A%E6%A3%AE%E5%AE%A3%E5%B8%83%E5%8F%82%E5%8A%A0NBA%E9%80%89%E7%A7%80,,
知乎热搜,2025-04-29 04:14:18,22,,网传中日友好医院外科医生出轨多人,,,https://www.zhihu.com/search?q=%E7%BD%91%E4%BC%A0%E4%B8%AD%E6%97%A5%E5%8F%8B%E5%A5%BD%E5%8C%BB%E9%99%A2%E5%A4%96%E7%A7%91%E5%8C%BB%E7%94%9F%E5%87%BA%E8%BD%A8%E5%A4%9A%E4%BA%BA,,
知乎热搜,2025-04-29 04:14:18,23,,中日友好医院肖飞,,,https://www.zhihu.com/search?q=%E4%B8%AD%E6%97%A5%E5%8F%8B%E5%A5%BD%E5%8C%BB%E9%99%A2%E8%82%96%E9%A3%9E,,
知乎热搜,2025-04-29 04:14:18,24,,湘江半马女配速员跑崩,,,https://www.zhihu.com/search?q=%E6%B9%98%E6%B1%9F%E5%8D%8A%E9%A9%AC%E5%A5%B3%E9%85%8D%E9%80%9F%E5%91%98%E8%B7%91%E5%B4%A9,,
知乎热搜,2025-04-29 04:14:18,25,,印度未事先通知突然开闸泄洪,,,https://www.zhihu.com/search?q=%E5%8D%B0%E5%BA%A6%E6%9C%AA%E4%BA%8B%E5%85%88%E9%80%9A%E7%9F%A5%E7%AA%81%E7%84%B6%E5%BC%80%E9%97%B8%E6%B3%84%E6%B4%AA,,
知乎热搜,2025-04-29 04:14:18,26,,饿了么将逐步取消外卖超时扣罚,,,https://www.zhihu.com/search?q=%E9%A5%BF%E4%BA%86%E4%B9%88%E5%B0%86%E9%80%90%E6%AD%A5%E5%8F%96%E6%B6%88%E5%A4%96%E5%8D%96%E8%B6%85%E6%97%B6%E6%89%A3%E7%BD%9A,,
知乎热榜,2025-04-29 04:14:18,1,1900286031774843467,西班牙和葡萄牙遭遇大规模停电，交通、通信、医疗等一度瘫痪，民众疯抢物资，目前情况怎么样？为什么会停电？,4月28日，西班牙和葡萄牙遭遇大规模停电，影响超过5000万伊比利亚半岛民众，交通、通信、医疗等关键领域一度瘫痪，法国南部等周边地区也受短暂波及。截至当地时间21时左右，持续了将近10个小时的停电才开始结束，各地电力逐步恢复。但在西班牙，不少民众已经开始抢购物资。目前停电原因尚不明确。 欧盟委员会执行副主席特蕾莎·里贝拉当日对外表示，此次大停电是近年来欧洲记录到的最严重事件之一。 伊比利亚半岛陷入大瘫痪 法国南部等周边地区受波及 因遭遇大范围停电，西班牙多地通信服务中断，民众只能依靠收音机获取信息，马德里网球公开赛被迫暂停；铁路基础设施管理局称列车大范围停运，马德里部分地铁疏散人群，多条路段因交通信号灯失灵出现堵塞，机场虽启用应急电力系统，但部分航班仍延误。 △4月28日，在西班牙马德里，马德里公开赛网球比赛场馆内，观众在大停电期间闲逛。 △4月28日，西班牙马德里一地铁站空无一人。 葡萄牙方面，全国多地交通信号灯受影响，部分地区地铁暂时关闭，公共安全部门提醒公共照明或受波及。欧洲航空安全组织指出，此次停电影响了往返马德里、巴塞罗那和里斯本的航班。 接近西班牙边境的法国南部巴斯克地区也一度出现了短暂停电现象，持续数分钟后迅速恢复供电。法国电网公司证实，受影响的是与西班牙电网直接互联的地区。 此外，与西班牙和法国毗邻的安道尔公国的电力供应也一度中断，但得益于与法国电网的自动重连机制，电力供应在几秒钟内迅速恢复。 停电发生后 民众开始抢购生活物资 大范围停电让西班牙民众感到不知所措。因为不知道停电会持续多久，很多人涌向超市购买食品和饮用水。更多资讯请下载央视新闻客户端 马德里网球公开赛正在进行，但比赛却因为停电而不得不暂停。据外媒报道，整个伊比利亚半岛，包括西班牙、葡萄牙全部停电，法国部分地区也受到了影响。目前停电原因尚不清楚。离谱新闻！西班牙葡萄牙整个伊比利亚半岛停电，马德里公开赛暂停-直播吧,1495 万热度,https://www.zhihu.com/question/1900286031774843467,https://picx.zhimg.com/80/v2-239d3e2d4074dee825f9c5f960a6d23b_1440w.webp?source=1def8aca,2025-04-28 12:31:35
知乎热榜,2025-04-29 04:14:18,2,1900300358229652607,阿里通义千问 Qwen3 系列模型正式发布，该模型有哪些技术亮点？,4 月 29 日消息，今日凌晨，阿里巴巴发布了新一代通义千问 Qwen3 模型，一举登顶全球最强开源模型。 这是国内首个“混合推理模型”，将“快思考”与“慢思考”集成进同一个模型，大大节省算力消耗。 经过后训练的模型，例如 Qwen3-30B-A3B，以及它们的预训练基座模型（如 Qwen3-30B-A3B-Base）已在各大平台上开放使用。同时，阿里云开源了两个 MoE 模型的权重：Qwen3-235B-A22B，一个拥有 2350 多亿总参数和 220 多亿激活参数的大模型Qwen3-30B-A3B，一个拥有约 300 亿总参数和 30 亿激活参数的小型 MoE 模型。 此外，六个 Dense 模型也已开源，包括 Qwen3-32B、Qwen3-14B、Qwen3-8B、Qwen3-4B、Qwen3-1.7B 和 Qwen3-0.6B，均在 Apache 2.0 许可下开源。 据阿里云介绍，其旗舰模型Qwen3-235B-A22B在代码、数学、通用能力等基准测试中，与 DeepSeek-R1、o1、o3-mini、Grok-3 和 Gemini-2.5-Pro 等顶级模型相比，表现出极具竞争力的结果。此外，小型 MoE 模型 Qwen3-30B-A3B 的激活参数数量是 QwQ-32B 的 10%，表现更胜一筹，甚至像 Qwen3-4B 这样的小模型也能匹敌 Qwen2.5-72B-Instruct 的性能。核心亮点多种思考模式 Qwen3 模型支持两种思考模式：思考模式：在这种模式下，模型会逐步推理，经过深思熟虑后给出最终答案。这种方法非常适合需要深入思考的复杂问题。非思考模式：在此模式中，模型提供快速、近乎即时的响应，适用于那些对速度要求高于深度的简单问题。 这种灵活性使用户能够根据具体任务控制模型进行“思考”的程度。例如，复杂的问题可以通过扩展推理步骤来解决，而简单的问题则可以直接快速作答，无需延迟。 至关重要的是，这两种模式的结合大大增强了模型实现稳定且高效的“思考预算”控制能力。如上文所述，Qwen3 展现出可扩展且平滑的性能提升，这与分配的计算推理预算直接相关。这样的设计让用户能够更轻松地为不同任务配置特定的预算，在成本效益和推理质量之间实现更优的平衡。多语言 Qwen3 模型支持 119 种语言和方言，例如简体中文、繁体中文、粤语等。这一广泛的多语言能力为国际应用开辟了新的可能性，让全球用户都能受益于这些模型的强大功能阿里发布国内首个“混合推理模型”Qwen3 并开源：支持两种思考模式，预训练约 36 万亿个 token、119 种语言和方言,1203 万热度,https://www.zhihu.com/question/1900300358229652607,https://picx.zhimg.com/80/v2-852c80daea2f5bba0091c75dfff853b3_1440w.jpg,2025-04-28 13:28:31
知乎热榜,2025-04-29 04:14:18,3,587995936,为什么程序员总是发现不了自己的Bug?,,267 万热度,https://www.zhihu.com/question/587995936,https://pic1.zhimg.com/80/v2-2cdf20aaddf228a1f2d4e7cd1944c2b8_1440w.png,2023-03-06 21:52:09
知乎热榜,2025-04-29 04:14:18,4,1898763060996466675,灰鹦鹉爆粗口三年未改，园方称形成习惯后只能慢慢调整，难矫正的原因在哪？ 有更好的办法吗？,近日，有游客发视频显示，在云南野生动物园，一名游客对一只灰鹦鹉打招呼，遭这只灰鹦鹉（下称“小灰”）脏话“回敬”。 早在2022年8月，“小灰”因模仿人类说脏话意外走红，园方曾公开表示已对其进行“矫正教育”。但如今三年过去，网友发出疑问“不是早就被教育过了吗”。 4月23日，云南野生动物园一名工作人员对此事回应称：“‘小灰’已形成固定语言模式，我们也在持续引导，目前只能是慢慢调整。”云南野生动物园一只灰鹦鹉爆粗口三年未改？园方回应：已形成固定语言,243 万热度,https://www.zhihu.com/question/1898763060996466675,https://pic1.zhimg.com/50/v2-621ca9e3acc8df3db3d4daa6671306eb_720w.webp?source=1def8aca,2025-04-24 07:39:51
