type,datetime,index,id,title,desc,hot,url,img,createtime
知乎热榜,2025-04-02 12:21:56,25,1890446748742285164,SU7 高速上车祸起火致 3 死，小米称事故前处于辅助驾驶状态，由车主介入退出，这种情况该如何定责？,4月1日，@小米公司发言人 微博发文称，2025年3月29日22时44分，一辆小米SU7标准版在德上高速公路池祁段行驶过程中遭遇严重交通事故。我们对此深感痛惜。 据初步了解，事故发生前车辆处于NOA智能辅助驾驶状态，以116km/h时速持续行驶。事发路段因施工修缮，用路障封闭自车道、改道至逆向车道。车辆检测出障碍物后发出提醒并开始减速。随后驾驶员接管车辆进入人驾状态，持续减速并操控车辆转向，随后车辆与隔离带水泥桩发生碰撞，碰撞前系统最后可以确认的时速约为97km/h。 碰撞发生后，我们立即与车主取得联系，了解非车主本人驾驶。同时，紧急救援呼叫车上乘员，并报警、呼叫120急救服务。 此后，警方随即抵达现场，全面介入调查事故。同时，我们第一时间成立了专项小组，于30日赶赴铜陵，在警方的指导下，积极配合调查、取证等各项工作，并于31日晚依法向警方提交完成我们所掌握的车辆行驶数据及系统运行信息。我们将继续全力配合警方工作，并严格遵循调查结果，确保事件处理公开透明。 同时，我们的专项组也将在警方的许可与指导下，与事故受难者家属取得联系，全力协助善后事宜，并提供支持与帮助。 我们将目前所知并提交给警方的信息，摘要公布如下： 3月29日 22:27:17 NOA激活，车速116km/h 3月29日 22:28:17 轻度分心报警 3月29日 22:36:48 NOA发出脱手预警提示“请手握方向盘” 3月29日 22:44:24 NOA发出风险提示“请注意前方有障碍”，发出减速请求，并开始减速 3月29日 22:44:25 NOA被接管，进入人驾状态，方向盘往左转角22.0625度，制动踏板开度31% 3月29日 22:44:26 方向盘往右转角1.0625度，制动踏板开度38% 3月29日 22:44:26-28之间 车辆与水泥护栏发生碰撞 3月29日 22:44:28 车端Ecall触发 3月29日 22:44:39 车端Ecall接通，确认事故发生，并报警、呼叫120急救服务 3月29日 22:45:06 与车主取得联系，确认非车主驾驶 3月29日 22:47:15 调配120成功 3月29日 约23时许 120抵达现场SU7高速上碰撞爆燃致3死，小米公布事件细节,74 万热度,https://www.zhihu.com/question/1890446748742285164,https://pic1.zhimg.com/80/v2-9bed46cf378125b86833dd2c057b9291_1440w.webp?source=1def8aca,2025-04-01 08:53:47
知乎热榜,2025-04-02 12:21:56,26,10994745951,谁能提供一个猪肉好吃又简单的做法？,平时做得比较多的就是回锅肉、红烧肉和白斩肉，还有没有什么做法简单又特别好吃的做法呢？,68 万热度,https://www.zhihu.com/question/10994745951,https://pic2.zhimg.com/50/v2-75513759db7b62c2a1f2cb8fb4e76e2b_b.jpg,2025-01-31 17:47:54
知乎热榜,2025-04-02 12:21:56,27,15167597196,如何评价网飞英剧《混沌少年时》？,以一起谋杀案为背景，讲述了一个少年被控杀人的故事,67 万热度,https://www.zhihu.com/question/15167597196,https://picx.zhimg.com/80/v2-01ff3d1ba23c3caba2862e1b5cddfdca_1440w.webp?source=1def8aca,2025-03-17 03:38:01
知乎热榜,2025-04-02 12:21:56,28,29207889,如何评价莺儿？,我个人觉得这个人非常非常糊涂，参考红楼中和管花园子的婆子吵架，哪一章怎么看怎么觉得莺儿很蠢，拎不清,62 万热度,https://www.zhihu.com/question/29207889,https://picx.zhimg.com/80/v2-ac2e25e80c1adb1ab6eaa90c04fa38f9_1440w.webp?source=1def8aca,2015-04-01 00:45:20
知乎热榜,2025-04-02 12:21:56,29,15456635946,心理学中有「读心术」吗？你认为什么是心理学中的「读心术」？,,61 万热度,https://www.zhihu.com/question/15456635946,https://pic2.zhimg.com/50/v2-f64ab58cc6d22c40a5f7ecfe5aeca0b1_b.jpg,2025-03-20 22:20:59
知乎热榜,2025-04-02 12:21:56,30,1890062996060987466,「AI 识别眼力赛」图片组开赛！你能否分辨出哪个由 AI 生成，哪个是人的创作？,在 AI 创作的内容越来越泛滥的情况下，编辑部小李特别筹备「AI 识别眼力赛」，并联动答主@杂然赋流形丶@拉格朗日的忧郁@Scotty@段小草@桔了个仔@Felina@范函子Skyline@Cecilia@张姆斯准备了一套特别题目。 图片辨别题和文字辨别题各 10 组素材，你能一眼识别出哪个是 AI 创作吗？你发现了哪些 AI 创作的典型特征？ 欢迎在回答中写下你的判断结论并聊聊依据。4月26日，小李会在回答中揭晓答案和素材原作者！ 所有题目均判断正确且认真写下理由的知友，可参与瓜分 10000 盐粒 ！ ⚠️请注意，此题禁止一切形式的 AI 辅助作答，请充分调动你作为人类的敏锐度，作出判断吧！ 题目见下图⬇️⬇️⬇️ 文字组直通车：「AI 识别眼力赛」文字组开赛！你能否分辨出哪个由 AI 生成，哪个是人的创作？ 当下 AI 技术飞速发展，人类已经能通过训练 AI 生成各种形态的惊艳内容。人类灵感可以交给 AI 吗？AI 会吃掉我的创意 DNA 吗？人类与 AI 的共创之路，将会把我们带向哪里？4 月 1 日至 4 月 26 日，我们一起漫谈 AI 时代人类创作可能的明天。 更多精彩见：https://www.zhihu.com/parker/campaign/1888928696380920088,60 万热度,https://www.zhihu.com/question/1890062996060987466,https://picx.zhimg.com/50/v2-40efc7f6207a563a55d7ea43db3234e9_b.jpg,2025-03-31 07:28:53
知乎热搜,2025-04-02 13:22:47,1,,小米集团午后跌超4%,,,https://www.zhihu.com/search?q=%E5%B0%8F%E7%B1%B3%E9%9B%86%E5%9B%A2%E5%8D%88%E5%90%8E%E8%B7%8C%E8%B6%854%25,,
知乎热搜,2025-04-02 13:22:47,2,,Fram-2载人航天飞行任务,,,https://www.zhihu.com/search?q=Fram-2%E8%BD%BD%E4%BA%BA%E8%88%AA%E5%A4%A9%E9%A3%9E%E8%A1%8C%E4%BB%BB%E5%8A%A1,,
知乎热搜,2025-04-02 13:22:47,3,,多家银行宣布下调存款利率,,,https://www.zhihu.com/search?q=%E5%A4%9A%E5%AE%B6%E9%93%B6%E8%A1%8C%E5%AE%A3%E5%B8%83%E4%B8%8B%E8%B0%83%E5%AD%98%E6%AC%BE%E5%88%A9%E7%8E%87,,
知乎热搜,2025-04-02 13:22:47,4,,你干过最牛的一件事是什么,,,https://www.zhihu.com/search?q=%E4%BD%A0%E5%B9%B2%E8%BF%87%E6%9C%80%E7%89%9B%E7%9A%84%E4%B8%80%E4%BB%B6%E4%BA%8B%E6%98%AF%E4%BB%80%E4%B9%88,,
知乎热搜,2025-04-02 13:22:47,5,,工业克苏鲁什么意思,,,https://www.zhihu.com/search?q=%E5%B7%A5%E4%B8%9A%E5%85%8B%E8%8B%8F%E9%B2%81%E4%BB%80%E4%B9%88%E6%84%8F%E6%80%9D,,
知乎热搜,2025-04-02 13:22:47,6,,为什么月薪 2 万的沈琳愿意卖卤肉,,,https://www.zhihu.com/search?q=%E4%B8%BA%E4%BB%80%E4%B9%88%E6%9C%88%E8%96%AA%202%20%E4%B8%87%E7%9A%84%E6%B2%88%E7%90%B3%E6%84%BF%E6%84%8F%E5%8D%96%E5%8D%A4%E8%82%89,,
知乎热搜,2025-04-02 13:22:47,7,,AI 时代下的家电智能化,,,https://www.zhihu.com/search?q=AI%C2%A0%E6%97%B6%E4%BB%A3%E4%B8%8B%E7%9A%84%E5%AE%B6%E7%94%B5%E6%99%BA%E8%83%BD%E5%8C%96,,
知乎热搜,2025-04-02 13:22:47,8,,家电行业的「科技平权」,,,https://www.zhihu.com/search?q=%E5%AE%B6%E7%94%B5%E8%A1%8C%E4%B8%9A%E7%9A%84%E3%80%8C%E7%A7%91%E6%8A%80%E5%B9%B3%E6%9D%83%E3%80%8D,,
知乎热搜,2025-04-02 13:22:47,9,,AWE 未来生活家,,,https://www.zhihu.com/search?q=AWE%C2%A0%E6%9C%AA%E6%9D%A5%E7%94%9F%E6%B4%BB%E5%AE%B6,,
知乎热搜,2025-04-02 13:22:47,10,,卷出新高度的 AI 家电,,,https://www.zhihu.com/search?q=%E5%8D%B7%E5%87%BA%E6%96%B0%E9%AB%98%E5%BA%A6%E7%9A%84%20AI%C2%A0%E5%AE%B6%E7%94%B5,,
知乎热搜,2025-04-02 13:22:47,11,,看见未来家,,,https://www.zhihu.com/search?q=%E7%9C%8B%E8%A7%81%E6%9C%AA%E6%9D%A5%E5%AE%B6,,
知乎热搜,2025-04-02 13:22:47,12,,让家电回归工具本质,,,https://www.zhihu.com/search?q=%E8%AE%A9%E5%AE%B6%E7%94%B5%E5%9B%9E%E5%BD%92%E5%B7%A5%E5%85%B7%E6%9C%AC%E8%B4%A8,,
知乎热搜,2025-04-02 13:22:47,13,,湖人战胜火箭,,,https://www.zhihu.com/search?q=%E6%B9%96%E4%BA%BA%E6%88%98%E8%83%9C%E7%81%AB%E7%AE%AD,,
知乎热搜,2025-04-02 13:22:47,14,,长的漂亮真的很有优势吗,,,https://www.zhihu.com/search?q=%E9%95%BF%E7%9A%84%E6%BC%82%E4%BA%AE%E7%9C%9F%E7%9A%84%E5%BE%88%E6%9C%89%E4%BC%98%E5%8A%BF%E5%90%97,,
知乎热搜,2025-04-02 13:22:47,15,,扑面而来的家电科技,,,https://www.zhihu.com/search?q=%E6%89%91%E9%9D%A2%E8%80%8C%E6%9D%A5%E7%9A%84%E5%AE%B6%E7%94%B5%E7%A7%91%E6%8A%80,,
知乎热搜,2025-04-02 13:22:47,16,,河北廊坊永清县 4.2 级地震,,,https://www.zhihu.com/search?q=%E6%B2%B3%E5%8C%97%E5%BB%8A%E5%9D%8A%E6%B0%B8%E6%B8%85%E5%8E%BF%204.2%20%E7%BA%A7%E5%9C%B0%E9%9C%87,,
知乎热搜,2025-04-02 13:22:47,17,,中国肥胖率最高的省是河北,,,https://www.zhihu.com/search?q=%E4%B8%AD%E5%9B%BD%E8%82%A5%E8%83%96%E7%8E%87%E6%9C%80%E9%AB%98%E7%9A%84%E7%9C%81%E6%98%AF%E6%B2%B3%E5%8C%97,,
知乎热搜,2025-04-02 13:22:47,18,,义乌购房新政公布,,,https://www.zhihu.com/search?q=%E4%B9%89%E4%B9%8C%E8%B4%AD%E6%88%BF%E6%96%B0%E6%94%BF%E5%85%AC%E5%B8%83,,
知乎热搜,2025-04-02 13:22:47,19,,多家银行消费贷利率阶段性上调,,,https://www.zhihu.com/search?q=%E5%A4%9A%E5%AE%B6%E9%93%B6%E8%A1%8C%E6%B6%88%E8%B4%B9%E8%B4%B7%E5%88%A9%E7%8E%87%E9%98%B6%E6%AE%B5%E6%80%A7%E4%B8%8A%E8%B0%83,,
知乎热搜,2025-04-02 13:22:47,20,,消费贷利率 3% 以下或被叫停,,,https://www.zhihu.com/search?q=%E6%B6%88%E8%B4%B9%E8%B4%B7%E5%88%A9%E7%8E%87%203%25%20%E4%BB%A5%E4%B8%8B%E6%88%96%E8%A2%AB%E5%8F%AB%E5%81%9C,,
知乎热搜,2025-04-02 13:22:47,21,,马斯克：人类首次极地轨道飞行将发射,,,https://www.zhihu.com/search?q=%E9%A9%AC%E6%96%AF%E5%85%8B%EF%BC%9A%E4%BA%BA%E7%B1%BB%E9%A6%96%E6%AC%A1%E6%9E%81%E5%9C%B0%E8%BD%A8%E9%81%93%E9%A3%9E%E8%A1%8C%E5%B0%86%E5%8F%91%E5%B0%84,,
知乎热搜,2025-04-02 13:22:47,22,,见义勇为荣誉被冒领,,,https://www.zhihu.com/search?q=%E8%A7%81%E4%B9%89%E5%8B%87%E4%B8%BA%E8%8D%A3%E8%AA%89%E8%A2%AB%E5%86%92%E9%A2%86,,
知乎热搜,2025-04-02 13:22:47,23,,中国航空首批民用运营合格证颁发,,,https://www.zhihu.com/search?q=%E4%B8%AD%E5%9B%BD%E8%88%AA%E7%A9%BA%E9%A6%96%E6%89%B9%E6%B0%91%E7%94%A8%E8%BF%90%E8%90%A5%E5%90%88%E6%A0%BC%E8%AF%81%E9%A2%81%E5%8F%91,,
知乎热搜,2025-04-02 13:22:47,24,,中国低空飞行载人时代开启,,,https://www.zhihu.com/search?q=%E4%B8%AD%E5%9B%BD%E4%BD%8E%E7%A9%BA%E9%A3%9E%E8%A1%8C%E8%BD%BD%E4%BA%BA%E6%97%B6%E4%BB%A3%E5%BC%80%E5%90%AF,,
知乎热搜,2025-04-02 13:22:47,25,,NBA爆发大规模冲突,,,https://www.zhihu.com/search?q=NBA%E7%88%86%E5%8F%91%E5%A4%A7%E8%A7%84%E6%A8%A1%E5%86%B2%E7%AA%81,,
知乎热搜,2025-04-02 13:22:47,26,,「甲亢哥」中国行直播,,,https://www.zhihu.com/search?q=%E3%80%8C%E7%94%B2%E4%BA%A2%E5%93%A5%E3%80%8D%E4%B8%AD%E5%9B%BD%E8%A1%8C%E7%9B%B4%E6%92%AD,,
知乎热搜,2025-04-02 13:22:47,27,,甲亢哥中国行,,,https://www.zhihu.com/search?q=%E7%94%B2%E4%BA%A2%E5%93%A5%E4%B8%AD%E5%9B%BD%E8%A1%8C,,
知乎热搜,2025-04-02 13:22:47,28,,距深圳市约170公里发现1亿吨油田,,,https://www.zhihu.com/search?q=%E8%B7%9D%E6%B7%B1%E5%9C%B3%E5%B8%82%E7%BA%A6170%E5%85%AC%E9%87%8C%E5%8F%91%E7%8E%B01%E4%BA%BF%E5%90%A8%E6%B2%B9%E7%94%B0,,
知乎热搜,2025-04-02 13:22:47,29,,南京全面取消商品房限售,,,https://www.zhihu.com/search?q=%E5%8D%97%E4%BA%AC%E5%85%A8%E9%9D%A2%E5%8F%96%E6%B6%88%E5%95%86%E5%93%81%E6%88%BF%E9%99%90%E5%94%AE,,
知乎热榜,2025-04-02 13:22:47,1,1890675416567641364,东部战区位台湾海峡中、南海域组织「海峡雷霆-2025A」演练，由联合利剑变为海峡雷霆，意味着什么？,东部战区新闻发言人施毅陆军大校表示，4月2日，中国人民解放军东部战区位台湾海峡中部、南部相关海域组织“海峡雷霆-2025A”演练，重点实施查证识别、警告驱离、拦截扣押等科目，检验部队区域管控、联合封控、精打击要能力。更多资讯请下载央视新闻客户端,1598 万热度,https://www.zhihu.com/question/1890675416567641364,https://pic1.zhimg.com/80/v2-a3f365ddc1e2a416306a0eb7f6549d79_1440w.png,2025-04-02 00:02:26
知乎热榜,2025-04-02 13:22:47,2,1890105053098009745,「甲亢哥」来华直播登上多国社媒榜单热门，为什么这种「体验」形成的反差能让外国人这么惊讶？,,877 万热度,https://www.zhihu.com/question/1890105053098009745,https://picx.zhimg.com/80/v2-b8c028c74521ddefa627d33f84eb9550_1440w.webp?source=1def8aca,2025-03-31 10:16:01
知乎热榜,2025-04-02 13:22:47,3,1890152838069445220,领导在一次会议上严厉批评了你，而实际上错误是由另一位同事小王造成的，你怎么办?,「瞎扯办公室」征稿中，邀请你用「瞎扯」调戏一下生活，优秀回答有机会入选知乎日报《瞎扯》栏目哦～ 我简单扯两句」有奖活动主链接：www.zhihu.com/parker/campaign/188864385232954185,330 万热度,https://www.zhihu.com/question/1890152838069445220,https://picx.zhimg.com/80/v2-6135f88b50f7bb6e26a4949c3b4c25a5_1440w.png,2025-03-31 13:25:53
知乎热榜,2025-04-02 13:22:47,4,1890428133892671408,我们真的需要「零百加速三四秒」的平民跑车吗？掌控得了吗？,市面上大家开的车零百加速大都十秒开外，中高级车一般在8秒上下，基本8秒涵盖了90%以上的车。几百万的跑车零百四五秒，因为买车门槛太高存量不多。（前面说的是油车） 但当电车，混动随随便便就能去到四五秒，三四秒时，买车门槛已降低至几十万，购车年龄会一降再降，当一个个喜欢拥抱高科技的新手司机，操控着这么一部暴力机器，你认为他会悠悠的开吗？安全吗？能掌控得了吗？,324 万热度,https://www.zhihu.com/question/1890428133892671408,https://pic1.zhimg.com/80/v2-241dca86cc1c7e119d8b034a6a25df91_1440w.webp?source=1def8aca,2025-04-01 07:39:49
知乎热榜,2025-04-02 13:22:47,5,1890752343743639634,如何评价知名网络主播「甲亢哥」Speed 于4月2日在重庆的直播？,继前四场直播后，4月2日下午3点开始的重庆直播有什么新的内容和活动形式出现么？是否仍然会出现一些匪夷所思的烂梗？,306 万热度,https://www.zhihu.com/question/1890752343743639634,https://pica.zhimg.com/80/v2-9320745cbd1b9d2d975fd762b6eeb1e9_1440w.webp?source=1def8aca,2025-04-02 05:08:07
知乎热榜,2025-04-02 13:22:47,6,1888651011868062054,海昏侯墓中出土大量儒家典籍，暗示他可能具备深厚的儒学修养，史书称其「荒淫无道」是否被刻意夸大？,,299 万热度,https://www.zhihu.com/question/1888651011868062054,https://pic1.zhimg.com/80/v2-ca4f664b161dc0f52e37aaf6d1279a82_1440w.webp?source=1def8aca,2025-03-27 09:58:10
知乎热榜,2025-04-02 13:22:47,7,1890713327908384953,如何看待乐道汽车总裁艾铁成宣布「下课」，乐道目前面临哪些困境？该如何破局？,4月2日，蔚来公司对旗下乐道品牌进行组织人事调整。当天上午，乐道汽车总裁艾铁成通过乐道App发表文章宣布离职，不再担任乐道汽车总裁和蔚来高级副总裁。蔚来公司随后对乐道汽车进行了人事任命，宣布原能源业务负责人沈斐担任乐道汽车总裁，全面负责乐道销售工作和区域公司管理，向蔚来联合创始人、总裁秦力洪汇报。https://baijiahao.baidu.com/s?id=1828252806294744670&wfr=spider&for=pc,299 万热度,https://www.zhihu.com/question/1890713327908384953,https://pic1.zhimg.com/80/v2-2ba6f614cf3b2bb242143a2bad12ef55_1440w.webp?source=1def8aca,2025-04-02 02:33:05
知乎热榜,2025-04-02 13:22:47,8,1890054557519816321,黄霄雲翻唱华晨宇作品被质疑偷歌，具体情况如何？华晨宇方最新回应称拒绝音乐版权擦边，黄霄雲是否侵权？,4月2日，针对黄霄云翻唱《烟火里的尘埃》的版权争议，@华晨宇工作室发文称经过昨日一天的主动沟通，双方未能达成有效共识。华晨宇方表示避重就轻不是解决问题的方式，同时拒绝音乐版权擦边行为。4月2日，@华晨宇工作室 发文回应近期与歌手黄霄云的版权争议。 华晨宇方表示：经过昨日一天的主动沟通，很遗憾双方未能达成有效共识。我方坚持立场：避重就轻不是解决问题的方式，同时拒绝音乐版权擦边行为。我们一直秉持开放的心态欢迎优秀音乐人交流共进，但与此同时希望音乐作品能够多一些纯粹原创，少一些模糊“借鉴”。尊重音乐创作者的作品创意是原创音乐人的基本职业道德素养，每一份饱含心血的成果都应该被认可和保护。 华晨宇方回应“黄霄云翻唱版权争议”：未能达成共识，拒绝音乐版权擦边 3月31日，黄霄雲工作室账号发布声明并配文：“近日，我方发现部分网络用户就黄霄雲女士翻唱华晨宇先生(原唱)歌曲《烟火里的尘埃》一事，通过自媒体平台散布及大肆传播不实言论，恶意诋毁黄霄雲女士声誉的行为，已严重侵害黄霄雲女士的个人名誉及正面社会形象。” 华晨宇方回应 4月1日，@华晨宇全球歌迷会官博 发布声明：“某艺人拥有的是《烟火里的尘埃》使用版权，而非《孩子》live版的使用版权，也并未向华晨宇方沟通借鉴和声改编一事，其使用范围应仅限于《烟火里的尘埃》歌曲本身，若要进行改编也是在原创的基础上自行创作或购买使用版权，而非直接裁剪他人创作内容。” 随后，@华晨宇全球歌迷会官博 再次发文：“翻唱作为一种再创作形式，本应是对原作的致敬与新解，但若直接引用原作而未明确标注或取得授权，恐有模糊原创与演绎界限之嫌。此举虽可能出于对原作的喜爱，却也是对原创者心血价值的侵害，希望音乐人在无论是翻唱、改编抑或二次创作中都应有清晰的授权声明。这是音乐生态良性发展的基石，愿所有热爱不被辜负，愿每一份创作皆被尊重。” 4月2日，@华晨宇工作室 发文：“经过昨日一天的主动沟通，很遗憾双方未能达成有效共识。我方坚持立场：避重就轻不是解决问题的方式，同时拒绝音乐版权擦边行为。” 黄霄雲翻唱华晨宇作品被质疑偷歌，双方都回应了！,272 万热度,https://www.zhihu.com/question/1890054557519816321,https://picx.zhimg.com/80/v2-0be3980a67a19bc039005f226dd7725e_1440w.png,2025-03-31 06:55:22
知乎热榜,2025-04-02 13:22:47,9,1890718764514927351,京东宣布达达员工今年升级至 19 薪，明年升级至 20 薪，这在业内处于什么水平？涨薪会带来哪些影响？,4月2日，京东宣布，达达员工薪酬将在今年升级至19薪，明年升级至20薪；此外，部分优秀达达员工将授予京东集团股票。这也是去年以来京东体系给员工第8次加薪。,246 万热度,https://www.zhihu.com/question/1890718764514927351,https://pic1.zhimg.com/80/v2-4d073157e3345f057fb930d67dfaebf4_1440w.webp?source=1def8aca,2025-04-02 02:54:41
知乎热榜,2025-04-02 13:22:47,10,1888989861488345783,刚果河水量远超长江，为什么却连一座大型水电站都没有？,,227 万热度,https://www.zhihu.com/question/1888989861488345783,https://pica.zhimg.com/80/v2-ea17e63c807cd0dc73d6f98f6373ea1a_1440w.webp?source=1def8aca,2025-03-28 08:24:38
知乎热榜,2025-04-02 13:22:47,11,1890112503347912883,前奥运冠军、著名田径运动员王军霞退役后首次参赛半马跑出 1 小时  35 分，你对该成绩有哪些评价？,阳山半程马拉松在无锡阳山正式开跑，前奥运冠军、中国著名田径运动员王军霞现身比赛现场。王军霞最终以1小时35分的成绩跑完了半马，排名女子组第6。王军霞透露：“这是我退役以来第一次参赛，第一次参加半马，本来我的任务不用跑完，领着大家跑一跑就可以了，但是路边拉拉队的加油声太给力了。”52岁“东方神鹿”王军霞归来！1小时35分，半马第6名！,211 万热度,https://www.zhihu.com/question/1890112503347912883,https://pic1.zhimg.com/80/v2-b35dc18ba021d2b161b614dae2b08f82_1440w.webp?source=1def8aca,2025-03-31 10:45:37
知乎热榜,2025-04-02 13:22:47,12,1890165471204045597,网友投诉在山姆买的莲雾中吃出蠕动活虫，客服称系正常情况，如何看待此事？,近日，有网友发布多个视频称，在山姆买的黑金刚莲雾中吃出多条蠕动的活虫。对此，3月31日，山姆会员商店在线客服回应南都记者称，“这个是正常情况的，因为水果类商品没有使用药之类的。但一般很少会出现这种情况，我们售卖也会提前检查商品。” 网友称在山姆买的莲雾中出现多条蠕动活虫。 该网友告诉南都记者，其在北京大兴山姆会员店买了一盒黑金刚莲雾，回家洗水果发现莲雾有点磕碰，“还把坏掉的用嘴啃掉，结果虫子尾巴露出来了。”其掰开莲雾发现不止一条虫子，有的死了，还有更肥大的虫子在蠕动，“有七八条活体虫，真的好恶心。” 对此，3月31日，山姆会员商店在线客服回应南都记者称，“这个是正常情况的，因为水果类商品没有使用药之类的。但一般很少会出现这种情况，我们售卖也会提前检查商品，保障商品品质。如果消费者遇到该情况，可以联系客服处理或申请售后。” 至于在水果中吃出活虫的售后方案及赔偿情况，上述客服表示，“实在不好意思，这个具体后续可以联系我们处理的。”网友投诉在山姆购买的莲雾中吃出蠕动活虫！客服称系正常情况_南方+_南方plus,174 万热度,https://www.zhihu.com/question/1890165471204045597,https://picx.zhimg.com/80/v2-39a5ac80cbc0d77df007498b1e51bbd0_1440w.webp?source=1def8aca,2025-03-31 14:16:05
知乎热榜,2025-04-02 13:22:47,13,664339031,真有人一松开油门就把脚放在刹车上吗？,一个是刹车踏板不踩的时候翘起的角度比油门大，放在上面要一直勾着脚背，很累。二是不觉得两脚中间有点挤，那东西没地方摆吗？,162 万热度,https://www.zhihu.com/question/664339031,https://pic1.zhimg.com/9b66926a2_xl.jpg?source=57bbeac9,2024-08-15 02:20:12
知乎热榜,2025-04-02 13:22:47,14,1890105194609607880,如何评价2025年3月米哈游《原神》5.5爱可菲立绘？,#原神# #爱可菲# #明绚千韵# ▌明绚千韵 · 爱可菲 调霜焙巧，琢味求臻 === 「『司掌甜蜜的精灵』、『统御味蕾的暴君』？也没报纸上传得那么夸张哦，爱可菲只是个喜欢烹饪的…有一点点严格的女孩啦。那些不认真对待料理的家伙，当然也得不到她的尊重！总之，你们两个的『风味』一定能搭配得好，我保证！」 ——娜维娅 长久以来，《蒸汽鸟报》的「美食专栏」被饕客们视作寻味尝鲜的风向标。作为这一版面的常客，「德波大饭店前主厨」爱可菲和她的「技术料理」更是享誉枫丹。 「分析」、「萃取」、「调和」，爱可菲拆解的不仅是「风味物质」，更是枫丹人对「美味」的固有认知。那些被解构又重组的味觉密码，在舌尖重新编写了珍馐佳肴的定义。 评论家们从不吝惜对这位天才主厨的赞赏，但也不会回避围绕她的争议。烹饪与管理两方面的一丝不苟，让爱可菲严苛的形象深入人心；她对同行和学徒们的毫不留情的点评，也让自己成为了烹饪界的舆论焦点…,148 万热度,https://www.zhihu.com/question/1890105194609607880,https://pic1.zhimg.com/80/v2-1c4988834155dca5ee370ff67dd32874_1440w.png,2025-03-31 10:16:34
知乎热榜,2025-04-02 13:22:47,15,1890492320635393765,如何评价电视剧《棋士》第 11 集？,感觉崔业开始慌了,135 万热度,https://www.zhihu.com/question/1890492320635393765,https://pica.zhimg.com/80/v2-0ea132bbb2b78dda1fcc34bbab66246e_1440w.webp?source=1def8aca,2025-04-01 11:54:52
