type,datetime,index,id,title,desc,hot,url,img,createtime
知乎热榜,2025-03-24 04:14:31,7,15619242556,曝奔驰裁员 3 万人，斥巨资鼓励自愿离职，最高获赔 400 万元，怎样看这一做法？奔驰遇到了哪些问题？,"近日，据德国《Handelsblatt》报道，梅赛德斯管理层将在 4 月给所有员工发信，鼓励员工自愿离职。 据报道，奔驰管理层将在 4 月给所有员工发信，提供非常丰厚的遣散费，以鼓励员工自愿离职。对于月薪近 8 万人民币且在公司工作至少 30 年的中层经理来说，遣散费超过 400 万人民币；而对于一名 30 多岁、月薪约 4.8 万人民币的工厂工人，遣散费也略高于 80 万人民币。 奔驰首席执行官奥拉・卡列尼乌斯（Ola K ä llenius）希望这份优厚的离职补偿能够鼓励约 3 万名员工自愿离职。 相关细节已经与企业职工委员会达成了一致，埃尔贡・吕马利表示："" 如果你不想离职，那也不必离开。但如果你选择离职，就会得到一笔丰厚的补偿。"" 这种看似 "" 慷慨 "" 的做法，实际上是奔驰在困境中做出的艰难抉择。 在汽车行业加速向电动化、智能化转型的浪潮中，传统汽车巨头们面临着前所未有的挑战。 一方面在中国这个庞大的市场，奔驰汽车的销量正急剧下滑。中国电动汽车品牌凭借其在电池技术、智能驾驶等领域的优势，以及更具竞争力的价格，逐渐抢占了奔驰等传统豪华品牌的市场份额。 据相关数据显示，奔驰 2024 年其全年销量为 68.36 万辆，同比下滑 7.3%，中国成为奔驰全球降幅最大的单一市场。在新能源领域，奔驰的纯电动汽车销量仅为 18.51 万辆，同比大跌 23.1%。尽管部分核心豪华产品如长轴距 GLC SUV 和长轴距 C 级车仍保持增长，但整体下滑趋势依然明显。 另外奔驰希望通过优化员工结构，能够更加灵活地应对市场变化，加快向电动化、智能化转型的步伐。https://baijiahao.baidu.com/s?id=1827369396253978250&wfr=spider&for=pc",314 万热度,https://www.zhihu.com/question/15619242556,https://pic1.zhimg.com/80/v2-5de3316698c67f71cddcb73dc645beed_1440w.webp?source=1def8aca,2025-03-23 11:03:05
知乎热榜,2025-03-24 04:14:31,8,15602725563,女生劝阻吸烟被怼不闻烟味别出来吃饭，官方称饭店有规劝义务，你能接受公共场合抽烟吗？二手烟有哪些危害？,近日，女生劝阻吸烟被怼不闻烟味别出来吃饭引发关注。针对此事，3月23日上午，杭州市政府服务热线一名工作人员告诉大河报《看见》记者，按照要求是必须全面禁烟的，娱乐场所和餐饮店都是有禁烟（规定）的，公共场所是不允许随便点香烟的，这种情况一旦发生的话，饭店是有义务进行规劝的。同时，如果饭店没有张贴禁烟标识，可以向当地市场监督管理局进行反映。 据了解，杭州市在2019年修订实施了《杭州市公共场所控制吸烟条例》（以下简称为“《条例》”，其中明确：室内公共场所、室内工作场所、公共交通工具内禁止吸烟，但娱乐、经营性住宿和餐饮等室内公共场所在一定期限内为限制吸烟场所。限制吸烟场所的经营者或者管理者应当按要求划定或者设置吸烟区(室)。 记者注意到，《条例》自2019年1月1日施行后，规定娱乐、经营性住宿和餐饮等室内公共场所在一定期限内为限制吸烟场所，经营者或者管理者应当按要求划定或者设置吸烟区（室），这一期限划定至2021年12月31日。 据多家主流媒体报道称，自2022年1月1日起，新修订的《杭州市公共场所控制吸烟条例》结束缓冲期，此前按规定设置吸烟区（室）的室内公共场所全面禁止吸烟。 也就是说，从2022年1月1日开始，杭州室内公共场所、室内工作场所、公共交通工具内全面禁止吸烟。同时，部分公共场所室外区域禁止吸烟。比如，为未成年人提供教育、教学、活动、服务的场所；为妇女、儿童提供服务的医疗卫生机构、儿童福利机构；体育健身场馆、演出场所的室外观众座席和比赛、健身、演出区域；对社会开放的文物保护单位；法律、法规、规章规定的其他公共场所等。 不想闻烟味别出来吃饭？女生劝阻吸烟被怼，官方回应：全面禁烟，饭店有规劝义务,298 万热度,https://www.zhihu.com/question/15602725563,https://picx.zhimg.com/80/v2-e2b2857d6278ea66e848b28360d78593_1440w.webp?source=1def8aca,2025-03-23 05:54:59
知乎热榜,2025-03-24 04:14:31,9,1886386539191316855,死后立遗嘱要子女将自己骨灰撒向空中随风而去，违法吗？,,272 万热度,https://www.zhihu.com/question/1886386539191316855,https://pic1.zhimg.com/80/v2-7b665bb7e2f3ffa835165ff22224a880_1440w.webp?source=1def8aca,2025-03-21 03:59:58
知乎热榜,2025-03-24 04:14:31,10,15490548065,《玉盘》作者回应各方解读，称「这是中国人特有的心意相通」，为什么我们会被这首歌打动？,春晚上的《玉盘》火了，围绕这首歌的二创、解读，持续到现在。 央视新闻《不如见一面》专栏，去四川成都，去《玉盘》背后的创作团队“葫芦童声”。 他们看到了那些隔着网络传达的共鸣。《玉盘》词曲创作者谭淇尹说：“《玉盘》里诗词的化用、文字的表达形式，都是我们熟悉的，而且是中国特有的。”这就意味着，“我不需要跟你说明白，但是你看到我的字，你就知道这是我们的身份，我们的成长，我们共用了一套系统去理解这个世界。” 你在《玉盘》里听到了什么？为什么我们会被这首歌打动？是童谣？是战歌？《玉盘》说，中国人都会懂,262 万热度,https://www.zhihu.com/question/15490548065,https://picx.zhimg.com/80/v2-6de920cf16c5b1f19b70ed3611faf8cf_1440w.webp?source=1def8aca,2025-03-21 08:30:46
知乎热榜,2025-03-24 04:14:31,11,15539424051,二手平台发霉橘子标价 500 元，这是玩梗还是真有科研价值？霉变的橘子有哪些危害？,近日，某二手物品交易平台上涌现大量“霉变橘子”交易帖，更有信息称“发霉的橘子在网上竟卖出了天价”。 有媒体报道，山东一女子在家中发现了新商机，那就是完全发霉变绿的橘子，单单一个发毛的橘子在网上就能卖到500元的价格，真是长见识了！ 当事人表示，本来想扔掉了，结果在软件上一看，发现卖的人还挺多，最后把这个橘子出掉了。 “发霉橘子”突然爆火卖出天价，网友称“我直接扔了”，专家紧急提醒_腾讯新闻,186 万热度,https://www.zhihu.com/question/15539424051,https://pic1.zhimg.com/80/v2-e513c26fb5e2b120546b89c4ef1a1070_1440w.webp?source=1def8aca,2025-03-22 03:32:50
知乎热榜,2025-03-24 04:14:31,12,15628277578,台湾「大罢免」全面升温，国民党将在全台陆续举办政策说明会反制大罢免，会带来哪些影响？,据台媒报道，民进党发起的“大罢免”活动全面升温。国民党将在全台陆续举办政策说明会，反制大罢免。[中国新闻]台湾“大罢免”全面升温,185 万热度,https://www.zhihu.com/question/15628277578,https://pic1.zhimg.com/80/v2-ff81731581e57056ffeb3623ddb49454_1440w.png,2025-03-23 13:28:45
知乎热榜,2025-03-24 04:14:31,13,3257311792,为什么有的动物用舌头喝水而不用嘴直接喝？,是它们用嘴喝不了，还是因为什么？ 比如最常见的狗，就是用舌头把水卷起来喝，还有大象用鼻子喝，等等。 大象肯定是用嘴也能喝，只不过鼻子方便。那其它的动物呢？ （图片我养的守宫伸舌头舔水） ——— 11.23补充一下，看了大家的回答，好像有个很重要的点被忽视了。就是，动物用舌头卷水还是直接喝，和能不能形成负压吸上来，其实并不对立。比如可以把嘴当成一个 碗，低头，让水进到嘴里，然后咽下就行，而不是非要吸上去。此外，我也想过是不是狗的吻比较长，导致用嘴喝水容易呛鼻子，但是短吻的动物一样也有不用嘴直接盛水喝的。大象 可以用鼻子喝水是因为体内有一层结构可以把气管隔开不会呛水，应该把这个特例单算。,184 万热度,https://www.zhihu.com/question/3257311792,https://pic1.zhimg.com/80/v2-4cb1b3b65ed48a57b11bad5eb865fda4_1440w.gif,2024-11-05 14:18:29
知乎热榜,2025-03-24 04:14:31,14,15470790067,江西一县称因人口出生率下降，教师规模产生剩余，拟研究转岗分流政策，如何看待这一现象？,近日，江西省万年县政府办在“问政江西”平台答复网友关于今年是否招聘英语教师的问题时，披露了该县因人口出生率下降，科学测算出学生规模将逐年缩减、教师规模产生剩余。 万年县政府办根据县教体局调查情况回复称，“2025年万年县不会招聘英语老师，我县政府十分重视教育工作，2017年前后，政府连续出台保障措施，招聘教师以满足教育教学的需要。但近年来人口出生率严重下降（出生人口从2008年的7934人到2024年的2478人），经科学测算，截至今年，学生人数将会以年平均4000多人的规模递减，按照师生比测算，教师也要以230多名的规模产生剩余，且主要是语数英教师。” 万年县政府办表示，“为妥善应对，有效利用师资资源，我县正在未雨绸缪，科学谋划，拟着手研究制定教师转岗分流、调节教师结构性均衡方面的相关政策，对有富余的相关专业教师短期内不再考虑招聘。” 而在去年，根据万年县“五型”办消息披露，万年县根据上级教师招聘工作的要求，结合本县教育发展的实际需求，决定通过全省统一招聘的方式，补充高中教师15人。此外，为加强万年县教育人才队伍建设，提高教育教学质量，计划面向硕士及以上学位研究生引进高层次教育人才10人。 资料来源万年县：测算将年均剩余超230名教师，拟研究转岗分流政策_招聘_教育_县政府办,177 万热度,https://www.zhihu.com/question/15470790067,https://pica.zhimg.com/80/v2-00082485d80322f8372ecd61d3e84dd7_1440w.webp?source=1def8aca,2025-03-21 04:14:10
知乎热榜,2025-03-24 04:14:31,15,15579727999,F-47到底有没有鸭翼？,网上关于美国六代机的图片满天飞，但是几乎不重样，到底是什么构型？,150 万热度,https://www.zhihu.com/question/15579727999,https://pic4.zhimg.com/50/v2-405dc2249b817f747448bb15e8126793_b.jpg,2025-03-22 14:40:34
知乎热榜,2025-03-24 04:14:31,16,15614552198,三只羊再次道歉「今后将继续按照应赔尽赔原则，执行退一赔三标准」，除了事后赔偿，商家更应该重视哪些环节？,关于停业整改情况的通报 尊敬的消费者、粉丝、社会公众及媒体朋友们： 针对我公司前期在直播带货“香港美诚”牌月饼和“鲜多裕”牌澳洲谷饲牛肉卷中存在的相关问题，给消费者带来了损失和伤害，我们感到无比自责。这暴露出我公司在经营管理中存在突出问题，我们对此负有不可推卸的责任。在此，再次向大家真诚道歉。 自合肥市联合调查组发布情况通报后，我们立即成立了以董事会成员为总负责的整改工作组，包括招商、选品、品控、核价、督查、售后服务、退赔等7个专项小组，全方位进行排查、整改。 一、2024年10月11日，我们按照行政处罚决定书足额缴纳罚款6894.95万元。 二、对于“香港美诚”牌月饼和“鲜多裕”牌澳洲谷饲牛肉卷产品，目前已累计赔付2777.85万元，今后将继续按照应赔尽赔原则，执行退一赔三标准，做好退赔工作。 三、严格把关产品质量，新筛选、签定3家第三方专业品控机构，分品类编制食品、化妆品等7类品控作业指导书，按规范严格把控产品质量。 四、严格甄选品牌合作，进一步提升自营品占比，提高准入门槛，合作品牌压减80%。 五、严格直播讲解和主播管理，设置多层审核环节，加强直播内容审查，确保卖点信息与产品信息的统一性、准确性。严格遵守《网络主播行为规范》，制定《主播违法违规行为处理办法》，加强网络文明行为规范，设置专人专项检查，对违规主播及时清退、解约。 六、严格售后服务标准，开设专门售后服务账号“三只羊网络售后”，对经认定的问题产品，我们承诺先行垫付退赔款，提高消费者售后服务体验。 感谢大家对我们的批评、监督和帮助，今后我们将严格落实行业标准，积极承担并履行相应的法律义务和社会责任，用实际行动回馈大家对我们的认可、信任与支持。 在此一并公布： 社会监督电话：4008686087 邮箱：service@sanzhiyang.cn 欢迎大家多提宝贵意见建议。 合肥三只羊网络科技有限公司 2025年3月23日“三只羊”通报停业整改情况，再次道歉,134 万热度,https://www.zhihu.com/question/15614552198,https://pica.zhimg.com/80/v2-5e5df17cf17557eac3f74d5c36b00b28_1440w.png,2025-03-23 09:41:11
知乎热榜,2025-03-24 04:14:31,17,681987656,《三角洲行动》大战场没有全屏文字交流，是不是为了掩盖队伍里大部分都是人机的事实？,,118 万热度,https://www.zhihu.com/question/681987656,https://pica.zhimg.com/80/v2-cfd81180d238243627633bb921f7735a_1440w.webp?source=1def8aca,2024-09-28 23:22:11
知乎热榜,2025-03-24 04:14:31,18,629860389,北京有哪些通勤居住友好型区域？,特别是对于上班打工族来说，北京有哪些通勤便利高，生活舒适，但有存在感比较低的区域？,117 万热度,https://www.zhihu.com/question/629860389,https://pic1.zhimg.com/80/v2-9930bd3d0e57b773f400c468e53dc070_1440w.webp?source=1def8aca,2023-11-11 09:03:08
知乎热榜,2025-03-24 04:14:31,19,13086337689,如何看待逐渐没落的港片电影及电视剧？港影的出路在哪里？,是人们看固定题材疲劳了?,116 万热度,https://www.zhihu.com/question/13086337689,https://pic1.zhimg.com/80/v2-45c49413de30630ffc0acaf83f682a47_1440w.webp?source=1def8aca,2025-02-23 01:46:10
知乎热榜,2025-03-24 04:14:31,20,15629139415,C 罗称「我只想葡萄牙赢，若我不上场能赢我会马上同意」，如何评价他的观点？,直播吧03月23日讯 葡萄牙vs丹麦的次回合对决即将打响，赛前，C罗被问到了球队应该拿出怎样不同的表现，来扭转首回合的失利。 C罗：“我们必须踢得更好，我们已经踢过很多比赛，明天我们会尽力做到最好。我不相信有任何人会不想拿出好的表现。有时候只是事情行不通，任何踢过球的人都明白我在说什么。” “明天如果我进球，那很好，如果是其他球员，对我来说也一样。如果葡萄牙要赢球，需要我不上场，那我会马上同意。”“即使我不在球队里，我也会继续这么说，我至死都会捍卫这件球衣。如果我不进球而球队能赢，我会开心地回家。这就是我们的生活，我期待明天，因为我知道我们会拿出好的表现。”C罗：我只想葡萄牙赢，若我不上场能赢我会马上同意-直播吧手机版,107 万热度,https://www.zhihu.com/question/15629139415,https://pic1.zhimg.com/50/v2-6510b0968619c52bd087fe88e2287fba_b.jpg,2025-03-23 13:41:37
知乎热榜,2025-03-24 04:14:31,21,15579316464,特朗普撤销拜登、哈里斯、希拉里、布林肯、沙利文安全许可，出于什么考量？此举有何影响？,特朗普宣布撤销哈里斯以及希拉里安全许可 央视新闻消息，当地时间3月21日，美国总统特朗普撤销前副总统卡玛拉·哈里斯、前国务卿希拉里·克林顿、前国务卿安东尼·布林肯、前国家安全顾问雅各布·沙利文、前总统拜登以及其家人等人的安全许可。 声明称，该命令将立即取消他们对机密信息的访问，并且所有执行部门和机构的负责人将撤销这些人员对美国政府设施的未陪同访问权限。 前总统拜登安全许可已被撤销 特朗普当地时间2月7日说，他已撤销前总统拜登的安全许可，取消其接收机密信息的权限。此外，据多家美国媒体报道，特朗普称他已撤销拜登政府的国务卿布林肯和总统国家安全事务助理沙利文的安全许可。更多资讯请下载央视新闻客户端,105 万热度,https://www.zhihu.com/question/15579316464,https://picx.zhimg.com/80/v2-7ad93e74059a74741e8c7bfcad16605c_1440w.webp?source=1def8aca,2025-03-22 14:34:52
知乎热榜,2025-03-24 04:14:31,22,267692668,《魔兽争霸 3》中有哪些奇怪的单位？,,102 万热度,https://www.zhihu.com/question/267692668,https://picx.zhimg.com/v2-642f9ccd0ba048026af289a792233bad_qhd.jpg?source=57bbeac9,2018-02-25 03:07:02
知乎热榜,2025-03-24 04:14:31,23,618009234,曹操挟天子以令诸侯，但是为啥我感觉好像没人听他的？,袁绍、袁术、刘表、刘备、孙权等等群雄好像没有一个人听他的。,101 万热度,https://www.zhihu.com/question/618009234,https://pica.zhimg.com/80/v2-716590dd89b64e175eb4bc660da87598_1440w.webp?source=1def8aca,2023-08-18 11:55:11
知乎热榜,2025-03-24 04:14:31,24,14438859682,罗素兄弟执导的科幻新片《电幻国度》 M 站仅 30 分，你对该评分有哪些评价？,罗素兄弟执导的科幻电影《电幻国度》电影媒体口碑现已解禁。截止发稿，该片在M站均分仅为30分（1好评4中评4差评）；烂番茄新鲜度仅为23%（5鲜17烂），有影评人吐槽《电幻国度》质量和《无主之地》一样糟糕。 年度最烂！“小11”科幻新片《电幻国度》M站仅30分,98 万热度,https://www.zhihu.com/question/14438859682,https://picx.zhimg.com/80/v2-4dbc9cb5fc52b294310fe3570259bbaa_1440w.webp?source=1def8aca,2025-03-08 13:24:58
知乎热榜,2025-03-24 04:14:31,25,15450786696,日本是首支获得 2026 世界杯资格的非东道主球队，你对该球队有何评价？,在今天晚上进行的世界杯亚洲区预选赛18强赛第7轮比赛中，日本2-0击败巴林，成为国际足坛首支晋级2026年世界杯的球队。 在击败巴林之后，日本在C组已经积了19分，在还剩3轮的情况下领先第二名的澳大利亚9分，领先第3-6名的沙特、印尼、巴林和国足13分，提前三轮晋级世界杯正赛。 这也使得他们成为了第一支获得美加墨世界杯的非东道主球队，这将是他们连续第8次参加世界杯正赛。提前3轮晋级，日本是首支获得2026世界杯资格的非东道主球队,95 万热度,https://www.zhihu.com/question/15450786696,https://pica.zhimg.com/80/v2-4294908139d5aab1bd3c71b07af93756_1440w.webp?source=1def8aca,2025-03-20 15:27:34
知乎热榜,2025-03-24 04:14:31,26,15529577831,AWE 2025 上，有哪些技术真正革新的清洁家电推荐？,清洁家电「吸尘器」、「电动拖把」、「蒸汽拖把」、「扫地机器人」、「洗地机」、「带拖地功能的扫地机器」技术近年来不断推陈出新，究竟哪个品牌能够完美解决干湿毛发分离、自动清洁等老大难生活痛点，带来真正意义上的技术革新？ HIZERO 赫兹作为清洁家电领域的独特力量，在 2025 AWE 带来新品，体验效果和实际表现如何？能否在超卷的赛道中杀出重围？期待大家的分享讨论。,87 万热度,https://www.zhihu.com/question/15529577831,https://picx.zhimg.com/80/v2-84677a2241160a3b16bc47ba4f5e800f_1440w.webp?source=1def8aca,2025-03-21 22:25:20
知乎热榜,2025-03-24 04:14:31,27,1885609915739006089,为什么西湖醋鱼从一道名菜变成了难吃的代名词？,是因为口味不一样或者真正会烧这道菜的厨师太少了，还是就是真的难吃？,79 万热度,https://www.zhihu.com/question/1885609915739006089,https://picx.zhimg.com/80/v2-5ee7ab434ab04871bb9856b9048117a6_1440w.webp?source=1def8aca,2025-03-19 00:33:56
知乎热榜,2025-03-24 04:14:31,28,14159370972,人类明明是顶级杂食动物，胃酸接近食腐动物，为什么连生肉都不敢吃？,,79 万热度,https://www.zhihu.com/question/14159370972,https://picx.zhimg.com/80/v2-1792bf309cb59e6396a3d6eafbffe3fb_1440w.webp?source=1def8aca,2025-03-05 12:41:52
知乎热榜,2025-03-24 04:14:31,29,407238397,如果后周周世宗柴荣再多活几十年是否能收复燕云十六州？,,73 万热度,https://www.zhihu.com/question/407238397,https://pic1.zhimg.com/80/v2-0983bd45a611286dbdccea52ec55108a_1440w.webp,2020-07-16 07:06:35
知乎热榜,2025-03-24 04:14:31,30,15607180982,韩文秀称「我国房地产市场、地方政府债务和中小金融机构风险，都已经得到有效控制」，哪些信息值得关注？,为期两天的中国发展高层论坛2025年年会今天（23日）在北京钓鱼台国宾馆举行。中央财经委员会办公室分管日常工作的副主任、中央农村工作领导小组办公室主任韩文秀在年会上表示，我国将持续深化供给侧结构性改革，不断更新旧动能，发展新动能。 韩文秀介绍，我国的工业门类十分齐全，产业链体系完整，配套能力强，集成优势明显，这在世界上是独有的，我们有基础有条件持续深化供给侧结构性改革，促进供给体系质量和效率不断提升。 韩文秀：要推动新旧发展动能接续转换。这些年我们变压力为动力，推动科技自立自强取得了积极的进展。我们将坚持科技引领，创新驱动，因地制宜，发展新质生产力，大力发展新兴产业，积极培育未来产业，积极运用数字技术、绿色技术、人工智能改造提升传统产业，还要规范涉企收费和执法，切实减轻企业负担。 韩文秀还表示，我国将综合整治内卷式竞争，规范地方政府和企业的行为，依法治理超低价恶性竞争，规范竞争秩序，倡导优质优价，反对劣质低价，推动企业优胜劣汰。 同时，还要大力弘扬企业家精神，推动老中新企业家携手并肩，大中小企业协同发展，打造更多经久不衰的百年老店。 三大风险已得到有效控制 此外，韩文秀还表示，经过艰苦努力，目前我国房地产市场、地方政府债务和中小金融机构风险，都已经得到有效控制。 韩文秀：近年来我们下了很大的力气，化解房地产市场、地方政府债务和中小金融机构风险。经过艰苦努力，这三大风险已经得到有效控制，目前处于收敛的状态。 韩文秀表示，去年四季度以来，我国房地产市场交易和价格出现积极变化，一线城市回暖态势比较明显，我国将继续推动房地产市场止跌回稳，加快构建房地产发展新模式，促进房地产市场长期持续健康发展。 同时，我国将继续做好地方政府隐性债务置换工作，推动地方融资平台市场化转型和债务风险化解。我国高度重视解决拖欠企业账款问题，将统筹用好财政货币政策工具，力争尽快取得明显进展。韩文秀：三大风险已得到有效控制,73 万热度,https://www.zhihu.com/question/15607180982,https://pic3.zhimg.com/50/v2-1b85543d528d23a012d6117239830a5e_b.jpg,2025-03-23 07:45:02
知乎热搜,2025-03-24 05:12:10,1,,以前的铁道部算是一个超级大部门吗,,,https://www.zhihu.com/search?q=%E4%BB%A5%E5%89%8D%E7%9A%84%E9%93%81%E9%81%93%E9%83%A8%E7%AE%97%E6%98%AF%E4%B8%80%E4%B8%AA%E8%B6%85%E7%BA%A7%E5%A4%A7%E9%83%A8%E9%97%A8%E5%90%97,,
知乎热搜,2025-03-24 05:12:10,2,,有哪些故意缩短产品寿命的设计,,,https://www.zhihu.com/search?q=%E6%9C%89%E5%93%AA%E4%BA%9B%E6%95%85%E6%84%8F%E7%BC%A9%E7%9F%AD%E4%BA%A7%E5%93%81%E5%AF%BF%E5%91%BD%E7%9A%84%E8%AE%BE%E8%AE%A1,,
知乎热搜,2025-03-24 05:12:10,3,,你见过最令你震撼的一张图片是什么,,,https://www.zhihu.com/search?q=%E4%BD%A0%E8%A7%81%E8%BF%87%E6%9C%80%E4%BB%A4%E4%BD%A0%E9%9C%87%E6%92%BC%E7%9A%84%E4%B8%80%E5%BC%A0%E5%9B%BE%E7%89%87%E6%98%AF%E4%BB%80%E4%B9%88,,
知乎热搜,2025-03-24 05:12:10,4,,如何看待美国识字率只有 79％,,,https://www.zhihu.com/search?q=%E5%A6%82%E4%BD%95%E7%9C%8B%E5%BE%85%E7%BE%8E%E5%9B%BD%E8%AF%86%E5%AD%97%E7%8E%87%E5%8F%AA%E6%9C%89%2079%EF%BC%85,,
知乎热搜,2025-03-24 05:12:10,5,,俄军称在库尔斯克州转入全线大规模进攻,,,https://www.zhihu.com/search?q=%E4%BF%84%E5%86%9B%E7%A7%B0%E5%9C%A8%E5%BA%93%E5%B0%94%E6%96%AF%E5%85%8B%E5%B7%9E%E8%BD%AC%E5%85%A5%E5%85%A8%E7%BA%BF%E5%A4%A7%E8%A7%84%E6%A8%A1%E8%BF%9B%E6%94%BB,,
知乎热搜,2025-03-24 05:12:10,6,,拜仁联赛主场37次对阵波鸿,,,https://www.zhihu.com/search?q=%E6%8B%9C%E4%BB%81%E8%81%94%E8%B5%9B%E4%B8%BB%E5%9C%BA37%E6%AC%A1%E5%AF%B9%E9%98%B5%E6%B3%A2%E9%B8%BF,,
知乎热搜,2025-03-24 05:12:10,7,,养老服务向全体老年人拓展,,,https://www.zhihu.com/search?q=%E5%85%BB%E8%80%81%E6%9C%8D%E5%8A%A1%E5%90%91%E5%85%A8%E4%BD%93%E8%80%81%E5%B9%B4%E4%BA%BA%E6%8B%93%E5%B1%95,,
知乎热搜,2025-03-24 05:12:10,8,,哈马斯称应立即开启停火协议第二阶段谈判,,,https://www.zhihu.com/search?q=%E5%93%88%E9%A9%AC%E6%96%AF%E7%A7%B0%E5%BA%94%E7%AB%8B%E5%8D%B3%E5%BC%80%E5%90%AF%E5%81%9C%E7%81%AB%E5%8D%8F%E8%AE%AE%E7%AC%AC%E4%BA%8C%E9%98%B6%E6%AE%B5%E8%B0%88%E5%88%A4,,
知乎热搜,2025-03-24 05:12:10,9,,「人造太阳」关键系统通过验收,,,https://www.zhihu.com/search?q=%E3%80%8C%E4%BA%BA%E9%80%A0%E5%A4%AA%E9%98%B3%E3%80%8D%E5%85%B3%E9%94%AE%E7%B3%BB%E7%BB%9F%E9%80%9A%E8%BF%87%E9%AA%8C%E6%94%B6,,
