type,datetime,index,id,title,desc,hot,url,img,createtime
知乎热榜,2025-05-02 00:56:23,12,1901244983983432857,董某莹被曝博士论文与北京科技大学一发明专利多处雷同，具体情况怎么样？算是抄袭吗？,5月1日上午，极目新闻记者拨打北京协和医学院多部电话，欲反映董袭莹论文雷同的情况，不过均未能接通。 北京科技大学校办的吴老师向极目新闻记者表示，已记录下记者反映的情况，将向领导汇报，调查了解学校老师的研究成果是否与他人论文有关。董袭莹论文被指与北科大专利多处雷同，其中一发明人为听力障碍学生，北科大校办：将调查了解 协和医学院4+4博士董某莹的博士论文因正文不足30页受质疑。 然而有人进一步指出，董某莹2023年提交的博士论文与北京科技大学几位老师和一位研究生在2022年提交的一项发明专利存在多处雷同。 董某莹的博士论文名为《跨模态图像融合技术在医疗影像分析中的研究》，完成于2023年5月，从摘要到全文小结共33页。与这篇博士论文存在雷同嫌疑的发明专利提交于2022年5月19日，名称是《一种跨模态图像生成和检测的方法及装置》，发明人为马博渊、赵基淮、班晓娟、王笑琨。这四位发明人中，赵基淮为北科大学生，其余为北科大计算机领域‍教师。 紫牛新闻记者使用DeepSeek检测董某莹的博士论文和赵基淮等人的发明专利说明书，DeepSeek认为，尽管专利申请与学术论文的呈现形式不同，但核心创新点、方法细节及实验结果的相似性超过合理借鉴范围。 DeepSeek认为两者文字直接重复约20%-25%，结构与逻辑重复约10%-15%，实验数据与结果重复约10%-15%，创新点与结论重复约5%-10%。 董某莹博士论文与北科大发明专利中疑似雷同的图片 例如在目标检测模型训练部分中关于YOLOv5模型参数，专利说明书第9页：“采用SGD优化器，初始学习率为1e-5，动量为0.98，权值衰减为0.01，输入图像尺寸调整为1024×1024。”论文第12页表1-2：“学习率设置为1e-5，动量0.98，权值衰减0.01，输入图像从512×512调整为1024×1024。” 关于数据增强方法，专利说明书第9页：“使用mosaic数据增强，将四个随机缩放、剪切和排列的图像拼接。”论文第11页1.3.2节：“采用mosaic数据增强，将四个随机缩放、剪切和排列的图像拼接。” 在实验结果与指标部分中，关于AP50提升数值，专利说明书第6页：“目标检测的平均精确度（AP50）分别提高了6.06%和8.9%。” 论文第14页表1-3：“平均精确度分别提高了6.06%和8.9%。” 董某莹在博士论文的独创性说明中表示：本人声明所呈交的学位论文是本人在导师指导下进行的研究工作及取得的研究成果。论文中除了特别加以标注和致谢的地方外，不包含其他人已经发表或撰写过的研究成果，也不包含为获得其他教育机构的学位或证书而使用过的材料。与我一同工作的同志对本研究所做的任何贡献均已在论文中作了明确的说明并表示谢意。 董某莹在博士论文是否涉嫌抄袭马博渊、赵基淮、班晓娟、王笑琨等人的发明专利，有待协和医学院进行调查。最新！董某莹博士论文与北京科技大学一发明专利多处雷同,59 万热度,https://www.zhihu.com/question/1901244983983432857,https://pic3.zhimg.com/v2-6070947b67f3f8a5385bfef567e47386_1440w.jpg,2025-05-01 04:02:07
知乎热榜,2025-05-02 00:56:23,13,1900503710884390010,女子视频展示自己在沙漠中「被虫子追赶」吓到语无伦次，沙漠蜱虫真能定位追踪人类么，野外遇到如何防范？,[视频],59 万热度,https://www.zhihu.com/question/1900503710884390010,https://picx.zhimg.com/80/v2-a0c3fb7e531595e301dba11b0842feb6_1440w.webp?source=1def8aca,2025-04-29 02:56:34
知乎热榜,2025-05-02 00:56:23,14,1894555455537250722,人类历史上衰落速度最快的城市是哪个？,,57 万热度,https://www.zhihu.com/question/1894555455537250722,https://pic2.zhimg.com/50/v2-410873d031568b4f11043f8b85e02407_b.jpg,2025-04-12 17:00:19
知乎热榜,2025-05-02 00:56:23,15,1899933741025032013,在外工作学习的你，五一为什么选择不回家？,,55 万热度,https://www.zhihu.com/question/1899933741025032013,https://pic1.zhimg.com/50/v2-bfd591e3f791a6254f91091d41e387ed_720w.webp?source=1def8aca,2025-04-27 13:11:42
知乎热榜,2025-05-02 00:56:23,16,1900988315747971092,网友爆料有协和 4+4 博士论文正文仅 12 页，这样会是合格的论文吗？博士论文一般有多少页？,近日，关于北京协和医学院“4+4”学制的讨论引发广泛关注。在往年的录取名单中，网友质疑2020级“4+4”试点班的金某木，其博士论文相比其他博士论文篇幅过短，正文仅有12页的内容。 《贝伐珠单抗治疗复发性胶质瘤的预后模型》的目录 30日上午，极目新闻在知网查询金某木的博士论文，发现总共55页的论文中，有15页左右的参考文献、5页左右的附录、14页的文献综述以及7页左右的其他内容，正文的确只有12页左右。 金某木研究的课题是《贝伐珠单抗治疗复发性胶质瘤的预后模型》，该论文于2024年5月1日发表，下载次数68次，被引用0次。 记者注意到，在2024年7月发布的《协和神经肿瘤周刊》中的译者一栏介绍道：金某木，北京协和医院神经外科、北京协和医学院4+4试点班2020级。2025年1月《协和神经肿瘤周刊》中金某木的信息则变更为：北京协和医院神经外科、2024级临床医学博士后。 随后，记者查询北京协和医学院“4+4”改革试点班招生网2020级的拟录取信息，发现其中并未出现金某木的名字。 《2024年度拟招收人员公示》中出现金山木的名字 不过，2024年1月16日北京协和医院发布的《2024年临床医学博士后项目拟招收人员公示》中，则出现了金山木的名字。同年8月北京协和医院发布的《2024年度拟招收人员公示》中，再次出现金某木的名字。 对于博士论文正文仅有12页左右，多位学界人士向极目新闻记者表示，这样的篇幅的确过短。正常来讲，博士论文加上文献综述、引言、参考文献等部分，篇幅应当在5万字左右，40多页肯定是不够的，长的博士论文都有200多页。即便是硕士论文都要求2万字以上，且为最低限度。“虽然不能以页数来论学术价值，但是页数少至少工作量是不够的。”“4+4”学制冲上热搜！协和医学院要求申请人需3人推荐,53 万热度,https://www.zhihu.com/question/1900988315747971092,https://picx.zhimg.com/80/v2-0c10dc14de957025fca4d37ecd9b0a6d_1440w.webp?source=1def8aca,2025-04-30 11:02:13
知乎热榜,2025-05-02 00:56:23,17,1896157910922416793,单依纯将参加《歌手 2025》，如何评价她的音乐实力？你看好她的表现吗？,近日，一则重磅消息在音乐圈和社交媒体上炸开了锅——单依纯确认加盟《歌手2025》。这一消息瞬间点燃了粉丝和乐迷们的热情，让人们对新一季的《歌手》充满了期待。 单依纯，这位年仅20岁出头的姑娘，凭借在《中国好声音》中的惊艳表现一鸣惊人。她那空灵纯净、富有感染力的嗓音，仿佛有一种魔力，能够直击人们的心灵深处。此后，她在音乐道路上不断前行，佳作频出。像《永不失联的爱》，以其深情的演绎和动人的旋律，成为了无数人心中的经典之作；《给电影人的情书》中，她用细腻的情感诠释，让听众感受到了电影人的梦想与坚持。她更是凭借《喂》《你的珍藏》等作品，稳坐“OST女王”的宝座，在影视音乐领域绽放出耀眼的光芒。 单依纯确认加盟《歌手2025》：新生代力量开启音乐新征程,52 万热度,https://www.zhihu.com/question/1896157910922416793,https://pica.zhimg.com/80/v2-046359849d4786750688e5383adf1cc3_1440w.webp?source=1def8aca,2025-04-17 03:07:54
知乎热榜,2025-05-02 00:56:23,18,437791072,项羽起势于会稽，我感觉绍兴、宁波一带的人都很温柔，那八千子弟兵真的很牛吗？,我读了大家的回答 感觉受益良多！ 我自己是宁波人，现在居住在绍兴，所以 不构成地域黑。 我以前读过戚继光 关于浙江兵的论述 觉得很有趣， 附在问题后面： 抗倭名将戚继光在浙江担任参将，防守宁绍台时，曾与当时的台州知府当世名将谭纶有过一段极为有趣的谈话，谈话内容就是关于浙江练兵的情况。 一、处州（今浙江丽水）兵的优点：作战斗起来十分勇猛，而且听从命令从不迟疑，冲锋陷阵，毫不迟疑，是战斗的主力。 处州（今浙江丽水）兵的缺点：他们每次打仗之前，都要和戚继光谈条件，就是要求知道作战的对手和人数，然后他们自己内部商议，如果认为能打，就作战，但是如果他们认为此仗不能打，即使你费尽口舌，他们也绝不会卖力。 二、绍兴兵的优点：相对于处州兵来说，绍兴兵更加听从命令，无论打什么仗，只要一声令下，他们从来不会拒绝，完全服从。而且他们不怕辛苦，安排他们扎营修城，打扫战场，他们从无怨言。在战场上，如果敌人退却，他们会主动追击敌人。 绍兴兵的缺点：敌人一旦主动攻击，那么他们就会自动撤退，据戚继光统计，但凡与敌相接三十步内，即将肉搏之时，他们一般会全军退走。总而言之，关键时刻实在靠不住。 三、台州兵的优点：戚继光开始招收台州新兵三千，经过了几个月的刻苦训练，台州新兵也算是好兵，他们听从指挥，毫不犹豫，作战也比较勇猛，在台州、温岭等地遭遇倭寇，四战四捷。 台州兵的缺点：台州新兵不够顽强坚毅，遇到真正顽强抵抗的倭寇，便会败退甚至逃窜。 四、义乌兵的优点：戚继光机遇巧合，看到义乌矿工群殴的壮阔场面，他被那种彪悍的民风所吸引，后来在义乌招收四千义务新兵，就是后来闻名天下的“戚家军”。义乌兵作战不仅十分勇敢，而且十分坚毅，碰到顽固反抗的倭寇，他们不会像台州兵那样败退，反而会激发他们顽强的斗志。他们服从命令，从不打折扣，而且曾一夜急行军130里，真正做到了“疾如风”。 义乌兵的优点：作战起来不听指挥，只顾冲锋，刹不住车。,47 万热度,https://www.zhihu.com/question/437791072,https://picx.zhimg.com/80/v2-1769148900c7f5e223af6371656d4ab7_1440w.jpg,2021-01-04 03:27:52
知乎热榜,2025-05-02 00:56:23,19,1900863654439654216,移动互联网未成年人模式正式发布，家长可一键启动所有 APP 未成年模式，网络环境将带来哪些改变？,4月29日上午，移动互联网未成年人模式在第八届数字中国建设峰会主论坛上正式发布。 立足未成年人网络保护现实需要、回应社会各界期待关切，国家网信办持续指导国内软硬件企业共同推进移动互联网未成年人模式（以下简称“未成年人模式”）建设工作。今年4月，未成年人模式突破一系列技术瓶颈，实现了全方位优化和系统性升级。 发布仪式全面展示了未成年人模式的特色亮点和主要功能。从操作方式看，移动智能终端、应用程序、应用程序分发平台实现三方联动，大大降低了模式的使用门槛。家长可在手机端显著位置点击图标，“一键启动”未成年人模式，所有应用程序同步切换，形成一个相对独立、安全可控的上网环境。从内容生态看，适合未成年人的优质内容得到大幅扩充，重点平台依托儿童内容创作者、版权资源、权威机构等，筛选海量内容纳入未成年人模式，并建立年龄分层、内容分类、推荐分众的梯度化内容体系，更好满足未成年人的精神文化需求。从功能服务看，未成年人模式可以提供每日上网总时长控制、使用时段设置、休息提醒、应用管理、使用情况统计等功能，家长可根据实际情况调整各项设置，实现对未成年人上网行为的合理引导。从覆盖范围看，华为、OPPO和中兴在手机系统更新后提供未成年人模式，小米、荣耀和vivo在发布的新机上搭载未成年人模式，应用商店建立未成年人专区，短视频、社交、电商、教育、工具等领域重点应用程序全面升级未成年人模式。后续模式的覆盖范围还将持续扩大，满足未成年人日常使用需求、提供丰富多元服务。 国家网信办相关负责人表示，充分发挥未成年人模式保护作用，离不开各方面的共同努力。一方面，将持续指导和支持鼓励平台优化未成年人模式，让这一技术工具更易用更好用。另一方面，希望广大家长和未成年人主动开启未成年人模式，提出宝贵意见，共同营造安全健康、清朗向上的网络环境。（央视新闻） 移动互联网未成年人模式正式发布,47 万热度,https://www.zhihu.com/question/1900863654439654216,https://pic1.zhimg.com/80/v2-2b32c867b3b47c9b306de5e725f9ce1d_1440w.png,2025-04-30 02:46:51
知乎热榜,2025-05-02 00:56:23,20,1900670715503571887,贵州茅台一季度净利润 268.47 亿元，同比增长 11.56%，如何评价该业绩？,每经AI快讯，4月29日，贵州茅台公告，2025年第一季度营收为506.01亿元，同比增长10.54%；净利润为268.47亿元，同比增长11.56%。https://www.nbd.com.cn/articles/2025-04-29/3859061.html,47 万热度,https://www.zhihu.com/question/1900670715503571887,https://pic1.zhimg.com/80/v2-65a58ee0d9056332013e200818a8e90c_1440w.png,2025-04-29 14:00:11
知乎热榜,2025-05-02 00:56:23,21,1900585709988983400,白客、辛柏青主演的犯罪电影《大风杀》拍得如何？,,46 万热度,https://www.zhihu.com/question/1900585709988983400,https://pic2.zhimg.com/50/v2-5e0bb405e14f169561410cd886ec190f_b.jpg,2025-04-29 08:22:24
知乎热榜,2025-05-02 00:56:23,22,353705904,为什么太阳系没有形成热木星？,目前在系外行星中发现了大量的热木星，除去热木星易于被目前手段发现的因素，仍然暗示着热木星的某种普遍性。为什么太阳系幸运地没有形成热木星？如果也有热木星的话，内太阳系恐怕难以有宜居类地行星存在的空间。,46 万热度,https://www.zhihu.com/question/353705904,https://pic3.zhimg.com/50/v2-f0ec780328c18d1b83f0983cc7f2174c_b.jpg,2019-11-02 04:26:43
知乎热榜,2025-05-02 00:56:23,23,1901229527511856939,如何评价《画江湖之不良人7：九幽玄天》的第7集？,个人感觉这一集是本季质量最好的，当然，前六集只能说是一言难尽,46 万热度,https://www.zhihu.com/question/1901229527511856939,https://pica.zhimg.com/50/v2-e2676284fec1cf316618998920e26afa_b.jpg,2025-05-01 03:00:42
知乎热榜,2025-05-02 00:56:23,24,1900585709976397587,如何评价邱礼涛执导，刘德华、欧豪主演的电影《猎金游戏》？,,46 万热度,https://www.zhihu.com/question/1900585709976397587,https://pica.zhimg.com/v2-2b3710e0c845004cae753a3cb88d305e_1440w.jpg?source=7e7ef6e2&needBackground=1,2025-04-29 08:22:24
知乎热榜,2025-05-02 00:56:23,25,1900303574958864100,如何评价常远、邓家佳主演的喜剧电影《人生开门红》？,,46 万热度,https://www.zhihu.com/question/1900303574958864100,https://picx.zhimg.com/80/v2-514802e9d030232278700413425ac7b7_1440w.webp?source=1def8aca,2025-04-28 13:41:18
知乎热榜,2025-05-02 00:56:23,26,1900928401654673888,同样是自然规律，为什么几乎每个人都能接受太阳东升西落，却很难接受人正常的生老病死？,生物的本质难道不是物理和化学吗？你看就连呼吸都是化学反应，本质上就是葡萄糖和氧气在酶的作用下，生成二氧化碳和水，并释放能量的过程。,46 万热度,https://www.zhihu.com/question/1900928401654673888,https://pica.zhimg.com/80/v2-484ec0b1013180d1ed39a0e1823a24d3_1440w.webp?source=1def8aca,2025-04-30 07:04:08
知乎热榜,2025-05-02 00:56:23,27,1894385336563504115,中国古代平民有没有日常喝水饮酒用的大杯子?,对我国古代平民喝水饮酒的一般印象来自水浒传影视剧：里面的客店给客人用来饮酒的似乎都是比较浅的碗，或者是比较小的陶瓷杯（类似现代喝高度白酒的小杯子），好汉喝得一不尽兴就提坛子或者酒壶直接灌了，感觉部分原因是因为缺少比较大的杯子，小杯太小，碗又比较浅容易洒出来。 我知道贵族是有爵和尊一类的中等体量杯子，材质从青铜、玉到金银不等。那么平民在日常生活中有这种比较大的杯子吗？ 5 月 1 日-5 月 31 日，参与活动，赢博物馆好礼！ 活动主会场：一起下馆子,46 万热度,https://www.zhihu.com/question/1894385336563504115,https://pica.zhimg.com/50/v2-74ca67b2947bb6baa949138b7fd87fac_b.jpg,2025-04-12 05:44:20
知乎热榜,2025-05-02 00:56:23,28,1901280270881128634,随着季后赛首轮 1:4 森林狼，湖人正式告别本赛季，如何评价湖人本赛季的表现？,本轮系列赛过后，詹姆斯时代湖人季后赛战绩为：1次总冠军、1次西部决赛、3次季后赛首轮已经2次无缘季后赛。,46 万热度,https://www.zhihu.com/question/1901280270881128634,https://picx.zhimg.com/80/v2-7c4cd3638862078344a4264f915aed9b_1440w.png,2025-05-01 06:22:20
知乎热榜,2025-05-02 00:56:23,29,1900576960557594234,情绪稳定该不该成为成年人的标配？,,46 万热度,https://www.zhihu.com/question/1900576960557594234,https://pic1.zhimg.com/80/v2-11c61b62c47ce88ab2b806cb85fdfca7_1440w.jpg,2025-04-29 07:47:38
知乎热榜,2025-05-02 00:56:23,30,1899529219559655244,对于一个博物馆而言，是丰富的珍贵文物更重要，还是优秀的展陈设计更重要？,例如南京博物院大量珍贵文物，却被吐槽为“仓储式”展示，六朝博物馆文物不多，却以其艺术馆式的展陈，成为网红博物馆。 5 月 1 日-5 月 31 日，参与活动，赢博物馆好礼！ 活动主会场：https://www.zhihu.com/parker/campaign/1899831974996210465?zh_hide_nav_bar=true,46 万热度,https://www.zhihu.com/question/1899529219559655244,https://picx.zhimg.com/50/v2-4816dec987922bc095fef61ef5844f9f_b.jpg,2025-04-26 10:24:17
