type,datetime,index,id,title,desc,hot,url,img,createtime
知乎热搜,2025-03-01 00:54:44,1,,多家银行下调存款利率,,,https://www.zhihu.com/search?q=%E5%A4%9A%E5%AE%B6%E9%93%B6%E8%A1%8C%E4%B8%8B%E8%B0%83%E5%AD%98%E6%AC%BE%E5%88%A9%E7%8E%87,,
知乎热搜,2025-03-01 00:54:44,2,,湖人vs独行侠,,,https://www.zhihu.com/search?q=%E6%B9%96%E4%BA%BAvs%E7%8B%AC%E8%A1%8C%E4%BE%A0,,
知乎热搜,2025-03-01 00:54:44,3,,沪深两市成交额突破5000亿,,,https://www.zhihu.com/search?q=%E6%B2%AA%E6%B7%B1%E4%B8%A4%E5%B8%82%E6%88%90%E4%BA%A4%E9%A2%9D%E7%AA%81%E7%A0%B45000%E4%BA%BF,,
知乎热搜,2025-03-01 00:54:44,4,,上班恶心穿搭,,,https://www.zhihu.com/search?q=%E4%B8%8A%E7%8F%AD%E6%81%B6%E5%BF%83%E7%A9%BF%E6%90%AD,,
知乎热搜,2025-03-01 00:54:44,5,,小米su7ultra,,,https://www.zhihu.com/search?q=%E5%B0%8F%E7%B1%B3su7ultra,,
知乎热搜,2025-03-01 00:54:44,6,,为何白天只睡一小会就能恢复疲劳,,,https://www.zhihu.com/search?q=%E4%B8%BA%E4%BD%95%E7%99%BD%E5%A4%A9%E5%8F%AA%E7%9D%A1%E4%B8%80%E5%B0%8F%E4%BC%9A%E5%B0%B1%E8%83%BD%E6%81%A2%E5%A4%8D%E7%96%B2%E5%8A%B3,,
知乎热搜,2025-03-01 00:54:44,7,,魔术vs勇士,,,https://www.zhihu.com/search?q=%E9%AD%94%E6%9C%AFvs%E5%8B%87%E5%A3%AB,,
知乎热搜,2025-03-01 00:54:44,8,,澳军称 055 在悉尼外海实弹开火,,,https://www.zhihu.com/search?q=%E6%BE%B3%E5%86%9B%E7%A7%B0%20055%20%E5%9C%A8%E6%82%89%E5%B0%BC%E5%A4%96%E6%B5%B7%E5%AE%9E%E5%BC%B9%E5%BC%80%E7%81%AB,,
知乎热搜,2025-03-01 00:54:44,9,,连续一年每天吃半斤牛肉体质会有变化吗,,,https://www.zhihu.com/search?q=%E8%BF%9E%E7%BB%AD%E4%B8%80%E5%B9%B4%E6%AF%8F%E5%A4%A9%E5%90%83%E5%8D%8A%E6%96%A4%E7%89%9B%E8%82%89%E4%BD%93%E8%B4%A8%E4%BC%9A%E6%9C%89%E5%8F%98%E5%8C%96%E5%90%97,,
知乎热搜,2025-03-01 00:54:44,10,,比特币 24 小时内跌幅超 4%,,,https://www.zhihu.com/search?q=%E6%AF%94%E7%89%B9%E5%B8%81%2024%20%E5%B0%8F%E6%97%B6%E5%86%85%E8%B7%8C%E5%B9%85%E8%B6%85%204%25,,
知乎热搜,2025-03-01 00:54:44,11,,爱你开播,,,https://www.zhihu.com/search?q=%E7%88%B1%E4%BD%A0%E5%BC%80%E6%92%AD,,
知乎热搜,2025-03-01 00:54:44,12,,充电宝公司 494 名员工收入超 100 万元,,,https://www.zhihu.com/search?q=%E5%85%85%E7%94%B5%E5%AE%9D%E5%85%AC%E5%8F%B8%20494%20%E5%90%8D%E5%91%98%E5%B7%A5%E6%94%B6%E5%85%A5%E8%B6%85%20100%20%E4%B8%87%E5%85%83,,
知乎热搜,2025-03-01 00:54:44,13,,美国与乌克兰的矿产协议条款,,,https://www.zhihu.com/search?q=%E7%BE%8E%E5%9B%BD%E4%B8%8E%E4%B9%8C%E5%85%8B%E5%85%B0%E7%9A%84%E7%9F%BF%E4%BA%A7%E5%8D%8F%E8%AE%AE%E6%9D%A1%E6%AC%BE,,
知乎热搜,2025-03-01 00:54:44,14,,乌克兰将在停战后大选,,,https://www.zhihu.com/search?q=%E4%B9%8C%E5%85%8B%E5%85%B0%E5%B0%86%E5%9C%A8%E5%81%9C%E6%88%98%E5%90%8E%E5%A4%A7%E9%80%89,,
知乎热搜,2025-03-01 00:54:44,15,,美国效率部21名工作人员辞职,,,https://www.zhihu.com/search?q=%E7%BE%8E%E5%9B%BD%E6%95%88%E7%8E%87%E9%83%A821%E5%90%8D%E5%B7%A5%E4%BD%9C%E4%BA%BA%E5%91%98%E8%BE%9E%E8%81%8C,,
知乎热搜,2025-03-01 00:54:44,16,,句号恐惧症,,,https://www.zhihu.com/search?q=%E5%8F%A5%E5%8F%B7%E6%81%90%E6%83%A7%E7%97%87,,
知乎热搜,2025-03-01 00:54:44,17,,百度21亿美元收购yy直播,,,https://www.zhihu.com/search?q=%E7%99%BE%E5%BA%A621%E4%BA%BF%E7%BE%8E%E5%85%83%E6%94%B6%E8%B4%ADyy%E7%9B%B4%E6%92%AD,,
知乎热搜,2025-03-01 00:54:44,18,,Meta洽谈人工智能数据中心项目,,,https://www.zhihu.com/search?q=Meta%E6%B4%BD%E8%B0%88%E4%BA%BA%E5%B7%A5%E6%99%BA%E8%83%BD%E6%95%B0%E6%8D%AE%E4%B8%AD%E5%BF%83%E9%A1%B9%E7%9B%AE,,
知乎热搜,2025-03-01 00:54:44,19,,吉祥航空回应发放过期坚果,,,https://www.zhihu.com/search?q=%E5%90%89%E7%A5%A5%E8%88%AA%E7%A9%BA%E5%9B%9E%E5%BA%94%E5%8F%91%E6%94%BE%E8%BF%87%E6%9C%9F%E5%9D%9A%E6%9E%9C,,
知乎热搜,2025-03-01 00:54:44,20,,核能只有「烧开水」的利用方式吗,,,https://www.zhihu.com/search?q=%E6%A0%B8%E8%83%BD%E5%8F%AA%E6%9C%89%E3%80%8C%E7%83%A7%E5%BC%80%E6%B0%B4%E3%80%8D%E7%9A%84%E5%88%A9%E7%94%A8%E6%96%B9%E5%BC%8F%E5%90%97,,
知乎热榜,2025-03-01 00:54:44,1,13667914713,中国与巴基斯坦签署选拔训练航天员合作协议，巴基斯坦籍航天员即将造访天宫空间站，对此你有何期待和祝福？,热烈欢迎！太空欢迎你！ 【中国与巴基斯坦签署选拔训练航天员合作协议 #中国空间站将迎来首位外籍航天员造访#】 北京时间2025年2月28日，中国载人航天工程办公室与巴基斯坦太空与高层大气研究委员会在巴基斯坦首都伊斯兰堡，正式签署《关于选拔、训练巴基斯坦航天员并参与中国空间站飞行任务的合作协议》，开启了中巴两国在载人航天领域深化合作的新篇章，迈出了中国选拔训练外籍航天员参与中国空间站飞行任务的第一步。 北京时间当日13时45分，签字仪式在巴基斯坦总理府举行，在巴基斯坦总理夏巴兹·谢里夫见证下，中国载人航天工程办公室副主任林西强与巴基斯坦太空与高层大气研究委员会主席穆罕默德·优素福·汗签署协议。此次协议的签署，标志着中国政府将首次为外国选拔训练航天员，中国空间站将迎来首位外籍航天员造访。 按计划，双方将利用一年左右的时间完成选拔工作，巴基斯坦航天员将在中国接受全方位的系统训练。根据中国空间站的飞行任务规划安排，将在未来几年内择机安排巴基斯坦航天员与中国航天员一道进入中国空间站执行短期飞行任务。 中国载人航天工程立项实施以来，始终坚持“和平利用、平等互利、共同发展”的原则，着眼面向全人类共享中国发展成果，主动开放中国空间站合作机会，积极为构建人类命运共同体贡献力量。此次合作协议签订，为更多发展中国家参加国际载人航天合作提供了范例，有利于激励更多国家携手探索宇宙奥秘，共同在造福全人类的道路上书写新的篇章。 #中国空间站将迎来首位外籍航天员造访#,223 万热度,https://www.zhihu.com/question/13667914713,https://pic4.zhimg.com/v2-12028aa6a34f2e14b4a7593da33b9f3b_1440w.jpg,2025-02-28 10:37:02
知乎热榜,2025-03-01 00:54:44,2,13406158720,连亏九年之后，香港迪士尼终于盈利，为何会亏损这么多年？,在连续九年亏损之后，香港迪士尼终于在2024财政年度（2023年10月1日至2024年9月28日）实现盈利，净利润达到8.38 亿港元，创下2005年迪士尼开园以来的新高，这或与2023年11月正式开幕的“冰雪奇缘世界”（World of Frozen，香港译为“魔雪奇缘世界”）直接相关。 在2024财政年度内，香港迪士尼乐园未扣除利息、税项、折旧及摊销前盈利（EBITDA）同比增长14亿港元至23亿港元，收入同比大增54%，达到88亿港元。其中，来自香港本地、中国内地以及其它市场的游客入场人次均超越2018年疫情前的水平。期内总入园人次达770万人次，创下历史新高。游客人均消费增长28%，反映出游客在园内的消费意愿也在显著提升。香港迪士尼10年来首盈利 冰雪奇缘园区助入园人数创新高,214 万热度,https://www.zhihu.com/question/13406158720,https://picx.zhimg.com/80/v2-9debce46510fe286f7b63248264641b5_1440w.png,2025-02-26 02:01:01
知乎热榜,2025-03-01 00:54:44,3,13615402158,如何看待纪录片《大国基石》谈及国产动画人物多数以白人脸为主，要建立亚洲人像数据库？,那么国产动画以前都是欧美人建模吗，如果要建立，会给国产动画带来什么改变 《大国基石 第二季》 第3集 算力引擎,193 万热度,https://www.zhihu.com/question/13615402158,https://pic4.zhimg.com/v2-4bb09d47f8222e4ae4d69254f8a3e2db_1440w.jpg,2025-02-28 01:35:43
知乎热榜,2025-03-01 00:54:44,4,13677485380,AMD RX 9070 和 9070 XT 显卡的国行售价曝光，对此你有哪些评价？,根据网上今日流传出的一张照片，AMD RX 9070 和 9070 XT 显卡的国行售价曝光，今晚 10 点开启预售，3 月 6 日正式开售。RX 9070 售价 4499 元起。RX 9070 XT 售价 4999 元起。4499元起！AMD RX 9070/XT系列显卡国行售价曝光,172 万热度,https://www.zhihu.com/question/13677485380,https://pic1.zhimg.com/50/v2-70cb655488fc5bd0e33be0dc52ba6710_b.jpg,2025-02-28 12:42:52
知乎热榜,2025-03-01 00:54:44,5,13608593577,「上班恶心穿搭」潮热度不减，年轻人故意穿丑衣服上班，是反抗职场规训，还是自我保护策略？,某社区平台“上班恶心穿搭”小组20万人分享经验：起球毛衣+荧光色棉裤、袜子套凉鞋、十年旧衬衫，刻意避免精致化以降低职场存在感。,58 万热度,https://www.zhihu.com/question/13608593577,https://pica.zhimg.com/80/v2-c58f424982aaa93814545612916c6fcf_1440w.webp?source=1def8aca,2025-02-28 00:17:16
知乎热榜,2025-03-01 00:54:44,6,11162689016,这一轮中国科技大爆发为什么不是院士杰青推动的？,杭州六小龙创始人四个硕士，两个博士。现在随便一个高校，入职门槛都是博士起，那些院士杰青都在干嘛？,48 万热度,https://www.zhihu.com/question/11162689016,https://picx.zhimg.com/80/v2-1fc4c5ea73ebf32b557e7f7b8ca0224c_1440w.png,2025-02-03 02:09:49
知乎热榜,2025-03-01 00:54:44,7,618858555,如果你学会了dnd世界观下的所有戏法（0环法术），你会做什么？,,47 万热度,https://www.zhihu.com/question/618858555,https://picx.zhimg.com/80/v2-35c9c7065538fc822ce1a82984a73b9f_1440w.webp?source=1def8aca,2023-08-23 17:30:40
知乎热榜,2025-03-01 00:54:44,8,13560233878,《哪吒 2》配音演员起诉配音公司，称公司「无正当理由将其开除、拖欠工资」，到底怎么回事？谁该承担责任？,2月25日晚，《哪吒2》配音演员“兔七”发布视频称，她曾在为《哪吒2》配音的成都声娱文化传播有限公司（以下简称：声娱文化）工作，现因声娱文化压榨配音练习生、无正当理由将她开除、拖欠工资等问题，向四川省成都市高新区法院起诉维权《哪吒2》配音演员起诉配音公司：无五险一金，转正4个月后被开除,43 万热度,https://www.zhihu.com/question/13560233878,https://picx.zhimg.com/80/v2-4e383a61ae136350498929c55abd93f5_1440w.webp?source=1def8aca,2025-02-27 10:01:46
知乎热榜,2025-03-01 00:54:44,9,5299826622,黑客为什么不攻击「支付宝」等移动支付工具？,,39 万热度,https://www.zhihu.com/question/5299826622,https://picx.zhimg.com/v2-f19e0e0add10a40489cdb8df576a0f7e_l.jpg?source=57bbeac9,2024-11-27 09:48:45
知乎热榜,2025-03-01 00:54:44,10,29457053,为什么水运比陆运成本低？,水运比陆运成本低的原因是因为单次运量大吗？ 如果相同载重的火车和船（单次运量相同），依然是水运成本低吗？ 未来陆运有没有可能和水运竞争？,36 万热度,https://www.zhihu.com/question/29457053,https://pic2.zhimg.com/80/v2-7b060d235f6e761aa33e27952cee4ad0_720w.png,2015-04-10 11:50:02
知乎热榜,2025-03-01 00:54:44,11,13666582874,特朗普与泽连斯基会面发生争吵，美乌矿产协议暂未签署，这释放了什么信号？,当地时间2月28日，美国总统特朗普与乌克兰总统泽连斯基在白宫举行会谈。会谈过程中，双方在媒体前爆发激烈争吵，泽连斯基提前离开白宫。原计划的联合记者会被取消，美乌矿产协议未能签署。 会谈中，泽连斯基表示，他认为特朗普是站在乌克兰一边的，并希望和特朗普讨论美国能做什么。泽连斯基希望美国继续提供安全援助。他还称，如果没有安全保障，乌克兰不会同意停火。他强调，美国不应该仅仅是讨论开采关键矿产来获利。泽连斯基希望在谈判协议中加入有关战俘交换的内容。 美国总统特朗普表示，俄罗斯总统普京没有违背与他的协议。特朗普称泽连斯基应该“更加感恩”，并指责泽连斯基在“拿第三次世界大战赌博”且他现在“没有牌”。特朗普还说，乌克兰无权命令美国如何看待冲突。 会谈中，特朗普称，目前的美乌矿产协议“非常公平”，这是美国做出的一项重大承诺。他表示，美国本土稀土矿产资源稀缺，而乌克兰却拥有丰富的储量，这些资源将用于支持美国的人工智能和军事武器等领域。 特朗普称，停火协议即将达成。他与俄罗斯总统普京进行了良好的讨论，并表示谈判人员已开始就未来关于俄乌停火协议的细节进行讨论。 就安全保障这一乌方核心诉求，特朗普表示，如果乌克兰再次受到攻击，他们无法指望获得美国保护，美方不想承诺任何具体的安全保障。乌克兰想加入北约的目标“不在谈判桌上”。 会谈中，特朗普还提到了欧洲，称欧洲“在支持乌克兰对抗俄罗斯方面做得远不如美国”，不过泽连斯基就此温和地表达了不同意见。 △会晤提前结束，泽连斯基离开白宫 会谈中，因关键问题分歧巨大，双方激烈争论，会晤提前结束。泽连斯基在离开白宫前并未回应任何记者提问，双方的联合新闻发布会被取消，矿产协议未能签署。 结束会晤后，泽连斯基通过社交媒体向美国、美总统、国会和民众表示感谢。他指出，乌克兰需要公正和持久的和平，乌方正在致力于此。 特朗普在社交媒体平台发布声明称，“如果美国介入，泽连斯基就不准备实现和平，因为他觉得美国的参与让他在谈判中占据了很大的优势泽连斯基在椭圆形办公室不尊重美国，他可以在准备好实现和平时再回来更多资讯请下载央视新闻客户端 当地时间2月27日，据路透社援引Interfax报道，根据航班信息，乌克兰总统泽连斯基27日已抵达美国。稍早前，美国总统特朗普表示，将于当地时间28日上午11点与泽连斯基会面。双方将就开发矿产和稀土协议进行会谈。泽连斯基抵达美国 会谈定在当地时间28日上午11时举行,36 万热度,https://www.zhihu.com/question/13666582874,https://pic4.zhimg.com/v2-f4e22244da7116435ee0f69543e87b0b_1440w.png,2025-02-28 10:21:25
知乎热榜,2025-03-01 00:54:44,12,13515885404,日本米价暴涨 90% 引发民众愤怒，日本米价暴涨原因有哪些？未来趋势会怎么样？,“日本大米涨价尤为明显，”住在日本福冈的陈玲向记者展示了她在网上购买大米的记录，去年11月买的30公斤大米价格是17580日元（约合人民币837元），到今年1月底，同款大米的价格已飙升至19500日元（约合人民币928元）。 数月的米价暴涨，导致日本市面上出现了“有价无市”的情况。一家位于东京的米店老板表示，由于米价总体上涨，他们也不得不上调对外销售的大米价格，当前出售的大米价格已经接近去年同期的两倍，而且销售的大米品种也减半。 中国农业大学经济管理学院教授陈永福向记者表示，“大米价格上涨如此迅猛，在日本大米市场中是很少见到的情形，也是去年大米供求紧张导致的结果。”对于日本大米价格表现异常，有不少市场分析认为，去年夏天日本多地接连遭受台风侵袭，导致不少消费者、批发商竞相囤购大米，进一步推高了米价。此外，受访专家还把矛头指向日本大米种植的“减反”政策。日本米价暴涨90%引发民众愤怒,36 万热度,https://www.zhihu.com/question/13515885404,https://pic1.zhimg.com/80/v2-537a719c6792172d3e5766fe87f7fe2a_1440w.png,2025-02-27 02:37:19
知乎热榜,2025-03-01 00:54:44,13,639051953,雷军或者说小米为什么要去造车？,,35 万热度,https://www.zhihu.com/question/639051953,https://pic3.zhimg.com/50/v2-a355b65c5cc93defc25df61c79b57db8_b.jpg,2024-01-11 06:35:22
知乎热榜,2025-03-01 00:54:44,14,13563800324,《哪吒2》总票房超 140 亿，猫眼预测票房降至 146 亿，后续票房走势如何？能破 150 亿吗？,据猫眼专业版数据，《哪吒之魔童闹海》全球票房（含预售及海外）破140亿，冲击全球票房榜第7！继续加油！《哪吒2》总票房超140亿,34 万热度,https://www.zhihu.com/question/13563800324,https://pica.zhimg.com/80/v2-3e1280922f457e0e43769c49c65cee38_1440w.png,2025-02-27 10:50:21
知乎热榜,2025-03-01 00:54:44,15,13590091024,369 时隔 5 年回应 Karsa「咖哥，我练好了」如何评价他本赛季的酒桶跟纳尔？,[2 张图片],33 万热度,https://www.zhihu.com/question/13590091024,https://picx.zhimg.com/80/v2-a87a78e84f8f6ca064c9e558dc35a30c_1440w.webp?source=1def8aca,2025-02-27 15:44:56
知乎热榜,2025-03-01 00:54:44,16,13574170798,浙江网友举报 15 只「中国瘰螈」被人用鞭炮炸死，中国瘰螈有多珍稀，该事件对动物保护又有何警示？,当事人在视频平台发文后已报警：,32 万热度,https://www.zhihu.com/question/13574170798,https://picx.zhimg.com/80/v2-767a4a855770328e2eeb6b38caedcccd_1440w.webp?source=1def8aca,2025-02-27 12:53:55
知乎热榜,2025-03-01 00:54:44,17,12885275798,中国近代签署的不平等条约，如果平等的话，条约条文会是什么？,从鸦片战争直到新中国成立，中国签署了大量不平等条约。 这些条约中，有百分之多少的条件是在满足外国的合理外交、贸易权益？有多少是在满足他们不合理的权益？有多少是在满足了外国后中国对等交换到了利益？有多少是中国没有拿到应得的利益？ 换句话说，如果当年中外平等，条约应如何签署，条约条文会是什么？哪些权益可以给到外国？哪些权益可以在对等交换什么东西后给到外国？,32 万热度,https://www.zhihu.com/question/12885275798,https://pica.zhimg.com/50/v2-f157a08f0f59ea7dc3774b029dcb8030_b.jpg,2025-02-21 00:54:48
知乎热榜,2025-03-01 00:54:44,18,13548927866,胡兵称在 49 岁时身高又长了 1 厘米，这个年龄还会长个吗？「中年二次发育」有科学依据吗？,"胡兵在个人社交账号上首次公开体检报告。他称,报告数值显示他的身体表征是25岁左右,并表示自己在49岁时还长高了一公分,引发网友热议。胡兵晒体检报告：49岁时身高又长了一厘米",31 万热度,https://www.zhihu.com/question/13548927866,https://pica.zhimg.com/80/v2-14a86d15c2ff1e1114847153fd6cea02_1440w.png,2025-02-27 08:11:19
知乎热榜,2025-03-01 00:54:44,19,12029478727,无量仙翁为啥要剿灭申正道一家？,如果说无量仙翁屠灭陈塘关是为了嫁祸龙族，那为啥要剿灭申公豹的家呢？不可能仅仅是为了炼丹吧？天下妖族那么多，没必要非得对申公豹一家下手吧！申公豹是无量仙翁引荐入门的人才，又当了多年捕妖队长，还给南极仙翁办了好多见不得光的脏事儿。申公豹的战力那么强，而且还没有背叛仙翁，仙翁应该很器重申公豹大加拉拢才是啊！怎么把人家申公豹家给端了？这样做对仙翁有啥好处呢？,31 万热度,https://www.zhihu.com/question/12029478727,https://picx.zhimg.com/80/v2-75d7a36238362ea3b4fccf6df1e1da81_1440w.webp?source=1def8aca,2025-02-12 10:01:06
知乎热榜,2025-03-01 00:54:44,20,13245514219,有哪些书籍你很推荐给身边的女性阅读，能够帮助她们在职业、情感或个人成长方面获得启发？,,31 万热度,https://www.zhihu.com/question/13245514219,https://pica.zhimg.com/80/v2-1e446b2c8e9c1e84c577dbb8c3bd74b2_1440w.webp?source=1def8aca,2025-02-24 12:24:00
知乎热榜,2025-03-01 00:54:44,21,12266975474,《潜伏》中戴笠视察天津时，余则成要是如实汇报站长的所作所为，会有什么后果？,如题，戴笠视察天津扬言要惩治贪腐和处理杨文泉纳妾的事。后面单独会谈之前，站长慌了神请余则成到办公室私聊，特意交代说有两件事，甚至还失态的说拜托了老弟。 倘若余则成在向戴笠汇报时，如实描述站长贪污和指使余则成纳妾，后续会怎么样？戴笠会真像他说得那样要严惩吗？还是高高举起，轻轻放下。毕竟，吴敬中是他的嫡系。,30 万热度,https://www.zhihu.com/question/12266975474,https://pic3.zhimg.com/50/v2-ec1f9e9df2a457f18d836e8f6f800aee_b.jpg,2025-02-14 16:20:24
知乎热榜,2025-03-01 00:54:44,22,13612838866,什么样的燃油车，还能在 2025 年继续赢得市场？,2025 年，中国汽车市场正经历新能源车的快速崛起以及智能驾驶技术的不断进步，燃油车还能继续在市场中立足吗？面对智能座舱、智能驾驶等新技术的挑战，什么样的燃油车能够顺应潮流，实现智能化升级，并继续吸引消费者的关注？是通过提升驾驶体验、优化智能化配置，还是在传统优势上创新突破，燃油车的未来，究竟该如何迎接这场变革并赢得市场的青睐？,30 万热度,https://www.zhihu.com/question/13612838866,https://picx.zhimg.com/50/v2-54c571dfb2534d635822914444240bbf_b.jpg,2025-02-28 01:09:35
知乎热榜,2025-03-01 00:54:44,23,13472390393,为什么人类没有像其它灵长类一样，把昆虫作为主要肉食来源的一种?,在狩猎采集的阶段，昆虫应该是一种可以被接受的食物，为什么这一习惯没有保留下去？ （黑猩猩有采食白蚁的，猴子应该也把昆虫当作一种营养丰富的食物）,30 万热度,https://www.zhihu.com/question/13472390393,https://picx.zhimg.com/80/v2-e5f4e22ee68363c01aa85fedf96d8647_1440w.webp?source=1def8aca,2025-02-26 13:33:59
知乎热榜,2025-03-01 00:54:44,24,13126219022,《哪吒之魔童闹海》彩蛋中鹿童和鹤童暴揍无量仙翁时会是什么心理？,今天带小孩去看了《哪吒2》，最后彩蛋，无量仙翁被自己两个徒弟来回开揍，突然觉得很解压。,30 万热度,https://www.zhihu.com/question/13126219022,https://pic3.zhimg.com/50/v2-7a61553faf53498cf65f6b0f9ea5424e_b.jpg,2025-02-23 09:59:38
知乎热榜,2025-03-01 00:54:44,25,13613171251,工作的时候经常达到「心流」状态，自己很投入很快乐，却被同事说这是有病，劝我不要太沉迷工作，该怎么办？,我就是真的很热爱工作啊，从事广告创意行业，做项目的时候可以不吃不喝不睡保持兴奋状态几十个小时不知疲倦，可能也因此「卷」到了同事，影响到了他们摸鱼？每次沉迷于工作，想要跟同事讨论业务，推进他们进度的时候，总会被同事提醒让我不要太沉迷工作，没有回报，投入产出不成正比，让我周末也不要回老板工作消息，不要看钉钉，我该如何回应？,30 万热度,https://www.zhihu.com/question/13613171251,https://picx.zhimg.com/80/v2-eb33e89d6d27a4f6a9052f7496b01439_1440w.webp?source=1def8aca,2025-02-28 01:13:03
知乎热榜,2025-03-01 00:54:44,26,361662916,为什么泰州发展不起来?,,30 万热度,https://www.zhihu.com/question/361662916,,2019-12-18 08:22:37
知乎热榜,2025-03-01 00:54:44,27,12614126080,请问大家谁知道炒菜放味精好，还是放鸡精好呢？,可以给我一个充分的理由吗？,30 万热度,https://www.zhihu.com/question/12614126080,https://pic1.zhimg.com/50/v2-108e4b95ff75a2fb0e84f36e497bfc88_b.jpg,2025-02-18 08:49:18
知乎热榜,2025-03-01 00:54:44,28,1625285009,《猫猫的奇幻漂流》获奥斯卡最佳动画长片、国际影片两项提名，如何评价这部影片？,来自拉脱维亚的动画导演金兹·兹巴洛迪斯（Gints Zilbalodis）最近常常觉得自己有“冒名顶替综合症”。 就在9个月前，他的第二部电影《猫猫的奇幻漂流》（下文简称《漂流》）还是一部“来自拉脱维亚的小猫电影”，但如今这部电影和它的团队已经在世界各个电影节获得了超过60个奖项，包括第77届戛纳电影节“一种关注”奖项提名，第82届金球奖最佳动画长片，第52届动画安妮奖最佳独立动画长片，以及第97届奥斯卡金像奖最佳国际影片、最佳动画长片两项提名。小猫冲进奥斯卡,30 万热度,https://www.zhihu.com/question/1625285009,https://pic3.zhimg.com/50/v2-d8e4ddab1406e2ab42b61e3afd960fe6_b.jpg,2024-10-21 15:39:00
知乎热榜,2025-03-01 00:54:44,29,13477480325,《太空堡垒》这么一部动画片，为什么会设计这么复杂的爱情故事？,林明梅、瑞克、丽莎三个人的恋爱故事，作为动画片的主要观众，孩子们是很难理解的吧。为什么动画片的创作者会这样来设计情节？ 其他动画片也有这么复杂的爱情设定吗？,29 万热度,https://www.zhihu.com/question/13477480325,https://pic1.zhimg.com/50/v2-21e450e82bd82509468ad30d6d3789c0_b.jpg,2025-02-26 14:28:50
